{"type":"message","id":"d27bcbee","parentId":"05377940","timestamp":"2026-04-27T13:25:51.815Z","message":{"role":"toolResult","toolCallId":"call_function_60em0y6polyi_1","toolName":"read","content":[{"type":"text","text":"            print(msg)\n        print(msg, file=logf, flush=True)\n    \n    def log_metrics(metrics):\n        \"\"\"Log structured metrics.\"\"\"\n        line = \" \".join(f\"{k}={v}\" for k, v in metrics.items())\n        log(line)\n        # Also print for auto-parsing\n        if is_main:\n            for k, v in metrics.items():\n                print(f\"METRIC {k}={v}\", flush=True)\n    \n    log(\"=\" * 60)\n    log(f\"Parameter Golf - T4 Training\")\n    log(f\"Run ID: {args.run_id}\")\n    log(f\"Device: {torch.cuda.get_device_name()} (rank {rank}/{world_size})\")\n    log(f\"PyTorch: {torch.__version__}\")\n    log(\"=\" * 60)\n    \n    # ==========================================================================\n    # DATA\n    # ==========================================================================\n    \n    log(\"[1/6] Downloading data...\")\n    try:\n        data_path, tok_path = download_data(args.data_path, args.vocab_size)\n    except Exception as e:\n        log(f\"ERROR: Data download failed: {e}\")\n        raise\n    \n    # Tokenizer\n    log(\"[2/6] Loading tokenizer...\")\n    sp = spm.SentencePieceProcessor(model_file=tok_path)\n    actual_vocab = int(sp.vocab_size())\n    if actual_vocab != args.vocab_size:\n        log(f\"Warning: vocab mismatch {actual_vocab} vs {args.vocab_size}\")\n        args.vocab_size = actual_vocab\n    \n    # Validation tokens\n    val_tokens = load_shard(os.path.join(data_path, \"fineweb_val_000000.bin\"))\n    base_bytes_lut = build_byte_lut(sp, args.vocab_size, device)\n    log(f\"Val tokens: {val_tokens.numel():,}\")\n    \n    # Training data stream\n    train_stream = TokenStream(os.path.join(data_path, \"fineweb_train_*.bin\"))\n    \n    # ==========================================================================\n    # MODEL\n    # ==========================================================================\n    \n    log(\"[3/6] Building model...\")\n    model = GPT().to(device).to(torch.bfloat16)\n    for m in model.modules():\n        if isinstance(m, CastedLinear):\n            m.float()\n    \n    if world_size > 1:\n        model = DDP(model, device_ids=[local_rank], output_device=local_rank)\n    \n    raw_model = model.module if world_size > 1 else model\n    n_params = sum(p.numel() for p in raw_model.parameters())\n    log(f\"Params: {n_params:,} ({n_params * 2 / 1024 / 1024:.1f} MB bf16)\")\n    \n    # ==========================================================================\n    # OPTIMIZER\n    # ==========================================================================\n    \n    opt = torch.optim.AdamW(\n        raw_model.parameters(),\n        lr=args.matrix_lr,\n        betas=(args.beta1, args.beta2),\n        weight_decay=args.weight_decay,\n        fused=True,\n    )\n    \n    # EMA for model averaging\n    ema_state = {k: v.cpu().clone() for k, v in raw_model.state_dict().items()}\n    \n    # ==========================================================================\n    # TRAINING LOOP\n    # ==========================================================================\n    \n    log(\"[4/6] Training...\")\n    torch.cuda.synchronize()\n    t0 = time.perf_counter()\n    \n    step = 0\n    best_val_bpb = float('inf')\n    best_state = None\n    grad_accum = 0\n    last_val_step = -1\n    last_checkpoint_time = t0\n    train_stream_pos = 0\n    \n    # Resume from checkpoint if exists\n    latest_ckpt = None\n    if os.path.exists(run_dir):\n        ckpts = sorted(glob.glob(os.path.join(run_dir, f\"{_CHECKPOINT_PREFIX}*.pt\")))\n        if ckpts:\n            latest_ckpt = ckpts[-1]\n    \n    if latest_ckpt:\n        log(f\"Resuming from checkpoint: {latest_ckpt}\")\n        resume_step, resume_val_bpb, resume_pos = load_checkpoint(\n            latest_ckpt, raw_model, opt\n        )\n        step = resume_step\n        best_val_bpb = resume_val_bpb\n        train_stream_pos = resume_pos\n        train_stream.seek_tokens(train_stream_pos)\n        log(f\"Resumed from step {step}, val_bpb={best_val_bpb:.4f}\")\n    \n    # Batch function\n    def get_batch():\n        span = args.train_batch_tokens + 1\n        chunk = train_stream.take(span)\n        x = chunk[:-1].reshape(-1, args.train_seq_len).to(device).long()\n        y = chunk[1:].reshape(-1, args.train_seq_len).to(device).long()\n        return x, y\n    \n    # Learning rate schedule\n    def lr_schedule(step):\n        if step < args.warmup_steps:\n            return step / max(args.warmup_steps, 1)\n        warmdown_start = int(args.iterations * (1 - args.warmdown_frac))\n        if step >= warmdown_start:\n            frac = (args.iterations - step) / max(args.iterations - warmdown_start, 1)\n            return max(frac, args.min_lr_ratio)\n        return 1.0\n    \n    while step < args.iterations:\n        elapsed = time.perf_counter() - t0\n        \n        # Checkpoint every N seconds\n        if is_main and (elapsed - last_checkpoint_time) >= _CHECKPOINT_EVERY_SECONDS:\n            if best_state is not None:\n                ckpt_path = save_checkpoint(\n                    step, raw_model, opt, ema_state, best_val_bpb, \n                    train_stream_pos, run_dir\n                )\n                log(f\"[CKPT] Saved: {ckpt_path}\")\n            last_checkpoint_time = time.perf_counter()\n        \n        # Validation\n        if step % args.val_loss_every == 0 and step > 0 and step != last_val_step:\n            last_val_step = step\n            if world_size > 1:\n                dist.barrier()\n            \n            torch.cuda.synchronize()\n            \n            if is_main:\n                model.eval()\n                val_loss_sum = 0.0\n                val_token_count = 0\n                val_limit = min(val_tokens.numel() - 1, args.val_max_tokens)\n                \n                with torch.no_grad():\n                    for i in range(0, val_limit, args.train_seq_len * 4):\n                        x = val_tokens[i:i + args.train_seq_len * 4].to(device).long()\n                        y = val_tokens[i + 1:i + 1 + args.train_seq_len * 4].to(device).long()\n                        with torch.autocast(device_type=\"cuda\", dtype=torch.bfloat16):\n                            loss = raw_model(x, y)\n                        val_loss_sum += loss.item() * x.numel()\n                        val_token_count += x.numel()\n                \n                val_loss = val_loss_sum / val_token_count\n                val_bpb = compute_val_bpb(val_loss, val_tokens[:val_token_count],\n                                          base_bytes_lut, device)\n                \n                # Update EMA\n                current_state = {k: v.cpu().clone() for k, v in raw_model.state_dict().items()}\n                for k in ema_state:\n                    ema_state[k] = args.ema_decay * ema_state[k] + (1 - args.ema_decay) * current_state[k]\n                \n                # Save best\n                if val_bpb < best_val_bpb:\n                    best_val_bpb = val_bpb\n                    best_state = {k: v.cpu().clone() for k, v in raw_model.state_dict().items()}\n                \n                log_metrics({\n                    \"step\": step,\n                    \"val_loss\": f\"{val_loss:.4f}\",\n                    \"val_bpb\": f\"{val_bpb:.4f}\",\n                    \"best_bpb\": f\"{best_val_bpb:.4f}\",\n                    \"elapsed_s\": f\"{elapsed:.0f}\"\n                })\n                \n                # Checkpoint on improvement\n                if val_bpb <= best_val_bpb:\n                    ckpt_path = save_checkpoint(\n                        step, raw_model, opt, ema_state, best_val_bpb,\n                        train_stream_pos, run_dir\n                    )\n                    log(f\"[CKPT] Best checkpoint saved\")\n            \n            model.train()\n            if world_size > 1:\n                dist.barrier()\n        \n        # Training step\n        try:\n            x, y = get_batch()\n            with torch.autocast(device_type=\"cuda\", dtype=torch.bfloat16):\n                loss = raw_model(x, y)\n            \n            # NaN/Inf detection\n            if not torch.isfinite(loss):\n                log(f\"ERROR: Non-finite loss at step {step}: {loss.item()}\")\n                # Save checkpoint before dying\n                if is_main and best_state is not None:\n                    save_checkpoint(step, raw_model, opt, ema_state, best_val_bpb,\n                                   train_stream_pos, run_dir)\n                break\n            \n            loss.backward()\n            grad_accum += 1\n            \n            # Optimizer step\n            if grad_accum >= args.grad_accum_steps:\n                scale = lr_schedule(step)\n                for g in opt.param_groups:\n                    g[\"lr\"] = args.matrix_lr * scale\n                \n                if args.grad_clip_norm > 0:\n                    torch.nn.utils.clip_grad_norm_(raw_model.parameters(), args.grad_clip_norm)\n                \n                opt.step()\n                opt.zero_grad(set_to_none=True)\n                \n                grad_accum = 0\n                step += 1\n                train_stream_pos += args.train_batch_tokens\n        \n        except Exception as e:\n            log(f\"ERROR at step {step}: {e}\")\n            if is_main:\n                save_checkpoint(step, raw_model, opt, ema_state, best_val_bpb,\n                              train_stream_pos, run_dir)\n            raise\n        \n        # Wallclock limit\n        if elapsed >= args.max_wallclock_seconds:\n            log(f\"Wallclock limit reached at step {step}\")\n            break\n        \n        # Progress logging\n        if step <= 10 or step % 100 == 0:\n            log(f\"step:{step}/{args.iterations} train_loss:{loss.item():.4f} time:{elapsed:.0f}s\")\n    \n    log(f\"[4/6] Training complete. Best val_bpb: {best_val_bpb:.4f}\")\n    \n    if world_size > 1:\n        dist.barrier()\n    \n    # ==========================================================================\n    # SAVE\n    # ==========================================================================\n    \n    if not is_main:\n        logf.close()\n        if world_size > 1:\n            dist.destroy_process_group()\n        return\n    \n    log(\"[5/6] Saving final model...\")\n    \n    if best_state is None:\n        best_state = {k: v.cpu().clone() for k, v in raw_model.state_dict().items()}\n    \n    torch.save(best_state, os.path.join(run_dir, \"best_model.pt\"))\n    \n    # Quantize and compress\n    quant = quantize_state_dict(best_state)\n    buf = io.BytesIO()\n    torch.save(quant, buf)\n    \n    import brotli\n    compressed = brotli.compress(buf.getvalue(), quality=11)\n    \n    code_size = len(open(__file__).read().encode())\n    total_size = len(compressed) + code_size\n    \n    log(f\"Compressed artifact: {len(compressed):,} bytes\")\n    log(f\"Code size: {code_size:,} bytes\")\n    log(f\"Total: {total_size:,} bytes (limit: 16,000,000)\")\n    \n    with open(os.path.join(run_dir, \"best_model.int8.br\"), \"wb\") as f:\n        f.write(compressed)\n    \n    # ==========================================================================\n    # TTT\n    # ==========================================================================\n    \n    if args.ttt_enabled:\n        log(\"[6/6] Running TTT...\")\n        raw_model.load_state_dict(best_state)\n        raw_model = run_ttt(raw_model, val_tokens, base_bytes_lut, device, args, log)\n        \n        # Save TTT model\n        ttt_state = {k: v.cpu() for k, v in raw_model.state_dict().items()}\n        torch.save(ttt_state, os.path.join(run_dir, \"best_model_ttt.pt\"))\n    \n    log(\"=\" * 60)\n    log(\"DONE\")\n    log(\"=\" * 60)\n    \n    log_metrics({\n        \"final_val_bpb\": f\"{best_val_bpb:.4f}\",\n        \"total_steps\": step,\n        \"total_time_s\": f\"{time.perf_counter() - t0:.0f}\",\n        \"artifact_bytes\": len(compressed),\n        \"code_bytes\": code_size,\n        \"total_bytes\": total_size\n    })\n    \n    logf.close()\n    if world_size > 1:\n        dist.destroy_process_group()\n\n\nif __name__ == \"__main__\":\n    # Signal handling for graceful shutdown\n    def handle_signal(signum, frame):\n        print(\"Received signal, saving checkpoint...\")\n        sys.exit(0)\n    \n    signal.signal(signal.SIGTERM, handle_signal)\n    signal.signal(signal.SIGINT, handle_signal)\n    \n    # Launch DDP if multiple GPUs\n    if (\n        os.environ.get(\"USE_DDP\", \"1\") == \"1\"\n        and \"LOCAL_RANK\" not in os.environ\n        and torch.cuda.is_available()\n        and torch.cuda.device_count() > 1\n    ):\n        cmd = [\n            sys.executable, \"-m\", \"torch.distributed.run\",\n            \"--standalone\", f\"--nproc_per_node={torch.cuda.device_count()}\",\n            __file__,\n        ]\n        os.execvp(cmd[0], cmd)\n    \n    train()"}],"isError":false,"timestamp":1777296351815}}
{"type":"message","id":"8d64a5e3","parentId":"d27bcbee","timestamp":"2026-04-27T13:26:03.250Z","message":{"role":"assistant","content":[{"type":"thinking","thinking":"Now I understand the full architecture. I need to implement:\n\n1. **SP8192 (Sequence Parallelism)** - Currently seq_len is 512, need to make it work with 8192\n2. **Parallel Residuals** - Currently uses sequential attention + MLP, need parallel branches\n3. **SmearGate** - A gating mechanism\n\nLet me implement these changes. The user wants conservative settings:\n- TRAIN_SEQ_LEN=8192\n- TRAIN_BATCH_TOKENS=4096\n- GRAD_ACCUM_STEPS=2\n- ITERATIONS=2000\n\nLet me now write the modified training script with these changes. I'll need to:\n\n1. Update the hyperparameters to support seq_len=8192\n2. Implement parallel residuals (attention and MLP branches in parallel)\n3. Implement SmearGate (some gating mechanism)\n\nFor SP8192 on a single T4:\n- Sequence parallelism splits the sequence across GPUs\n- On single GPU, we can simulate this but won't get the memory benefit\n- For memory efficiency with seq_len=8192, we need to be careful\n\nFor parallel residuals:\n- Instead of: x = x + attn(x) + mlp(x)\n- Do: x = x + parallel(attn(x), mlp(x))\n\nFor SmearGate:\n- This typically refers to a mechanism that \"smears\" or gates information across layers\n- Could be a cross-layer gating or some form of attention between layers\n\nLet me implement these carefully:","thinkingSignature":"24c0564ab49df695bda423a43801af970c82da453497cb7c46ab303523a8afd4"},{"type":"text","text":"Now I'll implement the 3 changes. Let me create the updated training script:\n"},{"type":"toolCall","id":"call_function_p2x6e0mgtvxy_1","name":"read","arguments":{"path":"/Users/dhruv2mars/dev/github/parameter-golf/train_kaggle.py","offset":260,"limit":150}}],"api":"anthropic-messages","provider":"minimax","model":"MiniMax-M2.7","usage":{"input":38280,"output":387,"cacheRead":9199,"cacheWrite":0,"totalTokens":47866,"cost":{"input":0.011484,"output":0.00046439999999999996,"cacheRead":0.00055194,"cacheWrite":0,"total":0.01250034}},"stopReason":"toolUse","timestamp":1777296351816,"responseId":"063e96df3fe893bbb840237c247dde14"}}
{"type":"message","id":"4983b154","parentId":"8d64a5e3","timestamp":"2026-04-27T13:26:03.270Z","message":{"role":"toolResult","toolCallId":"call_function_p2x6e0mgtvxy_1","toolName":"read","content":[{"type":"text","text":"        super().__init__()\n        self.scale = nn.Parameter(torch.ones(dim))\n    \n    def forward(self, x):\n        return self.scale * F.rms_norm(x, (x.size(-1),))\n\n\nclass CastedLinear(nn.Linear):\n    \"\"\"Linear that casts weights to match input dtype.\"\"\"\n    def forward(self, x):\n        return F.linear(x, self.weight.to(dtype=x.dtype), \n                        self.bias.to(dtype=x.dtype) if self.bias is not None else None)\n\n\nclass Rotary(nn.Module):\n    \"\"\"Rotary Position Embedding (RoPE).\"\"\"\n    def __init__(self, dim, base=10000.0, rope_dims=0):\n        super().__init__()\n        self.rope_dims = rope_dims if rope_dims > 0 else dim\n        inv_freq = 1.0 / (base ** (torch.arange(0, self.rope_dims, 2) / self.rope_dims))\n        self.register_buffer(\"inv_freq\", inv_freq, persistent=False)\n        self._cos = None\n        self._sin = None\n    \n    def forward(self, seq_len, device, dtype):\n        if self._cos is None or self._sin is None or self._cos.size(-2) != seq_len:\n            t = torch.arange(seq_len, device=device, dtype=self.inv_freq.dtype)\n            freqs = torch.outer(t, self.inv_freq.to(device))\n            self._cos = freqs.cos()[None, None, :, :]\n            self._sin = freqs.sin()[None, None, :, :]\n        return self._cos.to(dtype), self._sin.to(dtype)\n\n\ndef apply_rope(x, cos, sin, rope_dims=0):\n    \"\"\"Apply rotary embedding to query/key tensors.\"\"\"\n    if rope_dims > 0 and rope_dims < x.size(-1):\n        x_rope, x_pass = x[..., :rope_dims], x[..., rope_dims:]\n        half = rope_dims // 2\n        x1, x2 = x_rope[..., :half], x_rope[..., half:]\n        rotated = torch.cat((x1*cos + x2*sin, x1*(-sin) + x2*cos), -1)\n        return torch.cat((rotated, x_pass), -1)\n    half = x.size(-1) // 2\n    x1, x2 = x[..., :half], x[..., half:]\n    return torch.cat((x1*cos + x2*sin, x1*(-sin) + x2*cos), -1)\n\n\nclass Attention(nn.Module):\n    def __init__(self, dim, num_heads, num_kv_heads, rope_base, qk_gain_init, rope_dims=0):\n        super().__init__()\n        self.num_heads = num_heads\n        self.num_kv_heads = num_kv_heads\n        self.head_dim = dim // num_heads\n        self.rope_dims = rope_dims\n        kv_dim = num_kv_heads * self.head_dim\n        \n        self.q_proj = CastedLinear(dim, dim)\n        self.k_proj = CastedLinear(dim, kv_dim)\n        self.v_proj = CastedLinear(dim, kv_dim)\n        self.o_proj = CastedLinear(dim, dim)\n        \n        self.rotary = Rotary(self.head_dim, base=rope_base, rope_dims=rope_dims)\n        self.q_gain = nn.Parameter(torch.full((num_heads,), qk_gain_init, dtype=torch.float32))\n    \n    def forward(self, x):\n        b, s, d = x.shape\n        \n        q = self.q_proj(x).view(b, s, self.num_heads, self.head_dim).transpose(1, 2)\n        k = self.k_proj(x).view(b, s, self.num_kv_heads, self.head_dim).transpose(1, 2)\n        v = self.v_proj(x).view(b, s, self.num_kv_heads, self.head_dim).transpose(1, 2)\n        \n        # RMSNorm before QK projection (proven improvement)\n        q = F.rms_norm(q, (q.size(-1),))\n        k = F.rms_norm(k, (k.size(-1),))\n        \n        # Apply RoPE\n        cos, sin = self.rotary(s, x.device, q.dtype)\n        q = apply_rope(q, cos, sin, self.rope_dims)\n        k = apply_rope(k, cos, sin, self.rope_dims)\n        \n        # QK-Gain (learnable per-head scaling)\n        q = q * self.q_gain.view(1, -1, 1, 1).to(dtype=q.dtype)\n        \n        # KV replication for GQA\n        if self.num_kv_heads < self.num_heads:\n            repeat = self.num_heads // self.num_kv_heads\n            k = k.repeat_interleave(repeat, dim=1)\n            v = v.repeat_interleave(repeat, dim=1)\n        \n        # Attention\n        scale = self.head_dim ** -0.5\n        attn = torch.matmul(q * scale, k.transpose(-2, -1))\n        causal = torch.triu(torch.ones(s, s, device=x.device, dtype=torch.bool), 1)\n        attn = attn.masked_fill(causal, float(\"-inf\"))\n        attn = F.softmax(attn, dim=-1).to(q.dtype)\n        out = torch.matmul(attn, v).transpose(1, 2).contiguous().view(b, s, d)\n        return self.o_proj(out)\n\n\nclass MLP(nn.Module):\n    \"\"\"MLP with squared LeakyReLU activation.\"\"\"\n    def __init__(self, dim, mult=4):\n        super().__init__()\n        self.fc = CastedLinear(dim, mult * dim)\n        self.proj = CastedLinear(mult * dim, dim)\n    \n    def forward(self, x):\n        return self.proj(F.leaky_relu(self.fc(x), negative_slope=0.5).square())\n\n\nclass Block(nn.Module):\n    \"\"\"Transformer block with pre-norm and learned residuals.\"\"\"\n    def __init__(self, dim, num_heads, num_kv_heads, mlp_mult, rope_base, \n                 qk_gain_init, layer_idx, rope_dims=0):\n        super().__init__()\n        self.layer_idx = layer_idx\n        \n        self.attn_norm = RMSNorm(dim)\n        self.mlp_norm = RMSNorm(dim)\n        \n        self.attn = Attention(dim, num_heads, num_kv_heads, rope_base, qk_gain_init, rope_dims)\n        self.mlp = MLP(dim, mlp_mult)\n        \n        # Learned residual scaling (proven improvement)\n        self.attn_scale = nn.Parameter(torch.ones(dim))\n        self.mlp_scale = nn.Parameter(torch.ones(dim))\n        self.resid_mix = nn.Parameter(torch.stack((\n            torch.ones(dim), torch.zeros(dim)\n        )).float())\n        \n        # Layer scaling (deeper layers slightly smaller)\n        self.ln_scale = 1.0 / math.sqrt(layer_idx + 1)\n    \n    def forward(self, x, x0):\n        dtype = x.dtype\n        mix = self.resid_mix.to(dtype=dtype)\n        \n        # Residual mix: combine current and original residual\n        x_in = mix[0][None, None, :] * x + mix[1][None, None, :] * x0\n        \n        # Attention block\n        x = x_in + self.attn_scale.to(dtype=dtype)[None, None, :] * \\\n            self.attn(self.attn_norm(x_in) * self.ln_scale)\n        \n        # MLP block\n        x = x + self.mlp_scale.to(dtype=dtype)[None, None, :] * \\\n            self.mlp(self.mlp_norm(x) * self.ln_scale)\n        \n        return x\n\n\n\n[636 more lines in file. Use offset=410 to continue.]"}],"isError":false,"timestamp":1777296363270}}
