{"type":"message","id":"8f3dd03c","parentId":"af486de0","timestamp":"2026-04-25T19:47:27.318Z","message":{"role":"toolResult","toolCallId":"call_function_uua8b3rq4zc1_1","toolName":"bash","content":[{"type":"text","text":",{\"stream_name\":\"stdout\",\"time\":1819.620094257,\"data\":\"METRIC val_loss=5.1424\\n\"}\n,{\"stream_name\":\"stdout\",\"time\":1819.620098859,\"data\":\"METRIC val_bpb=2.3857\\n\"}\n,{\"stream_name\":\"stdout\",\"time\":1819.620103389,\"data\":\"METRIC best_bpb=2.3857\\n\"}\n,{\"stream_name\":\"stdout\",\"time\":1819.620108254,\"data\":\"METRIC elapsed_s=1783\\n\"}\n,{\"stream_name\":\"stdout\",\"time\":1820.292459576,\"data\":\"[CKPT] Best checkpoint saved\\n\"}\n,{\"stream_name\":\"stdout\",\"time\":1825.955876478,\"data\":\"Wallclock limit reached at step 1255\\n\"}\n,{\"stream_name\":\"stdout\",\"time\":1825.955904848,\"data\":\"[4/6] Training complete. Best val_bpb: 2.3857\\n\"}\n,{\"stream_name\":\"stdout\",\"time\":1826.226320605,\"data\":\"[5/6] Saving final model...\\n\"}\n,{\"stream_name\":\"stdout\",\"time\":1898.843519566,\"data\":\"Compressed artifact: 12,310,292 bytes\\n\"}\n,{\"stream_name\":\"stdout\",\"time\":1898.843555303,\"data\":\"Code size: 38,899 bytes\\n\"}\n,{\"stream_name\":\"stdout\",\"time\":1898.843562107,\"data\":\"Total: 12,349,191 bytes (limit: 16,000,000)\\n\"}\n,{\"stream_name\":\"stdout\",\"time\":1898.850118973,\"data\":\"[6/6] Running TTT...\\n\"}\n,{\"stream_name\":\"stdout\",\"time\":1898.89218163,\"data\":\"[TTT] Starting Test-Time Training...\\n\"}\n,{\"stream_name\":\"stderr\",\"time\":1901.523143237,\"data\":\"[rank0]: Traceback (most recent call last):\\n\"}\n,{\"stream_name\":\"stderr\",\"time\":1901.523188595,\"data\":\"[rank0]:   File \\\"/kaggle/src/script.py\\\", line 1054, in \\u003cmodule\\u003e\\n\"}\n,{\"stream_name\":\"stderr\",\"time\":1901.523194894,\"data\":\"[rank0]:     train()\\n\"}\n,{\"stream_name\":\"stderr\",\"time\":1901.523198627,\"data\":\"[rank0]:   File \\\"/kaggle/src/script.py\\\", line 1007, in train\\n\"}\n,{\"stream_name\":\"stderr\",\"time\":1901.523202506,\"data\":\"[rank0]:     raw_model = run_ttt(raw_model, val_tokens, base_bytes_lut, device, args, log)\\n\"}\n,{\"stream_name\":\"stderr\",\"time\":1901.523206454,\"data\":\"[rank0]:                 ^^^^^^^^^^^^^^^^^^^^^^^^^^^^^^^^^^^^^^^^^^^^^^^^^^^^^^^^^^^^^^^^^\\n\"}\n,{\"stream_name\":\"stderr\",\"time\":1901.523210531,\"data\":\"[rank0]:   File \\\"/kaggle/src/script.py\\\", line 629, in run_ttt\\n\"}\n,{\"stream_name\":\"stderr\",\"time\":1901.523214162,\"data\":\"[rank0]:     _ = model(x, y)\\n\"}\n,{\"stream_name\":\"stderr\",\"time\":1901.523218018,\"data\":\"[rank0]:         ^^^^^^^^^^^\\n\"}\n,{\"stream_name\":\"stderr\",\"time\":1901.523222562,\"data\":\"[rank0]:   File \\\"/usr/local/lib/python3.12/dist-packages/torch/nn/modules/module.py\\\", line 1776, in _wrapped_call_impl\\n\"}\n,{\"stream_name\":\"stderr\",\"time\":1901.523226058,\"data\":\"[rank0]:     return self._call_impl(*args, **kwargs)\\n\"}\n,{\"stream_name\":\"stderr\",\"time\":1901.523230063,\"data\":\"[rank0]:            ^^^^^^^^^^^^^^^^^^^^^^^^^^^^^^^^\\n\"}\n,{\"stream_name\":\"stderr\",\"time\":1901.52323385,\"data\":\"[rank0]:   File \\\"/usr/local/lib/python3.12/dist-packages/torch/nn/modules/module.py\\\", line 1787, in _call_impl\\n\"}\n,{\"stream_name\":\"stderr\",\"time\":1901.5232380530001,\"data\":\"[rank0]:     return forward_call(*args, **kwargs)\\n\"}\n,{\"stream_name\":\"stderr\",\"time\":1901.523241233,\"data\":\"[rank0]:            ^^^^^^^^^^^^^^^^^^^^^^^^^^^^^\\n\"}\n,{\"stream_name\":\"stderr\",\"time\":1901.523244704,\"data\":\"[rank0]:   File \\\"/kaggle/src/script.py\\\", line 458, in forward\\n\"}\n,{\"stream_name\":\"stderr\",\"time\":1901.523248079,\"data\":\"[rank0]:     x = block(x, x0)\\n\"}\n,{\"stream_name\":\"stderr\",\"time\":1901.523251479,\"data\":\"[rank0]:         ^^^^^^^^^^^^\\n\"}\n,{\"stream_name\":\"stderr\",\"time\":1901.523255344,\"data\":\"[rank0]:   File \\\"/usr/local/lib/python3.12/dist-packages/torch/nn/modules/module.py\\\", line 1776, in _wrapped_call_impl\\n\"}\n,{\"stream_name\":\"stderr\",\"time\":1901.523259301,\"data\":\"[rank0]:     return self._call_impl(*args, **kwargs)\\n\"}\n,{\"stream_name\":\"stderr\",\"time\":1901.523263221,\"data\":\"[rank0]:            ^^^^^^^^^^^^^^^^^^^^^^^^^^^^^^^^\\n\"}\n,{\"stream_name\":\"stderr\",\"time\":1901.523267186,\"data\":\"[rank0]:   File \\\"/usr/local/lib/python3.12/dist-packages/torch/nn/modules/module.py\\\", line 1787, in _call_impl\\n\"}\n,{\"stream_name\":\"stderr\",\"time\":1901.523271404,\"data\":\"[rank0]:     return forward_call(*args, **kwargs)\\n\"}\n,{\"stream_name\":\"stderr\",\"time\":1901.523275223,\"data\":\"[rank0]:            ^^^^^^^^^^^^^^^^^^^^^^^^^^^^^\\n\"}\n,{\"stream_name\":\"stderr\",\"time\":1901.523278694,\"data\":\"[rank0]:   File \\\"/kaggle/src/script.py\\\", line 410, in forward\\n\"}\n,{\"stream_name\":\"stderr\",\"time\":1901.523282321,\"data\":\"[rank0]:     self.attn(self.attn_norm(x_in) * self.ln_scale)\\n\"}\n,{\"stream_name\":\"stderr\",\"time\":1901.523285677,\"data\":\"[rank0]:   File \\\"/usr/local/lib/python3.12/dist-packages/torch/nn/modules/module.py\\\", line 1776, in _wrapped_call_impl\\n\"}\n,{\"stream_name\":\"stderr\",\"time\":1901.523289441,\"data\":\"[rank0]:     return self._call_impl(*args, **kwargs)\\n\"}\n,{\"stream_name\":\"stderr\",\"time\":1901.523292723,\"data\":\"[rank0]:            ^^^^^^^^^^^^^^^^^^^^^^^^^^^^^^^^\\n\"}\n,{\"stream_name\":\"stderr\",\"time\":1901.523296119,\"data\":\"[rank0]:   File \\\"/usr/local/lib/python3.12/dist-packages/torch/nn/modules/module.py\\\", line 1787, in _call_impl\\n\"}\n,{\"stream_name\":\"stderr\",\"time\":1901.523299688,\"data\":\"[rank0]:     return forward_call(*args, **kwargs)\\n\"}\n,{\"stream_name\":\"stderr\",\"time\":1901.523307377,\"data\":\"[rank0]:            ^^^^^^^^^^^^^^^^^^^^^^^^^^^^^\\n\"}\n,{\"stream_name\":\"stderr\",\"time\":1901.523312408,\"data\":\"[rank0]:   File \\\"/kaggle/src/script.py\\\", line 335, in forward\\n\"}\n,{\"stream_name\":\"stderr\",\"time\":1901.523316225,\"data\":\"[rank0]:     q = self.q_proj(x).view(b, s, self.num_heads, self.head_dim).transpose(1, 2)\\n\"}\n,{\"stream_name\":\"stderr\",\"time\":1901.523319712,\"data\":\"[rank0]:         ^^^^^^^^^^^^^^\\n\"}\n,{\"stream_name\":\"stderr\",\"time\":1901.523323061,\"data\":\"[rank0]:   File \\\"/usr/local/lib/python3.12/dist-packages/torch/nn/modules/module.py\\\", line 1776, in _wrapped_call_impl\\n\"}\n,{\"stream_name\":\"stderr\",\"time\":1901.52332674,\"data\":\"[rank0]:     return self._call_impl(*args, **kwargs)\\n\"}\n,{\"stream_name\":\"stderr\",\"time\":1901.523329909,\"data\":\"[rank0]:            ^^^^^^^^^^^^^^^^^^^^^^^^^^^^^^^^\\n\"}\n,{\"stream_name\":\"stderr\",\"time\":1901.523333088,\"data\":\"[rank0]:   File \\\"/usr/local/lib/python3.12/dist-packages/torch/nn/modules/module.py\\\", line 1787, in _call_impl\\n\"}\n,{\"stream_name\":\"stderr\",\"time\":1901.523337064,\"data\":\"[rank0]:     return forward_call(*args, **kwargs)\\n\"}\n,{\"stream_name\":\"stderr\",\"time\":1901.523340466,\"data\":\"[rank0]:            ^^^^^^^^^^^^^^^^^^^^^^^^^^^^^\\n\"}\n,{\"stream_name\":\"stderr\",\"time\":1901.523343944,\"data\":\"[rank0]:   File \\\"/kaggle/src/script.py\\\", line 279, in forward\\n\"}\n,{\"stream_name\":\"stderr\",\"time\":1901.523347969,\"data\":\"[rank0]:     return F.linear(x, self.weight.float(), \\n\"}\n,{\"stream_name\":\"stderr\",\"time\":1901.523352007,\"data\":\"[rank0]:            ^^^^^^^^^^^^^^^^^^^^^^^^^^^^^^^^\\n\"}\n,{\"stream_name\":\"stderr\",\"time\":1901.523355761,\"data\":\"[rank0]: RuntimeError: mat1 and mat2 must have the same dtype, but got BFloat16 and Float\\n\"}\n,{\"stream_name\":\"stderr\",\"time\":1901.874901535,\"data\":\"[rank0]:[W425 19:42:16.292778827 ProcessGroupNCCL.cpp:1553] Warning: WARNING: destroy_process_group() was not called before program exit, which can leak resources. For more info, please see https://pytorch.org/docs/stable/distributed.html#shutdown (function operator())\\n\"}\n,{\"stream_name\":\"stderr\",\"time\":1903.921762955,\"data\":\"E0425 19:42:18.842000 7 torch/distributed/elastic/multiprocessing/api.py:984] failed (exitcode: 1) local_rank: 0 (pid: 27) of binary: /usr/bin/python3\\n\"}\n,{\"stream_name\":\"stderr\",\"time\":1903.946390002,\"data\":\"Traceback (most recent call last):\\n\"}\n,{\"stream_name\":\"stderr\",\"time\":1903.946411957,\"data\":\"  File \\\"\\u003cfrozen runpy\\u003e\\\", line 198, in _run_module_as_main\\n\"}\n,{\"stream_name\":\"stderr\",\"time\":1903.946418078,\"data\":\"  File \\\"\\u003cfrozen runpy\\u003e\\\", line 88, in _run_code\\n\"}\n,{\"stream_name\":\"stderr\",\"time\":1903.946423122,\"data\":\"  File \\\"/usr/local/lib/python3.12/dist-packages/torch/distributed/run.py\\\", line 995, in \\u003cmodule\\u003e\\n\"}\n,{\"stream_name\":\"stderr\",\"time\":1903.946834384,\"data\":\"    main()\\n\"}\n,{\"stream_name\":\"stderr\",\"time\":1903.946843382,\"data\":\"  File \\\"/usr/local/lib/python3.12/dist-packages/torch/distributed/elastic/multiprocessing/errors/__init__.py\\\", line 362, in wrapper\\n\"}\n,{\"stream_name\":\"stderr\",\"time\":1903.947098245,\"data\":\"    return f(*args, **kwargs)\\n\"}\n,{\"stream_name\":\"stderr\",\"time\":1903.947110933,\"data\":\"           ^^^^^^^^^^^^^^^^^^\\n\"}\n,{\"stream_name\":\"stderr\",\"time\":1903.947115096,\"data\":\"  File \\\"/usr/local/lib/python3.12/dist-packages/torch/distributed/run.py\\\", line 991, in main\\n\"}\n,{\"stream_name\":\"stderr\",\"time\":1903.947634282,\"data\":\"    run(args)\\n\"}\n,{\"stream_name\":\"stderr\",\"time\":1903.947652244,\"data\":\"  File \\\"/usr/local/lib/python3.12/dist-packages/torch/distributed/run.py\\\", line 982, in run\\n\"}\n,{\"stream_name\":\"stderr\",\"time\":1903.948005585,\"data\":\"    elastic_launch(\\n\"}\n,{\"stream_name\":\"stderr\",\"time\":1903.948019155,\"data\":\"  File \\\"/usr/local/lib/python3.12/dist-packages/torch/distributed/launcher/api.py\\\", line 170, in __call__\\n\"}\n,{\"stream_name\":\"stderr\",\"time\":1903.948163186,\"data\":\"    return launch_agent(self._config, self._entrypoint, list(args))\\n\"}\n,{\"stream_name\":\"stderr\",\"time\":1903.948205327,\"data\":\"           ^^^^^^^^^^^^^^^^^^^^^^^^^^^^^^^^^^^^^^^^^^^^^^^^^^^^^^^^\\n\"}\n,{\"stream_name\":\"stderr\",\"time\":1903.948210468,\"data\":\"  File \\\"/usr/local/lib/python3.12/dist-packages/torch/distributed/launcher/api.py\\\", line 317, in launch_agent\\n\"}\n,{\"stream_name\":\"stderr\",\"time\":1903.948393029,\"data\":\"    raise ChildFailedError(\\n\"}\n,{\"stream_name\":\"stderr\",\"time\":1903.948399098,\"data\":\"torch.distributed.elastic.multiprocessing.errors.ChildFailedError: \\n\"}\n,{\"stream_name\":\"stderr\",\"time\":1903.948402786,\"data\":\"============================================================\\n\"}\n,{\"stream_name\":\"stderr\",\"time\":1903.948406285,\"data\":\"/kaggle/src/script.py FAILED\\n\"}\n,{\"stream_name\":\"stderr\",\"time\":1903.948409609,\"data\":\"------------------------------------------------------------\\n\"}\n,{\"stream_name\":\"stderr\",\"time\":1903.948412992,\"data\":\"Failures:\\n\"}\n,{\"stream_name\":\"stderr\",\"time\":1903.948416281,\"data\":\"  \\u003cNO_OTHER_FAILURES\\u003e\\n\"}\n,{\"stream_name\":\"stderr\",\"time\":1903.948420054,\"data\":\"------------------------------------------------------------\\n\"}\n,{\"stream_name\":\"stderr\",\"time\":1903.948423541,\"data\":\"Root Cause (first observed failure):\\n\"}\n,{\"stream_name\":\"stderr\",\"time\":1903.94842689,\"data\":\"[0]:\\n\"}\n,{\"stream_name\":\"stderr\",\"time\":1903.948430099,\"data\":\"  time      : 2026-04-25_19:42:18\\n\"}\n,{\"stream_name\":\"stderr\",\"time\":1903.948433401,\"data\":\"  host      : fec34c9af127\\n\"}\n,{\"stream_name\":\"stderr\",\"time\":1903.948436755,\"data\":\"  rank      : 0 (local_rank: 0)\\n\"}\n,{\"stream_name\":\"stderr\",\"time\":1903.948440012,\"data\":\"  exitcode  : 1 (pid: 27)\\n\"}\n,{\"stream_name\":\"stderr\",\"time\":1903.948443295,\"data\":\"  error_file: \\u003cN/A\\u003e\\n\"}\n,{\"stream_name\":\"stderr\",\"time\":1903.948448786,\"data\":\"  traceback : To enable traceback see: https://pytorch.org/docs/stable/elastic/errors.html\\n\"}\n,{\"stream_name\":\"stderr\",\"time\":1903.94845567,\"data\":\"============================================================\\n\"}\n,{\"stream_name\":\"stderr\",\"time\":1906.270935581,\"data\":\"/usr/local/lib/python3.12/dist-packages/mistune.py:435: SyntaxWarning: invalid escape sequence '\\\\|'\\n\"}\n,{\"stream_name\":\"stderr\",\"time\":1906.270968268,\"data\":\"  cells[i][c] = re.sub('\\\\\\\\\\\\\\\\\\\\|', '|', cell)\\n\"}\n,{\"stream_name\":\"stderr\",\"time\":1906.496424601,\"data\":\"/usr/local/lib/python3.12/dist-packages/nbconvert/filters/filter_links.py:36: SyntaxWarning: invalid escape sequence '\\\\_'\\n\"}\n,{\"stream_name\":\"stderr\",\"time\":1906.496450454,\"data\":\"  text = re.sub(r'_', '\\\\_', text) # Escape underscores in display text\\n\"}\n,{\"stream_name\":\"stderr\",\"time\":1907.115768535,\"data\":\"[NbConvertApp] Converting notebook __script__.ipynb to html\\n\"}\n,{\"stream_name\":\"stderr\",\"time\":1908.416307937,\"data\":\"[NbConvertApp] Writing 473344 bytes to __results__.html\\n\"}\n]"}],"isError":false,"timestamp":1777146447317}}
{"type":"message","id":"f65f9018","parentId":"8f3dd03c","timestamp":"2026-04-25T19:47:38.123Z","message":{"role":"assistant","content":[{"type":"thinking","thinking":"Found the TTT bug: `RuntimeError: mat1 and mat2 must have the same dtype, but got BFloat16 and Float`\n\nThe issue is in `run_ttt`:```python\nwith torch.no_grad():\n    _ = model(x, y)\n```The model is in bf16, but x/y are long (int64). Let me check the actual error more carefully...\n\nLooking at the traceback:```\nx = block(x, x0)  → self.attn(self.attn_norm(x_in) * self.ln_scale)  → return F.linear(x, self.weight.float(), ...)```Wait, the error says the CastedLinear is calling `self.weight.float()`. \n\nI see the problem now - the first forward pass with `torch.no_grad()` isn't actually using the autocast context, so when the model runs in float32 mode, the weight casting works fine, but the second forward pass with autocast enabled is trying to run bf16 computations through a CastedLinear that's forcing everything to float32, which causes the dtype mismatch. at the code more carefully. `model(x, y)` calls `forward()` which returns `F.cross_entropy(...)` when target is provided. This is a float loss, so bf16/float mixing isn't the issue there.\n\nWait, looking at the actual error: `self.weight.float()` is being called in CastedLinear, but then `F.linear(x, self.weight.float(), ...)` with x being bf16. The CastedLinear.forward() casts weights to float32, but when x is bf16 and weight is float32, the matmul should broadcast... unless there's a dtype mismatch somewhere.\n\nActually, I think the real issue is that in TTT, the model goes through `run_ttt()` which loads the state dict into the model and then calls `model.eval()`, but somewhere in that process the weights get converted to bf16 while the inputs remain bf16, causing the mismatch when CastedLinear tries to cast them again. I see the issue now—`CastLinear` is casting weights to float32 in the forward pass, but when autocast is enabled with bf16, there's a dtype mismatch because x arrives as bf16 while the weight is explicitly cast to float32. The fix is to remove the explicit float32 casting so the weight uses whatever dtype the autocast context provides, or ensure both x and weight stay in the same dtype throughout the operation. Looking at the stack trace more carefully, the actual error occurs inside the model's `forward()` method when calling `CastedLinear` with bf16 input and float weights. The issue is that `CastLinear.forward()` casts weights to float32, but when autocast is enabled with bf16, `F.linear()` needs both inputs in matching dtypes—so bf16 and float32 causes the mismatch.\n\nThe solution is to update `CastedLinear` to cast weights to bf16 instead of float32, or ensure weights are cast to match the autocast context properly.\n","thinkingSignature":"4d30e975da10ee5435a065a84f2f0e1c994ba88d8af71edb3c256c7dd1817cd4"},{"type":"toolCall","id":"call_function_jocn1a7n0bwp_1","name":"log_experiment","arguments":{"asi":{"error":"mat1 mat2 dtype mismatch bf16 vs float","fix_needed":"CastedLinear cast weights to match autocast dtype","ttt_broken":true},"commit":"a672845","description":"TTT crashed: dtype mismatch in CastedLinear (bf16/float32)","metric":2.3857,"status":"discard"}}],"api":"anthropic-messages","provider":"minimax","model":"MiniMax-M2.7","usage":{"input":3774,"output":736,"cacheRead":43584,"cacheWrite":0,"totalTokens":48094,"cost":{"input":0.0011321999999999999,"output":0.0008832,"cacheRead":0.00261504,"cacheWrite":0,"total":0.0046304399999999996}},"stopReason":"toolUse","timestamp":1777146447321,"responseId":"063c4d50b4a52b0673b61f8be9a9b51b"}}
{"type":"message","id":"4960c4be","parentId":"f65f9018","timestamp":"2026-04-25T19:47:38.132Z","message":{"role":"toolResult","toolCallId":"call_function_jocn1a7n0bwp_1","toolName":"log_experiment","content":[{"type":"text","text":"❌ Missing secondary metrics: best_val_bpb, steps, artifact_mb\n\nYou must provide all previously tracked metrics. Expected: best_val_bpb, steps, artifact_mb\nGot: (none)\n\nFix: include \"best_val_bpb\": <value>, \"steps\": <value>, \"artifact_mb\": <value> in the metrics parameter."}],"details":{},"isError":false,"timestamp":1777146458131}}
{"type":"message","id":"031834c3","parentId":"4960c4be","timestamp":"2026-04-25T19:47:42.936Z","message":{"role":"assistant","content":[{"type":"thinking","thinking":"Need to include all tracked secondary metrics.","thinkingSignature":"0166362f3fb5d82fe2f9a81a0ef8118840d275c0a94aa0c424f1343d85b4b3a4"},{"type":"toolCall","id":"call_function_0819aatye5fs_1","name":"log_experiment","arguments":{"asi":{"error":"mat1 mat2 dtype mismatch bf16 vs float","fix_needed":"CastedLinear cast weights to match autocast dtype","ttt_broken":true},"commit":"a672845","description":"TTT crashed: dtype mismatch in CastedLinear (bf16/float32)","metric":2.3857,"metrics":{"artifact_mb":12.3,"best_val_bpb":2.3857,"steps":1200},"status":"discard"}}],"api":"anthropic-messages","provider":"minimax","model":"MiniMax-M2.7","usage":{"input":240,"output":169,"cacheRead":47328,"cacheWrite":0,"totalTokens":47737,"cost":{"input":0.000072,"output":0.0002028,"cacheRead":0.00283968,"cacheWrite":0,"total":0.0031144799999999998}},"stopReason":"toolUse","timestamp":1777146458136,"responseId":"063c4d5cc26654971ee655df4e7c15b5"}}
{"type":"message","id":"14802da8","parentId":"031834c3","timestamp":"2026-04-25T19:47:43.002Z","message":{"role":"toolResult","toolCallId":"call_function_0819aatye5fs_1","toolName":"log_experiment","content":[{"type":"text","text":"Logged #2: discard — TTT crashed: dtype mismatch in CastedLinear (bf16/float32)\nBaseline val_bpb: 2.38bpb\nSecondary: artifact_mb: 12.30mb (+1.7%)  best_val_bpb: 2.39 (+0.3%)  steps: 1,200 (+3.9%)\n📋 ASI: error: mat1 mat2 dtype mismatch bf16 vs float | fix_needed: CastedLinear cast weights to match autocast dtype | ttt_broken: true\n(2 experiments)\n📝 Git: reverted changes (discard) — autoresearch files preserved"}],"details":{"experiment":{"commit":"a672845","metric":2.3857,"metrics":{"artifact_mb":12.3,"best_val_bpb":2.3857,"steps":1200},"status":"discard","description":"TTT crashed: dtype mismatch in CastedLinear (bf16/float32)","timestamp":1777146462942,"segment":0,"confidence":null,"iterationTokens":null,"asi":{"error":"mat1 mat2 dtype mismatch bf16 vs float","fix_needed":"CastedLinear cast weights to match autocast dtype","ttt_broken":true}},"state":{"results":[{"commit":"a672845","metric":2.379,"metrics":{"best_val_bpb":2.379,"steps":1155,"artifact_mb":12.1},"status":"keep","description":"30-min baseline: 2.379 val_bpb, 1155 steps, still improving","timestamp":1777144208804,"segment":0,"confidence":null,"iterationTokens":null,"asi":{"baseline_30min":true,"steps_completed":1155,"max_iterations":7000,"pct_exhausted":16.5,"loss_still_declining":true,"artifact_mb":12.1,"gap_to_sub1":1.879}},{"commit":"a672845","metric":2.3857,"metrics":{"artifact_mb":12.3,"best_val_bpb":2.3857,"steps":1200},"status":"discard","description":"TTT crashed: dtype mismatch in CastedLinear (bf16/float32)","timestamp":1777146462942,"segment":0,"confidence":null,"iterationTokens":null,"asi":{"error":"mat1 mat2 dtype mismatch bf16 vs float","fix_needed":"CastedLinear cast weights to match autocast dtype","ttt_broken":true}}],"bestMetric":2.379,"bestDirection":"lower","metricName":"val_bpb","metricUnit":"bpb","secondaryMetrics":[{"name":"best_val_bpb","unit":""},{"name":"steps","unit":""},{"name":"artifact_mb","unit":"mb"}],"name":"Parameter Golf - Find Best Config for Sub-1 BPB","currentSegment":0,"maxExperiments":null,"confidence":null},"wallClockSeconds":null},"isError":false,"timestamp":1777146463001}}
