{"type":"message","id":"61cfcdaa","parentId":"109b211d","timestamp":"2026-04-27T12:50:31.116Z","message":{"role":"assistant","content":[{"type":"thinking","thinking":"Val_bpb is inf - no validation happened because only 50 steps. Let me run a longer test with at least 100 steps to trigger validation.\n","thinkingSignature":"02ddf7620e017665fa008ed1d05d475527fc214365aac8d2e57fe794fd35031d"},{"type":"toolCall","id":"call_function_n6cje6q71lqa_1","name":"bash","arguments":{"command":"source ~/.venv/pg/bin/activate && python3 << 'EOF'\nfrom lightning_sdk import Studio, Teamspace\nimport os\n\nos.environ['LIGHTNING_USER_ID'] = 'd52587bc-ec3c-4c9c-a2fa-71246e3d4020'\nos.environ['LIGHTNING_API_KEY'] = '25da12f4-1ad8-4e3f-8ba4-2a60fcebaabe'\n\nts = Teamspace(name='default-project', user='dhruv2mars')\nstudio = Studio(name='parameter-golf', teamspace=ts)\n\n# Run 5-min test with validation\nprint('Running 5-min training test...')\ncmd = 'cd /teamspace/studios/this_studio/parameter-golf && ITERATIONS=100 VAL_LOSS_EVERY=50 MAX_WALLCLOCK=300 python3 train_kaggle.py 2>&1'\nresult = studio.run(cmd)\nprint('Output:')\nprint(result)\nEOF","timeout_seconds":"360"}}],"api":"anthropic-messages","provider":"minimax","model":"MiniMax-M2.7","usage":{"input":741,"output":277,"cacheRead":102656,"cacheWrite":0,"totalTokens":103674,"cost":{"input":0.00022229999999999998,"output":0.0003324,"cacheRead":0.006159359999999999,"cacheWrite":0,"total":0.006714059999999999}},"stopReason":"toolUse","timestamp":1777294217854,"responseId":"063e8e8e5992aac2ba38e43fd5136bd2"}}
{"type":"message","id":"09e818b0","parentId":"61cfcdaa","timestamp":"2026-04-27T12:54:20.555Z","message":{"role":"toolResult","toolCallId":"call_function_n6cje6q71lqa_1","toolName":"bash","content":[{"type":"text","text":"Running 5-min training test...\nOutput:\n============================================================\nParameter Golf - T4 Training\nRun ID: 0e398cc2\nDevice: Tesla T4 (rank 0/1)\nPyTorch: 2.8.0+cu128\n============================================================\n[1/6] Downloading data...\n[2/6] Loading tokenizer...\nVal tokens: 40,540,803\n[3/6] Building model...\nParams: 35,993,176 (68.7 MB bf16)\n[4/6] Training...\nstep:1/100 train_loss:9.0149 time:0s\nstep:2/100 train_loss:9.0013 time:1s\nstep:3/100 train_loss:9.0057 time:3s\nstep:4/100 train_loss:8.9992 time:4s\nstep:5/100 train_loss:8.9675 time:5s\nstep:6/100 train_loss:8.9389 time:6s\nstep:7/100 train_loss:8.9011 time:7s\nstep:8/100 train_loss:8.8657 time:8s\nstep:9/100 train_loss:8.8091 time:9s\nstep:10/100 train_loss:8.7578 time:11s\nstep=50 val_loss=7.1773 val_bpb=3.3297 best_bpb=3.3297 elapsed_s=57\nMETRIC step=50\nMETRIC val_loss=7.1773\nMETRIC val_bpb=3.3297\nMETRIC best_bpb=3.3297\nMETRIC elapsed_s=57\n[CKPT] Best checkpoint saved\nstep:100/100 train_loss:6.7773 time:125s\n[4/6] Training complete. Best val_bpb: 3.3297\n[5/6] Saving final model...\nCompressed artifact: 8,168,293 bytes\nCode size: 38,627 bytes\nTotal: 8,206,920 bytes (limit: 16,000,000)\n============================================================\nDONE\n============================================================\nfinal_val_bpb=3.3297 total_steps=100 total_time_s=215 artifact_bytes=8168293 code_bytes=38627 total_bytes=8206920\nMETRIC final_val_bpb=3.3297\nMETRIC total_steps=100\nMETRIC total_time_s=215\nMETRIC artifact_bytes=8168293\nMETRIC code_bytes=38627\nMETRIC total_bytes=8206920\n"}],"isError":false,"timestamp":1777294460555}}
{"type":"message","id":"15b3780f","parentId":"09e818b0","timestamp":"2026-04-27T12:54:33.396Z","message":{"role":"assistant","content":[{"type":"thinking","thinking":"Excellent! The training is working! 5-min run got 3.33 BPB. Let me stop the studio to save GPU quota and give a summary.\n","thinkingSignature":"9c3605d4f905d6343d83b934627b8d9bff89edaf767c91ba0a2d3c605951b250"},{"type":"toolCall","id":"call_function_vz11dzcw3jxj_1","name":"bash","arguments":{"command":"source ~/.venv/pg/bin/activate && python3 << 'EOF'\nfrom lightning_sdk import Studio, Teamspace\nimport os\n\nos.environ['LIGHTNING_USER_ID'] = 'd52587bc-ec3c-4c9c-a2fa-71246e3d4020'\nos.environ['LIGHTNING_API_KEY'] = '25da12f4-1ad8-4e3f-8ba4-2a60fcebaabe'\n\nts = Teamspace(name='default-project', user='dhruv2mars')\nstudio = Studio(name='parameter-golf', teamspace=ts)\n\n# Stop to save GPU quota\nprint('Stopping studio to save GPU quota...')\nstudio.stop()\nprint('Status:', studio.status)\nEOF","timeout_seconds":"30"}}],"api":"anthropic-messages","provider":"minimax","model":"MiniMax-M2.7","usage":{"input":846,"output":224,"cacheRead":103360,"cacheWrite":0,"totalTokens":104430,"cost":{"input":0.0002538,"output":0.0002688,"cacheRead":0.0062016,"cacheWrite":0,"total":0.0067242}},"stopReason":"toolUse","timestamp":1777294460560,"responseId":"063e8f7f1faac73e7c3cedec9e33b0f1"}}
{"type":"message","id":"7b31f890","parentId":"15b3780f","timestamp":"2026-04-27T12:55:19.592Z","message":{"role":"toolResult","toolCallId":"call_function_vz11dzcw3jxj_1","toolName":"bash","content":[{"type":"text","text":"Stopping studio to save GPU quota...\nStatus: Stopped\n"}],"isError":false,"timestamp":1777294519592}}
{"type":"message","id":"885b5bfa","parentId":"7b31f890","timestamp":"2026-04-27T12:55:33.779Z","message":{"role":"assistant","content":[{"type":"thinking","thinking":"Everything is working now. Let me summarize.\n","thinkingSignature":"2bc65cbc3935c3bb90f67b7df12789f442bff460a63de63f5ce1c18ee2a5f006"},{"type":"text","text":"\n\n## ✅ Setup Complete!\n\n**CLI is fully operational:**\n- Can start/stop studios\n- Run commands on remote studio\n- GPU training works (T4 Tesla)\n- Repo cloned and ready\n\n**Test Results:**\n| Test | Steps | Time | val_bpb |\n|------|-------|------|---------|\n| 1-min | 50 | 148s | inf (no val yet) |\n| 2-min | 50 | 147s | inf (no val yet) |\n| 5-min | 100 | 215s | **3.33 BPB** |\n\n**Current BPB:** 3.33 in 5 min (baseline - not optimized yet)\n**Target:** <1.0 BPB\n\nStudio stopped to save your GPU quota. Ready to go when you are.\n\nWant me to:\n1. Run longer training (30min, 2hr, etc.)\n2. Optimize hyperparameters\n3. Implement the phases from your roadmap (TTT fix, SmearGate, etc.)"}],"api":"anthropic-messages","provider":"minimax","model":"MiniMax-M2.7","usage":{"input":230,"output":220,"cacheRead":104192,"cacheWrite":0,"totalTokens":104642,"cost":{"input":0.000069,"output":0.00026399999999999997,"cacheRead":0.006251519999999999,"cacheWrite":0,"total":0.006584519999999999}},"stopReason":"stop","timestamp":1777294519596,"responseId":"063e8fbac14b96569cfb317f657bc504"}}
{"type":"message","id":"10a6ffe1","parentId":"885b5bfa","timestamp":"2026-04-27T12:58:34.444Z","message":{"role":"user","content":[{"type":"text","text":"ok, great. i would like you to do the follwoing things first:\n- cleanup the repo on lightning.ai - like i can still se the dafault main.py file, and other irrelevant folder. remove those\n- in our parameter-golf repo as well. do the cleanup. like remove the kaggle file, since we are not doing any training on kaggle now. cleanup the repo just to clear the bloat and jargon. \n- then, push the changes to main on github/lightning. make sure you keep track of the upstream parameter-golf repo from openai, if we are behind fix that and then update things everywhere."}],"timestamp":1777294714429}}
{"type":"message","id":"65d0b9c1","parentId":"10a6ffe1","timestamp":"2026-04-27T12:58:47.314Z","message":{"role":"assistant","content":[{"type":"thinking","thinking":"Let me do all three tasks:\n1. Clean up the Lightning AI studio\n2. Clean up the local repo\n3. Push to GitHub and sync with upstream\n","thinkingSignature":"00aba256aaafda354c399722be4843101896390816158f014b43b77be780e5d0"},{"type":"toolCall","id":"call_function_sffnrggnr9c5_1","name":"bash","arguments":{"command":"source ~/.venv/pg/bin/activate && python3 << 'EOF'\nfrom lightning_sdk import Studio, Teamspace\nimport os\n\nos.environ['LIGHTNING_USER_ID'] = 'd52587bc-ec3c-4c9c-a2fa-71246e3d4020'\nos.environ['LIGHTNING_API_KEY'] = '25da12f4-1ad8-4e3f-8ba4-2a60fcebaabe'\n\nts = Teamspace(name='default-project', user='dhruv2mars')\nstudio = Studio(name='parameter-golf', teamspace=ts)\nstudio.start()\nprint('Studio started')\nEOF","timeout_seconds":"30"}}],"api":"anthropic-messages","provider":"minimax","model":"MiniMax-M2.7","usage":{"input":390,"output":207,"cacheRead":104384,"cacheWrite":0,"totalTokens":104981,"cost":{"input":0.000117,"output":0.00024839999999999997,"cacheRead":0.006263039999999999,"cacheWrite":0,"total":0.006628439999999999}},"stopReason":"toolUse","timestamp":1777294714444,"responseId":"063e907e6eeed3523883459c9e5ef3fb"}}
{"type":"message","id":"07478c31","parentId":"65d0b9c1","timestamp":"2026-04-27T12:59:30.944Z","message":{"role":"toolResult","toolCallId":"call_function_sffnrggnr9c5_1","toolName":"bash","content":[{"type":"text","text":"Studio started\n"}],"isError":false,"timestamp":1777294770944}}
{"type":"message","id":"1fad5008","parentId":"07478c31","timestamp":"2026-04-27T12:59:39.309Z","message":{"role":"assistant","content":[{"type":"thinking","thinking":"Now let me clean up the studio - remove main.py and other default files.\n","thinkingSignature":"32508e134fed21a8a3aa4af26423732fb931c0407f60783f7dbd1ed34d4ab53d"},{"type":"toolCall","id":"call_function_qxixe0p7n397_1","name":"bash","arguments":{"command":"source ~/.venv/pg/bin/activate && python3 << 'EOF'\nfrom lightning_sdk import Studio, Teamspace\nimport os\n\nos.environ['LIGHTNING_USER_ID'] = 'd52587bc-ec3c-4c9c-a2fa-71246e3d4020'\nos.environ['LIGHTNING_API_KEY'] = '25da12f4-1ad8-4e3f-8ba4-2a60fcebaabe'\n\nts = Teamspace(name='default-project', user='dhruv2mars')\nstudio = Studio(name='parameter-golf', teamspace=ts)\n\n# List files\nprint('Studio contents:')\nresult = studio.run('ls -la /teamspace/studios/this_studio/')\nprint(result)\nEOF","timeout_seconds":"30"}}],"api":"anthropic-messages","provider":"minimax","model":"MiniMax-M2.7","usage":{"input":194,"output":213,"cacheRead":104768,"cacheWrite":0,"totalTokens":105175,"cost":{"input":0.0000582,"output":0.0002556,"cacheRead":0.0062860799999999994,"cacheWrite":0,"total":0.00659988}},"stopReason":"toolUse","timestamp":1777294770949,"responseId":"063e90b50ea1e21473ab7d90eb3fe733"}}
{"type":"message","id":"89118b6c","parentId":"1fad5008","timestamp":"2026-04-27T12:59:46.617Z","message":{"role":"toolResult","toolCallId":"call_function_qxixe0p7n397_1","toolName":"bash","content":[{"type":"text","text":"Studio contents:\ntotal 128\ndrwxr-xr-x 1 dhruv2mars dhruv2mars  4096 Apr 27 12:59 .\ndrwxr-xr-x 3 root       root        4096 Apr 22 21:00 ..\n-rwxr--r-- 1 dhruv2mars dhruv2mars   313 Apr 22 05:31 .bashrc\ndrwxr-xr-x 1 dhruv2mars dhruv2mars  4096 Apr 27 12:58 .cache\nlrwxrwxrwx 1 dhruv2mars dhruv2mars    19 Apr 27 12:59 .condarc -> /home/zeus/.condarc\ndrwxr-xr-x 3 dhruv2mars dhruv2mars  4096 Apr 27 12:59 .config\nlrwxrwxrwx 1 dhruv2mars dhruv2mars    34 Apr 27 12:59 .cursor-server -> /system/environment/.cursor-server\nlrwxrwxrwx 1 dhruv2mars dhruv2mars    18 Apr 27 12:59 .docker -> /home/zeus/.docker\n-rwxr--r-- 1 dhruv2mars dhruv2mars   419 Apr 27 12:59 .gitconfig\nlrwxrwxrwx 1 dhruv2mars dhruv2mars    21 Apr 27 12:59 .hushlogin -> /home/zeus/.hushlogin\ndrwxr-xr-x 1 dhruv2mars dhruv2mars  4096 Apr 27 12:59 .idea\ndrwxr-xr-x 2 dhruv2mars dhruv2mars  4096 Apr 27 12:59 .ipython\nlrwxrwxrwx 1 dhruv2mars dhruv2mars    19 Apr 27 12:59 .jupyter -> /home/zeus/.jupyter\ndrwxr-xr-x 1 dhruv2mars dhruv2mars  4096 Apr 27 12:59 .lightning_studio\n-rwxr--r-- 1 dhruv2mars dhruv2mars   236 Apr 27 12:36 .lightningignore\nlrwxrwxrwx 1 dhruv2mars dhruv2mars    17 Apr 27 12:59 .local -> /home/zeus/.local\nlrwxrwxrwx 1 dhruv2mars dhruv2mars    22 Apr 27 12:37 .nvm -> /system/conda/node/nvm\nlrwxrwxrwx 1 dhruv2mars dhruv2mars    21 Apr 27 12:59 .oh-my-zsh -> /home/zeus/.oh-my-zsh\nlrwxrwxrwx 1 dhruv2mars dhruv2mars    19 Apr 27 12:59 .profile -> /home/zeus/.profile\nlrwxrwxrwx 1 dhruv2mars dhruv2mars    15 Apr 27 12:58 .ssh -> /home/zeus/.ssh\nlrwxrwxrwx 1 dhruv2mars dhruv2mars    36 Apr 27 12:59 .sudo_as_admin_successful -> /home/zeus/.sudo_as_admin_successful\n-rwxr--r-- 1 dhruv2mars dhruv2mars   378 Apr 22 05:31 .vimrc\ndrwxr-xr-x 1 dhruv2mars dhruv2mars  4096 Apr 27 12:59 .vscode\nlrwxrwxrwx 1 dhruv2mars dhruv2mars    34 Apr 27 12:59 .vscode-server -> /system/environment/.vscode-server\nlrwxrwxrwx 1 dhruv2mars dhruv2mars    36 Apr 27 12:59 .windsurf-server -> /system/environment/.windsurf-server\n-rwxr--r-- 1 dhruv2mars dhruv2mars 50498 Apr 27 12:36 .zcompdump\n-rwxr--r-- 1 dhruv2mars dhruv2mars     0 Apr 27 12:55 .zsh_history\n-rwxr--r-- 1 dhruv2mars dhruv2mars  4235 Apr 22 05:31 .zshrc\n-rwxr--r-- 1 dhruv2mars dhruv2mars    33 Apr 27 12:35 main.py\ndrwxr-xr-x 1 dhruv2mars dhruv2mars  4096 Apr 27 12:59 parameter-golf\n"}],"isError":false,"timestamp":1777294786617}}
{"type":"message","id":"8ceb022f","parentId":"89118b6c","timestamp":"2026-04-27T12:59:57.609Z","message":{"role":"assistant","content":[{"type":"thinking","thinking":"Good. The studio has:\n1. `main.py` - the default file that needs to be removed\n2. `parameter-golf/` - our repo\n\nLet me remove main.py and check the parameter-golf repo for cleanup.\n","thinkingSignature":"ea2474a18d3425522a6f3d387e7ebae741a46f19c912b778f27069737b177759"},{"type":"toolCall","id":"call_function_fkqy8iirav5c_1","name":"bash","arguments":{"command":"source ~/.venv/pg/bin/activate && python3 << 'EOF'\nfrom lightning_sdk import Studio, Teamspace\nimport os\n\nos.environ['LIGHTNING_USER_ID'] = 'd52587bc-ec3c-4c9c-a2fa-71246e3d4020'\nos.environ['LIGHTNING_API_KEY'] = '25da12f4-1ad8-4e3f-8ba4-2a60fcebaabe'\n\nts = Teamspace(name='default-project', user='dhruv2mars')\nstudio = Studio(name='parameter-golf', teamspace=ts)\n\n# Remove main.py\nprint('Removing main.py...')\nstudio.run('rm /teamspace/studios/this_studio/main.py')\nprint('Done!')\n\n# Check our repo\nprint('\\nRepo contents:')\nresult = studio.run('ls -la /teamspace/studios/this_studio/parameter-golf/')\nprint(result)\nEOF","timeout_seconds":"30"}}],"api":"anthropic-messages","provider":"minimax","model":"MiniMax-M2.7","usage":{"input":1260,"output":285,"cacheRead":104896,"cacheWrite":0,"totalTokens":106441,"cost":{"input":0.00037799999999999997,"output":0.00034199999999999996,"cacheRead":0.00629376,"cacheWrite":0,"total":0.00701376}},"stopReason":"toolUse","timestamp":1777294786621,"responseId":"063e90c5789c8ddd825c1bc7981900ea"}}
{"type":"message","id":"b8fa7aaa","parentId":"8ceb022f","timestamp":"2026-04-27T13:00:10.296Z","message":{"role":"toolResult","toolCallId":"call_function_fkqy8iirav5c_1","toolName":"bash","content":[{"type":"text","text":"Removing main.py...\nDone!\n\nRepo contents:\ntotal 240\ndrwxr-xr-x 1 dhruv2mars dhruv2mars  4096 Apr 27 12:59 .\ndrwxr-xr-x 1 dhruv2mars dhruv2mars  4096 Apr 27 13:00 ..\ndrwxr-xr-x 1 dhruv2mars dhruv2mars  4096 Apr 27 12:59 .git\n-rwxr--r-- 1 dhruv2mars dhruv2mars   259 Apr 27 12:42 .gitignore\n-rwxr--r-- 1 dhruv2mars dhruv2mars  1063 Apr 27 12:42 LICENSE\n-rwxr--r-- 1 dhruv2mars dhruv2mars 24483 Apr 27 12:42 README.md\n-rwxr--r-- 1 dhruv2mars dhruv2mars  1341 Apr 27 12:42 THIRD_PARTY_NOTICES.md\ndrwxr-xr-x 1 dhruv2mars dhruv2mars  4096 Apr 27 12:58 checkpoints\ndrwxr-xr-x 1 dhruv2mars dhruv2mars  4096 Apr 27 12:59 data\ndrwxr-xr-x 1 dhruv2mars dhruv2mars  4096 Apr 27 12:59 experiments\ndrwxr-xr-x 1 dhruv2mars dhruv2mars  4096 Apr 27 12:59 logs\ndrwxr-xr-x 1 dhruv2mars dhruv2mars  4096 Apr 27 12:58 records\n-rwxr--r-- 1 dhruv2mars dhruv2mars   109 Apr 27 12:42 requirements.txt\n-rwxr--r-- 1 dhruv2mars dhruv2mars  4486 Apr 27 12:42 run_train.sh\n-rwxr--r-- 1 dhruv2mars dhruv2mars 47686 Apr 27 12:42 train_gpt.py\n-rwxr--r-- 1 dhruv2mars dhruv2mars 50195 Apr 27 12:42 train_gpt_mlx.py\n-rwxr--r-- 1 dhruv2mars dhruv2mars 38627 Apr 27 12:42 train_kaggle.py\n"}],"isError":false,"timestamp":1777294810296}}
{"type":"message","id":"dd36d1c5","parentId":"b8fa7aaa","timestamp":"2026-04-27T13:00:24.365Z","message":{"role":"assistant","content":[{"type":"thinking","thinking":"Good. Now let me:1. Remove unnecessary files from the repo (kaggle files, etc)\n2. Check upstream for updates\n3. Sync everything\n\nFiles to remove:\n- train_gpt.py (original reference)\n- train_gpt_mlx.py (original reference)\n- run_train.sh (old kaggle script)\n- experiments/ (old kaggle results)\n- checkpoints/\n- logs/\n- data/\n- records/\n\nActually, let me be more careful. Let me check what's actually needed:\n- train_kaggle.py - our main training script (KEEP)\n- train_gpt.py - maybe keep as reference?\n- train_gpt_mlx.py - maybe keep as reference?\n\n\nLet me first check if train_gpt.py and train_gpt_mlx.py are in the upstream repo before deciding what to remove. I should verify what's actually from upstream versus what we added locally.\n","thinkingSignature":"1f552b8450eff559448b72a33202ab62f5d4ccae2ef90c830c915f6c7ba21bb2"},{"type":"toolCall","id":"call_function_gr9axi3r0k2t_1","name":"bash","arguments":{"command":"cd /Users/dhruv2mars/dev/github/parameter-golf && git fetch upstream && git log --oneline upstream/main -5"}}],"api":"anthropic-messages","provider":"minimax","model":"MiniMax-M2.7","usage":{"input":799,"output":233,"cacheRead":106112,"cacheWrite":0,"totalTokens":107144,"cost":{"input":0.0002397,"output":0.00027959999999999997,"cacheRead":0.006366719999999999,"cacheWrite":0,"total":0.00688602}},"stopReason":"toolUse","timestamp":1777294810301,"responseId":"063e90dd379b746a786d2d0344c2672f"}}
{"type":"message","id":"81bd7857","parentId":"dd36d1c5","timestamp":"2026-04-27T13:00:25.192Z","message":{"role":"toolResult","toolCallId":"call_function_gr9axi3r0k2t_1","toolName":"bash","content":[{"type":"text","text":"7427de2 Update README leaderboard with recent record submissions + revert bad merges (#1806)\n8b148a0 Record: Scylla + Full GPTQ + XSA-all + FA3 — val_bpb 0.9485 (3-seed mean) (#1184)\nf56ef88 Record: 1.1122 BPB — Coprime-Stride Loader + Full GPTQ + XSA-all (3-seed mean) (#1060)\n2bd7916 Record: 11L Muon TTT + Entropy-Adaptive Epochs (8xH100) — val_bpb 1.1179 (3-seed mean) (#1148)\n75700cb Merge pull request #1511 from openai/codex/update-april-leaderboard-readme\n"}],"isError":false,"timestamp":1777294825192}}
{"type":"message","id":"160b1713","parentId":"81bd7857","timestamp":"2026-04-27T13:00:28.898Z","message":{"role":"assistant","content":[{"type":"thinking","thinking":"Let me check the current state of the local repo and what's been modified.\n","thinkingSignature":"5fd3d97af5cda2b9441a3fb991143bea661201971b81d2633c39b8db7e1e2a06"},{"type":"toolCall","id":"call_function_7iurbj69bshv_1","name":"bash","arguments":{"command":"cd /Users/dhruv2mars/dev/github/parameter-golf && git status && echo \"---\" && git log --oneline -5"}}],"api":"anthropic-messages","provider":"minimax","model":"MiniMax-M2.7","usage":{"input":257,"output":69,"cacheRead":106880,"cacheWrite":0,"totalTokens":107206,"cost":{"input":0.00007709999999999999,"output":0.0000828,"cacheRead":0.0064128,"cacheWrite":0,"total":0.0065727}},"stopReason":"toolUse","timestamp":1777294825197,"responseId":"063e90e968f3f1607d9c8c33ce40c534"}}
{"type":"message","id":"247c25cd","parentId":"160b1713","timestamp":"2026-04-27T13:00:28.926Z","message":{"role":"toolResult","toolCallId":"call_function_7iurbj69bshv_1","toolName":"bash","content":[{"type":"text","text":"(use \"git push\" to publish your local commits)\n\nUntracked files:\n?? (use \"git add <file>...\" to include in what will be committed)\nkaggle_pull/\n\n---\n4f76b43 feat: add optimized train_kaggle.py pipeline\n7427de2 Update README leaderboard with recent record submissions + revert bad merges (#1806)\n8b148a0 Record: Scylla + Full GPTQ + XSA-all + FA3 — val_bpb 0.9485 (3-seed mean) (#1184)\nf56ef88 Record: 1.1122 BPB — Coprime-Stride Loader + Full GPTQ + XSA-all (3-seed mean) (#1060)\n2bd7916 Record: 11L Muon TTT + Entropy-Adaptive Epochs (8xH100) — val_bpb 1.1179 (3-seed mean) (#1148)\n\n[tokenjuice compacted bash output]"}],"details":{"tokenjuice":{"compacted":true,"rawChars":730,"reducedChars":582,"savedChars":148,"reducer":"git/status"}},"isError":false,"timestamp":1777294828926}}
{"type":"message","id":"646bb145","parentId":"247c25cd","timestamp":"2026-04-27T13:00:35.085Z","message":{"role":"assistant","content":[{"type":"thinking","thinking":"Need to:\n1. Add kaggle files (pg_autoresearch.py, run_train.sh, train_kaggle.py) - already committed\n2. Delete kaggle_pull directory\n3. Sync with upstream\n4. Push to origin\n\nLet me check what was already committed vs what's on disk.\n","thinkingSignature":"82acde18401cf4faef9913376b8260147feebad74111cfc9ef0a7129e2f4febb"},{"type":"toolCall","id":"call_function_5lztjkrq9r02_1","name":"bash","arguments":{"command":"cd /Users/dhruv2mars/dev/github/parameter-golf && rm -rf kaggle_pull && ls -la"}}],"api":"anthropic-messages","provider":"minimax","model":"MiniMax-M2.7","usage":{"input":331,"output":112,"cacheRead":107072,"cacheWrite":0,"totalTokens":107515,"cost":{"input":0.0000993,"output":0.0001344,"cacheRead":0.00642432,"cacheWrite":0,"total":0.00665802}},"stopReason":"toolUse","timestamp":1777294828931,"responseId":"063e90edf05a8b1d83c20f12cfa56c01"}}
