{"type":"message","id":"415c1071","parentId":"75c56483","timestamp":"2026-04-27T13:25:47.609Z","message":{"role":"assistant","content":[{"type":"thinking","thinking":"Now I understand the model architecture. Let me read the rest to see how training is done and understand the full flow, then implement the 3 changes:\n\n1. SP8192 - Sequence Parallelism with seq len 8192\n2. Parallel residuals - parallel attention and MLP branches\n3. SmearGate - some gating mechanism\n\nLet me continue reading the file.","thinkingSignature":"c4f9674f7f76bbac2349d9a1b08fa1384cd9dcedcd0d132774fbc6fdfa9f16ad"},{"type":"toolCall","id":"call_function_p0h82l5j73jy_1","name":"read","arguments":{"path":"/Users/dhruv2mars/dev/github/parameter-golf/train_kaggle.py","offset":501,"limit":200}}],"api":"anthropic-messages","provider":"minimax","model":"MiniMax-M2.7","usage":{"input":33414,"output":137,"cacheRead":9199,"cacheWrite":0,"totalTokens":42750,"cost":{"input":0.010024199999999999,"output":0.00016439999999999998,"cacheRead":0.00055194,"cacheWrite":0,"total":0.01074054}},"stopReason":"toolUse","timestamp":1777296341288,"responseId":"063e96d552841658a60dc40eaad41381"}}
{"type":"message","id":"949de9bc","parentId":"415c1071","timestamp":"2026-04-27T13:25:47.622Z","message":{"role":"toolResult","toolCallId":"call_function_p0h82l5j73jy_1","toolName":"read","content":[{"type":"text","text":"    flat = (q.to(torch.int16).flatten() + 32).clamp_(0, 63).to(torch.int32)\n    pad = (-flat.numel()) % 4\n    if pad:\n        flat = torch.cat([flat, torch.zeros(pad, dtype=torch.int32)])\n    \n    vals = flat.view(-1, 4)\n    word = vals[:, 0] | (vals[:, 1] << 6) | (vals[:, 2] << 12) | (vals[:, 3] << 18)\n    \n    packed = torch.empty((word.numel(), 3), dtype=torch.uint8)\n    packed[:, 0] = (word & 255).to(torch.uint8)\n    packed[:, 1] = ((word >> 8) & 255).to(torch.uint8)\n    packed[:, 2] = ((word >> 16) & 255).to(torch.uint8)\n    \n    return packed.flatten(), pad\n\n\ndef quantize_state_dict(state_dict):\n    \"\"\"Quantize model weights for storage.\"\"\"\n    quantized = {}\n    scales = {}\n    meta = {}\n    \n    for name, tensor in state_dict.items():\n        t = tensor.detach().cpu()\n        \n        # Non-float tensors (embeddings indices, etc.)\n        if not t.is_floating_point():\n            quantized[name] = t.to(torch.int16)\n            continue\n        \n        # Embedding layers: int8\n        if \"tok_emb\" in name or \"lm_head\" in name:\n            q, s = quantize_row(t, clip_std_mult=H.embed_clip_sigmas, bits=8)\n            quantized[name] = q\n            meta[name] = {\"bits\": 8, \"shape\": tuple(t.shape)}\n        \n        # Matrix weights: int6\n        elif t.ndim == 2:\n            q, s = quantize_row(t, clip_std_mult=H.matrix_clip_sigmas, bits=6)\n            packed, pad = pack_int6(q)\n            quantized[name] = packed\n            meta[name] = {\"bits\": 6, \"shape\": tuple(t.shape), \"pad\": pad}\n        \n        # Other: int8\n        else:\n            q, s = quantize_row(t, clip_std_mult=H.matrix_clip_sigmas, bits=8)\n            quantized[name] = q\n            meta[name] = {\"bits\": 8, \"shape\": tuple(t.shape)}\n        \n        scales[name] = s\n    \n    return {\"q\": quantized, \"s\": scales, \"meta\": meta}\n\n\n# ============================================================================\n# CHECKPOINTING\n# ============================================================================\n\ndef save_checkpoint(step, model, optimizer, ema_state, best_val_bpb, \n                    train_stream_pos, run_dir):\n    \"\"\"Save training checkpoint.\"\"\"\n    checkpoint = {\n        \"step\": step,\n        \"model\": model.state_dict() if hasattr(model, 'state_dict') else None,\n        \"optimizer\": optimizer.state_dict() if hasattr(optimizer, 'state_dict') else None,\n        \"ema_state\": ema_state,\n        \"best_val_bpb\": best_val_bpb,\n        \"train_stream_pos\": train_stream_pos,\n    }\n    \n    path = os.path.join(run_dir, f\"{_CHECKPOINT_PREFIX}{step}.pt\")\n    torch.save(checkpoint, path)\n    \n    # Clean old checkpoints (keep last 3)\n    ckpts = sorted(glob.glob(os.path.join(run_dir, f\"{_CHECKPOINT_PREFIX}*.pt\")))\n    for old in ckpts[:-3]:\n        os.remove(old)\n    \n    return path\n\n\ndef load_checkpoint(path, model, optimizer):\n    \"\"\"Load training checkpoint and return step + stream position.\"\"\"\n    ckpt = torch.load(path, map_location='cpu')\n    \n    if ckpt.get(\"model\") is not None:\n        model.load_state_dict(ckpt[\"model\"])\n    if ckpt.get(\"optimizer\") is not None and hasattr(optimizer, 'load_state_dict'):\n        optimizer.load_state_dict(ckpt[\"optimizer\"])\n    \n    return ckpt.get(\"step\", 0), ckpt.get(\"best_val_bpb\", float('inf')), \\\n           ckpt.get(\"train_stream_pos\", 0)\n\n\n# ============================================================================\n# TTT (TEST-TIME TRAINING)\n# ============================================================================\n\ndef run_ttt(model, val_tokens, base_bytes_lut, device, args, log_fn):\n    \"\"\"Run Test-Time Training for final BPB boost.\"\"\"\n    log_fn(\"[TTT] Starting Test-Time Training...\")\n    \n    model.eval()\n    ttt_opt = torch.optim.SGD(model.parameters(), lr=args.ttt_lr, momentum=0.9)\n    \n    tokens_used = 0\n    total_tokens = min(val_tokens.numel() - 1, args.ttt_warmup_tokens * args.ttt_epochs)\n    \n    for epoch in range(args.ttt_epochs):\n        indices = torch.randperm(val_tokens.numel() - 1)\n        \n        for start in range(0, len(indices), args.ttt_warmup_tokens):\n            chunk = indices[start:start + args.ttt_warmup_tokens]\n            \n            # Score first (legal requirement)\n            x = val_tokens[chunk].to(device).long()\n            y = val_tokens[chunk + 1].to(device).long()\n            \n            with torch.no_grad():\n                _ = model(x, y)\n            \n            # Then train\n            with torch.autocast(device_type=\"cuda\", dtype=torch.bfloat16):\n                loss = model(x, y)\n            \n            if not torch.isfinite(loss):\n                log_fn(f\"[TTT] Non-finite loss at epoch {epoch}, chunk {start}\")\n                continue\n            \n            ttt_opt.zero_grad()\n            loss.backward()\n            torch.nn.utils.clip_grad_norm_(model.parameters(), 1.0)\n            ttt_opt.step()\n            \n            tokens_used += x.numel()\n        \n        # Evaluate after each epoch\n        val_loss_sum = 0.0\n        val_token_count = 0\n        eval_limit = min(val_tokens.numel() - 1, args.val_max_tokens)\n        \n        with torch.no_grad():\n            for i in range(0, eval_limit, args.train_seq_len * 4):\n                x = val_tokens[i:i + args.train_seq_len * 4].to(device).long()\n                y = val_tokens[i + 1:i + 1 + args.train_seq_len * 4].to(device).long()\n                with torch.autocast(device_type=\"cuda\", dtype=torch.bfloat16):\n                    loss = model(x, y)\n                val_loss_sum += loss.item() * x.numel()\n                val_token_count += x.numel()\n        \n        ttt_val_bpb = compute_val_bpb(\n            val_loss_sum / val_token_count, val_tokens[:val_token_count],\n            base_bytes_lut, device\n        )\n        log_fn(f\"[TTT] Epoch {epoch + 1}/{args.ttt_epochs}: val_bpb={ttt_val_bpb:.4f}\")\n    \n    return model\n\n\n# ============================================================================\n# TRAINING\n# ============================================================================\n\ndef train():\n    \"\"\"Main training function.\"\"\"\n    args = H()\n    \n    # ==========================================================================\n    # SETUP\n    # ==========================================================================\n    \n    if not torch.cuda.is_available():\n        raise RuntimeError(\"CUDA required for training\")\n    \n    # Distributed setup\n    world_size = int(os.environ.get(\"WORLD_SIZE\", \"1\"))\n    local_rank = int(os.environ.get(\"LOCAL_RANK\", \"0\"))\n    rank = int(os.environ.get(\"RANK\", \"0\"))\n    device = torch.device(f\"cuda:{local_rank}\")\n    torch.cuda.set_device(device)\n    \n    if world_size > 1:\n        dist.init_process_group(backend=\"nccl\")\n    \n    is_main = rank == 0\n    \n    # Enable TF32 for faster compute\n    torch.backends.cuda.matmul.allow_tf32 = True\n    torch.backends.cudnn.allow_tf32 = True\n    \n    # Create run directory\n    run_dir = os.path.join(args.checkpoint_dir, args.run_id)\n    os.makedirs(run_dir, exist_ok=True)\n    os.makedirs(\"logs\", exist_ok=True)\n    \n    # Logging\n    logf = open(f\"logs/{args.run_id}.rank{rank}.txt\", \"w\")\n    \n    def log(msg):\n        if is_main:\n\n[345 more lines in file. Use offset=701 to continue.]"}],"isError":false,"timestamp":1777296347622}}
{"type":"message","id":"05377940","parentId":"949de9bc","timestamp":"2026-04-27T13:25:51.799Z","message":{"role":"assistant","content":[{"type":"thinking","thinking":"Let me continue reading to see the training loop and understand how things work.","thinkingSignature":"5859136c654b11c90b06624fd5cac1df7fbd1475bed649db5e186b98b3d02eb9"},{"type":"toolCall","id":"call_function_60em0y6polyi_1","name":"read","arguments":{"path":"/Users/dhruv2mars/dev/github/parameter-golf/train_kaggle.py","offset":701,"limit":350}}],"api":"anthropic-messages","provider":"minimax","model":"MiniMax-M2.7","usage":{"input":35308,"output":77,"cacheRead":9199,"cacheWrite":0,"totalTokens":44584,"cost":{"input":0.0105924,"output":0.0000924,"cacheRead":0.00055194,"cacheWrite":0,"total":0.01123674}},"stopReason":"toolUse","timestamp":1777296347624,"responseId":"063e96dc963f21d1bd0bd7c2d305bad3"}}
