{"type":"message","id":"eeb11adc","parentId":"546b16a9","timestamp":"2026-04-26T08:16:10.238Z","message":{"role":"assistant","content":[{"type":"thinking","thinking":"RoPE 32 is the best. Let me now try exploring other dimensions near rope32. Let me try:- ROPE 28 (between 24 and 32)\n- ROPE 36 (between 32 and 48)","thinkingSignature":"eb1d91238492ca3f3d1b0d622daefb1f325768a499add57dc193554bb141a99b"},{"type":"toolCall","id":"call_function_rl1tjn0a4htb_1","name":"bash","arguments":{"command":"cd /Users/dhruv2mars/dev/github/parameter-golf && python3 experiments/pg_autoresearch.py run --name \"ar_rope28_$(date +%Y%m%d)\" --env \"ITERATIONS=7000\" --env \"MAX_WALLCLOCK_SECONDS=1800\" --env \"ROPE_DIMS=28\" --timeout 2400 2>&1"}}],"api":"anthropic-messages","provider":"minimax","model":"MiniMax-M2.7","usage":{"input":312,"output":156,"cacheRead":67200,"cacheWrite":0,"totalTokens":67668,"cost":{"input":0.0000936,"output":0.0001872,"cacheRead":0.004032,"cacheWrite":0,"total":0.0043128}},"stopReason":"toolUse","timestamp":1777191365857,"responseId":"063cfcc6644693d068c20c6be1449fcd"}}
{"type":"message","id":"63e9f526","parentId":"eeb11adc","timestamp":"2026-04-26T08:52:54.305Z","message":{"role":"toolResult","toolCallId":"call_function_rl1tjn0a4htb_1","toolName":"bash","content":[{"type":"text","text":"{\"best_val_bpb\": 2.3564, \"compressed_bytes\": null, \"error\": null, \"metric\": 2.3564, \"non_finite\": false, \"output\": \"/Users/dhruv2mars/dev/github/parameter-golf/experiments/kaggle_results/pg-auto-ar-rope28-20260426-91370\", \"ref\": \"dhruv2mars/pg-auto-ar-rope28-20260426-91370\", \"runtime_seconds\": null, \"status\": \"KernelWorkerStatus.COMPLETE\", \"steps\": 1100, \"ttt_val_bpb\": null, \"val_bpb\": 2.3564}\n"}],"isError":false,"timestamp":1777193574305}}
{"type":"message","id":"f813c65f","parentId":"63e9f526","timestamp":"2026-04-26T08:53:01.680Z","message":{"role":"assistant","content":[{"type":"thinking","thinking":"2.3564 - worse than rope32 (2.331) but better than rope24 (2.3565). The peak is around rope32.\n","thinkingSignature":"b02d404dfff1197ae0b34b3f86dfadf4d5645cbc837f2b3815ee8e0ddfb5da61"},{"type":"toolCall","id":"call_function_gwfg1bbf6pzk_1","name":"log_experiment","arguments":{"asi":{"arch":"rope_dims=28","conclusion":"rope28 worse than rope32 - confirms peak around 32"},"commit":"de16801","description":"ROPE 28 dims: 2.356, confirms rope32 is the peak","metric":2.3564,"metrics":{"artifact_mb":12.1,"best_val_bpb":2.3564,"steps":1100},"status":"discard"}}],"api":"anthropic-messages","provider":"minimax","model":"MiniMax-M2.7","usage":{"input":67711,"output":183,"cacheRead":64,"cacheWrite":0,"totalTokens":67958,"cost":{"input":0.0203133,"output":0.0002196,"cacheRead":0.00000384,"cacheWrite":0,"total":0.02053674}},"stopReason":"toolUse","timestamp":1777193574307,"responseId":"063d05687a368fcb3466169aa788865c"}}
{"type":"message","id":"85adbb98","parentId":"f813c65f","timestamp":"2026-04-26T08:53:01.735Z","message":{"role":"toolResult","toolCallId":"call_function_gwfg1bbf6pzk_1","toolName":"log_experiment","content":[{"type":"text","text":"Logged #22: discard — ROPE 28 dims: 2.356, confirms rope32 is the peak\nBaseline val_bpb: 2.38bpb\nSecondary: artifact_mb: 12.10mb (0.0%)  best_val_bpb: 2.36 (-0.9%)  steps: 1,100 (-4.8%)\n📋 ASI: arch: rope_dims=28 | conclusion: rope28 worse than rope32 - confirms peak around 32\n📊 Confidence: 1.6× noise floor — improvement is above noise but marginal\n(22 experiments)\n📝 Git: reverted changes (discard) — autoresearch files preserved"}],"details":{"experiment":{"commit":"de16801","metric":2.3564,"metrics":{"artifact_mb":12.1,"best_val_bpb":2.3564,"steps":1100},"status":"discard","description":"ROPE 28 dims: 2.356, confirms rope32 is the peak","timestamp":1777193581685,"segment":0,"confidence":1.6466552315609053,"iterationTokens":null,"asi":{"arch":"rope_dims=28","conclusion":"rope28 worse than rope32 - confirms peak around 32"}},"state":{"results":[{"commit":"a672845","metric":2.379,"metrics":{"best_val_bpb":2.379,"steps":1155,"artifact_mb":12.1},"status":"keep","description":"30-min baseline: 2.379 val_bpb, 1155 steps, still improving","timestamp":1777144208804,"segment":0,"confidence":null,"iterationTokens":null,"asi":{"baseline_30min":true,"steps_completed":1155,"max_iterations":7000,"pct_exhausted":16.5,"loss_still_declining":true,"artifact_mb":12.1,"gap_to_sub1":1.879}},{"commit":"a672845","metric":2.3857,"metrics":{"artifact_mb":12.3,"best_val_bpb":2.3857,"steps":1200},"status":"discard","description":"TTT crashed: dtype mismatch in CastedLinear (bf16/float32)","timestamp":1777146462942,"segment":0,"confidence":null,"iterationTokens":null,"asi":{"error":"mat1 mat2 dtype mismatch bf16 vs float","fix_needed":"CastedLinear cast weights to match autocast dtype","ttt_broken":true}},{"commit":"e8ecad4","metric":2.3821,"metrics":{"artifact_mb":12.3,"best_val_bpb":2.3821,"steps":1200},"status":"discard","description":"TTT still broken: OOM from attention .float() creating 32GB matrix","timestamp":1777148696907,"segment":0,"confidence":null,"iterationTokens":null,"asi":{"error":"OOM: attention .float() creates 32GB matrix","fix_needed":"Remove .float() or use bf16 for attention scores","ttt_broken":true}},{"commit":"de16801","metric":2.4351,"metrics":{"artifact_mb":12.3,"best_val_bpb":2.4351,"steps":1200},"status":"discard","description":"TTT still OOM: eval loop also has memory issues","timestamp":1777150932661,"segment":0,"confidence":null,"iterationTokens":null,"asi":{"error":"OOM still in TTT eval loop","fix_needed":"Reduce eval tokens per chunk, or skip TTT for now","ttt_broken":true}},{"commit":"de16801","metric":2.4265,"metrics":{"artifact_mb":12.3,"best_val_bpb":2.4265,"steps":900},"status":"discard","description":"Wider arch (9L-640d) too slow, timed out at 900 steps","timestamp":1777155540944,"segment":0,"confidence":null,"iterationTokens":null,"asi":{"arch":"9L-640d-10H/5KV","conclusion":"wider model too slow, hit wallclock before converging","error":"SIGTERM/SIGABRT - wallclock timeout","result":"worse than baseline","steps":900}},{"commit":"de16801","metric":2.4179,"metrics":{"artifact_mb":12.1,"best_val_bpb":2.4179,"steps":1000},"status":"discard","description":"Deeper/narrower (13L-480d): 2.418 val_bpb, worse","timestamp":1777157778800,"segment":0,"confidence":null,"iterationTokens":null,"asi":{"arch":"13L-480d-8H/4KV","conclusion":"narrower model underfits","result":"worse than baseline"}},{"commit":"de16801","metric":2.4755,"metrics":{"artifact_mb":12.1,"best_val_bpb":2.4755,"steps":1600},"status":"discard","description":"Seq1024 + batch4096: 2.48 val_bpb, worse","timestamp":1777160126335,"segment":0,"confidence":null,"iterationTokens":null,"asi":{"arch":"11L-512d, seq_len=1024","conclusion":"longer context underfits - fewer steps per time","result":"worse than baseline"}},{"commit":"de16801","metric":2.4523,"metrics":{"artifact_mb":12.1,"best_val_bpb":2.4523,"steps":900},"status":"discard","description":"More depth loops (3x, layers 3-6): 2.452 val_bpb","timestamp":1777162354973,"segment":0,"confidence":null,"iterationTokens":null,"asi":{"arch":"11L-512d, 3 loops on layers 3-6","conclusion":"more depth recurrence = slower = fewer steps = worse","result":"worse than baseline"}},{"commit":"de16801","metric":2.3948,"metrics":{"artifact_mb":12.1,"best_val_bpb":2.3948,"steps":1200},"status":"discard","description":"Higher LR (0.002): 2.395, slightly worse","timestamp":1777164584746,"segment":0,"confidence":null,"iterationTokens":null,"asi":{"conclusion":"higher LR converges faster but worse final","hyperparam":"lr=0.002"}},{"commit":"de16801","metric":2.382,"metrics":{"artifact_mb":12.1,"best_val_bpb":2.382,"steps":1100},"status":"keep","description":"Lower LR (0.0005): 2.382, within noise of baseline","timestamp":1777166805914,"segment":0,"confidence":null,"iterationTokens":null,"asi":{"conclusion":"lower LR marginally worse but within noise - may generalize better","hyperparam":"lr=0.0005"}},{"commit":"de16801","metric":2.3871,"metrics":{"artifact_mb":12.1,"best_val_bpb":2.3871,"steps":1200},"status":"discard","description":"Shorter warmdown (0.6): 2.387, slightly worse","timestamp":1777169035789,"segment":0,"confidence":null,"iterationTokens":null,"asi":{"conclusion":"shorter warmdown slightly worse","hyperparam":"warmdown=0.6"}},{"commit":"de16801","metric":2.3903,"metrics":{"artifact_mb":12.1,"best_val_bpb":2.3903,"steps":1100},"status":"discard","description":"Lower WD (0.05): 2.390, slightly worse","timestamp":1777171253884,"segment":0,"confidence":null,"iterationTokens":null,"asi":{"conclusion":"lower weight decay slightly worse","hyperparam":"wd=0.05"}},{"commit":"de16801","metric":2.3767,"metrics":{"artifact_mb":12.1,"best_val_bpb":2.3767,"steps":1100},"status":"keep","description":"Higher WD (0.15): 2.377, BEST so far! Better than baseline","timestamp":1777173486921,"segment":0,"confidence":0.2035398230088492,"iterationTokens":null,"asi":{"conclusion":"higher WD improves BPB by ~0.002","hyperparam":"wd=0.15"}},{"commit":"de16801","metric":2.4075,"metrics":{"artifact_mb":12.1,"best_val_bpb":2.4075,"steps":1100},"status":"discard","description":"WD0.15 + warmdown0.8: 2.408, worse","timestamp":1777175717625,"segment":0,"confidence":0.16140350877192655,"iterationTokens":null,"asi":{"conclusion":"longer warmdown worse with higher WD","hyperparam":"wd=0.15, warmdown=0.8"}},{"commit":"de16801","metric":2.4864,"metrics":{"artifact_mb":12.1,"best_val_bpb":2.4864,"steps":1100},"status":"discard","description":"ROPE 8 dims: 2.486, much worse","timestamp":1777177952414,"segment":0,"confidence":0.14556962025316225,"iterationTokens":null,"asi":{"arch":"rope_dims=8","conclusion":"less RoPE = much worse","result":"much worse"}},{"commit":"de16801","metric":2.3565,"metrics":{"artifact_mb":12.1,"best_val_bpb":2.3565,"steps":1100},"status":"keep","description":"ROPE 24 dims: 2.357, NEW BEST! 2.4% better than baseline","timestamp":1777180169789,"segment":0,"confidence":1.4610389610389511,"iterationTokens":null,"asi":{"arch":"rope_dims=24","conclusion":"more RoPE is a REAL win - 2.4% better than baseline","result":"BEST so far - significant"}},{"commit":"de16801","metric":2.3531,"metrics":{"artifact_mb":12.1,"best_val_bpb":2.3531,"steps":1100},"status":"keep","description":"ROPE 24 + WD 0.15: 2.353, COMBINED BEST!","timestamp":1777182401297,"segment":0,"confidence":1.5058139534883455,"iterationTokens":null,"asi":{"arch":"rope_dims=24 + wd=0.15","conclusion":"COMBINING best findings: rope24 + wd15 = another small win","result":"NEW BEST - 1.1% better than rope24 alone"}},{"commit":"de16801","metric":2.331,"metrics":{"artifact_mb":12.1,"best_val_bpb":2.331,"steps":1100},"status":"keep","description":"ROPE 32 dims: 2.331, MASSIVE IMPROVEMENT! 2% better than baseline","timestamp":1777184633015,"segment":0,"confidence":2,"iterationTokens":null,"asi":{"arch":"rope_dims=32","conclusion":"HUGE WIN - rope32 is 2% better than baseline","result":"MASSIVE BEST - 2% improvement"}},{"commit":"de16801","metric":2.3341,"metrics":{"artifact_mb":12.1,"best_val_bpb":2.3341,"steps":1100},"status":"discard","description":"ROPE 32 + WD 0.15: 2.334, slightly worse than rope32 alone","timestamp":1777186873742,"segment":0,"confidence":1.5686274509803841,"iterationTokens":null,"asi":{"arch":"rope_dims=32 + wd=0.15","conclusion":"adding wd15 to rope32 doesn't help further"}},{"commit":"de16801","metric":2.3314,"metrics":{"artifact_mb":12.1,"best_val_bpb":2.3314,"steps":1100},"status":"discard","description":"ROPE 32 + WD 0.10: 2.331, same as rope32","timestamp":1777189126449,"segment":0,"confidence":1.5635179153094503,"iterationTokens":null,"asi":{"arch":"rope_dims=32 + wd=0.10","conclusion":"wd=0.10 no benefit over rope32 alone"}},{"commit":"de16801","metric":2.3493,"metrics":{"artifact_mb":12.1,"best_val_bpb":2.3493,"steps":1100},"status":"discard","description":"ROPE 48 dims: 2.349, worse than rope32","timestamp":1777191365822,"segment":0,"confidence":1.4906832298136656,"iterationTokens":null,"asi":{"arch":"rope_dims=48","conclusion":"rope48 worse than rope32 - sweet spot around rope32"}},{"commit":"de16801","metric":2.3564,"metrics":{"artifact_mb":12.1,"best_val_bpb":2.3564,"steps":1100},"status":"discard","description":"ROPE 28 dims: 2.356, confirms rope32 is the peak","timestamp":1777193581685,"segment":0,"confidence":1.6466552315609053,"iterationTokens":null,"asi":{"arch":"rope_dims=28","conclusion":"rope28 worse than rope32 - confirms peak around 32"}}],"bestMetric":2.379,"bestDirection":"lower","metricName":"val_bpb","metricUnit":"bpb","secondaryMetrics":[{"name":"best_val_bpb","unit":""},{"name":"steps","unit":""},{"name":"artifact_mb","unit":"mb"}],"name":"Parameter Golf - Find Best Config for Sub-1 BPB","currentSegment":0,"maxExperiments":null,"confidence":1.6466552315609053},"wallClockSeconds":null},"isError":false,"timestamp":1777193581735}}
{"type":"message","id":"c5771e10","parentId":"85adbb98","timestamp":"2026-04-26T08:53:04.958Z","message":{"role":"assistant","content":[{"type":"thinking","thinking":"Confirmed: ROPE_DIMS=32 is optimal. Now let me try combining rope32 with other improvements. Since TTT is broken and wd15 didn't help with rope32, let me try:\n\n1. ROPE32 + lower LR (0.0005)\n2. ROPE32 + longer warmdown (0.75)\n3. ROPE32 + QK gain adjustment\n4. ROPE32 + different MLP mult\n","thinkingSignature":"9dfd688ca5d76360c6740c0493975372ecfb78b7d0a6e8687e30d8d38d129397"},{"type":"toolCall","id":"call_function_o9nv9jm4e7jc_1","name":"bash","arguments":{"command":"cd /Users/dhruv2mars/dev/github/parameter-golf && python3 experiments/pg_autoresearch.py run --name \"ar_rope32_lr0005_$(date +%Y%m%d)\" --env \"ITERATIONS=7000\" --env \"MAX_WALLCLOCK_SECONDS=1800\" --env \"ROPE_DIMS=32\" --env \"MATRIX_LR=0.0005\" --timeout 2400 2>&1"}}],"api":"anthropic-messages","provider":"minimax","model":"MiniMax-M2.7","usage":{"input":338,"output":213,"cacheRead":67744,"cacheWrite":0,"totalTokens":68295,"cost":{"input":0.0001014,"output":0.0002556,"cacheRead":0.00406464,"cacheWrite":0,"total":0.004421639999999999}},"stopReason":"toolUse","timestamp":1777193581738,"responseId":"063d056e3311c03a59ca9019a5761b06"}}
{"type":"message","id":"47005ea2","parentId":"c5771e10","timestamp":"2026-04-26T09:29:49.430Z","message":{"role":"toolResult","toolCallId":"call_function_o9nv9jm4e7jc_1","toolName":"bash","content":[{"type":"text","text":"{\"best_val_bpb\": 2.3319, \"compressed_bytes\": null, \"error\": null, \"metric\": 2.3319, \"non_finite\": false, \"output\": \"/Users/dhruv2mars/dev/github/parameter-golf/experiments/kaggle_results/pg-auto-ar-rope32-lr0005-20260426-93585\", \"ref\": \"dhruv2mars/pg-auto-ar-rope32-lr0005-20260426-93585\", \"runtime_seconds\": null, \"status\": \"KernelWorkerStatus.COMPLETE\", \"steps\": 1200, \"ttt_val_bpb\": null, \"val_bpb\": 2.3319}\n"}],"isError":false,"timestamp":1777195789430}}
{"type":"message","id":"7c49a790","parentId":"47005ea2","timestamp":"2026-04-26T09:29:58.037Z","message":{"role":"assistant","content":[{"type":"thinking","thinking":"Same as rope32 alone. Let me try combining rope32 with higher EMA decay.","thinkingSignature":"6ff3a7b604e10f40cda15f6633d91fc3e3a30672e7f2d036489fd62091e73663"},{"type":"toolCall","id":"call_function_m8j206ndmevl_1","name":"log_experiment","arguments":{"asi":{"arch":"rope_dims=32 + lr=0.0005","conclusion":"lower LR no further benefit with rope32"},"commit":"de16801","description":"ROPE 32 + LR 0.0005: 2.332, same as rope32","metric":2.3319,"metrics":{"artifact_mb":12.1,"best_val_bpb":2.3319,"steps":1200},"status":"discard"}}],"api":"anthropic-messages","provider":"minimax","model":"MiniMax-M2.7","usage":{"input":68369,"output":175,"cacheRead":0,"cacheWrite":0,"totalTokens":68544,"cost":{"input":0.0205107,"output":0.00020999999999999998,"cacheRead":0,"cacheWrite":0,"total":0.020720699999999998}},"stopReason":"toolUse","timestamp":1777195789432,"responseId":"063d0e114e04d4f4253ca8c6e0da4171"}}
