{"type":"message","id":"4004b5d2","parentId":"fa996b06","timestamp":"2026-04-27T09:24:07.296Z","message":{"role":"assistant","content":[{"type":"thinking","thinking":"Now let me check the training dynamics of the 4-hour run:","thinkingSignature":"67218b540a78cdc45ff7e4c528611bbb70118b6e70b1bde20ca3837788dd56e0"},{"type":"toolCall","id":"call_function_zqbt64r8i0gq_1","name":"bash","arguments":{"command":"cat /Users/dhruv2mars/dev/github/parameter-golf/experiments/kaggle_results/pg-auto-ar-4hr-extended-20260427-66952/logs/*.txt 2>/dev/null | grep \"val_bpb\" | tail -20"}}],"api":"anthropic-messages","provider":"minimax","model":"MiniMax-M2.7","usage":{"input":100981,"output":95,"cacheRead":9711,"cacheWrite":0,"totalTokens":110787,"cost":{"input":0.0302943,"output":0.00011399999999999999,"cacheRead":0.0005826599999999999,"cacheWrite":0,"total":0.030990959999999998}},"stopReason":"toolUse","timestamp":1777281839433,"responseId":"063e5e33489d1cd9c2eea2014a1a2775"}}
{"type":"message","id":"4205b9d2","parentId":"4004b5d2","timestamp":"2026-04-27T09:24:07.313Z","message":{"role":"toolResult","toolCallId":"call_function_zqbt64r8i0gq_1","toolName":"bash","content":[{"type":"text","text":"step=8250 val_loss=4.0777 val_bpb=1.8917 best_bpb=1.8824 elapsed_s=13068\nstep=8300 val_loss=4.2154 val_bpb=1.9556 best_bpb=1.8824 elapsed_s=13148\nstep=8350 val_loss=4.0713 val_bpb=1.8888 best_bpb=1.8824 elapsed_s=13227\nstep=8400 val_loss=4.0979 val_bpb=1.9011 best_bpb=1.8824 elapsed_s=13306\nstep=8450 val_loss=4.0509 val_bpb=1.8793 best_bpb=1.8793 elapsed_s=13384\nstep=8500 val_loss=4.0647 val_bpb=1.8857 best_bpb=1.8793 elapsed_s=13464\nstep=8550 val_loss=4.0631 val_bpb=1.8849 best_bpb=1.8793 elapsed_s=13543\nstep=8600 val_loss=4.0749 val_bpb=1.8904 best_bpb=1.8793 elapsed_s=13622\nstep=8650 val_loss=4.0448 val_bpb=1.8765 best_bpb=1.8765 elapsed_s=13700\nstep=8700 val_loss=4.0386 val_bpb=1.8736 best_bpb=1.8736 elapsed_s=13780\nstep=8750 val_loss=4.0477 val_bpb=1.8778 best_bpb=1.8736 elapsed_s=13860\nstep=8800 val_loss=4.0441 val_bpb=1.8761 best_bpb=1.8736 elapsed_s=13939\nstep=8850 val_loss=4.0423 val_bpb=1.8753 best_bpb=1.8736 elapsed_s=14018\nstep=8900 val_loss=4.0361 val_bpb=1.8724 best_bpb=1.8724 elapsed_s=14097\nstep=8950 val_loss=4.0785 val_bpb=1.8921 best_bpb=1.8724 elapsed_s=14176\nstep=9000 val_loss=4.0462 val_bpb=1.8771 best_bpb=1.8724 elapsed_s=14255\nstep=9050 val_loss=4.0568 val_bpb=1.8820 best_bpb=1.8724 elapsed_s=14334\n[4/6] Training complete. Best val_bpb: 1.8724\nfinal_val_bpb=1.8724 total_steps=9092 total_time_s=14472 artifact_bytes=15666163 code_bytes=38981 total_bytes=15705144\n[4/6] Training complete. Best val_bpb: inf\n"}],"isError":false,"timestamp":1777281847313}}
{"type":"message","id":"c977aa70","parentId":"4205b9d2","timestamp":"2026-04-27T09:24:30.127Z","message":{"role":"assistant","content":[{"type":"thinking","thinking":"Important observation: the 4-hour run hit the **iteration cap** (9000 steps out of 50000) before hitting the wallclock cap (14400s). So we actually didn't use all the time - the model would have continued improving if allowed.\n\nAnd the artifact is now 15.7 MB (14.6MB model + 38981 bytes code). That's over 16MB! The total_bytes is 15,705,144 which exceeds the 16,000,000 limit.\n\nWait, that's a problem. The artifact with 4 hours of training is 15.7MB. That's just under the limit but very close. If we train longer, the model might get even larger.\n\n\nActually, checking the leaderboard format more carefully - the compressed model file is what gets submitted, not the total bytes. The compressed artifact is 15,666,163 bytes, which is well under the limit, so the submission should be fine.\n\nThe code overhead is tiny at 38,981 bytes, bringing the total to about 15.7MB, so there's still room for improvement. The model is still improving at step 9000 with 1.872 BPB, and if I extend training to 6 hours it could reach around 1.82 BPB, while 12 hours might get it down to 1.70-1.75 BPB - but even that leaves a significant gap to the sub-1 BPB target.\n\nThe real constraint is that PPM is the only path to sub-1, and I need to figure out what PPM actually means in this context. Looking at the code and documentation, it seems to be a compression technique that adds a secondary byte-level or character-level model to the primary BPE model, potentially using a PPM or zstd-based approach to capture byte-level patterns that the main model misses. This would be a substantial feature to implement. Looking at the training logs, the 4-hour run shows the model is still improving at step 9000 but has hit the iteration limit, so extending to more iterations could help push toward sub-1 BPB. I'll schedule a 12-hour run with the current best hyperparameters and higher iteration count while I implement the PPM compression approach to test both strategies in parallel.","thinkingSignature":"7b61f130f94c1a992e9c7938f9211a67e2a2663b33cbd4280f1dea960c5144b8"},{"type":"text","text":"Key data from 4-hr run:\n- Still improving at step 9000 (1.872 BPB)\n- Hit iteration cap, not wallclock cap\n- Artifact: 15.7MB (just under 16MB limit)\n\nModel is **still learning strongly**. Let me run a 12-hr session to see if extended training alone can close the gap further:\n"},{"type":"toolCall","id":"call_function_s9by6vwqnuon_1","name":"bash","arguments":{"command":"cd /Users/dhruv2mars/dev/github/parameter-golf && python3 experiments/pg_autoresearch.py run --name \"ar_12hr_extended_$(date +%Y%m%d)\" --env \"ITERATIONS=50000\" --env \"MAX_WALLCLOCK_SECONDS=43200\" --env \"ROPE_DIMS=32\" --env \"EMA_DECAY=0.994\" --env \"GRAD_CLIP_NORM=0.3\" --env \"QK_GAIN_INIT=4.0\" --env \"WARMDOWN_FRAC=0.80\" --env \"MATRIX_LR=0.0008\" --timeout 60000 2>&1"}}],"api":"anthropic-messages","provider":"minimax","model":"MiniMax-M2.7","usage":{"input":101724,"output":715,"cacheRead":9711,"cacheWrite":0,"totalTokens":112150,"cost":{"input":0.030517199999999998,"output":0.0008579999999999999,"cacheRead":0.0005826599999999999,"cacheWrite":0,"total":0.03195786}},"stopReason":"toolUse","timestamp":1777281847321,"responseId":"063e5e3891df008c974e4ccafdce3bc4"}}
{"type":"message","id":"a94be650","parentId":"c977aa70","timestamp":"2026-04-27T09:24:47.081Z","message":{"role":"toolResult","toolCallId":"call_function_s9by6vwqnuon_1","toolName":"bash","content":[{"type":"text","text":"Command aborted"}],"details":{},"isError":true,"timestamp":1777281887081}}
{"type":"message","id":"c0b51f46","parentId":"a94be650","timestamp":"2026-04-27T09:24:47.087Z","message":{"role":"assistant","content":[],"api":"anthropic-messages","provider":"minimax","model":"MiniMax-M2.7","usage":{"input":0,"output":0,"cacheRead":0,"cacheWrite":0,"totalTokens":0,"cost":{"input":0,"output":0,"cacheRead":0,"cacheWrite":0,"total":0}},"stopReason":"aborted","timestamp":1777281887085,"errorMessage":"Operation aborted"}}
{"type":"message","id":"be08bb7a","parentId":"c0b51f46","timestamp":"2026-04-27T09:24:47.900Z","message":{"role":"user","content":[{"type":"text","text":"Autoresearch loop ended (likely context limit). Resume the experiment loop — read autoresearch.md and git log for context. Be careful not to overfit to the benchmarks and do not cheat on the benchmarks."}],"timestamp":1777281887891}}
{"type":"message","id":"27ae4ae5","parentId":"be08bb7a","timestamp":"2026-04-27T09:25:00.632Z","message":{"role":"assistant","content":[{"type":"thinking","thinking":"The user wants me to resume the autoresearch loop. Let me first read the autoresearch.md and git log to get context on where we left off.","thinkingSignature":"ecafc5e947b21098f50a72525afcd3c1b29e8802cfd157de6d15ad8f450dcea5"},{"type":"toolCall","id":"call_function_e34z4b4ep6ix_1","name":"read","arguments":{"path":"/Users/dhruv2mars/dev/github/parameter-golf/autoresearch.md"}},{"type":"toolCall","id":"call_function_e34z4b4ep6ix_2","name":"bash","arguments":{"command":"cd /Users/dhruv2mars/dev/github/parameter-golf && git log --oneline -20"}}],"api":"anthropic-messages","provider":"minimax","model":"MiniMax-M2.7","usage":{"input":13,"output":113,"cacheRead":1754,"cacheWrite":97731,"totalTokens":99611,"cost":{"input":0.0000039,"output":0.0001356,"cacheRead":0.00010523999999999999,"cacheWrite":0.036649125,"total":0.036893865}},"stopReason":"toolUse","timestamp":1777281887900,"responseId":"063e5e63519ed39a7bcb9620cc657510"}}
{"type":"message","id":"1b495259","parentId":"27ae4ae5","timestamp":"2026-04-27T09:25:00.658Z","message":{"role":"toolResult","toolCallId":"call_function_e34z4b4ep6ix_1","toolName":"read","content":[{"type":"text","text":"# Autoresearch: Parameter Golf - Find Best Config for Sub-1 BPB\n\n## Objective\n\nOptimize a language model under 16MB to achieve the lowest bits-per-byte (BPB) on FineWeb validation.\nEach iteration = one 30-minute Kaggle training run.\nWinner will be used for extended training (6-12hr) to hit sub-1 BPB.\n\n## Metrics\n\n- **Primary**: `val_bpb` (BPB, lower is better) — the optimization target\n- **Secondary**: `best_val_bpb`, `ttt_val_bpb`, `steps`, `compressed_bytes`, `runtime_seconds`\n\n## How to Run\n\n```bash\n./autoresearch.sh\n```\n\nOutputs `METRIC val_bpb=X` lines. Each run takes ~40 min (30 min training + buffer).\n\n## Files in Scope\n\n- `train_kaggle.py` — main training pipeline (all hyperparameters configurable via env vars)\n- `run_train.sh` — runner script (reference, not used by autoresearch)\n- `experiments/pg_autoresearch.py` — Kaggle kernel launcher/collector\n- `autoresearch.sh` — this loop's driver\n\n## Off Limits\n\n- Do NOT modify the data pipeline (FineWeb downloads, tokenizer)\n- Do NOT change vocab_size below 8192 (tokenizer is fixed)\n- Do NOT increase ITERATIONS above 7000 for the 30-min loop\n\n## Constraints\n\n- Model must fit under 16MB (checked at submission)\n- 30-min wallclock cap per run\n- Training must be stable (no NaN/Inf)\n\n## Search Space\n\n### Architecture (env vars in train_kaggle.py)\n\n| Parameter | Current | Search Range | Notes |\n|-----------|---------|--------------|-------|\n| NUM_LAYERS | 11 | 8-14 | More layers = more capacity but slower |\n| MODEL_DIM | 512 | 384-640 | Width of model |\n| NUM_HEADS | 8 | 4-16 | Attention heads |\n| NUM_KV_HEADS | 4 | 2-8 | KV heads for GQA |\n| MLP_MULT | 4 | 2-6 | MLP hidden dim = dim * mult |\n| ROPE_DIMS | 16 | 8-32 | RoPE dimensions |\n| QK_GAIN_INIT | 5.25 | 3.0-8.0 | QK scaling per head |\n| NUM_LOOPS | 2 | 1-4 | Depth recurrence loops |\n| LOOP_START | 3 | 2-6 | First layer to loop |\n| LOOP_END | 5 | 4-8 | Last layer to loop |\n\n### Hyperparameters\n\n| Parameter | Current | Search Range |\n|-----------|---------|--------------|\n| MATRIX_LR | 0.001 | 0.0001-0.005 |\n| WEIGHT_DECAY | 0.095 | 0.01-0.2 |\n| EMA_DECAY | 0.9965 | 0.99-0.999 |\n| WARMDOWN_FRAC | 0.72 | 0.6-0.85 |\n| GRAD_CLIP_NORM | 1.0 | 0.3-2.0 |\n| TIE_EMBED_LR_RATIO | 1.0 | 0.1-2.0 |\n\n### TTT (Test-Time Training)\n\n| Parameter | Current | Search Range |\n|-----------|---------|--------------|\n| TTT_ENABLED | 0 | 0 or 1 |\n| TTT_LR | 0.005 | 0.001-0.02 |\n| TTT_EPOCHS | 3 | 1-5 |\n| TTT_WARMUP_TOKENS | 32768 | 8192-131072 |\n\n### Quantization\n\n| Parameter | Current | Search Range |\n|-----------|---------|--------------|\n| MATRIX_CLIP_SIGMAS | 12.85 | 8-20 |\n| EMBED_CLIP_SIGMAS | 20.0 | 10-30 |\n\n### Training\n\n| Parameter | Current | Search Range |\n|-----------|---------|--------------|\n| TRAIN_BATCH_TOKENS | 8192 | 4096-32768 |\n| TRAIN_SEQ_LEN | 512 | 256-1024 |\n| GRAD_ACCUM_STEPS | 1 | 1-4 |\n\n## What's Been Tried\n\n### Key Discoveries (32+ experiments)\n\n1. **ROPE_DIMS 32 = MAJOR WIN** (+2% over baseline)\n   - Sweet spot is 32 dims (tested 8, 16, 24, 28, 32, 48)\n   - rope8=2.49, rope24=2.36, rope32=2.33, rope48=2.35\n   \n2. **EMA_DECAY 0.994 > 0.9965** (+0.2%)\n   - Lower decay = faster EMA update helps convergence\n   - ema0.994 → 2.326, ema0.9965 → 2.331\n\n3. **GRAD_CLIP_NORM 0.3 = SWEET SPOT** (+0.6%)\n   - clip0.2→2.312, clip0.3→2.309, clip0.4→2.313, clip1.0→2.331\n   - Tighter clipping helps training stability\n\n4. **QK_GAIN 4.5 > 5.25** (+0.1%)\n   - qk4.5 → 2.310, qk5.0 → 2.318, qk6.0 → 2.319\n   - Original 5.25 was good but 4.5 is better\n\n5. **Current best config**: rope32 + ema0.994 + clip0.3 + qk4.5 = 2.310 BPB\n   - 2.9% better than baseline\n\n### Failed Experiments\n- **TTT**: broken (OOM + dtype issues) - needs fix before use\n- Wider architecture (640d): too slow, hit wallclock early\n- Deeper (13L-480d): underfits\n- Seq 1024: fewer steps per time = worse\n- More depth loops (3x): slower = worse\n- Higher LR (0.002): worse convergence\n- Lower WD (0.05): worse\n- ROPE 48 dims: worse than rope32\n- EMA 0.999: too slow convergence\n\n### ROPE base & KV exploration\n- rope_base 5000 → 2.301, worse than 10000 ✓\n- rope_base 20000 → 2.325, much worse ✓\n- 2 KV heads → 2.301, slightly worse than 4 ✓\n\n### Current best config (30-min runs)\n```\nROPE_DIMS=32          # +2% - BIGGEST WIN\nEMA_DECAY=0.994       # +0.2%\nGRAD_CLIP_NORM=0.3    # +0.6%\nQK_GAIN_INIT=4.0      # +0.1%\nWARMDOWN_FRAC=0.80    # small gain\nMATRIX_LR=0.0008      # lower LR helps slightly\nNUM_LAYERS=11         # keep\nMODEL_DIM=512         # keep\n```\n\n**Result: 2.30 val_bpb in 30 min (1100-1200 steps)**\n**Gap to sub-1: ~1.3 BPB — needs extended training + PPM**\n\n## Loop Strategy\n\n1. ✓ Establish 30-min baseline: 2.38 BPB\n2. ✓ Architecture exploration: ROPE_DIMS 32 is best (+2%)\n3. ✓ Hyperparameter tuning: EMA, clip, warmdown, LR, QK\n4. ✗ TTT: broken on T4 (OOM)\n5. ⏳ Extended training: needed to close gap to sub-1\n6. ⏳ PPM: not yet implemented\n\n## Extended Training Strategy\n- Current best: 2.30 BPB in 30 min\n- Extended (6hr): estimated ~1.7-1.9 BPB\n- Extended + PPM: estimated ~0.8-1.0 BPB\n- Run extended training on best config when ready\n- PPM implementation is the key to sub-1\n\n## Notes\n\n- T4 is ~3x slower than H100, so 30-min on T4 ≈ 10-min on H100\n- Sub-1 BPB likely requires: extended training (6hr+) + TTT + good architecture\n- Each run takes ~40 min (30 min training + 10 min queue/overhead)\n- Loop runs indefinitely until manually stopped\n"}],"isError":false,"timestamp":1777281900658}}
{"type":"message","id":"62ad119c","parentId":"1b495259","timestamp":"2026-04-27T09:25:00.659Z","message":{"role":"toolResult","toolCallId":"call_function_e34z4b4ep6ix_2","toolName":"bash","content":[{"type":"text","text":"f0a8b35 autoresearch: update with extended training strategy\n8f3abc1 autoresearch: 32 runs done, key discoveries documented\nde16801 fix: attention scores use bf16 instead of float32 to avoid OOM\ne8ecad4 fix: CastedLinear dtype to match input\na672845 autoresearch: add 30-min loop setup\n6f4f113 feat: add architecture verification experiment runner\nb4e50db docs: add ARCHITECTURE.md blueprint for sub-1 BPB\n315ea0f fix: grad_accum=1 for faster step rate in quick runs\n7ff3dc3 chore: update autoresearch to use stable kernel\n235b988 chore: repo cleanup and stable training pipeline\nedb5949 experiment: raise lr with legal int6 pack\nf65c3fb experiment: pack matrix artifact as int6\n838510e experiment: restore legal fast lr\n7afde7a experiment: tighten int8 clip for cap\nd1acc3e experiment: test legal mid lr\n52c1ea5 experiment: test higher fast-proxy lr\nb415410 experiment: raise AdamW lr for fast proxy\na1bb294 experiment: speed updates with single accumulation\n0d01198 experiment: restore AdamW single-entry verify\n639a399 experiment: inline Kaggle training wrapper\n"}],"isError":false,"timestamp":1777281900658}}
