{"type":"message","id":"4e6cee5f","parentId":"53c610ce","timestamp":"2026-04-27T11:48:43.891Z","message":{"role":"assistant","content":[{"type":"thinking","thinking":"There's only one teamspace - default-project. But there are no studios in it. The user said \"there are no studios there\" - so maybe the studio isn't in default-project. The URL was `https://lightning.ai/dhruv2mars/default-project/studios/parameter-golf/code` which suggests the studio is in the default-project teamspace.\n\nWait, maybe the studio isn't running or isn't listed. Let me check if the studio name is different or if it needs to be created. Or maybe I need to use a different approach to list studios.\n\nLet me check the studio.run method to see if I can run commands.","thinkingSignature":"fc12186baaa7cdbf299c754a6ddbd45cb0572ea46d15b6ad0f641d3c97bca991"},{"type":"toolCall","id":"call_function_frm43jqpvlnx_1","name":"bash","arguments":{"command":"source ~/.venv/pg/bin/activate && python -c \"\nfrom lightning_sdk import Studio\nimport os\n\nos.environ['LIGHTNING_USER_ID'] = 'd52587bc-ec3c-4c9c-a2fa-71246e3d4020'\nos.environ['LIGHTNING_API_KEY'] = '25da12f4-1ad8-4e3f-8ba4-2a60fcebaabe'\n\n# Try to create/get studio by name\nstudio = Studio(name='parameter-golf', user='dhruv2mars')\nprint('Studio:', studio.name)\nprint('Status:', studio.status)\nprint('Teamspace:', studio.teamspace)\n\" 2>&1"}}],"api":"anthropic-messages","provider":"minimax","model":"MiniMax-M2.7","usage":{"input":69958,"output":301,"cacheRead":9348,"cacheWrite":0,"totalTokens":79607,"cost":{"input":0.0209874,"output":0.0003612,"cacheRead":0.0005608799999999999,"cacheWrite":0,"total":0.02190948}},"stopReason":"toolUse","timestamp":1777290514577,"responseId":"063e80158cf2773fade811c4995b7b8a"}}
{"type":"message","id":"91075e1c","parentId":"4e6cee5f","timestamp":"2026-04-27T11:48:45.019Z","message":{"role":"toolResult","toolCallId":"call_function_frm43jqpvlnx_1","toolName":"bash","content":[{"type":"text","text":"Traceback (most recent call last):\n  File \"<string>\", line 9, in <module>\n    studio = Studio(name='parameter-golf', user='dhruv2mars')\n  File \"/Users/dhruv2mars/.venv/pg/lib/python3.14/site-packages/lightning_sdk/utils/logging.py\", line 37, in wrapper\n    return func(*args, **kwargs)\n  File \"/Users/dhruv2mars/.venv/pg/lib/python3.14/site-packages/lightning_sdk/studio.py\", line 99, in __init__\n    raise ValueError(\"Couldn't resolve teamspace from the provided name, org, or user\")\nValueError: Couldn't resolve teamspace from the provided name, org, or user\n\n\nCommand exited with code 1"}],"details":{},"isError":true,"timestamp":1777290525019}}
{"type":"message","id":"a4bfdf06","parentId":"91075e1c","timestamp":"2026-04-27T11:48:51.541Z","message":{"role":"assistant","content":[{"type":"thinking","thinking":"Let me try with teamspace parameter.","thinkingSignature":"c2fde6d0af1ba498fc5afb0aebcd36759c1dce08f047f858f7a6556251b9b4aa"},{"type":"toolCall","id":"call_function_vqv3nopjbm2r_1","name":"bash","arguments":{"command":"source ~/.venv/pg/bin/activate && python -c \"\nfrom lightning_sdk import Studio, Teamspace\nimport os\n\nos.environ['LIGHTNING_USER_ID'] = 'd52587bc-ec3c-4c9c-a2fa-71246e3d4020'\nos.environ['LIGHTNING_API_KEY'] = '25da12f4-1ad8-4e3f-8ba4-2a60fcebaabe'\n\n# Get teamspace\nts = Teamspace(name='default-project', user='dhruv2mars')\n\n# Try to create/get studio by name\nstudio = Studio(name='parameter-golf', teamspace=ts)\nprint('Studio:', studio.name)\nprint('Status:', studio.status)\n\" 2>&1"}}],"api":"anthropic-messages","provider":"minimax","model":"MiniMax-M2.7","usage":{"input":70437,"output":192,"cacheRead":9348,"cacheWrite":0,"totalTokens":79977,"cost":{"input":0.0211311,"output":0.0002304,"cacheRead":0.0005608799999999999,"cacheWrite":0,"total":0.021922379999999998}},"stopReason":"toolUse","timestamp":1777290525024,"responseId":"063e801e26c53c3a2ca11cc85c8c63d1"}}
{"type":"message","id":"c65216e6","parentId":"a4bfdf06","timestamp":"2026-04-27T11:48:55.372Z","message":{"role":"toolResult","toolCallId":"call_function_vqv3nopjbm2r_1","toolName":"bash","content":[{"type":"text","text":"Studio: parameter-golf\nStatus: Stopped\n"}],"isError":false,"timestamp":1777290535372}}
{"type":"message","id":"a2141fb8","parentId":"c65216e6","timestamp":"2026-04-27T11:49:00.196Z","message":{"role":"assistant","content":[{"type":"thinking","thinking":"The studio is there but it's Stopped. Let me start it and then run a command.","thinkingSignature":"45696898d8bc8fba0d5f62e58545e75b4c6495b454e649a8e00ccdb31a938ef7"},{"type":"text","text":"Studio exists but **Stopped**. Let me start it:\n"},{"type":"toolCall","id":"call_function_xxqdwr7amsft_1","name":"bash","arguments":{"command":"source ~/.venv/pg/bin/activate && python -c \"\nfrom lightning_sdk import Studio, Teamspace\nimport os\n\nos.environ['LIGHTNING_USER_ID'] = 'd52587bc-ec3c-4c9c-a2fa-71246e3d4020'\nos.environ['LIGHTNING_API_KEY'] = '25da12f4-1ad8-4e3f-8ba4-2a60fcebaabe'\n\nts = Teamspace(name='default-project', user='dhruv2mars')\nstudio = Studio(name='parameter-golf', teamspace=ts)\nprint('Starting studio...')\nstudio.start()\nprint('Status:', studio.status)\n\" 2>&1"}}],"api":"anthropic-messages","provider":"minimax","model":"MiniMax-M2.7","usage":{"input":70655,"output":202,"cacheRead":9348,"cacheWrite":0,"totalTokens":80205,"cost":{"input":0.0211965,"output":0.00024239999999999998,"cacheRead":0.0005608799999999999,"cacheWrite":0,"total":0.02199978}},"stopReason":"toolUse","timestamp":1777290535376,"responseId":"063e802791abce515080ec300cfd6aac"}}
{"type":"message","id":"9c827260","parentId":"a2141fb8","timestamp":"2026-04-27T11:50:30.695Z","message":{"role":"toolResult","toolCallId":"call_function_xxqdwr7amsft_1","toolName":"bash","content":[{"type":"text","text":"Starting studio...\nStatus: Running\n"}],"isError":false,"timestamp":1777290630695}}
{"type":"message","id":"493a7fbc","parentId":"9c827260","timestamp":"2026-04-27T11:50:39.200Z","message":{"role":"assistant","content":[{"type":"thinking","thinking":"The studio is now running. Let me wait a bit and then run a command.","thinkingSignature":"b883e3faf4f2916eeadbdfa2d7bb682caa589803acbc51760cac9c7fa70bf087"},{"type":"toolCall","id":"call_function_pn2cgtozuhco_1","name":"bash","arguments":{"command":"sleep 15 && source ~/.venv/pg/bin/activate && python -c \"\nfrom lightning_sdk import Studio, Teamspace\nimport os\n\nos.environ['LIGHTNING_USER_ID'] = 'd52587bc-ec3c-4c9c-a2fa-71246e3d4020'\nos.environ['LIGHTNING_API_KEY'] = '25da12f4-1ad8-4e3f-8ba4-2a60fcebaabe'\n\nts = Teamspace(name='default-project', user='dhruv2mars')\nstudio = Studio(name='parameter-golf', teamspace=ts)\nprint('Status:', studio.status)\n\n# Run a command\nprint('Running command...')\nresult = studio.run('pwd')\nprint('Output:', result)\n\" 2>&1"}}],"api":"anthropic-messages","provider":"minimax","model":"MiniMax-M2.7","usage":{"input":70879,"output":208,"cacheRead":9348,"cacheWrite":0,"totalTokens":80435,"cost":{"input":0.0212637,"output":0.0002496,"cacheRead":0.0005608799999999999,"cacheWrite":0,"total":0.02207418}},"stopReason":"toolUse","timestamp":1777290630699,"responseId":"063e808ad8e524507e75ffb2cc2d8595"}}
{"type":"message","id":"1c019f17","parentId":"493a7fbc","timestamp":"2026-04-27T11:51:01.507Z","message":{"role":"toolResult","toolCallId":"call_function_pn2cgtozuhco_1","toolName":"bash","content":[{"type":"text","text":"Status: Running\nRunning command...\nOutput: /teamspace/studios/this_studio\n"}],"isError":false,"timestamp":1777290661507}}
{"type":"message","id":"01a4b92c","parentId":"1c019f17","timestamp":"2026-04-27T11:51:11.720Z","message":{"role":"assistant","content":[{"type":"thinking","thinking":"Excellent! It works! Now let me run a quick training test.","thinkingSignature":"693c5b5de3c245f65786b2902e465b17db2547fbdfd8cde72cb807cdec30eb32"},{"type":"text","text":"**CLI working!** Let me run a quick 1-min training test:\n"},{"type":"toolCall","id":"call_function_rszeej1531p8_1","name":"bash","arguments":{"command":"source ~/.venv/pg/bin/activate && python -c \"\nfrom lightning_sdk import Studio, Teamspace\nimport os\n\nos.environ['LIGHTNING_USER_ID'] = 'd52587bc-ec3c-4c9c-a2fa-71246e3d4020'\nos.environ['LIGHTNING_API_KEY'] = '25da12f4-1ad8-4e3f-8ba4-2a60fcebaabe'\n\nts = Teamspace(name='default-project', user='dhruv2mars')\nstudio = Studio(name='parameter-golf', teamspace=ts)\n\n# Run quick training test\ncmd = 'cd /teamspace/studios/this_studio/parameter-golf && ITERATIONS=50 MAX_WALLCLOCK=60 python3 train_kaggle.py 2>&1'\nprint('Running:', cmd)\nresult = studio.run(cmd, detatch=False)\nprint('Output:', result)\n\" 2>&1","timeout_seconds":"120"}}],"api":"anthropic-messages","provider":"minimax","model":"MiniMax-M2.7","usage":{"input":71122,"output":266,"cacheRead":9348,"cacheWrite":0,"totalTokens":80736,"cost":{"input":0.0213366,"output":0.0003192,"cacheRead":0.0005608799999999999,"cacheWrite":0,"total":0.02221668}},"stopReason":"toolUse","timestamp":1777290661512,"responseId":"063e80a82facfa0f7ee094035c09dfd5"}}
{"type":"message","id":"d5d1645a","parentId":"01a4b92c","timestamp":"2026-04-27T11:51:16.035Z","message":{"role":"toolResult","toolCallId":"call_function_rszeej1531p8_1","toolName":"bash","content":[{"type":"text","text":"Traceback (most recent call last):\n  File \"<string>\", line 14, in <module>\n    result = studio.run(cmd, detatch=False)\n  File \"/Users/dhruv2mars/.venv/pg/lib/python3.14/site-packages/lightning_sdk/utils/logging.py\", line 21, in wrapper\n    bound_args = sig.bind(*args, **kwargs)\n  File \"/opt/homebrew/Cellar/python@3.14/3.14.4/Frameworks/Python.framework/Versions/3.14/lib/python3.14/inspect.py\", line 3236, in bind\n    return self._bind(args, kwargs)\n           ~~~~~~~~~~^^^^^^^^^^^^^^\n  File \"/opt/homebrew/Cellar/python@3.14/3.14.4/Frameworks/Python.framework/Versions/3.14/lib/python3.14/inspect.py\", line 3225, in _bind\n    raise TypeError(\n        'got an unexpected keyword argument {arg!r}'.format(\n            arg=next(iter(kwargs))))\nTypeError: got an unexpected keyword argument 'detatch'\nRunning: cd /teamspace/studios/this_studio/parameter-golf && ITERATIONS=50 MAX_WALLCLOCK=60 python3 train_kaggle.py 2>&1\n\n\nCommand exited with code 1"}],"details":{},"isError":true,"timestamp":1777290676035}}
{"type":"message","id":"fc4993ee","parentId":"d5d1645a","timestamp":"2026-04-27T11:51:24.425Z","message":{"role":"assistant","content":[{"type":"thinking","thinking":"Typo - detatch should be detach. Let me fix it.","thinkingSignature":"64fdf6826666bb31d9725ff1c528e4703a260b291c17e011c20c4e25bf377e94"},{"type":"toolCall","id":"call_function_r6mwx6sitqff_1","name":"bash","arguments":{"command":"source ~/.venv/pg/bin/activate && python -c \"\nfrom lightning_sdk import Studio, Teamspace\nimport os\n\nos.environ['LIGHTNING_USER_ID'] = 'd52587bc-ec3c-4c9c-a2fa-71246e3d4020'\nos.environ['LIGHTNING_API_KEY'] = '25da12f4-1ad8-4e3f-8ba4-2a60fcebaabe'\n\nts = Teamspace(name='default-project', user='dhruv2mars')\nstudio = Studio(name='parameter-golf', teamspace=ts)\n\n# Run quick training test\ncmd = 'cd /teamspace/studios/this_studio/parameter-golf && ITERATIONS=50 MAX_WALLCLOCK=60 python3 train_kaggle.py 2>&1'\nprint('Running training test...')\nresult = studio.run(cmd, timeout=90)\nprint('Output:', result)\n\" 2>&1","timeout_seconds":"120"}}],"api":"anthropic-messages","provider":"minimax","model":"MiniMax-M2.7","usage":{"input":71685,"output":252,"cacheRead":9348,"cacheWrite":0,"totalTokens":81285,"cost":{"input":0.0215055,"output":0.0003024,"cacheRead":0.0005608799999999999,"cacheWrite":0,"total":0.02236878}},"stopReason":"toolUse","timestamp":1777290676040,"responseId":"063e80b61970d701b941b2043ffc1de9"}}
{"type":"message","id":"109e7924","parentId":"fc4993ee","timestamp":"2026-04-27T11:51:28.723Z","message":{"role":"toolResult","toolCallId":"call_function_r6mwx6sitqff_1","toolName":"bash","content":[{"type":"text","text":"Traceback (most recent call last):\n  File \"<string>\", line 14, in <module>\n    result = studio.run(cmd, timeout=90)\n  File \"/Users/dhruv2mars/.venv/pg/lib/python3.14/site-packages/lightning_sdk/utils/logging.py\", line 21, in wrapper\n    bound_args = sig.bind(*args, **kwargs)\n  File \"/opt/homebrew/Cellar/python@3.14/3.14.4/Frameworks/Python.framework/Versions/3.14/lib/python3.14/inspect.py\", line 3236, in bind\n    return self._bind(args, kwargs)\n           ~~~~~~~~~~^^^^^^^^^^^^^^\n  File \"/opt/homebrew/Cellar/python@3.14/3.14.4/Frameworks/Python.framework/Versions/3.14/lib/python3.14/inspect.py\", line 3225, in _bind\n    raise TypeError(\n        'got an unexpected keyword argument {arg!r}'.format(\n            arg=next(iter(kwargs))))\nTypeError: got an unexpected keyword argument 'timeout'\nRunning training test...\n\n\nCommand exited with code 1"}],"details":{},"isError":true,"timestamp":1777290688723}}
{"type":"message","id":"16adc49d","parentId":"109e7924","timestamp":"2026-04-27T11:51:35.485Z","message":{"role":"assistant","content":[{"type":"thinking","thinking":"Let me check what parameters the run method accepts.","thinkingSignature":"c4bf94c7ed5d1456f0c2a87de6ed1caf8c03435ab3c110003da3b9c0c411e58a"},{"type":"toolCall","id":"call_function_8j7mno8wyw3c_1","name":"bash","arguments":{"command":"source ~/.venv/pg/bin/activate && python -c \"\nfrom lightning_sdk import Studio\nimport inspect\nprint(inspect.signature(Studio.run))\n\" 2>&1"}}],"api":"anthropic-messages","provider":"minimax","model":"MiniMax-M2.7","usage":{"input":72197,"output":71,"cacheRead":9348,"cacheWrite":0,"totalTokens":81616,"cost":{"input":0.0216591,"output":0.0000852,"cacheRead":0.0005608799999999999,"cacheWrite":0,"total":0.02230518}},"stopReason":"toolUse","timestamp":1777290688727,"responseId":"063e80c3ed9c92aeba2f12a605604153"}}
{"type":"message","id":"a0766594","parentId":"16adc49d","timestamp":"2026-04-27T11:51:36.196Z","message":{"role":"toolResult","toolCallId":"call_function_8j7mno8wyw3c_1","toolName":"bash","content":[{"type":"text","text":"(self, *commands: str) -> str\n"}],"isError":false,"timestamp":1777290696196}}
{"type":"message","id":"7499b69e","parentId":"a0766594","timestamp":"2026-04-27T11:51:41.961Z","message":{"role":"assistant","content":[{"type":"thinking","thinking":"It just takes commands. Let me run without timeout - it might block until done.","thinkingSignature":"ae33baf6e8aedeb4c89d34317da4ac2ee13fc915a2e6893adebd857f40509ec0"},{"type":"toolCall","id":"call_function_hmgtsglfk0mx_1","name":"bash","arguments":{"command":"source ~/.venv/pg/bin/activate && python -c \"\nfrom lightning_sdk import Studio, Teamspace\nimport os\n\nos.environ['LIGHTNING_USER_ID'] = 'd52587bc-ec3c-4c9c-a2fa-71246e3d4020'\nos.environ['LIGHTNING_API_KEY'] = '25da12f4-1ad8-4e3f-8ba4-2a60fcebaabe'\n\nts = Teamspace(name='default-project', user='dhruv2mars')\nstudio = Studio(name='parameter-golf', teamspace=ts)\n\n# Run quick training test\ncmd = 'cd /teamspace/studios/this_studio/parameter-golf && ITERATIONS=50 MAX_WALLCLOCK=60 python3 train_kaggle.py 2>&1'\nprint('Running training test...')\nresult = studio.run(cmd)\nprint('Output:', result)\n\" 2>&1","timeout_seconds":"180"}}],"api":"anthropic-messages","provider":"minimax","model":"MiniMax-M2.7","usage":{"input":72293,"output":251,"cacheRead":9348,"cacheWrite":0,"totalTokens":81892,"cost":{"input":0.0216879,"output":0.0003012,"cacheRead":0.0005608799999999999,"cacheWrite":0,"total":0.02254998}},"stopReason":"toolUse","timestamp":1777290696200,"responseId":"063e80c80965c3f1b0a509402c2f2f7f"}}
{"type":"message","id":"fd1a8539","parentId":"7499b69e","timestamp":"2026-04-27T11:51:51.479Z","message":{"role":"toolResult","toolCallId":"call_function_hmgtsglfk0mx_1","toolName":"bash","content":[{"type":"text","text":"Traceback (most recent call last):\n  File \"<string>\", line 14, in <module>\n    result = studio.run(cmd)\n  File \"/Users/dhruv2mars/.venv/pg/lib/python3.14/site-packages/lightning_sdk/utils/logging.py\", line 37, in wrapper\n    return func(*args, **kwargs)\n  File \"/Users/dhruv2mars/.venv/pg/lib/python3.14/site-packages/lightning_sdk/studio.py\", line 578, in run\n    raise RuntimeError(output)\nRuntimeError: (eval):cd:1: no such file or directory: /teamspace/studios/this_studio/parameter-golf\nRunning training test...\n\n\nCommand exited with code 1"}],"details":{},"isError":true,"timestamp":1777290711479}}
{"type":"message","id":"42d0324f","parentId":"fd1a8539","timestamp":"2026-04-27T11:51:59.322Z","message":{"role":"assistant","content":[{"type":"thinking","thinking":"Directory doesn't exist. Let me check what exists.","thinkingSignature":"d9d6c2a712cb8e0a678df2b757f44870e1a3b70552c7d6a3c72cbc37febfd7d4"},{"type":"toolCall","id":"call_function_ep31km6tdk5d_1","name":"bash","arguments":{"command":"source ~/.venv/pg/bin/activate && python -c \"\nfrom lightning_sdk import Studio, Teamspace\nimport os\n\nos.environ['LIGHTNING_USER_ID'] = 'd52587bc-ec3c-4c9c-a2fa-71246e3d4020'\nos.environ['LIGHTNING_API_KEY'] = '25da12f4-1ad8-4e3f-8ba4-2a60fcebaabe'\n\nts = Teamspace(name='default-project', user='dhruv2mars')\nstudio = Studio(name='parameter-golf', teamspace=ts)\n\n# Check directory\nprint('Current dir:', studio.run('pwd'))\nprint('Contents:', studio.run('ls -la'))\n\" 2>&1"}}],"api":"anthropic-messages","provider":"minimax","model":"MiniMax-M2.7","usage":{"input":72716,"output":191,"cacheRead":9348,"cacheWrite":0,"totalTokens":82255,"cost":{"input":0.0218148,"output":0.0002292,"cacheRead":0.0005608799999999999,"cacheWrite":0,"total":0.022604879999999997}},"stopReason":"toolUse","timestamp":1777290711483,"responseId":"063e80da8809a6556355c6d8a4869a10"}}
{"type":"message","id":"e193aae2","parentId":"42d0324f","timestamp":"2026-04-27T11:52:11.656Z","message":{"role":"toolResult","toolCallId":"call_function_ep31km6tdk5d_1","toolName":"bash","content":[{"type":"text","text":"Current dir: /teamspace/studios/this_studio\nContents: total 56\ndrwxr-xr-x 1 dhruv2mars dhruv2mars 4096 Apr 27 11:50 .\ndrwxr-xr-x 3 root       root       4096 Apr 22 21:00 ..\n-rw-r--r-- 1 dhruv2mars dhruv2mars  313 Apr 22 04:58 .bashrc\nlrwxrwxrwx 1 dhruv2mars dhruv2mars   19 Apr 27 11:49 .condarc -> /home/zeus/.condarc\ndrwxr-xr-x 3 dhruv2mars dhruv2mars 4096 Apr 27 11:50 .config\nlrwxrwxrwx 1 dhruv2mars dhruv2mars   34 Apr 27 11:49 .cursor-server -> /system/environment/.cursor-server\nlrwxrwxrwx 1 dhruv2mars dhruv2mars   18 Apr 27 11:49 .docker -> /home/zeus/.docker\n-rw-r--r-- 1 dhruv2mars dhruv2mars  419 Apr 27 11:49 .gitconfig\nlrwxrwxrwx 1 dhruv2mars dhruv2mars   21 Apr 27 11:49 .hushlogin -> /home/zeus/.hushlogin\ndrwxr-xr-x 2 dhruv2mars dhruv2mars 4096 Apr 22 07:00 .idea\ndrwxr-xr-x 2 dhruv2mars dhruv2mars 4096 Apr 27 11:50 .ipython\nlrwxrwxrwx 1 dhruv2mars dhruv2mars   19 Apr 27 11:49 .jupyter -> /home/zeus/.jupyter\ndrwxr-xr-x 2 dhruv2mars dhruv2mars 4096 Apr 27 11:49 .lightning_studio\n-rw-r--r-- 1 dhruv2mars dhruv2mars  236 Apr 27 11:49 .lightningignore\nlrwxrwxrwx 1 dhruv2mars dhruv2mars   17 Apr 27 11:49 .local -> /home/zeus/.local\nlrwxrwxrwx 1 dhruv2mars dhruv2mars   22 Apr 27 11:50 .nvm -> /system/conda/node/nvm\nlrwxrwxrwx 1 dhruv2mars dhruv2mars   21 Apr 27 11:49 .oh-my-zsh -> /home/zeus/.oh-my-zsh\nlrwxrwxrwx 1 dhruv2mars dhruv2mars   19 Apr 27 11:49 .profile -> /home/zeus/.profile\nlrwxrwxrwx 1 dhruv2mars dhruv2mars   15 Apr 27 11:49 .ssh -> /home/zeus/.ssh\nlrwxrwxrwx 1 dhruv2mars dhruv2mars   36 Apr 27 11:49 .sudo_as_admin_successful -> /home/zeus/.sudo_as_admin_successful\n-rw-r--r-- 1 dhruv2mars dhruv2mars  378 Apr 22 04:58 .vimrc\ndrwxr-xr-x 3 dhruv2mars dhruv2mars 4096 Apr 27 11:49 .vscode\nlrwxrwxrwx 1 dhruv2mars dhruv2mars   34 Apr 27 11:49 .vscode-server -> /system/environment/.vscode-server\nlrwxrwxrwx 1 dhruv2mars dhruv2mars   36 Apr 27 11:49 .windsurf-server -> /system/environment/.windsurf-server\n-rw-r--r-- 1 dhruv2mars dhruv2mars 4235 Apr 22 04:58 .zshrc\n-rwxr--r-- 1 dhruv2mars dhruv2mars   33 Apr 27 11:48 main.py\n"}],"isError":false,"timestamp":1777290731656}}
{"type":"message","id":"1c93a283","parentId":"e193aae2","timestamp":"2026-04-27T11:52:21.769Z","message":{"role":"assistant","content":[{"type":"thinking","thinking":"The parameter-golf directory doesn't exist in the studio. The repo needs to be cloned. Let me clone it and then run the training.","thinkingSignature":"1b5b931a32807a4165e20e611f1d698aab2733af527b5b3489bca1d346e4a6a3"},{"type":"text","text":"Repo not in studio. Let me clone it:\n"},{"type":"toolCall","id":"call_function_8icek33ala92_1","name":"bash","arguments":{"command":"source ~/.venv/pg/bin/activate && python -c \"\nfrom lightning_sdk import Studio, Teamspace\nimport os\n\nos.environ['LIGHTNING_USER_ID'] = 'd52587bc-ec3c-4c9c-a2fa-71246e3d4020'\nos.environ['LIGHTNING_API_KEY'] = '25da12f4-1ad8-4e3f-8ba4-2a60fcebaabe'\n\nts = Teamspace(name='default-project', user='dhruv2mars')\nstudio = Studio(name='parameter-golf', teamspace=ts)\n\n# Clone repo\nprint('Cloning repo...')\nresult = studio.run('cd /teamspace/studios/this_studio && git clone https://github.com/Dhruv2mars/parameter-golf.git 2>&1')\nprint(result)\n\" 2>&1","timeout_seconds":"60"}}],"api":"anthropic-messages","provider":"minimax","model":"MiniMax-M2.7","usage":{"input":73798,"output":257,"cacheRead":9348,"cacheWrite":0,"totalTokens":83403,"cost":{"input":0.0221394,"output":0.00030839999999999996,"cacheRead":0.0005608799999999999,"cacheWrite":0,"total":0.02300868}},"stopReason":"toolUse","timestamp":1777290731660,"responseId":"063e80eefe0bb455048e6063804cae65"}}
