{"type":"message","id":"97f8ac7d","parentId":"f976d015","timestamp":"2026-04-25T18:07:42.931Z","message":{"role":"toolResult","toolCallId":"call_function_k8ppo6s4784y_1","toolName":"bash","content":[{"type":"text","text":"/Users/dhruv2mars/dev/github/parameter-golf/.gemini/settings.json\n/Users/dhruv2mars/dev/github/parameter-golf/.gemini/agents/entire-search.md\n/Users/dhruv2mars/dev/github/parameter-golf/records/track_10min_16mb/2026-03-19_Seq2048_FP16Emb_TunedLR/train_seed1337.log\n/Users/dhruv2mars/dev/github/parameter-golf/records/track_10min_16mb/2026-03-19_Seq2048_FP16Emb_TunedLR/train_gpt.py\n/Users/dhruv2mars/dev/github/parameter-golf/records/track_10min_16mb/2026-03-19_Seq2048_FP16Emb_TunedLR/train_seed3.log\n/Users/dhruv2mars/dev/github/parameter-golf/records/track_10min_16mb/2026-03-19_Seq2048_FP16Emb_TunedLR/README.md\n/Users/dhruv2mars/dev/github/parameter-golf/records/track_10min_16mb/2026-03-19_Seq2048_FP16Emb_TunedLR/train_seed42.log\n/Users/dhruv2mars/dev/github/parameter-golf/records/track_10min_16mb/2026-03-19_Seq2048_FP16Emb_TunedLR/submission.json\n/Users/dhruv2mars/dev/github/parameter-golf/records/track_10min_16mb/2026-03-18_LowerLR/train_gpt.py\n/Users/dhruv2mars/dev/github/parameter-golf/records/track_10min_16mb/2026-03-18_LowerLR/README.md\n/Users/dhruv2mars/dev/github/parameter-golf/records/track_10min_16mb/2026-03-18_LowerLR/submission.json\n/Users/dhruv2mars/dev/github/parameter-golf/records/track_10min_16mb/2026-03-18_LowerLR/train.log\n/Users/dhruv2mars/dev/github/parameter-golf/records/track_10min_16mb/2026-03-19_MixedQuant_Int6Int8_SlidingWindow/train_gpt.py\n/Users/dhruv2mars/dev/github/parameter-golf/records/track_10min_16mb/2026-03-19_MixedQuant_Int6Int8_SlidingWindow/README.md\n/Users/dhruv2mars/dev/github/parameter-golf/records/track_10min_16mb/2026-03-19_MixedQuant_Int6Int8_SlidingWindow/submission.json\n/Users/dhruv2mars/dev/github/parameter-golf/records/track_10min_16mb/2026-03-19_MixedQuant_Int6Int8_SlidingWindow/train.log\n/Users/dhruv2mars/dev/github/parameter-golf/records/track_10min_16mb/2026-03-31_Scylla_FullGPTQ_XSA11_FA3_0.9485/train_seed1337.log\n/Users/dhruv2mars/dev/github/parameter-golf/records/track_10min_16mb/2026-03-31_Scylla_FullGPTQ_XSA11_FA3_0.9485/train_gpt.py\n/Users/dhruv2mars/dev/github/parameter-golf/records/track_10min_16mb/2026-03-31_Scylla_FullGPTQ_XSA11_FA3_0.9485/README.md\n/Users/dhruv2mars/dev/github/parameter-golf/records/track_10min_16mb/2026-03-31_Scylla_FullGPTQ_XSA11_FA3_0.9485/train_seed2025.log\n/Users/dhruv2mars/dev/github/parameter-golf/records/track_10min_16mb/2026-03-31_Scylla_FullGPTQ_XSA11_FA3_0.9485/train_seed42.log\n/Users/dhruv2mars/dev/github/parameter-golf/records/track_10min_16mb/2026-03-31_Scylla_FullGPTQ_XSA11_FA3_0.9485/submission.json\n/Users/dhruv2mars/dev/github/parameter-golf/records/track_10min_16mb/2026-03-31_Scylla_FullGPTQ_XSA11_FA3_0.9485/candidate.meta.npz\n/Users/dhruv2mars/dev/github/parameter-golf/records/track_10min_16mb/2026-03-31_Scylla_FullGPTQ_XSA11_FA3_0.9485/candidate.vocab\n/Users/dhruv2mars/dev/github/parameter-golf/records/track_10min_16mb/2026-03-18_FP16Embed_WD3600/train_gpt.py\n/Users/dhruv2mars/dev/github/parameter-golf/records/track_10min_16mb/2026-03-18_FP16Embed_WD3600/README.md\n/Users/dhruv2mars/dev/github/parameter-golf/records/track_10min_16mb/2026-03-18_FP16Embed_WD3600/train_seed42.log\n/Users/dhruv2mars/dev/github/parameter-golf/records/track_10min_16mb/2026-03-18_FP16Embed_WD3600/submission.json\n/Users/dhruv2mars/dev/github/parameter-golf/records/track_10min_16mb/2026-03-18_FP16Embed_WD3600/train.log\n/Users/dhruv2mars/dev/github/parameter-golf/records/track_10min_16mb/2026-03-31_ParallelResiduals_MiniDepthRecurrence/requirements.txt\n/Users/dhruv2mars/dev/github/parameter-golf/records/track_10min_16mb/2026-03-31_ParallelResiduals_MiniDepthRecurrence/train_seed1337.log\n/Users/dhruv2mars/dev/github/parameter-golf/records/track_10min_16mb/2026-03-31_ParallelResiduals_MiniDepthRecurrence/train_gpt.py\n/Users/dhruv2mars/dev/github/parameter-golf/records/track_10min_16mb/2026-03-31_ParallelResiduals_MiniDepthRecurrence/train_seed2024.log\n/Users/dhruv2mars/dev/github/parameter-golf/records/track_10min_16mb/2026-03-31_ParallelResiduals_MiniDepthRecurrence/README.md\n/Users/dhruv2mars/dev/github/parameter-golf/records/track_10min_16mb/2026-03-31_ParallelResiduals_MiniDepthRecurrence/train_seed42.log\n/Users/dhruv2mars/dev/github/parameter-golf/records/track_10min_16mb/2026-03-31_ParallelResiduals_MiniDepthRecurrence/submission.json\n/Users/dhruv2mars/dev/github/parameter-golf/records/track_10min_16mb/2026-03-23_LeakyReLU_LegalTTT_ParallelMuon/train_seed1337.log\n/Users/dhruv2mars/dev/github/parameter-golf/records/track_10min_16mb/2026-03-23_LeakyReLU_LegalTTT_ParallelMuon/train_gpt.py\n/Users/dhruv2mars/dev/github/parameter-golf/records/track_10min_16mb/2026-03-23_LeakyReLU_LegalTTT_ParallelMuon/README.md\n/Users/dhruv2mars/dev/github/parameter-golf/records/track_10min_16mb/2026-03-23_LeakyReLU_LegalTTT_ParallelMuon/train_seed2025.log\n/Users/dhruv2mars/dev/github/parameter-golf/records/track_10min_16mb/2026-03-23_LeakyReLU_LegalTTT_ParallelMuon/train_seed42.log\n/Users/dhruv2mars/dev/github/parameter-golf/records/track_10min_16mb/2026-03-23_LeakyReLU_LegalTTT_ParallelMuon/submission.json\n/Users/dhruv2mars/dev/github/parameter-golf/records/track_10min_16mb/2026-03-19_SlidingWindowEval/train_gpt.py\n/Users/dhruv2mars/dev/github/parameter-golf/records/track_10min_16mb/2026-03-19_SlidingWindowEval/README.md\n/Users/dhruv2mars/dev/github/parameter-golf/records/track_10min_16mb/2026-03-19_SlidingWindowEval/submission.json\n/Users/dhruv2mars/dev/github/parameter-golf/records/track_10min_16mb/2026-03-19_SlidingWindowEval/train.log\n/Users/dhruv2mars/dev/github/parameter-golf/records/track_10min_16mb/2026-03-18_LongContextSeq2048/train_gpt.py\n/Users/dhruv2mars/dev/github/parameter-golf/records/track_10min_16mb/2026-03-18_LongContextSeq2048/README.md\n/Users/dhruv2mars/dev/github/parameter-golf/records/track_10min_16mb/2026-03-18_LongContextSeq2048/train_seed1339.log\n/Users/dhruv2mars/dev/github/parameter-golf/records/track_10min_16mb/2026-03-18_LongContextSeq2048/train_seed1338.log\n/Users/dhruv2mars/dev/github/parameter-golf/records/track_10min_16mb/2026-03-18_LongContextSeq2048/submission.json\n/Users/dhruv2mars/dev/github/parameter-golf/records/track_10min_16mb/2026-03-18_LongContextSeq2048/train.log\n/Users/dhruv2mars/dev/github/parameter-golf/records/track_10min_16mb/2026-04-08_SP8192_ParallelResid_ScoreFirstTTT/train_seed999.log\n/Users/dhruv2mars/dev/github/parameter-golf/records/track_10min_16mb/2026-04-08_SP8192_ParallelResid_ScoreFirstTTT/train_gpt.py\n/Users/dhruv2mars/dev/github/parameter-golf/records/track_10min_16mb/2026-04-08_SP8192_ParallelResid_ScoreFirstTTT/README.md\n/Users/dhruv2mars/dev/github/parameter-golf/records/track_10min_16mb/2026-04-08_SP8192_ParallelResid_ScoreFirstTTT/train_seed42.log\n/Users/dhruv2mars/dev/github/parameter-golf/records/track_10min_16mb/2026-04-08_SP8192_ParallelResid_ScoreFirstTTT/submission.json\n/Users/dhruv2mars/dev/github/parameter-golf/records/track_10min_16mb/2026-04-08_SP8192_ParallelResid_ScoreFirstTTT/train_seed314.log\n/Users/dhruv2mars/dev/github/parameter-golf/records/track_10min_16mb/REDACTED/train_seed7.log\n/Users/dhruv2mars/dev/github/parameter-golf/records/track_10min_16mb/REDACTED/train_seed1337.log\n/Users/dhruv2mars/dev/github/parameter-golf/records/track_10min_16mb/REDACTED/train_gpt.py\n/Users/dhruv2mars/dev/github/parameter-golf/records/track_10min_16mb/REDACTED/README.md\n/Users/dhruv2mars/dev/github/parameter-golf/records/track_10min_16mb/REDACTED/train_seed42.log\n/Users/dhruv2mars/dev/github/parameter-golf/records/track_10min_16mb/REDACTED/submission.json\n/Users/dhruv2mars/dev/github/parameter-golf/records/track_10min_16mb/REDACTED/setup.sh\n/Users/dhruv2mars/dev/github/parameter-golf/records/track_10min_16mb/REDACTED/requirements.txt\n/Users/dhruv2mars/dev/github/parameter-golf/records/track_10min_16mb/REDACTED/run_cuda_ternary.sh\n/Users/dhruv2mars/dev/github/parameter-golf/records/track_10min_16mb/REDACTED/fineweb_8192_bpe.model\n/Users/dhruv2mars/dev/github/parameter-golf/records/track_10min_16mb/REDACTED/ternary_log_7.txt\n/Users/dhruv2mars/dev/github/parameter-golf/records/track_10min_16mb/REDACTED/ternary_log_42.txt\n/Users/dhruv2mars/dev/github/parameter-golf/records/track_10min_16mb/REDACTED/README.md\n/Users/dhruv2mars/dev/github/parameter-golf/records/track_10min_16mb/REDACTED/fineweb_8192_bpe.vocab\n/Users/dhruv2mars/dev/github/parameter-golf/records/track_10min_16mb/REDACTED/RESULTS.md\n/Users/dhruv2mars/dev/github/parameter-golf/records/track_10min_16mb/REDACTED/ternary_log_1337.txt\n/Users/dhruv2mars/dev/github/parameter-golf/records/track_10min_16mb/REDACTED/submission_ternary.json\n/Users/dhruv2mars/dev/github/parameter-golf/records/track_10min_16mb/REDACTED/train_gpt_cuda_ternary.py\n/Users/dhruv2mars/dev/github/parameter-golf/records/track_10min_16mb/REDACTED/requirements.txt\n/Users/dhruv2mars/dev/github/parameter-golf/records/track_10min_16mb/REDACTED/train_seed1337.log\n/Users/dhruv2mars/dev/github/parameter-golf/records/track_10min_16mb/REDACTED/train_gpt.py\n/Users/dhruv2mars/dev/github/parameter-golf/records/track_10min_16mb/REDACTED/README.md\n"}],"isError":false,"timestamp":1777140462931}}
{"type":"message","id":"c2411a9e","parentId":"97f8ac7d","timestamp":"2026-04-25T18:07:42.931Z","message":{"role":"toolResult","toolCallId":"call_function_k8ppo6s4784y_2","toolName":"bash","content":[{"type":"text","text":"total 424\ndrwxr-xr-x@  3 dhruv2mars  staff     96 25 Apr 15:46 __pycache__\ndrwxr-xr-x@ 30 dhruv2mars  staff    960 25 Apr 17:51 .\ndrwxr-xr-x@ 20 dhruv2mars  staff    640 25 Apr 02:17 ..\ndrwxr-x---@  4 dhruv2mars  staff    128 24 Apr 19:21 .claude\ndrwxr-x---@  5 dhruv2mars  staff    160 24 Apr 19:21 .codex\ndrwxr-x---@  7 dhruv2mars  staff    224 24 Apr 19:25 .entire\ndrwxr-x---@  3 dhruv2mars  staff     96 24 Apr 19:21 .factory\ndrwxr-x---@  4 dhruv2mars  staff    128 24 Apr 19:21 .gemini\ndrwxr-xr-x@ 17 dhruv2mars  staff    544 25 Apr 23:24 .git\n-rw-r--r--@  1 dhruv2mars  staff    337 25 Apr 15:46 .gitignore\ndrwxr-xr-x@  3 dhruv2mars  staff     96 24 Apr 19:21 .opencode\ndrwxr-xr-x@  9 dhruv2mars  staff    288 25 Apr 02:32 autoresearch-results\ndrwxr-xr-x@  9 dhruv2mars  staff    288 24 Apr 00:39 data\ndrwxr-xr-x@  3 dhruv2mars  staff     96 25 Apr 17:00 docs\ndrwxr-xr-x@ 11 dhruv2mars  staff    352 25 Apr 17:50 experiments\ndrwxr-xr-x@  6 dhruv2mars  staff    192 24 Apr 20:51 kaggle_pull\n-rw-r--r--@  1 dhruv2mars  staff    363 25 Apr 16:29 kernel-metadata.json\n-rw-r--r--@  1 dhruv2mars  staff   1063 24 Apr 00:25 LICENSE\n-rw-r--r--@  1 dhruv2mars  staff   2337 25 Apr 15:46 PROGRESS.md\n-rw-r--r--@  1 dhruv2mars  staff  23993 24 Apr 00:25 README.md\ndrwxr-xr-x@  4 dhruv2mars  staff    128 24 Apr 00:25 records\n-rw-r--r--@  1 dhruv2mars  staff    109 24 Apr 00:25 requirements.txt\n-rwxr-xr-x@  1 dhruv2mars  staff   4472 25 Apr 16:29 run_train_ttt.sh\n-rwxr-xr-x@  1 dhruv2mars  staff   4486 25 Apr 16:09 run_train.sh\n-rw-r--r--@  1 dhruv2mars  staff   1607 25 Apr 17:51 test_push.py\n-rw-r--r--@  1 dhruv2mars  staff   1341 24 Apr 00:25 THIRD_PARTY_NOTICES.md\n-rw-r--r--@  1 dhruv2mars  staff  50195 24 Apr 00:25 train_gpt_mlx.py\n-rw-r--r--@  1 dhruv2mars  staff  47686 24 Apr 00:25 train_gpt.py\n-rw-r--r--@  1 dhruv2mars  staff  38549 25 Apr 16:09 train_kaggle.py\n-rwxr-xr-x@  1 dhruv2mars  staff    683 25 Apr 15:45 upload_kaggle.sh\n"}],"isError":false,"timestamp":1777140462931}}
{"type":"message","id":"e6d6c220","parentId":"c2411a9e","timestamp":"2026-04-25T18:07:50.257Z","message":{"role":"assistant","content":[{"type":"thinking","thinking":"Let me explore more of the repo to understand:\n1. Current architecture details\n2. The best submissions and their scores\n3. The training pipeline\n4. What has already been tried\n\nLet me look at the main files and recent submissions.\n","thinkingSignature":"2405904ab6ac5d2a9c6273bc535bb86c4c275e8e42b18fa75ac7090ea6f7530f"},{"type":"toolCall","id":"call_function_9bf3jmodi6h5_1","name":"read","arguments":{"path":"/Users/dhruv2mars/dev/github/parameter-golf/README.md"}},{"type":"toolCall","id":"call_function_9bf3jmodi6h5_2","name":"read","arguments":{"path":"/Users/dhruv2mars/dev/github/parameter-golf/PROGRESS.md"}},{"type":"toolCall","id":"call_function_9bf3jmodi6h5_3","name":"bash","arguments":{"command":"ls -la /Users/dhruv2mars/dev/github/parameter-golf/records/track_10min_16mb/ | sort -r"}}],"api":"anthropic-messages","provider":"minimax","model":"MiniMax-M2.7","usage":{"input":4850,"output":173,"cacheRead":12672,"cacheWrite":0,"totalTokens":17695,"cost":{"input":0.001455,"output":0.00020759999999999998,"cacheRead":0.00076032,"cacheWrite":0,"total":0.00242292}},"stopReason":"toolUse","timestamp":1777140462933,"responseId":"063c35ef57640fa36a4f8178c0db5f3c"}}
