{"type":"message","id":"7cf75dd3","parentId":"9bf7f8cd","timestamp":"2026-04-27T11:24:46.668Z","message":{"role":"toolResult","toolCallId":"call_function_oifmmmn6lt01_1","toolName":"understand_image","content":[{"type":"text","text":"Based on the screenshot of your terminal, here is the status:\n\n**Is training running now?**\n**Yes.** The script `train_kaggle.py` was launched in the background (indicated by the `&` at the end of the command). The terminal shows that the process started with ID `100121`. It is currently in the setup and data preparation phase.\n\n**Any output?**\nYes, there is significant output showing the initialization of the run:\n\n*   **Configuration Details:** It lists parameters like 25,000 iterations, a model size of 11L x 512d, and a sequence length of 512.\n*   **Hardware Detection:** It has correctly identified the device as a **Tesla T4 GPU** and is using PyTorch 2.8.0+cu128.\n*   **Current Progress:** It is currently on step **[1/6] Downloading data...**\n*   **Completed Tasks:** It has successfully downloaded the tokenizer (`fineweb_8192_bpe.model`).\n*   **Warnings:** There is a warning suggesting you set an `HF_TOKEN` (Hugging Face Token) for faster downloads, though it is still proceeding without one.\n\nBecause the process is running in the background, you have a fresh cursor at the bottom, but the script will continue to print its progress to this terminal window as it moves from downloading data to the actual training loops."}],"details":{"server":"MiniMax","tool":"understand_image","structuredContent":{"type":"text","text":"Based on the screenshot of your terminal, here is the status:\n\n**Is training running now?**\n**Yes.** The script `train_kaggle.py` was launched in the background (indicated by the `&` at the end of the command). The terminal shows that the process started with ID `100121`. It is currently in the setup and data preparation phase.\n\n**Any output?**\nYes, there is significant output showing the initialization of the run:\n\n*   **Configuration Details:** It lists parameters like 25,000 iterations, a model size of 11L x 512d, and a sequence length of 512.\n*   **Hardware Detection:** It has correctly identified the device as a **Tesla T4 GPU** and is using PyTorch 2.8.0+cu128.\n*   **Current Progress:** It is currently on step **[1/6] Downloading data...**\n*   **Completed Tasks:** It has successfully downloaded the tokenizer (`fineweb_8192_bpe.model`).\n*   **Warnings:** There is a warning suggesting you set an `HF_TOKEN` (Hugging Face Token) for faster downloads, though it is still proceeding without one.\n\nBecause the process is running in the background, you have a fresh cursor at the bottom, but the script will continue to print its progress to this terminal window as it moves from downloading data to the actual training loops.","annotations":null,"_meta":null},"isError":false},"isError":false,"timestamp":1777289086668}}
{"type":"message","id":"9342e667","parentId":"7cf75dd3","timestamp":"2026-04-27T11:24:52.139Z","message":{"role":"assistant","content":[{"type":"thinking","thinking":"Now training is running and I can see it's downloading data. Let me wait a bit and check the progress.","thinkingSignature":"46495689a2a92d98f8ac54ef440599f7682cd6681c68af1da953a1de5a7e245e"},{"type":"text","text":"Training started! Downloading data on T4 GPU. Let me monitor:\n"},{"type":"toolCall","id":"call_function_oqvvfrtkbql2_1","name":"bash","arguments":{"command":"sleep 30 && agent-browser screenshot 2>&1"}}],"api":"anthropic-messages","provider":"minimax","model":"MiniMax-M2.7","usage":{"input":53404,"output":72,"cacheRead":9348,"cacheWrite":0,"totalTokens":62824,"cost":{"input":0.0160212,"output":0.0000864,"cacheRead":0.0005608799999999999,"cacheWrite":0,"total":0.01666848}},"stopReason":"toolUse","timestamp":1777289086672,"responseId":"063e7a80c74c2977c447858d9021b053"}}
{"type":"message","id":"80fac080","parentId":"9342e667","timestamp":"2026-04-27T11:25:22.480Z","message":{"role":"toolResult","toolCallId":"call_function_oqvvfrtkbql2_1","toolName":"bash","content":[{"type":"text","text":"✓ Screenshot saved to /Users/dhruv2mars/.agent-browser/tmp/screenshots/screenshot-1777289122463.png\n"}],"isError":false,"timestamp":1777289122480}}
{"type":"message","id":"2da5ec8b","parentId":"80fac080","timestamp":"2026-04-27T11:25:30.512Z","message":{"role":"assistant","content":[{"type":"thinking","thinking":"Let me see the progress.","thinkingSignature":"cda1b88cc0756a532501aa6438c55126be7e52ff3def820e3981ee1ae364c4f6"},{"type":"toolCall","id":"call_function_x5kze45jip6o_1","name":"understand_image","arguments":{"prompt":"What's the current status? Training progress, steps, loss?","image_url":"/Users/dhruv2mars/.agent-browser/tmp/screenshots/screenshot-1777289122463.png"}}],"api":"anthropic-messages","provider":"minimax","model":"MiniMax-M2.7","usage":{"input":53519,"output":75,"cacheRead":9348,"cacheWrite":0,"totalTokens":62942,"cost":{"input":0.0160557,"output":0.00008999999999999999,"cacheRead":0.0005608799999999999,"cacheWrite":0,"total":0.01670658}},"stopReason":"toolUse","timestamp":1777289122484,"responseId":"063e7aa6480c2b4ee4d685598c2f8b08"}}
{"type":"message","id":"490ee2d7","parentId":"2da5ec8b","timestamp":"2026-04-27T11:25:37.987Z","message":{"role":"toolResult","toolCallId":"call_function_x5kze45jip6o_1","toolName":"understand_image","content":[{"type":"text","text":"Based on the terminal output in the image, here is the current status of the training:\n\n*   **Training Progress:** The training is in its early stages. It has completed 10 steps out of a total of 2,500 planned steps. \n*   **Current Step:** 10/2500.\n*   **Current Loss:** The training loss at step 10 is **8.7477**. \n*   **Loss Trend:** The loss is steadily decreasing from an initial 9.0119 at step 1.\n*   **Speed:** Each step is taking approximately 1 second (step 10 took 11 seconds total elapsed time).\n*   **Model Info:** The model has approximately **36 million parameters** (35,993,176) and is being trained on the FineWeb dataset."}],"details":{"server":"MiniMax","tool":"understand_image","structuredContent":{"type":"text","text":"Based on the terminal output in the image, here is the current status of the training:\n\n*   **Training Progress:** The training is in its early stages. It has completed 10 steps out of a total of 2,500 planned steps. \n*   **Current Step:** 10/2500.\n*   **Current Loss:** The training loss at step 10 is **8.7477**. \n*   **Loss Trend:** The loss is steadily decreasing from an initial 9.0119 at step 1.\n*   **Speed:** Each step is taking approximately 1 second (step 10 took 11 seconds total elapsed time).\n*   **Model Info:** The model has approximately **36 million parameters** (35,993,176) and is being trained on the FineWeb dataset.","annotations":null,"_meta":null},"isError":false},"isError":false,"timestamp":1777289137987}}
{"type":"message","id":"d9c8013e","parentId":"490ee2d7","timestamp":"2026-04-27T11:25:45.041Z","message":{"role":"assistant","content":[{"type":"thinking","thinking":"Training is running! Step 10/2500 with loss 8.7477. Let me wait more and check progress again.","thinkingSignature":"19da1fd4f32bcafd50a67d5ceed1c9aac70aefcfa46007defa031f7226a155fd"},{"type":"text","text":"**Training running!** Step 10/2500, loss 8.75, T4 GPU active.\n"},{"type":"toolCall","id":"call_function_mfl6y923dqsx_1","name":"bash","arguments":{"command":"sleep 60 && agent-browser screenshot 2>&1"}}],"api":"anthropic-messages","provider":"minimax","model":"MiniMax-M2.7","usage":{"input":53774,"output":85,"cacheRead":9348,"cacheWrite":0,"totalTokens":63207,"cost":{"input":0.0161322,"output":0.000102,"cacheRead":0.0005608799999999999,"cacheWrite":0,"total":0.01679508}},"stopReason":"toolUse","timestamp":1777289137997,"responseId":"063e7ab47e450e21b42bb30772bd753f"}}
{"type":"message","id":"06ba5774","parentId":"d9c8013e","timestamp":"2026-04-27T11:26:27.323Z","message":{"role":"toolResult","toolCallId":"call_function_mfl6y923dqsx_1","toolName":"bash","content":[{"type":"text","text":"Command aborted"}],"details":{},"isError":true,"timestamp":1777289187323}}
{"type":"message","id":"08c185fc","parentId":"06ba5774","timestamp":"2026-04-27T11:26:27.330Z","message":{"role":"assistant","content":[],"api":"anthropic-messages","provider":"minimax","model":"MiniMax-M2.7","usage":{"input":0,"output":0,"cacheRead":0,"cacheWrite":0,"totalTokens":0,"cost":{"input":0,"output":0,"cacheRead":0,"cacheWrite":0,"total":0}},"stopReason":"aborted","timestamp":1777289187327,"errorMessage":"Operation aborted"}}
{"type":"message","id":"956e9e0a","parentId":"08c185fc","timestamp":"2026-04-27T11:27:23.890Z","message":{"role":"user","content":[{"type":"text","text":"whats the status? have we setup lightning perfectly? is everything working perfectly fine? \n\nmake sure u do a short 1 min training run just to see if our training pipeline and everything is set perfectly and everything is stable"}],"timestamp":1777289243878}}
{"type":"message","id":"96a79d9d","parentId":"956e9e0a","timestamp":"2026-04-27T11:27:31.514Z","message":{"role":"assistant","content":[{"type":"thinking","thinking":"Let me check the current status of the training and verify everything is working properly.","thinkingSignature":"3dff7db5098e38c46c43614623de65de49474de0738a34025dadafaad8b6827f"},{"type":"toolCall","id":"call_function_i48a6fsdzx7x_1","name":"bash","arguments":{"command":"agent-browser screenshot 2>&1"}}],"api":"anthropic-messages","provider":"minimax","model":"MiniMax-M2.7","usage":{"input":13,"output":48,"cacheRead":9348,"cacheWrite":53024,"totalTokens":62433,"cost":{"input":0.0000039,"output":0.0000576,"cacheRead":0.0005608799999999999,"cacheWrite":0.019884,"total":0.020506379999999998}},"stopReason":"toolUse","timestamp":1777289243890,"responseId":"063e7b1e4eff1ef614833f8b20dba771"}}
{"type":"message","id":"625d1c65","parentId":"96a79d9d","timestamp":"2026-04-27T11:27:31.866Z","message":{"role":"toolResult","toolCallId":"call_function_i48a6fsdzx7x_1","toolName":"bash","content":[{"type":"text","text":"✓ Screenshot saved to /Users/dhruv2mars/.agent-browser/tmp/screenshots/screenshot-1777289251856.png\n"}],"isError":false,"timestamp":1777289251866}}
{"type":"message","id":"57cf44c2","parentId":"625d1c65","timestamp":"2026-04-27T11:27:36.247Z","message":{"role":"assistant","content":[{"type":"thinking","thinking":"Let me see the screenshot.","thinkingSignature":"bed3728fc271af724b2324a84e7b13551486eeaab2c928de8fa9766fb528858b"},{"type":"toolCall","id":"call_function_pu2l4posv12v_1","name":"understand_image","arguments":{"prompt":"What is the current training status? Steps, loss, GPU usage?","image_url":"/Users/dhruv2mars/.agent-browser/tmp/screenshots/screenshot-1777289251856.png"}}],"api":"anthropic-messages","provider":"minimax","model":"MiniMax-M2.7","usage":{"input":53128,"output":77,"cacheRead":9348,"cacheWrite":0,"totalTokens":62553,"cost":{"input":0.0159384,"output":0.0000924,"cacheRead":0.0005608799999999999,"cacheWrite":0,"total":0.016591679999999998}},"stopReason":"toolUse","timestamp":1777289251870,"responseId":"063e7b24c0752068e8f2e71aa6a6afef"}}
{"type":"message","id":"efc885f9","parentId":"57cf44c2","timestamp":"2026-04-27T11:27:47.309Z","message":{"role":"toolResult","toolCallId":"call_function_pu2l4posv12v_1","toolName":"understand_image","content":[{"type":"text","text":"Based on the terminal output and the UI indicators in the screenshot, here is the current training status:\n\n*   **Steps:** The training is currently at **step 100** out of a total of **2500** steps (`100/2500`).\n*   **Loss:** \n    *   The most recent **training loss** is **6.5520**.\n    *   The most recent **validation loss** (calculated at step 100) is **6.4919**.\n*   **GPU Usage:** In the top header bar, the **T4 VRAM** indicator shows that approximately **75%** of the available GPU memory is currently in use (three out of four bars are lit up)."}],"details":{"server":"MiniMax","tool":"understand_image","structuredContent":{"type":"text","text":"Based on the terminal output and the UI indicators in the screenshot, here is the current training status:\n\n*   **Steps:** The training is currently at **step 100** out of a total of **2500** steps (`100/2500`).\n*   **Loss:** \n    *   The most recent **training loss** is **6.5520**.\n    *   The most recent **validation loss** (calculated at step 100) is **6.4919**.\n*   **GPU Usage:** In the top header bar, the **T4 VRAM** indicator shows that approximately **75%** of the available GPU memory is currently in use (three out of four bars are lit up).","annotations":null,"_meta":null},"isError":false},"isError":false,"timestamp":1777289267309}}
{"type":"message","id":"3241ba19","parentId":"efc885f9","timestamp":"2026-04-27T11:27:57.263Z","message":{"role":"assistant","content":[{"type":"thinking","thinking":"Good progress - step 100/2500, loss is dropping (6.55 training, 6.49 validation), GPU is at 75% VRAM. Let me kill this and run a quick 1-min test to verify everything works correctly.","thinkingSignature":"88ccbb3a87894664352518c259b9a59ae808f5f4f35102486989a2a850bacc1f"},{"type":"text","text":"Training running well: step 100/2500, loss dropping (6.55), GPU at 75% VRAM.\n\nLet me kill this and run a quick 1-min verification:\n"},{"type":"toolCall","id":"call_function_p0gottb17olj_1","name":"bash","arguments":{"command":"agent-browser type \"\" \"pkill -f train_kaggle\" 2>&1 && agent-browser press Enter 2>&1"}}],"api":"anthropic-messages","provider":"minimax","model":"MiniMax-M2.7","usage":{"input":53365,"output":142,"cacheRead":9348,"cacheWrite":0,"totalTokens":62855,"cost":{"input":0.0160095,"output":0.0001704,"cacheRead":0.0005608799999999999,"cacheWrite":0,"total":0.01674078}},"stopReason":"toolUse","timestamp":1777289267314,"responseId":"063e7b38c37ca8ecdbddeea8d9aa1dae"}}
{"type":"message","id":"97cb6339","parentId":"3241ba19","timestamp":"2026-04-27T11:27:57.740Z","message":{"role":"toolResult","toolCallId":"call_function_p0gottb17olj_1","toolName":"bash","content":[{"type":"text","text":"✓ Done\n✓ Done\n"}],"isError":false,"timestamp":1777289277740}}
{"type":"message","id":"c916951a","parentId":"97cb6339","timestamp":"2026-04-27T11:28:02.510Z","message":{"role":"assistant","content":[{"type":"thinking","thinking":"Good. Now let me run a quick 1-min test.","thinkingSignature":"af5e06ef674c35b6486d1755db7c637f4411a34eabb3e21d79b7c514eab32e6b"},{"type":"toolCall","id":"call_function_focs42cok1ij_1","name":"bash","arguments":{"command":"sleep 2 && agent-browser screenshot 2>&1"}}],"api":"anthropic-messages","provider":"minimax","model":"MiniMax-M2.7","usage":{"input":53528,"output":49,"cacheRead":9348,"cacheWrite":0,"totalTokens":62925,"cost":{"input":0.0160584,"output":0.0000588,"cacheRead":0.0005608799999999999,"cacheWrite":0,"total":0.01667808}},"stopReason":"toolUse","timestamp":1777289277745,"responseId":"063e7b3f34ca16fcd0a7735b1295a310"}}
{"type":"message","id":"30910c9f","parentId":"c916951a","timestamp":"2026-04-27T11:28:04.867Z","message":{"role":"toolResult","toolCallId":"call_function_focs42cok1ij_1","toolName":"bash","content":[{"type":"text","text":"✓ Screenshot saved to /Users/dhruv2mars/.agent-browser/tmp/screenshots/screenshot-1777289284857.png\n"}],"isError":false,"timestamp":1777289284867}}
{"type":"message","id":"93ebaf43","parentId":"30910c9f","timestamp":"2026-04-27T11:28:09.710Z","message":{"role":"assistant","content":[{"type":"thinking","thinking":"Let me check if it killed properly.","thinkingSignature":"aad1e1e7426955ee5059665d5f78fb3356677bb93654e019d40c89a0485ba0f8"},{"type":"toolCall","id":"call_function_6niujaew2vx9_1","name":"bash","arguments":{"command":"agent-browser type \"\" \"cd ~/parameter-golf && ITERATIONS=50 MAX_WALLCLOCK=60 python3 train_kaggle.py 2>&1\" 2>&1 && agent-browser press Enter 2>&1"}}],"api":"anthropic-messages","provider":"minimax","model":"MiniMax-M2.7","usage":{"input":53620,"output":80,"cacheRead":9348,"cacheWrite":0,"totalTokens":63048,"cost":{"input":0.016086,"output":0.000096,"cacheRead":0.0005608799999999999,"cacheWrite":0,"total":0.016742879999999998}},"stopReason":"toolUse","timestamp":1777289284871,"responseId":"063e7b46a12850396cf6bb7bd3bfe371"}}
{"type":"message","id":"ae2440d3","parentId":"93ebaf43","timestamp":"2026-04-27T11:28:10.160Z","message":{"role":"toolResult","toolCallId":"call_function_6niujaew2vx9_1","toolName":"bash","content":[{"type":"text","text":"✓ Done\n✓ Done\n"}],"isError":false,"timestamp":1777289290160}}
{"type":"message","id":"b7aa648d","parentId":"ae2440d3","timestamp":"2026-04-27T11:28:14.239Z","message":{"role":"assistant","content":[{"type":"thinking","thinking":"Good, let me wait a minute and check the results.","thinkingSignature":"9ffcc95f5cf1404dd232fd20b2e0a1c112613cc446249920d9459cb52419ffbf"},{"type":"toolCall","id":"call_function_78ek3tbv0mqu_1","name":"bash","arguments":{"command":"sleep 60 && agent-browser screenshot 2>&1"}}],"api":"anthropic-messages","provider":"minimax","model":"MiniMax-M2.7","usage":{"input":53721,"output":48,"cacheRead":9348,"cacheWrite":0,"totalTokens":63117,"cost":{"input":0.0161163,"output":0.0000576,"cacheRead":0.0005608799999999999,"cacheWrite":0,"total":0.01673478}},"stopReason":"toolUse","timestamp":1777289290167,"responseId":"063e7b4adb035815a5c0ed52c0c539e6"}}
{"type":"message","id":"cb133bdc","parentId":"b7aa648d","timestamp":"2026-04-27T11:29:14.607Z","message":{"role":"toolResult","toolCallId":"call_function_78ek3tbv0mqu_1","toolName":"bash","content":[{"type":"text","text":"✓ Screenshot saved to /Users/dhruv2mars/.agent-browser/tmp/screenshots/screenshot-1777289354597.png\n"}],"isError":false,"timestamp":1777289354607}}
{"type":"message","id":"2c179191","parentId":"cb133bdc","timestamp":"2026-04-27T11:29:21.226Z","message":{"role":"assistant","content":[{"type":"thinking","thinking":"Let me check the results.","thinkingSignature":"883674cb007012b2241f56e6b98d4b961748301e7cb8fc0bf240a7e36c3002db"},{"type":"toolCall","id":"call_function_egsy4w7gwazv_1","name":"understand_image","arguments":{"prompt":"Did the 1-min test complete? What was the final result?","image_url":"/Users/dhruv2mars/.agent-browser/tmp/screenshots/screenshot-1777289354597.png"}}],"api":"anthropic-messages","provider":"minimax","model":"MiniMax-M2.7","usage":{"input":53812,"output":77,"cacheRead":9348,"cacheWrite":0,"totalTokens":63237,"cost":{"input":0.016143599999999998,"output":0.0000924,"cacheRead":0.0005608799999999999,"cacheWrite":0,"total":0.016796879999999997}},"stopReason":"toolUse","timestamp":1777289354612,"responseId":"063e7b8d6b503872674aed9e89ad9a40"}}
{"type":"message","id":"7b3669f5","parentId":"2c179191","timestamp":"2026-04-27T11:29:31.468Z","message":{"role":"toolResult","toolCallId":"call_function_egsy4w7gwazv_1","toolName":"understand_image","content":[{"type":"text","text":"Based on the terminal output at the bottom of the screen, the test did not complete successfully.\n\nThe final line indicates that the process terminated with an **exit code of 1** (`exit 1`), which typically signifies an error or failure. \n\nBefore failing, the script ran for **195 seconds** (as shown by `elapsed_s=195`), reaching **step 150** with a final recorded `val_loss` of **6.2248** and a `best_bpb` of **2.8878**."}],"details":{"server":"MiniMax","tool":"understand_image","structuredContent":{"type":"text","text":"Based on the terminal output at the bottom of the screen, the test did not complete successfully.\n\nThe final line indicates that the process terminated with an **exit code of 1** (`exit 1`), which typically signifies an error or failure. \n\nBefore failing, the script ran for **195 seconds** (as shown by `elapsed_s=195`), reaching **step 150** with a final recorded `val_loss` of **6.2248** and a `best_bpb` of **2.8878**.","annotations":null,"_meta":null},"isError":false},"isError":false,"timestamp":1777289371468}}
{"type":"message","id":"96b6b6df","parentId":"7b3669f5","timestamp":"2026-04-27T11:29:39.230Z","message":{"role":"assistant","content":[{"type":"thinking","thinking":"It ran for 195 seconds (more than 60 seconds), got to step 150 with val_loss 6.22 and best_bpb 2.89, but exited with code 1. There might be an error. Let me check what the error was.","thinkingSignature":"fdfaf658a1ada49b63c00e0a0230515decc65324f42abbc00f54f02c67857f99"},{"type":"toolCall","id":"call_function_kmpvlvc2nsa1_1","name":"bash","arguments":{"command":"agent-browser type \"\" \"tail -100 ~/parameter-golf/logs/*.log 2>/dev/null\" 2>&1 && agent-browser press Enter 2>&1 && sleep 3 && agent-browser screenshot 2>&1"}}],"api":"anthropic-messages","provider":"minimax","model":"MiniMax-M2.7","usage":{"input":54012,"output":127,"cacheRead":9348,"cacheWrite":0,"totalTokens":63487,"cost":{"input":0.0162036,"output":0.0001524,"cacheRead":0.0005608799999999999,"cacheWrite":0,"total":0.01691688}},"stopReason":"toolUse","timestamp":1777289371475,"responseId":"063e7b9eba5d69ccc6f2ebde229b4fcf"}}
{"type":"message","id":"fd164d50","parentId":"96b6b6df","timestamp":"2026-04-27T11:29:43.025Z","message":{"role":"toolResult","toolCallId":"call_function_kmpvlvc2nsa1_1","toolName":"bash","content":[{"type":"text","text":"✓ Done\n✓ Done\n✓ Screenshot saved to /Users/dhruv2mars/.agent-browser/tmp/screenshots/screenshot-1777289383014.png\n"}],"isError":false,"timestamp":1777289383025}}
