{"type":"message","id":"7a40c5f5","parentId":"38648d22","timestamp":"2026-04-27T02:27:44.743Z","message":{"role":"toolResult","toolCallId":"call_function_uye0hxe8w39b_1","toolName":"bash","content":[{"type":"text","text":"{\"best_val_bpb\": 2.2897, \"compressed_bytes\": null, \"error\": null, \"metric\": 2.2897, \"non_finite\": false, \"output\": \"/Users/dhruv2mars/dev/github/parameter-golf/experiments/kaggle_results/pg-auto-ar-best-beta095-20260427-54653\", \"ref\": \"dhruv2mars/pg-auto-ar-best-beta095-20260427-54653\", \"runtime_seconds\": null, \"status\": \"KernelWorkerStatus.COMPLETE\", \"steps\": 1200, \"ttt_val_bpb\": null, \"val_bpb\": 2.2897}\n"}],"isError":false,"timestamp":1777256864743}}
{"type":"message","id":"4a73d77e","parentId":"7a40c5f5","timestamp":"2026-04-27T02:28:02.892Z","message":{"role":"assistant","content":[{"type":"thinking","thinking":"2.2897! MASSIVE IMPROVEMENT! 2.3% better than the previous best (2.300)! Beta2=0.95 was the winning combination! Wait, the current beta2 is already 0.95... Let me check - the default in train_kaggle.py is BETA2=0.95. So this run used the same beta2. Hmm, but it got 2.2897 vs 2.2996...\n\nWait, let me re-check. The baseline default is BETA2=0.95. And my current best is also using the default (no BETA2 override). So why is this run getting 2.2897 vs 2.2996?\n\n\nThis could be noise or maybe the kernel launch had slightly different conditions. But if beta2=0.95 was already the default, something else must be different here - let me look at what other parameters might have changed between these runs. I need to actually look at the train_kaggle.py file to verify what the default beta values are, since the difference between the runs suggests either a different beta combination was used or it's just random noise.","thinkingSignature":"51f74ac0e418fa2ba616d6261aa9e407619f09ba3220c0f56ad9deb064d1fc3b"},{"type":"toolCall","id":"call_function_ygjbsrrpspr8_1","name":"read","arguments":{"limit":30,"offset":81,"path":"/Users/dhruv2mars/dev/github/parameter-golf/train_kaggle.py"}}],"api":"anthropic-messages","provider":"minimax","model":"MiniMax-M2.7","usage":{"input":92441,"output":302,"cacheRead":0,"cacheWrite":9711,"totalTokens":102454,"cost":{"input":0.027732299999999998,"output":0.00036239999999999997,"cacheRead":0,"cacheWrite":0.003641625,"total":0.031736324999999996}},"stopReason":"toolUse","timestamp":1777256864747,"responseId":"063dfca631806875eb9c62630692bb0c"}}
{"type":"message","id":"9a52639a","parentId":"4a73d77e","timestamp":"2026-04-27T02:28:02.914Z","message":{"role":"toolResult","toolCallId":"call_function_ygjbsrrpspr8_1","toolName":"read","content":[{"type":"text","text":"    val_loss_every = int(os.environ.get(\"VAL_LOSS_EVERY\", 50))\n    val_max_tokens = int(os.environ.get(\"VAL_MAX_TOKENS\", 131072))\n    \n    # Model architecture (proven SOTA config)\n    vocab_size = int(os.environ.get(\"VOCAB_SIZE\", 8192))\n    num_layers = int(os.environ.get(\"NUM_LAYERS\", 11))\n    model_dim = int(os.environ.get(\"MODEL_DIM\", 512))\n    num_heads = int(os.environ.get(\"NUM_HEADS\", 8))\n    num_kv_heads = int(os.environ.get(\"NUM_KV_HEADS\", 4))\n    mlp_mult = int(os.environ.get(\"MLP_MULT\", 4))\n    tie_embeddings = bool(int(os.environ.get(\"TIE_EMBEDDINGS\", \"1\")))\n    rope_base = float(os.environ.get(\"ROPE_BASE\", 10000.0))\n    rope_dims = int(os.environ.get(\"ROPE_DIMS\", 16))\n    logit_softcap = float(os.environ.get(\"LOGIT_SOFTCAP\", 30.0))\n    \n    # Depth recurrence (proven: layers 3-5 loop twice)\n    num_loops = int(os.environ.get(\"NUM_LOOPS\", 2))\n    loop_start = int(os.environ.get(\"LOOP_START\", 3))\n    loop_end = int(os.environ.get(\"LOOP_END\", 5))\n    enable_looping_at = float(os.environ.get(\"ENABLE_LOOPING_AT\", 0.35))\n    \n    # QK-Gain (proven: 5.25 is optimal)\n    qk_gain_init = float(os.environ.get(\"QK_GAIN_INIT\", 5.25))\n    \n    # Optimizer\n    matrix_lr = float(os.environ.get(\"MATRIX_LR\", _T4_MATRIX_LR))\n    weight_decay = float(os.environ.get(\"WEIGHT_DECAY\", 0.095))\n    beta1 = float(os.environ.get(\"BETA1\", 0.9))\n    beta2 = float(os.environ.get(\"BETA2\", 0.95))\n    adam_eps = float(os.environ.get(\"ADAM_EPS\", 1e-8))\n\n[935 more lines in file. Use offset=111 to continue.]"}],"isError":false,"timestamp":1777256882914}}
{"type":"message","id":"633ad969","parentId":"9a52639a","timestamp":"2026-04-27T02:28:14.654Z","message":{"role":"assistant","content":[{"type":"thinking","thinking":"So the defaults are beta1=0.9, beta2=0.95, and I ran with beta1=0.9, beta2=0.95 (same as default). But got 2.2897 vs 2.2996. This could be random variation (noise). But let me log it anyway and try again with different beta values to see if there's a real signal.\n\nLet me log this run and then try beta1=0.95/beta2=0.99.","thinkingSignature":"3c691beed674975af0d1d9e08fe1ca6a73f693f1212956d2e21c5831791f907c"},{"type":"toolCall","id":"call_function_uomq3wn7g6kq_1","name":"log_experiment","arguments":{"asi":{"arch":"rope32+ema994+clip0.3+qk4+warmdown0.80+lr0.0008+beta095","conclusion":"2.29 - could be noise or real improvement with 1200 steps","result":"possible new best - 2.2897"},"commit":"8f3abc1","description":"Best config + beta095: 2.290, possible new best!","metric":2.2897,"metrics":{"artifact_mb":12.1,"best_val_bpb":2.2897,"steps":1200},"status":"keep"}}],"api":"anthropic-messages","provider":"minimax","model":"MiniMax-M2.7","usage":{"input":93237,"output":296,"cacheRead":9711,"cacheWrite":0,"totalTokens":103244,"cost":{"input":0.0279711,"output":0.00035519999999999996,"cacheRead":0.0005826599999999999,"cacheWrite":0,"total":0.028908959999999997}},"stopReason":"toolUse","timestamp":1777256882921,"responseId":"063dfcb640c98892f19964ec2f90c21e"}}
