{"type":"message","id":"0cca834c","parentId":"5bb9c5a2","timestamp":"2026-04-25T18:32:37.255Z","message":{"role":"toolResult","toolCallId":"call_function_zcp7514pxjne_1","toolName":"read","content":[{"type":"text","text":"---\nname: autoresearch-create\ndescription: Set up and run an autonomous experiment loop for any optimization target. Gathers what to optimize, then starts the loop immediately. Use when asked to \"run autoresearch\", \"optimize X in a loop\", \"set up autoresearch for X\", or \"start experiments\".\n---\n\n# Autoresearch\n\nAutonomous experiment loop: try ideas, keep what works, discard what doesn't, never stop.\n\n## Tools\n\n- **`init_experiment`** — configure session (name, metric, unit, direction). Call again to re-initialize with a new baseline when the optimization target changes.\n- **`run_experiment`** — runs command, times it, captures output.\n- **`log_experiment`** — records result. `keep` auto-commits. `discard`/`crash`/`checks_failed` auto-reverts code changes (autoresearch files preserved). Always include secondary `metrics` dict. Dashboard: ctrl+shift+t.\n\n## Setup\n\n1. Ask (or infer): **Goal**, **Command**, **Metric** (+ direction), **Files in scope**, **Constraints**.\n2. `git checkout -b autoresearch/<goal>-<date>`\n3. Read the source files. Understand the workload deeply before writing anything.\n4. Write `autoresearch.md` and `autoresearch.sh` (see below). Commit both.\n5. `init_experiment` → run baseline → `log_experiment` → start looping immediately.\n\n### `autoresearch.md`\n\nThis is the heart of the session. A fresh agent with no context should be able to read this file and run the loop effectively. Invest time making it excellent.\n\n```markdown\n# Autoresearch: <goal>\n\n## Objective\n<Specific description of what we're optimizing and the workload.>\n\n## Metrics\n- **Primary**: <name> (<unit>, lower/higher is better) — the optimization target\n- **Secondary**: <name>, <name>, ... — independent tradeoff monitors\n\n## How to Run\n`./autoresearch.sh` — outputs `METRIC name=number` lines.\n\n## Files in Scope\n<Every file the agent may modify, with a brief note on what it does.>\n\n## Off Limits\n<What must NOT be touched.>\n\n## Constraints\n<Hard rules: tests must pass, no new deps, etc.>\n\n## What's Been Tried\n<Update this section as experiments accumulate. Note key wins, dead ends,\nand architectural insights so the agent doesn't repeat failed approaches.>\n```\n\nUpdate `autoresearch.md` periodically — especially the \"What's Been Tried\" section — so resuming agents have full context.\n\n### `autoresearch.sh`\n\nBash script (`set -euo pipefail`) that: pre-checks fast (syntax errors in <1s), runs the benchmark, and outputs structured lines to stdout. Keep the script fast — every second is multiplied by hundreds of runs.\n\n**For fast, noisy benchmarks** (< 5s), run the workload multiple times inside the script and report the median. This produces stable data points and makes the confidence score reliable from the start. Slow workloads (ML training, large builds) don't need this — single runs are fine.\n\n#### Structured output\n\n- `METRIC name=value` — primary metric (must match `init_experiment`'s `metric_name`) and any secondary metrics. Parsed automatically by `run_experiment`.\n\n#### Design the script to inform optimization\n\nThe script should output **whatever data helps you make better decisions in the next iteration.** Think about what you'll need to see after each run to know where to focus:\n\n- Phase timings when the workload has distinct stages\n- Error counts, failure categories, or test names when checks can fail in different ways\n- Memory usage, cache hit rates, or other runtime diagnostics when relevant\n- Anything domain-specific that would help localize regressions or identify bottlenecks\n\nThe script runs the same code every iteration — but you can **update it during the loop** if you discover you need more signal. Add instrumentation as you learn what matters.\n\n#### Agent-supplied ASI via `log_experiment`\n\nUse `log_experiment`'s `asi` parameter to annotate each run with **whatever would help the next iteration make a better decision.** Free-form key/value pairs — you decide what's worth recording. Don't repeat the description or raw output; capture what you'd lose after a context reset.\n\n**Annotate failures and crashes heavily.** Discarded and crashed runs are reverted — the code changes are gone. The only record that survives is the description and ASI in `autoresearch.jsonl`. If you don't capture what you tried and why it failed, future iterations will waste time re-discovering the same dead ends.\n\n### `autoresearch.config.json` (optional)\n\nJSON config file that lives in the pi session's working directory (`ctx.cwd`). Supported fields:\n\n- **`maxIterations`** (number) — maximum experiments before auto-stopping.\n- **`workingDir`** (string) — override the directory for all autoresearch operations: file I/O (`autoresearch.jsonl`, `autoresearch.md`, `autoresearch.sh`, `autoresearch.checks.sh`, `autoresearch.ideas.md`), command execution, and git operations. Supports absolute paths or relative paths (resolved against `ctx.cwd`). The config file itself always stays in `ctx.cwd`. Fails if the directory doesn't exist.\n\n```json\n{\n  \"workingDir\": \"/path/to/project\",\n  \"maxIterations\": 50\n}\n```\n\n### `autoresearch.checks.sh` (optional)\n\nBash script (`set -euo pipefail`) for backpressure/correctness checks: tests, types, lint, etc. **Only create this file when the user's constraints require correctness validation** (e.g., \"tests must pass\", \"types must check\").\n\nWhen this file exists:\n- Runs automatically after every **passing** benchmark in `run_experiment`.\n- If checks fail, `run_experiment` reports it clearly — log as `checks_failed`.\n- Its execution time does **NOT** affect the primary metric.\n- You cannot `keep` a result when checks have failed.\n- Has a separate timeout (default 300s, configurable via `checks_timeout_seconds`).\n\nWhen this file does **not** exist, everything behaves exactly as before — no changes to the loop.\n\n**Keep output minimal.** Only the last 80 lines of checks output are fed back to the agent on failure. Suppress verbose progress/success output and let only errors through. This keeps context lean and helps the agent pinpoint what broke.\n\n```bash\n#!/bin/bash\nset -euo pipefail\n# Example: run tests and typecheck — suppress success output, only show errors\npnpm test --run --reporter=dot 2>&1 | tail -50\npnpm typecheck 2>&1 | grep -i error || true\n```\n\n## Loop Rules\n\n**LOOP FOREVER.** Never ask \"should I continue?\" — the user expects autonomous work.\n\n- **Primary metric is king.** Improved → `keep`. Worse/equal → `discard`. Secondary metrics rarely affect this.\n- **Annotate every run with `asi`.** Record what you learned — not what you did. What would help the next iteration or a fresh agent resuming this session?\n- **Watch the confidence score.** After 3+ runs, `log_experiment` reports a confidence score (best improvement as a multiple of the session noise floor). ≥2.0× means the improvement is likely real. <1.0× means it's within noise — consider re-running to confirm before keeping. The score is advisory — it never auto-discards.\n- **Simpler is better.** Removing code for equal perf = keep. Ugly complexity for tiny gain = probably discard.\n- **Don't thrash.** Repeatedly reverting the same idea? Try something structurally different.\n- **Crashes:** fix if trivial, otherwise log and move on. Don't over-invest.\n- **Think longer when stuck.** Re-read source files, study the profiling data, reason about what the CPU is actually doing. The best ideas come from deep understanding, not from trying random variations.\n- **Resuming:** if `autoresearch.md` exists, read it + git log, continue looping.\n\n**NEVER STOP.** The user may be away for hours. Keep going until interrupted.\n\n## Ideas Backlog\n\nWhen you discover complex but promising optimizations that you won't pursue right now, **append them as bullets to `autoresearch.ideas.md`**. Don't let good ideas get lost.\n\nOn resume (context limit, crash), check `autoresearch.ideas.md` — prune stale/tried entries, experiment with the rest. When all paths are exhausted, delete the file and write a final summary.\n\n## User Messages During Experiments\n\nIf the user sends a message while an experiment is running, finish the current `run_experiment` + `log_experiment` cycle first, then incorporate their feedback in the next iteration. Don't abandon a running experiment.\n"}],"isError":false,"timestamp":1777141957255}}
{"type":"message","id":"100492d7","parentId":"0cca834c","timestamp":"2026-04-25T18:32:50.198Z","message":{"role":"assistant","content":[{"type":"thinking","thinking":"Now I understand the full setup. Let me write the autoresearch files while the 30-min run is still going. I'll prepare everything for Phase 3.\n\nKey things I need to define:\n1. Goal: Optimize val_bpb for sub-1 BPB target with 30-min training\n2. Metric: val_bpb (lower is better)\n3. Files in scope: train_kaggle.py, hyperparameters, architecture settings\n4. Command: Run train_kaggle.py on Kaggle, extract val_bpb\n5. Constraints: Must stay under 16MB, must work on 2xT4\n\nLet me write the autoresearch.md and autoresearch.sh files.\n\n\nI need to check what the current performance looks like before finalizing these files. The 30-min run should give me a baseline to work from, but I'll start drafting the setup files now and adjust the search space once I have that data point.\n\nThe key decisions I'm facing are: the architecture itself, how to configure TTT and PPM for post-training optimization, and whether to enable them by default or leave them optional. I also need to nail down the exact training parameters like learning rate, weight decay, and batch size. Let me write out the autorun script first since it's straightforward, then work on the configuration document to clarify the search space.","thinkingSignature":"88d13e8a6c97da23242bd1312a13c81792183992b3c76aeb09d694b6b65c655c"},{"type":"text","text":"\n\nWhile the 30-min baseline run is going (~29 min left), I'll prep Phase 3: Autoresearch setup.\n"},{"type":"toolCall","id":"call_function_5sxxwhjmoo2n_1","name":"write","arguments":{"content":"#!/bin/bash\n# Parameter Golf Autoresearch - 30-min training runs on Kaggle\n# Each run = push kernel → wait → extract val_bpb\n\nset -euo pipefail\n\nREPO=\"$(cd \"$(dirname \"$0\")/..\" && pwd)\"\nWORK=\"$REPO/experiments/kaggle_work\"\nOUT=\"$REPO/experiments/kaggle_results\"\nSTATE=\"$REPO/experiments/kaggle_state.json\"\n\n# =============================================================================\n# FAST PRE-CHECK (syntax, <1s)\n# =============================================================================\n\npython3 -m py_compile \"$REPO/train_kaggle.py\" 2>/dev/null || {\n    echo \"SYNTAX ERROR train_kaggle.py\"\n    exit 1\n}\n\n# =============================================================================\n# RUN ID\n# =============================================================================\n\nRUN_ID=\"${RUN_ID:-pg-ar-$(date +%Y%m%d-%H%M%S)-$$}\"\nTIMEOUT=\"${TIMEOUT:-2400}\"  # 40 min Kaggle timeout (gives buffer)\n\n# =============================================================================\n# LAUNCH KAGGLE KERNEL\n# =============================================================================\n\ncd \"$REPO\"\n\n# Build kernel with current env vars baked in\n\"$REPO/experiments/pg_autoresearch.py\" launch \\\n    --name \"ar-$RUN_ID\" \\\n    --env \"RUN_ID=$RUN_ID\" \\\n    --env \"ITERATIONS=7000\" \\\n    --env \"MAX_WALLCLOCK_SECONDS=1800\" \\\n    2>&1 | tee /tmp/ar_launch_$$.json\n\nKERNEL_REF=$(python3 -c \"import json,sys; d=json.load(sys.stdin); print(d.get('ref',''))\" < /tmp/ar_launch_$$.json)\n\nif [ -z \"$KERNEL_REF\" ]; then\n    echo \"ERROR: Failed to launch kernel\"\n    exit 1\nfi\n\necho \"[AR] Kernel launched: $KERNEL_REF\"\n\n# =============================================================================\n# WAIT FOR COMPLETION\n# =============================================================================\n\n\"$REPO/experiments/pg_autoresearch.py\" status --ref \"$KERNEL_REF\" || true\necho \"[AR] Waiting for completion (timeout=${TIMEOUT}s)...\"\n\npython3 -c \"\nimport subprocess, json, time, sys\nref = '$KERNEL_REF'\ntimeout = $TIMEOUT\npoll = 30\ndeadline = time.time() + timeout\nwhile time.time() < deadline:\n    cp = subprocess.run(['$REPO/experiments/pg_autoresearch.py', 'status', '--ref', ref], capture_output=True, text=True)\n    status = cp.stdout.strip()\n    print(f'[AR] status={status}', flush=True)\n    if 'COMPLETE' in status or 'ERROR' in status:\n        print(f'[AR] Done: {status}', flush=True)\n        sys.exit(0)\n    time.sleep(poll)\nprint('[AR] TIMEOUT', flush=True)\nsys.exit(1)\n\" || {\n    echo \"[AR] Wait failed or timeout\"\n    exit 1\n}\n\n# =============================================================================\n# COLLECT RESULTS\n# =============================================================================\n\n\"$REPO/experiments/pg_autoresearch.py\" collect \\\n    --ref \"$KERNEL_REF\" \\\n    --name \"$RUN_ID\" \\\n    2>&1 | tee /tmp/ar_result_$$.json\n\n# =============================================================================\n# EXTRACT METRICS FOR AUTORESEARCH\n# =============================================================================\n\nMETRICS=$(python3 -c \"\nimport json, sys\ntry:\n    d = json.load(open('/tmp/ar_result_$$.json'))\n    val_bpb = d.get('metric', d.get('val_bpb', d.get('best_val_bpb', 999.0)))\n    best_val_bpb = d.get('best_val_bpb', val_bpb)\n    ttt_val_bpb = d.get('ttt_val_bpb')\n    steps = d.get('steps', 0)\n    compressed = d.get('compressed_bytes')\n    runtime = d.get('runtime_seconds')\n    status = d.get('status', 'UNKNOWN')\n    error = d.get('error', '')\n    non_finite = d.get('non_finite', False)\n    \n    print(f'val_bpb={val_bpb}')\n    print(f'best_val_bpb={best_val_bpb}')\n    if ttt_val_bpb:\n        print(f'ttt_val_bpb={ttt_val_bpb}')\n    print(f'steps={steps}')\n    if compressed:\n        print(f'compressed_bytes={compressed}')\n    if runtime:\n        print(f'runtime_seconds={runtime}')\n    print(f'status={status}')\n    \n    if error:\n        print(f'ERROR: {error[:200]}', file=sys.stderr)\n    if non_finite or status == 'ERROR':\n        print('[AR] NON-FINITE or ERROR detected', file=sys.stderr)\n        sys.exit(1)\nexcept Exception as e:\n    print(f'PARSE ERROR: {e}', file=sys.stderr)\n    sys.exit(1)\n\" 2>&1)\n\nMETRIC_LINE=$(echo \"$METRICS\" | grep \"^val_bpb=\" || echo \"val_bpb=999.0\")\necho \"[AR] METRIC $METRIC_LINE\"\necho \"$METRICS\"\n\n# Exit with success if we got a valid result\nexit 0\n","path":"/Users/dhruv2mars/dev/github/parameter-golf/autoresearch.sh"}}],"api":"anthropic-messages","provider":"minimax","model":"MiniMax-M2.7","usage":{"input":1940,"output":1449,"cacheRead":33728,"cacheWrite":0,"totalTokens":37117,"cost":{"input":0.0005819999999999999,"output":0.0017388,"cacheRead":0.00202368,"cacheWrite":0,"total":0.0043444799999999995}},"stopReason":"toolUse","timestamp":1777141957258,"responseId":"063c3bc5898fa18cc29e9c915057d09c"}}
{"type":"message","id":"c2c5bf92","parentId":"100492d7","timestamp":"2026-04-25T18:32:50.223Z","message":{"role":"toolResult","toolCallId":"call_function_5sxxwhjmoo2n_1","toolName":"write","content":[{"type":"text","text":"Successfully wrote 4335 bytes to /Users/dhruv2mars/dev/github/parameter-golf/autoresearch.sh"}],"isError":false,"timestamp":1777141970223}}
{"type":"message","id":"0b5d9529","parentId":"c2c5bf92","timestamp":"2026-04-25T18:33:02.534Z","message":{"role":"assistant","content":[{"type":"thinking","thinking":"Now write the autoresearch.md.\n","thinkingSignature":"f56dec26efe11dad2c251e572268782f525525f26d6907f01d9eee81be50744a"},{"type":"toolCall","id":"call_function_nss5dpy5mf62_1","name":"write","arguments":{"content":"# Autoresearch: Parameter Golf - Find Best Config for Sub-1 BPB\n\n## Objective\n\nOptimize a language model under 16MB to achieve the lowest bits-per-byte (BPB) on FineWeb validation.\nEach iteration = one 30-minute Kaggle training run.\nWinner will be used for extended training (6-12hr) to hit sub-1 BPB.\n\n## Metrics\n\n- **Primary**: `val_bpb` (BPB, lower is better) — the optimization target\n- **Secondary**: `best_val_bpb`, `ttt_val_bpb`, `steps`, `compressed_bytes`, `runtime_seconds`\n\n## How to Run\n\n```bash\n./autoresearch.sh\n```\n\nOutputs `METRIC val_bpb=X` lines. Each run takes ~40 min (30 min training + buffer).\n\n## Files in Scope\n\n- `train_kaggle.py` — main training pipeline (all hyperparameters configurable via env vars)\n- `run_train.sh` — runner script (reference, not used by autoresearch)\n- `experiments/pg_autoresearch.py` — Kaggle kernel launcher/collector\n- `autoresearch.sh` — this loop's driver\n\n## Off Limits\n\n- Do NOT modify the data pipeline (FineWeb downloads, tokenizer)\n- Do NOT change vocab_size below 8192 (tokenizer is fixed)\n- Do NOT increase ITERATIONS above 7000 for the 30-min loop\n\n## Constraints\n\n- Model must fit under 16MB (checked at submission)\n- 30-min wallclock cap per run\n- Training must be stable (no NaN/Inf)\n\n## Search Space\n\n### Architecture (env vars in train_kaggle.py)\n\n| Parameter | Current | Search Range | Notes |\n|-----------|---------|--------------|-------|\n| NUM_LAYERS | 11 | 8-14 | More layers = more capacity but slower |\n| MODEL_DIM | 512 | 384-640 | Width of model |\n| NUM_HEADS | 8 | 4-16 | Attention heads |\n| NUM_KV_HEADS | 4 | 2-8 | KV heads for GQA |\n| MLP_MULT | 4 | 2-6 | MLP hidden dim = dim * mult |\n| ROPE_DIMS | 16 | 8-32 | RoPE dimensions |\n| QK_GAIN_INIT | 5.25 | 3.0-8.0 | QK scaling per head |\n| NUM_LOOPS | 2 | 1-4 | Depth recurrence loops |\n| LOOP_START | 3 | 2-6 | First layer to loop |\n| LOOP_END | 5 | 4-8 | Last layer to loop |\n\n### Hyperparameters\n\n| Parameter | Current | Search Range |\n|-----------|---------|--------------|\n| MATRIX_LR | 0.001 | 0.0001-0.005 |\n| WEIGHT_DECAY | 0.095 | 0.01-0.2 |\n| EMA_DECAY | 0.9965 | 0.99-0.999 |\n| WARMDOWN_FRAC | 0.72 | 0.6-0.85 |\n| GRAD_CLIP_NORM | 1.0 | 0.3-2.0 |\n| TIE_EMBED_LR_RATIO | 1.0 | 0.1-2.0 |\n\n### TTT (Test-Time Training)\n\n| Parameter | Current | Search Range |\n|-----------|---------|--------------|\n| TTT_ENABLED | 0 | 0 or 1 |\n| TTT_LR | 0.005 | 0.001-0.02 |\n| TTT_EPOCHS | 3 | 1-5 |\n| TTT_WARMUP_TOKENS | 32768 | 8192-131072 |\n\n### Quantization\n\n| Parameter | Current | Search Range |\n|-----------|---------|--------------|\n| MATRIX_CLIP_SIGMAS | 12.85 | 8-20 |\n| EMBED_CLIP_SIGMAS | 20.0 | 10-30 |\n\n### Training\n\n| Parameter | Current | Search Range |\n|-----------|---------|--------------|\n| TRAIN_BATCH_TOKENS | 8192 | 4096-32768 |\n| TRAIN_SEQ_LEN | 512 | 256-1024 |\n| GRAD_ACCUM_STEPS | 1 | 1-4 |\n\n## What's Been Tried\n\n### Baseline\n- 30-min run (ITERATIONS=7000, MAX_WALLCLOCK=1800) — RUNNING NOW\n- Expected ~1.0-1.5 BPB based on 10-min runs at ~2.65 BPB\n\n### Known from prior experiments\n- **SOTA architecture**: 11L x 512d x 8H / 4KV with tied embeddings\n- **SP8192 tokenizer** is fixed (cannot change)\n- **Depth recurrence**: layers 3-5, loop 2x, activates at 35% training\n- **QK-Gain 5.25** is proven optimal\n- **MLP 4x** with squared LeakyReLU\n- **RoPE 16 dims** at base 10000\n- **Best 10-min BPB**: ~2.65 (current), SOTA ~2.2-2.3 expected\n- **Best Kaggle leaderboard**: ~1.08-1.12 BPB (10-min on H100 equivalent)\n\n### Ideas to Try\n- **TTT**: Enable TTT (currently disabled) — may add ~0.05-0.1 BPB\n- **PPM**: Not yet implemented — hybrid byte-level compression\n- **Architecture exploration**: Wider/shallower vs narrower/deeper\n- **Extended warmdown**: Longer learning rate decay\n- **Lower learning rate**: May improve convergence\n\n## Loop Strategy\n\n1. Start with 30-min baseline (RUNNING NOW)\n2. Establish baseline BPB\n3. Try architecture changes first (layers, dims, heads) — highest impact\n4. Then tune hyperparameters (LR, WD, EMA) — medium impact\n5. Enable TTT if disabled — easy win if it works\n6. Explore PPM integration if time permits\n7. Keep iterating until confident in best config\n8. Run extended training (6-12hr) on winning config\n\n## Notes\n\n- T4 is ~3x slower than H100, so 30-min on T4 ≈ 10-min on H100\n- Sub-1 BPB likely requires: extended training (6hr+) + TTT + good architecture\n- Each run takes ~40 min (30 min training + 10 min queue/overhead)\n- Loop runs indefinitely until manually stopped\n","path":"/Users/dhruv2mars/dev/github/parameter-golf/autoresearch.md"}}],"api":"anthropic-messages","provider":"minimax","model":"MiniMax-M2.7","usage":{"input":1211,"output":1467,"cacheRead":35648,"cacheWrite":0,"totalTokens":38326,"cost":{"input":0.0003633,"output":0.0017603999999999999,"cacheRead":0.0021388799999999997,"cacheWrite":0,"total":0.00426258}},"stopReason":"toolUse","timestamp":1777141970225,"responseId":"063c3bd2748103599cc10f24edd3de64"}}
{"type":"message","id":"d69867bc","parentId":"0b5d9529","timestamp":"2026-04-25T18:33:02.547Z","message":{"role":"toolResult","toolCallId":"call_function_nss5dpy5mf62_1","toolName":"write","content":[{"type":"text","text":"Successfully wrote 4463 bytes to /Users/dhruv2mars/dev/github/parameter-golf/autoresearch.md"}],"isError":false,"timestamp":1777141982547}}
