{"type":"message","id":"28128c2d","parentId":"392863cd","timestamp":"2026-04-25T18:07:58.576Z","message":{"role":"toolResult","toolCallId":"call_function_zutsix0gr12n_1","toolName":"read","content":[{"type":"text","text":"#!/usr/bin/env python3\n\"\"\"\nParameter Golf - Kaggle 2xT4 Optimized Training Pipeline\n=======================================================\nClean, stable implementation for long-running sessions.\n\nKey features:\n- Checkpointing every 5 minutes with resume capability\n- NaN/Inf detection with graceful recovery\n- Incremental 10-minute validation cycles\n- Standard proven architecture (11L x 512d, SP8192, depth recurrence)\n- TTT (Test-Time Training) for final BPB boost\n\nTarget: Sub-1 BPB on 2xT4 GPUs with extended training.\n\"\"\"\n\nimport gc\nimport glob\nimport io\nimport json\nimport math\nimport os\nimport random\nimport signal\nimport sys\nimport time\nimport uuid\nimport zlib\nfrom pathlib import Path\n\nimport numpy as np\nimport sentencepiece as spm\nimport torch\nimport torch.distributed as dist\nimport torch.nn.functional as F\nfrom torch import nn\nfrom torch.nn.parallel import DistributedDataParallel as DDP\n\n# ============================================================================\n# CONSTANTS\n# ============================================================================\n\n# T4 specs: 16GB VRAM each, ~65 TFLOPs vs H100 SXM ~400 TFLOPs\n# T4 is ~3x slower, so we compensate with more accumulation\n_T4_BATCH_TOKENS = 8192\n_T4_SEQ_LEN = 512\n_T4_GRAD_ACCUM = 1          # 1 for quick feedback, 4 for larger effective batch\n_T4_ITERATIONS = 2500        # Base iterations (will scale with time)\n_T4_MAX_WALLCLOCK = 570      # 10 minutes for quick validation runs\n_T4_MATRIX_LR = 0.001       # AdamW LR tuned for T4\n\n# Checkpointing\n_CHECKPOINT_DIR = \"checkpoints\"\n_CHECKPOINT_EVERY_SECONDS = 300  # 5 minutes\n_CHECKPOINT_PREFIX = \"ckpt_step_\"\n\n# ============================================================================\n# HYPERPARAMETERS\n# ============================================================================\n\nclass H:\n    \"\"\"Hyperparameters - all configurable via environment variables.\"\"\"\n    \n    # Paths\n    data_path = os.environ.get(\"DATA_PATH\", \"/tmp/fineweb-pg\")\n    run_id = os.environ.get(\"RUN_ID\", str(uuid.uuid4())[:8])\n    seed = int(os.environ.get(\"SEED\", 1337))\n    checkpoint_dir = os.environ.get(\"CHECKPOINT_DIR\", _CHECKPOINT_DIR)\n    \n    # Training\n    iterations = int(os.environ.get(\"ITERATIONS\", _T4_ITERATIONS))\n    train_batch_tokens = int(os.environ.get(\"TRAIN_BATCH_TOKENS\", _T4_BATCH_TOKENS))\n    train_seq_len = int(os.environ.get(\"TRAIN_SEQ_LEN\", _T4_SEQ_LEN))\n    grad_accum_steps = int(os.environ.get(\"GRAD_ACCUM_STEPS\", _T4_GRAD_ACCUM))\n    max_wallclock_seconds = float(os.environ.get(\"MAX_WALLCLOCK_SECONDS\", _T4_MAX_WALLCLOCK))\n    warmup_steps = int(os.environ.get(\"WARMUP_STEPS\", 50))\n    warmdown_frac = float(os.environ.get(\"WARMDOWN_FRAC\", 0.72))\n    min_lr_ratio = float(os.environ.get(\"MIN_LR_RATIO\", 0.1))\n    \n    # Validation\n    val_loss_every = int(os.environ.get(\"VAL_LOSS_EVERY\", 50))\n    val_max_tokens = int(os.environ.get(\"VAL_MAX_TOKENS\", 131072))\n    \n    # Model architecture (proven SOTA config)\n    vocab_size = int(os.environ.get(\"VOCAB_SIZE\", 8192))\n    num_layers = int(os.environ.get(\"NUM_LAYERS\", 11))\n    model_dim = int(os.environ.get(\"MODEL_DIM\", 512))\n    num_heads = int(os.environ.get(\"NUM_HEADS\", 8))\n    num_kv_heads = int(os.environ.get(\"NUM_KV_HEADS\", 4))\n    mlp_mult = int(os.environ.get(\"MLP_MULT\", 4))\n    tie_embeddings = bool(int(os.environ.get(\"TIE_EMBEDDINGS\", \"1\")))\n    rope_base = float(os.environ.get(\"ROPE_BASE\", 10000.0))\n    rope_dims = int(os.environ.get(\"ROPE_DIMS\", 16))\n    logit_softcap = float(os.environ.get(\"LOGIT_SOFTCAP\", 30.0))\n    \n    # Depth recurrence (proven: layers 3-5 loop twice)\n    num_loops = int(os.environ.get(\"NUM_LOOPS\", 2))\n    loop_start = int(os.environ.get(\"LOOP_START\", 3))\n    loop_end = int(os.environ.get(\"LOOP_END\", 5))\n    enable_looping_at = float(os.environ.get(\"ENABLE_LOOPING_AT\", 0.35))\n    \n    # QK-Gain (proven: 5.25 is optimal)\n    qk_gain_init = float(os.environ.get(\"QK_GAIN_INIT\", 5.25))\n    \n    # Optimizer\n    matrix_lr = float(os.environ.get(\"MATRIX_LR\", _T4_MATRIX_LR))\n    weight_decay = float(os.environ.get(\"WEIGHT_DECAY\", 0.095))\n    beta1 = float(os.environ.get(\"BETA1\", 0.9))\n    beta2 = float(os.environ.get(\"BETA2\", 0.95))\n    adam_eps = float(os.environ.get(\"ADAM_EPS\", 1e-8))\n    grad_clip_norm = float(os.environ.get(\"GRAD_CLIP_NORM\", 1.0))\n    \n    # EMA (proven: 0.9965 is optimal)\n    ema_decay = float(os.environ.get(\"EMA_DECAY\", 0.9965))\n    \n    # Quantization\n    matrix_clip_sigmas = float(os.environ.get(\"MATRIX_CLIP_SIGMAS\", 12.85))\n    embed_clip_sigmas = float(os.environ.get(\"EMBED_CLIP_SIGMAS\", 20.0))\n    \n    # TTT (Test-Time Training) - enables via env var\n    ttt_enabled = bool(int(os.environ.get(\"TTT_ENABLED\", \"0\")))\n    ttt_lr = float(os.environ.get(\"TTT_LR\", 0.005))\n    ttt_epochs = int(os.environ.get(\"TTT_EPOCHS\", 3))\n    ttt_warmup_tokens = int(os.environ.get(\"TTT_WARMUP_TOKENS\", 32768))\n\n\n# ============================================================================\n# DATA LOADING\n# ============================================================================\n\ndef download_data(data_path, vocab_size=8192):\n    \"\"\"Download tokenizer and data shards from HuggingFace.\"\"\"\n    from huggingface_hub import hf_hub_download\n    \n    data_path = os.path.join(data_path, f\"fineweb10B_sp{vocab_size}\")\n    parent = os.path.dirname(data_path)\n    tok_dir = os.path.join(parent, \"tokenizers\")\n    \n    os.makedirs(data_path, exist_ok=True)\n    os.makedirs(tok_dir, exist_ok=True)\n    \n    repo_id = \"kevclark/parameter-golf\"\n    \n    # Tokenizer\n    tok_path = os.path.join(tok_dir, f\"fineweb_{vocab_size}_bpe.model\")\n    if not os.path.exists(tok_path) or os.path.getsize(tok_path) < 1000:\n        print(f\"Downloading tokenizer...\")\n        cached = hf_hub_download(\n            repo_id=repo_id,\n            filename=f\"datasets/tokenizers/fineweb_{vocab_size}_bpe.model\",\n            repo_type=\"dataset\"\n        )\n        import shutil\n        shutil.copy(cached, tok_path)\n        print(f\"Downloaded: {tok_path}\")\n    \n    # Data shards - need both val and train\n    for prefix, count in [(\"val\", 1), (\"train\", 2)]:\n        for i in range(count):\n            local = os.path.join(data_path, f\"fineweb_{prefix}_{i:06d}.bin\")\n            if os.path.exists(local) and os.path.getsize(local) > 1000:\n                continue\n            remote = f\"datasets/datasets/fineweb10B_sp{vocab_size}/fineweb_{prefix}_{i:06d}.bin\"\n            try:\n                cached = hf_hub_download(repo_id=repo_id, filename=remote, repo_type=\"dataset\")\n                import shutil\n                shutil.copy(cached, local)\n                print(f\"Downloaded: {os.path.basename(local)}\")\n            except Exception as e:\n                print(f\"ERROR downloading {remote}: {e}\")\n                raise\n    \n    return data_path, tok_path\n\n\ndef load_shard(path):\n    \"\"\"Load a FineWeb binary shard.\"\"\"\n    header = np.fromfile(path, dtype=\"<i4\", count=256)\n    if header.size != 256 or int(header[0]) != 20240520:\n        raise ValueError(f\"Bad shard header: {path}\")\n    num_tokens = int(header[2])\n    data = np.fromfile(path, dtype=\"<u2\", count=num_tokens, offset=256*4)\n    return torch.from_numpy(data.astype(np.uint16))\n\n\nclass TokenStream:\n    \"\"\"Streaming token loader that cycles through shards.\"\"\"\n    \n    def __init__(self, pattern):\n        self.files = sorted(Path(p) for p in glob.glob(str(pattern)))\n        if not self.files:\n            raise FileNotFoundError(f\"No files matching: {pattern}\")\n        self.file_idx = 0\n        self.tokens = load_shard(self.files[0])\n        self.pos = 0\n    \n    def _next_file(self):\n        self.file_idx = (self.file_idx + 1) % len(self.files)\n        self.tokens = load_shard(self.files[self.file_idx])\n        self.pos = 0\n    \n    def take(self, n):\n        \"\"\"Take n tokens, cycling through shards.\"\"\"\n        result = []\n        while n > 0:\n            avail = self.tokens.numel() - self.pos\n            if avail <= 0:\n                self._next_file()\n                continue\n            k = min(n, avail)\n            result.append(self.tokens[self.pos:self.pos+k])\n            self.pos += k\n            n -= k\n        return torch.cat(result)\n    \n    def seek_tokens(self, n):\n        \"\"\"Skip first n tokens (for resume).\"\"\"\n        while n > 0:\n            avail = self.tokens.numel() - self.pos\n            if avail <= n:\n                n -= avail\n                self._next_file()\n            else:\n                self.pos += n\n                n = 0\n\n\n# ============================================================================\n# TOKENIZER UTILITIES\n# ============================================================================\n\ndef build_byte_lut(sp, vocab_size, device):\n    \"\"\"Build lookup table: token -> byte count.\"\"\"\n    base_bytes = torch.zeros(vocab_size, dtype=torch.int16, device=device)\n    for i in range(min(int(sp.vocab_size()), vocab_size)):\n        if sp.is_control(i) or sp.is_unknown(i) or sp.is_unused(i):\n            continue\n        piece = sp.id_to_piece(i)\n        if piece.startswith(\"▁\"):\n            piece = piece[1:]\n        base_bytes[i] = len(piece.encode(\"utf-8\"))\n    return base_bytes\n\n\ndef compute_val_bpb(val_loss, val_tokens, base_bytes_lut, device):\n    \"\"\"Compute validation bits-per-byte from cross-entropy loss.\"\"\"\n    bits_per_token = val_loss / math.log(2)\n    val_subset = val_tokens.to(device).long()\n    byte_count = base_bytes_lut[val_subset].sum().item()\n    tokens_per_byte = val_subset.numel() / max(byte_count, 1)\n    return bits_per_token * tokens_per_byte\n\n\n# ============================================================================\n# MODEL\n# ============================================================================\n\nclass RMSNorm(nn.Module):\n    def __init__(self, dim):\n        super().__init__()\n        self.scale = nn.Parameter(torch.ones(dim))\n    \n    def forward(self, x):\n        return self.scale * F.rms_norm(x, (x.size(-1),))\n\n\nclass CastedLinear(nn.Linear):\n    \"\"\"Linear that casts weights to float32 for computation.\"\"\"\n    def forward(self, x):\n        return F.linear(x, self.weight.float(), \n                        self.bias.float() if self.bias is not None else None)\n\n\nclass Rotary(nn.Module):\n    \"\"\"Rotary Position Embedding (RoPE).\"\"\"\n    def __init__(self, dim, base=10000.0, rope_dims=0):\n        super().__init__()\n        self.rope_dims = rope_dims if rope_dims > 0 else dim\n        inv_freq = 1.0 / (base ** (torch.arange(0, self.rope_dims, 2) / self.rope_dims))\n        self.register_buffer(\"inv_freq\", inv_freq, persistent=False)\n        self._cos = None\n        self._sin = None\n    \n    def forward(self, seq_len, device, dtype):\n        if self._cos is None or self._sin is None or self._cos.size(-2) != seq_len:\n            t = torch.arange(seq_len, device=device, dtype=self.inv_freq.dtype)\n            freqs = torch.outer(t, self.inv_freq.to(device))\n            self._cos = freqs.cos()[None, None, :, :]\n            self._sin = freqs.sin()[None, None, :, :]\n        return self._cos.to(dtype), self._sin.to(dtype)\n\n\ndef apply_rope(x, cos, sin, rope_dims=0):\n    \"\"\"Apply rotary embedding to query/key tensors.\"\"\"\n    if rope_dims > 0 and rope_dims < x.size(-1):\n        x_rope, x_pass = x[..., :rope_dims], x[..., rope_dims:]\n        half = rope_dims // 2\n        x1, x2 = x_rope[..., :half], x_rope[..., half:]\n        rotated = torch.cat((x1*cos + x2*sin, x1*(-sin) + x2*cos), -1)\n        return torch.cat((rotated, x_pass), -1)\n    half = x.size(-1) // 2\n    x1, x2 = x[..., :half], x[..., half:]\n    return torch.cat((x1*cos + x2*sin, x1*(-sin) + x2*cos), -1)\n\n\nclass Attention(nn.Module):\n    def __init__(self, dim, num_heads, num_kv_heads, rope_base, qk_gain_init, rope_dims=0):\n        super().__init__()\n        self.num_heads = num_heads\n        self.num_kv_heads = num_kv_heads\n        self.head_dim = dim // num_heads\n        self.rope_dims = rope_dims\n        kv_dim = num_kv_heads * self.head_dim\n        \n        self.q_proj = CastedLinear(dim, dim)\n        self.k_proj = CastedLinear(dim, kv_dim)\n        self.v_proj = CastedLinear(dim, kv_dim)\n        self.o_proj = CastedLinear(dim, dim)\n        \n        self.rotary = Rotary(self.head_dim, base=rope_base, rope_dims=rope_dims)\n        self.q_gain = nn.Parameter(torch.full((num_heads,), qk_gain_init, dtype=torch.float32))\n    \n    def forward(self, x):\n        b, s, d = x.shape\n        \n        q = self.q_proj(x).view(b, s, self.num_heads, self.head_dim).transpose(1, 2)\n        k = self.k_proj(x).view(b, s, self.num_kv_heads, self.head_dim).transpose(1, 2)\n        v = self.v_proj(x).view(b, s, self.num_kv_heads, self.head_dim).transpose(1, 2)\n        \n        # RMSNorm before QK projection (proven improvement)\n        q = F.rms_norm(q, (q.size(-1),))\n        k = F.rms_norm(k, (k.size(-1),))\n        \n        # Apply RoPE\n        cos, sin = self.rotary(s, x.device, q.dtype)\n        q = apply_rope(q, cos, sin, self.rope_dims)\n        k = apply_rope(k, cos, sin, self.rope_dims)\n        \n        # QK-Gain (learnable per-head scaling)\n        q = q * self.q_gain.view(1, -1, 1, 1).to(dtype=q.dtype)\n        \n        # KV replication for GQA\n        if self.num_kv_heads < self.num_heads:\n            repeat = self.num_heads // self.num_kv_heads\n            k = k.repeat_interleave(repeat, dim=1)\n            v = v.repeat_interleave(repeat, dim=1)\n        \n        # Attention\n        scale = self.head_dim ** -0.5\n        attn = torch.matmul(q * scale, k.transpose(-2, -1).float())\n        causal = torch.triu(torch.ones(s, s, device=x.device, dtype=torch.bool), 1)\n        attn = attn.masked_fill(causal, float(\"-inf\"))\n        attn = F.softmax(attn, dim=-1).to(q.dtype)\n        out = torch.matmul(attn, v).transpose(1, 2).contiguous().view(b, s, d)\n        return self.o_proj(out)\n\n\nclass MLP(nn.Module):\n    \"\"\"MLP with squared LeakyReLU activation.\"\"\"\n    def __init__(self, dim, mult=4):\n        super().__init__()\n        self.fc = CastedLinear(dim, mult * dim)\n        self.proj = CastedLinear(mult * dim, dim)\n    \n    def forward(self, x):\n        return self.proj(F.leaky_relu(self.fc(x), negative_slope=0.5).square())\n\n\nclass Block(nn.Module):\n    \"\"\"Transformer block with pre-norm and learned residuals.\"\"\"\n    def __init__(self, dim, num_heads, num_kv_heads, mlp_mult, rope_base, \n                 qk_gain_init, layer_idx, rope_dims=0):\n        super().__init__()\n        self.layer_idx = layer_idx\n        \n        self.attn_norm = RMSNorm(dim)\n        self.mlp_norm = RMSNorm(dim)\n        \n        self.attn = Attention(dim, num_heads, num_kv_heads, rope_base, qk_gain_init, rope_dims)\n        self.mlp = MLP(dim, mlp_mult)\n        \n        # Learned residual scaling (proven improvement)\n        self.attn_scale = nn.Parameter(torch.ones(dim))\n        self.mlp_scale = nn.Parameter(torch.ones(dim))\n        self.resid_mix = nn.Parameter(torch.stack((\n            torch.ones(dim), torch.zeros(dim)\n        )).float())\n        \n        # Layer scaling (deeper layers slightly smaller)\n        self.ln_scale = 1.0 / math.sqrt(layer_idx + 1)\n    \n    def forward(self, x, x0):\n        dtype = x.dtype\n        mix = self.resid_mix.to(dtype=dtype)\n        \n        # Residual mix: combine current and original residual\n        x_in = mix[0][None, None, :] * x + mix[1][None, None, :] * x0\n        \n        # Attention block\n        x = x_in + self.attn_scale.to(dtype=dtype)[None, None, :] * \\\n            self.attn(self.attn_norm(x_in) * self.ln_scale)\n        \n        # MLP block\n        x = x + self.mlp_scale.to(dtype=dtype)[None, None, :] * \\\n            self.mlp(self.mlp_norm(x) * self.ln_scale)\n        \n        return x\n\n\nclass GPT(nn.Module):\n    \"\"\"Standard transformer language model.\"\"\"\n    def __init__(self):\n        super().__init__()\n        \n        self.tok_emb = nn.Embedding(H.vocab_size, H.model_dim)\n        self.blocks = nn.ModuleList([\n            Block(\n                H.model_dim, H.num_heads, H.num_kv_heads, H.mlp_mult,\n                H.rope_base, H.qk_gain_init, i, H.rope_dims\n            )\n            for i in range(H.num_layers)\n        ])\n        self.final_norm = RMSNorm(H.model_dim)\n        \n        # Tied embeddings save parameters\n        self.lm_head = None if H.tie_embeddings else \\\n            CastedLinear(H.model_dim, H.vocab_size, bias=False)\n        \n        self._init_weights()\n    \n    def _init_weights(self):\n        if H.tie_embeddings:\n            nn.init.normal_(self.tok_emb.weight, std=0.005)\n        for m in self.modules():\n            if isinstance(m, CastedLinear) and m.bias is not None:\n                if (m.bias.data == 0).all() or m.bias.data.abs().sum() == 0:\n                    nn.init.zeros_(m.bias)\n    \n    def forward(self, x, target=None):\n        x = self.tok_emb(x)\n        x = F.rms_norm(x, (x.size(-1),))\n        x0 = x\n        \n        # Compute depth loop activation step\n        warmup_steps = int(H.iterations * H.enable_looping_at)\n        loop_active = False\n        \n        for i, block in enumerate(self.blocks):\n            x = block(x, x0)\n            \n            # Depth recurrence: loop layers 3-5 after warmup\n            if (i >= H.loop_start and i <= H.loop_end and \n                H.num_loops > 1 and loop_active):\n                for _ in range(H.num_loops - 1):\n                    x = block(x, x0)\n            \n            # Activate recurrence after warmup\n            if i == H.loop_start:\n                loop_active = True\n        \n        x = self.final_norm(x)\n        \n        # Output projection\n        if self.lm_head is not None:\n            logits = self.lm_head(x)\n        else:\n            logits = F.linear(x, self.tok_emb.weight)\n        \n        # Logit softcap (improves calibration)\n        logits = H.logit_softcap * torch.tanh(logits / H.logit_softcap)\n        \n        if target is not None:\n            return F.cross_entropy(logits.view(-1, H.vocab_size), target.view(-1), \n                                   reduction='mean')\n        return logits\n\n\n# ============================================================================\n# QUANTIZATION\n# ============================================================================\n\ndef quantize_row(t, clip_std_mult=12.85, bits=8):\n    \"\"\"Per-row quantization for GPTQ.\"\"\"\n    t = t.float()\n    qmax = (1 << (bits - 1)) - 1\n    \n    if t.ndim < 2:\n        scale = (t.abs().max() / qmax).clamp_min(1/qmax)\n        q = torch.round(torch.clamp(t, -qmax * scale, qmax * scale) / scale).to(torch.int8)\n        return q, scale\n    \n    std = t.std(dim=1, keepdim=True)\n    clip = std * clip_std_mult\n    scale = (clip / qmax).clamp_min(1/qmax)\n    q = torch.round(torch.clamp(t, -clip, clip) / scale).to(torch.int8)\n    return q, scale.squeeze(-1)\n\n\ndef pack_int6(q):\n    \"\"\"Pack int6 values into bytes (4 values per 3 bytes).\"\"\"\n    flat = (q.to(torch.int16).flatten() + 32).clamp_(0, 63).to(torch.int32)\n    pad = (-flat.numel()) % 4\n    if pad:\n        flat = torch.cat([flat, torch.zeros(pad, dtype=torch.int32)])\n    \n    vals = flat.view(-1, 4)\n    word = vals[:, 0] | (vals[:, 1] << 6) | (vals[:, 2] << 12) | (vals[:, 3] << 18)\n    \n    packed = torch.empty((word.numel(), 3), dtype=torch.uint8)\n    packed[:, 0] = (word & 255).to(torch.uint8)\n    packed[:, 1] = ((word >> 8) & 255).to(torch.uint8)\n    packed[:, 2] = ((word >> 16) & 255).to(torch.uint8)\n    \n    return packed.flatten(), pad\n\n\ndef quantize_state_dict(state_dict):\n    \"\"\"Quantize model weights for storage.\"\"\"\n    quantized = {}\n    scales = {}\n    meta = {}\n    \n    for name, tensor in state_dict.items():\n        t = tensor.detach().cpu()\n        \n        # Non-float tensors (embeddings indices, etc.)\n        if not t.is_floating_point():\n            quantized[name] = t.to(torch.int16)\n            continue\n        \n        # Embedding layers: int8\n        if \"tok_emb\" in name or \"lm_head\" in name:\n            q, s = quantize_row(t, clip_std_mult=H.embed_clip_sigmas, bits=8)\n            quantized[name] = q\n            meta[name] = {\"bits\": 8, \"shape\": tuple(t.shape)}\n        \n        # Matrix weights: int6\n        elif t.ndim == 2:\n            q, s = quantize_row(t, clip_std_mult=H.matrix_clip_sigmas, bits=6)\n            packed, pad = pack_int6(q)\n            quantized[name] = packed\n            meta[name] = {\"bits\": 6, \"shape\": tuple(t.shape), \"pad\": pad}\n        \n        # Other: int8\n        else:\n            q, s = quantize_row(t, clip_std_mult=H.matrix_clip_sigmas, bits=8)\n            quantized[name] = q\n            meta[name] = {\"bits\": 8, \"shape\": tuple(t.shape)}\n        \n        scales[name] = s\n    \n    return {\"q\": quantized, \"s\": scales, \"meta\": meta}\n\n\n# ============================================================================\n# CHECKPOINTING\n# ============================================================================\n\ndef save_checkpoint(step, model, optimizer, ema_state, best_val_bpb, \n                    train_stream_pos, run_dir):\