{"type":"message","id":"69255699","parentId":"fd164d50","timestamp":"2026-04-27T11:29:47.002Z","message":{"role":"assistant","content":[{"type":"thinking","thinking":"Let me see what the error was.","thinkingSignature":"a8b307ad0c5f546196c29fe0878665cb26dec5f27caaf43462e80ccfb9c9998b"},{"type":"toolCall","id":"call_function_v4kqfey8kch2_1","name":"understand_image","arguments":{"prompt":"What error caused the exit? Show the full terminal output.","image_url":"/Users/dhruv2mars/.agent-browser/tmp/screenshots/screenshot-1777289383014.png"}}],"api":"anthropic-messages","provider":"minimax","model":"MiniMax-M2.7","usage":{"input":54188,"output":77,"cacheRead":9348,"cacheWrite":0,"totalTokens":63613,"cost":{"input":0.0162564,"output":0.0000924,"cacheRead":0.0005608799999999999,"cacheWrite":0,"total":0.01690968}},"stopReason":"toolUse","timestamp":1777289383029,"responseId":"063e7ba786a41ee45138fa0c90f0765d"}}
{"type":"message","id":"5e522be4","parentId":"69255699","timestamp":"2026-04-27T11:30:11.494Z","message":{"role":"toolResult","toolCallId":"call_function_v4kqfey8kch2_1","toolName":"understand_image","content":[{"type":"text","text":"Based on the terminal output in the image, the script exited with a generic **`exit 1`** error code. There is no specific descriptive error message (like a Python traceback) visible in the terminal before the exit. The process terminated immediately after saving a checkpoint at step 150.\n\nCommon reasons for such an exit without a clear traceback in this context include hardware resource limits (e.g., running out of VRAM, as indicated by the nearly full T4 VRAM bar at the top right) or a silent crash in an underlying library.\n\n### Full Terminal Output:\n```text\nMETRIC val_loss=7.1684\nMETRIC val_bpb=3.3256\nMETRIC best_bpb=3.3256\nMETRIC elapsed_s=57\n[CKPT] Best checkpoint saved\nstep:100/2500 train_loss:6.5520 time:125s\nstep=100 val_loss=6.4919 val_bpb=3.0117 best_bpb=3.0117 elapsed_s=126\nMETRIC step=100\nMETRIC val_loss=6.4919\nMETRIC val_bpb=3.0117\nMETRIC best_bpb=3.0117\nMETRIC elapsed_s=126\n[CKPT] Best checkpoint saved\nstep=150 val_loss=6.2248 val_bpb=2.8878 best_bpb=2.8878 elapsed_s=195\nMETRIC step=150\nMETRIC val_loss=6.2248\nMETRIC val_bpb=2.8878\nMETRIC best_bpb=2.8878\nMETRIC elapsed_s=195\n[CKPT] Best checkpoint saved\n\n[1]  + 100120 exit 1      load_conda_and_run python3 ~/parameter-golf/train_kaggle.py 2>&1 | \n       100121 done        head -50\nautoresearch/phase1-20260426 ~/parameter-golf [] \n```"}],"details":{"server":"MiniMax","tool":"understand_image","structuredContent":{"type":"text","text":"Based on the terminal output in the image, the script exited with a generic **`exit 1`** error code. There is no specific descriptive error message (like a Python traceback) visible in the terminal before the exit. The process terminated immediately after saving a checkpoint at step 150.\n\nCommon reasons for such an exit without a clear traceback in this context include hardware resource limits (e.g., running out of VRAM, as indicated by the nearly full T4 VRAM bar at the top right) or a silent crash in an underlying library.\n\n### Full Terminal Output:\n```text\nMETRIC val_loss=7.1684\nMETRIC val_bpb=3.3256\nMETRIC best_bpb=3.3256\nMETRIC elapsed_s=57\n[CKPT] Best checkpoint saved\nstep:100/2500 train_loss:6.5520 time:125s\nstep=100 val_loss=6.4919 val_bpb=3.0117 best_bpb=3.0117 elapsed_s=126\nMETRIC step=100\nMETRIC val_loss=6.4919\nMETRIC val_bpb=3.0117\nMETRIC best_bpb=3.0117\nMETRIC elapsed_s=126\n[CKPT] Best checkpoint saved\nstep=150 val_loss=6.2248 val_bpb=2.8878 best_bpb=2.8878 elapsed_s=195\nMETRIC step=150\nMETRIC val_loss=6.2248\nMETRIC val_bpb=2.8878\nMETRIC best_bpb=2.8878\nMETRIC elapsed_s=195\n[CKPT] Best checkpoint saved\n\n[1]  + 100120 exit 1      load_conda_and_run python3 ~/parameter-golf/train_kaggle.py 2>&1 | \n       100121 done        head -50\nautoresearch/phase1-20260426 ~/parameter-golf [] \n```","annotations":null,"_meta":null},"isError":false},"isError":false,"timestamp":1777289411494}}
{"type":"message","id":"2db62fe1","parentId":"5e522be4","timestamp":"2026-04-27T11:30:21.211Z","message":{"role":"assistant","content":[{"type":"thinking","thinking":"I see - it was killed with exit code 1 because I did `pkill -f train_kaggle` earlier. The script is working - it ran steps 1-150, val_bpb went from 3.33 → 3.01 → 2.89, showing good learning. The checkpoint was saved.\n\nThe exit 1 is from my pkill command. Let me run a clean 1-min test to verify everything is stable.","thinkingSignature":"15366db882aa2ae99bb25889781b3574a3d00c0fb06fd90e4645a16068b6dd55"},{"type":"text","text":"Training works! Exit 1 was from my `pkill`. Results show good learning:\n- Step 1: 3.33 BPB\n- Step 100: 3.01 BPB  \n- Step 150: 2.89 BPB\n\nLet me run a clean 1-min test to confirm stability:\n"},{"type":"toolCall","id":"call_function_sla5pqanmi96_1","name":"bash","arguments":{"command":"agent-browser type \"\" \"cd ~/parameter-golf && ITERATIONS=50 MAX_WALLCLOCK=60 TIE_EMBEDDINGS=1 python3 train_kaggle.py 2>&1 | tee ~/1min_test.log\" 2>&1 && agent-browser press Enter 2>&1"}}],"api":"anthropic-messages","provider":"minimax","model":"MiniMax-M2.7","usage":{"input":54693,"output":247,"cacheRead":9348,"cacheWrite":0,"totalTokens":64288,"cost":{"input":0.0164079,"output":0.0002964,"cacheRead":0.0005608799999999999,"cacheWrite":0,"total":0.017265179999999998}},"stopReason":"toolUse","timestamp":1777289411498,"responseId":"063e7bc6440599231b539993407ab693"}}
{"type":"message","id":"5c8dbb39","parentId":"2db62fe1","timestamp":"2026-04-27T11:30:21.668Z","message":{"role":"toolResult","toolCallId":"call_function_sla5pqanmi96_1","toolName":"bash","content":[{"type":"text","text":"✓ Done\n✓ Done\n"}],"isError":false,"timestamp":1777289421668}}
{"type":"message","id":"ef2d06e8","parentId":"5c8dbb39","timestamp":"2026-04-27T11:30:25.823Z","message":{"role":"assistant","content":[{"type":"thinking","thinking":"Let me wait for it to complete.","thinkingSignature":"8c41d6dcfd223916268b7c85ea3e44d0e3b4129e2ee61ddf19236f249a6227d6"},{"type":"toolCall","id":"call_function_w37jdcseizds_1","name":"bash","arguments":{"command":"sleep 75 && agent-browser screenshot 2>&1"}}],"api":"anthropic-messages","provider":"minimax","model":"MiniMax-M2.7","usage":{"input":54961,"output":44,"cacheRead":9348,"cacheWrite":0,"totalTokens":64353,"cost":{"input":0.0164883,"output":0.000052799999999999996,"cacheRead":0.0005608799999999999,"cacheWrite":0,"total":0.01710198}},"stopReason":"toolUse","timestamp":1777289421675,"responseId":"063e7bceba8933bd08e4ada5190b47e9"}}
{"type":"message","id":"67d508fb","parentId":"ef2d06e8","timestamp":"2026-04-27T11:31:41.172Z","message":{"role":"toolResult","toolCallId":"call_function_w37jdcseizds_1","toolName":"bash","content":[{"type":"text","text":"✓ Screenshot saved to /Users/dhruv2mars/.agent-browser/tmp/screenshots/screenshot-1777289501161.png\n"}],"isError":false,"timestamp":1777289501172}}
{"type":"message","id":"0abd6b0b","parentId":"67d508fb","timestamp":"2026-04-27T11:31:47.232Z","message":{"role":"assistant","content":[{"type":"thinking","thinking":"Let me check the results.","thinkingSignature":"883674cb007012b2241f56e6b98d4b961748301e7cb8fc0bf240a7e36c3002db"},{"type":"toolCall","id":"call_function_fjyhdf62cz5l_1","name":"understand_image","arguments":{"prompt":"Did the 1-min test complete successfully? Show final results.","image_url":"/Users/dhruv2mars/.agent-browser/tmp/screenshots/screenshot-1777289501161.png"}}],"api":"anthropic-messages","provider":"minimax","model":"MiniMax-M2.7","usage":{"input":55048,"output":76,"cacheRead":9348,"cacheWrite":0,"totalTokens":64472,"cost":{"input":0.0165144,"output":0.0000912,"cacheRead":0.0005608799999999999,"cacheWrite":0,"total":0.017166479999999998}},"stopReason":"toolUse","timestamp":1777289501176,"responseId":"063e7c1f533d24b1590a9e499c655781"}}
{"type":"message","id":"b319c5a1","parentId":"0abd6b0b","timestamp":"2026-04-27T11:31:58.610Z","message":{"role":"toolResult","toolCallId":"call_function_fjyhdf62cz5l_1","toolName":"understand_image","content":[{"type":"text","text":"Based on the terminal output in the image, the process **did not complete successfully**.\n\nAt the bottom of the terminal, you can see that the command `load_conda_and_run python3 ~/parameter-golf/train_kaggle.py` terminated with an **`exit 1`** status, which indicates an error or abnormal termination. The training run appears to have reached only step 150 out of the 2500 expected steps.\n\n**Final recorded results before the crash:**\n*   **Step:** 150\n*   **val_loss:** 6.2248\n*   **val_bpb:** 2.8878\n*   **best_bpb:** 2.8878\n*   **Elapsed Time:** 195 seconds (approx. 3 minutes and 15 seconds)\n*   **Checkpoint:** A \"Best checkpoint\" was saved at step 150 just before the process exited."}],"details":{"server":"MiniMax","tool":"understand_image","structuredContent":{"type":"text","text":"Based on the terminal output in the image, the process **did not complete successfully**.\n\nAt the bottom of the terminal, you can see that the command `load_conda_and_run python3 ~/parameter-golf/train_kaggle.py` terminated with an **`exit 1`** status, which indicates an error or abnormal termination. The training run appears to have reached only step 150 out of the 2500 expected steps.\n\n**Final recorded results before the crash:**\n*   **Step:** 150\n*   **val_loss:** 6.2248\n*   **val_bpb:** 2.8878\n*   **best_bpb:** 2.8878\n*   **Elapsed Time:** 195 seconds (approx. 3 minutes and 15 seconds)\n*   **Checkpoint:** A \"Best checkpoint\" was saved at step 150 just before the process exited.","annotations":null,"_meta":null},"isError":false},"isError":false,"timestamp":1777289518610}}
{"type":"message","id":"aaf4601c","parentId":"b319c5a1","timestamp":"2026-04-27T11:32:07.105Z","message":{"role":"assistant","content":[{"type":"thinking","thinking":"It's showing the old run's results because the log is still showing. Let me check if there's a new process running.","thinkingSignature":"984642381e3e7a9555aac667abd2a0ca6006398e47b939ddd055f7e667e12afb"},{"type":"toolCall","id":"call_function_x66np17akaru_1","name":"bash","arguments":{"command":"agent-browser type \"\" \"ps aux | grep train\" 2>&1 && agent-browser press Enter 2>&1 && sleep 2 && agent-browser screenshot 2>&1"}}],"api":"anthropic-messages","provider":"minimax","model":"MiniMax-M2.7","usage":{"input":55320,"output":85,"cacheRead":9348,"cacheWrite":0,"totalTokens":64753,"cost":{"input":0.016596,"output":0.000102,"cacheRead":0.0005608799999999999,"cacheWrite":0,"total":0.01725888}},"stopReason":"toolUse","timestamp":1777289518619,"responseId":"063e7c33e4f2d0f64d40b78cd007303a"}}
{"type":"message","id":"84f1fbfc","parentId":"aaf4601c","timestamp":"2026-04-27T11:32:09.935Z","message":{"role":"toolResult","toolCallId":"call_function_x66np17akaru_1","toolName":"bash","content":[{"type":"text","text":"✓ Done\n✓ Done\n✓ Screenshot saved to /Users/dhruv2mars/.agent-browser/tmp/screenshots/screenshot-1777289529924.png\n"}],"isError":false,"timestamp":1777289529935}}
{"type":"message","id":"3e027fa2","parentId":"84f1fbfc","timestamp":"2026-04-27T11:32:15.697Z","message":{"role":"assistant","content":[{"type":"thinking","thinking":"Let me see the process status.","thinkingSignature":"2d434b0a3a61d627af10c4929808c8db98e7a524a3fa1ea87bccd4e2f8174e7f"},{"type":"toolCall","id":"call_function_jd7y6lb38cmx_1","name":"understand_image","arguments":{"prompt":"Is training running? What processes are active?","image_url":"/Users/dhruv2mars/.agent-browser/tmp/screenshots/screenshot-1777289529924.png"}}],"api":"anthropic-messages","provider":"minimax","model":"MiniMax-M2.7","usage":{"input":55454,"output":73,"cacheRead":9348,"cacheWrite":0,"totalTokens":64875,"cost":{"input":0.0166362,"output":0.0000876,"cacheRead":0.0005608799999999999,"cacheWrite":0,"total":0.01728468}},"stopReason":"toolUse","timestamp":1777289529939,"responseId":"063e7c3cb6a02f114792b085e0415ec1"}}
{"type":"message","id":"c8c4edea","parentId":"3e027fa2","timestamp":"2026-04-27T11:32:26.349Z","message":{"role":"toolResult","toolCallId":"call_function_jd7y6lb38cmx_1","toolName":"understand_image","content":[{"type":"text","text":"Based on the terminal output in the screenshot, **training is not currently running.**\n\nHere is a breakdown of what the image shows:\n\n*   **Process Status:** The training script (`train_kaggle.py`) has terminated. You can see the line `[1] + 100120 exit 1...`, which indicates that the process exited with an error code (`exit 1`).\n*   **Active Processes:** Currently, only the interactive shell (`zsh`) is active, as indicated by the blinking cursor at the bottom prompt: `autoresearch/phase1-20260426 ~/parameter-golf []`.\n*   **Execution History:** The logs show that training progressed until at least step 150, saving checkpoints along the way. However, it seems to have crashed or stopped shortly after that.\n*   **Hardware Usage:** At the top right, the T4 VRAM indicator shows very low usage, further confirming that no heavy training process is active on the GPU.\n\n**Summary:** The training process failed and exited. You are currently at an idle command prompt."}],"details":{"server":"MiniMax","tool":"understand_image","structuredContent":{"type":"text","text":"Based on the terminal output in the screenshot, **training is not currently running.**\n\nHere is a breakdown of what the image shows:\n\n*   **Process Status:** The training script (`train_kaggle.py`) has terminated. You can see the line `[1] + 100120 exit 1...`, which indicates that the process exited with an error code (`exit 1`).\n*   **Active Processes:** Currently, only the interactive shell (`zsh`) is active, as indicated by the blinking cursor at the bottom prompt: `autoresearch/phase1-20260426 ~/parameter-golf []`.\n*   **Execution History:** The logs show that training progressed until at least step 150, saving checkpoints along the way. However, it seems to have crashed or stopped shortly after that.\n*   **Hardware Usage:** At the top right, the T4 VRAM indicator shows very low usage, further confirming that no heavy training process is active on the GPU.\n\n**Summary:** The training process failed and exited. You are currently at an idle command prompt.","annotations":null,"_meta":null},"isError":false},"isError":false,"timestamp":1777289546349}}
{"type":"message","id":"27647323","parentId":"c8c4edea","timestamp":"2026-04-27T11:32:32.295Z","message":{"role":"assistant","content":[{"type":"thinking","thinking":"It seems like the training exited. The exit 1 is from the `load_conda_and_run` wrapper maybe. Let me check the log file directly and see what happened.","thinkingSignature":"59b2aa816d80e3b3aa957126fbbb5bfa7b864fbfcdf65974640a0f3214986918"},{"type":"toolCall","id":"call_function_b93ukw75wgea_1","name":"bash","arguments":{"command":"agent-browser type \"\" \"cat ~/1min_test.log 2>/dev/null || echo 'no log file'\" 2>&1 && agent-browser press Enter 2>&1 && sleep 2 && agent-browser screenshot 2>&1"}}],"api":"anthropic-messages","provider":"minimax","model":"MiniMax-M2.7","usage":{"input":55758,"output":109,"cacheRead":9348,"cacheWrite":0,"totalTokens":65215,"cost":{"input":0.0167274,"output":0.00013079999999999998,"cacheRead":0.0005608799999999999,"cacheWrite":0,"total":0.01741908}},"stopReason":"toolUse","timestamp":1777289546357,"responseId":"063e7c4ce2f3c7e600409267924331f8"}}
{"type":"message","id":"49b68a19","parentId":"27647323","timestamp":"2026-04-27T11:32:34.997Z","message":{"role":"toolResult","toolCallId":"call_function_b93ukw75wgea_1","toolName":"bash","content":[{"type":"text","text":"✓ Done\n✓ Done\n✓ Screenshot saved to /Users/dhruv2mars/.agent-browser/tmp/screenshots/screenshot-1777289554990.png\n"}],"isError":false,"timestamp":1777289554997}}
{"type":"message","id":"6676a91a","parentId":"49b68a19","timestamp":"2026-04-27T11:32:38.613Z","message":{"role":"assistant","content":[{"type":"thinking","thinking":"Let me check the log.","thinkingSignature":"428674532d5cdee12d070588500e3ca865467029e2bbfc1ceb83b0d7d624d2fb"},{"type":"toolCall","id":"call_function_t20067do5exa_1","name":"understand_image","arguments":{"prompt":"What does the log show? Any errors?","image_url":"/Users/dhruv2mars/.agent-browser/tmp/screenshots/screenshot-1777289554990.png"}}],"api":"anthropic-messages","provider":"minimax","model":"MiniMax-M2.7","usage":{"input":55916,"output":72,"cacheRead":9348,"cacheWrite":0,"totalTokens":65336,"cost":{"input":0.0167748,"output":0.0000864,"cacheRead":0.0005608799999999999,"cacheWrite":0,"total":0.01742208}},"stopReason":"toolUse","timestamp":1777289555001,"responseId":"063e7c53aa324c32f7d6314a1abb8cc2"}}
{"type":"message","id":"8fb076ba","parentId":"6676a91a","timestamp":"2026-04-27T11:32:55.850Z","message":{"role":"toolResult","toolCallId":"call_function_t20067do5exa_1","toolName":"understand_image","content":[{"type":"text","text":"Based on the screenshot provided, the log in the terminal shows progress for a machine learning training task that ended with an error.\n\nHere is a breakdown of what the log shows:\n\n### 1. Training Progress (Successful part)\nThe first part of the log shows successful training iterations for a model:\n*   **Metrics:** It tracks `val_loss` (validation loss) and `val_bpb` (likely bits-per-byte, a common metric in language modeling).\n*   **Progress:** You can see the training progress through several steps:\n    *   **Initial/Step 0:** Shows an initial `val_loss` of 7.1684.\n    *   **Step 100:** Training loss was 6.5520, and `val_loss` improved to 6.4919.\n    *   **Step 150:** Training continued, and metrics improved further, with `val_loss` dropping to 6.2248.\n*   **Checkpoints:** After each improvement at step 100 and step 150, the log shows `[CKPT] Best checkpoint saved`, indicating the model state was being successfully saved to disk.\n\n### 2. The Error\nThe process did not finish successfully. There is a clear indication of a failure at the bottom of the log:\n\n*   **Error Message:** The line `[1] + 100120 exit 1` indicates that the background process running your training script crashed. In computer systems, an exit code of `0` means success, while **`exit 1` signifies a general error or failure.**\n*   **Likely Cause (Typo):** Look closely at the command that was executed:\n    `load_conda_and_run python3 ~/parameter-golf/train_kagglle.py ...`\n    There appears to be a typo in the filename: **`train_kagglle.py`** has two 'l's in \"kaggle.\" If the actual file is named `train_kaggle.py`, the system would fail because it cannot find the file with the extra 'l'.\n\n### Summary\nThe log shows that your training was running correctly and showing good improvement up to step 150. However, the process then crashed with an **exit code 1**. You should check the spelling of your filename in your run command and check if there are any other error messages hidden by the `head -50` command which might have truncated the full error output."}],"details":{"server":"MiniMax","tool":"understand_image","structuredContent":{"type":"text","text":"Based on the screenshot provided, the log in the terminal shows progress for a machine learning training task that ended with an error.\n\nHere is a breakdown of what the log shows:\n\n### 1. Training Progress (Successful part)\nThe first part of the log shows successful training iterations for a model:\n*   **Metrics:** It tracks `val_loss` (validation loss) and `val_bpb` (likely bits-per-byte, a common metric in language modeling).\n*   **Progress:** You can see the training progress through several steps:\n    *   **Initial/Step 0:** Shows an initial `val_loss` of 7.1684.\n    *   **Step 100:** Training loss was 6.5520, and `val_loss` improved to 6.4919.\n    *   **Step 150:** Training continued, and metrics improved further, with `val_loss` dropping to 6.2248.\n*   **Checkpoints:** After each improvement at step 100 and step 150, the log shows `[CKPT] Best checkpoint saved`, indicating the model state was being successfully saved to disk.\n\n### 2. The Error\nThe process did not finish successfully. There is a clear indication of a failure at the bottom of the log:\n\n*   **Error Message:** The line `[1] + 100120 exit 1` indicates that the background process running your training script crashed. In computer systems, an exit code of `0` means success, while **`exit 1` signifies a general error or failure.**\n*   **Likely Cause (Typo):** Look closely at the command that was executed:\n    `load_conda_and_run python3 ~/parameter-golf/train_kagglle.py ...`\n    There appears to be a typo in the filename: **`train_kagglle.py`** has two 'l's in \"kaggle.\" If the actual file is named `train_kaggle.py`, the system would fail because it cannot find the file with the extra 'l'.\n\n### Summary\nThe log shows that your training was running correctly and showing good improvement up to step 150. However, the process then crashed with an **exit code 1**. You should check the spelling of your filename in your run command and check if there are any other error messages hidden by the `head -50` command which might have truncated the full error output.","annotations":null,"_meta":null},"isError":false},"isError":false,"timestamp":1777289575850}}
