{"type":"message","id":"ec9eba5c","parentId":"6f739a86","timestamp":"2026-04-26T13:56:50.420Z","message":{"role":"toolResult","toolCallId":"call_function_6ujz0hih2hvd_1","toolName":"log_experiment","content":[{"type":"text","text":"Logged #28: discard — Wider/shallower (10L-576d-9H): 2.318, slightly worse than best\nBaseline val_bpb: 2.38bpb\nSecondary: artifact_mb: 12.10mb (0.0%)  best_val_bpb: 2.32 (-2.6%)  steps: 1,100 (-4.8%)\n📋 ASI: arch: 10L-576d-9H/3KV + rope32 + ema994 + clip0.3 | conclusion: wider shallower slightly worse than 11L-512d best\n📊 Confidence: 2.3× noise floor — improvement is likely real\n(28 experiments)\n📝 Git: reverted changes (discard) — autoresearch files preserved"}],"details":{"experiment":{"commit":"de16801","metric":2.3179,"metrics":{"artifact_mb":12.1,"best_val_bpb":2.3179,"steps":1100},"status":"discard","description":"Wider/shallower (10L-576d-9H): 2.318, slightly worse than best","timestamp":1777211810396,"segment":0,"confidence":2.300330033003304,"iterationTokens":null,"asi":{"arch":"10L-576d-9H/3KV + rope32 + ema994 + clip0.3","conclusion":"wider shallower slightly worse than 11L-512d best"}},"state":{"results":[{"commit":"a672845","metric":2.379,"metrics":{"best_val_bpb":2.379,"steps":1155,"artifact_mb":12.1},"status":"keep","description":"30-min baseline: 2.379 val_bpb, 1155 steps, still improving","timestamp":1777144208804,"segment":0,"confidence":null,"iterationTokens":null,"asi":{"baseline_30min":true,"steps_completed":1155,"max_iterations":7000,"pct_exhausted":16.5,"loss_still_declining":true,"artifact_mb":12.1,"gap_to_sub1":1.879}},{"commit":"a672845","metric":2.3857,"metrics":{"artifact_mb":12.3,"best_val_bpb":2.3857,"steps":1200},"status":"discard","description":"TTT crashed: dtype mismatch in CastedLinear (bf16/float32)","timestamp":1777146462942,"segment":0,"confidence":null,"iterationTokens":null,"asi":{"error":"mat1 mat2 dtype mismatch bf16 vs float","fix_needed":"CastedLinear cast weights to match autocast dtype","ttt_broken":true}},{"commit":"e8ecad4","metric":2.3821,"metrics":{"artifact_mb":12.3,"best_val_bpb":2.3821,"steps":1200},"status":"discard","description":"TTT still broken: OOM from attention .float() creating 32GB matrix","timestamp":1777148696907,"segment":0,"confidence":null,"iterationTokens":null,"asi":{"error":"OOM: attention .float() creates 32GB matrix","fix_needed":"Remove .float() or use bf16 for attention scores","ttt_broken":true}},{"commit":"de16801","metric":2.4351,"metrics":{"artifact_mb":12.3,"best_val_bpb":2.4351,"steps":1200},"status":"discard","description":"TTT still OOM: eval loop also has memory issues","timestamp":1777150932661,"segment":0,"confidence":null,"iterationTokens":null,"asi":{"error":"OOM still in TTT eval loop","fix_needed":"Reduce eval tokens per chunk, or skip TTT for now","ttt_broken":true}},{"commit":"de16801","metric":2.4265,"metrics":{"artifact_mb":12.3,"best_val_bpb":2.4265,"steps":900},"status":"discard","description":"Wider arch (9L-640d) too slow, timed out at 900 steps","timestamp":1777155540944,"segment":0,"confidence":null,"iterationTokens":null,"asi":{"arch":"9L-640d-10H/5KV","conclusion":"wider model too slow, hit wallclock before converging","error":"SIGTERM/SIGABRT - wallclock timeout","result":"worse than baseline","steps":900}},{"commit":"de16801","metric":2.4179,"metrics":{"artifact_mb":12.1,"best_val_bpb":2.4179,"steps":1000},"status":"discard","description":"Deeper/narrower (13L-480d): 2.418 val_bpb, worse","timestamp":1777157778800,"segment":0,"confidence":null,"iterationTokens":null,"asi":{"arch":"13L-480d-8H/4KV","conclusion":"narrower model underfits","result":"worse than baseline"}},{"commit":"de16801","metric":2.4755,"metrics":{"artifact_mb":12.1,"best_val_bpb":2.4755,"steps":1600},"status":"discard","description":"Seq1024 + batch4096: 2.48 val_bpb, worse","timestamp":1777160126335,"segment":0,"confidence":null,"iterationTokens":null,"asi":{"arch":"11L-512d, seq_len=1024","conclusion":"longer context underfits - fewer steps per time","result":"worse than baseline"}},{"commit":"de16801","metric":2.4523,"metrics":{"artifact_mb":12.1,"best_val_bpb":2.4523,"steps":900},"status":"discard","description":"More depth loops (3x, layers 3-6): 2.452 val_bpb","timestamp":1777162354973,"segment":0,"confidence":null,"iterationTokens":null,"asi":{"arch":"11L-512d, 3 loops on layers 3-6","conclusion":"more depth recurrence = slower = fewer steps = worse","result":"worse than baseline"}},{"commit":"de16801","metric":2.3948,"metrics":{"artifact_mb":12.1,"best_val_bpb":2.3948,"steps":1200},"status":"discard","description":"Higher LR (0.002): 2.395, slightly worse","timestamp":1777164584746,"segment":0,"confidence":null,"iterationTokens":null,"asi":{"conclusion":"higher LR converges faster but worse final","hyperparam":"lr=0.002"}},{"commit":"de16801","metric":2.382,"metrics":{"artifact_mb":12.1,"best_val_bpb":2.382,"steps":1100},"status":"keep","description":"Lower LR (0.0005): 2.382, within noise of baseline","timestamp":1777166805914,"segment":0,"confidence":null,"iterationTokens":null,"asi":{"conclusion":"lower LR marginally worse but within noise - may generalize better","hyperparam":"lr=0.0005"}},{"commit":"de16801","metric":2.3871,"metrics":{"artifact_mb":12.1,"best_val_bpb":2.3871,"steps":1200},"status":"discard","description":"Shorter warmdown (0.6): 2.387, slightly worse","timestamp":1777169035789,"segment":0,"confidence":null,"iterationTokens":null,"asi":{"conclusion":"shorter warmdown slightly worse","hyperparam":"warmdown=0.6"}},{"commit":"de16801","metric":2.3903,"metrics":{"artifact_mb":12.1,"best_val_bpb":2.3903,"steps":1100},"status":"discard","description":"Lower WD (0.05): 2.390, slightly worse","timestamp":1777171253884,"segment":0,"confidence":null,"iterationTokens":null,"asi":{"conclusion":"lower weight decay slightly worse","hyperparam":"wd=0.05"}},{"commit":"de16801","metric":2.3767,"metrics":{"artifact_mb":12.1,"best_val_bpb":2.3767,"steps":1100},"status":"keep","description":"Higher WD (0.15): 2.377, BEST so far! Better than baseline","timestamp":1777173486921,"segment":0,"confidence":0.2035398230088492,"iterationTokens":null,"asi":{"conclusion":"higher WD improves BPB by ~0.002","hyperparam":"wd=0.15"}},{"commit":"de16801","metric":2.4075,"metrics":{"artifact_mb":12.1,"best_val_bpb":2.4075,"steps":1100},"status":"discard","description":"WD0.15 + warmdown0.8: 2.408, worse","timestamp":1777175717625,"segment":0,"confidence":0.16140350877192655,"iterationTokens":null,"asi":{"conclusion":"longer warmdown worse with higher WD","hyperparam":"wd=0.15, warmdown=0.8"}},{"commit":"de16801","metric":2.4864,"metrics":{"artifact_mb":12.1,"best_val_bpb":2.4864,"steps":1100},"status":"discard","description":"ROPE 8 dims: 2.486, much worse","timestamp":1777177952414,"segment":0,"confidence":0.14556962025316225,"iterationTokens":null,"asi":{"arch":"rope_dims=8","conclusion":"less RoPE = much worse","result":"much worse"}},{"commit":"de16801","metric":2.3565,"metrics":{"artifact_mb":12.1,"best_val_bpb":2.3565,"steps":1100},"status":"keep","description":"ROPE 24 dims: 2.357, NEW BEST! 2.4% better than baseline","timestamp":1777180169789,"segment":0,"confidence":1.4610389610389511,"iterationTokens":null,"asi":{"arch":"rope_dims=24","conclusion":"more RoPE is a REAL win - 2.4% better than baseline","result":"BEST so far - significant"}},{"commit":"de16801","metric":2.3531,"metrics":{"artifact_mb":12.1,"best_val_bpb":2.3531,"steps":1100},"status":"keep","description":"ROPE 24 + WD 0.15: 2.353, COMBINED BEST!","timestamp":1777182401297,"segment":0,"confidence":1.5058139534883455,"iterationTokens":null,"asi":{"arch":"rope_dims=24 + wd=0.15","conclusion":"COMBINING best findings: rope24 + wd15 = another small win","result":"NEW BEST - 1.1% better than rope24 alone"}},{"commit":"de16801","metric":2.331,"metrics":{"artifact_mb":12.1,"best_val_bpb":2.331,"steps":1100},"status":"keep","description":"ROPE 32 dims: 2.331, MASSIVE IMPROVEMENT! 2% better than baseline","timestamp":1777184633015,"segment":0,"confidence":2,"iterationTokens":null,"asi":{"arch":"rope_dims=32","conclusion":"HUGE WIN - rope32 is 2% better than baseline","result":"MASSIVE BEST - 2% improvement"}},{"commit":"de16801","metric":2.3341,"metrics":{"artifact_mb":12.1,"best_val_bpb":2.3341,"steps":1100},"status":"discard","description":"ROPE 32 + WD 0.15: 2.334, slightly worse than rope32 alone","timestamp":1777186873742,"segment":0,"confidence":1.5686274509803841,"iterationTokens":null,"asi":{"arch":"rope_dims=32 + wd=0.15","conclusion":"adding wd15 to rope32 doesn't help further"}},{"commit":"de16801","metric":2.3314,"metrics":{"artifact_mb":12.1,"best_val_bpb":2.3314,"steps":1100},"status":"discard","description":"ROPE 32 + WD 0.10: 2.331, same as rope32","timestamp":1777189126449,"segment":0,"confidence":1.5635179153094503,"iterationTokens":null,"asi":{"arch":"rope_dims=32 + wd=0.10","conclusion":"wd=0.10 no benefit over rope32 alone"}},{"commit":"de16801","metric":2.3493,"metrics":{"artifact_mb":12.1,"best_val_bpb":2.3493,"steps":1100},"status":"discard","description":"ROPE 48 dims: 2.349, worse than rope32","timestamp":1777191365822,"segment":0,"confidence":1.4906832298136656,"iterationTokens":null,"asi":{"arch":"rope_dims=48","conclusion":"rope48 worse than rope32 - sweet spot around rope32"}},{"commit":"de16801","metric":2.3564,"metrics":{"artifact_mb":12.1,"best_val_bpb":2.3564,"steps":1100},"status":"discard","description":"ROPE 28 dims: 2.356, confirms rope32 is the peak","timestamp":1777193581685,"segment":0,"confidence":1.6466552315609053,"iterationTokens":null,"asi":{"arch":"rope_dims=28","conclusion":"rope28 worse than rope32 - confirms peak around 32"}},{"commit":"de16801","metric":2.3319,"metrics":{"artifact_mb":12.1,"best_val_bpb":2.3319,"steps":1200},"status":"discard","description":"ROPE 32 + LR 0.0005: 2.332, same as rope32","timestamp":1777195798042,"segment":0,"confidence":1.6551724137931099,"iterationTokens":null,"asi":{"arch":"rope_dims=32 + lr=0.0005","conclusion":"lower LR no further benefit with rope32"}},{"commit":"de16801","metric":2.3469,"metrics":{"artifact_mb":12.1,"best_val_bpb":2.3469,"steps":1100},"status":"discard","description":"ROPE 32 + EMA 0.999: 2.347, worse than rope32","timestamp":1777200322812,"segment":0,"confidence":1.5559157212317658,"iterationTokens":null,"asi":{"arch":"rope_dims=32 + ema=0.999","conclusion":"higher EMA slows convergence, slightly worse"}},{"commit":"de16801","metric":2.3258,"metrics":{"artifact_mb":12.1,"best_val_bpb":2.3258,"steps":1200},"status":"keep","description":"ROPE 32 + EMA 0.994: 2.326, NEW BEST by combining rope32 + lower EMA!","timestamp":1777202534320,"segment":0,"confidence":1.6269113149846983,"iterationTokens":null,"asi":{"arch":"rope_dims=32 + ema=0.994","conclusion":"lower EMA decay (faster update) helps - NEW BEST!","result":"NEW BEST by combining rope32 + lower EMA"}},{"commit":"de16801","metric":2.3093,"metrics":{"artifact_mb":12.1,"best_val_bpb":2.3093,"steps":1100},"status":"keep","description":"ROPE 32 + EMA 0.994 + GRAD_CLIP 0.3: 2.309, HUGE WIN! 3% better than baseline","timestamp":1777204827391,"segment":0,"confidence":2.1512345679012386,"iterationTokens":null,"asi":{"arch":"rope32 + ema994 + clip0.3","conclusion":"tighter gradient clipping helps convergence - MAJOR win!","result":"NEW BEST - 3% better than baseline!"}},{"commit":"de16801","metric":2.3521,"metrics":{"artifact_mb":12.1,"best_val_bpb":2.3521,"steps":1000},"status":"discard","description":"12L + rope32/ema994/clip0.3: 2.352, too slow (1000 steps), worse","timestamp":1777209402828,"segment":0,"confidence":2.346801346801345,"iterationTokens":null,"asi":{"arch":"12L-512d + rope32 + ema994 + clip0.3","conclusion":"12 layers too slow, hit wallclock early, worse than best"}},{"commit":"de16801","metric":2.3179,"metrics":{"artifact_mb":12.1,"best_val_bpb":2.3179,"steps":1100},"status":"discard","description":"Wider/shallower (10L-576d-9H): 2.318, slightly worse than best","timestamp":1777211810396,"segment":0,"confidence":2.300330033003304,"iterationTokens":null,"asi":{"arch":"10L-576d-9H/3KV + rope32 + ema994 + clip0.3","conclusion":"wider shallower slightly worse than 11L-512d best"}}],"bestMetric":2.379,"bestDirection":"lower","metricName":"val_bpb","metricUnit":"bpb","secondaryMetrics":[{"name":"best_val_bpb","unit":""},{"name":"steps","unit":""},{"name":"artifact_mb","unit":"mb"}],"name":"Parameter Golf - Find Best Config for Sub-1 BPB","currentSegment":0,"maxExperiments":null,"confidence":2.300330033003304},"wallClockSeconds":null},"isError":false,"timestamp":1777211810420}}
{"type":"message","id":"50b4b8d8","parentId":"ec9eba5c","timestamp":"2026-04-26T13:56:54.082Z","message":{"role":"assistant","content":[{"type":"thinking","thinking":"Current best: 2.3093 (rope32 + ema0.994 + grad_clip0.3). Let me try a few more combinations to push lower before doing extended training. Let me try:1. Even tighter grad clip (0.2)\n2. Slightly lower LR\n3. More warmup steps\n4. Different qk_gain","thinkingSignature":"80a4a05159a1f47d10dd2cd60575e1dd27a4933a6a86f96f4b1bb935abfd65eb"},{"type":"toolCall","id":"call_function_n3vs5hg5j2g8_1","name":"bash","arguments":{"command":"cd /Users/dhruv2mars/dev/github/parameter-golf && python3 experiments/pg_autoresearch.py run --name \"ar_best_clip02_$(date +%Y%m%d)\" --env \"ITERATIONS=7000\" --env \"MAX_WALLCLOCK_SECONDS=1800\" --env \"ROPE_DIMS=32\" --env \"EMA_DECAY=0.994\" --env \"GRAD_CLIP_NORM=0.2\" --timeout 2400 2>&1"}}],"api":"anthropic-messages","provider":"minimax","model":"MiniMax-M2.7","usage":{"input":364,"output":208,"cacheRead":72992,"cacheWrite":0,"totalTokens":73564,"cost":{"input":0.0001092,"output":0.0002496,"cacheRead":0.00437952,"cacheWrite":0,"total":0.00473832}},"stopReason":"toolUse","timestamp":1777211810422,"responseId":"063d4ca34c9acd4256ca680f04a399b7"}}
{"type":"message","id":"5f6694f9","parentId":"50b4b8d8","timestamp":"2026-04-26T14:34:04.468Z","message":{"role":"toolResult","toolCallId":"call_function_n3vs5hg5j2g8_1","toolName":"bash","content":[{"type":"text","text":"{\"best_val_bpb\": 2.3123, \"compressed_bytes\": null, \"error\": null, \"metric\": 2.3123, \"non_finite\": false, \"output\": \"/Users/dhruv2mars/dev/github/parameter-golf/experiments/kaggle_results/pg-auto-ar-best-clip02-20260426-11814\", \"ref\": \"dhruv2mars/pg-auto-ar-best-clip02-20260426-11814\", \"runtime_seconds\": null, \"status\": \"KernelWorkerStatus.COMPLETE\", \"steps\": 1100, \"ttt_val_bpb\": null, \"val_bpb\": 2.3123}\n"}],"isError":false,"timestamp":1777214044468}}
{"type":"message","id":"eac33c04","parentId":"5f6694f9","timestamp":"2026-04-26T14:34:13.137Z","message":{"role":"assistant","content":[{"type":"thinking","thinking":"2.3123 - slightly worse than clip0.3 (2.3093). Let me try clip0.4 to see if there's a sweet spot.\n","thinkingSignature":"2167509655bfd7d391ffc98b9ce9503a798edd9d0991ae02f9da6883e621d980"},{"type":"toolCall","id":"call_function_oh1mn5qwkh9t_1","name":"log_experiment","arguments":{"asi":{"arch":"rope32 + ema994 + clip0.2","conclusion":"clip0.2 slightly worse than clip0.3"},"commit":"de16801","description":"Best config + clip 0.2: 2.312, slightly worse than clip0.3","metric":2.3123,"metrics":{"artifact_mb":12.1,"best_val_bpb":2.3123,"steps":1100},"status":"discard"}}],"api":"anthropic-messages","provider":"minimax","model":"MiniMax-M2.7","usage":{"input":73644,"output":194,"cacheRead":0,"cacheWrite":0,"totalTokens":73838,"cost":{"input":0.0220932,"output":0.0002328,"cacheRead":0,"cacheWrite":0,"total":0.022326}},"stopReason":"toolUse","timestamp":1777214044470,"responseId":"063d55601de410af371475b6371d2e07"}}
