{"type":"message","id":"712bb97f","parentId":"0fb12295","timestamp":"2026-04-25T22:56:18.831Z","message":{"role":"toolResult","toolCallId":"call_function_hy47tmff95us_1","toolName":"log_experiment","content":[{"type":"text","text":"Logged #6: discard — Deeper/narrower (13L-480d): 2.418 val_bpb, worse\nBaseline val_bpb: 2.38bpb\nSecondary: artifact_mb: 12.10mb (0.0%)  best_val_bpb: 2.42 (+1.6%)  steps: 1,000 (-13.4%)\n📋 ASI: arch: 13L-480d-8H/4KV | conclusion: narrower model underfits | result: worse than baseline\n(6 experiments)\n📝 Git: reverted changes (discard) — autoresearch files preserved"}],"details":{"experiment":{"commit":"de16801","metric":2.4179,"metrics":{"artifact_mb":12.1,"best_val_bpb":2.4179,"steps":1000},"status":"discard","description":"Deeper/narrower (13L-480d): 2.418 val_bpb, worse","timestamp":1777157778800,"segment":0,"confidence":null,"iterationTokens":null,"asi":{"arch":"13L-480d-8H/4KV","conclusion":"narrower model underfits","result":"worse than baseline"}},"state":{"results":[{"commit":"a672845","metric":2.379,"metrics":{"best_val_bpb":2.379,"steps":1155,"artifact_mb":12.1},"status":"keep","description":"30-min baseline: 2.379 val_bpb, 1155 steps, still improving","timestamp":1777144208804,"segment":0,"confidence":null,"iterationTokens":null,"asi":{"baseline_30min":true,"steps_completed":1155,"max_iterations":7000,"pct_exhausted":16.5,"loss_still_declining":true,"artifact_mb":12.1,"gap_to_sub1":1.879}},{"commit":"a672845","metric":2.3857,"metrics":{"artifact_mb":12.3,"best_val_bpb":2.3857,"steps":1200},"status":"discard","description":"TTT crashed: dtype mismatch in CastedLinear (bf16/float32)","timestamp":1777146462942,"segment":0,"confidence":null,"iterationTokens":null,"asi":{"error":"mat1 mat2 dtype mismatch bf16 vs float","fix_needed":"CastedLinear cast weights to match autocast dtype","ttt_broken":true}},{"commit":"e8ecad4","metric":2.3821,"metrics":{"artifact_mb":12.3,"best_val_bpb":2.3821,"steps":1200},"status":"discard","description":"TTT still broken: OOM from attention .float() creating 32GB matrix","timestamp":1777148696907,"segment":0,"confidence":null,"iterationTokens":null,"asi":{"error":"OOM: attention .float() creates 32GB matrix","fix_needed":"Remove .float() or use bf16 for attention scores","ttt_broken":true}},{"commit":"de16801","metric":2.4351,"metrics":{"artifact_mb":12.3,"best_val_bpb":2.4351,"steps":1200},"status":"discard","description":"TTT still OOM: eval loop also has memory issues","timestamp":1777150932661,"segment":0,"confidence":null,"iterationTokens":null,"asi":{"error":"OOM still in TTT eval loop","fix_needed":"Reduce eval tokens per chunk, or skip TTT for now","ttt_broken":true}},{"commit":"de16801","metric":2.4265,"metrics":{"artifact_mb":12.3,"best_val_bpb":2.4265,"steps":900},"status":"discard","description":"Wider arch (9L-640d) too slow, timed out at 900 steps","timestamp":1777155540944,"segment":0,"confidence":null,"iterationTokens":null,"asi":{"arch":"9L-640d-10H/5KV","conclusion":"wider model too slow, hit wallclock before converging","error":"SIGTERM/SIGABRT - wallclock timeout","result":"worse than baseline","steps":900}},{"commit":"de16801","metric":2.4179,"metrics":{"artifact_mb":12.1,"best_val_bpb":2.4179,"steps":1000},"status":"discard","description":"Deeper/narrower (13L-480d): 2.418 val_bpb, worse","timestamp":1777157778800,"segment":0,"confidence":null,"iterationTokens":null,"asi":{"arch":"13L-480d-8H/4KV","conclusion":"narrower model underfits","result":"worse than baseline"}}],"bestMetric":2.379,"bestDirection":"lower","metricName":"val_bpb","metricUnit":"bpb","secondaryMetrics":[{"name":"best_val_bpb","unit":""},{"name":"steps","unit":""},{"name":"artifact_mb","unit":"mb"}],"name":"Parameter Golf - Find Best Config for Sub-1 BPB","currentSegment":0,"maxExperiments":null,"confidence":null},"wallClockSeconds":null},"isError":false,"timestamp":1777157778831}}
{"type":"message","id":"7ea2982d","parentId":"712bb97f","timestamp":"2026-04-25T22:56:23.214Z","message":{"role":"assistant","content":[{"type":"thinking","thinking":"The deeper/narrower model was worse. The baseline 11L x 512d is still the best.\n\nLet me try a different direction: tuning hyperparameters. Let me try:\n1. Lower learning rate (maybe the model can converge better)\n2. Different weight decay\n3. Different warmdown fraction\n\nActually, let me look at the loss curve from the baseline. The loss was still declining rapidly at step 1155. This suggests more training could help a lot. But we only have 30 min per run.\n\nLet me think about what could give meaningful improvement:\n1. **Longer sequences**: seq_len=1024 instead of 512 - this gives 2x context, which might help the model learn better\n\n\n2. **Batch size**: Increasing batch size could stabilize learning\n3. **Learning rate**: Trying different LR values or schedules\n4. **Depth recurrence adjustments**: The recurrence pattern might benefit from tweaking the loop range or number of loops\n\nLet me test whether extending the sequence length to 1024 helps the model capture longer-range patterns.","thinkingSignature":"ebd5d0adcfaaba8d987a4c6664b2f9150ae5337c2189b8beac396560a6b83f11"},{"type":"toolCall","id":"call_function_0m2fi8soy1xe_1","name":"bash","arguments":{"command":"cd /Users/dhruv2mars/dev/github/parameter-golf && python3 experiments/pg_autoresearch.py run --name \"ar_seq1024_$(date +%Y%m%d)\" --env \"ITERATIONS=7000\" --env \"MAX_WALLCLOCK_SECONDS=1800\" --env \"TRAIN_SEQ_LEN=1024\" --env \"TRAIN_BATCH_TOKENS=4096\" --timeout 2400 2>&1"}}],"api":"anthropic-messages","provider":"minimax","model":"MiniMax-M2.7","usage":{"input":335,"output":341,"cacheRead":58368,"cacheWrite":0,"totalTokens":59044,"cost":{"input":0.00010049999999999999,"output":0.00040919999999999997,"cacheRead":0.00350208,"cacheWrite":0,"total":0.0040117799999999995}},"stopReason":"toolUse","timestamp":1777157778833,"responseId":"063c799466fb036c9ddc505f6e26ffa0"}}
{"type":"message","id":"1f0fbfce","parentId":"7ea2982d","timestamp":"2026-04-25T23:35:19.439Z","message":{"role":"toolResult","toolCallId":"call_function_0m2fi8soy1xe_1","toolName":"bash","content":[{"type":"text","text":"{\"best_val_bpb\": 2.4755, \"compressed_bytes\": null, \"error\": null, \"metric\": 2.4755, \"non_finite\": false, \"output\": \"/Users/dhruv2mars/dev/github/parameter-golf/experiments/kaggle_results/pg-auto-ar-seq1024-20260426-57783\", \"ref\": \"dhruv2mars/pg-auto-ar-seq1024-20260426-57783\", \"runtime_seconds\": null, \"status\": \"KernelWorkerStatus.COMPLETE\", \"steps\": 1600, \"ttt_val_bpb\": null, \"val_bpb\": 2.4755}\n"}],"isError":false,"timestamp":1777160119439}}
{"type":"message","id":"918b2e60","parentId":"1f0fbfce","timestamp":"2026-04-25T23:35:26.328Z","message":{"role":"assistant","content":[{"type":"thinking","thinking":"Seq1024 made it worse (2.48 vs 2.38). That makes sense - with seq_len=1024, we have fewer gradient steps in the same time, and shorter context windows might actually be better for the training data distribution.\n\nLet me try a different direction. What about increasing depth recurrence? More loop iterations:\n","thinkingSignature":"9a8208d42b07a94276c5cb220922c2463b2b19e048788c3008dd1bf66868b951"},{"type":"toolCall","id":"call_function_nkh4yy361uwa_1","name":"log_experiment","arguments":{"asi":{"arch":"11L-512d, seq_len=1024","conclusion":"longer context underfits - fewer steps per time","result":"worse than baseline"},"commit":"de16801","description":"Seq1024 + batch4096: 2.48 val_bpb, worse","metric":2.4755,"metrics":{"artifact_mb":12.1,"best_val_bpb":2.4755,"steps":1600},"status":"discard"}}],"api":"anthropic-messages","provider":"minimax","model":"MiniMax-M2.7","usage":{"input":58918,"output":233,"cacheRead":64,"cacheWrite":0,"totalTokens":59215,"cost":{"input":0.0176754,"output":0.00027959999999999997,"cacheRead":0.00000384,"cacheWrite":0,"total":0.017958840000000004}},"stopReason":"toolUse","timestamp":1777160119442,"responseId":"063c82ba32908d786bf8dd23d0cd613a"}}
{"type":"message","id":"bee07eaa","parentId":"918b2e60","timestamp":"2026-04-25T23:35:26.387Z","message":{"role":"toolResult","toolCallId":"call_function_nkh4yy361uwa_1","toolName":"log_experiment","content":[{"type":"text","text":"Logged #7: discard — Seq1024 + batch4096: 2.48 val_bpb, worse\nBaseline val_bpb: 2.38bpb\nSecondary: artifact_mb: 12.10mb (0.0%)  best_val_bpb: 2.48 (+4.1%)  steps: 1,600 (+38.5%)\n📋 ASI: arch: 11L-512d, seq_len=1024 | conclusion: longer context underfits - fewer steps per time | result: worse than baseline\n(7 experiments)\n📝 Git: reverted changes (discard) — autoresearch files preserved"}],"details":{"experiment":{"commit":"de16801","metric":2.4755,"metrics":{"artifact_mb":12.1,"best_val_bpb":2.4755,"steps":1600},"status":"discard","description":"Seq1024 + batch4096: 2.48 val_bpb, worse","timestamp":1777160126335,"segment":0,"confidence":null,"iterationTokens":null,"asi":{"arch":"11L-512d, seq_len=1024","conclusion":"longer context underfits - fewer steps per time","result":"worse than baseline"}},"state":{"results":[{"commit":"a672845","metric":2.379,"metrics":{"best_val_bpb":2.379,"steps":1155,"artifact_mb":12.1},"status":"keep","description":"30-min baseline: 2.379 val_bpb, 1155 steps, still improving","timestamp":1777144208804,"segment":0,"confidence":null,"iterationTokens":null,"asi":{"baseline_30min":true,"steps_completed":1155,"max_iterations":7000,"pct_exhausted":16.5,"loss_still_declining":true,"artifact_mb":12.1,"gap_to_sub1":1.879}},{"commit":"a672845","metric":2.3857,"metrics":{"artifact_mb":12.3,"best_val_bpb":2.3857,"steps":1200},"status":"discard","description":"TTT crashed: dtype mismatch in CastedLinear (bf16/float32)","timestamp":1777146462942,"segment":0,"confidence":null,"iterationTokens":null,"asi":{"error":"mat1 mat2 dtype mismatch bf16 vs float","fix_needed":"CastedLinear cast weights to match autocast dtype","ttt_broken":true}},{"commit":"e8ecad4","metric":2.3821,"metrics":{"artifact_mb":12.3,"best_val_bpb":2.3821,"steps":1200},"status":"discard","description":"TTT still broken: OOM from attention .float() creating 32GB matrix","timestamp":1777148696907,"segment":0,"confidence":null,"iterationTokens":null,"asi":{"error":"OOM: attention .float() creates 32GB matrix","fix_needed":"Remove .float() or use bf16 for attention scores","ttt_broken":true}},{"commit":"de16801","metric":2.4351,"metrics":{"artifact_mb":12.3,"best_val_bpb":2.4351,"steps":1200},"status":"discard","description":"TTT still OOM: eval loop also has memory issues","timestamp":1777150932661,"segment":0,"confidence":null,"iterationTokens":null,"asi":{"error":"OOM still in TTT eval loop","fix_needed":"Reduce eval tokens per chunk, or skip TTT for now","ttt_broken":true}},{"commit":"de16801","metric":2.4265,"metrics":{"artifact_mb":12.3,"best_val_bpb":2.4265,"steps":900},"status":"discard","description":"Wider arch (9L-640d) too slow, timed out at 900 steps","timestamp":1777155540944,"segment":0,"confidence":null,"iterationTokens":null,"asi":{"arch":"9L-640d-10H/5KV","conclusion":"wider model too slow, hit wallclock before converging","error":"SIGTERM/SIGABRT - wallclock timeout","result":"worse than baseline","steps":900}},{"commit":"de16801","metric":2.4179,"metrics":{"artifact_mb":12.1,"best_val_bpb":2.4179,"steps":1000},"status":"discard","description":"Deeper/narrower (13L-480d): 2.418 val_bpb, worse","timestamp":1777157778800,"segment":0,"confidence":null,"iterationTokens":null,"asi":{"arch":"13L-480d-8H/4KV","conclusion":"narrower model underfits","result":"worse than baseline"}},{"commit":"de16801","metric":2.4755,"metrics":{"artifact_mb":12.1,"best_val_bpb":2.4755,"steps":1600},"status":"discard","description":"Seq1024 + batch4096: 2.48 val_bpb, worse","timestamp":1777160126335,"segment":0,"confidence":null,"iterationTokens":null,"asi":{"arch":"11L-512d, seq_len=1024","conclusion":"longer context underfits - fewer steps per time","result":"worse than baseline"}}],"bestMetric":2.379,"bestDirection":"lower","metricName":"val_bpb","metricUnit":"bpb","secondaryMetrics":[{"name":"best_val_bpb","unit":""},{"name":"steps","unit":""},{"name":"artifact_mb","unit":"mb"}],"name":"Parameter Golf - Find Best Config for Sub-1 BPB","currentSegment":0,"maxExperiments":null,"confidence":null},"wallClockSeconds":null},"isError":false,"timestamp":1777160126387}}
{"type":"message","id":"48026af3","parentId":"bee07eaa","timestamp":"2026-04-25T23:35:28.787Z","message":{"role":"assistant","content":[{"type":"thinking","thinking":"Running the full autoresearch loop now. Let me continue with more experiments.\n","thinkingSignature":"e26d9add2df33799ec7457a49aee7446339cdbfa39d743e54c24c1c7b6ffd0a8"},{"type":"toolCall","id":"call_function_uz0zzj30rbp8_1","name":"bash","arguments":{"command":"cd /Users/dhruv2mars/dev/github/parameter-golf && python3 experiments/pg_autoresearch.py run --name \"ar_more_loops_$(date +%Y%m%d)\" --env \"ITERATIONS=7000\" --env \"MAX_WALLCLOCK_SECONDS=1800\" --env \"NUM_LOOPS=3\" --env \"LOOP_START=3\" --env \"LOOP_END=6\" --timeout 2400 2>&1"}}],"api":"anthropic-messages","provider":"minimax","model":"MiniMax-M2.7","usage":{"input":319,"output":140,"cacheRead":58976,"cacheWrite":0,"totalTokens":59435,"cost":{"input":0.0000957,"output":0.000168,"cacheRead":0.0035385599999999996,"cacheWrite":0,"total":0.0038022599999999996}},"stopReason":"toolUse","timestamp":1777160126389,"responseId":"063c82bfadff7fbf4e327efa21f9c537"}}
{"type":"message","id":"9a8b9544","parentId":"48026af3","timestamp":"2026-04-26T00:12:28.304Z","message":{"role":"toolResult","toolCallId":"call_function_uz0zzj30rbp8_1","toolName":"bash","content":[{"type":"text","text":"{\"best_val_bpb\": 2.4523, \"compressed_bytes\": null, \"error\": null, \"metric\": 2.4523, \"non_finite\": false, \"output\": \"/Users/dhruv2mars/dev/github/parameter-golf/experiments/kaggle_results/pg-auto-ar-more-loops-20260426-60128\", \"ref\": \"dhruv2mars/pg-auto-ar-more-loops-20260426-60128\", \"runtime_seconds\": null, \"status\": \"KernelWorkerStatus.COMPLETE\", \"steps\": 900, \"ttt_val_bpb\": null, \"val_bpb\": 2.4523}\n"}],"isError":false,"timestamp":1777162348304}}
{"type":"message","id":"40264af6","parentId":"9a8b9544","timestamp":"2026-04-26T00:12:34.969Z","message":{"role":"assistant","content":[{"type":"thinking","thinking":"2.4523 - still worse than baseline. Let me try something else.\n","thinkingSignature":"f28180f314242a3baf52ec820bb9ee49d902b7e77738b9c952fef823f11a9cae"},{"type":"toolCall","id":"call_function_t9w0jbmzo029_1","name":"log_experiment","arguments":{"asi":{"arch":"11L-512d, 3 loops on layers 3-6","conclusion":"more depth recurrence = slower = fewer steps = worse","result":"worse than baseline"},"commit":"de16801","description":"More depth loops (3x, layers 3-6): 2.452 val_bpb","metric":2.4523,"metrics":{"artifact_mb":12.1,"best_val_bpb":2.4523,"steps":900},"status":"discard"}}],"api":"anthropic-messages","provider":"minimax","model":"MiniMax-M2.7","usage":{"input":59574,"output":187,"cacheRead":0,"cacheWrite":0,"totalTokens":59761,"cost":{"input":0.017872199999999998,"output":0.00022439999999999998,"cacheRead":0,"cacheWrite":0,"total":0.018096599999999997}},"stopReason":"toolUse","timestamp":1777162348305,"responseId":"063c8b6f9fce2b3c46d39eec85d39224"}}
{"type":"message","id":"1fd8b1b6","parentId":"40264af6","timestamp":"2026-04-26T00:12:35.017Z","message":{"role":"toolResult","toolCallId":"call_function_t9w0jbmzo029_1","toolName":"log_experiment","content":[{"type":"text","text":"Logged #8: discard — More depth loops (3x, layers 3-6): 2.452 val_bpb\nBaseline val_bpb: 2.38bpb\nSecondary: artifact_mb: 12.10mb (0.0%)  best_val_bpb: 2.45 (+3.1%)  steps: 900 (-22.1%)\n📋 ASI: arch: 11L-512d, 3 loops on layers 3-6 | conclusion: more depth recurrence = slower = fewer steps = worse | result: worse than baseline\n(8 experiments)\n📝 Git: reverted changes (discard) — autoresearch files preserved"}],"details":{"experiment":{"commit":"de16801","metric":2.4523,"metrics":{"artifact_mb":12.1,"best_val_bpb":2.4523,"steps":900},"status":"discard","description":"More depth loops (3x, layers 3-6): 2.452 val_bpb","timestamp":1777162354973,"segment":0,"confidence":null,"iterationTokens":null,"asi":{"arch":"11L-512d, 3 loops on layers 3-6","conclusion":"more depth recurrence = slower = fewer steps = worse","result":"worse than baseline"}},"state":{"results":[{"commit":"a672845","metric":2.379,"metrics":{"best_val_bpb":2.379,"steps":1155,"artifact_mb":12.1},"status":"keep","description":"30-min baseline: 2.379 val_bpb, 1155 steps, still improving","timestamp":1777144208804,"segment":0,"confidence":null,"iterationTokens":null,"asi":{"baseline_30min":true,"steps_completed":1155,"max_iterations":7000,"pct_exhausted":16.5,"loss_still_declining":true,"artifact_mb":12.1,"gap_to_sub1":1.879}},{"commit":"a672845","metric":2.3857,"metrics":{"artifact_mb":12.3,"best_val_bpb":2.3857,"steps":1200},"status":"discard","description":"TTT crashed: dtype mismatch in CastedLinear (bf16/float32)","timestamp":1777146462942,"segment":0,"confidence":null,"iterationTokens":null,"asi":{"error":"mat1 mat2 dtype mismatch bf16 vs float","fix_needed":"CastedLinear cast weights to match autocast dtype","ttt_broken":true}},{"commit":"e8ecad4","metric":2.3821,"metrics":{"artifact_mb":12.3,"best_val_bpb":2.3821,"steps":1200},"status":"discard","description":"TTT still broken: OOM from attention .float() creating 32GB matrix","timestamp":1777148696907,"segment":0,"confidence":null,"iterationTokens":null,"asi":{"error":"OOM: attention .float() creates 32GB matrix","fix_needed":"Remove .float() or use bf16 for attention scores","ttt_broken":true}},{"commit":"de16801","metric":2.4351,"metrics":{"artifact_mb":12.3,"best_val_bpb":2.4351,"steps":1200},"status":"discard","description":"TTT still OOM: eval loop also has memory issues","timestamp":1777150932661,"segment":0,"confidence":null,"iterationTokens":null,"asi":{"error":"OOM still in TTT eval loop","fix_needed":"Reduce eval tokens per chunk, or skip TTT for now","ttt_broken":true}},{"commit":"de16801","metric":2.4265,"metrics":{"artifact_mb":12.3,"best_val_bpb":2.4265,"steps":900},"status":"discard","description":"Wider arch (9L-640d) too slow, timed out at 900 steps","timestamp":1777155540944,"segment":0,"confidence":null,"iterationTokens":null,"asi":{"arch":"9L-640d-10H/5KV","conclusion":"wider model too slow, hit wallclock before converging","error":"SIGTERM/SIGABRT - wallclock timeout","result":"worse than baseline","steps":900}},{"commit":"de16801","metric":2.4179,"metrics":{"artifact_mb":12.1,"best_val_bpb":2.4179,"steps":1000},"status":"discard","description":"Deeper/narrower (13L-480d): 2.418 val_bpb, worse","timestamp":1777157778800,"segment":0,"confidence":null,"iterationTokens":null,"asi":{"arch":"13L-480d-8H/4KV","conclusion":"narrower model underfits","result":"worse than baseline"}},{"commit":"de16801","metric":2.4755,"metrics":{"artifact_mb":12.1,"best_val_bpb":2.4755,"steps":1600},"status":"discard","description":"Seq1024 + batch4096: 2.48 val_bpb, worse","timestamp":1777160126335,"segment":0,"confidence":null,"iterationTokens":null,"asi":{"arch":"11L-512d, seq_len=1024","conclusion":"longer context underfits - fewer steps per time","result":"worse than baseline"}},{"commit":"de16801","metric":2.4523,"metrics":{"artifact_mb":12.1,"best_val_bpb":2.4523,"steps":900},"status":"discard","description":"More depth loops (3x, layers 3-6): 2.452 val_bpb","timestamp":1777162354973,"segment":0,"confidence":null,"iterationTokens":null,"asi":{"arch":"11L-512d, 3 loops on layers 3-6","conclusion":"more depth recurrence = slower = fewer steps = worse","result":"worse than baseline"}}],"bestMetric":2.379,"bestDirection":"lower","metricName":"val_bpb","metricUnit":"bpb","secondaryMetrics":[{"name":"best_val_bpb","unit":""},{"name":"steps","unit":""},{"name":"artifact_mb","unit":"mb"}],"name":"Parameter Golf - Find Best Config for Sub-1 BPB","currentSegment":0,"maxExperiments":null,"confidence":null},"wallClockSeconds":null},"isError":false,"timestamp":1777162355017}}
{"type":"message","id":"2a830429","parentId":"1fd8b1b6","timestamp":"2026-04-26T00:12:40.808Z","message":{"role":"assistant","content":[{"type":"thinking","thinking":"8 runs done. Pattern is clear:\n- Wider/deeper/narrower/shallower = worse\n- Seq_len=1024 = worse (slower)\n- More loops = worse (slower)\n\nThe current architecture is already well-tuned. What's left to try:\n1. **LR tuning** - maybe slightly higher LR could help\n2. **Lower warmdown_frac** - shorter decay?\n3. **Different WD** - maybe less WD?\n4. **Different QK gain** - try 6.0 or 4.5?\n5. **Different rope dims** - 24 instead of 16?\n\n\nThe key insight from all these experiments is that the model is severely constrained by time—any change that slows down training just leads to underfitting. So I should focus on what's actually hurting performance, not what slows things down. LR tuning looks like the most promising angle: the current 0.001 might be suboptimal, so I'll try 0.002 and 0.0005 to see if either helps.\n","thinkingSignature":"86f1d99138db9329927ec8e5b193820c1330ae35f96472feb971f72a1079caf0"},{"type":"toolCall","id":"call_function_hkw9nbyql4x9_1","name":"bash","arguments":{"command":"cd /Users/dhruv2mars/dev/github/parameter-golf && python3 experiments/pg_autoresearch.py run --name \"ar_higher_lr_$(date +%Y%m%d)\" --env \"ITERATIONS=7000\" --env \"MAX_WALLCLOCK_SECONDS=1800\" --env \"MATRIX_LR=0.002\" --timeout 2400 2>&1"}}],"api":"anthropic-messages","provider":"minimax","model":"MiniMax-M2.7","usage":{"input":347,"output":321,"cacheRead":59552,"cacheWrite":0,"totalTokens":60220,"cost":{"input":0.0001041,"output":0.0003852,"cacheRead":0.0035731199999999995,"cacheWrite":0,"total":0.00406242}},"stopReason":"toolUse","timestamp":1777162355019,"responseId":"063c8b74e56f814423e49b3452fe5a6f"}}
