{"type":"message","id":"15aa5dab","parentId":"28b90bcf","timestamp":"2026-04-27T12:12:47.123Z","message":{"role":"toolResult","toolCallId":"call_function_cv1zui60tea9_1","toolName":"bash","content":[{"type":"text","text":"Machine: CPU\nCloud account: lightning-public-prod\nCluster: lightning-public-prod\n\nrun_job signature: (name: str, machine: ForwardRef('Machine') | str, command: str, env: Dict[str, str] | None = None, interruptible: bool = False, reuse_snapshot: bool = True) -> 'Job'\n"}],"isError":false,"timestamp":1777291967123}}
{"type":"message","id":"84802e84","parentId":"15aa5dab","timestamp":"2026-04-27T12:12:57.549Z","message":{"role":"assistant","content":[{"type":"thinking","thinking":"The studio is on CPU only! The machine is \"CPU\", not GPU. This explains why CUDA is not available. The studio needs GPU resources.\n\nWe need to switch the machine to a GPU one. Let me check how to do that.\n","thinkingSignature":"640006d631ff2fe906ec2bfd8e07ad12ca7a1f03b97c74d3b7306cefd88d13fc"},{"type":"text","text":"\n\nStudio is on **CPU only** — no GPU. Need to switch to GPU machine.\n"},{"type":"toolCall","id":"call_function_qjvy22b3ri4v_1","name":"bash","arguments":{"command":"source ~/.venv/pg/bin/activate && python -c \"\nfrom lightning_sdk import Studio, Teamspace, Machine\nimport os\n\nos.environ['LIGHTNING_USER_ID'] = 'd52587bc-ec3c-4c9c-a2fa-71246e3d4020'\nos.environ['LIGHTNING_API_KEY'] = '25da12f4-1ad8-4e3f-8ba4-2a60fcebaabe'\n\nts = Teamspace(name='default-project', user='dhruv2mars')\nstudio = Studio(name='parameter-golf', teamspace=ts)\n\n# List available machines\nmachines = ts.list_machines()\nprint('Available machines:')\nfor m in machines:\n    print(f'  - {m}')\n\" 2>&1","timeout_seconds":"30"}}],"api":"anthropic-messages","provider":"minimax","model":"MiniMax-M2.7","usage":{"input":323,"output":268,"cacheRead":92480,"cacheWrite":0,"totalTokens":93071,"cost":{"input":0.0000969,"output":0.0003216,"cacheRead":0.0055487999999999996,"cacheWrite":0,"total":0.0059673}},"stopReason":"toolUse","timestamp":1777291967127,"responseId":"063e85c13525b7891cf491e8fb6d4ea9"}}
{"type":"message","id":"846935d9","parentId":"84802e84","timestamp":"2026-04-27T12:13:03.086Z","message":{"role":"toolResult","toolCallId":"call_function_qjvy22b3ri4v_1","toolName":"bash","content":[{"type":"text","text":"Traceback (most recent call last):\n  File \"<string>\", line 12, in <module>\n    machines = ts.list_machines()\n  File \"/Users/dhruv2mars/.venv/pg/lib/python3.14/site-packages/lightning_sdk/utils/logging.py\", line 37, in wrapper\n    return func(*args, **kwargs)\n  File \"/Users/dhruv2mars/.venv/pg/lib/python3.14/site-packages/lightning_sdk/teamspace.py\", line 321, in list_machines\n    self.id, cloud_accounts=cloud_accounts, machine=machine, org_id=self._org.id\n                                                                    ^^^^^^^^^^^^\nAttributeError: 'NoneType' object has no attribute 'id'\n\n\nCommand exited with code 1"}],"details":{},"isError":true,"timestamp":1777291983086}}
{"type":"message","id":"21d731b9","parentId":"846935d9","timestamp":"2026-04-27T12:13:14.147Z","message":{"role":"assistant","content":[{"type":"thinking","thinking":"Let me try a different approach - use `switch_machine` to get a GPU, or check if the studio can be configured for GPU.\n","thinkingSignature":"961ff8d4cf53560ccb481bc0df983ed090e9aa5711f6a29c8635c4badb732c2c"},{"type":"toolCall","id":"call_function_h6dulc6awca9_1","name":"bash","arguments":{"command":"source ~/.venv/pg/bin/activate && python -c \"\nfrom lightning_sdk import Studio, Teamspace, Machine\nimport os\n\nos.environ['LIGHTNING_USER_ID'] = 'd52587bc-ec3c-4c9c-a2fa-71246e3d4020'\nos.environ['LIGHTNING_API_KEY'] = '25da12f4-1ad8-4e3f-8ba4-2a60fcebaabe'\n\nts = Teamspace(name='default-project', user='dhruv2mars')\nstudio = Studio(name='parameter-golf', teamspace=ts)\n\n# Try to switch to T4 machine\nprint('Switching to T4 GPU...')\ntry:\n    studio.switch_machine('T4')\n    print('Switched to T4')\nexcept Exception as e:\n    print('Error:', e)\n\" 2>&1","timeout_seconds":"60"}}],"api":"anthropic-messages","provider":"minimax","model":"MiniMax-M2.7","usage":{"input":377,"output":246,"cacheRead":92800,"cacheWrite":0,"totalTokens":93423,"cost":{"input":0.0001131,"output":0.00029519999999999997,"cacheRead":0.005567999999999999,"cacheWrite":0,"total":0.0059762999999999995}},"stopReason":"toolUse","timestamp":1777291983090,"responseId":"063e85d1e1118f681c355ba63723fd3e"}}
{"type":"message","id":"8017cd8f","parentId":"21d731b9","timestamp":"2026-04-27T12:13:20.342Z","message":{"role":"toolResult","toolCallId":"call_function_h6dulc6awca9_1","toolName":"bash","content":[{"type":"text","text":"Switching to T4 GPU...\nError: (400)\nReason: Bad Request\nHTTP response headers: HTTPHeaderDict({'Date': 'Mon, 27 Apr 2026 12:13:19 GMT', 'Content-Type': 'application/json', 'Transfer-Encoding': 'chunked', 'Connection': 'keep-alive', 'access-control-allow-headers': 'Content-Type,X-Grid-Key,X-Grid-User,Authorization', 'access-control-allow-methods': 'GET,POST,PUT,PATCH,DELETE,HEAD,OPTIONS', 'access-control-allow-origin': '*', 'Strict-Transport-Security': 'max-age=15552000; includeSubDomains; preload', 'Set-Cookie': 'session-id=97506ce9-d071-4cec-be5b-80d6b234b717; Path=/; HttpOnly; Secure; SameSite=Lax, visitor-id=400c1af5-0eda-4b12-9ceb-36ae6b45a676; Path=/; Expires=Tue, 27 Apr 2027 12:13:19 GMT; HttpOnly; Secure; SameSite=Lax', 'vary': 'Accept-Encoding', 'x-content-type-options': 'nosniff', 'x-frame-options': 'SAMEORIGIN', 'x-xss-protection': '1; mode=block', 'cf-cache-status': 'DYNAMIC', 'Cross-Origin-Opener-Policy': 'same-origin', 'Server': 'cloudflare', 'CF-RAY': '9f2dbd93fcabe328-DEL'})\nHTTP response body: b'{\"code\":3, \"message\":\"Error with compute configuration: accelerator T4 not found for this AWS cluster\", \"details\":[]}'\n\n"}],"isError":false,"timestamp":1777292000342}}
{"type":"message","id":"9dd0eaae","parentId":"8017cd8f","timestamp":"2026-04-27T12:13:32.879Z","message":{"role":"assistant","content":[{"type":"thinking","thinking":"Interesting! The T4 accelerator is not available on this cluster. Let me check what machines are available on this cluster.\n","thinkingSignature":"f18a374cb801f95639714bc765c5bec0d2955538dfb710c7e31c33d8bbaca64c"},{"type":"toolCall","id":"call_function_oqneju4ak1fs_1","name":"bash","arguments":{"command":"source ~/.venv/pg/bin/activate && python -c \"\nfrom lightning_sdk import Studio, Teamspace, Machine\nimport os\n\nos.environ['LIGHTNING_USER_ID'] = 'd52587bc-ec3c-4c9c-a2fa-71246e3d4020'\nos.environ['LIGHTNING_API_KEY'] = '25da12f4-1ad8-4e3f-8ba4-2a60fcebaabe'\n\nts = Teamspace(name='default-project', user='dhruv2mars')\nstudio = Studio(name='parameter-golf', teamspace=ts)\n\n# Try different machine names\nfor name in ['T4', 't4', 'GPU', 'gpu', 'L4', 'l4', 'A10G', 'a10g', 'A100', 'a100']:\n    try:\n        print(f'Trying {name}...')\n        studio.switch_machine(name)\n        print(f'Switched to {name}!')\n        break\n    except Exception as e:\n        print(f'{name}: Failed')\n\" 2>&1","timeout_seconds":"120"}}],"api":"anthropic-messages","provider":"minimax","model":"MiniMax-M2.7","usage":{"input":662,"output":289,"cacheRead":93120,"cacheWrite":0,"totalTokens":94071,"cost":{"input":0.0001986,"output":0.00034679999999999997,"cacheRead":0.0055872,"cacheWrite":0,"total":0.006132599999999999}},"stopReason":"toolUse","timestamp":1777292000346,"responseId":"063e85e38a432a3b7b607d993cd000f9"}}
{"type":"message","id":"1440f269","parentId":"9dd0eaae","timestamp":"2026-04-27T12:13:49.696Z","message":{"role":"toolResult","toolCallId":"call_function_oqneju4ak1fs_1","toolName":"bash","content":[{"type":"text","text":"Trying T4...\nT4: Failed\nTrying t4...\nt4: Failed\nTrying GPU...\nGPU: Failed\nTrying gpu...\ngpu: Failed\nTrying L4...\nL4: Failed\nTrying l4...\nl4: Failed\nTrying A10G...\nA10G: Failed\nTrying a10g...\na10g: Failed\nTrying A100...\nA100: Failed\nTrying a100...\na100: Failed\n"}],"isError":false,"timestamp":1777292029696}}
{"type":"message","id":"0ec0860e","parentId":"1440f269","timestamp":"2026-04-27T12:14:00.721Z","message":{"role":"assistant","content":[{"type":"thinking","thinking":"Let me check what machines are available. Maybe I need to use a different cloud account or region.\n","thinkingSignature":"e495aebf78051e6239c2a021e197714f5030342c7c084a7dc61a5cfcfe919a6d"},{"type":"toolCall","id":"call_function_9unmhtlno8vg_1","name":"bash","arguments":{"command":"source ~/.venv/pg/bin/activate && python -c \"\nfrom lightning_sdk import Studio, Teamspace, Machine, CloudProvider\nimport os\n\nos.environ['LIGHTNING_USER_ID'] = 'd52587bc-ec3c-4c9c-a2fa-71246e3d4020'\nos.environ['LIGHTNING_API_KEY'] = '25da12f4-1ad8-4e3f-8ba4-2a60fcebaabe'\n\nts = Teamspace(name='default-project', user='dhruv2mars')\nstudio = Studio(name='parameter-golf', teamspace=ts)\n\n# Check cloud accounts\nprint('Cloud accounts:', ts.cloud_accounts())\n\n# Try to get machines with default cloud account\ntry:\n    machines = ts.list_machines()\n    print('Machines:', machines)\nexcept Exception as e:\n    print('Error listing machines:', e)\n\" 2>&1","timeout_seconds":"30"}}],"api":"anthropic-messages","provider":"minimax","model":"MiniMax-M2.7","usage":{"input":390,"output":248,"cacheRead":93760,"cacheWrite":0,"totalTokens":94398,"cost":{"input":0.000117,"output":0.00029759999999999997,"cacheRead":0.0056256,"cacheWrite":0,"total":0.0060402}},"stopReason":"toolUse","timestamp":1777292029700,"responseId":"063e860167801a16266a3aad1b1934fd"}}
{"type":"message","id":"a7a6ceec","parentId":"0ec0860e","timestamp":"2026-04-27T12:14:05.401Z","message":{"role":"toolResult","toolCallId":"call_function_9unmhtlno8vg_1","toolName":"bash","content":[{"type":"text","text":"Traceback (most recent call last):\n  File \"<string>\", line 12, in <module>\n    print('Cloud accounts:', ts.cloud_accounts())\n                             ~~~~~~~~~~~~~~~~~^^\nTypeError: 'list' object is not callable\n\n\nCommand exited with code 1"}],"details":{},"isError":true,"timestamp":1777292045401}}
{"type":"message","id":"a45b7d3a","parentId":"a7a6ceec","timestamp":"2026-04-27T12:14:14.462Z","message":{"role":"assistant","content":[{"type":"thinking","thinking":"It's a list, not a method. Let me try differently.\n","thinkingSignature":"a4e60c9b6f60efbacc1ee34511265488b10f5dc9ebc4772502e311b423634ec1"},{"type":"toolCall","id":"call_function_vuueauubigpt_1","name":"bash","arguments":{"command":"source ~/.venv/pg/bin/activate && python -c \"\nfrom lightning_sdk import Studio, Teamspace, Machine\nimport os\n\nos.environ['LIGHTNING_USER_ID'] = 'd52587bc-ec3c-4c9c-a2fa-71246e3d4020'\nos.environ['LIGHTNING_API_KEY'] = '25da12f4-1ad8-4e3f-8ba4-2a60fcebaabe'\n\nts = Teamspace(name='default-project', user='dhruv2mars')\nstudio = Studio(name='parameter-golf', teamspace=ts)\n\n# Check cloud accounts\nprint('Cloud accounts:', ts.cloud_accounts)\nprint('Cloud account objs:', ts.cloud_account_objs)\n\" 2>&1","timeout_seconds":"30"}}],"api":"anthropic-messages","provider":"minimax","model":"MiniMax-M2.7","usage":{"input":301,"output":209,"cacheRead":94144,"cacheWrite":0,"totalTokens":94654,"cost":{"input":0.0000903,"output":0.00025079999999999997,"cacheRead":0.00564864,"cacheWrite":0,"total":0.00598974}},"stopReason":"toolUse","timestamp":1777292045406,"responseId":"063e8610b7622c6113b164be9df75bac"}}
{"type":"message","id":"a51bf18e","parentId":"a45b7d3a","timestamp":"2026-04-27T12:14:19.366Z","message":{"role":"toolResult","toolCallId":"call_function_vuueauubigpt_1","toolName":"bash","content":[{"type":"text","text":"Cloud accounts: ['lightning-public-prod', 'gcp-lightning-public-prod', 'lightning-aggregate-provider-prod', 'lightning-cloudflare-prod']\nCloud account objs: [{'cluster_id': 'lightning-public-prod',\n 'cluster_name': 'lightning-public-prod',\n 'cluster_region': '',\n 'created_at': '2024-11-12T06:46:47.754981Z',\n 'is_cluster_healthy': False,\n 'project_id': '01jcfhzwndfbgnp1sv571j2xtv',\n 'sa_key': '',\n 'sa_key_created_at': None,\n 'updated_at': '2024-11-12T06:46:47.754981Z'}, {'cluster_id': 'gcp-lightning-public-prod',\n 'cluster_name': 'gcp-lightning-public-prod',\n 'cluster_region': '',\n 'created_at': '2025-03-04T21:49:54.795657Z',\n 'is_cluster_healthy': False,\n 'project_id': '01jcfhzwndfbgnp1sv571j2xtv',\n 'sa_key': '',\n 'sa_key_created_at': None,\n 'updated_at': '2025-03-04T21:49:54.795657Z'}, {'cluster_id': 'lightning-aggregate-provider-prod',\n 'cluster_name': 'lightning-aggregate-provider-prod',\n 'cluster_region': '',\n 'created_at': '2025-07-23T21:15:03.356907Z',\n 'is_cluster_healthy': False,\n 'project_id': '01jcfhzwndfbgnp1sv571j2xtv',\n 'sa_key': '',\n 'sa_key_created_at': None,\n 'updated_at': '2025-07-23T21:15:03.356907Z'}, {'cluster_id': 'lightning-cloudflare-prod',\n 'cluster_name': 'lightning-cloudflare-prod',\n 'cluster_region': '',\n 'created_at': '2025-08-19T12:20:02.847517Z',\n 'is_cluster_healthy': False,\n 'project_id': '01jcfhzwndfbgnp1sv571j2xtv',\n 'sa_key': '',\n 'sa_key_created_at': None,\n 'updated_at': '2025-08-19T12:20:02.847517Z'}]\n"}],"isError":false,"timestamp":1777292059366}}
{"type":"message","id":"3a5bbba6","parentId":"a51bf18e","timestamp":"2026-04-27T12:14:32.472Z","message":{"role":"assistant","content":[{"type":"thinking","thinking":"The issue is that the clusters show `is_cluster_healthy: False`. That means the clusters might not be accessible. Let me try using a different cloud account - maybe GCP has GPUs?\n\nAlso, I see the cloud account is set to `lightning-public-prod`. Let me try using a different cloud account for the studio, or try switching to a different cloud provider cluster.\n\nActually, the simplest approach might be to use `run_job` to run training as a background job instead of in the interactive studio. That way the training runs in the cloud with proper GPU allocation.\n\nLet me try `run_job` with a GPU machine.\n","thinkingSignature":"df24fb0face89b1e405401f96b776958370a6c1377907560ef7d79da617ece89"},{"type":"toolCall","id":"call_function_di1b7roqgcot_1","name":"bash","arguments":{"command":"source ~/.venv/pg/bin/activate && python -c \"\nfrom lightning_sdk import Studio, Teamspace\nimport os\n\nos.environ['LIGHTNING_USER_ID'] = 'd52587bc-ec3c-4c9c-a2fa-71246e3d4020'\nos.environ['LIGHTNING_API_KEY'] = '25da12f4-1ad8-4e3f-8ba4-2a60fcebaabe'\n\nts = Teamspace(name='default-project', user='dhruv2mars')\n\n# Try to run a job with GPU\njob = ts.run_job(\n    name='parameter-golf-test',\n    machine='T4',  # or 'gcp-t4g-large'\n    command='python -c \\\"import torch; print(torch.cuda.is_available())\\\"'\n)\nprint('Job:', job)\n\" 2>&1","timeout_seconds":"60"}}],"api":"anthropic-messages","provider":"minimax","model":"MiniMax-M2.7","usage":{"input":763,"output":347,"cacheRead":94400,"cacheWrite":0,"totalTokens":95510,"cost":{"input":0.00022889999999999998,"output":0.0004164,"cacheRead":0.005664,"cacheWrite":0,"total":0.0063092999999999995}},"stopReason":"toolUse","timestamp":1777292059370,"responseId":"063e861e7faff967ecc5f68f21c384c2"}}
{"type":"message","id":"1a243472","parentId":"3a5bbba6","timestamp":"2026-04-27T12:14:34.325Z","message":{"role":"toolResult","toolCallId":"call_function_di1b7roqgcot_1","toolName":"bash","content":[{"type":"text","text":"Traceback (most recent call last):\n  File \"<string>\", line 11, in <module>\n    job = ts.run_job(\n          ^^^^^^^^^^\nAttributeError: 'Teamspace' object has no attribute 'run_job'\n\n\nCommand exited with code 1"}],"details":{},"isError":true,"timestamp":1777292074325}}
{"type":"message","id":"0004c81c","parentId":"1a243472","timestamp":"2026-04-27T12:14:40.711Z","message":{"role":"assistant","content":[{"type":"thinking","thinking":"Let me check the studio.run_job method instead.\n","thinkingSignature":"2c7d0f0cccfd8458f20c39c0b4a35ec7091fb8d8c6184dc9bf348c69dc86328c"},{"type":"toolCall","id":"call_function_as5n8bnjetue_1","name":"bash","arguments":{"command":"source ~/.venv/pg/bin/activate && python -c \"\nfrom lightning_sdk import Studio, Teamspace\nimport os\n\nos.environ['LIGHTNING_USER_ID'] = 'd52587bc-ec3c-4c9c-a2fa-71246e3d4020'\nos.environ['LIGHTNING_API_KEY'] = '25da12f4-1ad8-4e3f-8ba4-2a60fcebaabe'\n\nts = Teamspace(name='default-project', user='dhruv2mars')\nstudio = Studio(name='parameter-golf', teamspace=ts)\n\n# Try studio.run_job\njob = studio.run_job(\n    name='parameter-golf-test',\n    machine='T4',\n    command='python -c \\\"import torch; print(torch.cuda.is_available())\\\"'\n)\nprint('Job:', job)\n\" 2>&1","timeout_seconds":"60"}}],"api":"anthropic-messages","provider":"minimax","model":"MiniMax-M2.7","usage":{"input":343,"output":228,"cacheRead":95104,"cacheWrite":0,"totalTokens":95675,"cost":{"input":0.0001029,"output":0.0002736,"cacheRead":0.00570624,"cacheWrite":0,"total":0.00608274}},"stopReason":"toolUse","timestamp":1777292074329,"responseId":"063e862a7bf41c79bc7c0ba225d5b7eb"}}
