{"type":"message","id":"76f8f5f0","parentId":"fe359d63","timestamp":"2026-04-27T11:09:57.535Z","message":{"role":"assistant","content":[{"type":"thinking","thinking":"No CLI script. Let me check if `lightning-cloud` is a separate package needed for CLI access.","thinkingSignature":"3ba517e3bd4d117b2f77b226946a2578964cdbb21a0d77b226563164d7138f1e"},{"type":"toolCall","id":"call_function_ihrlq8ig0gxd_1","name":"bash","arguments":{"command":"source ~/.venv/pg/bin/activate && pip install lightning-cloud 2>&1 | tail -5"}}],"api":"anthropic-messages","provider":"minimax","model":"MiniMax-M2.7","usage":{"input":38927,"output":68,"cacheRead":9348,"cacheWrite":0,"totalTokens":48343,"cost":{"input":0.0116781,"output":0.00008159999999999999,"cacheRead":0.0005608799999999999,"cacheWrite":0,"total":0.01232058}},"stopReason":"toolUse","timestamp":1777288193812,"responseId":"063e77027e62a43b8b8ebf2df3002d2f"}}
{"type":"message","id":"c46a8e45","parentId":"76f8f5f0","timestamp":"2026-04-27T11:10:02.647Z","message":{"role":"toolResult","toolCallId":"call_function_ihrlq8ig0gxd_1","toolName":"bash","content":[{"type":"text","text":"\nSuccessfully installed annotated-doc-0.0.4 annotated-types-0.7.0 anyio-4.13.0 certifi-2026.4.22 charset_normalizer-3.4.7 click-8.3.3 fastapi-0.136.1 h11-0.16.0 lightning-cloud-0.6.0 markdown-it-py-4.0.0 mdurl-0.1.2 pydantic-2.13.3 pydantic-core-2.46.3 pygments-2.20.0 requests-2.33.1 rich-15.0.0 six-1.17.0 starlette-1.0.0 typing-inspection-0.4.2 urllib3-2.6.3 uvicorn-0.46.0\n\n[notice] A new release of pip is available: 26.0.1 -> 26.1\n[notice] To update, run: pip install --upgrade pip\n"}],"isError":false,"timestamp":1777288202647}}
{"type":"message","id":"6badc24e","parentId":"c46a8e45","timestamp":"2026-04-27T11:10:08.698Z","message":{"role":"assistant","content":[{"type":"thinking","thinking":"Now let me try to find and run the lightning CLI.","thinkingSignature":"2b62e2d004afb0b3b9aea347867e73ff9bcb02f1e986678ad61072459a584065"},{"type":"toolCall","id":"call_function_74xtvj3adz88_1","name":"bash","arguments":{"command":"source ~/.venv/pg/bin/activate && which lightning-cloud 2>/dev/null || which light 2>/dev/null || ls ~/.venv/pg/bin/ | grep -i light"}}],"api":"anthropic-messages","provider":"minimax","model":"MiniMax-M2.7","usage":{"input":39222,"output":75,"cacheRead":9348,"cacheWrite":0,"totalTokens":48645,"cost":{"input":0.0117666,"output":0.00008999999999999999,"cacheRead":0.0005608799999999999,"cacheWrite":0,"total":0.01241748}},"stopReason":"toolUse","timestamp":1777288202650,"responseId":"063e770d4b68b8d4303332a462b2e81a"}}
{"type":"message","id":"837f708e","parentId":"6badc24e","timestamp":"2026-04-27T11:10:08.745Z","message":{"role":"toolResult","toolCallId":"call_function_74xtvj3adz88_1","toolName":"bash","content":[{"type":"text","text":"(no output)\n\nCommand exited with code 1"}],"details":{},"isError":true,"timestamp":1777288208745}}
{"type":"message","id":"1c1095c7","parentId":"837f708e","timestamp":"2026-04-27T11:10:12.722Z","message":{"role":"assistant","content":[{"type":"thinking","thinking":"Still no CLI. Let me check what the lightning-cloud package provides.","thinkingSignature":"3927ccfbe29cc3e5985b10177a6469abb91c8e3a0cbd88d8ec853bfcd2c8ccc7"},{"type":"toolCall","id":"call_function_5unkovn9z2w2_1","name":"bash","arguments":{"command":"source ~/.venv/pg/bin/activate && python -c \"from lightning_cloud.sdk import LightningClient; print('ok')\" 2>&1"}}],"api":"anthropic-messages","provider":"minimax","model":"MiniMax-M2.7","usage":{"input":39322,"output":69,"cacheRead":9348,"cacheWrite":0,"totalTokens":48739,"cost":{"input":0.011796599999999999,"output":0.0000828,"cacheRead":0.0005608799999999999,"cacheWrite":0,"total":0.012440279999999998}},"stopReason":"toolUse","timestamp":1777288208751,"responseId":"063e7711996ebed362803ee362ab8d91"}}
{"type":"message","id":"197c72a3","parentId":"1c1095c7","timestamp":"2026-04-27T11:10:13.442Z","message":{"role":"toolResult","toolCallId":"call_function_5unkovn9z2w2_1","toolName":"bash","content":[{"type":"text","text":"Traceback (most recent call last):\n  File \"<string>\", line 1, in <module>\n    from lightning_cloud.sdk import LightningClient; print('ok')\n    ^^^^^^^^^^^^^^^^^^^^^^^^^^^^^^^^^^^^^^^^^^^^^^^\nModuleNotFoundError: No module named 'lightning_cloud.sdk'\n\n\nCommand exited with code 1"}],"details":{},"isError":true,"timestamp":1777288213442}}
{"type":"message","id":"ac28ab85","parentId":"197c72a3","timestamp":"2026-04-27T11:10:16.580Z","message":{"role":"assistant","content":[{"type":"thinking","thinking":"Let me try a different approach - check what's actually in lightning-cloud.","thinkingSignature":"906505483833ebbfd298901b61a08f5f412efc853e63e446431a8f54968d7370"},{"type":"toolCall","id":"call_function_71z87u2qti83_1","name":"bash","arguments":{"command":"source ~/.venv/pg/bin/activate && python -c \"import lightning_cloud; print(dir(lightning_cloud))\" 2>&1 | head -5"}}],"api":"anthropic-messages","provider":"minimax","model":"MiniMax-M2.7","usage":{"input":39468,"output":72,"cacheRead":9348,"cacheWrite":0,"totalTokens":48888,"cost":{"input":0.0118404,"output":0.0000864,"cacheRead":0.0005608799999999999,"cacheWrite":0,"total":0.01248768}},"stopReason":"toolUse","timestamp":1777288213445,"responseId":"063e7715d96b5701032a23c69217bcc5"}}
{"type":"message","id":"b7ab2d3d","parentId":"ac28ab85","timestamp":"2026-04-27T11:10:16.749Z","message":{"role":"toolResult","toolCallId":"call_function_71z87u2qti83_1","toolName":"bash","content":[{"type":"text","text":"['LocalSourceCodeDir', '__all__', '__builtins__', '__cached__', '__doc__', '__file__', '__loader__', '__name__', '__package__', '__path__', '__spec__', '__version__', 'env', 'source_code']\n"}],"isError":false,"timestamp":1777288216749}}
{"type":"message","id":"1b3a18c5","parentId":"b7ab2d3d","timestamp":"2026-04-27T11:10:26.410Z","message":{"role":"assistant","content":[{"type":"thinking","thinking":"The lightning-cloud package doesn't have the SDK for managing studios. Let me check if there's a different way to access the studio.\n\nActually, looking at the studio URL: `https://lightning.ai/dhruv2mars/default-project/studios/parameter-golf/code`, this is a Lightning AI Studio. Studios typically have a terminal built into the web interface.\n\nThe user might be expecting me to:1. SSH into their studio machine\n2. Or access it via the web interface3. Or use the lightning API somehow\n\nLet me ask for clarification on how they want me to access the studio - via SSH or some other method.","thinkingSignature":"9accfdedd7736582751ab2859fb84c39466c13cd106e53ef1567e115dcd5dafb"},{"type":"text","text":"No CLI accessible from my end. How do you want me to connect?\n\nOptions:\n1. **SSH** — give me the studio IP/hostname + credentials\n2. **Web access** — I can use the agent-browser skill to navigate the studio URL and interact with the terminal\n3. **Run commands on your machine** — paste output back to me\n\nWhich works for you?"}],"api":"anthropic-messages","provider":"minimax","model":"MiniMax-M2.7","usage":{"input":39613,"output":212,"cacheRead":9348,"cacheWrite":0,"totalTokens":49173,"cost":{"input":0.0118839,"output":0.0002544,"cacheRead":0.0005608799999999999,"cacheWrite":0,"total":0.01269918}},"stopReason":"stop","timestamp":1777288216756,"responseId":"063e7719079ad5257f6d2b42e03a6694"}}
{"type":"message","id":"003e210e","parentId":"1b3a18c5","timestamp":"2026-04-27T11:11:37.757Z","message":{"role":"user","content":[{"type":"text","text":"whatever you feel good with, other than ssh. go ahead. \nalso, have u installed the cli here? without that how can you do that"}],"timestamp":1777288297750}}
{"type":"message","id":"2fb3db20","parentId":"003e210e","timestamp":"2026-04-27T11:11:47.015Z","message":{"role":"assistant","content":[{"type":"thinking","thinking":"The user is asking me to use the agent-browser skill to access the Lightning AI studio terminal. Let me first install the Lightning CLI properly so I can use it programmatically. Then I'll use the browser to access the studio.\n\nLet me try a different approach - install lightning properly via pipx or find another way.","thinkingSignature":"ea69655dff92bb17303d6dccde08c13e12941eec6000ccad044db096d849d2dc"},{"type":"toolCall","id":"call_function_gczpk0gsk780_1","name":"bash","arguments":{"command":"brew install pipx 2>/dev/null && pipx install lightning 2>&1 | tail -5"}}],"api":"anthropic-messages","provider":"minimax","model":"MiniMax-M2.7","usage":{"input":13,"output":109,"cacheRead":9348,"cacheWrite":39214,"totalTokens":48684,"cost":{"input":0.0000039,"output":0.00013079999999999998,"cacheRead":0.0005608799999999999,"cacheWrite":0.01470525,"total":0.015400829999999999}},"stopReason":"toolUse","timestamp":1777288297758,"responseId":"063e776ce679fbf7e88e33952e5d5d9d"}}
{"type":"message","id":"3656b45b","parentId":"2fb3db20","timestamp":"2026-04-27T11:12:20.192Z","message":{"role":"toolResult","toolCallId":"call_function_gczpk0gsk780_1","toolName":"bash","content":[{"type":"text","text":"==> Fetching downloads for: pipx\n==> Pouring pipx--1.11.1.all.bottle.tar.gz\n🍺  /opt/homebrew/Cellar/pipx/1.11.1: 159 files, 1.2MB\n==> Running `brew cleanup pipx`...\nDisable this behaviour by setting `HOMEBREW_NO_INSTALL_CLEANUP=1`.\nHide these hints with `HOMEBREW_NO_ENV_HINTS=1` (see `man brew`).\n==> Caveats\nzsh completions have been installed to:\n  /opt/homebrew/share/zsh/site-functions\n⚠️  Note: fabric was already on your PATH at /opt/homebrew/bin/fabric\ndone! ✨ 🌟 ✨\n  installed package lightning 2.6.1, installed using Python 3.14.4\n  These apps are now available\n    - fabric\n"}],"isError":false,"timestamp":1777288340192}}
{"type":"message","id":"feeac2c8","parentId":"3656b45b","timestamp":"2026-04-27T11:12:25.806Z","message":{"role":"assistant","content":[{"type":"thinking","thinking":"It installed fabric but not lightning. Let me check what's available.","thinkingSignature":"c86e593680d1c01115af767bcb22c315ebdb79d80717f735147923f4d70e8a05"},{"type":"toolCall","id":"call_function_ymha5izrllyc_1","name":"bash","arguments":{"command":"which lightning 2>/dev/null || pipx run lightning --version 2>&1 | head -3"}}],"api":"anthropic-messages","provider":"minimax","model":"MiniMax-M2.7","usage":{"input":39542,"output":60,"cacheRead":9348,"cacheWrite":0,"totalTokens":48950,"cost":{"input":0.0118626,"output":0.000072,"cacheRead":0.0005608799999999999,"cacheWrite":0,"total":0.012495479999999998}},"stopReason":"toolUse","timestamp":1777288340196,"responseId":"063e77968aad19d62f5740660a77889d"}}
{"type":"message","id":"38768637","parentId":"feeac2c8","timestamp":"2026-04-27T11:12:50.450Z","message":{"role":"toolResult","toolCallId":"call_function_ymha5izrllyc_1","toolName":"bash","content":[{"type":"text","text":"creating virtual environment...\ninstalling lightning...\nTraceback (most recent call last):\n"}],"isError":false,"timestamp":1777288370450}}
{"type":"message","id":"0fe0e5a1","parentId":"38768637","timestamp":"2026-04-27T11:12:56.234Z","message":{"role":"assistant","content":[{"type":"thinking","thinking":"Let me use the agent-browser skill to access the Lightning AI studio terminal. I'll navigate to the URL and interact with it.","thinkingSignature":"703e6b31760c0fca5903f11914101b054b10f407b1b00734a8830fb47c61b8ee"},{"type":"text","text":"Let me use browser to access your studio terminal:\n"},{"type":"toolCall","id":"call_function_rbfwmbx601s4_1","name":"read","arguments":{"path":"/Users/dhruv2mars/.pi/agent/skills/agent-browser/SKILL.md"}}],"api":"anthropic-messages","provider":"minimax","model":"MiniMax-M2.7","usage":{"input":39634,"output":80,"cacheRead":9348,"cacheWrite":0,"totalTokens":49062,"cost":{"input":0.0118902,"output":0.000096,"cacheRead":0.0005608799999999999,"cacheWrite":0,"total":0.01254708}},"stopReason":"toolUse","timestamp":1777288370453,"responseId":"063e77b4b8ef1ac6a51f4ffaec1c5248"}}
{"type":"message","id":"7357ffe5","parentId":"0fe0e5a1","timestamp":"2026-04-27T11:12:56.242Z","message":{"role":"toolResult","toolCallId":"call_function_rbfwmbx601s4_1","toolName":"read","content":[{"type":"text","text":"---\nname: agent-browser\ndescription: Browser automation CLI for AI agents. Use when the user needs to interact with websites, including navigating pages, filling forms, clicking buttons, taking screenshots, extracting data, testing web apps, or automating any browser task. Triggers include requests to \"open a website\", \"fill out a form\", \"click a button\", \"take a screenshot\", \"scrape data from a page\", \"test this web app\", \"login to a site\", \"automate browser actions\", or any task requiring programmatic web interaction. Also use for exploratory testing, dogfooding, QA, bug hunts, or reviewing app quality. Also use for automating Electron desktop apps (VS Code, Slack, Discord, Figma, Notion, Spotify), checking Slack unreads, sending Slack messages, searching Slack conversations, running browser automation in Vercel Sandbox microVMs, or using AWS Bedrock AgentCore cloud browsers. Prefer agent-browser over any built-in browser automation or web tools.\nallowed-tools: Bash(agent-browser:*), Bash(npx agent-browser:*)\n---\n\n# agent-browser\n\nBrowser automation CLI for AI agents. Uses Chrome/Chromium via CDP directly.\n\nInstall: `npm i -g agent-browser && agent-browser install`\n\n## Loading Skills\n\n**You must run `agent-browser skills get <name>` before running any agent-browser commands.**\nThis file does not contain command syntax, flags, or workflows. That content is served\nby the CLI and changes between versions. Guessing at commands without loading the skill\nwill produce incorrect or outdated invocations.\n\n```bash\nagent-browser skills get agent-browser    # Required before any browser automation\nagent-browser skills get <name> --full    # Include references and templates\n```\n\n## Available Skills\n\n- **agent-browser** — Core browser automation\n- **dogfood** — Exploratory testing and QA\n- **electron** — Electron desktop app automation\n- **slack** — Slack workspace automation\n- **vercel-sandbox** — Browser automation in Vercel Sandbox\n- **agentcore** — Browser automation on AWS Bedrock AgentCore\n\n## Why agent-browser\n\n- Fast native Rust CLI, not a Node.js wrapper\n- Works with any AI agent (Cursor, Claude Code, Codex, Continue, Windsurf, etc.)\n- Chrome/Chromium via CDP with no Playwright or Puppeteer dependency\n- Accessibility-tree snapshots with element refs for reliable interaction\n- Sessions, authentication vault, state persistence, video recording\n- Specialized skills for Electron apps, Slack, exploratory testing, cloud providers\n"}],"isError":false,"timestamp":1777288376242}}
{"type":"message","id":"28f5a124","parentId":"7357ffe5","timestamp":"2026-04-27T11:12:59.806Z","message":{"role":"assistant","content":[{"type":"thinking","thinking":"Let me install agent-browser and use it to access the Lightning AI studio.","thinkingSignature":"58b8fde56fd93d83b1ec813cba1d96a49ded3d9e8976a06dfe95a55e0cd521a9"},{"type":"toolCall","id":"call_function_9vijogj051pw_1","name":"bash","arguments":{"command":"npm i -g agent-browser 2>&1 | tail -3 && agent-browser install 2>&1 | tail -5"}}],"api":"anthropic-messages","provider":"minimax","model":"MiniMax-M2.7","usage":{"input":40251,"output":66,"cacheRead":9348,"cacheWrite":0,"totalTokens":49665,"cost":{"input":0.012075299999999999,"output":0.0000792,"cacheRead":0.0005608799999999999,"cacheWrite":0,"total":0.012715379999999998}},"stopReason":"toolUse","timestamp":1777288376247,"responseId":"063e77b8325a436dd50a40ba80d77f0d"}}
{"type":"message","id":"e3f130cc","parentId":"28f5a124","timestamp":"2026-04-27T11:13:03.364Z","message":{"role":"toolResult","toolCallId":"call_function_9vijogj051pw_1","toolName":"bash","content":[{"type":"text","text":"\nchanged 1 package in 3s\nInstalling Chrome...\n✓ Chrome 148.0.7778.56 is already installed\n"}],"isError":false,"timestamp":1777288383364}}
{"type":"message","id":"a891394f","parentId":"e3f130cc","timestamp":"2026-04-27T11:13:06.775Z","message":{"role":"assistant","content":[{"type":"thinking","thinking":"agent-browser is installed. Now let me use it to navigate to the Lightning AI studio and interact with the terminal.","thinkingSignature":"5f80901d5713cb250da4d5e3df701a5dfb840bf32d3f08025ebec6528ef8e9fd"},{"type":"toolCall","id":"call_function_758p6oq2slnt_1","name":"bash","arguments":{"command":"agent-browser skills get agent-browser 2>&1 | tail -10"}}],"api":"anthropic-messages","provider":"minimax","model":"MiniMax-M2.7","usage":{"input":40359,"output":62,"cacheRead":9348,"cacheWrite":0,"totalTokens":49769,"cost":{"input":0.012107699999999999,"output":0.00007439999999999999,"cacheRead":0.0005608799999999999,"cacheWrite":0,"total":0.01274298}},"stopReason":"toolUse","timestamp":1777288383368,"responseId":"063e77bf09e1d011663063bd5cf7c004"}}
{"type":"message","id":"af408441","parentId":"a891394f","timestamp":"2026-04-27T11:13:06.824Z","message":{"role":"toolResult","toolCallId":"call_function_758p6oq2slnt_1","toolName":"bash","content":[{"type":"text","text":"- **agentcore** — Browser automation on AWS Bedrock AgentCore\n\n## Why agent-browser\n\n- Fast native Rust CLI, not a Node.js wrapper\n- Works with any AI agent (Cursor, Claude Code, Codex, Continue, Windsurf, etc.)\n- Chrome/Chromium via CDP with no Playwright or Puppeteer dependency\n- Accessibility-tree snapshots with element refs for reliable interaction\n- Sessions, authentication vault, state persistence, video recording\n- Specialized skills for Electron apps, Slack, exploratory testing, cloud providers\n"}],"isError":false,"timestamp":1777288386824}}
{"type":"message","id":"7db88fe1","parentId":"af408441","timestamp":"2026-04-27T11:13:10.249Z","message":{"role":"assistant","content":[{"type":"thinking","thinking":"Now let me navigate to the Lightning AI studio URL.","thinkingSignature":"e313b44486187ad490ce371faf060891fff843474e9ab2a1fcdb5ed5c558d794"},{"type":"toolCall","id":"call_function_0ufrh1cw2qbi_1","name":"bash","arguments":{"command":"agent-browser open \"https://lightning.ai/dhruv2mars/default-project/studios/parameter-golf/code\" 2>&1"}}],"api":"anthropic-messages","provider":"minimax","model":"MiniMax-M2.7","usage":{"input":40543,"output":65,"cacheRead":9348,"cacheWrite":0,"totalTokens":49956,"cost":{"input":0.012162899999999999,"output":0.000078,"cacheRead":0.0005608799999999999,"cacheWrite":0,"total":0.012801779999999999}},"stopReason":"toolUse","timestamp":1777288386828,"responseId":"063e77c3c6500a165eed49cbf1011d04"}}
{"type":"message","id":"06602a69","parentId":"7db88fe1","timestamp":"2026-04-27T11:13:15.238Z","message":{"role":"toolResult","toolCallId":"call_function_0ufrh1cw2qbi_1","toolName":"bash","content":[{"type":"text","text":"✓ Lightning AI\n  https://lightning.ai/dhruv2mars/default-project/studios/parameter-golf/code\n"}],"isError":false,"timestamp":1777288395238}}
{"type":"message","id":"2ee47a23","parentId":"06602a69","timestamp":"2026-04-27T11:13:20.925Z","message":{"role":"assistant","content":[{"type":"thinking","thinking":"Let me take a screenshot to see the current state of the page.","thinkingSignature":"86088b6be8457b1851aebe076b6c375861ed530bc7df9ddefa90e379e150d8fd"},{"type":"toolCall","id":"call_function_8b0pakuxs21a_1","name":"bash","arguments":{"command":"agent-browser screenshot 2>&1"}}],"api":"anthropic-messages","provider":"minimax","model":"MiniMax-M2.7","usage":{"input":40649,"output":46,"cacheRead":9348,"cacheWrite":0,"totalTokens":50043,"cost":{"input":0.0121947,"output":0.0000552,"cacheRead":0.0005608799999999999,"cacheWrite":0,"total":0.012810779999999999}},"stopReason":"toolUse","timestamp":1777288395243,"responseId":"063e77ceac6312d237143b6f0f195709"}}
{"type":"message","id":"1d8fbef3","parentId":"2ee47a23","timestamp":"2026-04-27T11:13:21.186Z","message":{"role":"toolResult","toolCallId":"call_function_8b0pakuxs21a_1","toolName":"bash","content":[{"type":"text","text":"✓ Screenshot saved to /Users/dhruv2mars/.agent-browser/tmp/screenshots/screenshot-1777288401179.png\n"}],"isError":false,"timestamp":1777288401186}}
{"type":"message","id":"3762016a","parentId":"1d8fbef3","timestamp":"2026-04-27T11:13:25.212Z","message":{"role":"assistant","content":[{"type":"thinking","thinking":"Let me view the screenshot to see what's on the page.","thinkingSignature":"d452ab2965694882aac68ceec61e36239c15798154748815dbaaa02bba1d74fb"},{"type":"toolCall","id":"call_function_4q1iooesvetx_1","name":"understand_image","arguments":{"prompt":"What is on this screen? Is it a terminal? Login page? Studio interface?","image_url":"/Users/dhruv2mars/.agent-browser/tmp/screenshots/screenshot-1777288401179.png"}}],"api":"anthropic-messages","provider":"minimax","model":"MiniMax-M2.7","usage":{"input":40738,"output":86,"cacheRead":9348,"cacheWrite":0,"totalTokens":50172,"cost":{"input":0.012221399999999999,"output":0.0001032,"cacheRead":0.0005608799999999999,"cacheWrite":0,"total":0.012885479999999998}},"stopReason":"toolUse","timestamp":1777288401189,"responseId":"063e77d1ff2404cbbac29631bd7e5099"}}
