{"type":"message","id":"ca4d0e01","parentId":"dd6f89a3","timestamp":"2026-04-25T18:31:20.621Z","message":{"role":"assistant","content":[{"type":"thinking","thinking":"Now I need to prepare the 30-min run. The config is in train_kaggle.py. For 30 min:\n- MAX_WALLCLOCK_SECONDS=1800 (30 min)\n- ITERATIONS=7000 (3x the 2500 for 10 min)\n\nLet me prepare the run. I need to push this to Kaggle. Let me check how to do it.\n\nFirst, let me understand the current hyperparameters and create a 30-min run. I'll need to push to Kaggle somehow.\n\nLooking at the code, the config is set via environment variables:\n- ITERATIONS=7000\n\n\n- MAX_WALLCLOCK_SECONDS=1800\n\nNow I'm setting up the Kaggle push using the pg_autoresearch.py script, which handles pushing to Kaggle and waiting for completion. Let me first examine the train_kaggle.py file to see what needs to be configured, then I'll prepare the push command to get this run on Kaggle.\n\nI can either use pg_autoresearch.py's run command or write a custom script. Let me review the train_kaggle.py file to understand all the hyperparameters available, then set up the 30-minute baseline run.\n","thinkingSignature":"51e194320bf3a75a28c81642b8e680e4c1ba4b648829466c163a42414aa04598"},{"type":"toolCall","id":"call_function_shcsmlzgu2an_1","name":"read","arguments":{"limit":150,"offset":81,"path":"/Users/dhruv2mars/dev/github/parameter-golf/train_kaggle.py"}}],"api":"anthropic-messages","provider":"minimax","model":"MiniMax-M2.7","usage":{"input":799,"output":305,"cacheRead":19808,"cacheWrite":0,"totalTokens":20912,"cost":{"input":0.0002397,"output":0.000366,"cacheRead":0.0011884799999999998,"cacheWrite":0,"total":0.0017941799999999998}},"stopReason":"toolUse","timestamp":1777141877889,"responseId":"063c3b760f511434b2b18c9e89985228"}}
{"type":"message","id":"533177d6","parentId":"ca4d0e01","timestamp":"2026-04-25T18:31:20.656Z","message":{"role":"toolResult","toolCallId":"call_function_shcsmlzgu2an_1","toolName":"read","content":[{"type":"text","text":"    val_loss_every = int(os.environ.get(\"VAL_LOSS_EVERY\", 50))\n    val_max_tokens = int(os.environ.get(\"VAL_MAX_TOKENS\", 131072))\n    \n    # Model architecture (proven SOTA config)\n    vocab_size = int(os.environ.get(\"VOCAB_SIZE\", 8192))\n    num_layers = int(os.environ.get(\"NUM_LAYERS\", 11))\n    model_dim = int(os.environ.get(\"MODEL_DIM\", 512))\n    num_heads = int(os.environ.get(\"NUM_HEADS\", 8))\n    num_kv_heads = int(os.environ.get(\"NUM_KV_HEADS\", 4))\n    mlp_mult = int(os.environ.get(\"MLP_MULT\", 4))\n    tie_embeddings = bool(int(os.environ.get(\"TIE_EMBEDDINGS\", \"1\")))\n    rope_base = float(os.environ.get(\"ROPE_BASE\", 10000.0))\n    rope_dims = int(os.environ.get(\"ROPE_DIMS\", 16))\n    logit_softcap = float(os.environ.get(\"LOGIT_SOFTCAP\", 30.0))\n    \n    # Depth recurrence (proven: layers 3-5 loop twice)\n    num_loops = int(os.environ.get(\"NUM_LOOPS\", 2))\n    loop_start = int(os.environ.get(\"LOOP_START\", 3))\n    loop_end = int(os.environ.get(\"LOOP_END\", 5))\n    enable_looping_at = float(os.environ.get(\"ENABLE_LOOPING_AT\", 0.35))\n    \n    # QK-Gain (proven: 5.25 is optimal)\n    qk_gain_init = float(os.environ.get(\"QK_GAIN_INIT\", 5.25))\n    \n    # Optimizer\n    matrix_lr = float(os.environ.get(\"MATRIX_LR\", _T4_MATRIX_LR))\n    weight_decay = float(os.environ.get(\"WEIGHT_DECAY\", 0.095))\n    beta1 = float(os.environ.get(\"BETA1\", 0.9))\n    beta2 = float(os.environ.get(\"BETA2\", 0.95))\n    adam_eps = float(os.environ.get(\"ADAM_EPS\", 1e-8))\n    grad_clip_norm = float(os.environ.get(\"GRAD_CLIP_NORM\", 1.0))\n    \n    # EMA (proven: 0.9965 is optimal)\n    ema_decay = float(os.environ.get(\"EMA_DECAY\", 0.9965))\n    \n    # Quantization\n    matrix_clip_sigmas = float(os.environ.get(\"MATRIX_CLIP_SIGMAS\", 12.85))\n    embed_clip_sigmas = float(os.environ.get(\"EMBED_CLIP_SIGMAS\", 20.0))\n    \n    # TTT (Test-Time Training) - enables via env var\n    ttt_enabled = bool(int(os.environ.get(\"TTT_ENABLED\", \"0\")))\n    ttt_lr = float(os.environ.get(\"TTT_LR\", 0.005))\n    ttt_epochs = int(os.environ.get(\"TTT_EPOCHS\", 3))\n    ttt_warmup_tokens = int(os.environ.get(\"TTT_WARMUP_TOKENS\", 32768))\n\n\n# ============================================================================\n# DATA LOADING\n# ============================================================================\n\ndef download_data(data_path, vocab_size=8192):\n    \"\"\"Download tokenizer and data shards from HuggingFace.\"\"\"\n    from huggingface_hub import hf_hub_download\n    \n    data_path = os.path.join(data_path, f\"fineweb10B_sp{vocab_size}\")\n    parent = os.path.dirname(data_path)\n    tok_dir = os.path.join(parent, \"tokenizers\")\n    \n    os.makedirs(data_path, exist_ok=True)\n    os.makedirs(tok_dir, exist_ok=True)\n    \n    repo_id = \"kevclark/parameter-golf\"\n    \n    # Tokenizer\n    tok_path = os.path.join(tok_dir, f\"fineweb_{vocab_size}_bpe.model\")\n    if not os.path.exists(tok_path) or os.path.getsize(tok_path) < 1000:\n        print(f\"Downloading tokenizer...\")\n        cached = hf_hub_download(\n            repo_id=repo_id,\n            filename=f\"datasets/tokenizers/fineweb_{vocab_size}_bpe.model\",\n            repo_type=\"dataset\"\n        )\n        import shutil\n        shutil.copy(cached, tok_path)\n        print(f\"Downloaded: {tok_path}\")\n    \n    # Data shards - need both val and train\n    for prefix, count in [(\"val\", 1), (\"train\", 2)]:\n        for i in range(count):\n            local = os.path.join(data_path, f\"fineweb_{prefix}_{i:06d}.bin\")\n            if os.path.exists(local) and os.path.getsize(local) > 1000:\n                continue\n            remote = f\"datasets/datasets/fineweb10B_sp{vocab_size}/fineweb_{prefix}_{i:06d}.bin\"\n            try:\n                cached = hf_hub_download(repo_id=repo_id, filename=remote, repo_type=\"dataset\")\n                import shutil\n                shutil.copy(cached, local)\n                print(f\"Downloaded: {os.path.basename(local)}\")\n            except Exception as e:\n                print(f\"ERROR downloading {remote}: {e}\")\n                raise\n    \n    return data_path, tok_path\n\n\ndef load_shard(path):\n    \"\"\"Load a FineWeb binary shard.\"\"\"\n    header = np.fromfile(path, dtype=\"<i4\", count=256)\n    if header.size != 256 or int(header[0]) != 20240520:\n        raise ValueError(f\"Bad shard header: {path}\")\n    num_tokens = int(header[2])\n    data = np.fromfile(path, dtype=\"<u2\", count=num_tokens, offset=256*4)\n    return torch.from_numpy(data.astype(np.uint16))\n\n\nclass TokenStream:\n    \"\"\"Streaming token loader that cycles through shards.\"\"\"\n    \n    def __init__(self, pattern):\n        self.files = sorted(Path(p) for p in glob.glob(str(pattern)))\n        if not self.files:\n            raise FileNotFoundError(f\"No files matching: {pattern}\")\n        self.file_idx = 0\n        self.tokens = load_shard(self.files[0])\n        self.pos = 0\n    \n    def _next_file(self):\n        self.file_idx = (self.file_idx + 1) % len(self.files)\n        self.tokens = load_shard(self.files[self.file_idx])\n        self.pos = 0\n    \n    def take(self, n):\n        \"\"\"Take n tokens, cycling through shards.\"\"\"\n        result = []\n        while n > 0:\n            avail = self.tokens.numel() - self.pos\n            if avail <= 0:\n                self._next_file()\n                continue\n            k = min(n, avail)\n            result.append(self.tokens[self.pos:self.pos+k])\n            self.pos += k\n            n -= k\n        return torch.cat(result)\n    \n    def seek_tokens(self, n):\n        \"\"\"Skip first n tokens (for resume).\"\"\"\n        while n > 0:\n            avail = self.tokens.numel() - self.pos\n            if avail <= n:\n                n -= avail\n                self._next_file()\n            else:\n                self.pos += n\n                n = 0\n\n\n# ============================================================================\n# TOKENIZER UTILITIES\n# ============================================================================\n\n[815 more lines in file. Use offset=231 to continue.]"}],"isError":false,"timestamp":1777141880656}}
{"type":"message","id":"b5c25636","parentId":"533177d6","timestamp":"2026-04-25T18:31:27.771Z","message":{"role":"assistant","content":[{"type":"thinking","thinking":"Good, I have the config. Now let me set up the 30-min run. Let me prepare the script to push to Kaggle.","thinkingSignature":"04177e351290239a2d6bf8575ad16bdb6c3248f50d00f6c6625c2288022da42c"},{"type":"text","text":"\n\nGood. Now let me prepare the 30-min run and the autoresearch setup. I'll do this in parallel.\n"},{"type":"toolCall","id":"call_function_ngf1vf0omxeo_1","name":"bash","arguments":{"command":"cd /Users/dhruv2mars/dev/github/parameter-golf && git checkout -b autoresearch/phase1-$(date +%Y%m%d) 2>/dev/null || echo \"branch exists\""}},{"type":"toolCall","id":"call_function_ngf1vf0omxeo_2","name":"bash","arguments":{"command":"ls /Users/dhruv2mars/dev/github/parameter-golf/records/track_10min_16mb/ | head -5"}}],"api":"anthropic-messages","provider":"minimax","model":"MiniMax-M2.7","usage":{"input":1661,"output":167,"cacheRead":20576,"cacheWrite":0,"totalTokens":22404,"cost":{"input":0.0004983,"output":0.0002004,"cacheRead":0.00123456,"cacheWrite":0,"total":0.00193326}},"stopReason":"toolUse","timestamp":1777141880659,"responseId":"063c3b7894d21ae05f1a752e56acb21c"}}
{"type":"message","id":"c572cb2c","parentId":"b5c25636","timestamp":"2026-04-25T18:31:27.824Z","message":{"role":"toolResult","toolCallId":"call_function_ngf1vf0omxeo_1","toolName":"bash","content":[{"type":"text","text":"(no output)"}],"isError":false,"timestamp":1777141887824}}
{"type":"message","id":"01488c72","parentId":"c572cb2c","timestamp":"2026-04-25T18:31:27.824Z","message":{"role":"toolResult","toolCallId":"call_function_ngf1vf0omxeo_2","toolName":"bash","content":[{"type":"text","text":"2026-03-17_LoRA_TTT\n2026-03-17_NaiveBaseline\n2026-03-18_FP16Embed_WD3600\n2026-03-18_LongContextSeq2048\n2026-03-18_LowerLR\n"}],"isError":false,"timestamp":1777141887824}}
{"type":"message","id":"9d62c31f","parentId":"01488c72","timestamp":"2026-04-25T18:31:29.260Z","message":{"role":"assistant","content":[{"type":"thinking","thinking":"Good, branch created. Now let me prepare the 30-min run. I need to:\n\n1. Create a script that runs the 30-min baseline\n2. Push it to Kaggle\n3. Monitor the results\n\nLet me first create the run command for 30 min, then push it.","thinkingSignature":"fd12b973bd75ae87a6fa44e2cc41055f0e6edc2b31861abb2892ba1ee60abfc0"},{"type":"toolCall","id":"call_function_5n5mlz9256gt_1","name":"read","arguments":{"path":"/Users/dhruv2mars/dev/github/parameter-golf/run_train.sh"}}],"api":"anthropic-messages","provider":"minimax","model":"MiniMax-M2.7","usage":{"input":226,"output":102,"cacheRead":22208,"cacheWrite":0,"totalTokens":22536,"cost":{"input":0.0000678,"output":0.0001224,"cacheRead":0.0013324799999999998,"cacheWrite":0,"total":0.0015226799999999998}},"stopReason":"toolUse","timestamp":1777141887826,"responseId":"063c3b80a2d20849297eb2c2502e31f3"}}
{"type":"message","id":"434b14aa","parentId":"9d62c31f","timestamp":"2026-04-25T18:31:29.281Z","message":{"role":"toolResult","toolCallId":"call_function_5n5mlz9256gt_1","toolName":"read","content":[{"type":"text","text":"#!/bin/bash\n# Parameter Golf - Kaggle 2xT4 Training Runner\n# Optimized for stable, long-running sessions with checkpointing.\n\nset -euo pipefail\n\n# Fast syntax check\npython3 -m py_compile train_kaggle.py 2>/dev/null || { \n    echo \"SYNTAX ERROR in train_kaggle.py\"\n    exit 1\n}\n\nmkdir -p logs checkpoints\n\n# =============================================================================\n# ENVIRONMENT: All hyperparameters configurable via env vars\n# =============================================================================\n\n# Run identification\nexport RUN_ID=${RUN_ID:-\"t4-$(date +%Y%m%d-%H%M%S)\"}\n\n# Training (10 min for quick validation, extend for long runs)\nexport ITERATIONS=${ITERATIONS:-2500}\nexport MAX_WALLCLOCK_SECONDS=${MAX_WALLCLOCK_SECONDS:-600}\nexport WARMDOWN_FRAC=${WARMDOWN_FRAC:-0.72}\nexport MIN_LR_RATIO=${MIN_LR_RATIO:-0.1}\n\n# Batch (effective batch = BATCH_TOKENS * GRAD_ACCUM)\nexport TRAIN_BATCH_TOKENS=${TRAIN_BATCH_TOKENS:-8192}\nexport TRAIN_SEQ_LEN=${TRAIN_SEQ_LEN:-512}\nexport GRAD_ACCUM_STEPS=${GRAD_ACCUM_STEPS:-1}  # 1 for quick feedback, 4 for larger effective batch\n\n# Model architecture (proven SOTA config)\nexport VOCAB_SIZE=${VOCAB_SIZE:-8192}\nexport NUM_LAYERS=${NUM_LAYERS:-11}\nexport MODEL_DIM=${MODEL_DIM:-512}\nexport NUM_HEADS=${NUM_HEADS:-8}\nexport NUM_KV_HEADS=${NUM_KV_HEADS:-4}\nexport MLP_MULT=${MLP_MULT:-4}\n\n# Depth recurrence (layers 3-5 loop twice after 35% of training)\nexport NUM_LOOPS=${NUM_LOOPS:-2}\nexport LOOP_START=${LOOP_START:-3}\nexport LOOP_END=${LOOP_END:-5}\nexport ENABLE_LOOPING_AT=${ENABLE_LOOPING_AT:-0.35}\n\n# QK-Gain (5.25 is proven optimal)\nexport QK_GAIN_INIT=${QK_GAIN_INIT:-5.25}\n\n# RoPE\nexport ROPE_DIMS=${ROPE_DIMS:-16}\nexport ROPE_BASE=${ROPE_BASE:-10000.0}\n\n# Optimizer (AdamW, tuned for T4)\nexport MATRIX_LR=${MATRIX_LR:-0.001}\nexport WEIGHT_DECAY=${WEIGHT_DECAY:-0.095}\nexport BETA1=${BETA1:-0.9}\nexport BETA2=${BETA2:-0.95}\nexport GRAD_CLIP_NORM=${GRAD_CLIP_NORM:-1.0}\nexport EMA_DECAY=${EMA_DECAY:-0.9965}\n\n# Quantization (GPTQ SDClip)\nexport MATRIX_CLIP_SIGMAS=${MATRIX_CLIP_SIGMAS:-12.85}\nexport EMBED_CLIP_SIGMAS=${EMBED_CLIP_SIGMAS:-20.0}\n\n# TTT (Test-Time Training) - enables via TTT_ENABLED=1\nexport TTT_ENABLED=${TTT_ENABLED:-0}\nexport TTT_LR=${TTT_LR:-0.005}\nexport TTT_EPOCHS=${TTT_EPOCHS:-3}\nexport TTT_WARMUP_TOKENS=${TTT_WARMUP_TOKENS:-32768}\n\n# Checkpointing\nexport CHECKPOINT_DIR=${CHECKPOINT_DIR:-\"checkpoints\"}\n\n# =============================================================================\n# PRINT CONFIG\n# =============================================================================\n\necho \"==========================================\"\necho \"Parameter Golf - T4 Training\"\necho \"==========================================\"\necho \"RUN_ID: $RUN_ID\"\necho \"ITERATIONS: $ITERATIONS\"\necho \"MAX_TIME: ${MAX_WALLCLOCK_SECONDS}s\"\necho \"EFFECTIVE_BATCH: $((TRAIN_BATCH_TOKENS * GRAD_ACCUM_STEPS)) tokens\"\necho \"MODEL: ${NUM_LAYERS}L x ${MODEL_DIM}d x ${NUM_HEADS}H / ${NUM_KV_HEADS}KV\"\necho \"LOOP: layers ${LOOP_START}-${LOOP_END}, ${NUM_LOOPS}x\"\necho \"QK-GAIN: $QK_GAIN_INIT\"\necho \"TTT: $TTT_ENABLED (${TTT_EPOCHS} epochs)\"\necho \"==========================================\"\n\n# =============================================================================\n# RUN\n# =============================================================================\n\npython3 train_kaggle.py 2>&1 | tee \"logs/${RUN_ID}.log\"\n\n# =============================================================================\n# EXTRACT METRICS\n# =============================================================================\n\nif [ -f \"logs/${RUN_ID}.log\" ]; then\n    echo \"\"\n    echo \"==========================================\"\n    echo \"RESULTS\"\n    echo \"==========================================\"\n    \n    # Extract from log\n    VAL_BPB=$(grep -E \"final_val_bpb|best_val_bpb\" \"logs/${RUN_ID}.log\" | tail -1 | sed 's/.*=\\([0-9.]*\\).*/\\1/' || echo \"N/A\")\n    ARTIFACT=$(grep -E \"Compressed artifact:|artifact_bytes\" \"logs/${RUN_ID}.log\" | tail -1 | grep -oE '[0-9]+,' | tr -d ',' || echo \"N/A\")\n    STEPS=$(grep -E \"total_steps\" \"logs/${RUN_ID}.log\" | tail -1 | sed 's/.*=\\([0-9]*\\).*/\\1/' || echo \"N/A\")\n    TIME=$(grep -E \"total_time_s\" \"logs/${RUN_ID}.log\" | tail -1 | sed 's/.*=\\([0-9.]*\\).*/\\1/' || echo \"N/A\")\n    \n    echo \"val_bpb: ${VAL_BPB}\"\n    echo \"artifact_bytes: ${ARTIFACT}\"\n    echo \"steps: ${STEPS}\"\n    echo \"time_seconds: ${TIME}\"\n    \n    # METRIC lines for auto-parsing\n    grep \"^METRIC \" \"logs/${RUN_ID}.log\" | tail -10\nfi"}],"isError":false,"timestamp":1777141889281}}
{"type":"message","id":"74dd1f02","parentId":"434b14aa","timestamp":"2026-04-25T18:31:31.443Z","message":{"role":"assistant","content":[{"type":"thinking","thinking":"Now I have the full picture. Let me set up the 30-min run. I need to:\n\n1. Run the 30-min baseline using `pg_autoresearch.py run --name` with modified env vars\n2. Then analyze the results\n3. Set up autoresearch\n\nFor the 30-min run, I'll use the existing `pg_autoresearch.py` script with:\n- ITERATIONS=7000\n- MAX_WALLCLOCK_SECONDS=1800\n\nLet me prepare the command for the user. But first, let me also check what the existing script does for metric extraction.\n","thinkingSignature":"4fb7078a8cb0612b76f557829f9cfe458944bf6865796013cd523ec16e52b5e2"},{"type":"text","text":"\n\n## Phase 1: Running 30-min Baseline\n"},{"type":"toolCall","id":"call_function_28ah2nqbdmp9_1","name":"bash","arguments":{"command":"cd /Users/dhruv2mars/dev/github/parameter-golf && python3 experiments/pg_autoresearch.py launch --name \"30min_baseline_$(date +%Y%m%d)\" --env \"ITERATIONS=7000\" --env \"MAX_WALLCLOCK_SECONDS=1800\" 2>&1"}}],"api":"anthropic-messages","provider":"minimax","model":"MiniMax-M2.7","usage":{"input":1375,"output":229,"cacheRead":22400,"cacheWrite":0,"totalTokens":24004,"cost":{"input":0.0004125,"output":0.0002748,"cacheRead":0.001344,"cacheWrite":0,"total":0.0020312999999999998}},"stopReason":"toolUse","timestamp":1777141889284,"responseId":"063c3b811e07e8238166c1cfaf1a4578"}}
{"type":"message","id":"274d553b","parentId":"74dd1f02","timestamp":"2026-04-25T18:31:34.211Z","message":{"role":"toolResult","toolCallId":"call_function_28ah2nqbdmp9_1","toolName":"bash","content":[{"type":"text","text":"{\"env\": {\"ITERATIONS\": \"7000\", \"MAX_WALLCLOCK_SECONDS\": \"1800\", \"RUN_ID\": \"30min-baseline-20260426\"}, \"path\": \"/Users/dhruv2mars/dev/github/parameter-golf/experiments/kaggle_work/30min-baseline-20260426\", \"ref\": \"dhruv2mars/pg-auto-30min-baseline-20260426-41891\"}\n"}],"isError":false,"timestamp":1777141894211}}
{"type":"message","id":"0513e85b","parentId":"274d553b","timestamp":"2026-04-25T18:31:35.983Z","message":{"role":"assistant","content":[{"type":"thinking","thinking":"The kernel was pushed. Let me check its status.\n","thinkingSignature":"1ed3d5a3acc6e10456adee673d3a8623f4629ceee1bdce6d03ba80fde930028c"},{"type":"toolCall","id":"call_function_iqsn17ezh8e1_1","name":"bash","arguments":{"command":"cd /Users/dhruv2mars/dev/github/parameter-golf && python3 experiments/pg_autoresearch.py status --ref \"dhruv2mars/pg-auto-30min-baseline-20260426-41891\" 2>&1"}}],"api":"anthropic-messages","provider":"minimax","model":"MiniMax-M2.7","usage":{"input":231,"output":87,"cacheRead":23744,"cacheWrite":0,"totalTokens":24062,"cost":{"input":0.00006929999999999999,"output":0.00010439999999999999,"cacheRead":0.0014246399999999998,"cacheWrite":0,"total":0.0015983399999999997}},"stopReason":"toolUse","timestamp":1777141894212,"responseId":"063c3b8696c37cd778dca97fc9e9f3eb"}}
{"type":"message","id":"b59698e4","parentId":"0513e85b","timestamp":"2026-04-25T18:31:38.817Z","message":{"role":"toolResult","toolCallId":"call_function_iqsn17ezh8e1_1","toolName":"bash","content":[{"type":"text","text":"KernelWorkerStatus.RUNNING\n"}],"isError":false,"timestamp":1777141898817}}
{"type":"message","id":"ae77c16c","parentId":"b59698e4","timestamp":"2026-04-25T18:31:41.512Z","message":{"role":"assistant","content":[{"type":"thinking","thinking":"Good, it's running. Let me check the status periodically. Meanwhile, I can start reading more of the code to understand the full architecture for Phase 2.","thinkingSignature":"6d3505054e446c055d0de866bdf6b43755c197cac495e926c5a627782772e059"},{"type":"text","text":"\n\n30-min baseline launched. Kernel running.\n\nNow moving to **Phase 2: Analysis** while it runs. Let me audit the current code.\n"},{"type":"toolCall","id":"call_function_6tqbfqlz2rhv_1","name":"read","arguments":{"limit":300,"offset":230,"path":"/Users/dhruv2mars/dev/github/parameter-golf/train_kaggle.py"}}],"api":"anthropic-messages","provider":"minimax","model":"MiniMax-M2.7","usage":{"input":103,"output":122,"cacheRead":23968,"cacheWrite":0,"totalTokens":24193,"cost":{"input":0.0000309,"output":0.00014639999999999998,"cacheRead":0.0014380799999999998,"cacheWrite":0,"total":0.0016153799999999998}},"stopReason":"toolUse","timestamp":1777141898818,"responseId":"063c3b8ba789ed1a3de7f80a045c4b54"}}
