{"type":"message","id":"bd5bb2d7","parentId":"8e804686","timestamp":"2026-04-27T03:05:22.159Z","message":{"role":"toolResult","toolCallId":"call_function_84p9jsitgvee_1","toolName":"bash","content":[{"type":"text","text":"{\"best_val_bpb\": 2.3051, \"compressed_bytes\": null, \"error\": null, \"metric\": 2.3051, \"non_finite\": false, \"output\": \"/Users/dhruv2mars/dev/github/parameter-golf/experiments/kaggle_results/pg-auto-ar-best-confirm-20260427-56914\", \"ref\": \"dhruv2mars/pg-auto-ar-best-confirm-20260427-56914\", \"runtime_seconds\": null, \"status\": \"KernelWorkerStatus.COMPLETE\", \"steps\": 1100, \"ttt_val_bpb\": null, \"val_bpb\": 2.3051}\n"}],"isError":false,"timestamp":1777259122159}}
{"type":"message","id":"e5b392df","parentId":"bd5bb2d7","timestamp":"2026-04-27T03:05:37.772Z","message":{"role":"assistant","content":[{"type":"thinking","thinking":"The confirmation run got 2.3051, which is slightly worse than the 2.2996 that I had as the best. The variation is within noise (±0.01). The 2.2897 was likely noise. The true performance is around 2.30-2.31.Let me log this.","thinkingSignature":"0ca41e84590f568e9fa3d4efb9cb83c5c7d76dad6c1b048483de9a393a41ad2e"},{"type":"toolCall","id":"call_function_izifs52cm4u5_1","name":"log_experiment","arguments":{"asi":{"arch":"rope32+ema994+clip0.3+qk4+warmdown0.80+lr0.0008","conclusion":"confirms ~2.30-2.31 is the true range, 2.29 was lucky noise"},"commit":"8f3abc1","description":"Confirmation run: 2.305, confirms ~2.30-2.31 range","metric":2.3051,"metrics":{"artifact_mb":12.1,"best_val_bpb":2.3051,"steps":1100},"status":"keep"}}],"api":"anthropic-messages","provider":"minimax","model":"MiniMax-M2.7","usage":{"input":94143,"output":252,"cacheRead":0,"cacheWrite":9711,"totalTokens":104106,"cost":{"input":0.028242899999999998,"output":0.0003024,"cacheRead":0,"cacheWrite":0.003641625,"total":0.032186925}},"stopReason":"toolUse","timestamp":1777259122163,"responseId":"063e0575d2ed78d6d8d57eaf4659513f"}}
