{"type":"message","id":"80ea2cd6","parentId":"69ae56c1","timestamp":"2026-04-25T18:08:10.996Z","message":{"role":"toolResult","toolCallId":"call_function_ye96a8wiw8ys_1","toolName":"read","content":[{"type":"text","text":"#!/usr/bin/env python3\n\"\"\"Kaggle-backed Parameter Golf experiment helper.\"\"\"\n\nfrom __future__ import annotations\n\nimport argparse\nimport json\nimport os\nimport re\nimport shutil\nimport subprocess\nimport sys\nimport time\nfrom dataclasses import dataclass\nfrom pathlib import Path\n\n\nREPO = Path(__file__).resolve().parents[1]\nWORK = REPO / \"experiments\" / \"kaggle_work\"\nOUT = REPO / \"experiments\" / \"kaggle_results\"\nSTATE = REPO / \"experiments\" / \"kaggle_state.json\"\nDEFAULT_REF = \"dhruv2mars/parameter-golf-t4-stable\"\n\n\n@dataclass\nclass Metrics:\n    ref: str\n    status: str\n    best_val_bpb: float | None\n    ttt_val_bpb: float | None\n    steps: int\n    compressed_bytes: int | None\n    runtime_seconds: float | None\n    non_finite: bool\n    error: str | None\n\n    @property\n    def metric(self) -> float:\n        return self.ttt_val_bpb or self.best_val_bpb or 999.0\n\n\ndef run(cmd: list[str], cwd: Path = REPO, check: bool = True) -> subprocess.CompletedProcess[str]:\n    return subprocess.run(cmd, cwd=cwd, text=True, stdout=subprocess.PIPE, stderr=subprocess.STDOUT, check=check)\n\n\ndef slugify(text: str) -> str:\n    s = re.sub(r\"[^a-z0-9]+\", \"-\", text.lower()).strip(\"-\")\n    return s[:45] or \"trial\"\n\n\ndef load_state() -> dict:\n    if STATE.exists():\n        return json.loads(STATE.read_text())\n    return {\n        \"best\": {\n            \"ref\": DEFAULT_REF,\n            \"best_val_bpb\": 2.4912,\n            \"metric\": 2.4912,\n            \"description\": \"Kaggle v3 AdamW baseline, 2xT4, step 500\",\n        },\n        \"runs\": [],\n    }\n\n\ndef save_state(state: dict) -> None:\n    STATE.parent.mkdir(parents=True, exist_ok=True)\n    tmp = STATE.with_suffix(\".tmp\")\n    tmp.write_text(json.dumps(state, indent=2, sort_keys=True) + \"\\n\")\n    tmp.replace(STATE)\n\n\ndef prepare_kernel(name: str, env: dict[str, str]) -> tuple[Path, str]:\n    slug = slugify(name)\n    ref = f\"dhruv2mars/pg-auto-{slug}-{int(time.time()) % 100000}\"\n    target = WORK / slug\n    if target.exists():\n        shutil.rmtree(target)\n    target.mkdir(parents=True)\n\n    for rel in [\"requirements.txt\"]:\n        shutil.copy2(REPO / rel, target / rel)\n\n    wrapper = target / \"run_kernel.py\"\n    env_lines = \"\\n\".join(f\"os.environ[{k!r}] = {v!r}\" for k, v in sorted(env.items()))\n    train_source = (REPO / \"train_kaggle.py\").read_text()\n    wrapper.write_text(\n        \"import os\\n\"\n        f\"{env_lines}\\n\"\n        \"# Inlined because Kaggle executes only code_file as /kaggle/src/script.py.\\n\"\n        f\"{train_source}\\n\"\n    )\n    (target / \"kernel-metadata.json\").write_text(\n        json.dumps(\n            {\n                \"id\": ref,\n                \"title\": ref.split(\"/\", 1)[1].replace(\"-\", \" \").title(),\n                \"code_file\": \"run_kernel.py\",\n                \"language\": \"python\",\n                \"kernel_type\": \"script\",\n                \"is_private\": True,\n                \"enable_gpu\": True,\n                \"enable_tpu\": False,\n                \"enable_internet\": True,\n                \"dataset_sources\": [],\n                \"competition_sources\": [],\n                \"kernel_sources\": [],\n                \"model_sources\": [],\n            },\n            indent=2,\n        )\n        + \"\\n\"\n    )\n    return target, ref\n\n\ndef push_kernel(path: Path) -> str:\n    cp = run([\"kaggle\", \"kernels\", \"push\", \"-p\", str(path), \"--accelerator\", \"NvidiaTeslaT4\"], check=False)\n    if cp.returncode != 0:\n        raise RuntimeError(cp.stdout)\n    return cp.stdout\n\n\ndef status(ref: str) -> str:\n    cp = run([\"kaggle\", \"kernels\", \"status\", ref], check=False)\n    m = re.search(r'status \"([^\"]+)\"', cp.stdout)\n    return m.group(1) if m else cp.stdout.strip()\n\n\ndef wait(ref: str, timeout: int, poll: int) -> str:\n    deadline = time.time() + timeout\n    last = \"\"\n    while time.time() < deadline:\n        last = status(ref)\n        if last.endswith(\".COMPLETE\") or last.endswith(\".ERROR\") or last in {\"COMPLETE\", \"ERROR\"}:\n            return last\n        time.sleep(poll)\n    return last or \"TIMEOUT\"\n\n\ndef pull(ref: str, dest: Path) -> None:\n    if dest.exists():\n        shutil.rmtree(dest)\n    dest.mkdir(parents=True)\n    run([\"kaggle\", \"kernels\", \"output\", ref, \"-p\", str(dest), \"--force\"], check=False)\n\n\ndef parse_logs(ref: str, dest: Path, status_value: str) -> Metrics:\n    text = \"\\n\".join(p.read_text(errors=\"replace\") for p in dest.rglob(\"*.txt\"))\n    text += \"\\n\".join(p.read_text(errors=\"replace\") for p in dest.rglob(\"*.log\"))\n\n    vals = [float(x) for x in re.findall(r\"Best val_bpb:\\s*([0-9.]+)\", text)]\n    ttt = [float(x) for x in re.findall(r\"TTT val_bpb:\\s*([0-9.]+)\", text)]\n    steps = [int(x) for x in re.findall(r\"step:(\\d+)/\", text)]\n    compressed = [int(x) for x in re.findall(r\"Compressed:\\s*(\\d+)\\s*bytes\", text)]\n    times = [float(x) / 1000.0 for x in re.findall(r\"time:([0-9.]+)ms\", text)]\n    err_match = re.search(r\"(Traceback .*|RuntimeError: .*|IndexError: .*|CUDA out of memory.*)\", text, re.S)\n    return Metrics(\n        ref=ref,\n        status=status_value,\n        best_val_bpb=min(vals) if vals else None,\n        ttt_val_bpb=min(ttt) if ttt else None,\n        steps=max(steps) if steps else 0,\n        compressed_bytes=compressed[-1] if compressed else None,\n        runtime_seconds=max(times) if times else None,\n        non_finite=\"Non-finite loss\" in text or \"train_loss:nan\" in text,\n        error=(err_match.group(1)[:500] if err_match else None),\n    )\n\n\ndef record(metrics: Metrics, desc: str) -> None:\n    state = load_state()\n    row = {\n        \"ref\": metrics.ref,\n        \"description\": desc,\n        \"status\": metrics.status,\n        \"best_val_bpb\": metrics.best_val_bpb,\n        \"ttt_val_bpb\": metrics.ttt_val_bpb,\n        \"metric\": metrics.metric,\n        \"steps\": metrics.steps,\n        \"compressed_bytes\": metrics.compressed_bytes,\n        \"runtime_seconds\": metrics.runtime_seconds,\n        \"non_finite\": metrics.non_finite,\n        \"error\": metrics.error,\n        \"ts\": int(time.time()),\n    }\n    state.setdefault(\"runs\", []).append(row)\n    best_metric = float(state.get(\"best\", {}).get(\"metric\", 999.0))\n    if metrics.metric < best_metric and not metrics.non_finite:\n        state[\"best\"] = row\n    save_state(state)\n\n\ndef cmd_baseline(_args: argparse.Namespace) -> int:\n    state = load_state()\n    print(json.dumps({\"val_bpb\": state[\"best\"][\"metric\"], \"best\": state[\"best\"]}, sort_keys=True))\n    return 0\n\n\ndef cmd_launch(args: argparse.Namespace) -> int:\n    env = dict(item.split(\"=\", 1) for item in args.env)\n    env.setdefault(\"RUN_ID\", slugify(args.name))\n    path, ref = prepare_kernel(args.name, env)\n    push_kernel(path)\n    print(json.dumps({\"ref\": ref, \"path\": str(path), \"env\": env}, sort_keys=True))\n    return 0\n\n\ndef cmd_run(args: argparse.Namespace) -> int:\n    env = dict(item.split(\"=\", 1) for item in args.env)\n    env.setdefault(\"RUN_ID\", slugify(args.name))\n    path, ref = prepare_kernel(args.name, env)\n    push_kernel(path)\n    st = wait(ref, args.timeout, args.poll)\n    dest = OUT / ref.split(\"/\", 1)[1]\n    pull(ref, dest)\n    metrics = parse_logs(ref, dest, st)\n    record(metrics, args.name)\n    print(json.dumps(metrics.__dict__ | {\"metric\": metrics.metric, \"val_bpb\": metrics.metric, \"output\": str(dest)}, sort_keys=True))\n    return 0 if metrics.best_val_bpb is not None and not metrics.non_finite else 1\n\n\ndef cmd_collect(args: argparse.Namespace) -> int:\n    st = status(args.ref)\n    dest = OUT / args.ref.split(\"/\", 1)[1]\n    pull(args.ref, dest)\n    metrics = parse_logs(args.ref, dest, st)\n    record(metrics, args.name or args.ref)\n    print(json.dumps(metrics.__dict__ | {\"metric\": metrics.metric, \"val_bpb\": metrics.metric, \"output\": str(dest)}, sort_keys=True))\n    return 0 if metrics.best_val_bpb is not None and not metrics.non_finite else 1\n\n\ndef cmd_status(args: argparse.Namespace) -> int:\n    print(status(args.ref))\n    return 0\n\n\ndef main() -> int:\n    p = argparse.ArgumentParser()\n    sub = p.add_subparsers(dest=\"cmd\", required=True)\n    sub.add_parser(\"baseline\").set_defaults(func=cmd_baseline)\n\n    launch = sub.add_parser(\"launch\")\n    launch.add_argument(\"--name\", required=True)\n    launch.add_argument(\"--env\", action=\"append\", default=[])\n    launch.set_defaults(func=cmd_launch)\n\n    runp = sub.add_parser(\"run\")\n    runp.add_argument(\"--name\", required=True)\n    runp.add_argument(\"--env\", action=\"append\", default=[])\n    runp.add_argument(\"--timeout\", type=int, default=5400)\n    runp.add_argument(\"--poll\", type=int, default=120)\n    runp.set_defaults(func=cmd_run)\n\n    collect = sub.add_parser(\"collect\")\n    collect.add_argument(\"--ref\", required=True)\n    collect.add_argument(\"--name\")\n    collect.set_defaults(func=cmd_collect)\n\n    stat = sub.add_parser(\"status\")\n    stat.add_argument(\"--ref\", required=True)\n    stat.set_defaults(func=cmd_status)\n\n    args = p.parse_args()\n    try:\n        return args.func(args)\n    except Exception as exc:\n        print(json.dumps({\"error\": str(exc), \"metric\": 999.0}, sort_keys=True))\n        return 1\n\n\nif __name__ == \"__main__\":\n    sys.exit(main())\n"}],"isError":false,"timestamp":1777140490996}}
{"type":"message","id":"861162fb","parentId":"80ea2cd6","timestamp":"2026-04-25T18:08:10.997Z","message":{"role":"toolResult","toolCallId":"call_function_ye96a8wiw8ys_2","toolName":"read","content":[{"type":"text","text":"{\n  \"best\": {\n    \"ref\": \"dhruv2mars/parameter-golf-t4-stable\",\n    \"best_val_bpb\": 2.8283,\n    \"metric\": 2.8283,\n    \"description\": \"Baseline 10-min run: 110 steps, val_bpb=2.8283\"\n  },\n  \"runs\": [\n    {\n      \"ref\": \"dhruv2mars/parameter-golf-t4-stable\",\n      \"description\": \"Stable pipeline baseline\",\n      \"status\": \"COMPLETE\",\n      \"best_val_bpb\": 2.8283,\n      \"ttt_val_bpb\": null,\n      \"metric\": 2.8283,\n      \"steps\": 110,\n      \"compressed_bytes\": 8857347,\n      \"runtime_seconds\": 650,\n      \"non_finite\": false,\n      \"error\": null,\n      \"ts\": 1744665960\n    }\n  ]\n}"}],"isError":false,"timestamp":1777140490996}}
{"type":"message","id":"a5ccaf7a","parentId":"861162fb","timestamp":"2026-04-25T18:08:32.005Z","message":{"role":"assistant","content":[{"type":"thinking","thinking":"Okay, now I have a full picture. Let me summarize what I've learned:\n\n**Current State:**\n- Baseline: ~2.65-2.83 BPB on 10 min training runs (2xT4)\n- SOTA on leaderboard: ~1.08 BPB (requires special tricks, PR-based, etc.)\n- Goal: sub-1, ideally 0.5-0.6 BPB\n\n**Architecture:**\n- 11L x 512d x 8H / 4KV, tied embeddings\n- SP8192 tokenizer\n- Depth recurrence (layers 3-5, loop 2x)\n- QK-Gain 5.25\n- GPTQ int6/int8 quantization\n- TTT (Test-Time Training) available\n\n**Training:**\n- 2x T4 GPUs (16GB each)\n- Kaggle (30hrs/week quota, 12hr session limit)\n- Checkpointing every 5 mins\n- Extended training (50K-100K steps target)\n\n**Key Insight:** The user is NOT competing in the 10-min leaderboard — they're doing extended training on their own hardware (2xT4 on Kaggle) to eventually achieve sub-1 BPB.\n\n**The problem with the proposed autoresearch setup:**\n1. Training on Kaggle requires pushing kernels, waiting for results, pulling logs — this is SLOW (minutes per experiment)\n2. Each experiment takes 10+ minutes minimum just for training\n3. With 30 hours/week quota and 12hr session limits, there's natural boundaries\n4. The loop would be bottlenecked by Kaggle API latency, not compute\n\n**What makes sense:**\n- Use local experiments (even 1xT4) for quick iteration (< 2 min feedback)\n- Use Kaggle for longer runs (30min-12hr) as \"production\" experiments\n- Autoresearch is perfect for local experiments to find good configs, then push those to Kaggle for extended training\n \nNow I'm examining what's been tried so far and what's working. Looking at the leaderboard, the best results combine several techniques: extended context (8192 tokens), depth recurrence with 3-layer looping, parallel residuals, legal TTT, and QK-Gain around 5.25. The top scores cluster around 1.08-1.12, which suggests this combination is hitting diminishing returns but still improving. Need to understand which of these components are essential versus optional, and whether there's room to push further with longer training or additional optimizations.\n","thinkingSignature":"cce8fdb9a794158b13464166bf83e30d2dcd76968b5b39ac51bdb323786755dc"},{"type":"text","text":"\n\nAlright, I have full context now. Let me start the interrogation.\n\n**Second question: What's your CURRENT best BPB on 2xT4 with extended training?**\n\nYou mentioned 2.65 BPB on 10-min runs, but what have you achieved with 1hr, 6hr, or 12hr training sessions? And have you actually pushed to sub-1 BPB yet, or is that still theoretical?"}],"api":"anthropic-messages","provider":"minimax","model":"MiniMax-M2.7","usage":{"input":2750,"output":611,"cacheRead":39296,"cacheWrite":0,"totalTokens":42657,"cost":{"input":0.000825,"output":0.0007331999999999999,"cacheRead":0.00235776,"cacheWrite":0,"total":0.00391596}},"stopReason":"stop","timestamp":1777140490999,"responseId":"063c360b7dcc85d749b3cd00c02c49ba"}}
{"type":"message","id":"3c9a9dc1","parentId":"a5ccaf7a","timestamp":"2026-04-25T18:09:05.840Z","message":{"role":"user","content":[{"type":"text","text":"i have not done extended training yet."}],"timestamp":1777140545833}}
{"type":"message","id":"a73c335e","parentId":"3c9a9dc1","timestamp":"2026-04-25T18:09:23.373Z","message":{"role":"assistant","content":[{"type":"thinking","thinking":"So the user has NOT done extended training yet. They have:\n- 10 min baseline: ~2.65 BPB\n- Not done 1hr, 6hr, or 12hr runs\n\nThis is critical context. The plan is:\n1. extend training time\n2. add TTT\n3. add PPM hybrid\n\nBut none of these have been tested in combination on their actual hardware.\n\nNow I need to understand more about the autoresearch setup. The key challenge is:\n\n1. **Training is on Kaggle** - not local. This means the experiment loop needs to push code to Kaggle, wait for results, pull logs, parse metrics.\n\n2. **12-hour max sessions** - the benchmark script needs to work within this constraint or be resumable.\n\n3. **Goal is 0.5-0.6 BPB** - starting from 2.65 BPB. That's a 4-5x improvement needed.\n\n4. **Three axes to optimize**: training time, TTT, PPM hybrid\n\nLet me ask about the Kaggle workflow and what they want to optimize.\n","thinkingSignature":"c42b7e3529f8765b379166a0b19bf14163aec491bfe92d975dd95493ab0bc794"},{"type":"text","text":"\n\nGot it. So you have:\n- **Baseline**: ~2.65 BPB (10 min on 2xT4)\n- **Target**: 0.5-0.6 BPB\n- **Untried**: extended training, TTT on T4, PPM hybrid\n\nThat's a 4-5x gap to close. Before we set up autoresearch, I need to understand your iteration cycle.\n\n**Third question: How long does one Kaggle training run take to complete and give you results?**\n\nSpecifically:\n- Time from pushing to Kaggle → results available\n- Can you run multiple experiments in parallel?\n- What's your bottleneck: GPU time, iteration speed, or something else?"}],"api":"anthropic-messages","provider":"minimax","model":"MiniMax-M2.7","usage":{"input":168,"output":373,"cacheRead":41984,"cacheWrite":0,"totalTokens":42525,"cost":{"input":0.0000504,"output":0.0004476,"cacheRead":0.0025190399999999997,"cacheWrite":0,"total":0.0030170399999999995}},"stopReason":"stop","timestamp":1777140545841,"responseId":"063c36446090d380b7ac30f794004154"}}
{"type":"message","id":"6d02e152","parentId":"a73c335e","timestamp":"2026-04-25T18:11:12.117Z","message":{"role":"user","content":[{"type":"text","text":"its upon you how long you want the training run to be. i have only done mostly 10 min runs, and few 20 min runs. note, that in past experience, doing things parallely didnt go well. also, you have to keep monitoring the runs, so that you get to know instantly when you get any results or error. mostly, our training pipeline is decent in terms of reliability, at least in my experience till now."}],"timestamp":1777140672113}}
{"type":"message","id":"f33f39a6","parentId":"6d02e152","timestamp":"2026-04-25T18:11:34.678Z","message":{"role":"assistant","content":[{"type":"thinking","thinking":"Good info. So:\n- No parallel runs (Kaggle doesn't handle it well)\n- User has to monitor - they get results directly\n- Runs are synchronous - push, wait, get results\n\nSo the iteration loop is:\n1. Prepare experiment config\n2. Push to Kaggle\n3. Wait for completion (monitoring manually)\n4. Collect results\n5. Analyze\n6. Plan next iteration\n7. Repeat\n\nFor autoresearch, the loop is normally automated, but here the human is the bottleneck. The autoresearch setup needs to accommodate this.\n\nGiven:\n- 30 hrs/week GPU quota\n- 12 hr max session\n- Sequential runs only\n- Manual monitoring\n\nSo the key question for autoresearch: should we optimize for BEST BPB within each run, or should we set up a pipeline that continues across sessions? Because 30 hrs/week = ~1800 mins/week. If each run is 10 min, that's 180 runs/week. If each run is 60 min, that's 30 runs/week.\n\nFor the goal of sub-1 BPB, probably need longer runs. But the question is: how do we structure the experiment loop?\n\nLet me think about what the user wants:\n1. Extended training (scale from 10min to much longer)\n2. Add TTT\n3. Add PPM hybrid\n\nThese are 3 big bets. Each one could potentially make a huge difference. The question is the ORDER and the EXPERIMENTS needed.\n\nWith Kaggle constraints:\n- 2xT4 = slower than 8xH100 (what other competitors use)\n- 10 min on H100 = maybe 30 min on 2xT4 for same compute\n- 12 hr max session\n\nSo if they want to beat H100 competitors (SOTA is 1.08 BPB), they need:\n1. Much longer training to close the gap\n2. TTT for additional boost\n3. PPM hybrid for the final push\n \nNow I see the critical constraint: we can't train directly on Kaggle due to the 30-hour weekly limit. The user mentioned using Kaggle for training with access to extended GPU time, but that's a maximum cap, not a guarantee. With just 30 hours per week, we'd hit limits fast. So the real strategy needs to balance training duration against quota consumption—either run fewer longer experiments or spread shorter runs across multiple days.\n\nThe key insight is that the 12-hour session window is actually feasible for extended training on Kaggle. But I need to understand the iteration pattern first: are they pushing code and waiting for results (synchronous), or running something in the background (asynchronous)?\n","thinkingSignature":"6fdf439a3a33ad5d3222b678f4098b83b0660eac06555db12c6d037d16ba2ccc"},{"type":"text","text":"\n\nGot it. Sequential runs, manual monitoring, decent reliability.\n\n**Fourth question: What's your iteration cycle? Do you push code → wait for results → check logs, or is there background processing?**\n\nBecause if it's synchronous (push, wait, get results), then autoresearch needs to know: does each run represent one experiment in the loop, or do you run longer sessions where multiple experiments happen inside one run?"}],"api":"anthropic-messages","provider":"minimax","model":"MiniMax-M2.7","usage":{"input":282,"output":633,"cacheRead":42112,"cacheWrite":0,"totalTokens":43027,"cost":{"input":0.0000846,"output":0.0007595999999999999,"cacheRead":0.0025267199999999997,"cacheWrite":0,"total":0.0033709199999999995}},"stopReason":"stop","timestamp":1777140672118,"responseId":"063c36c2c381a52085ba07b4727c25b3"}}
{"type":"message","id":"98bafc84","parentId":"f33f39a6","timestamp":"2026-04-25T18:12:05.235Z","message":{"role":"user","content":[{"type":"text","text":"i dont know what to answer here honestly."}],"timestamp":1777140725230}}
{"type":"message","id":"b70f5128","parentId":"98bafc84","timestamp":"2026-04-25T18:12:15.231Z","message":{"role":"assistant","content":[{"type":"thinking","thinking":"The user is confused about my question. Let me rephrase more simply.\n\nIn the current workflow:\n1. They push code to Kaggle\n2. Wait for results\n3. Check logs\n\nThe question is: when you want to test a new idea (e.g., \"try TTT with LR=0.01\"), do you:\n- A) Start a new Kaggle run for that specific idea?\n- B) Modify code and push, wait for full training, then evaluate at the end?\n\nLet me reframe more concretely.\n","thinkingSignature":"fbe9cbd6e966360adae03dd2d32d2aa6749942ff45c4910c5cc1dcc93af6eabc"},{"type":"text","text":"\n\nLet me simplify. Here's how I think your workflow works:\n\n1. You modify `train_kaggle.py` or env vars\n2. Push to Kaggle\n3. Training runs (10min, 20min, etc.)\n4. You get a `val_bpb` result at the end\n\n**Is that correct?** \n\nIf yes, then the \"experiment unit\" is one Kaggle run = one `val_bpb` measurement.\n\nAnd your iteration loop is:\n```\nCode change → Push → Wait → Check val_bpb → Next idea\n```\n\n**Is this how you currently operate?**"}],"api":"anthropic-messages","provider":"minimax","model":"MiniMax-M2.7","usage":{"input":127,"output":236,"cacheRead":42368,"cacheWrite":0,"totalTokens":42731,"cost":{"input":0.0000381,"output":0.0002832,"cacheRead":0.00254208,"cacheWrite":0,"total":0.00286338}},"stopReason":"stop","timestamp":1777140725236,"responseId":"063c36f7d760c7fc71762edf7400bb81"}}
