{"type":"message","id":"1cad8e73","parentId":"cd34cc5e","timestamp":"2026-04-27T11:22:54.775Z","message":{"role":"toolResult","toolCallId":"call_function_akzudkfnljd0_1","toolName":"understand_image","content":[{"type":"text","text":"Based on the information visible in your terminal and the environment metrics:\n\n### **What processes are running?**\nBased on the `ps aux` command you ran, only one relevant process is currently listed:\n*   **JupyterLab Server:** The process running `/opt/jupyter/envs/main/bin/jupyter-lab`. This is the background process that powers the development environment you are currently using.\n\n### **Is training still active?**\n**No, training does not appear to be active.** Here is the evidence from the screenshot:\n\n1.  **Process List:** The `ps aux | grep -E 'python|torch'` command only returned the Jupyter process. If a training script were running, you would see another line for a command like `python train.py` or similar.\n2.  **GPU Utilization:** At the top center of the screen, the GPU monitor (labeled **T4 UTIL**) shows no green bars, indicating **0% utilization**. If a model were training, you would see activity there.\n3.  **Terminal State:** Your terminal prompt is active and waiting for input (`.../parameter-golf $`). If training were running in the foreground of this terminal window, you would see the training logs scrolling, and you wouldn't have a command prompt.\n4.  **Log File:** While your `tail` command showed some configuration parameters (like `VOCAB_SIZE: 1024`), these are just the last lines recorded in the log file from a previous run; it does not indicate current activity."}],"details":{"server":"MiniMax","tool":"understand_image","structuredContent":{"type":"text","text":"Based on the information visible in your terminal and the environment metrics:\n\n### **What processes are running?**\nBased on the `ps aux` command you ran, only one relevant process is currently listed:\n*   **JupyterLab Server:** The process running `/opt/jupyter/envs/main/bin/jupyter-lab`. This is the background process that powers the development environment you are currently using.\n\n### **Is training still active?**\n**No, training does not appear to be active.** Here is the evidence from the screenshot:\n\n1.  **Process List:** The `ps aux | grep -E 'python|torch'` command only returned the Jupyter process. If a training script were running, you would see another line for a command like `python train.py` or similar.\n2.  **GPU Utilization:** At the top center of the screen, the GPU monitor (labeled **T4 UTIL**) shows no green bars, indicating **0% utilization**. If a model were training, you would see activity there.\n3.  **Terminal State:** Your terminal prompt is active and waiting for input (`.../parameter-golf $`). If training were running in the foreground of this terminal window, you would see the training logs scrolling, and you wouldn't have a command prompt.\n4.  **Log File:** While your `tail` command showed some configuration parameters (like `VOCAB_SIZE: 1024`), these are just the last lines recorded in the log file from a previous run; it does not indicate current activity.","annotations":null,"_meta":null},"isError":false},"isError":false,"timestamp":1777288974775}}
{"type":"message","id":"1ee76852","parentId":"1cad8e73","timestamp":"2026-04-27T11:23:02.288Z","message":{"role":"assistant","content":[{"type":"thinking","thinking":"Training is NOT running - the GPU shows 0% utilization. The training script probably completed or errored out. Let me check the log file more carefully to see what happened.","thinkingSignature":"5e3bd45b5b281f927a367506a09a4263a1d589448c43950f718fb7edb1ddb29e"},{"type":"text","text":"Training not running - GPU at 0%. Let me check what happened:\n"},{"type":"toolCall","id":"call_function_ocmq0o9zbu8i_1","name":"bash","arguments":{"command":"agent-browser type \"\" \"tail -50 ~/parameter-golf/logs/*.log 2>/dev/null | tail -60\" 2>&1 && agent-browser press Enter 2>&1 && sleep 3 && agent-browser screenshot 2>&1"}}],"api":"anthropic-messages","provider":"minimax","model":"MiniMax-M2.7","usage":{"input":51258,"output":127,"cacheRead":9348,"cacheWrite":0,"totalTokens":60733,"cost":{"input":0.0153774,"output":0.0001524,"cacheRead":0.0005608799999999999,"cacheWrite":0,"total":0.01609068}},"stopReason":"toolUse","timestamp":1777288974783,"responseId":"063e7a119631892bd8b1caf00546b856"}}
{"type":"message","id":"6ab2543d","parentId":"1ee76852","timestamp":"2026-04-27T11:23:06.090Z","message":{"role":"toolResult","toolCallId":"call_function_ocmq0o9zbu8i_1","toolName":"bash","content":[{"type":"text","text":"✓ Done\n✓ Done\n✓ Screenshot saved to /Users/dhruv2mars/.agent-browser/tmp/screenshots/screenshot-1777288986082.png\n"}],"isError":false,"timestamp":1777288986090}}
{"type":"message","id":"ef09eb4a","parentId":"6ab2543d","timestamp":"2026-04-27T11:23:10.110Z","message":{"role":"assistant","content":[{"type":"thinking","thinking":"Let me see the output.","thinkingSignature":"428cf233543f06169b8f0feb8c93afd107b760ae86c43c810667cdc5f19ee5f7"},{"type":"toolCall","id":"call_function_p4maaxfuo9yr_1","name":"understand_image","arguments":{"prompt":"What does the log show? Any errors or final results?","image_url":"/Users/dhruv2mars/.agent-browser/tmp/screenshots/screenshot-1777288986082.png"}}],"api":"anthropic-messages","provider":"minimax","model":"MiniMax-M2.7","usage":{"input":51434,"output":75,"cacheRead":9348,"cacheWrite":0,"totalTokens":60857,"cost":{"input":0.0154302,"output":0.00008999999999999999,"cacheRead":0.0005608799999999999,"cacheWrite":0,"total":0.01608108}},"stopReason":"toolUse","timestamp":1777288986094,"responseId":"063e7a1a4998619bba51982e3d5c41b7"}}
{"type":"message","id":"08fa2769","parentId":"ef09eb4a","timestamp":"2026-04-27T11:23:20.912Z","message":{"role":"toolResult","toolCallId":"call_function_p4maaxfuo9yr_1","toolName":"understand_image","content":[{"type":"text","text":"The log shown in the terminal displays the **initialization and configuration parameters** for a machine learning training session.\n\nSpecifically:\n*   **Errors:** There are **no errors** visible in the log.\n*   **Final Results:** There are **no final results** shown (such as training loss, accuracy, or a completion timestamp).\n\nThe output is a summary header for a project called \"Parameter Golf - Lightning AI Training,\" listing parameters such as:\n*   **RUN_ID:** Lightning-20260427-105032\n*   **START_TIME:** Mon Apr 27 10:50:32 UTC 2026\n*   **ITERATIONS:** 25000 (target)\n*   **Model Architecture:** 11 layers, 512 dimensions, 8 heads.\n*   **Other specs:** Sequence length (512), Vocab size (1024), etc.\n\nIt appears the user ran a `tail` command on the log files to view the setup information, but the actual training progress or final outcome is not contained in this specific view."}],"details":{"server":"MiniMax","tool":"understand_image","structuredContent":{"type":"text","text":"The log shown in the terminal displays the **initialization and configuration parameters** for a machine learning training session.\n\nSpecifically:\n*   **Errors:** There are **no errors** visible in the log.\n*   **Final Results:** There are **no final results** shown (such as training loss, accuracy, or a completion timestamp).\n\nThe output is a summary header for a project called \"Parameter Golf - Lightning AI Training,\" listing parameters such as:\n*   **RUN_ID:** Lightning-20260427-105032\n*   **START_TIME:** Mon Apr 27 10:50:32 UTC 2026\n*   **ITERATIONS:** 25000 (target)\n*   **Model Architecture:** 11 layers, 512 dimensions, 8 heads.\n*   **Other specs:** Sequence length (512), Vocab size (1024), etc.\n\nIt appears the user ran a `tail` command on the log files to view the setup information, but the actual training progress or final outcome is not contained in this specific view.","annotations":null,"_meta":null},"isError":false},"isError":false,"timestamp":1777289000911}}
{"type":"message","id":"2f82bb52","parentId":"08fa2769","timestamp":"2026-04-27T11:23:30.621Z","message":{"role":"assistant","content":[{"type":"thinking","thinking":"The log shows only the initialization parameters but no training progress. This means either:\n1. The training hasn't started yet\n2. The training ran but didn't log to this file\n3. The file is empty or hasn't been created\n\nLet me check if there's any other log file or check the status differently.","thinkingSignature":"5bf55d8ea79c324d4c50d0dbb930e2e310e1acb7ecb05c902f2903a43a8851bd"},{"type":"toolCall","id":"call_function_wa3r2to9v3ei_1","name":"bash","arguments":{"command":"agent-browser type \"\" \"ls -la ~/parameter-golf/logs/ 2>/dev/null && cat ~/parameter-golf/logs/run_lightning*.log 2>/dev/null | tail -100\" 2>&1 && agent-browser press Enter 2>&1 && sleep 3 && agent-browser screenshot 2>&1"}}],"api":"anthropic-messages","provider":"minimax","model":"MiniMax-M2.7","usage":{"input":51735,"output":155,"cacheRead":9348,"cacheWrite":0,"totalTokens":61238,"cost":{"input":0.0155205,"output":0.000186,"cacheRead":0.0005608799999999999,"cacheWrite":0,"total":0.016267379999999998}},"stopReason":"toolUse","timestamp":1777289000919,"responseId":"063e7a2dde4425e020f41f3329e1623e"}}
{"type":"message","id":"28569c59","parentId":"2f82bb52","timestamp":"2026-04-27T11:23:34.477Z","message":{"role":"toolResult","toolCallId":"call_function_wa3r2to9v3ei_1","toolName":"bash","content":[{"type":"text","text":"✓ Done\n✓ Done\n✓ Screenshot saved to /Users/dhruv2mars/.agent-browser/tmp/screenshots/screenshot-1777289014466.png\n"}],"isError":false,"timestamp":1777289014477}}
{"type":"message","id":"50a9d8e5","parentId":"28569c59","timestamp":"2026-04-27T11:23:41.955Z","message":{"role":"assistant","content":[{"type":"thinking","thinking":"Let me see the result.","thinkingSignature":"2e3a26af10482055d587db1903a4da4615a9c9f91cc9da4f13a8fda07ee9d3fb"},{"type":"toolCall","id":"call_function_eq1xpxzao2ax_1","name":"understand_image","arguments":{"prompt":"What files are in logs directory? Any errors or output?","image_url":"/Users/dhruv2mars/.agent-browser/tmp/screenshots/screenshot-1777289014466.png"}}],"api":"anthropic-messages","provider":"minimax","model":"MiniMax-M2.7","usage":{"input":51939,"output":75,"cacheRead":9348,"cacheWrite":0,"totalTokens":61362,"cost":{"input":0.015581699999999999,"output":0.00008999999999999999,"cacheRead":0.0005608799999999999,"cacheWrite":0,"total":0.01623258}},"stopReason":"toolUse","timestamp":1777289014481,"responseId":"063e7a3932c274ce424bd314a6975496"}}
{"type":"message","id":"c466c972","parentId":"50a9d8e5","timestamp":"2026-04-27T11:23:50.653Z","message":{"role":"toolResult","toolCallId":"call_function_eq1xpxzao2ax_1","toolName":"understand_image","content":[{"type":"text","text":"Based on the terminal output in the image:\n\n### Files in the `logs` directory:\nThere is one log file:\n*   `lightning-20260427-105032.log`\n\n### Output and Errors:\n*   **Log Output:** The visible content of the log file shows the initialization header for \"Parameter Golf - Lightning AI Training,\" including:\n    *   **RUN_ID:** lightning-20260427-105032\n    *   **START_TIME:** Mon Apr 27 10:50:32 UTC 2026\n    *   **Parameters:** 25,000 iterations, 11L x 512d x 8H model, effective batch size of 8192 tokens, etc.\n*   **Errors:** There is a shell error shown: `zsh: no matches found: /teamspace/studios/this_studio/parameter-golf/logs/run_lightning*.log`. This happened because the command tried to read files starting with `run_lightning`, but the actual file in the directory starts with just `lightning`. There are no training-related errors visible in the log content itself."}],"details":{"server":"MiniMax","tool":"understand_image","structuredContent":{"type":"text","text":"Based on the terminal output in the image:\n\n### Files in the `logs` directory:\nThere is one log file:\n*   `lightning-20260427-105032.log`\n\n### Output and Errors:\n*   **Log Output:** The visible content of the log file shows the initialization header for \"Parameter Golf - Lightning AI Training,\" including:\n    *   **RUN_ID:** lightning-20260427-105032\n    *   **START_TIME:** Mon Apr 27 10:50:32 UTC 2026\n    *   **Parameters:** 25,000 iterations, 11L x 512d x 8H model, effective batch size of 8192 tokens, etc.\n*   **Errors:** There is a shell error shown: `zsh: no matches found: /teamspace/studios/this_studio/parameter-golf/logs/run_lightning*.log`. This happened because the command tried to read files starting with `run_lightning`, but the actual file in the directory starts with just `lightning`. There are no training-related errors visible in the log content itself.","annotations":null,"_meta":null},"isError":false},"isError":false,"timestamp":1777289030653}}
{"type":"message","id":"18381304","parentId":"c466c972","timestamp":"2026-04-27T11:23:57.213Z","message":{"role":"assistant","content":[{"type":"thinking","thinking":"OK so there's a log file `lightning-20260427-105032.log`. The training script started but there's no training output. This means it either:\n1. Exited immediately (error)\n2. Started but not logging\n3. Running in backgroundLet me check the full content of that log file.","thinkingSignature":"7148f3c3b5ec4fbd79b56145028e587d334fb03498fb892a16607edf5d04a861"},{"type":"toolCall","id":"call_function_k3m6t0213wv5_1","name":"bash","arguments":{"command":"agent-browser type \"\" \"cat ~/parameter-golf/logs/lightning-20260427-105032.log | tail -200\" 2>&1 && agent-browser press Enter 2>&1 && sleep 3 && agent-browser screenshot 2>&1"}}],"api":"anthropic-messages","provider":"minimax","model":"MiniMax-M2.7","usage":{"input":52259,"output":142,"cacheRead":9348,"cacheWrite":0,"totalTokens":61749,"cost":{"input":0.0156777,"output":0.0001704,"cacheRead":0.0005608799999999999,"cacheWrite":0,"total":0.01640898}},"stopReason":"toolUse","timestamp":1777289030659,"responseId":"063e7a4955a14371e6e77c00b476356d"}}
{"type":"message","id":"122f5712","parentId":"18381304","timestamp":"2026-04-27T11:24:00.927Z","message":{"role":"toolResult","toolCallId":"call_function_k3m6t0213wv5_1","toolName":"bash","content":[{"type":"text","text":"✓ Done\n✓ Done\n✓ Screenshot saved to /Users/dhruv2mars/.agent-browser/tmp/screenshots/screenshot-1777289040917.png\n"}],"isError":false,"timestamp":1777289040927}}
{"type":"message","id":"4836815f","parentId":"122f5712","timestamp":"2026-04-27T11:24:06.258Z","message":{"role":"assistant","content":[{"type":"thinking","thinking":"Let me see the output.","thinkingSignature":"428cf233543f06169b8f0feb8c93afd107b760ae86c43c810667cdc5f19ee5f7"},{"type":"toolCall","id":"call_function_8eihi8kqajnz_1","name":"understand_image","arguments":{"prompt":"What does the full log show? Any training steps, errors, or final results?","image_url":"/Users/dhruv2mars/.agent-browser/tmp/screenshots/screenshot-1777289040917.png"}}],"api":"anthropic-messages","provider":"minimax","model":"MiniMax-M2.7","usage":{"input":52450,"output":80,"cacheRead":9348,"cacheWrite":0,"totalTokens":61878,"cost":{"input":0.015735,"output":0.000096,"cacheRead":0.0005608799999999999,"cacheWrite":0,"total":0.016391879999999998}},"stopReason":"toolUse","timestamp":1777289040931,"responseId":"063e7a513b629d5730435e9377a28af1"}}
{"type":"message","id":"2f519074","parentId":"4836815f","timestamp":"2026-04-27T11:24:16.991Z","message":{"role":"toolResult","toolCallId":"call_function_8eihi8kqajnz_1","toolName":"understand_image","content":[{"type":"text","text":"Based on the provided screenshot, the log shown in the terminal is only the **initialization/setup header** for a training run.\n\nHere is a breakdown of what the visible log shows:\n\n*   **Training Steps:** **No.** There are no training steps, loss values, or progress indicators visible.\n*   **Errors:** **No significant training errors.** However, there is a shell error (`zsh: no matches found`) just before the log output because a previous command tried to use a wildcard (`*`) to find log files that didn't exist yet in that specific format. The actual log file content shown contains no errors.\n*   **Final Results:** **No.** The training appears to have just started (or the log was captured immediately after start-up).\n*   **What is actually shown:** The log displays the **model configuration and hyperparameters** for the run, including:\n    *   **Run ID:** lightning-20260427-105032\n    *   **Start Time:** Mon Apr 27 10:50:32 UTC 2026\n    *   **Target Iterations:** 25,000\n    *   **Model Architecture:** 11 layers, 512 dimensions, 8 heads.\n    *   **Batch size, sequence length, and vocabulary size.**\n\nThe log stops immediately after the configuration parameters, indicating that no actual training data has been processed or logged yet in this view."}],"details":{"server":"MiniMax","tool":"understand_image","structuredContent":{"type":"text","text":"Based on the provided screenshot, the log shown in the terminal is only the **initialization/setup header** for a training run.\n\nHere is a breakdown of what the visible log shows:\n\n*   **Training Steps:** **No.** There are no training steps, loss values, or progress indicators visible.\n*   **Errors:** **No significant training errors.** However, there is a shell error (`zsh: no matches found`) just before the log output because a previous command tried to use a wildcard (`*`) to find log files that didn't exist yet in that specific format. The actual log file content shown contains no errors.\n*   **Final Results:** **No.** The training appears to have just started (or the log was captured immediately after start-up).\n*   **What is actually shown:** The log displays the **model configuration and hyperparameters** for the run, including:\n    *   **Run ID:** lightning-20260427-105032\n    *   **Start Time:** Mon Apr 27 10:50:32 UTC 2026\n    *   **Target Iterations:** 25,000\n    *   **Model Architecture:** 11 layers, 512 dimensions, 8 heads.\n    *   **Batch size, sequence length, and vocabulary size.**\n\nThe log stops immediately after the configuration parameters, indicating that no actual training data has been processed or logged yet in this view.","annotations":null,"_meta":null},"isError":false},"isError":false,"timestamp":1777289056991}}
{"type":"message","id":"01a99dc9","parentId":"2f519074","timestamp":"2026-04-27T11:24:24.914Z","message":{"role":"assistant","content":[{"type":"thinking","thinking":"The log only shows the initialization header. This is suspicious - either:\n1. The training started but hasn't logged anything yet\n2. The training script has an error and exited\n3. The training is running but logging somewhere else\n\nLet me check if there are any Python processes running or if there's any error output.","thinkingSignature":"789cb12d95353ca33d923c3fc1d12ca85f73a51c3e2c9984dcf6f196dec2e5f3"},{"type":"text","text":"Training seems to have started but no progress. Let me check for errors:\n"},{"type":"toolCall","id":"call_function_iz6vgxl14vvh_1","name":"bash","arguments":{"command":"agent-browser type \"\" \"python3 ~/parameter-golf/train_kaggle.py 2>&1 | head -50 &\" 2>&1 && agent-browser press Enter 2>&1 && sleep 5 && agent-browser screenshot 2>&1"}}],"api":"anthropic-messages","provider":"minimax","model":"MiniMax-M2.7","usage":{"input":52831,"output":154,"cacheRead":9348,"cacheWrite":0,"totalTokens":62333,"cost":{"input":0.0158493,"output":0.0001848,"cacheRead":0.0005608799999999999,"cacheWrite":0,"total":0.01659498}},"stopReason":"toolUse","timestamp":1777289056999,"responseId":"063e7a639109a26b2e6f85454dadc755"}}
{"type":"message","id":"1f2f0af8","parentId":"01a99dc9","timestamp":"2026-04-27T11:24:30.695Z","message":{"role":"toolResult","toolCallId":"call_function_iz6vgxl14vvh_1","toolName":"bash","content":[{"type":"text","text":"✓ Done\n✓ Done\n✓ Screenshot saved to /Users/dhruv2mars/.agent-browser/tmp/screenshots/screenshot-1777289070686.png\n"}],"isError":false,"timestamp":1777289070695}}
{"type":"message","id":"9bf7f8cd","parentId":"1f2f0af8","timestamp":"2026-04-27T11:24:36.354Z","message":{"role":"assistant","content":[{"type":"thinking","thinking":"Let me see what's happening.","thinkingSignature":"5c89fceb08022189b7659eacd1ec426e0be6b6003e270320b4685f0e5a2c6f0f"},{"type":"toolCall","id":"call_function_oifmmmn6lt01_1","name":"understand_image","arguments":{"prompt":"Is training running now? Any output?","image_url":"/Users/dhruv2mars/.agent-browser/tmp/screenshots/screenshot-1777289070686.png"}}],"api":"anthropic-messages","provider":"minimax","model":"MiniMax-M2.7","usage":{"input":53034,"output":71,"cacheRead":9348,"cacheWrite":0,"totalTokens":62453,"cost":{"input":0.0159102,"output":0.0000852,"cacheRead":0.0005608799999999999,"cacheWrite":0,"total":0.01655628}},"stopReason":"toolUse","timestamp":1777289070699,"responseId":"063e7a71925685771eebf48520e6c84e"}}
