{"type":"message","id":"5ed1eb96","parentId":"add61737","timestamp":"2026-04-25T18:31:48.193Z","message":{"role":"assistant","content":[{"type":"thinking","thinking":"Now I have full context. Let me check the status of the 30-min baseline run and also check for PPM implementation.\n\nKey observations:\n1. TTT exists but disabled by default (TTT_ENABLED=0)\n2. PPM - I haven't seen any PPM implementation in the code\n3. The model uses depth recurrence, RMSNorm, learned residuals, QK-gain, etc.\n4. GPTQ quantization with int6/int8 packing\n\nLet me check for PPM in the code and also check the run status.","thinkingSignature":"208888ff24aa07af7e81f12e3032d78cd076fba09a1add9e24ce3d259f038b89"},{"type":"toolCall","id":"call_function_ph0mhv8xfie2_1","name":"bash","arguments":{"command":"grep -n \"PPM\\|ppm\\|prob\\|predictive\\|loss\\|compression\" /Users/dhruv2mars/dev/github/parameter-golf/train_kaggle.py | head -20"}},{"type":"toolCall","id":"call_function_ph0mhv8xfie2_2","name":"bash","arguments":{"command":"cd /Users/dhruv2mars/dev/github/parameter-golf && python3 experiments/pg_autoresearch.py status --ref \"dhruv2mars/pg-auto-30min-baseline-20260426-41891\" 2>&1"}}],"api":"anthropic-messages","provider":"minimax","model":"MiniMax-M2.7","usage":{"input":1860,"output":238,"cacheRead":29728,"cacheWrite":0,"totalTokens":31826,"cost":{"input":0.000558,"output":0.0002856,"cacheRead":0.00178368,"cacheWrite":0,"total":0.00262728}},"stopReason":"toolUse","timestamp":1777141905218,"responseId":"063c3b919bb999ef59cc79bfe1b41a19"}}
{"type":"message","id":"638461a4","parentId":"5ed1eb96","timestamp":"2026-04-25T18:31:50.181Z","message":{"role":"toolResult","toolCallId":"call_function_ph0mhv8xfie2_1","toolName":"bash","content":[{"type":"text","text":"81:    val_loss_every = int(os.environ.get(\"VAL_LOSS_EVERY\", 50))\n245:def compute_val_bpb(val_loss, val_tokens, base_bytes_lut, device):\n246:    \"\"\"Compute validation bits-per-byte from cross-entropy loss.\"\"\"\n247:    bits_per_token = val_loss / math.log(2)\n624:                loss = model(x, y)\n626:            if not torch.isfinite(loss):\n627:                log_fn(f\"[TTT] Non-finite loss at epoch {epoch}, chunk {start}\")\n631:            loss.backward()\n638:        val_loss_sum = 0.0\n647:                    loss = model(x, y)\n648:                val_loss_sum += loss.item() * x.numel()\n652:            val_loss_sum / val_token_count, val_tokens[:val_token_count],\n845:        if step % args.val_loss_every == 0 and step > 0 and step != last_val_step:\n854:                val_loss_sum = 0.0\n863:                            loss = raw_model(x, y)\n864:                        val_loss_sum += loss.item() * x.numel()\n867:                val_loss = val_loss_sum / val_token_count\n868:                val_bpb = compute_val_bpb(val_loss, val_tokens[:val_token_count],\n883:                    \"val_loss\": f\"{val_loss:.4f}\",\n905:                loss = raw_model(x, y)\n"}],"isError":false,"timestamp":1777141910181}}
{"type":"message","id":"cfa22671","parentId":"638461a4","timestamp":"2026-04-25T18:31:50.181Z","message":{"role":"toolResult","toolCallId":"call_function_ph0mhv8xfie2_2","toolName":"bash","content":[{"type":"text","text":"KernelWorkerStatus.RUNNING\n"}],"isError":false,"timestamp":1777141910181}}
{"type":"message","id":"27ec8b83","parentId":"cfa22671","timestamp":"2026-04-25T18:31:52.492Z","message":{"role":"assistant","content":[{"type":"thinking","thinking":"OK so PPM is NOT implemented yet in the codebase. The user said we NEED it, but it's not there. Let me search for any PPM-related code or references.\n\nAlso the 30-min run is still running.\n\nLet me search the records for any PPM references.","thinkingSignature":"4cb68852252cb79c4242ea0cccda19a97c2ccc69320e3912ea197a4db86a907c"},{"type":"toolCall","id":"call_function_ubvhim650nip_1","name":"bash","arguments":{"command":"grep -rhi \"ppm\\|predictive\\|predict\\|loss.predictor\\|byte.predictor\" /Users/dhruv2mars/dev/github/parameter-golf/records/ 2>/dev/null | head -20"}},{"type":"toolCall","id":"call_function_ubvhim650nip_2","name":"bash","arguments":{"command":"grep -rhi \"ppm\\|predictive\" /Users/dhruv2mars/dev/github/parameter-golf/*.md 2>/dev/null | head -20"}}],"api":"anthropic-messages","provider":"minimax","model":"MiniMax-M2.7","usage":{"input":464,"output":176,"cacheRead":31584,"cacheWrite":0,"totalTokens":32224,"cost":{"input":0.0001392,"output":0.00021119999999999998,"cacheRead":0.0018950399999999997,"cacheWrite":0,"total":0.0022454399999999996}},"stopReason":"toolUse","timestamp":1777141910182,"responseId":"063c3b96fab5c3401346a4d1739c5839"}}
{"type":"message","id":"704a9c20","parentId":"27ec8b83","timestamp":"2026-04-25T18:31:52.972Z","message":{"role":"toolResult","toolCallId":"call_function_ubvhim650nip_1","toolName":"bash","content":[{"type":"text","text":"            # logits[:, j, :] predicts the token AFTER position j in the input.\n            # So logits[:, -stride:, :] predicts tokens at input positions\n            # logits[:, j, :] predicts the token AFTER position j in the input.\n            # So logits[:, -stride:, :] predicts tokens at input positions\n            # logits[:, j, :] predicts the token AFTER position j in the input.\n            # So logits[:, -stride:, :] predicts tokens at input positions\n            # logits[:, j, :] predicts the token AFTER position j in the input.\n            # So logits[:, -stride:, :] predicts tokens at input positions\nBinary file /Users/dhruv2mars/dev/github/parameter-golf/records/track_10min_16mb/REDACTED/fineweb_8192_bpe.model matches\n        # Multi-token prediction auxiliary loss (training only)\n        # Multi-token prediction auxiliary loss (training only)\nTversky showed genuine quality benefit (~-0.017 bpb) at dev scale with 128 features and fp16 prototype storage. However, subsequent investigation at full convergence (12L 768d) and with corrected prototype storage showed all Tversky variants within noise of the linear baseline. Additional experiments included full ternary prototypes, shared feature pools across layers, no-features mode, logit-head application, and different membership functions (sigmoid, poly, tanh). A synthetic-data notebook confirmed that Tversky's asymmetric similarity only helps on tasks with genuine directional feature relationships (hypernym/hyponym, cause/effect); next-token prediction on FineWeb web text is not such a task.\n### MTP (Multi-Token Prediction)\nAll variants within 0.001–0.002 bpb of baseline — pure noise. Confirmed by synthetic-data analysis that Tversky's asymmetric similarity only helps on tasks with directional feature relationships, which next-token prediction on web text is not.\n        # Multi-token prediction auxiliary loss (training only)\n        # Multi-token prediction auxiliary loss (training only)\n## Compliance (Track A — Fixed Predictor)\n            # logits[:, j, :] predicts the token AFTER position j in the input.\n            # So logits[:, -stride:, :] predicts tokens at input positions\nAll 2D weight matrices are fake-quantized to int6 (\\[-31, 31]) during every forward pass via Straight-Through Estimator — the forward pass sees quantized weights while gradients flow through the rounding operation as if it were identity. The model learns weight configurations that are inherently robust to post-training quantization. The tied embedding matrix is stored as fp16 passthrough (not quantized), since it serves double duty for both input embeddings and output predictions where errors compound in both directions.\n"}],"isError":false,"timestamp":1777141912972}}
{"type":"message","id":"20913621","parentId":"704a9c20","timestamp":"2026-04-25T18:31:52.972Z","message":{"role":"toolResult","toolCallId":"call_function_ubvhim650nip_2","toolName":"bash","content":[{"type":"text","text":"- Add PPM (Prediction by Partial Match) for byte-level patterns\n4. Add PPM integration for hybrid approach\n"}],"isError":false,"timestamp":1777141912972}}
{"type":"message","id":"f7265585","parentId":"20913621","timestamp":"2026-04-25T18:31:54.578Z","message":{"role":"assistant","content":[{"type":"thinking","thinking":"No PPM implemented yet in train_kaggle.py. Need to research what PPM means in this context. Let me check PROGRESS.md for more details about what PPM was planned to be.","thinkingSignature":"3d4186be70e435356d6432cf1e87ff75b3f9956393c9b3fcf70c8e0edff7808a"},{"type":"toolCall","id":"call_function_cim48ctw4ma0_1","name":"bash","arguments":{"command":"cd /Users/dhruv2mars/dev/github/parameter-golf && python3 experiments/pg_autoresearch.py status --ref \"dhruv2mars/pg-auto-30min-baseline-20260426-41891\" 2>&1"}},{"type":"toolCall","id":"call_function_cim48ctw4ma0_2","name":"read","arguments":{"limit":100,"path":"/Users/dhruv2mars/dev/github/parameter-golf/PROGRESS.md"}}],"api":"anthropic-messages","provider":"minimax","model":"MiniMax-M2.7","usage":{"input":760,"output":158,"cacheRead":32032,"cacheWrite":0,"totalTokens":32950,"cost":{"input":0.00022799999999999999,"output":0.0001896,"cacheRead":0.00192192,"cacheWrite":0,"total":0.00233952}},"stopReason":"toolUse","timestamp":1777141912973,"responseId":"063c3b99613f2811b396a017c5ee3863"}}
{"type":"message","id":"acd61120","parentId":"f7265585","timestamp":"2026-04-25T18:31:55.718Z","message":{"role":"toolResult","toolCallId":"call_function_cim48ctw4ma0_1","toolName":"bash","content":[{"type":"text","text":"KernelWorkerStatus.RUNNING\n"}],"isError":false,"timestamp":1777141915718}}
{"type":"message","id":"2deb4fce","parentId":"acd61120","timestamp":"2026-04-25T18:31:55.719Z","message":{"role":"toolResult","toolCallId":"call_function_cim48ctw4ma0_2","toolName":"read","content":[{"type":"text","text":"# Parameter Golf Progress\n\n## Goal\n\nTrain a language model achieving sub-1 BPB on 2xT4 GPUs with extended training.\nUse incremental 10-minute validation cycles for hill climbing toward the target.\n\n## Constraints\n\n- **Hardware:** 2x Tesla T4 (16GB each)\n- **Artifact:** Under 16,000,000 bytes\n- **Training:** 30 hours/week quota, 12 hours per session\n- **Strategy:** Incremental 10-min runs → validate → improve → repeat\n\n## Architecture (Proven SOTA Config)\n\n```\n- Model: 11L x 512d x 8H / 4KV, tied embeddings\n- Tokenizer: SP8192 (SentencePiece 8K)\n- Depth Recurrence: layers 3-5, loop 2x, activates at 35% of training\n- QK-Gain: 5.25 (learnable per-head scaling)\n- MLP: 4x dim, squared LeakyReLU\n- RoPE: 16 dims, base 10000\n- Logit Softcap: 30.0\n```\n\n## Training Pipeline (Stable)\n\n### Features\n- Checkpointing every 5 minutes with resume capability\n- NaN/Inf detection with graceful recovery\n- Signal handling for clean shutdown\n- 10-minute validation cycles\n- EMA model averaging\n\n### Hyperparameters\n```\nIterations: 2500 (quick) / 50000+ (extended)\nEffective Batch: 32K tokens (8K x 4 accum)\nMatrix LR: 0.001 (AdamW)\nWeight Decay: 0.095\nEMA: 0.9965\nWarmdown: 72% of training\n```\n\n## Current Status\n\n### Phase 1: Stability (COMPLETED)\n- Rewrote train_kaggle.py from scratch\n- Removed dead code (MuonEqR, dead compression functions)\n- Fixed TTT implementation (was calling model twice)\n- Added checkpointing with resume\n- Added signal handling for graceful shutdown\n- Added NaN/Inf detection\n\n### Phase 2: Baseline (IN PROGRESS)\n- Run 10-min baseline to establish current BPB\n- Expected: ~2.3-2.5 BPB with 2500 steps\n\n### Phase 3: Hybrid Architecture (PENDING)\n- Add PPM (Prediction by Partial Match) for byte-level patterns\n- Add adaptive cache for document repetition\n- Target: ~0.1-0.15 BPB improvement\n\n### Phase 4: Extended Training (PENDING)\n- Scale to 50K-100K steps with extended sessions\n- Target: ~1.4-1.6 BPB (neural only)\n- With hybrid: sub-1 achievable\n\n## Key Files\n\n- `train_kaggle.py`: Clean, stable training pipeline\n- `run_train.sh`: Runner with all hyperparameters\n- `checkpoints/`: Saved states for resume\n- `logs/`: Training logs\n\n## Next Steps\n\n1. Run 10-min baseline on Kaggle\n2. Verify BPB is reasonable (~2.3-2.5)\n3. Begin incremental optimization experiments\n4. Add PPM integration for hybrid approach"}],"isError":false,"timestamp":1777141915718}}
{"type":"message","id":"f151a347","parentId":"2deb4fce","timestamp":"2026-04-25T18:31:57.610Z","message":{"role":"assistant","content":[{"type":"thinking","thinking":"Good. So PPM is planned but not yet implemented. Let me check the Kaggle run status and wait for results. While waiting, I can start drafting the autoresearch setup.\n\nThe run is still RUNNING. Let me check again.","thinkingSignature":"3261bf15b1173fa385f22ee681c5cb0e4737a025ea40279853e0d7cbc0ad98f3"},{"type":"toolCall","id":"call_function_y0lnvdk5cm5n_1","name":"bash","arguments":{"command":"cd /Users/dhruv2mars/dev/github/parameter-golf && python3 experiments/pg_autoresearch.py status --ref \"dhruv2mars/pg-auto-30min-baseline-20260426-41891\" 2>&1 && echo \"---\" && sleep 30 && python3 experiments/pg_autoresearch.py status --ref \"dhruv2mars/pg-auto-30min-baseline-20260426-41891\" 2>&1"}}],"api":"anthropic-messages","provider":"minimax","model":"MiniMax-M2.7","usage":{"input":834,"output":171,"cacheRead":32768,"cacheWrite":0,"totalTokens":33773,"cost":{"input":0.0002502,"output":0.0002052,"cacheRead":0.00196608,"cacheWrite":0,"total":0.0024214799999999997}},"stopReason":"toolUse","timestamp":1777141915720,"responseId":"063c3b9b92657a281fd04aeebd678173"}}
{"type":"message","id":"bf36bd60","parentId":"f151a347","timestamp":"2026-04-25T18:32:31.512Z","message":{"role":"toolResult","toolCallId":"call_function_y0lnvdk5cm5n_1","toolName":"bash","content":[{"type":"text","text":"KernelWorkerStatus.RUNNING\n---\nKernelWorkerStatus.RUNNING\n"}],"isError":false,"timestamp":1777141951512}}
{"type":"message","id":"5bb9c5a2","parentId":"bf36bd60","timestamp":"2026-04-25T18:32:37.216Z","message":{"role":"assistant","content":[{"type":"thinking","thinking":"Still running. Let me move on to Phase 2 and 3 while waiting. I'll:1. Audit the current code\n2. Design the search space\n3. Write autoresearch.md and autoresearch.sh\n\nThen I'll check on the 30-min run later.","thinkingSignature":"e707fe335e06864fb4100eb26fb9781cb09bd16a788ba5653b9f3219a5e1869e"},{"type":"text","text":"\n\n30-min run still going. While waiting, let me do **Phase 2: Analysis**.\n\n## Phase 2: Code Audit\n\n**Current Status:**\n\n| Component | Status | Notes |\n|-----------|--------|-------|\n| Architecture | ✅ Good | 11L x 512d, tied embeddings, depth recurrence |\n| TTT | ⚠️ Implemented but UNTESTED | `TTT_ENABLED=0` by default |\n| PPM | ❌ NOT implemented | Only mentioned in PROGRESS.md |\n| Quantization | ✅ Good | GPTQ int6/8 |\n\n**Key Issues:**\n1. TTT never tested on T4 — may have bugs\n2. PPM is just a TODO item — needs design\n3. No hybrid approach yet\n\n**What's working:** Architecture, optimizer, EMA, checkpointing\n\n**What's broken/missing:** TTT integration, PPM integration\n\n**Search space for autoresearch:**\n- Architecture knobs (layers, dims, heads, loop config)\n- Hyperparameters (lr, wd, warmup, warmdown)\n- TTT settings (lr, epochs, warmup_tokens)\n- Quantization settings (clip_sigmas)\n- Depth recurrence timing\n\n**What's NOT in search space yet:** PPM (needs implementation first)\n\nLet me now write the autoresearch config while the 30-min run completes.\n"},{"type":"toolCall","id":"call_function_zcp7514pxjne_1","name":"read","arguments":{"path":"/Users/dhruv2mars/.pi/agent/git/github.com/davebcn87/pi-autoresearch/skills/autoresearch-create/SKILL.md"}}],"api":"anthropic-messages","provider":"minimax","model":"MiniMax-M2.7","usage":{"input":185,"output":383,"cacheRead":33568,"cacheWrite":0,"totalTokens":34136,"cost":{"input":0.0000555,"output":0.0004596,"cacheRead":0.0020140799999999997,"cacheWrite":0,"total":0.00252918}},"stopReason":"toolUse","timestamp":1777141951513,"responseId":"063c3bc2843373bb2e2a1c08fb9e72ea"}}
