{"type":"message","id":"f7fbd4cd","parentId":"25d707c9","timestamp":"2026-04-27T11:36:36.792Z","message":{"role":"toolResult","toolCallId":"call_function_4h3i9jtqtg6c_1","toolName":"understand_image","content":[{"type":"text","text":"Based on the image provided, the exact Python version and its full system path are **not explicitly displayed**.\n\nHowever, we can see several relevant details from the interface:\n\n*   **Python Command:** The terminal shows a command being executed using `python3` via a wrapper script: `load_conda_and_run python3 ~/parameter-golf/train_kaggle.py`.\n*   **Environment Name:** The active environment (likely a Conda environment) is named **`autoresearch/phase1-20260426`**, as seen in both the terminal prompt and the bottom status bar.\n*   **Script Path:** The Python script being run is located at **`~/parameter-golf/train_kaggle.py`**.\n*   **Platform:** The environment is a **Lightning AI Studio**, which typically uses standardized paths like `/home/zeus/miniconda3/envs/...` for managed environments, but the specific path for this environment is not visible in the screenshot.\n\nTo find this information in the actual interface, you would typically run `python3 --version` and `which python3` in the terminal."}],"details":{"server":"MiniMax","tool":"understand_image","structuredContent":{"type":"text","text":"Based on the image provided, the exact Python version and its full system path are **not explicitly displayed**.\n\nHowever, we can see several relevant details from the interface:\n\n*   **Python Command:** The terminal shows a command being executed using `python3` via a wrapper script: `load_conda_and_run python3 ~/parameter-golf/train_kaggle.py`.\n*   **Environment Name:** The active environment (likely a Conda environment) is named **`autoresearch/phase1-20260426`**, as seen in both the terminal prompt and the bottom status bar.\n*   **Script Path:** The Python script being run is located at **`~/parameter-golf/train_kaggle.py`**.\n*   **Platform:** The environment is a **Lightning AI Studio**, which typically uses standardized paths like `/home/zeus/miniconda3/envs/...` for managed environments, but the specific path for this environment is not visible in the screenshot.\n\nTo find this information in the actual interface, you would typically run `python3 --version` and `which python3` in the terminal.","annotations":null,"_meta":null},"isError":false},"isError":false,"timestamp":1777289796792}}
{"type":"message","id":"bcd0f858","parentId":"f7fbd4cd","timestamp":"2026-04-27T11:36:43.015Z","message":{"role":"assistant","content":[{"type":"thinking","thinking":"Let me try to run python directly without the wrapper.","thinkingSignature":"5339546c94c872260047e0251c72c3706231260cbf69b8aed3dfb30c642c15b8"},{"type":"toolCall","id":"call_function_gvuhx50alwez_1","name":"bash","arguments":{"command":"agent-browser type \"\" \"which python3 && python3 --version\" 2>&1 && agent-browser press Enter 2>&1 && sleep 2 && agent-browser screenshot 2>&1"}}],"api":"anthropic-messages","provider":"minimax","model":"MiniMax-M2.7","usage":{"input":58680,"output":75,"cacheRead":9348,"cacheWrite":0,"totalTokens":68103,"cost":{"input":0.017603999999999998,"output":0.00008999999999999999,"cacheRead":0.0005608799999999999,"cacheWrite":0,"total":0.018254879999999998}},"stopReason":"toolUse","timestamp":1777289796801,"responseId":"063e7d47f1c056b2a590f3711c92ce99"}}
{"type":"message","id":"87904fa9","parentId":"bcd0f858","timestamp":"2026-04-27T11:36:45.807Z","message":{"role":"toolResult","toolCallId":"call_function_gvuhx50alwez_1","toolName":"bash","content":[{"type":"text","text":"✓ Done\n✓ Done\n✓ Screenshot saved to /Users/dhruv2mars/.agent-browser/tmp/screenshots/screenshot-1777289805796.png\n"}],"isError":false,"timestamp":1777289805807}}
{"type":"message","id":"464c0fd5","parentId":"87904fa9","timestamp":"2026-04-27T11:36:49.150Z","message":{"role":"assistant","content":[{"type":"thinking","thinking":"Let me check.","thinkingSignature":"155764a1465f1aa31e7510f8cd8266c6638b35b4a37882161cbf92b1741bf4f4"},{"type":"toolCall","id":"call_function_ogqp8c4pi88o_1","name":"understand_image","arguments":{"prompt":"Show the python path and version.","image_url":"/Users/dhruv2mars/.agent-browser/tmp/screenshots/screenshot-1777289805796.png"}}],"api":"anthropic-messages","provider":"minimax","model":"MiniMax-M2.7","usage":{"input":58804,"output":68,"cacheRead":9348,"cacheWrite":0,"totalTokens":68220,"cost":{"input":0.0176412,"output":0.00008159999999999999,"cacheRead":0.0005608799999999999,"cacheWrite":0,"total":0.01828368}},"stopReason":"toolUse","timestamp":1777289805811,"responseId":"063e7d4eddfa9018fd5aafdfade87a7a"}}
{"type":"message","id":"c6cd3a45","parentId":"464c0fd5","timestamp":"2026-04-27T11:37:03.857Z","message":{"role":"toolResult","toolCallId":"call_function_ogqp8c4pi88o_1","toolName":"understand_image","content":[{"type":"text","text":"Based on the image provided, the Python path and version are not explicitly displayed in the current terminal output. However, you can find them by typing the following commands into the terminal shown at the bottom:\n\n1.  **To find the Python path:**\n    ```bash\n    which python3\n    ```\n2.  **To find the Python version:**\n    ```bash\n    python3 --version\n    ```\n\nFrom the terminal history, it can be seen that a script is being executed using a conda environment wrapper:\n`load_conda_and_run python3 ~/parameter-golf/train_kaggle.py`\n\nThis indicates that `python3` is likely the executable from the active Conda environment. The current working directory is `~/parameter-golf`."}],"details":{"server":"MiniMax","tool":"understand_image","structuredContent":{"type":"text","text":"Based on the image provided, the Python path and version are not explicitly displayed in the current terminal output. However, you can find them by typing the following commands into the terminal shown at the bottom:\n\n1.  **To find the Python path:**\n    ```bash\n    which python3\n    ```\n2.  **To find the Python version:**\n    ```bash\n    python3 --version\n    ```\n\nFrom the terminal history, it can be seen that a script is being executed using a conda environment wrapper:\n`load_conda_and_run python3 ~/parameter-golf/train_kaggle.py`\n\nThis indicates that `python3` is likely the executable from the active Conda environment. The current working directory is `~/parameter-golf`.","annotations":null,"_meta":null},"isError":false},"isError":false,"timestamp":1777289823857}}
{"type":"message","id":"6d72131b","parentId":"c6cd3a45","timestamp":"2026-04-27T11:37:10.876Z","message":{"role":"assistant","content":[{"type":"thinking","thinking":"The screenshot isn't showing the command output. Let me try scrolling up or pressing Enter to refresh.","thinkingSignature":"08fc0ed1ed6130ca1847719ff9e9dbe31f61a0a201e90fe62a05ec12b977a15e"},{"type":"toolCall","id":"call_function_hs9d9vxmss6u_1","name":"bash","arguments":{"command":"agent-browser press \"PageUp\" 2>&1 && sleep 1 && agent-browser screenshot 2>&1"}}],"api":"anthropic-messages","provider":"minimax","model":"MiniMax-M2.7","usage":{"input":59038,"output":67,"cacheRead":9348,"cacheWrite":0,"totalTokens":68453,"cost":{"input":0.0177114,"output":0.0000804,"cacheRead":0.0005608799999999999,"cacheWrite":0,"total":0.01835268}},"stopReason":"toolUse","timestamp":1777289823862,"responseId":"063e7d62b7dfcc88c563301ed0b08170"}}
{"type":"message","id":"8dac4310","parentId":"6d72131b","timestamp":"2026-04-27T11:37:12.450Z","message":{"role":"toolResult","toolCallId":"call_function_hs9d9vxmss6u_1","toolName":"bash","content":[{"type":"text","text":"✓ Done\n✓ Screenshot saved to /Users/dhruv2mars/.agent-browser/tmp/screenshots/screenshot-1777289832440.png\n"}],"isError":false,"timestamp":1777289832450}}
{"type":"message","id":"69af43c4","parentId":"8dac4310","timestamp":"2026-04-27T11:37:16.139Z","message":{"role":"assistant","content":[{"type":"thinking","thinking":"Let me check.","thinkingSignature":"155764a1465f1aa31e7510f8cd8266c6638b35b4a37882161cbf92b1741bf4f4"},{"type":"toolCall","id":"call_function_845mldvzib14_1","name":"understand_image","arguments":{"prompt":"Show the python version and path.","image_url":"/Users/dhruv2mars/.agent-browser/tmp/screenshots/screenshot-1777289832440.png"}}],"api":"anthropic-messages","provider":"minimax","model":"MiniMax-M2.7","usage":{"input":59151,"output":68,"cacheRead":9348,"cacheWrite":0,"totalTokens":68567,"cost":{"input":0.0177453,"output":0.00008159999999999999,"cacheRead":0.0005608799999999999,"cacheWrite":0,"total":0.01838778}},"stopReason":"toolUse","timestamp":1777289832454,"responseId":"063e7d6811de2bd9842813c96e8f1d0f"}}
{"type":"message","id":"49c0cf58","parentId":"69af43c4","timestamp":"2026-04-27T11:37:33.850Z","message":{"role":"toolResult","toolCallId":"call_function_845mldvzib14_1","toolName":"understand_image","content":[{"type":"text","text":"Based on the provided screenshot, the specific Python version and its full path are not explicitly displayed. However, you can find this information by typing the following commands in the terminal at the bottom of the screen:\n\n1.  To see the **Python version**, run:\n    `python3 --version`\n2.  To see the **Python path**, run:\n    `which python3`\n\nFrom the current terminal output, it can be seen that:\n*   The script being run is located at `~/parameter-golf/train_kaggle.py`.\n*   The environment appears to be a Lightning AI Studio, which often uses Python 3.10 by default, and your active environment/branch name seems to be `autoresearch/phase1-20260426` (as shown in the bottom-left status bar)."}],"details":{"server":"MiniMax","tool":"understand_image","structuredContent":{"type":"text","text":"Based on the provided screenshot, the specific Python version and its full path are not explicitly displayed. However, you can find this information by typing the following commands in the terminal at the bottom of the screen:\n\n1.  To see the **Python version**, run:\n    `python3 --version`\n2.  To see the **Python path**, run:\n    `which python3`\n\nFrom the current terminal output, it can be seen that:\n*   The script being run is located at `~/parameter-golf/train_kaggle.py`.\n*   The environment appears to be a Lightning AI Studio, which often uses Python 3.10 by default, and your active environment/branch name seems to be `autoresearch/phase1-20260426` (as shown in the bottom-left status bar).","annotations":null,"_meta":null},"isError":false},"isError":false,"timestamp":1777289853850}}
{"type":"message","id":"2d741fd5","parentId":"49c0cf58","timestamp":"2026-04-27T11:37:40.565Z","message":{"role":"assistant","content":[{"type":"thinking","thinking":"Let me try a different approach - scroll to see the output of the previous commands.","thinkingSignature":"11147b82a5f963fb8058684bee9cff697b42cf32c83793e806595ccfe285f21f"},{"type":"toolCall","id":"call_function_9jco8emvclmb_1","name":"bash","arguments":{"command":"agent-browser type \"\" \"python3 -c 'import sys; print(sys.executable, sys.version)'\" 2>&1 && agent-browser press Enter 2>&1 && sleep 3 && agent-browser screenshot 2>&1"}}],"api":"anthropic-messages","provider":"minimax","model":"MiniMax-M2.7","usage":{"input":59398,"output":89,"cacheRead":9348,"cacheWrite":0,"totalTokens":68835,"cost":{"input":0.0178194,"output":0.0001068,"cacheRead":0.0005608799999999999,"cacheWrite":0,"total":0.01848708}},"stopReason":"toolUse","timestamp":1777289853854,"responseId":"063e7d8051cf17b07e4ad4d8212724e7"}}
{"type":"message","id":"71c1252a","parentId":"2d741fd5","timestamp":"2026-04-27T11:37:44.325Z","message":{"role":"toolResult","toolCallId":"call_function_9jco8emvclmb_1","toolName":"bash","content":[{"type":"text","text":"✓ Done\n✓ Done\n✓ Screenshot saved to /Users/dhruv2mars/.agent-browser/tmp/screenshots/screenshot-1777289864315.png\n"}],"isError":false,"timestamp":1777289864325}}
{"type":"message","id":"0b18564c","parentId":"71c1252a","timestamp":"2026-04-27T11:37:48.907Z","message":{"role":"assistant","content":[{"type":"thinking","thinking":"Let me check.","thinkingSignature":"155764a1465f1aa31e7510f8cd8266c6638b35b4a37882161cbf92b1741bf4f4"},{"type":"toolCall","id":"call_function_784ulbn2b2pp_1","name":"understand_image","arguments":{"prompt":"Show the python executable and version.","image_url":"/Users/dhruv2mars/.agent-browser/tmp/screenshots/screenshot-1777289864315.png"}}],"api":"anthropic-messages","provider":"minimax","model":"MiniMax-M2.7","usage":{"input":59536,"output":68,"cacheRead":9348,"cacheWrite":0,"totalTokens":68952,"cost":{"input":0.0178608,"output":0.00008159999999999999,"cacheRead":0.0005608799999999999,"cacheWrite":0,"total":0.01850328}},"stopReason":"toolUse","timestamp":1777289864329,"responseId":"063e7d882c8dcbff8af4146ca32ce19e"}}
{"type":"message","id":"dabff5d3","parentId":"0b18564c","timestamp":"2026-04-27T11:37:57.668Z","message":{"role":"toolResult","toolCallId":"call_function_784ulbn2b2pp_1","toolName":"understand_image","content":[{"type":"text","text":"Based on the terminal output in the image, the Python executable being used is **`python3`**.\n\nThe command visible in the terminal is:\n`load_conda_and_run python3 ~/parameter-golf/train_kaggle.py ...`\n\nThe exact **version** number (e.g., 3.8, 3.10, etc.) is **not explicitly displayed** in the image. However, the command indicates it is running within a Conda environment, likely named `autoresearch/phase1-20260426` as seen in the terminal prompt and the bottom status bar."}],"details":{"server":"MiniMax","tool":"understand_image","structuredContent":{"type":"text","text":"Based on the terminal output in the image, the Python executable being used is **`python3`**.\n\nThe command visible in the terminal is:\n`load_conda_and_run python3 ~/parameter-golf/train_kaggle.py ...`\n\nThe exact **version** number (e.g., 3.8, 3.10, etc.) is **not explicitly displayed** in the image. However, the command indicates it is running within a Conda environment, likely named `autoresearch/phase1-20260426` as seen in the terminal prompt and the bottom status bar.","annotations":null,"_meta":null},"isError":false},"isError":false,"timestamp":1777289877668}}
{"type":"message","id":"dab525cf","parentId":"dabff5d3","timestamp":"2026-04-27T11:38:05.073Z","message":{"role":"assistant","content":[{"type":"thinking","thinking":"The terminal seems to be stuck showing old output. The `load_conda_and_run` wrapper is wrapping every command. Let me try to bypass it or check what's happening.Let me scroll up to see more output.","thinkingSignature":"a13e3f2c95466021649650fe59b7412db339b0f267c2c9cb25dc8438d6b62234"},{"type":"toolCall","id":"call_function_h5o1nxg9i60i_1","name":"bash","arguments":{"command":"agent-browser mouse move 100 500 2>&1 && agent-browser click \"@body\" 2>&1"}}],"api":"anthropic-messages","provider":"minimax","model":"MiniMax-M2.7","usage":{"input":59737,"output":92,"cacheRead":9348,"cacheWrite":0,"totalTokens":69177,"cost":{"input":0.0179211,"output":0.0001104,"cacheRead":0.0005608799999999999,"cacheWrite":0,"total":0.01859238}},"stopReason":"toolUse","timestamp":1777289877675,"responseId":"063e7d9867b85ac649d9e7969bea7864"}}
{"type":"message","id":"914df82c","parentId":"dab525cf","timestamp":"2026-04-27T11:38:05.517Z","message":{"role":"toolResult","toolCallId":"call_function_h5o1nxg9i60i_1","toolName":"bash","content":[{"type":"text","text":"✓ Done\n✗ Element not found. Verify the selector is correct and the element exists in the DOM.\n\n\nCommand exited with code 1"}],"details":{},"isError":true,"timestamp":1777289885517}}
{"type":"message","id":"78a84929","parentId":"914df82c","timestamp":"2026-04-27T11:38:09.190Z","message":{"role":"assistant","content":[{"type":"thinking","thinking":"Let me try scrolling up with the mouse wheel.","thinkingSignature":"1600a57ce457417b4d11064161df65ed2f0cb2bdab5f21cb022eb7eb8f280246"},{"type":"toolCall","id":"call_function_ucu70f0bmfdu_1","name":"bash","arguments":{"command":"agent-browser mouse wheel -500 2>&1 && sleep 1 && agent-browser screenshot 2>&1"}}],"api":"anthropic-messages","provider":"minimax","model":"MiniMax-M2.7","usage":{"input":59873,"output":57,"cacheRead":9348,"cacheWrite":0,"totalTokens":69278,"cost":{"input":0.0179619,"output":0.0000684,"cacheRead":0.0005608799999999999,"cacheWrite":0,"total":0.01859118}},"stopReason":"toolUse","timestamp":1777289885524,"responseId":"063e7d9e291376238befa23ac6b7f957"}}
{"type":"message","id":"f9427eb7","parentId":"78a84929","timestamp":"2026-04-27T11:38:10.720Z","message":{"role":"toolResult","toolCallId":"call_function_ucu70f0bmfdu_1","toolName":"bash","content":[{"type":"text","text":"✓ Done\n✓ Screenshot saved to /Users/dhruv2mars/.agent-browser/tmp/screenshots/screenshot-1777289890711.png\n"}],"isError":false,"timestamp":1777289890720}}
{"type":"message","id":"5b47d06b","parentId":"f9427eb7","timestamp":"2026-04-27T11:38:14.096Z","message":{"role":"assistant","content":[{"type":"thinking","thinking":"Let me check.","thinkingSignature":"155764a1465f1aa31e7510f8cd8266c6638b35b4a37882161cbf92b1741bf4f4"},{"type":"toolCall","id":"call_function_03bsur4b3yyx_1","name":"understand_image","arguments":{"prompt":"Show the full terminal output - scroll to the top to see the beginning of the session.","image_url":"/Users/dhruv2mars/.agent-browser/tmp/screenshots/screenshot-1777289890711.png"}}],"api":"anthropic-messages","provider":"minimax","model":"MiniMax-M2.7","usage":{"input":59976,"output":79,"cacheRead":9348,"cacheWrite":0,"totalTokens":69403,"cost":{"input":0.0179928,"output":0.0000948,"cacheRead":0.0005608799999999999,"cacheWrite":0,"total":0.01864848}},"stopReason":"toolUse","timestamp":1777289890725,"responseId":"063e7da23ba50d304502375629442e7b"}}
{"type":"message","id":"dde0a5b4","parentId":"5b47d06b","timestamp":"2026-04-27T11:38:31.403Z","message":{"role":"toolResult","toolCallId":"call_function_03bsur4b3yyx_1","toolName":"understand_image","content":[{"type":"text","text":"Based on the image provided, here is the visible terminal output. Note that as this is a static image, I cannot scroll to show earlier parts of the session.\n\n```text\nMETRIC val_loss=7.1684\nMETRIC val_bpb=3.3256\nMETRIC best_bpb=3.3256\nMETRIC elapsed_s=57\n[CKPT] Best checkpoint saved\nstep:100/2500 train_loss:6.5520 time:125s\nstep=100 val_loss=6.4919 val_bpb=3.0117 best_bpb=3.0117 elapsed_s=126\nMETRIC step=100\nMETRIC val_loss=6.4919\nMETRIC val_bpb=3.0117\nMETRIC best_bpb=3.0117\nMETRIC elapsed_s=126\n[CKPT] Best checkpoint saved\nstep=150 val_loss=6.2248 val_bpb=2.8878 best_bpb=2.8878 elapsed_s=195\nMETRIC step=150\nMETRIC val_loss=6.2248\nMETRIC val_bpb=2.8878\nMETRIC best_bpb=2.8878\nMETRIC elapsed_s=195\n[CKPT] Best checkpoint saved\n\n[1]  + 100120 exit 1    load_conda_and_run python3 ~/parameter-golf/train_kaggle.py 2>&1 |\n       100121 done      head -50\n⚡ autoresearch/phase1-20260426 ~/parameter-golf []\n```"}],"details":{"server":"MiniMax","tool":"understand_image","structuredContent":{"type":"text","text":"Based on the image provided, here is the visible terminal output. Note that as this is a static image, I cannot scroll to show earlier parts of the session.\n\n```text\nMETRIC val_loss=7.1684\nMETRIC val_bpb=3.3256\nMETRIC best_bpb=3.3256\nMETRIC elapsed_s=57\n[CKPT] Best checkpoint saved\nstep:100/2500 train_loss:6.5520 time:125s\nstep=100 val_loss=6.4919 val_bpb=3.0117 best_bpb=3.0117 elapsed_s=126\nMETRIC step=100\nMETRIC val_loss=6.4919\nMETRIC val_bpb=3.0117\nMETRIC best_bpb=3.0117\nMETRIC elapsed_s=126\n[CKPT] Best checkpoint saved\nstep=150 val_loss=6.2248 val_bpb=2.8878 best_bpb=2.8878 elapsed_s=195\nMETRIC step=150\nMETRIC val_loss=6.2248\nMETRIC val_bpb=2.8878\nMETRIC best_bpb=2.8878\nMETRIC elapsed_s=195\n[CKPT] Best checkpoint saved\n\n[1]  + 100120 exit 1    load_conda_and_run python3 ~/parameter-golf/train_kaggle.py 2>&1 |\n       100121 done      head -50\n⚡ autoresearch/phase1-20260426 ~/parameter-golf []\n```","annotations":null,"_meta":null},"isError":false},"isError":false,"timestamp":1777289911403}}
{"type":"message","id":"974a18a2","parentId":"dde0a5b4","timestamp":"2026-04-27T11:38:38.616Z","message":{"role":"assistant","content":[{"type":"thinking","thinking":"I see - the issue is that there's a pipeline with `head -50` that's killing the process. The `[1] + 100120 exit 1` shows the process was stopped. The `head -50` is from an earlier command.Let me clear the terminal and run fresh.","thinkingSignature":"f5db5c121cf035124183649f3ee44e7eaa81e03b4f6c6dfafa25c11120bc04c0"},{"type":"text","text":"I see - old command with `| head -50` is killing it. Let me clear and run fresh:\n"},{"type":"toolCall","id":"call_function_japaeowl3li7_1","name":"bash","arguments":{"command":"agent-browser type \"\" \"clear && python3 train_kaggle.py &\" 2>&1 && agent-browser press Enter 2>&1"}}],"api":"anthropic-messages","provider":"minimax","model":"MiniMax-M2.7","usage":{"input":60399,"output":136,"cacheRead":9348,"cacheWrite":0,"totalTokens":69883,"cost":{"input":0.0181197,"output":0.00016319999999999998,"cacheRead":0.0005608799999999999,"cacheWrite":0,"total":0.018843779999999997}},"stopReason":"toolUse","timestamp":1777289911412,"responseId":"063e7db9353b3b8aaa8866261ac5affc"}}
{"type":"message","id":"fa1cc594","parentId":"974a18a2","timestamp":"2026-04-27T11:38:39.072Z","message":{"role":"toolResult","toolCallId":"call_function_japaeowl3li7_1","toolName":"bash","content":[{"type":"text","text":"✓ Done\n✓ Done\n"}],"isError":false,"timestamp":1777289919072}}
