{"type":"message","id":"6de75164","parentId":"efd4d487","timestamp":"2026-04-25T18:22:15.234Z","message":{"role":"assistant","content":[{"type":"thinking","thinking":"The user hasn't run 30-minute runs either. So they don't know the scaling curve. This is a fundamental data point they need to establish.\n\nLet me think about what we know and what we don't know:\n\n**What we know:**\n- 10 min = ~2.65 BPB (rough estimate)\n- 10-min SOTA = 1.08 BPB (8xH100, but that's different hardware)\n\n**What we DON'T know:**\n- 30 min = ?\n- Scaling curve (does it keep improving linearly? plateau?)\n- How long to reach sub-1 with just extended training?\n\n**What the user needs to establish FIRST:**\n- The scaling curve: 10 min → 30 min → 60 min → ... \n- This tells us how many iterations are needed for sub-1\n- And whether TTT/PPM are even necessary, or just extended training can get there\n\nBut this is EXPENSIVE to run. Each run costs GPU time. And if the scaling curve is steep, you might need 6+ hours just to verify.\n\nHmm, but the SOTA leaderboard shows 1.08 BPB from 10-minute runs on 8xH100. The T4 is slower, so 10-min on T4 = maybe equivalent to 2-3 min on 8xH100. So on T4, you might need much longer to reach the same performance.\n\nActually wait - the SOTA scores are from 8xH100 runs. The user has 2xT4. T4 is roughly 3x slower than H100 (16GB vs H100's ~80GB, lower TFLOPs). So 10 min on 8xH100 ≈ 30 min on 2xT4 (roughly). If the SOTA can get 1.08 BPB in 10 min on 8xH100, the user might need 30 min on 2xT4 to get the same result.\n\n\nThe key insight here is that the user's architecture closely mirrors the SOTA, so the bottleneck isn't design—it's raw compute. The real question is whether their hardware constraints allow them to reach 1.08 BPB or if they need to push further to 0.5-0.6 BPB. I should ask the user what they want to do: either establish the scaling baseline first with a single 30-min run, or skip the verification and move directly into the autoresearch process.\n","thinkingSignature":"d4a69ae7518192e2eb8aa50b2dd62b7736f6840421dfd28907527ab9151a261a"},{"type":"text","text":"\n\nYou're missing critical data: the **scaling curve**. This tells us how far extended training can take you.\n\n**Quick math:**\n- SOTA: 1.08 BPB in 10-min on 8xH100\n- T4 is ~3x slower than H100\n- So 30-min on 2xT4 ≈ 10-min on 8xH100 → maybe ~1.08 BPB\n- Sub-1 might be achievable with just extended training\n\n**Eleventh question: What's your risk tolerance?**\n\nOption A: **Establish baseline first** (1 x 30-min run)\n- Check actual BPB at 30 min\n- Compare to SOTA scaling curve\n- Then decide: is TTT/PPM needed, or just more time?\n\nOption B: **Skip baseline, trust the math**\n- Assume 30-min ≈ 1.1 BPB, need PPM/TTT for 0.5-0.6\n- Jump straight into autoresearch\n\nOption A costs ~30 min of GPU time upfront but prevents wasted iterations on wrong assumptions."}],"api":"anthropic-messages","provider":"minimax","model":"MiniMax-M2.7","usage":{"input":193,"output":737,"cacheRead":46528,"cacheWrite":0,"totalTokens":47458,"cost":{"input":0.0000579,"output":0.0008843999999999999,"cacheRead":0.00279168,"cacheWrite":0,"total":0.0037339799999999996}},"stopReason":"stop","timestamp":1777141315152,"responseId":"063c394667ea9d006bfc3003e1261432"}}
{"type":"message","id":"b04803e5","parentId":"6de75164","timestamp":"2026-04-25T18:23:34.058Z","message":{"role":"user","content":[{"type":"text","text":"do a 30 min run to get actual bpb. and for your info, we NEED ppm and tts. so after that, jump into autoresearch."}],"timestamp":1777141414050}}
{"type":"message","id":"ab9e745f","parentId":"b04803e5","timestamp":"2026-04-25T18:23:45.962Z","message":{"role":"assistant","content":[{"type":"thinking","thinking":"The user wants me to:\n1. Do a 30-min run to establish the baseline BPB\n2. Then set up autoresearch for architecture+TTT+PPM optimization\n\nBut wait - I can't run the Kaggle training myself. The user has to push to Kaggle. Let me clarify the workflow.\n\nActually, looking back at the setup - the user uses `pg_autoresearch.py` or `train_kaggle.py` and pushes to Kaggle. I can't directly push to Kaggle.\n\nSo the workflow is:\n1. User pushes a 30-min run to Kaggle\n2. Wait for results\n3. Based on results, set up autoresearch\n\nLet me ask what config for the 30-min run.\n","thinkingSignature":"5d45545756227353c3b4a5a7ad6f52141f1ac8820d1c7db04945555aa48bcdb3"},{"type":"text","text":"\n\nUnderstood. Let me set up the 30-min run.\n\n**What config should I use for the 30-min baseline?**\n\nCurrent `train_kaggle.py` defaults:\n- `MAX_WALLCLOCK_SECONDS=600` (10 min)\n- `ITERATIONS=2500`\n\nFor 30 min, should I use:\n- `MAX_WALLCLOCK_SECONDS=1800` (30 min)\n- `ITERATIONS=?` (unlimited, let it run until time cap)\n\nOr do you want me to increase ITERATIONS too (e.g., 7500 to match 30 min)?\n\n**Confirm the config and I'll prepare the script for you to push.**"}],"api":"anthropic-messages","provider":"minimax","model":"MiniMax-M2.7","usage":{"input":333,"output":294,"cacheRead":46656,"cacheWrite":0,"totalTokens":47283,"cost":{"input":0.00009989999999999999,"output":0.0003528,"cacheRead":0.00279936,"cacheWrite":0,"total":0.0032520599999999998}},"stopReason":"stop","timestamp":1777141414058,"responseId":"063c39a9264706765a6d5605f2213e9a"}}
{"type":"message","id":"e792a8c0","parentId":"ab9e745f","timestamp":"2026-04-25T18:25:54.682Z","message":{"role":"user","content":[{"type":"text","text":"do for 30 min run. match iterations for 30 min. \n\nwhat will you do after that?"}],"timestamp":1777141554674}}
{"type":"message","id":"4d68d874","parentId":"e792a8c0","timestamp":"2026-04-25T18:26:16.799Z","message":{"role":"assistant","content":[{"type":"thinking","thinking":"The user wants me to:\n1. Set up a 30-min run with matched iterations\n2. Explain what I'll do after the run completes\n\nFor 30 min on T4 (estimated ~258ms/step):\n- 30 min = 1800 seconds\n- Steps = 1800 / 0.258 ≈ 6976 steps\n- So ITERATIONS=6976 or round to ~7000\n\nAfter the run completes:\n1. Analyze the result\n2. Based on the actual BPB, plan the autoresearch setup\n3. Set up the autoresearch loop with:\n   - `autoresearch.md` with clear objective\n   - `autoresearch.sh` that runs train_kaggle.py with config variations\n   - Clear scope: architecture, TTT, PPM, hyperparameters\n\nBut wait - I need to understand something. The user mentioned \"we NEED PPM\" but there's no PPM implementation in the current code. So after the 30-min baseline run, I need to:\n1. Analyze the result\n2. Understand what's already working\n3. Plan the autoresearch scope based on what needs to be built\n\nLet me answer: after the 30-min run, I'll analyze the results and set up the autoresearch framework with clear documentation of what we need to optimize.\n","thinkingSignature":"bfa101b8cdc888c603fa6a5b491df8542201c87ab35774150fc686c84b49247a"},{"type":"text","text":"\n\nFor 30 min run config:\n- `MAX_WALLCLOCK_SECONDS=1800`\n- `ITERATIONS=7000`\n\n**After the 30-min run completes:**\n\n1. **Analyze results** — actual BPB, loss curve, how far from sub-1\n2. **Audit current code** — what's implemented vs what's theoretical (TTT, PPM)\n3. **Design the search space** — which knobs to turn (architecture, hyperparameters, TTT settings, PPM integration)\n4. **Write `autoresearch.md`** — define objective, metrics, files in scope, constraints\n5. **Write `autoresearch.sh`** — script that runs train_kaggle.py and extracts `val_bpb`\n6. **Initialize autoresearch** — baseline run → start loop\n\nThe key question after baseline: **What's the gap between 30-min BPB and sub-1?** If 30-min → 1.2 BPB, then PPM+TTT need to close ~0.7. If 30-min → 2.0 BPB, then extended training alone won't cut it.\n\n**Are you ready to push the 30-min run?** I can write the exact command/script for you."}],"api":"anthropic-messages","provider":"minimax","model":"MiniMax-M2.7","usage":{"input":186,"output":519,"cacheRead":46976,"cacheWrite":0,"totalTokens":47681,"cost":{"input":0.000055799999999999994,"output":0.0006228,"cacheRead":0.00281856,"cacheWrite":0,"total":0.00349716}},"stopReason":"stop","timestamp":1777141554683,"responseId":"063c3a352bf78c077e589272ede8fddd"}}
{"type":"message","id":"39251053","parentId":"4d68d874","timestamp":"2026-04-25T18:27:31.226Z","message":{"role":"user","content":[{"type":"text","text":"yeah yeah. i am happy with your plan. now give me the summary of what will you do and happen"}],"timestamp":1777141651220}}
{"type":"message","id":"a13f26bb","parentId":"39251053","timestamp":"2026-04-25T18:27:42.712Z","message":{"role":"assistant","content":[{"type":"thinking","thinking":"The user wants a clear summary of the plan before we proceed. Let me lay it out concisely.\n","thinkingSignature":"941feefb379e69603a43a10b151c6db02a4b40d813b004dd399c647e72af2491"},{"type":"text","text":"\n\n## Summary\n\n### Phase 1: Baseline (Now)\n- **Action**: You push a 30-min run to Kaggle\n- **Config**: 1800s wallclock, 7000 iterations\n- **Goal**: Establish actual BPB at 30 min\n\n### Phase 2: Analysis (After results)\n- Check actual BPB vs expected\n- Audit TTT/PPM status in code\n- Determine gap to sub-1\n\n### Phase 3: Autoresearch Setup\n- Write `autoresearch.md` — defines search space, metrics, constraints\n- Write `autoresearch.sh` — runs 30-min experiment, outputs `METRIC val_bpb=X`\n- Initialize session with `init_experiment`\n- Run baseline → `log_experiment` → start loop\n\n### Phase 4: Autoresearch Loop\n- Tries architecture/hyperparameter/TTT/PPM changes\n- Each run = 30 min on Kaggle\n- Keeps winners, discards losers\n- Loops autonomously until you stop it\n\n### Phase 5: Winning Run\n- Identify best config from autoresearch\n- Run extended (6-12 hr) to hit sub-1\n\n**Next step: Give me the exact command to push the 30-min run, or just confirm and I'll write it out for you.**"}],"api":"anthropic-messages","provider":"minimax","model":"MiniMax-M2.7","usage":{"input":340,"output":299,"cacheRead":47104,"cacheWrite":0,"totalTokens":47743,"cost":{"input":0.000102,"output":0.0003588,"cacheRead":0.00282624,"cacheWrite":0,"total":0.0032870399999999998}},"stopReason":"stop","timestamp":1777141651226,"responseId":"063c3a9616e059b3db28895fda94a624"}}
{"type":"compaction","id":"39cccbad","parentId":"a13f26bb","timestamp":"2026-04-25T18:28:48.773Z","summary":"## Goal\n- Learn how to use the pi-autoresearch extension for autonomous experiment loops\n- Build the best language model that fits under **16MB** with sub-1 bpb (ideally **0.5–0.6 bpb**) for the **openai parameter-golf challenge** on the PB leaderboard\n\n## Constraints & Preferences\n- Model must fit under **16MB**\n- Training via **Kaggle** with **2x T4 GPUs**\n- No limits on compute/resources; **30hrs GPU quota**\n- **Max session run: 12hrs**\n- Planned improvements: (1) extended training, (2) TTT, (3) PPM hybrid\n- Current architecture deemed \"okay-ish\"\n\n## Progress\n### Done\n- [x] User learned how to use pi-autoresearch (read `SKILL.md` for `autoresearch-create`)\n- [x] User requested `/grill-me` skill to stress-test the plan\n\n### In Progress\n- [ ] **Grill-me interview** — first question asked: \"What is your current bpb score?\"\n- [ ] Setting up the actual `autoresearch` loop\n\n### Blocked\n- (none yet)\n\n## Key Decisions\n- **Grill-me first**: User wants to validate the plan before setting up autoresearch loop\n- **Autoresearch not yet initialized**: Awaiting grill-me outcome to define goal, metric, command, files in scope, and constraints\n\n## Next Steps\n1. User must answer: What is the **current baseline bpb score**?\n2. Continue grill-me interview to resolve all decision branches (architecture, training loop, metric definition, etc.)\n3. Create `git checkout -b autoresearch/<goal>-<date>` branch\n4. Read source files deeply\n5. Write `autoresearch.md` and `autoresearch.sh`\n6. Run `init_experiment` with `direction=lower` (bpb)\n7. Establish baseline → `log_experiment` → start looping\n\n## Critical Context\n- **Extension path**: `/Users/dhruv2mars/.pi/agent/git/github.com/davebcn87/pi-autoresearch/skills/autoresearch-create/SKILL.md`\n- **Key tools**: `init_experiment` (name, metric, unit, direction), `run_experiment` (execute + time), `log_experiment` (keep/discard/crash + `asi` param)\n- **Grill-me skill**: `read(path=\"/Users/dhruv2mars/.pi/agent/skills/grill-me/SKILL.md\")` — asks questions one at a time\n- **autoresearch script output format**: `METRIC name=value` lines\n- **Metric**: `bpb` (lower is better)\n\n---\n\n**Turn Context (split turn):**\n\n## Original Request\nUser asked assistant to checkout the full repo for context, noting current performance of ~2.65 bpb on 10 min training run.\n\n## Early Progress\n- Explored repo structure with `find` and `ls` commands\n- Discovered this is the **\"Parameter Golf\" challenge** - train best language model under 16MB that trains in under 10 minutes, evaluated by compression (bits per byte) on FineWeb validation\n- Found 39+ experiment records with various approaches (GPTQ, depth recurrence, quantization, TTT, etc.)\n- Read README.md, PROGRESS.md, and training scripts (train_kaggle.py, run_train.sh, run_train_ttt.sh)\n- Identified proven SOTA architecture: 11L x 512d x 8H / 4KV with tied embeddings, SP8192 tokenizer, depth recurrence (layers 3-5 loop 2x after 35% training), QK-Gain 5.25, RoPE 16 dims\n- Best submissions achieving ~1.08-1.12 BPB; goal is sub-1 BPB\n\n## Context for Suffix\nThe retained suffix contains the full implementation details:\n- Training hyperparameters (batch=8192 tokens, seq_len=512, iterations=2500, weight_decay=0.095, EMA=0.9965, warmdown at 72%)\n- Model architecture code with attention, MLP (4x dim with squared LeakyReLU), quantization (GPTQ SDClip)\n- Depth recurrence implementation, checkpointing every 5 minutes\n- The assistant was reading these files to understand the full training pipeline before proposing improvements\n\n<read-files>\n/Users/dhruv2mars/.pi/agent/git/github.com/davebcn87/pi-autoresearch/skills/autoresearch-create/SKILL.md\n/Users/dhruv2mars/.pi/agent/skills/grill-me/SKILL.md\n/Users/dhruv2mars/dev/github/parameter-golf/PROGRESS.md\n/Users/dhruv2mars/dev/github/parameter-golf/README.md\n/Users/dhruv2mars/dev/github/parameter-golf/run_train.sh\n/Users/dhruv2mars/dev/github/parameter-golf/run_train_ttt.sh\n/Users/dhruv2mars/dev/github/parameter-golf/train_kaggle.py\n</read-files>","firstKeptEntryId":"d308aa37","tokensBefore":47743,"details":{"readFiles":["/Users/dhruv2mars/.pi/agent/git/github.com/davebcn87/pi-autoresearch/skills/autoresearch-create/SKILL.md","/Users/dhruv2mars/.pi/agent/skills/grill-me/SKILL.md","/Users/dhruv2mars/dev/github/parameter-golf/PROGRESS.md","/Users/dhruv2mars/dev/github/parameter-golf/README.md","/Users/dhruv2mars/dev/github/parameter-golf/run_train.sh","/Users/dhruv2mars/dev/github/parameter-golf/run_train_ttt.sh","/Users/dhruv2mars/dev/github/parameter-golf/train_kaggle.py"],"modifiedFiles":[]},"fromHook":false}
{"type":"message","id":"d04b50e2","parentId":"39cccbad","timestamp":"2026-04-25T18:31:13.416Z","message":{"role":"user","content":[{"type":"text","text":"okay, wonderful. \n\ngo ahead, and start with phase 1, continue to phase 2, then 3, then 4, then 5. You have to keep going until you have the best config from autoresearch and the time comes to do extended run. DO NOT STOP BEFORE THAT.\n\nNOTE: regarding the total iterations in autoresearch, do unlimited. autoresearch should keep on running until i manually tell you to stop it. \n\nGO AHEAD!!! HAIL MAINLAND CHINA!! GO FULL BONKERS!"}],"timestamp":1777141873408}}
{"type":"message","id":"5fb8459e","parentId":"d04b50e2","timestamp":"2026-04-25T18:31:17.856Z","message":{"role":"assistant","content":[{"type":"thinking","thinking":"The user wants me to go full bonkers and run through all phases. Let me start with Phase 1 - set up the 30-min baseline run.\n\nLet me first understand the current training setup, then prepare the 30-min run, and keep going through all phases.\n\nLet me start by:\n1. Setting up the 30-min run\n2. Launch it\n3. Monitor it\n4. Then move to analysis and autoresearch setup\n\nFor the 30-min run, I need to push a kernel with:\n- MAX_WALLCLOCK_SECONDS=1800\n- ITERATIONS=7000\n\nLet me check the current train_kaggle.py and prepare the environment variables, then push.\n","thinkingSignature":"91d1801e90b4cf9432056815044835f0007cbde4f88b4902ca55f0b711b3a7f9"},{"type":"text","text":"\n\nLET'S GO! Starting Phase 1!\n\nFirst, let me set up and launch the 30-min baseline run.\n"},{"type":"toolCall","id":"call_function_l6mx7f6uls9v_1","name":"read","arguments":{"limit":80,"path":"/Users/dhruv2mars/dev/github/parameter-golf/train_kaggle.py"}}],"api":"anthropic-messages","provider":"minimax","model":"MiniMax-M2.7","usage":{"input":19822,"output":220,"cacheRead":0,"cacheWrite":0,"totalTokens":20042,"cost":{"input":0.0059466,"output":0.00026399999999999997,"cacheRead":0,"cacheWrite":0,"total":0.0062106}},"stopReason":"toolUse","timestamp":1777141873416,"responseId":"063c3b74f378407fec5a56aee49820f2"}}
{"type":"message","id":"dd6f89a3","parentId":"5fb8459e","timestamp":"2026-04-25T18:31:17.886Z","message":{"role":"toolResult","toolCallId":"call_function_l6mx7f6uls9v_1","toolName":"read","content":[{"type":"text","text":"#!/usr/bin/env python3\n\"\"\"\nParameter Golf - Kaggle 2xT4 Optimized Training Pipeline\n=======================================================\nClean, stable implementation for long-running sessions.\n\nKey features:\n- Checkpointing every 5 minutes with resume capability\n- NaN/Inf detection with graceful recovery\n- Incremental 10-minute validation cycles\n- Standard proven architecture (11L x 512d, SP8192, depth recurrence)\n- TTT (Test-Time Training) for final BPB boost\n\nTarget: Sub-1 BPB on 2xT4 GPUs with extended training.\n\"\"\"\n\nimport gc\nimport glob\nimport io\nimport json\nimport math\nimport os\nimport random\nimport signal\nimport sys\nimport time\nimport uuid\nimport zlib\nfrom pathlib import Path\n\nimport numpy as np\nimport sentencepiece as spm\nimport torch\nimport torch.distributed as dist\nimport torch.nn.functional as F\nfrom torch import nn\nfrom torch.nn.parallel import DistributedDataParallel as DDP\n\n# ============================================================================\n# CONSTANTS\n# ============================================================================\n\n# T4 specs: 16GB VRAM each, ~65 TFLOPs vs H100 SXM ~400 TFLOPs\n# T4 is ~3x slower, so we compensate with more accumulation\n_T4_BATCH_TOKENS = 8192\n_T4_SEQ_LEN = 512\n_T4_GRAD_ACCUM = 1          # 1 for quick feedback, 4 for larger effective batch\n_T4_ITERATIONS = 2500        # Base iterations (will scale with time)\n_T4_MAX_WALLCLOCK = 570      # 10 minutes for quick validation runs\n_T4_MATRIX_LR = 0.001       # AdamW LR tuned for T4\n\n# Checkpointing\n_CHECKPOINT_DIR = \"checkpoints\"\n_CHECKPOINT_EVERY_SECONDS = 300  # 5 minutes\n_CHECKPOINT_PREFIX = \"ckpt_step_\"\n\n# ============================================================================\n# HYPERPARAMETERS\n# ============================================================================\n\nclass H:\n    \"\"\"Hyperparameters - all configurable via environment variables.\"\"\"\n    \n    # Paths\n    data_path = os.environ.get(\"DATA_PATH\", \"/tmp/fineweb-pg\")\n    run_id = os.environ.get(\"RUN_ID\", str(uuid.uuid4())[:8])\n    seed = int(os.environ.get(\"SEED\", 1337))\n    checkpoint_dir = os.environ.get(\"CHECKPOINT_DIR\", _CHECKPOINT_DIR)\n    \n    # Training\n    iterations = int(os.environ.get(\"ITERATIONS\", _T4_ITERATIONS))\n    train_batch_tokens = int(os.environ.get(\"TRAIN_BATCH_TOKENS\", _T4_BATCH_TOKENS))\n    train_seq_len = int(os.environ.get(\"TRAIN_SEQ_LEN\", _T4_SEQ_LEN))\n    grad_accum_steps = int(os.environ.get(\"GRAD_ACCUM_STEPS\", _T4_GRAD_ACCUM))\n    max_wallclock_seconds = float(os.environ.get(\"MAX_WALLCLOCK_SECONDS\", _T4_MAX_WALLCLOCK))\n    warmup_steps = int(os.environ.get(\"WARMUP_STEPS\", 50))\n    warmdown_frac = float(os.environ.get(\"WARMDOWN_FRAC\", 0.72))\n    min_lr_ratio = float(os.environ.get(\"MIN_LR_RATIO\", 0.1))\n    \n    # Validation\n\n[965 more lines in file. Use offset=81 to continue.]"}],"isError":false,"timestamp":1777141877886}}
