{"type":"message","id":"9369bc03","parentId":"39f0a682","timestamp":"2026-04-27T11:08:01.311Z","message":{"role":"assistant","content":[{"type":"thinking","thinking":"The user has given me:1. LIGHTNING_USER_ID\n2. LIGHTNING_API_KEY\n3. Studio URL\n\nLet me use the Lightning AI CLI to connect and set things up. First I need to install the CLI, login, and then access the studio.\n\nActually, I should check if I can use the `lightning` CLI directly from here. Let me try to use it to access the studio.","thinkingSignature":"86d3ae56f2e34532ce1aab70e16699d15cc1bfce2d1838480120f4f7939524de"},{"type":"toolCall","id":"call_function_cxecnfvqy9cl_1","name":"bash","arguments":{"command":"pip install lightning -q 2>&1 | tail -3"}}],"api":"anthropic-messages","provider":"minimax","model":"MiniMax-M2.7","usage":{"input":0,"output":123,"cacheRead":45762,"cacheWrite":0,"totalTokens":45885,"cost":{"input":0,"output":0.00014759999999999998,"cacheRead":0.0027457199999999997,"cacheWrite":0,"total":0.0028933199999999996}},"stopReason":"toolUse","timestamp":1777288073142,"responseId":"063e768b7d99a78989bdae99b79ffee5"}}
{"type":"message","id":"db535c12","parentId":"9369bc03","timestamp":"2026-04-27T11:08:01.323Z","message":{"role":"toolResult","toolCallId":"call_function_cxecnfvqy9cl_1","toolName":"bash","content":[{"type":"text","text":"/bin/bash: pip: command not found\n"}],"isError":false,"timestamp":1777288081323}}
{"type":"message","id":"4800da7d","parentId":"db535c12","timestamp":"2026-04-27T11:08:05.202Z","message":{"role":"assistant","content":[{"type":"thinking","thinking":"No pip available. Let me try pip3 or check what's available.","thinkingSignature":"111cc285e3848f472ed1dfe081ab6d3ba586424e260f34866c1654f22ee4ab97"},{"type":"toolCall","id":"call_function_qat3xi0951mg_1","name":"bash","arguments":{"command":"which python3 && python3 -m pip install lightning -q 2>&1 | tail -3"}}],"api":"anthropic-messages","provider":"minimax","model":"MiniMax-M2.7","usage":{"input":36561,"output":60,"cacheRead":9348,"cacheWrite":0,"totalTokens":45969,"cost":{"input":0.0109683,"output":0.000072,"cacheRead":0.0005608799999999999,"cacheWrite":0,"total":0.011601179999999999}},"stopReason":"toolUse","timestamp":1777288081325,"responseId":"063e769128fca7ad4e5bdba5c0b0398b"}}
{"type":"message","id":"a388b592","parentId":"4800da7d","timestamp":"2026-04-27T11:08:05.792Z","message":{"role":"toolResult","toolCallId":"call_function_qat3xi0951mg_1","toolName":"bash","content":[{"type":"text","text":"/opt/homebrew/bin/python3\n\nnote: If you believe this is a mistake, please contact your Python installation or OS distribution provider. You can override this, at the risk of breaking your Python installation or OS, by passing --break-system-packages.\nhint: See PEP 668 for the detailed specification.\n"}],"isError":false,"timestamp":1777288085792}}
{"type":"message","id":"5ddb9795","parentId":"a388b592","timestamp":"2026-04-27T11:08:09.175Z","message":{"role":"assistant","content":[{"type":"thinking","thinking":"Need to use --break-system-packages or a venv. Let me try with that flag.","thinkingSignature":"d144cdf17d6cd9d86415dbb7b00f15bb0cca0f152b22d4a5f3b9614c309fa602"},{"type":"toolCall","id":"call_function_m9incynjw3z4_1","name":"bash","arguments":{"command":"python3 -m pip install lightning --break-system-packages -q 2>&1 | tail -5"}}],"api":"anthropic-messages","provider":"minimax","model":"MiniMax-M2.7","usage":{"input":36697,"output":65,"cacheRead":9348,"cacheWrite":0,"totalTokens":46110,"cost":{"input":0.011009099999999999,"output":0.000078,"cacheRead":0.0005608799999999999,"cacheWrite":0,"total":0.011647979999999999}},"stopReason":"toolUse","timestamp":1777288085795,"responseId":"063e7696c1c3aec0bb8943ec37ae1061"}}
{"type":"message","id":"61b0fb60","parentId":"5ddb9795","timestamp":"2026-04-27T11:08:12.103Z","message":{"role":"toolResult","toolCallId":"call_function_m9incynjw3z4_1","toolName":"bash","content":[{"type":"text","text":"(no output)"}],"isError":false,"timestamp":1777288092103}}
{"type":"message","id":"b1b48fe8","parentId":"61b0fb60","timestamp":"2026-04-27T11:08:23.019Z","message":{"role":"assistant","content":[{"type":"thinking","thinking":"Installed. Let me try the lightning CLI now.","thinkingSignature":"33692fc7a56ef51ca7fd24145dfedbd9c3a799658bc847bc7a18a4d5ca3d40d2"},{"type":"toolCall","id":"call_function_dyvo30iafwg0_1","name":"bash","arguments":{"command":"export LIGHTNING_USER_ID=\"d52587bc-ec3c-4c9c-a2fa-71246e3d4020\" && export LIGHTNING_API_KEY=\"REDACTED\" && lightning --version 2>&1"}}],"api":"anthropic-messages","provider":"minimax","model":"MiniMax-M2.7","usage":{"input":36780,"output":107,"cacheRead":9348,"cacheWrite":0,"totalTokens":46235,"cost":{"input":0.011033999999999999,"output":0.0001284,"cacheRead":0.0005608799999999999,"cacheWrite":0,"total":0.011723279999999999}},"stopReason":"toolUse","timestamp":1777288092106,"responseId":"063e76a24efbf9eb8c9f112eabde625b"}}
{"type":"message","id":"f72435b3","parentId":"b1b48fe8","timestamp":"2026-04-27T11:08:23.041Z","message":{"role":"toolResult","toolCallId":"call_function_dyvo30iafwg0_1","toolName":"bash","content":[{"type":"text","text":"/bin/bash: lightning: command not found\n\n\nCommand exited with code 127"}],"details":{},"isError":true,"timestamp":1777288103041}}
{"type":"message","id":"c8f05542","parentId":"f72435b3","timestamp":"2026-04-27T11:08:28.232Z","message":{"role":"assistant","content":[{"type":"thinking","thinking":"The lightning CLI isn't in PATH even after install. Let me find where it was installed.","thinkingSignature":"72577a2e2c9e7be5640c53a14ec31fa7eccd852ff8503c5330adf8356314a3bd"},{"type":"toolCall","id":"call_function_cf7bflsvcdm9_1","name":"bash","arguments":{"command":"python3 -m pip show lightning 2>/dev/null | grep Location && find /usr/local/bin /opt/homebrew/bin ~/Library/Python -name \"lightning*\" 2>/dev/null | head -5"}}],"api":"anthropic-messages","provider":"minimax","model":"MiniMax-M2.7","usage":{"input":36918,"output":88,"cacheRead":9348,"cacheWrite":0,"totalTokens":46354,"cost":{"input":0.0110754,"output":0.00010559999999999999,"cacheRead":0.0005608799999999999,"cacheWrite":0,"total":0.01174188}},"stopReason":"toolUse","timestamp":1777288103047,"responseId":"063e76a840b795eea60775b197cfa834"}}
{"type":"message","id":"b80d0d88","parentId":"c8f05542","timestamp":"2026-04-27T11:08:28.507Z","message":{"role":"toolResult","toolCallId":"call_function_cf7bflsvcdm9_1","toolName":"bash","content":[{"type":"text","text":"Location: /opt/homebrew/lib/python3.14/site-packages\n"}],"isError":false,"timestamp":1777288108507}}
{"type":"message","id":"3ce2be10","parentId":"b80d0d88","timestamp":"2026-04-27T11:08:31.627Z","message":{"role":"assistant","content":[{"type":"thinking","thinking":"Let me try to run it directly as a module or find the executable.","thinkingSignature":"d57b49c22f0c94257a91523557e328268fdb7d5b4c2e518dcb94f7a9b3b024d3"},{"type":"toolCall","id":"call_function_il2mru3l4yl8_1","name":"bash","arguments":{"command":"python3 -m lightning --version 2>&1"}}],"api":"anthropic-messages","provider":"minimax","model":"MiniMax-M2.7","usage":{"input":37035,"output":51,"cacheRead":9348,"cacheWrite":0,"totalTokens":46434,"cost":{"input":0.011110499999999999,"output":0.0000612,"cacheRead":0.0005608799999999999,"cacheWrite":0,"total":0.01173258}},"stopReason":"toolUse","timestamp":1777288108510,"responseId":"063e76ad87bb46eaeaa0fba2d5564bd6"}}
{"type":"message","id":"39d49db8","parentId":"3ce2be10","timestamp":"2026-04-27T11:08:34.166Z","message":{"role":"toolResult","toolCallId":"call_function_il2mru3l4yl8_1","toolName":"bash","content":[{"type":"text","text":"/opt/homebrew/opt/python@3.14/bin/python3.14: No module named lightning.__main__; 'lightning' is a package and cannot be directly executed\n\n\nCommand exited with code 1"}],"details":{},"isError":true,"timestamp":1777288114166}}
{"type":"message","id":"8b91b804","parentId":"39d49db8","timestamp":"2026-04-27T11:08:38.996Z","message":{"role":"assistant","content":[{"type":"thinking","thinking":"Hmm, the package isn't set up correctly. Let me try a different approach - use the lightning CLI through the proper pip install method with an executable.","thinkingSignature":"dd7835ba42bfe06196460a5726bd941439069174189d89f73c53f95b0eeeb465"},{"type":"toolCall","id":"call_function_muh7rnuorb4e_1","name":"bash","arguments":{"command":"python3 -m pip install lightning-cli --break-system-packages -q 2>&1 | tail -3 && which lightning 2>&1"}}],"api":"anthropic-messages","provider":"minimax","model":"MiniMax-M2.7","usage":{"input":37144,"output":84,"cacheRead":9348,"cacheWrite":0,"totalTokens":46576,"cost":{"input":0.011143199999999999,"output":0.0001008,"cacheRead":0.0005608799999999999,"cacheWrite":0,"total":0.011804879999999998}},"stopReason":"toolUse","timestamp":1777288114168,"responseId":"063e76b2a8ff373b68d8fe3c22472a2a"}}
{"type":"message","id":"4d2aac10","parentId":"8b91b804","timestamp":"2026-04-27T11:08:39.734Z","message":{"role":"toolResult","toolCallId":"call_function_muh7rnuorb4e_1","toolName":"bash","content":[{"type":"text","text":"ERROR: Could not find a version that satisfies the requirement lightning-cli (from versions: none)\nERROR: No matching distribution found for lightning-cli\n\n\nCommand exited with code 1"}],"details":{},"isError":true,"timestamp":1777288119734}}
{"type":"message","id":"52319a5b","parentId":"4d2aac10","timestamp":"2026-04-27T11:08:43.844Z","message":{"role":"assistant","content":[{"type":"thinking","thinking":"`lightning-cli` isn't a separate package. Let me try reinstalling the main `lightning` package properly.","thinkingSignature":"98512357e67d8cf7ff953565eacc5c5d49b2a47480025bfc94413c4bead8504e"},{"type":"toolCall","id":"call_function_xodd5ar41cly_1","name":"bash","arguments":{"command":"python3 -m pip uninstall lightning -y 2>&1 && python3 -m pip install lightning --break-system-packages 2>&1 | tail -10"}}],"api":"anthropic-messages","provider":"minimax","model":"MiniMax-M2.7","usage":{"input":37279,"output":82,"cacheRead":9348,"cacheWrite":0,"totalTokens":46709,"cost":{"input":0.0111837,"output":0.00009839999999999999,"cacheRead":0.0005608799999999999,"cacheWrite":0,"total":0.01184298}},"stopReason":"toolUse","timestamp":1777288119737,"responseId":"063e76b823f4de9262eef8a3cb3bdae6"}}
{"type":"message","id":"653b8b1d","parentId":"52319a5b","timestamp":"2026-04-27T11:08:44.121Z","message":{"role":"toolResult","toolCallId":"call_function_xodd5ar41cly_1","toolName":"bash","content":[{"type":"text","text":"error: externally-managed-environment\n\n× This environment is externally managed\n╰─> To install Python packages system-wide, try brew install\n    xyz, where xyz is the package you are trying to\n    install.\n    \n    If you wish to install a Python library that isn't in Homebrew,\n    use a virtual environment:\n    \n    python3 -m venv path/to/venv\n    source path/to/venv/bin/activate\n    python3 -m pip install xyz\n    \n    If you wish to install a Python application that isn't in Homebrew,\n    it may be easiest to use 'pipx install xyz', which will manage a\n    virtual environment for you. You can install pipx with\n    \n    brew install pipx\n    \n    You may restore the old behavior of pip by passing\n    the '--break-system-packages' flag to pip, or by adding\n    'break-system-packages = true' to your pip.conf file. The latter\n    will permanently disable this error.\n    \n    If you disable this error, we STRONGLY recommend that you additionally\n    pass the '--user' flag to pip, or set 'user = true' in your pip.conf\n    file. Failure to do this can result in a broken Homebrew installation.\n    \n    Read more about this behavior here: <https://peps.python.org/pep-0668/>\n\nnote: If you believe this is a mistake, please contact your Python installation or OS distribution provider. You can override this, at the risk of breaking your Python installation or OS, by passing --break-system-packages.\nhint: See PEP 668 for the detailed specification.\n\n\nCommand exited with code 1"}],"details":{},"isError":true,"timestamp":1777288124121}}
{"type":"message","id":"b9742f72","parentId":"653b8b1d","timestamp":"2026-04-27T11:08:48.511Z","message":{"role":"assistant","content":[{"type":"thinking","thinking":"The issue is that the `--break-system-packages` flag was accepted but then the package install fails because the environment is managed. Let me try creating a virtual environment instead.","thinkingSignature":"0a720c0bfb06d1833201b54994434ed20bf28189a7e19b3fda28f35397ee00f3"},{"type":"toolCall","id":"call_function_7htfvoj4a0jc_1","name":"bash","arguments":{"command":"python3 -m venv ~/.venv/pg && source ~/.venv/pg/bin/activate && pip install lightning 2>&1 | tail -5"}}],"api":"anthropic-messages","provider":"minimax","model":"MiniMax-M2.7","usage":{"input":37716,"output":90,"cacheRead":9348,"cacheWrite":0,"totalTokens":47154,"cost":{"input":0.0113148,"output":0.000108,"cacheRead":0.0005608799999999999,"cacheWrite":0,"total":0.01198368}},"stopReason":"toolUse","timestamp":1777288124125,"responseId":"063e76bc6fa1bda330f9d753c1a3394a"}}
{"type":"message","id":"7858f4ef","parentId":"b9742f72","timestamp":"2026-04-27T11:09:17.261Z","message":{"role":"toolResult","toolCallId":"call_function_7htfvoj4a0jc_1","toolName":"bash","content":[{"type":"text","text":"\nSuccessfully installed MarkupSafe-3.0.3 PyYAML-6.0.3 aiohappyeyeballs-2.6.1 aiohttp-3.13.5 aiosignal-1.4.0 attrs-26.1.0 filelock-3.29.0 frozenlist-1.8.0 fsspec-2026.3.0 idna-3.13 jinja2-3.1.6 lightning-2.6.1 lightning-utilities-0.15.3 mpmath-1.3.0 multidict-6.7.1 networkx-3.6.1 numpy-2.4.4 packaging-26.2 propcache-0.4.1 pytorch-lightning-2.6.1 setuptools-81.0.0 sympy-1.14.0 torch-2.11.0 torchmetrics-1.9.0 tqdm-4.67.3 typing-extensions-4.15.0 yarl-1.23.0\n\n[notice] A new release of pip is available: 26.0.1 -> 26.1\n[notice] To update, run: pip install --upgrade pip\n"}],"isError":false,"timestamp":1777288157261}}
{"type":"message","id":"21b902df","parentId":"7858f4ef","timestamp":"2026-04-27T11:09:24.791Z","message":{"role":"assistant","content":[{"type":"thinking","thinking":"Now let me login with the lightning CLI and check the studio.","thinkingSignature":"e22b26452851fe28df36bda082fe4e17856b7acdf99f3289697e89ce49705b76"},{"type":"toolCall","id":"call_function_0l4kp448viyd_1","name":"bash","arguments":{"command":"source ~/.venv/pg/bin/activate && export LIGHTNING_USER_ID=\"d52587bc-ec3c-4c9c-a2fa-71246e3d4020\" && export LIGHTNING_API_KEY=\"REDACTED\" && lightning --version 2>&1"}}],"api":"anthropic-messages","provider":"minimax","model":"MiniMax-M2.7","usage":{"input":38082,"output":119,"cacheRead":9348,"cacheWrite":0,"totalTokens":47549,"cost":{"input":0.0114246,"output":0.0001428,"cacheRead":0.0005608799999999999,"cacheWrite":0,"total":0.01212828}},"stopReason":"toolUse","timestamp":1777288157265,"responseId":"063e76e0cf6c16c72cb1b1095db5afb0"}}
{"type":"message","id":"ed5cdd70","parentId":"21b902df","timestamp":"2026-04-27T11:09:24.818Z","message":{"role":"toolResult","toolCallId":"call_function_0l4kp448viyd_1","toolName":"bash","content":[{"type":"text","text":"/bin/bash: lightning: command not found\n\n\nCommand exited with code 127"}],"details":{},"isError":true,"timestamp":1777288164818}}
{"type":"message","id":"56b14275","parentId":"ed5cdd70","timestamp":"2026-04-27T11:09:29.170Z","message":{"role":"assistant","content":[{"type":"thinking","thinking":"The venv was installed but lightning isn't in PATH. Let me use the full path.","thinkingSignature":"52a5ee34f9f47ceea25bab22856fcb56d552dc755425eb8176e441135dd1227d"},{"type":"toolCall","id":"call_function_4tdrxgc3sw25_1","name":"bash","arguments":{"command":"source ~/.venv/pg/bin/activate && which python && python -m lightning --version 2>&1"}}],"api":"anthropic-messages","provider":"minimax","model":"MiniMax-M2.7","usage":{"input":38232,"output":65,"cacheRead":9348,"cacheWrite":0,"totalTokens":47645,"cost":{"input":0.0114696,"output":0.000078,"cacheRead":0.0005608799999999999,"cacheWrite":0,"total":0.01210848}},"stopReason":"toolUse","timestamp":1777288164823,"responseId":"063e76e5bd7216fc390960f407d547d8"}}
{"type":"message","id":"30083bab","parentId":"56b14275","timestamp":"2026-04-27T11:09:35.983Z","message":{"role":"toolResult","toolCallId":"call_function_4tdrxgc3sw25_1","toolName":"bash","content":[{"type":"text","text":"/Users/dhruv2mars/.venv/pg/bin/python\n/Users/dhruv2mars/.venv/pg/bin/python: No module named lightning.__main__; 'lightning' is a package and cannot be directly executed\n\n\nCommand exited with code 1"}],"details":{},"isError":true,"timestamp":1777288175983}}
{"type":"message","id":"3b54a615","parentId":"30083bab","timestamp":"2026-04-27T11:09:42.277Z","message":{"role":"assistant","content":[{"type":"thinking","thinking":"The lightning package doesn't have a `__main__.py`. Let me check how to run it.","thinkingSignature":"5e0adfb3a6c0c14abe2ced642d4a206ade824a4114f2c1bdd37e1bb23ae9e292"},{"type":"toolCall","id":"call_function_fco22csazrh7_1","name":"bash","arguments":{"command":"source ~/.venv/pg/bin/activate && pip show lightning | grep -i \"console\\|entry\\|scripts\" && ls ~/.venv/pg/bin/ | grep light"}}],"api":"anthropic-messages","provider":"minimax","model":"MiniMax-M2.7","usage":{"input":38367,"output":79,"cacheRead":9348,"cacheWrite":0,"totalTokens":47794,"cost":{"input":0.011510099999999999,"output":0.0000948,"cacheRead":0.0005608799999999999,"cacheWrite":0,"total":0.01216578}},"stopReason":"toolUse","timestamp":1777288175986,"responseId":"063e76f2b2a3a64b7f3183cb02676273"}}
{"type":"message","id":"83bc0a84","parentId":"3b54a615","timestamp":"2026-04-27T11:09:42.509Z","message":{"role":"toolResult","toolCallId":"call_function_fco22csazrh7_1","toolName":"bash","content":[{"type":"text","text":"(no output)\n\nCommand exited with code 1"}],"details":{},"isError":true,"timestamp":1777288182509}}
{"type":"message","id":"f3bb5d24","parentId":"83bc0a84","timestamp":"2026-04-27T11:09:47.007Z","message":{"role":"assistant","content":[{"type":"thinking","thinking":"No console scripts defined. The lightning CLI might be accessed differently. Let me check the package structure.","thinkingSignature":"f6217979b58b59580f288bf12fcbe3f4988c29ad39e8a473d55d9962da33532d"},{"type":"toolCall","id":"call_function_2x7o5jtrs8sb_1","name":"bash","arguments":{"command":"source ~/.venv/pg/bin/activate && python -c \"import lightning; print(lightning.__file__)\" && ls ~/.venv/pg/lib/python*/site-packages/lightning/ | head -10"}}],"api":"anthropic-messages","provider":"minimax","model":"MiniMax-M2.7","usage":{"input":38471,"output":88,"cacheRead":9348,"cacheWrite":0,"totalTokens":47907,"cost":{"input":0.011541299999999999,"output":0.00010559999999999999,"cacheRead":0.0005608799999999999,"cacheWrite":0,"total":0.01220778}},"stopReason":"toolUse","timestamp":1777288182512,"responseId":"063e76f72e25948ea933925d5b61b2b2"}}
{"type":"message","id":"584abbd4","parentId":"f3bb5d24","timestamp":"2026-04-27T11:09:48.533Z","message":{"role":"toolResult","toolCallId":"call_function_2x7o5jtrs8sb_1","toolName":"bash","content":[{"type":"text","text":"/Users/dhruv2mars/.venv/pg/lib/python3.14/site-packages/lightning/__init__.py\n__about__.py\n__init__.py\n__pycache__\n__setup__.py\n__version__.py\n3fb7aa414e64c83118cf76c2354dbd9c527a9ecdb4a34070\ndata\nfabric\npy.typed\npytorch\n"}],"isError":false,"timestamp":1777288188533}}
{"type":"message","id":"dfe7bfdd","parentId":"584abbd4","timestamp":"2026-04-27T11:09:53.604Z","message":{"role":"assistant","content":[{"type":"thinking","thinking":"I see - it's the new `lightning` package which is different from the old `pytorch-lightning`. The CLI might be a separate entry point or might need to be invoked differently.\n\nLet me check if there's a CLI script in the package.","thinkingSignature":"8b3136854b12561b030bdcd83688465bcb8fa84ce367ad341ea5fe306d6e1885"},{"type":"toolCall","id":"call_function_ewrlurja1apu_1","name":"bash","arguments":{"command":"source ~/.venv/pg/bin/activate && find ~/.venv/pg -name \"lightning*\" -type f 2>/dev/null | head -10"}}],"api":"anthropic-messages","provider":"minimax","model":"MiniMax-M2.7","usage":{"input":38663,"output":108,"cacheRead":9348,"cacheWrite":0,"totalTokens":48119,"cost":{"input":0.011598899999999999,"output":0.0001296,"cacheRead":0.0005608799999999999,"cacheWrite":0,"total":0.012289379999999999}},"stopReason":"toolUse","timestamp":1777288188536,"responseId":"063e76fdf99c51690a3126ecb04e71fd"}}
{"type":"message","id":"fe359d63","parentId":"dfe7bfdd","timestamp":"2026-04-27T11:09:53.809Z","message":{"role":"toolResult","toolCallId":"call_function_ewrlurja1apu_1","toolName":"bash","content":[{"type":"text","text":"/Users/dhruv2mars/.venv/pg/lib/python3.14/site-packages/lightning/fabric/plugins/environments/__pycache__/lightning.cpython-314.pyc\n/Users/dhruv2mars/.venv/pg/lib/python3.14/site-packages/lightning/fabric/plugins/environments/lightning.py\n/Users/dhruv2mars/.venv/pg/lib/python3.14/site-packages/lightning_fabric/plugins/environments/__pycache__/lightning.cpython-314.pyc\n/Users/dhruv2mars/.venv/pg/lib/python3.14/site-packages/lightning_fabric/plugins/environments/lightning.py\n"}],"isError":false,"timestamp":1777288193809}}
