{"type":"message","id":"b53c2ac3","parentId":"14802da8","timestamp":"2026-04-25T19:47:46.767Z","message":{"role":"assistant","content":[{"type":"thinking","thinking":"Now I need to fix the TTT dtype issue. The problem is that CastedLinear casts to float32 but the model is in bf16. I need to fix the forward method to cast to bf16 when using autocast.\n\nLet me look at the CastedLinear forward method and fix it.","thinkingSignature":"2ee23a3d712b46166747fe47bf6765faceb646afb4c75007c8305ab3b059d4a4"},{"type":"toolCall","id":"call_function_386nzj0k1fsx_1","name":"read","arguments":{"limit":15,"offset":275,"path":"/Users/dhruv2mars/dev/github/parameter-golf/train_kaggle.py"}}],"api":"anthropic-messages","provider":"minimax","model":"MiniMax-M2.7","usage":{"input":327,"output":122,"cacheRead":47552,"cacheWrite":0,"totalTokens":48001,"cost":{"input":0.0000981,"output":0.00014639999999999998,"cacheRead":0.00285312,"cacheWrite":0,"total":0.0030976199999999997}},"stopReason":"toolUse","timestamp":1777146463003,"responseId":"063c4d61a71b99c1714e7ccf0982e22e"}}
{"type":"message","id":"6f0dd71a","parentId":"b53c2ac3","timestamp":"2026-04-25T19:47:46.784Z","message":{"role":"toolResult","toolCallId":"call_function_386nzj0k1fsx_1","toolName":"read","content":[{"type":"text","text":"    \"\"\"Rotary Position Embedding (RoPE).\"\"\"\n    def __init__(self, dim, base=10000.0, rope_dims=0):\n        super().__init__()\n        self.rope_dims = rope_dims if rope_dims > 0 else dim\n        inv_freq = 1.0 / (base ** (torch.arange(0, self.rope_dims, 2) / self.rope_dims))\n        self.register_buffer(\"inv_freq\", inv_freq, persistent=False)\n        self._cos = None\n        self._sin = None\n    \n    def forward(self, seq_len, device, dtype):\n        if self._cos is None or self._sin is None or self._cos.size(-2) != seq_len:\n            t = torch.arange(seq_len, device=device, dtype=self.inv_freq.dtype)\n            freqs = torch.outer(t, self.inv_freq.to(device))\n            self._cos = freqs.cos()[None, None, :, :]\n            self._sin = freqs.sin()[None, None, :, :]\n\n[756 more lines in file. Use offset=290 to continue.]"}],"isError":false,"timestamp":1777146466784}}
{"type":"message","id":"4d8ea6a5","parentId":"6f0dd71a","timestamp":"2026-04-25T19:47:48.371Z","message":{"role":"assistant","content":[{"type":"thinking","thinking":"Let me look at the CastedLinear class and the run_ttt function to fix the dtype issue.","thinkingSignature":"2a6044c17bab9bd9c685cd05db29ed08ac4eb7deec2dfb696c8f426c64246b0d"},{"type":"toolCall","id":"call_function_uvggbub36sqf_1","name":"read","arguments":{"limit":15,"offset":267,"path":"/Users/dhruv2mars/dev/github/parameter-golf/train_kaggle.py"}}],"api":"anthropic-messages","provider":"minimax","model":"MiniMax-M2.7","usage":{"input":311,"output":82,"cacheRead":47872,"cacheWrite":0,"totalTokens":48265,"cost":{"input":0.00009329999999999999,"output":0.00009839999999999999,"cacheRead":0.00287232,"cacheWrite":0,"total":0.0030640199999999998}},"stopReason":"toolUse","timestamp":1777146466790,"responseId":"063c4d63e8438e82ee512c85d7b79990"}}
{"type":"message","id":"7e52d465","parentId":"4d8ea6a5","timestamp":"2026-04-25T19:47:48.390Z","message":{"role":"toolResult","toolCallId":"call_function_uvggbub36sqf_1","toolName":"read","content":[{"type":"text","text":"class CastedLinear(nn.Linear):\n    \"\"\"Linear that casts weights to float32 for computation.\"\"\"\n    def forward(self, x):\n        return F.linear(x, self.weight.float(), \n                        self.bias.float() if self.bias is not None else None)\n\n\nclass Rotary(nn.Module):\n    \"\"\"Rotary Position Embedding (RoPE).\"\"\"\n    def __init__(self, dim, base=10000.0, rope_dims=0):\n        super().__init__()\n        self.rope_dims = rope_dims if rope_dims > 0 else dim\n        inv_freq = 1.0 / (base ** (torch.arange(0, self.rope_dims, 2) / self.rope_dims))\n        self.register_buffer(\"inv_freq\", inv_freq, persistent=False)\n        self._cos = None\n\n[764 more lines in file. Use offset=282 to continue.]"}],"isError":false,"timestamp":1777146468390}}
{"type":"message","id":"716f6347","parentId":"7e52d465","timestamp":"2026-04-25T19:47:51.017Z","message":{"role":"assistant","content":[{"type":"thinking","thinking":"The CastedLinear always casts to float32. But when TTT uses autocast with bfloat16, the input x is bf16. We need to match the weight dtype to the input dtype instead of always using float32.\n\nLet me fix this:","thinkingSignature":"d95d6388061da94f6fd1c2021e17cd0b6388dd18146c2b6fee58d18fcf9ea91a"},{"type":"toolCall","id":"call_function_3e3bgug5cgoh_1","name":"edit","arguments":{"edits":[{"newText":"class CastedLinear(nn.Linear):\n    \"\"\"Linear that casts weights to match input dtype.\"\"\"\n    def forward(self, x):\n        return F.linear(x, self.weight.to(dtype=x.dtype), \n                        self.bias.to(dtype=x.dtype) if self.bias is not None else None)","oldText":"class CastedLinear(nn.Linear):\n    \"\"\"Linear that casts weights to float32 for computation.\"\"\"\n    def forward(self, x):\n        return F.linear(x, self.weight.float(), \n                        self.bias.float() if self.bias is not None else None)"}],"path":"/Users/dhruv2mars/dev/github/parameter-golf/train_kaggle.py"}}],"api":"anthropic-messages","provider":"minimax","model":"MiniMax-M2.7","usage":{"input":275,"output":245,"cacheRead":48160,"cacheWrite":0,"totalTokens":48680,"cost":{"input":0.0000825,"output":0.000294,"cacheRead":0.0028895999999999995,"cacheWrite":0,"total":0.0032660999999999996}},"stopReason":"toolUse","timestamp":1777146468395,"responseId":"063c4d64e5b1d16abdd500a022763cd0"}}
{"type":"message","id":"034405ad","parentId":"716f6347","timestamp":"2026-04-25T19:47:51.052Z","message":{"role":"toolResult","toolCallId":"call_function_3e3bgug5cgoh_1","toolName":"edit","content":[{"type":"text","text":"Successfully replaced 1 block(s) in /Users/dhruv2mars/dev/github/parameter-golf/train_kaggle.py."}],"details":{"diff":"      ...\n  264         return self.scale * F.rms_norm(x, (x.size(-1),))\n  265 \n  266 \n  267 class CastedLinear(nn.Linear):\n- 268     \"\"\"Linear that casts weights to float32 for computation.\"\"\"\n+ 268     \"\"\"Linear that casts weights to match input dtype.\"\"\"\n  269     def forward(self, x):\n- 270         return F.linear(x, self.weight.float(), \n- 271                         self.bias.float() if self.bias is not None else None)\n+ 270         return F.linear(x, self.weight.to(dtype=x.dtype), \n+ 271                         self.bias.to(dtype=x.dtype) if self.bias is not None else None)\n  272 \n  273 \n  274 class Rotary(nn.Module):\n  275     \"\"\"Rotary Position Embedding (RoPE).\"\"\"\n      ...","firstChangedLine":268},"isError":false,"timestamp":1777146471052}}
{"type":"message","id":"fa85f1ce","parentId":"034405ad","timestamp":"2026-04-25T19:47:52.256Z","message":{"role":"assistant","content":[{"type":"thinking","thinking":"Good. Now let me commit this fix and launch the TTT experiment again.","thinkingSignature":"94a7cdba940248b342b75b45b66fd5d0de0dd85db98ecdffe6a0397105521097"},{"type":"toolCall","id":"call_function_qfhx8y1jmfsk_1","name":"bash","arguments":{"command":"cd /Users/dhruv2mars/dev/github/parameter-golf && git add -A && git commit -m \"fix: CastedLinear dtype to match input\" 2>&1"}}],"api":"anthropic-messages","provider":"minimax","model":"MiniMax-M2.7","usage":{"input":250,"output":79,"cacheRead":48416,"cacheWrite":0,"totalTokens":48745,"cost":{"input":0.000075,"output":0.0000948,"cacheRead":0.00290496,"cacheWrite":0,"total":0.0030747599999999997}},"stopReason":"toolUse","timestamp":1777146471055,"responseId":"063c4d67f8072bedad2fce25514c3a2a"}}
{"type":"message","id":"3d61e9da","parentId":"fa85f1ce","timestamp":"2026-04-25T19:47:52.685Z","message":{"role":"toolResult","toolCallId":"call_function_qfhx8y1jmfsk_1","toolName":"bash","content":[{"type":"text","text":"[autoresearch/phase1-20260426 e8ecad4] fix: CastedLinear dtype to match input\n 2 files changed, 6 insertions(+), 3 deletions(-)\n create mode 100644 autoresearch.jsonl\n"}],"isError":false,"timestamp":1777146472685}}
{"type":"message","id":"78aade21","parentId":"3d61e9da","timestamp":"2026-04-25T19:47:54.880Z","message":{"role":"assistant","content":[{"type":"thinking","thinking":"Now let me launch a TTT test run with the fix.","thinkingSignature":"3e51478e455dee436e9212671eac4e71791be9d0a5cfcb35edf42828d5826987"},{"type":"toolCall","id":"call_function_zjtrh21k910e_1","name":"bash","arguments":{"command":"cd /Users/dhruv2mars/dev/github/parameter-golf && python3 experiments/pg_autoresearch.py run --name \"ar_ttt_fix_$(date +%Y%m%d)\" --env \"ITERATIONS=7000\" --env \"MAX_WALLCLOCK_SECONDS=1800\" --env \"TTT_ENABLED=1\" --env \"TTT_EPOCHS=3\" --env \"TTT_LR=0.005\" --env \"TTT_WARMUP_TOKENS=32768\" --timeout 2400 2>&1"}}],"api":"anthropic-messages","provider":"minimax","model":"MiniMax-M2.7","usage":{"input":153,"output":154,"cacheRead":48640,"cacheWrite":0,"totalTokens":48947,"cost":{"input":0.0000459,"output":0.0001848,"cacheRead":0.0029184,"cacheWrite":0,"total":0.0031490999999999997}},"stopReason":"toolUse","timestamp":1777146472686,"responseId":"063c4d6876378c44fa05d6bc25b4c142"}}
{"type":"message","id":"96c4c932","parentId":"78aade21","timestamp":"2026-04-25T20:24:47.371Z","message":{"role":"toolResult","toolCallId":"call_function_zjtrh21k910e_1","toolName":"bash","content":[{"type":"text","text":"{\"best_val_bpb\": 2.3821, \"compressed_bytes\": null, \"error\": \"Traceback (most recent call last):\\\\n\\\"}\\n,{\\\"stream_name\\\":\\\"stderr\\\",\\\"time\\\":1907.356984003,\\\"data\\\":\\\"[rank0]:   File \\\\\\\"/kaggle/src/script.py\\\\\\\", line 1054, in \\\\u003cmodule\\\\u003e\\\\n\\\"}\\n,{\\\"stream_name\\\":\\\"stderr\\\",\\\"time\\\":1907.356990756,\\\"data\\\":\\\"[rank0]:     train()\\\\n\\\"}\\n,{\\\"stream_name\\\":\\\"stderr\\\",\\\"time\\\":1907.356995758,\\\"data\\\":\\\"[rank0]:   File \\\\\\\"/kaggle/src/script.py\\\\\\\", line 1007, in train\\\\n\\\"}\\n,{\\\"stream_name\\\":\\\"stderr\\\",\\\"time\\\":1907.35701736,\\\"data\\\":\\\"[rank0]:     raw_model = run_ttt(raw_model, val_tokens, base_bytes_lut\", \"metric\": 2.3821, \"non_finite\": false, \"output\": \"/Users/dhruv2mars/dev/github/parameter-golf/experiments/kaggle_results/pg-auto-ar-ttt-fix-20260426-46474\", \"ref\": \"dhruv2mars/pg-auto-ar-ttt-fix-20260426-46474\", \"runtime_seconds\": null, \"status\": \"KernelWorkerStatus.ERROR\", \"steps\": 1200, \"ttt_val_bpb\": null, \"val_bpb\": 2.3821}\n"}],"isError":false,"timestamp":1777148687371}}
{"type":"message","id":"bb5bb54b","parentId":"96c4c932","timestamp":"2026-04-25T20:24:53.163Z","message":{"role":"assistant","content":[{"type":"thinking","thinking":"TTT still crashed. Let me check the new error:\n","thinkingSignature":"a8dce8b403ed43e2bc04c20a4b5f3f5f69499847b10d06e5e9bd1246195438a0"},{"type":"toolCall","id":"call_function_bffeldhazds1_1","name":"bash","arguments":{"command":"cat /Users/dhruv2mars/dev/github/parameter-golf/experiments/kaggle_results/pg-auto-ar-ttt-fix-20260426-46474/pg-auto-ar-ttt-fix-20260426-46474.log 2>/dev/null | python3 -c \"import sys,json; [print(json.loads(l).get('data','')[:300]) for l in sys.stdin if l.strip() and 'rank0' in l]\" | grep -A3 \"Traceback\\|RuntimeError\\|Error\" | head -40"}}],"api":"anthropic-messages","provider":"minimax","model":"MiniMax-M2.7","usage":{"input":49205,"output":149,"cacheRead":64,"cacheWrite":0,"totalTokens":49418,"cost":{"input":0.014761499999999999,"output":0.00017879999999999998,"cacheRead":0.00000384,"cacheWrite":0,"total":0.014944139999999998}},"stopReason":"toolUse","timestamp":1777148687372,"responseId":"063c56126ac7f8415213f6d7d293abe6"}}
{"type":"message","id":"3d1bc435","parentId":"bb5bb54b","timestamp":"2026-04-25T20:24:53.244Z","message":{"role":"toolResult","toolCallId":"call_function_bffeldhazds1_1","toolName":"bash","content":[{"type":"text","text":"Traceback (most recent call last):\n  File \"<string>\", line 1, in <module>\n    import sys,json; [print(json.loads(l).get('data','')[:300]) for l in sys.stdin if l.strip() and 'rank0' in l]\n                            ~~~~~~~~~~^^^\n  File \"/opt/homebrew/Cellar/python@3.14/3.14.4/Frameworks/Python.framework/Versions/3.14/lib/python3.14/json/__init__.py\", line 352, in loads\n    return _default_decoder.decode(s)\n           ~~~~~~~~~~~~~~~~~~~~~~~^^^\n  File \"/opt/homebrew/Cellar/python@3.14/3.14.4/Frameworks/Python.framework/Versions/3.14/lib/python3.14/json/decoder.py\", line 345, in decode\n    obj, end = self.raw_decode(s, idx=_w(s, 0).end())\n               ~~~~~~~~~~~~~~~^^^^^^^^^^^^^^^^^^^^^^^\n  File \"/opt/homebrew/Cellar/python@3.14/3.14.4/Frameworks/Python.framework/Versions/3.14/lib/python3.14/json/decoder.py\", line 363, in raw_decode\n    raise JSONDecodeError(\"Expecting value\", s, err.value) from None\njson.decoder.JSONDecodeError: Expecting value: line 1 column 1 (char 0)\n"}],"isError":false,"timestamp":1777148693244}}
{"type":"message","id":"d02a6028","parentId":"3d1bc435","timestamp":"2026-04-25T20:24:54.505Z","message":{"role":"assistant","content":[{"type":"thinking","thinking":"JSON parsing failed. Let me just look at the end of the log.\n","thinkingSignature":"4ad65d53afba5d6663a757667c407a262fee2477c4ed2ba0a1a804fff5331c3c"},{"type":"toolCall","id":"call_function_tg06i9gznjzc_1","name":"bash","arguments":{"command":"tail -80 /Users/dhruv2mars/dev/github/parameter-golf/experiments/kaggle_results/pg-auto-ar-ttt-fix-20260426-46474/pg-auto-ar-ttt-fix-20260426-46474.log"}}],"api":"anthropic-messages","provider":"minimax","model":"MiniMax-M2.7","usage":{"input":469,"output":90,"cacheRead":49248,"cacheWrite":0,"totalTokens":49807,"cost":{"input":0.0001407,"output":0.000108,"cacheRead":0.0029548799999999996,"cacheWrite":0,"total":0.0032035799999999997}},"stopReason":"toolUse","timestamp":1777148693245,"responseId":"063c56156c7a2c70d9271bad787541e1"}}
