{"type":"message","id":"4b792ff7","parentId":"f7b89056","timestamp":"2026-04-27T11:46:22.969Z","message":{"role":"assistant","content":[{"type":"thinking","thinking":"Now I can access the teamspace and list studios. Let me find the studio.","thinkingSignature":"81b4333c7ba781b3ac120fbd12e7ebe0b8015741f80b6868cb1e86ed76f81c58"},{"type":"toolCall","id":"call_function_66g3ynj3fjpk_1","name":"bash","arguments":{"command":"source ~/.venv/pg/bin/activate && python -c \"\nfrom lightning_sdk import Teamspace\nimport os\n\nos.environ['LIGHTNING_USER_ID'] = 'd52587bc-ec3c-4c9c-a2fa-71246e3d4020'\nos.environ['LIGHTNING_API_KEY'] = '25da12f4-1ad8-4e3f-8ba4-2a60fcebaabe'\n\nts = Teamspace(name='default-project', user='dhruv2mars')\nstudios = ts.studios\nprint('Studios:', studios)\n\" 2>&1"}}],"api":"anthropic-messages","provider":"minimax","model":"MiniMax-M2.7","usage":{"input":67219,"output":172,"cacheRead":9348,"cacheWrite":0,"totalTokens":76739,"cost":{"input":0.020165699999999998,"output":0.0002064,"cacheRead":0.0005608799999999999,"cacheWrite":0,"total":0.020932979999999997}},"stopReason":"toolUse","timestamp":1777290378386,"responseId":"063e7f8af1e67ffef804824926fb8933"}}
{"type":"message","id":"1ff29a61","parentId":"4b792ff7","timestamp":"2026-04-27T11:46:27.062Z","message":{"role":"toolResult","toolCallId":"call_function_66g3ynj3fjpk_1","toolName":"bash","content":[{"type":"text","text":"Studios: [Studio(name=parameter-golf, teamspace=Teamspace(name=default-project, owner=User(name=dhruv2mars)))]\n"}],"isError":false,"timestamp":1777290387062}}
{"type":"message","id":"0c3e80ab","parentId":"1ff29a61","timestamp":"2026-04-27T11:46:34.535Z","message":{"role":"assistant","content":[{"type":"thinking","thinking":"Found it. Now let me get the studio and run a command.","thinkingSignature":"6ba7a7948419ab14e31d62c2971c8d92dcc273c3a4b0d54e3d454c1b9fa730ec"},{"type":"toolCall","id":"call_function_i8i5nfdbjts5_1","name":"bash","arguments":{"command":"source ~/.venv/pg/bin/activate && python -c \"\nfrom lightning_sdk import Teamspace, Studio\nimport os\n\nos.environ['LIGHTNING_USER_ID'] = 'd52587bc-ec3c-4c9c-a2fa-71246e3d4020'\nos.environ['LIGHTNING_API_KEY'] = '25da12f4-1ad8-4e3f-8ba4-2a60fcebaabe'\n\nts = Teamspace(name='default-project', user='dhruv2mars')\nstudio = ts.studios[0]\nprint('Studio:', studio.name)\nprint('ID:', studio.id)\nprint('Methods:', [m for m in dir(studio) if not m.startswith('_')])\n\" 2>&1"}}],"api":"anthropic-messages","provider":"minimax","model":"MiniMax-M2.7","usage":{"input":67439,"output":199,"cacheRead":9348,"cacheWrite":0,"totalTokens":76986,"cost":{"input":0.0202317,"output":0.00023879999999999998,"cacheRead":0.0005608799999999999,"cacheWrite":0,"total":0.02103138}},"stopReason":"toolUse","timestamp":1777290387066,"responseId":"063e7f955679c484993855edaa84737c"}}
{"type":"message","id":"893c098b","parentId":"0c3e80ab","timestamp":"2026-04-27T11:46:38.403Z","message":{"role":"toolResult","toolCallId":"call_function_i8i5nfdbjts5_1","toolName":"bash","content":[{"type":"text","text":"Traceback (most recent call last):\n  File \"<string>\", line 11, in <module>\n    print('ID:', studio.id)\n                 ^^^^^^^^^\nAttributeError: 'Studio' object has no attribute 'id'\nStudio: parameter-golf\n\n\nCommand exited with code 1"}],"details":{},"isError":true,"timestamp":1777290398403}}
{"type":"message","id":"954349a1","parentId":"893c098b","timestamp":"2026-04-27T11:46:43.849Z","message":{"role":"assistant","content":[{"type":"thinking","thinking":"Let me see what's available.","thinkingSignature":"65c8cbd7b6e7d56ad41de3781d52c296f1f86ad9228085607e23b7a2529ba94f"},{"type":"toolCall","id":"call_function_hkbj80s6jn4h_1","name":"bash","arguments":{"command":"source ~/.venv/pg/bin/activate && python -c \"\nfrom lightning_sdk import Teamspace, Studio\nimport os\n\nos.environ['LIGHTNING_USER_ID'] = 'd52587bc-ec3c-4c9c-a2fa-71246e3d4020'\nos.environ['LIGHTNING_API_KEY'] = '25da12f4-1ad8-4e3f-8ba4-2a60fcebaabe'\n\nts = Teamspace(name='default-project', user='dhruv2mars')\nstudio = ts.studios[0]\nprint('Studio:', studio.name)\nprint('Status:', studio.status)\nprint('Methods:', [m for m in dir(studio) if not m.startswith('_') and callable(getattr(studio, m, None))])\n\" 2>&1"}}],"api":"anthropic-messages","provider":"minimax","model":"MiniMax-M2.7","usage":{"input":67712,"output":202,"cacheRead":9348,"cacheWrite":0,"totalTokens":77262,"cost":{"input":0.020313599999999998,"output":0.00024239999999999998,"cacheRead":0.0005608799999999999,"cacheWrite":0,"total":0.021116879999999998}},"stopReason":"toolUse","timestamp":1777290398407,"responseId":"063e7f9ee007fc54bf55caf0c666affa"}}
{"type":"message","id":"e52fd12a","parentId":"954349a1","timestamp":"2026-04-27T11:46:51.530Z","message":{"role":"toolResult","toolCallId":"call_function_hkbj80s6jn4h_1","toolName":"bash","content":[{"type":"text","text":"Studio: parameter-golf\nStatus: Running\nMethods: ['add_ports', 'create_assistant', 'delete', 'download_file', 'download_folder', 'duplicate', 'install_plugin', 'list_ports', 'rename', 'run', 'run_and_detach', 'run_job', 'run_mmt', 'run_plugin', 'run_with_exit_code', 'set_env', 'start', 'stop', 'switch_machine', 'uninstall_plugin', 'upload_file', 'upload_folder']\n"}],"isError":false,"timestamp":1777290411530}}
{"type":"message","id":"fb5a05b8","parentId":"e52fd12a","timestamp":"2026-04-27T11:46:59.788Z","message":{"role":"assistant","content":[{"type":"thinking","thinking":"There's a `run` method! Let me try running a command.","thinkingSignature":"a78b3a841169b9841e97c75dd9d4b22ad413d6f4119fd86ea5322cb65e9c1876"},{"type":"text","text":"Connected! Let me run a command:\n"},{"type":"toolCall","id":"call_function_3m0p3nxv56b1_1","name":"bash","arguments":{"command":"source ~/.venv/pg/bin/activate && python -c \"\nfrom lightning_sdk import Teamspace\nimport os\n\nos.environ['LIGHTNING_USER_ID'] = 'd52587bc-ec3c-4c9c-a2fa-71246e3d4020'\nos.environ['LIGHTNING_API_KEY'] = '25da12f4-1ad8-4e3f-8ba4-2a60fcebaabe'\n\nts = Teamspace(name='default-project', user='dhruv2mars')\nstudio = ts.studios[0]\n\n# Run a simple command\nresult = studio.run('pwd && ls -la')\nprint('Output:', result)\n\" 2>&1"}}],"api":"anthropic-messages","provider":"minimax","model":"MiniMax-M2.7","usage":{"input":68031,"output":194,"cacheRead":9348,"cacheWrite":0,"totalTokens":77573,"cost":{"input":0.0204093,"output":0.0002328,"cacheRead":0.0005608799999999999,"cacheWrite":0,"total":0.021202979999999996}},"stopReason":"toolUse","timestamp":1777290411534,"responseId":"063e7fae9ac237d353948568e00cd43e"}}
{"type":"message","id":"edebc488","parentId":"fb5a05b8","timestamp":"2026-04-27T11:47:03.850Z","message":{"role":"toolResult","toolCallId":"call_function_3m0p3nxv56b1_1","toolName":"bash","content":[{"type":"text","text":"Traceback (most recent call last):\n  File \"<string>\", line 9, in <module>\n    studio = ts.studios[0]\n             ~~~~~~~~~~^^^\nIndexError: list index out of range\n\n\nCommand exited with code 1"}],"details":{},"isError":true,"timestamp":1777290423850}}
{"type":"message","id":"a892e74b","parentId":"edebc488","timestamp":"2026-04-27T11:47:04.459Z","message":{"role":"assistant","content":[],"api":"anthropic-messages","provider":"minimax","model":"MiniMax-M2.7","usage":{"input":0,"output":0,"cacheRead":0,"cacheWrite":0,"totalTokens":0,"cost":{"input":0,"output":0,"cacheRead":0,"cacheWrite":0,"total":0}},"stopReason":"aborted","timestamp":1777290423854,"errorMessage":"Operation aborted"}}
{"type":"message","id":"7f57a3bb","parentId":"a892e74b","timestamp":"2026-04-27T11:47:38.800Z","message":{"role":"user","content":[{"type":"text","text":"teamspace name is: default-project\n\nand there are no studios there."}],"timestamp":1777290458786}}
{"type":"message","id":"911a6867","parentId":"7f57a3bb","timestamp":"2026-04-27T11:47:47.655Z","message":{"role":"assistant","content":[{"type":"thinking","thinking":"Let me list the studios properly.","thinkingSignature":"15a00a5052a581432d0ff719ece23cddb326d76da2ed7fb39a03a8a33e21df83"},{"type":"toolCall","id":"call_function_k7nl89wha2dk_1","name":"bash","arguments":{"command":"source ~/.venv/pg/bin/activate && python -c \"\nfrom lightning_sdk import Teamspace\nimport os\n\nos.environ['LIGHTNING_USER_ID'] = 'd52587bc-ec3c-4c9c-a2fa-71246e3d4020'\nos.environ['LIGHTNING_API_KEY'] = '25da12f4-1ad8-4e3f-8ba4-2a60fcebaabe'\n\nts = Teamspace(name='default-project')\nprint('TS:', ts)\nprint('Owner:', ts.owner)\nprint('Studios:', ts.studios)\n\" 2>&1"}}],"api":"anthropic-messages","provider":"minimax","model":"MiniMax-M2.7","usage":{"input":13,"output":163,"cacheRead":9348,"cacheWrite":68003,"totalTokens":77527,"cost":{"input":0.0000039,"output":0.00019559999999999998,"cacheRead":0.0005608799999999999,"cacheWrite":0.025501125,"total":0.026261505}},"stopReason":"toolUse","timestamp":1777290458800,"responseId":"063e7fdd97bf46fb1d6025188d17e5a8"}}
{"type":"message","id":"d38393b8","parentId":"911a6867","timestamp":"2026-04-27T11:47:48.726Z","message":{"role":"toolResult","toolCallId":"call_function_k7nl89wha2dk_1","toolName":"bash","content":[{"type":"text","text":"Traceback (most recent call last):\n  File \"<string>\", line 8, in <module>\n    ts = Teamspace(name='default-project')\n  File \"/Users/dhruv2mars/.venv/pg/lib/python3.14/site-packages/lightning_sdk/utils/logging.py\", line 37, in wrapper\n    return func(*args, **kwargs)\n  File \"/Users/dhruv2mars/.venv/pg/lib/python3.14/site-packages/lightning_sdk/teamspace.py\", line 120, in __init__\n    raise RuntimeError(\n        \"Neither user or org are specified, but one of them has to be the owner of the Teamspace\"\n    )\nRuntimeError: Neither user or org are specified, but one of them has to be the owner of the Teamspace\n\n\nCommand exited with code 1"}],"details":{},"isError":true,"timestamp":1777290468726}}
{"type":"message","id":"b0fb45bc","parentId":"d38393b8","timestamp":"2026-04-27T11:47:53.283Z","message":{"role":"assistant","content":[{"type":"thinking","thinking":"Let me list all the studios to see what teamspace they belong to.","thinkingSignature":"01dd5e079253c1a91921a76b352c9daa718748e95bb2885c91a1b6f4e63ed186"},{"type":"toolCall","id":"call_function_6b7k0542wpsj_1","name":"bash","arguments":{"command":"source ~/.venv/pg/bin/activate && python -c \"\nfrom lightning_sdk import User\nimport os\n\nos.environ['LIGHTNING_USER_ID'] = 'd52587bc-ec3c-4c9c-a2fa-71246e3d4020'\nos.environ['LIGHTNING_API_KEY'] = '25da12f4-1ad8-4e3f-8ba4-2a60fcebaabe'\n\nuser = User()\nprint('User:', user)\nprint('Teamspaces:', user.list_teamspaces())\n\" 2>&1"}}],"api":"anthropic-messages","provider":"minimax","model":"MiniMax-M2.7","usage":{"input":68368,"output":158,"cacheRead":9348,"cacheWrite":0,"totalTokens":77874,"cost":{"input":0.020510399999999998,"output":0.0001896,"cacheRead":0.0005608799999999999,"cacheWrite":0,"total":0.02126088}},"stopReason":"toolUse","timestamp":1777290468731,"responseId":"063e7fe5c11e036a93f004e024811fee"}}
{"type":"message","id":"69995d2d","parentId":"b0fb45bc","timestamp":"2026-04-27T11:47:54.435Z","message":{"role":"toolResult","toolCallId":"call_function_6b7k0542wpsj_1","toolName":"bash","content":[{"type":"text","text":"Traceback (most recent call last):\n  File \"<string>\", line 8, in <module>\n    user = User()\n  File \"/Users/dhruv2mars/.venv/pg/lib/python3.14/site-packages/lightning_sdk/utils/logging.py\", line 37, in wrapper\n    return func(*args, **kwargs)\n  File \"/Users/dhruv2mars/.venv/pg/lib/python3.14/site-packages/lightning_sdk/user.py\", line 30, in __init__\n    raise ValueError(\"Neither name is provided nor can the user be inferred from the environment variable!\")\nValueError: Neither name is provided nor can the user be inferred from the environment variable!\n\n\nCommand exited with code 1"}],"details":{},"isError":true,"timestamp":1777290474435}}
{"type":"message","id":"7fa3de05","parentId":"69995d2d","timestamp":"2026-04-27T11:47:59.523Z","message":{"role":"assistant","content":[{"type":"thinking","thinking":"Let me try to understand the structure better. Maybe I need to find the correct teamspace. Let me list all studios under the user.","thinkingSignature":"26067cdd77cbd60210bb619a547d1a5df0e1f6b2f654a9b33936c84b9f27c432"},{"type":"toolCall","id":"call_function_hhrlcqbrj0f1_1","name":"bash","arguments":{"command":"source ~/.venv/pg/bin/activate && python -c \"\nfrom lightning_sdk import Studio\nimport os\n\nos.environ['LIGHTNING_USER_ID'] = 'd52587bc-ec3c-4c9c-a2fa-71246e3d4020'\nos.environ['LIGHTNING_API_KEY'] = '25da12f4-1ad8-4e3f-8ba4-2a60fcebaabe'\n\n# Try listing all studios\nstudios = Studio.list_all()\nprint('All studios:', studios)\n\" 2>&1"}}],"api":"anthropic-messages","provider":"minimax","model":"MiniMax-M2.7","usage":{"input":68692,"output":171,"cacheRead":9348,"cacheWrite":0,"totalTokens":78211,"cost":{"input":0.0206076,"output":0.0002052,"cacheRead":0.0005608799999999999,"cacheWrite":0,"total":0.02137368}},"stopReason":"toolUse","timestamp":1777290474439,"responseId":"063e7fea53b89c3ec29cd6224eb26bd1"}}
{"type":"message","id":"c26d591a","parentId":"7fa3de05","timestamp":"2026-04-27T11:48:00.265Z","message":{"role":"toolResult","toolCallId":"call_function_hhrlcqbrj0f1_1","toolName":"bash","content":[{"type":"text","text":"Traceback (most recent call last):\n  File \"<string>\", line 9, in <module>\n    studios = Studio.list_all()\n              ^^^^^^^^^^^^^^^\nAttributeError: type object 'Studio' has no attribute 'list_all'\n\n\nCommand exited with code 1"}],"details":{},"isError":true,"timestamp":1777290480265}}
{"type":"message","id":"b3e21920","parentId":"c26d591a","timestamp":"2026-04-27T11:48:05.332Z","message":{"role":"assistant","content":[{"type":"thinking","thinking":"Let me look at what methods Studio has.","thinkingSignature":"9666427b34d46a054d8903f9f6bae3339da314b93fb29d0880f5314204e5c794"},{"type":"toolCall","id":"call_function_5n4eh1rb6egw_1","name":"bash","arguments":{"command":"source ~/.venv/pg/bin/activate && python -c \"\nfrom lightning_sdk import Studio\nimport inspect\n\n# Get all methods\nmethods = [m for m in dir(Studio) if not m.startswith('_')]\nprint('Studio methods:', methods)\n\n# Check for static methods\nprint('\\\\nStatic methods:')\nfor m in methods:\n    attr = getattr(Studio, m, None)\n    if callable(attr) and hasattr(attr, '__func__'):\n        try:\n            sig = inspect.signature(attr)\n            print(f'  {m}{sig}')\n        except:\n            pass\n\" 2>&1"}}],"api":"anthropic-messages","provider":"minimax","model":"MiniMax-M2.7","usage":{"input":68933,"output":160,"cacheRead":9348,"cacheWrite":0,"totalTokens":78441,"cost":{"input":0.020679899999999998,"output":0.000192,"cacheRead":0.0005608799999999999,"cacheWrite":0,"total":0.02143278}},"stopReason":"toolUse","timestamp":1777290480269,"responseId":"063e7ff1a7f65ee793daad9a588c7d75"}}
{"type":"message","id":"52697f57","parentId":"b3e21920","timestamp":"2026-04-27T11:48:06.047Z","message":{"role":"toolResult","toolCallId":"call_function_5n4eh1rb6egw_1","toolName":"bash","content":[{"type":"text","text":"Studio methods: ['add_ports', 'auto_shutdown', 'auto_shutdown_time', 'auto_sleep', 'auto_sleep_time', 'available_plugins', 'cloud_account', 'cluster', 'create_assistant', 'delete', 'download_file', 'download_folder', 'duplicate', 'env', 'install_plugin', 'installed_plugins', 'interruptible', 'list_ports', 'machine', 'name', 'owner', 'public_ip', 'rename', 'run', 'run_and_detach', 'run_job', 'run_mmt', 'run_plugin', 'run_with_exit_code', 'set_env', 'show_progress', 'start', 'status', 'stop', 'switch_machine', 'teamspace', 'uninstall_plugin', 'upload_file', 'upload_folder']\n\nStatic methods:\n"}],"isError":false,"timestamp":1777290486047}}
{"type":"message","id":"a141af32","parentId":"52697f57","timestamp":"2026-04-27T11:48:11.178Z","message":{"role":"assistant","content":[{"type":"thinking","thinking":"Let me try to list studios by using the Teamspace with the correct user.","thinkingSignature":"c8f988f2672fbe73a2bd77202e86d2f52f269b6ce49a33ac1d74ccf61ee89194"},{"type":"toolCall","id":"call_function_cr43r7505e9z_1","name":"bash","arguments":{"command":"source ~/.venv/pg/bin/activate && python -c \"\nfrom lightning_sdk import Teamspace, User\nimport os\n\nos.environ['LIGHTNING_USER_ID'] = 'd52587bc-ec3c-4c9c-a2fa-71246e3d4020'\nos.environ['LIGHTNING_API_KEY'] = '25da12f4-1ad8-4e3f-8ba4-2a60fcebaabe'\n\n# Get user info\nuser = User(name='dhruv2mars')\nprint('User:', user)\n\n# List all teamspaces\n# ts = Teamspace(name='default-project', user='dhruv2mars')\n# print('Studios:', ts.studios)\n\" 2>&1"}}],"api":"anthropic-messages","provider":"minimax","model":"MiniMax-M2.7","usage":{"input":69271,"output":197,"cacheRead":9348,"cacheWrite":0,"totalTokens":78816,"cost":{"input":0.0207813,"output":0.0002364,"cacheRead":0.0005608799999999999,"cacheWrite":0,"total":0.02157858}},"stopReason":"toolUse","timestamp":1777290486051,"responseId":"063e7ff6a3bd4a686c0211f71643596a"}}
{"type":"message","id":"ce844f8e","parentId":"a141af32","timestamp":"2026-04-27T11:48:12.350Z","message":{"role":"toolResult","toolCallId":"call_function_cr43r7505e9z_1","toolName":"bash","content":[{"type":"text","text":"User: User(name=dhruv2mars)\n"}],"isError":false,"timestamp":1777290492350}}
{"type":"message","id":"848e8969","parentId":"ce844f8e","timestamp":"2026-04-27T11:48:18.129Z","message":{"role":"assistant","content":[{"type":"thinking","thinking":"Let me try to get the teamspace with the user.","thinkingSignature":"84b856dc7ee22526246888325e0627273e67d901cecc55a73a1cbc859223c8c3"},{"type":"toolCall","id":"call_function_58u3dft31e71_1","name":"bash","arguments":{"command":"source ~/.venv/pg/bin/activate && python -c \"\nfrom lightning_sdk import Teamspace, User\nimport os\n\nos.environ['LIGHTNING_USER_ID'] = 'd52587bc-ec3c-4c9c-a2fa-71246e3d4020'\nos.environ['LIGHTNING_API_KEY'] = '25da12f4-1ad8-4e3f-8ba4-2a60fcebaabe'\n\n# List all studios for this user\nts = Teamspace(name='default-project', user='dhruv2mars')\nprint('TS name:', ts.name)\nprint('Owner:', ts.owner)\nprint('Studios count:', len(ts.studios))\nfor s in ts.studios:\n    print('  -', s.name, s.status)\n\" 2>&1"}}],"api":"anthropic-messages","provider":"minimax","model":"MiniMax-M2.7","usage":{"input":69493,"output":209,"cacheRead":9348,"cacheWrite":0,"totalTokens":79050,"cost":{"input":0.0208479,"output":0.00025079999999999997,"cacheRead":0.0005608799999999999,"cacheWrite":0,"total":0.021659579999999998}},"stopReason":"toolUse","timestamp":1777290492353,"responseId":"063e7ffd194f58d74b306d6522fc9f21"}}
{"type":"message","id":"e74ede5f","parentId":"848e8969","timestamp":"2026-04-27T11:48:23.454Z","message":{"role":"toolResult","toolCallId":"call_function_58u3dft31e71_1","toolName":"bash","content":[{"type":"text","text":"TS name: default-project\nOwner: User(name=dhruv2mars)\nStudios count: 0\n"}],"isError":false,"timestamp":1777290503454}}
{"type":"message","id":"daef6f25","parentId":"e74ede5f","timestamp":"2026-04-27T11:48:32.087Z","message":{"role":"assistant","content":[{"type":"thinking","thinking":"No studios in the default-project teamspace. Let me check what teamspaces exist.","thinkingSignature":"c00fa885bf37a355687ed8744579ec107da28f6d4a6cee312154e36f68e7d6f8"},{"type":"toolCall","id":"call_function_lq9ueyoj8l9l_1","name":"bash","arguments":{"command":"source ~/.venv/pg/bin/activate && python -c \"\nfrom lightning_sdk import User\nimport os\n\nos.environ['LIGHTNING_USER_ID'] = 'd52587bc-ec3c-4c9c-a2fa-71246e3d4020'\nos.environ['LIGHTNING_API_KEY'] = '25da12f4-1ad8-4e3f-8ba4-2a60fcebaabe'\n\nuser = User(name='dhruv2mars')\nprint('User:', user)\n\n# Check teamspaces attribute\nprint('Teamspaces:', user.teamspaces)\n\" 2>&1"}}],"api":"anthropic-messages","provider":"minimax","model":"MiniMax-M2.7","usage":{"input":69740,"output":171,"cacheRead":9348,"cacheWrite":0,"totalTokens":79259,"cost":{"input":0.020922,"output":0.0002052,"cacheRead":0.0005608799999999999,"cacheWrite":0,"total":0.02168808}},"stopReason":"toolUse","timestamp":1777290503457,"responseId":"063e800afc01812724142af4f9c1bc5b"}}
{"type":"message","id":"53c610ce","parentId":"daef6f25","timestamp":"2026-04-27T11:48:34.573Z","message":{"role":"toolResult","toolCallId":"call_function_lq9ueyoj8l9l_1","toolName":"bash","content":[{"type":"text","text":"User: User(name=dhruv2mars)\nTeamspaces: [Teamspace(name=default-project, owner=User(name=dhruv2mars))]\n"}],"isError":false,"timestamp":1777290514573}}
