{"type":"message","id":"f986e72b","parentId":"b70f5128","timestamp":"2026-04-25T18:12:31.299Z","message":{"role":"user","content":[{"type":"text","text":"yes"}],"timestamp":1777140751292}}
{"type":"message","id":"50e36074","parentId":"f986e72b","timestamp":"2026-04-25T18:12:49.880Z","message":{"role":"assistant","content":[{"type":"thinking","thinking":"Good, so we have a clear picture:\n- One Kaggle run = one val_bpb measurement\n- Sequential, manual monitoring\n- ~10-20 min per run\n- 30hr/week GPU quota, 12hr max session\n\nNow let me think about the autoresearch setup. The challenge is:\n\n1. The experiment loop needs to run commands locally\n2. But the training happens on Kaggle\n\nSo the \"run_experiment\" command would be:\n1. Push kernel to Kaggle\n2. Wait for results\n3. Extract val_bpb\n\nBut waiting is tricky - does pi handle long waits? Looking at the pg_autoresearch.py, it already has `wait()` functionality.\n\n\nThe critical decision is what metric to optimize. Since we're building toward 0.5-0.6 BPB but currently have ~2.65 BPB, the primary metric should be val_bpb where lower is better. The experiment loop will need to push code to Kaggle, monitor for completion, then extract and log the results. The key constraint is that full model convergence might require 12+ hours, but each run only gives us a single val_bpb data point, so the loop needs to balance quick iterations against the longer training horizon needed for meaningful optimization. Looking at the compute budget and expected scaling, the baseline 2.65 BPB at 2500 steps will likely drop to around 2.2-2.4 BPB with extended training in the first session, then potentially 1.8-2.0 BPB after pushing through multiple sessions. The challenge is deciding what to optimize now—architectural improvements like depth recurrence or TTT, tuning hyperparameters like learning rates and batch sizes, or preparing the model for longer training runs to get it below 1.0 BPB.\n","thinkingSignature":"7c747d4ddf694ae9c6634162ca03329380f68718a1f75bd43095cd5140d2085e"},{"type":"text","text":"\n\nOk, we're getting somewhere.\n\n**Fifth question: What are you planning to try FIRST?**\n\nYour 3 things (extend training, add TTT, add PPM) are ideas. But what does your gut say is the highest-impact change right now? And roughly how many runs do you think you'll need to get meaningful signal?\n\nI'm asking because autoresearch needs a clear optimization target, and I need to understand what \"a win\" looks like in a single run."}],"api":"anthropic-messages","provider":"minimax","model":"MiniMax-M2.7","usage":{"input":196,"output":466,"cacheRead":42432,"cacheWrite":0,"totalTokens":43094,"cost":{"input":0.0000588,"output":0.0005591999999999999,"cacheRead":0.0025459199999999997,"cacheWrite":0,"total":0.0031639199999999998}},"stopReason":"stop","timestamp":1777140751300,"responseId":"063c37113bda76ed5e95f34a62d33253"}}
{"type":"message","id":"94a045e8","parentId":"50e36074","timestamp":"2026-04-25T18:14:02.291Z","message":{"role":"user","content":[{"type":"text","text":"you need to think this yourself. coz to me, entended training (upwards of 6 hrs) will have meaningful improvemnets. but that doesnt help in autoresearch, coz there is no point if a single ietration is 6 hrs."}],"timestamp":1777140842284}}
{"type":"message","id":"c45dd330","parentId":"94a045e8","timestamp":"2026-04-25T18:14:34.400Z","message":{"role":"assistant","content":[{"type":"thinking","thinking":"Now we're getting to the core issue!\n\nThe user is pointing out a fundamental tension:\n- Extended training (6+ hours) will give meaningful improvements\n- But autoresearch loops need fast iteration (each run < 5-10 min)\n- You can't do hundreds of iterations if each iteration takes 6 hours\n\nThis is a critical insight. The user is essentially asking: how do we make autoresearch work when the thing that will actually move the needle (extended training) is incompatible with fast iteration?\n\nOptions:\n1. **Don't use autoresearch for the extended training phase** - Just run the long training sessions manually. Autoresearch is good for fast iteration (10-30 min runs) to find the right architecture/hyperparams, then you do one final extended run.\n\n2. **Hybrid approach**: Use autoresearch with short runs to optimize the architecture, then do a final extended training run.\n\n3. **Abandon sub-1 BPB goal** - It's too far for 10-min runs, even with TTT. Maybe aim for 1.5-2.0 BPB with what's possible.\n\n4. **Use the leaderboard differently** - The challenge allows submissions from extended training as \"non-record submissions\". Maybe the goal is to see how close you can get with unlimited compute within the 30hr/week quota.\n\nActually, looking at the README again - the \"Unlimited Compute Leaderboard & Non-record Submissions\" section shows people doing 4-hour runs. So extended training IS allowed and expected for pushing toward the target.\n\nSo the strategy might be:\n- **Autoresearch for rapid architecture exploration** (10-30 min runs)\n- **Final push with extended training** (6-12 hr runs)\n\nBut then what's the metric for autoresearch? The metric needs to be something that improves in short runs. Things that can improve in 10-30 min:\n- Architecture changes\n- Hyperparameter tuning\n- Quantization strategy\n- Loss landscape improvements\n\n\n- But NOT: scaling up training time (that's fixed for a given experiment)\n\nWait, but even this is tricky. If the baseline is 2.65 BPB and we need 0.5-0.6 BPB, that's a massive gap that probably can't be closed with architecture/hyperparameter tuning alone. Even the best leaderboard entries with 10-min runs get around 1.08 BPB. To get to 0.5-0.6 BPB, you NEED extended training. So the question becomes: what does autoresearch actually optimize for in this context?\n\nThe architecture choices that work best with extended training, finding config changes that reliably improve across short runs, or identifying what actually moves the needle. Maybe I'm overthinking the exact target - just improving BPB in each iteration is the real goal, whether that comes from architecture tweaks or hyperparameter adjustments. But wait, the leaderboard shows SOTA at 1.08 BPB with only 10-minute runs, while 4-hour runs on non-record submissions hit 1.2074 BPB - which is actually worse! This suggests extended training isn't necessarily the bottleneck. The key insight is that what matters is building the best model within the 16MB constraint, not necessarily training longer. So the autoresearch should focus on optimizing what's actually limiting performance at 10 minutes.\n\nLooking at the progression - the top results combine sequence parallelism at 8192 tokens, multi-layer recurrence, parallel residuals, and legal TTT, all hitting around 1.08 BPB in just 10 minutes on 8xH100 GPUs. The user's setup with 2xT4 GPUs and current 2.65 BPB baseline is a completely different scenario. For T4 specifically, I'd expect around 3x slower performance than H100 SXM, so a 10-minute run might only complete a quarter of the training steps. The real constraint is that each iteration is slow due to the hardware limitations, and achieving sub-1 BPB targets requires fundamentally different optimizations - likely extending training time significantly and potentially combining neural approaches with hybrid methods like PPM to bridge that gap. The key constraint is that a single training run on T4 can only execute a limited number of iterations within the time window. I need to understand how many steps fit into one 6-12 hour session to properly calibrate the optimization strategy.\n","thinkingSignature":"d73ce8c17e77f235a5b2939cac786439858f0c182b789443d07dadb6793bb040"},{"type":"text","text":"\n\nEXCELLENT point. You've identified the core tension:\n\n**Extended training = real gains, but useless for autoresearch (too slow to iterate)**\n\nSo let me reframe. The goal isn't to use autoresearch for the \"winning\" run. It's to use autoresearch for **architecture exploration** — finding the config that will perform best when you DO run it extended.\n\n**Sixth question: How many steps can you run in a 6-hour session on 2xT4?**\n\nRough estimate is fine. This tells me how much \"training budget\" you get per experiment. Is it 500 steps? 2000? 10000?"}],"api":"anthropic-messages","provider":"minimax","model":"MiniMax-M2.7","usage":{"input":160,"output":1019,"cacheRead":42624,"cacheWrite":0,"totalTokens":43803,"cost":{"input":0.000048,"output":0.0012228,"cacheRead":0.00255744,"cacheWrite":0,"total":0.00382824}},"stopReason":"stop","timestamp":1777140842292,"responseId":"063c376db1900b7031fa2c54affaf1cb"}}
{"type":"message","id":"22594bec","parentId":"c45dd330","timestamp":"2026-04-25T18:14:57.739Z","message":{"role":"user","content":[{"type":"text","text":"no idea how much."}],"timestamp":1777140897732}}
{"type":"message","id":"1c2a06c5","parentId":"22594bec","timestamp":"2026-04-25T18:15:09.711Z","message":{"role":"assistant","content":[{"type":"thinking","thinking":"The user doesn't know how many steps they can get in 6 hours on 2xT4.\n\nI need to either:\n1. Calculate based on their current timings\n2. Ask them to estimate based on their 10-min runs\n\nLet me check their logs to understand steps-per-time ratio.\n\nFrom the state file, 10 minutes got 110 steps.\n- 10 min = 600 seconds\n- 110 steps in 600s = ~5.5 seconds/step\n\nSo for 6 hours (21600 seconds):\n- 21600 / 5.5 = ~3927 steps\n\nFor 12 hours:\n- 43200 / 5.5 = ~7855 steps\n\nThat's actually decent for iteration! Even 4K steps should show meaningful signal.\n\nFor autoresearch, this means:\n- 6hr runs = ~4000 steps per iteration\n- 12hr runs = ~8000 steps per iteration\n\nThat's workable for architecture exploration.\n","thinkingSignature":"79cc13bfc409e71e2c116c4eeb82ceb905f348f283e107e836f9bd8c20f6936d"},{"type":"text","text":"\n\nLet me check your training logs to estimate.\n"},{"type":"toolCall","id":"call_function_2bbja7743k04_1","name":"bash","arguments":{"command":"head -20 /Users/dhruv2mars/dev/github/parameter-golf/logs/*.txt 2>/dev/null | head -50 || ls /Users/dhruv2mars/dev/github/parameter-golf/logs/"}},{"type":"toolCall","id":"call_function_2bbja7743k04_2","name":"bash","arguments":{"command":"grep -h \"step:\" /Users/dhruv2mars/dev/github/parameter-golf/experiments/kaggle_results/*/*.txt 2>/dev/null | tail -20"}}],"api":"anthropic-messages","provider":"minimax","model":"MiniMax-M2.7","usage":{"input":178,"output":334,"cacheRead":42752,"cacheWrite":0,"totalTokens":43264,"cost":{"input":0.0000534,"output":0.0004008,"cacheRead":0.0025651199999999997,"cacheWrite":0,"total":0.00301932}},"stopReason":"toolUse","timestamp":1777140897740,"responseId":"063c37a435bc92ec913956cc477dcf61"}}
{"type":"message","id":"0833ec40","parentId":"1c2a06c5","timestamp":"2026-04-25T18:15:09.746Z","message":{"role":"toolResult","toolCallId":"call_function_2bbja7743k04_1","toolName":"bash","content":[{"type":"text","text":"(no output)"}],"isError":false,"timestamp":1777140909746}}
{"type":"message","id":"88c998ec","parentId":"0833ec40","timestamp":"2026-04-25T18:15:09.746Z","message":{"role":"toolResult","toolCallId":"call_function_2bbja7743k04_2","toolName":"bash","content":[{"type":"text","text":"(no output)"}],"isError":false,"timestamp":1777140909746}}
{"type":"message","id":"60312aed","parentId":"88c998ec","timestamp":"2026-04-25T18:15:13.858Z","message":{"role":"assistant","content":[{"type":"thinking","thinking":"Let me look for any logs or data about actual runtime performance on T4.\n","thinkingSignature":"21ad1d5d33bd86fffdf613ec6e0f9f5612dd799a01c2d386010ce269651ef819"},{"type":"toolCall","id":"call_function_5zqwv7pevkq5_1","name":"bash","arguments":{"command":"find /Users/dhruv2mars/dev/github/parameter-golf -name \"*.log\" -o -name \"*.txt\" | xargs grep -l \"step:\" 2>/dev/null | head -5"}},{"type":"toolCall","id":"call_function_5zqwv7pevkq5_2","name":"bash","arguments":{"command":"grep -rh \"step:\" /Users/dhruv2mars/dev/github/parameter-golf/records/ 2>/dev/null | grep -v \".py\" | tail -20"}}],"api":"anthropic-messages","provider":"minimax","model":"MiniMax-M2.7","usage":{"input":199,"output":142,"cacheRead":42880,"cacheWrite":0,"totalTokens":43221,"cost":{"input":0.000059699999999999994,"output":0.0001704,"cacheRead":0.0025727999999999997,"cacheWrite":0,"total":0.0028028999999999997}},"stopReason":"toolUse","timestamp":1777140909749,"responseId":"063c37ae4a3f600452c893e668ebd777"}}
{"type":"message","id":"142b4b77","parentId":"60312aed","timestamp":"2026-04-25T18:15:14.063Z","message":{"role":"toolResult","toolCallId":"call_function_5zqwv7pevkq5_1","toolName":"bash","content":[{"type":"text","text":"/Users/dhruv2mars/dev/github/parameter-golf/records/track_10min_16mb/2026-03-19_Seq2048_FP16Emb_TunedLR/train_seed1337.log\n/Users/dhruv2mars/dev/github/parameter-golf/records/track_10min_16mb/2026-03-19_Seq2048_FP16Emb_TunedLR/train_seed3.log\n/Users/dhruv2mars/dev/github/parameter-golf/records/track_10min_16mb/2026-03-19_Seq2048_FP16Emb_TunedLR/train_seed42.log\n/Users/dhruv2mars/dev/github/parameter-golf/records/track_10min_16mb/2026-03-18_LowerLR/train.log\n/Users/dhruv2mars/dev/github/parameter-golf/records/track_10min_16mb/2026-03-19_MixedQuant_Int6Int8_SlidingWindow/train.log\n"}],"isError":false,"timestamp":1777140914063}}
{"type":"message","id":"6e4644fa","parentId":"142b4b77","timestamp":"2026-04-25T18:15:14.063Z","message":{"role":"toolResult","toolCallId":"call_function_5zqwv7pevkq5_2","toolName":"bash","content":[{"type":"text","text":"step:327400/500000 train_loss:2.0451 train_time:14311217ms step_avg:43.71ms\nstep:327600/500000 train_loss:2.0360 train_time:14319952ms step_avg:43.71ms\nstep:327800/500000 train_loss:2.0273 train_time:14328692ms step_avg:43.71ms\nstep:328000/500000 train_loss:2.1318 train_time:14337428ms step_avg:43.71ms\nstep:328200/500000 train_loss:2.0219 train_time:14346167ms step_avg:43.71ms\nstep:328400/500000 train_loss:1.8702 train_time:14354904ms step_avg:43.71ms\nstep:328600/500000 train_loss:2.2112 train_time:14363648ms step_avg:43.71ms\nstep:328800/500000 train_loss:2.0007 train_time:14372507ms step_avg:43.71ms\nstep:329000/500000 train_loss:1.9333 train_time:14381249ms step_avg:43.71ms\nstep:329200/500000 train_loss:1.8833 train_time:14389989ms step_avg:43.71ms\nstep:329400/500000 train_loss:1.9639 train_time:14398731ms step_avg:43.71ms\nstep:329430/500000 val_loss:1.9837 val_bpb:1.1749 train_time:14400039ms step_avg:43.71ms\nstopping_early: wallclock_cap train_time:14400039ms step:329430/500000\n                log0(f\"warmup_step:{warmup_step + 1}/{args.warmup_steps}\")\n            log0(f\"step:{step}/{args.iterations} val_loss:{val_loss:.4f} val_bpb:{val_bpb:.4f} \"\n        if last_step:\n                log0(f\"stopping_early: wallclock_cap train_time:{training_time_ms:.0f}ms step:{step}/{args.iterations}\")\n                log0(f\"QAT activated at step:{step} elapsed:{elapsed_ms:.0f}ms\")\n            log0(f\"step:{step}/{args.iterations} train_loss:{train_loss.item():.4f} \"\n                 f\"train_time:{approx_training_time_ms:.0f}ms step_avg:{approx_training_time_ms / step:.2f}ms\")\n"}],"isError":false,"timestamp":1777140914063}}
{"type":"message","id":"14807176","parentId":"6e4644fa","timestamp":"2026-04-25T18:15:26.862Z","message":{"role":"assistant","content":[{"type":"thinking","thinking":"I found useful data. Looking at the logs:1. One run with 500K iterations - they did 329K steps in ~14.4 seconds? Wait, that seems wrong. Let me look more carefully.The \"train_time:14337428ms\" = 14337 seconds = ~4 hours for 328K steps.So on H100s (8xH100s), they did 328K steps in ~4 hours. That's ~43.7ms per step.\n\nFor 2xT4, T4 is ~6x slower per step than H100. So 43.7ms * 6 = ~262ms per step.\n\n\nLet me verify this against the 10-minute runs. On the SOTA config with T4, 2500 steps in 10 minutes gives me about 240ms per step, which matches the ~262ms estimate. So for 6 hours on 2xT4, I can estimate roughly 87K steps based on the 240ms per step timing.\n\nNow I'm looking at the 8xH100 500K iteration run, which shows 329K steps completed in 14.4 seconds of training time. That's only about 43.7ms per step on H100, which seems suspiciously fast. If 2500 steps take 10 minutes on 2xT4, then 2500 steps would be around 600 seconds, giving me 240ms per step. For a 6-hour session that would be roughly 90K steps total, so I should check what iteration counts were actually used in the experiments.\n","thinkingSignature":"015613fef9931a3b4562e072d3d65bb82a189c7ff313677098f1528c04c97175"},{"type":"text","text":"\n\nFound data. Let me analyze:\n"},{"type":"toolCall","id":"call_function_6pr2je5jrr75_1","name":"read","arguments":{"limit":100,"path":"/Users/dhruv2mars/dev/github/parameter-golf/records/track_10min_16mb/2026-03-19_Seq2048_FP16Emb_TunedLR/train_seed42.log"}},{"type":"toolCall","id":"call_function_6pr2je5jrr75_2","name":"bash","arguments":{"command":"grep -h \"step_avg\\|train_time:\" /Users/dhruv2mars/dev/github/parameter-golf/records/track_10min_16mb/*/train*.log 2>/dev/null | grep \"step_avg\" | head -10"}}],"api":"anthropic-messages","provider":"minimax","model":"MiniMax-M2.7","usage":{"input":921,"output":486,"cacheRead":43072,"cacheWrite":0,"totalTokens":44479,"cost":{"input":0.0002763,"output":0.0005832,"cacheRead":0.0025843199999999998,"cacheWrite":0,"total":0.0034438199999999998}},"stopReason":"toolUse","timestamp":1777140914064,"responseId":"063c37b23beeb14d824af799572ee4b5"}}
