{"type":"message","id":"24603986","parentId":"19411303","timestamp":"2026-04-26T02:03:55.843Z","message":{"role":"toolResult","toolCallId":"call_function_4eu24d0qhlms_1","toolName":"log_experiment","content":[{"type":"text","text":"Logged #11: discard — Shorter warmdown (0.6): 2.387, slightly worse\nBaseline val_bpb: 2.38bpb\nSecondary: artifact_mb: 12.10mb (0.0%)  best_val_bpb: 2.39 (+0.3%)  steps: 1,200 (+3.9%)\n📋 ASI: conclusion: shorter warmdown slightly worse | hyperparam: warmdown=0.6\n(11 experiments)\n📝 Git: reverted changes (discard) — autoresearch files preserved"}],"details":{"experiment":{"commit":"de16801","metric":2.3871,"metrics":{"artifact_mb":12.1,"best_val_bpb":2.3871,"steps":1200},"status":"discard","description":"Shorter warmdown (0.6): 2.387, slightly worse","timestamp":1777169035789,"segment":0,"confidence":null,"iterationTokens":null,"asi":{"conclusion":"shorter warmdown slightly worse","hyperparam":"warmdown=0.6"}},"state":{"results":[{"commit":"a672845","metric":2.379,"metrics":{"best_val_bpb":2.379,"steps":1155,"artifact_mb":12.1},"status":"keep","description":"30-min baseline: 2.379 val_bpb, 1155 steps, still improving","timestamp":1777144208804,"segment":0,"confidence":null,"iterationTokens":null,"asi":{"baseline_30min":true,"steps_completed":1155,"max_iterations":7000,"pct_exhausted":16.5,"loss_still_declining":true,"artifact_mb":12.1,"gap_to_sub1":1.879}},{"commit":"a672845","metric":2.3857,"metrics":{"artifact_mb":12.3,"best_val_bpb":2.3857,"steps":1200},"status":"discard","description":"TTT crashed: dtype mismatch in CastedLinear (bf16/float32)","timestamp":1777146462942,"segment":0,"confidence":null,"iterationTokens":null,"asi":{"error":"mat1 mat2 dtype mismatch bf16 vs float","fix_needed":"CastedLinear cast weights to match autocast dtype","ttt_broken":true}},{"commit":"e8ecad4","metric":2.3821,"metrics":{"artifact_mb":12.3,"best_val_bpb":2.3821,"steps":1200},"status":"discard","description":"TTT still broken: OOM from attention .float() creating 32GB matrix","timestamp":1777148696907,"segment":0,"confidence":null,"iterationTokens":null,"asi":{"error":"OOM: attention .float() creates 32GB matrix","fix_needed":"Remove .float() or use bf16 for attention scores","ttt_broken":true}},{"commit":"de16801","metric":2.4351,"metrics":{"artifact_mb":12.3,"best_val_bpb":2.4351,"steps":1200},"status":"discard","description":"TTT still OOM: eval loop also has memory issues","timestamp":1777150932661,"segment":0,"confidence":null,"iterationTokens":null,"asi":{"error":"OOM still in TTT eval loop","fix_needed":"Reduce eval tokens per chunk, or skip TTT for now","ttt_broken":true}},{"commit":"de16801","metric":2.4265,"metrics":{"artifact_mb":12.3,"best_val_bpb":2.4265,"steps":900},"status":"discard","description":"Wider arch (9L-640d) too slow, timed out at 900 steps","timestamp":1777155540944,"segment":0,"confidence":null,"iterationTokens":null,"asi":{"arch":"9L-640d-10H/5KV","conclusion":"wider model too slow, hit wallclock before converging","error":"SIGTERM/SIGABRT - wallclock timeout","result":"worse than baseline","steps":900}},{"commit":"de16801","metric":2.4179,"metrics":{"artifact_mb":12.1,"best_val_bpb":2.4179,"steps":1000},"status":"discard","description":"Deeper/narrower (13L-480d): 2.418 val_bpb, worse","timestamp":1777157778800,"segment":0,"confidence":null,"iterationTokens":null,"asi":{"arch":"13L-480d-8H/4KV","conclusion":"narrower model underfits","result":"worse than baseline"}},{"commit":"de16801","metric":2.4755,"metrics":{"artifact_mb":12.1,"best_val_bpb":2.4755,"steps":1600},"status":"discard","description":"Seq1024 + batch4096: 2.48 val_bpb, worse","timestamp":1777160126335,"segment":0,"confidence":null,"iterationTokens":null,"asi":{"arch":"11L-512d, seq_len=1024","conclusion":"longer context underfits - fewer steps per time","result":"worse than baseline"}},{"commit":"de16801","metric":2.4523,"metrics":{"artifact_mb":12.1,"best_val_bpb":2.4523,"steps":900},"status":"discard","description":"More depth loops (3x, layers 3-6): 2.452 val_bpb","timestamp":1777162354973,"segment":0,"confidence":null,"iterationTokens":null,"asi":{"arch":"11L-512d, 3 loops on layers 3-6","conclusion":"more depth recurrence = slower = fewer steps = worse","result":"worse than baseline"}},{"commit":"de16801","metric":2.3948,"metrics":{"artifact_mb":12.1,"best_val_bpb":2.3948,"steps":1200},"status":"discard","description":"Higher LR (0.002): 2.395, slightly worse","timestamp":1777164584746,"segment":0,"confidence":null,"iterationTokens":null,"asi":{"conclusion":"higher LR converges faster but worse final","hyperparam":"lr=0.002"}},{"commit":"de16801","metric":2.382,"metrics":{"artifact_mb":12.1,"best_val_bpb":2.382,"steps":1100},"status":"keep","description":"Lower LR (0.0005): 2.382, within noise of baseline","timestamp":1777166805914,"segment":0,"confidence":null,"iterationTokens":null,"asi":{"conclusion":"lower LR marginally worse but within noise - may generalize better","hyperparam":"lr=0.0005"}},{"commit":"de16801","metric":2.3871,"metrics":{"artifact_mb":12.1,"best_val_bpb":2.3871,"steps":1200},"status":"discard","description":"Shorter warmdown (0.6): 2.387, slightly worse","timestamp":1777169035789,"segment":0,"confidence":null,"iterationTokens":null,"asi":{"conclusion":"shorter warmdown slightly worse","hyperparam":"warmdown=0.6"}}],"bestMetric":2.379,"bestDirection":"lower","metricName":"val_bpb","metricUnit":"bpb","secondaryMetrics":[{"name":"best_val_bpb","unit":""},{"name":"steps","unit":""},{"name":"artifact_mb","unit":"mb"}],"name":"Parameter Golf - Find Best Config for Sub-1 BPB","currentSegment":0,"maxExperiments":null,"confidence":null},"wallClockSeconds":null},"isError":false,"timestamp":1777169035843}}
{"type":"message","id":"d2ce9aee","parentId":"24603986","timestamp":"2026-04-26T02:03:57.856Z","message":{"role":"assistant","content":[{"type":"thinking","thinking":"Let me try longer warmdown and also try lower weight decay, which could help generalization.","thinkingSignature":"2717dbbb3adcaedd9abb3d7bb40f4546ab3baafcfebf255062feea75099b123c"},{"type":"toolCall","id":"call_function_tifssfrykm8v_1","name":"bash","arguments":{"command":"cd /Users/dhruv2mars/dev/github/parameter-golf && python3 experiments/pg_autoresearch.py run --name \"ar_wd05_$(date +%Y%m%d)\" --env \"ITERATIONS=7000\" --env \"MAX_WALLCLOCK_SECONDS=1800\" --env \"WEIGHT_DECAY=0.05\" --timeout 2400 2>&1"}}],"api":"anthropic-messages","provider":"minimax","model":"MiniMax-M2.7","usage":{"input":315,"output":128,"cacheRead":61248,"cacheWrite":0,"totalTokens":61691,"cost":{"input":0.00009449999999999999,"output":0.0001536,"cacheRead":0.0036748799999999997,"cacheWrite":0,"total":0.0039229799999999995}},"stopReason":"toolUse","timestamp":1777169035846,"responseId":"063ca58cfed001b78189df8b914ea664"}}
{"type":"message","id":"fe16f7dd","parentId":"d2ce9aee","timestamp":"2026-04-26T02:40:48.033Z","message":{"role":"toolResult","toolCallId":"call_function_tifssfrykm8v_1","toolName":"bash","content":[{"type":"text","text":"{\"best_val_bpb\": 2.3903, \"compressed_bytes\": null, \"error\": null, \"metric\": 2.3903, \"non_finite\": false, \"output\": \"/Users/dhruv2mars/dev/github/parameter-golf/experiments/kaggle_results/pg-auto-ar-wd05-20260426-69037\", \"ref\": \"dhruv2mars/pg-auto-ar-wd05-20260426-69037\", \"runtime_seconds\": null, \"status\": \"KernelWorkerStatus.COMPLETE\", \"steps\": 1100, \"ttt_val_bpb\": null, \"val_bpb\": 2.3903}\n"}],"isError":false,"timestamp":1777171248033}}
{"type":"message","id":"a0c29765","parentId":"fe16f7dd","timestamp":"2026-04-26T02:40:53.879Z","message":{"role":"assistant","content":[{"type":"thinking","thinking":"2.3903 - slightly worse. Let's continue.","thinkingSignature":"5ed21f15faef0a7905c6d68a31ff773ea816c51d323abe84ccb76d4336ab4240"},{"type":"toolCall","id":"call_function_2w78ketgzcpc_1","name":"log_experiment","arguments":{"asi":{"conclusion":"lower weight decay slightly worse","hyperparam":"wd=0.05"},"commit":"de16801","description":"Lower WD (0.05): 2.390, slightly worse","metric":2.3903,"metrics":{"artifact_mb":12.1,"best_val_bpb":2.3903,"steps":1100},"status":"discard"}}],"api":"anthropic-messages","provider":"minimax","model":"MiniMax-M2.7","usage":{"input":61828,"output":154,"cacheRead":0,"cacheWrite":0,"totalTokens":61982,"cost":{"input":0.0185484,"output":0.0001848,"cacheRead":0,"cacheWrite":0,"total":0.0187332}},"stopReason":"toolUse","timestamp":1777171248035,"responseId":"063cae327e9008457c2e2bf463a55d9b"}}
{"type":"message","id":"9601fe07","parentId":"a0c29765","timestamp":"2026-04-26T02:40:53.935Z","message":{"role":"toolResult","toolCallId":"call_function_2w78ketgzcpc_1","toolName":"log_experiment","content":[{"type":"text","text":"Logged #12: discard — Lower WD (0.05): 2.390, slightly worse\nBaseline val_bpb: 2.38bpb\nSecondary: artifact_mb: 12.10mb (0.0%)  best_val_bpb: 2.39 (+0.5%)  steps: 1,100 (-4.8%)\n📋 ASI: conclusion: lower weight decay slightly worse | hyperparam: wd=0.05\n(12 experiments)\n📝 Git: reverted changes (discard) — autoresearch files preserved"}],"details":{"experiment":{"commit":"de16801","metric":2.3903,"metrics":{"artifact_mb":12.1,"best_val_bpb":2.3903,"steps":1100},"status":"discard","description":"Lower WD (0.05): 2.390, slightly worse","timestamp":1777171253884,"segment":0,"confidence":null,"iterationTokens":null,"asi":{"conclusion":"lower weight decay slightly worse","hyperparam":"wd=0.05"}},"state":{"results":[{"commit":"a672845","metric":2.379,"metrics":{"best_val_bpb":2.379,"steps":1155,"artifact_mb":12.1},"status":"keep","description":"30-min baseline: 2.379 val_bpb, 1155 steps, still improving","timestamp":1777144208804,"segment":0,"confidence":null,"iterationTokens":null,"asi":{"baseline_30min":true,"steps_completed":1155,"max_iterations":7000,"pct_exhausted":16.5,"loss_still_declining":true,"artifact_mb":12.1,"gap_to_sub1":1.879}},{"commit":"a672845","metric":2.3857,"metrics":{"artifact_mb":12.3,"best_val_bpb":2.3857,"steps":1200},"status":"discard","description":"TTT crashed: dtype mismatch in CastedLinear (bf16/float32)","timestamp":1777146462942,"segment":0,"confidence":null,"iterationTokens":null,"asi":{"error":"mat1 mat2 dtype mismatch bf16 vs float","fix_needed":"CastedLinear cast weights to match autocast dtype","ttt_broken":true}},{"commit":"e8ecad4","metric":2.3821,"metrics":{"artifact_mb":12.3,"best_val_bpb":2.3821,"steps":1200},"status":"discard","description":"TTT still broken: OOM from attention .float() creating 32GB matrix","timestamp":1777148696907,"segment":0,"confidence":null,"iterationTokens":null,"asi":{"error":"OOM: attention .float() creates 32GB matrix","fix_needed":"Remove .float() or use bf16 for attention scores","ttt_broken":true}},{"commit":"de16801","metric":2.4351,"metrics":{"artifact_mb":12.3,"best_val_bpb":2.4351,"steps":1200},"status":"discard","description":"TTT still OOM: eval loop also has memory issues","timestamp":1777150932661,"segment":0,"confidence":null,"iterationTokens":null,"asi":{"error":"OOM still in TTT eval loop","fix_needed":"Reduce eval tokens per chunk, or skip TTT for now","ttt_broken":true}},{"commit":"de16801","metric":2.4265,"metrics":{"artifact_mb":12.3,"best_val_bpb":2.4265,"steps":900},"status":"discard","description":"Wider arch (9L-640d) too slow, timed out at 900 steps","timestamp":1777155540944,"segment":0,"confidence":null,"iterationTokens":null,"asi":{"arch":"9L-640d-10H/5KV","conclusion":"wider model too slow, hit wallclock before converging","error":"SIGTERM/SIGABRT - wallclock timeout","result":"worse than baseline","steps":900}},{"commit":"de16801","metric":2.4179,"metrics":{"artifact_mb":12.1,"best_val_bpb":2.4179,"steps":1000},"status":"discard","description":"Deeper/narrower (13L-480d): 2.418 val_bpb, worse","timestamp":1777157778800,"segment":0,"confidence":null,"iterationTokens":null,"asi":{"arch":"13L-480d-8H/4KV","conclusion":"narrower model underfits","result":"worse than baseline"}},{"commit":"de16801","metric":2.4755,"metrics":{"artifact_mb":12.1,"best_val_bpb":2.4755,"steps":1600},"status":"discard","description":"Seq1024 + batch4096: 2.48 val_bpb, worse","timestamp":1777160126335,"segment":0,"confidence":null,"iterationTokens":null,"asi":{"arch":"11L-512d, seq_len=1024","conclusion":"longer context underfits - fewer steps per time","result":"worse than baseline"}},{"commit":"de16801","metric":2.4523,"metrics":{"artifact_mb":12.1,"best_val_bpb":2.4523,"steps":900},"status":"discard","description":"More depth loops (3x, layers 3-6): 2.452 val_bpb","timestamp":1777162354973,"segment":0,"confidence":null,"iterationTokens":null,"asi":{"arch":"11L-512d, 3 loops on layers 3-6","conclusion":"more depth recurrence = slower = fewer steps = worse","result":"worse than baseline"}},{"commit":"de16801","metric":2.3948,"metrics":{"artifact_mb":12.1,"best_val_bpb":2.3948,"steps":1200},"status":"discard","description":"Higher LR (0.002): 2.395, slightly worse","timestamp":1777164584746,"segment":0,"confidence":null,"iterationTokens":null,"asi":{"conclusion":"higher LR converges faster but worse final","hyperparam":"lr=0.002"}},{"commit":"de16801","metric":2.382,"metrics":{"artifact_mb":12.1,"best_val_bpb":2.382,"steps":1100},"status":"keep","description":"Lower LR (0.0005): 2.382, within noise of baseline","timestamp":1777166805914,"segment":0,"confidence":null,"iterationTokens":null,"asi":{"conclusion":"lower LR marginally worse but within noise - may generalize better","hyperparam":"lr=0.0005"}},{"commit":"de16801","metric":2.3871,"metrics":{"artifact_mb":12.1,"best_val_bpb":2.3871,"steps":1200},"status":"discard","description":"Shorter warmdown (0.6): 2.387, slightly worse","timestamp":1777169035789,"segment":0,"confidence":null,"iterationTokens":null,"asi":{"conclusion":"shorter warmdown slightly worse","hyperparam":"warmdown=0.6"}},{"commit":"de16801","metric":2.3903,"metrics":{"artifact_mb":12.1,"best_val_bpb":2.3903,"steps":1100},"status":"discard","description":"Lower WD (0.05): 2.390, slightly worse","timestamp":1777171253884,"segment":0,"confidence":null,"iterationTokens":null,"asi":{"conclusion":"lower weight decay slightly worse","hyperparam":"wd=0.05"}}],"bestMetric":2.379,"bestDirection":"lower","metricName":"val_bpb","metricUnit":"bpb","secondaryMetrics":[{"name":"best_val_bpb","unit":""},{"name":"steps","unit":""},{"name":"artifact_mb","unit":"mb"}],"name":"Parameter Golf - Find Best Config for Sub-1 BPB","currentSegment":0,"maxExperiments":null,"confidence":null},"wallClockSeconds":null},"isError":false,"timestamp":1777171253935}}
{"type":"message","id":"34da2027","parentId":"9601fe07","timestamp":"2026-04-26T02:40:57.168Z","message":{"role":"assistant","content":[{"type":"thinking","thinking":"Let me try higher weight decay since lower was worse:\n","thinkingSignature":"e2fe76cab0e663fe7eb9cad5a918ea0a5d48b7044f477e5b8e05f33fdb6402b7"},{"type":"toolCall","id":"call_function_fwr1kbtrwlqf_1","name":"bash","arguments":{"command":"cd /Users/dhruv2mars/dev/github/parameter-golf && python3 experiments/pg_autoresearch.py run --name \"ar_wd15_$(date +%Y%m%d)\" --env \"ITERATIONS=7000\" --env \"MAX_WALLCLOCK_SECONDS=1800\" --env \"WEIGHT_DECAY=0.15\" --timeout 2400 2>&1"}}],"api":"anthropic-messages","provider":"minimax","model":"MiniMax-M2.7","usage":{"input":276,"output":121,"cacheRead":61824,"cacheWrite":0,"totalTokens":62221,"cost":{"input":0.0000828,"output":0.0001452,"cacheRead":0.0037094399999999996,"cacheWrite":0,"total":0.0039374399999999995}},"stopReason":"toolUse","timestamp":1777171253938,"responseId":"063cae382db4a5ef26b7056936d1d26c"}}
{"type":"message","id":"dfe31c68","parentId":"34da2027","timestamp":"2026-04-26T03:17:48.081Z","message":{"role":"toolResult","toolCallId":"call_function_fwr1kbtrwlqf_1","toolName":"bash","content":[{"type":"text","text":"{\"best_val_bpb\": 2.3767, \"compressed_bytes\": null, \"error\": null, \"metric\": 2.3767, \"non_finite\": false, \"output\": \"/Users/dhruv2mars/dev/github/parameter-golf/experiments/kaggle_results/pg-auto-ar-wd15-20260426-71257\", \"ref\": \"dhruv2mars/pg-auto-ar-wd15-20260426-71257\", \"runtime_seconds\": null, \"status\": \"KernelWorkerStatus.COMPLETE\", \"steps\": 1100, \"ttt_val_bpb\": null, \"val_bpb\": 2.3767}\n"}],"isError":false,"timestamp":1777173468081}}
{"type":"message","id":"1cd8a8e6","parentId":"dfe31c68","timestamp":"2026-04-26T03:18:06.919Z","message":{"role":"assistant","content":[{"type":"thinking","thinking":"WD=0.15 gives 2.377, which is BETTER than baseline (2.379)! By 0.002 BPB. That's a small but genuine improvement worth keeping.","thinkingSignature":"a4fae05d5dd2d701aed4408ab1d1b0abbf396db1f875d7032fe046599d1f50e8"},{"type":"toolCall","id":"call_function_d9b0e5jriz1m_1","name":"log_experiment","arguments":{"asi":{"conclusion":"higher WD improves BPB by ~0.002","hyperparam":"wd=0.15"},"commit":"de16801","description":"Higher WD (0.15): 2.377, BEST so far! Better than baseline","metric":2.3767,"metrics":{"artifact_mb":12.1,"best_val_bpb":2.3767,"steps":1100},"status":"keep"}}],"api":"anthropic-messages","provider":"minimax","model":"MiniMax-M2.7","usage":{"input":62365,"output":191,"cacheRead":0,"cacheWrite":0,"totalTokens":62556,"cost":{"input":0.0187095,"output":0.0002292,"cacheRead":0,"cacheWrite":0,"total":0.0189387}},"stopReason":"toolUse","timestamp":1777173468083,"responseId":"063cb6e0b8b89b985e28ba51f5413466"}}
