{"type":"message","id":"8cba725e","parentId":"0d3d0180","timestamp":"2026-04-25T18:07:50.314Z","message":{"role":"toolResult","toolCallId":"call_function_9bf3jmodi6h5_2","toolName":"read","content":[{"type":"text","text":"# Parameter Golf Progress\n\n## Goal\n\nTrain a language model achieving sub-1 BPB on 2xT4 GPUs with extended training.\nUse incremental 10-minute validation cycles for hill climbing toward the target.\n\n## Constraints\n\n- **Hardware:** 2x Tesla T4 (16GB each)\n- **Artifact:** Under 16,000,000 bytes\n- **Training:** 30 hours/week quota, 12 hours per session\n- **Strategy:** Incremental 10-min runs → validate → improve → repeat\n\n## Architecture (Proven SOTA Config)\n\n```\n- Model: 11L x 512d x 8H / 4KV, tied embeddings\n- Tokenizer: SP8192 (SentencePiece 8K)\n- Depth Recurrence: layers 3-5, loop 2x, activates at 35% of training\n- QK-Gain: 5.25 (learnable per-head scaling)\n- MLP: 4x dim, squared LeakyReLU\n- RoPE: 16 dims, base 10000\n- Logit Softcap: 30.0\n```\n\n## Training Pipeline (Stable)\n\n### Features\n- Checkpointing every 5 minutes with resume capability\n- NaN/Inf detection with graceful recovery\n- Signal handling for clean shutdown\n- 10-minute validation cycles\n- EMA model averaging\n\n### Hyperparameters\n```\nIterations: 2500 (quick) / 50000+ (extended)\nEffective Batch: 32K tokens (8K x 4 accum)\nMatrix LR: 0.001 (AdamW)\nWeight Decay: 0.095\nEMA: 0.9965\nWarmdown: 72% of training\n```\n\n## Current Status\n\n### Phase 1: Stability (COMPLETED)\n- Rewrote train_kaggle.py from scratch\n- Removed dead code (MuonEqR, dead compression functions)\n- Fixed TTT implementation (was calling model twice)\n- Added checkpointing with resume\n- Added signal handling for graceful shutdown\n- Added NaN/Inf detection\n\n### Phase 2: Baseline (IN PROGRESS)\n- Run 10-min baseline to establish current BPB\n- Expected: ~2.3-2.5 BPB with 2500 steps\n\n### Phase 3: Hybrid Architecture (PENDING)\n- Add PPM (Prediction by Partial Match) for byte-level patterns\n- Add adaptive cache for document repetition\n- Target: ~0.1-0.15 BPB improvement\n\n### Phase 4: Extended Training (PENDING)\n- Scale to 50K-100K steps with extended sessions\n- Target: ~1.4-1.6 BPB (neural only)\n- With hybrid: sub-1 achievable\n\n## Key Files\n\n- `train_kaggle.py`: Clean, stable training pipeline\n- `run_train.sh`: Runner with all hyperparameters\n- `checkpoints/`: Saved states for resume\n- `logs/`: Training logs\n\n## Next Steps\n\n1. Run 10-min baseline on Kaggle\n2. Verify BPB is reasonable (~2.3-2.5)\n3. Begin incremental optimization experiments\n4. Add PPM integration for hybrid approach"}],"isError":false,"timestamp":1777140470313}}
{"type":"message","id":"d1731fa3","parentId":"8cba725e","timestamp":"2026-04-25T18:07:50.314Z","message":{"role":"toolResult","toolCallId":"call_function_9bf3jmodi6h5_3","toolName":"bash","content":[{"type":"text","text":"total 0\ndrwxr-xr-x@ 39 dhruv2mars  staff  1248 24 Apr 14:50 .\ndrwxr-xr-x@ 14 dhruv2mars  staff   448 24 Apr 00:25 REDACTED\ndrwxr-xr-x@ 12 dhruv2mars  staff   384 24 Apr 00:25 REDACTED\ndrwxr-xr-x@ 10 dhruv2mars  staff   320 24 Apr 14:50 2026-03-31_Scylla_FullGPTQ_XSA11_FA3_0.9485\ndrwxr-xr-x@ 10 dhruv2mars  staff   320 24 Apr 00:25 REDACTED\ndrwxr-xr-x@ 10 dhruv2mars  staff   320 24 Apr 00:25 2026-03-17_LoRA_TTT\ndrwxr-xr-x@  9 dhruv2mars  staff   288 24 Apr 14:50 REDACTED\ndrwxr-xr-x@  9 dhruv2mars  staff   288 24 Apr 00:25 2026-04-01_Vocab4096_MLPMult4_WD085\ndrwxr-xr-x@  9 dhruv2mars  staff   288 24 Apr 00:25 2026-03-31_ParallelResiduals_MiniDepthRecurrence\ndrwxr-xr-x@  9 dhruv2mars  staff   288 24 Apr 00:25 REDACTED\ndrwxr-xr-x@  9 dhruv2mars  staff   288 24 Apr 00:25 2026-03-22_11L_EMA_GPTQ-lite_warmdown3500_QAT015_1.1233\ndrwxr-xr-x@  9 dhruv2mars  staff   288 24 Apr 00:25 2026-03-21_11L_XSA4_EMA_PartialRoPE_LateQAT_1.1248\ndrwxr-xr-x@  9 dhruv2mars  staff   288 24 Apr 00:25 2026-03-20_11L_XSA4_EMA_Int6_MLP3x_WD04_1.1271\ndrwxr-xr-x@  8 dhruv2mars  staff   256 24 Apr 14:50 REDACTED\ndrwxr-xr-x@  8 dhruv2mars  staff   256 24 Apr 00:25 REDACTED\ndrwxr-xr-x@  8 dhruv2mars  staff   256 24 Apr 00:25 2026-04-08_SP8192_ParallelResid_ScoreFirstTTT\ndrwxr-xr-x@  8 dhruv2mars  staff   256 24 Apr 00:25 2026-04-06_SP8192_QK5_LegalTTT_1.0828\ndrwxr-xr-x@  8 dhruv2mars  staff   256 24 Apr 00:25 REDACTED\ndrwxr-xr-x@  8 dhruv2mars  staff   256 24 Apr 00:25 2026-04-03_MuonEqR_DepthRecurrence_WD090_AllInt6\ndrwxr-xr-x@  8 dhruv2mars  staff   256 24 Apr 00:25 2026-03-23_LeakyReLU_LegalTTT_ParallelMuon\ndrwxr-xr-x@  8 dhruv2mars  staff   256 24 Apr 00:25 REDACTED\ndrwxr-xr-x@  8 dhruv2mars  staff   256 24 Apr 00:25 2026-03-20_10L_Int5MLP_MuonWD04_SWA50\ndrwxr-xr-x@  8 dhruv2mars  staff   256 24 Apr 00:25 2026-03-19_TrainingOptSeq4096\ndrwxr-xr-x@  8 dhruv2mars  staff   256 24 Apr 00:25 REDACTED\ndrwxr-xr-x@  8 dhruv2mars  staff   256 24 Apr 00:25 2026-03-19_Seq2048_FP16Emb_TunedLR\ndrwxr-xr-x@  8 dhruv2mars  staff   256 24 Apr 00:25 2026-03-18_LongContextSeq2048\ndrwxr-xr-x@  7 dhruv2mars  staff   224 24 Apr 00:25 2026-03-18_FP16Embed_WD3600\ndrwxr-xr-x@  6 dhruv2mars  staff   192 24 Apr 00:25 2026-03-20_11L_EfficientPartialXSA_FA3_SWA120\ndrwxr-xr-x@  6 dhruv2mars  staff   192 24 Apr 00:25 2026-03-19_WarmdownQuantization\ndrwxr-xr-x@  6 dhruv2mars  staff   192 24 Apr 00:25 2026-03-19_smeargate_orthoinit_muonwd\ndrwxr-xr-x@  6 dhruv2mars  staff   192 24 Apr 00:25 2026-03-19_SlidingWindowEval\ndrwxr-xr-x@  6 dhruv2mars  staff   192 24 Apr 00:25 REDACTED\ndrwxr-xr-x@  6 dhruv2mars  staff   192 24 Apr 00:25 2026-03-19_MixedQuant_Int6Int8_SlidingWindow\ndrwxr-xr-x@  6 dhruv2mars  staff   192 24 Apr 00:25 2026-03-19_10L_MixedPrecision\ndrwxr-xr-x@  6 dhruv2mars  staff   192 24 Apr 00:25 2026-03-18_LowerLR\ndrwxr-xr-x@  6 dhruv2mars  staff   192 24 Apr 00:25 2026-03-17_NaiveBaseline\ndrwxr-xr-x@  4 dhruv2mars  staff   128 24 Apr 00:25 ..\ndrwxr-xr-x@  3 dhruv2mars  staff    96 24 Apr 00:25 2026-03-19_int6_STE QAT_ MLP_bigram _U_Net\ndrwxr-xr-x@  2 dhruv2mars  staff    64 24 Apr 19:20 2026-04-24_exp6_baseline\n"}],"isError":false,"timestamp":1777140470314}}
{"type":"message","id":"392863cd","parentId":"d1731fa3","timestamp":"2026-04-25T18:07:58.484Z","message":{"role":"assistant","content":[{"type":"thinking","thinking":"Let me dig deeper into the current state of the project - the latest experiment, the training code, and the current best configs.\n","thinkingSignature":"08f6cf5b4c24b6eaf3b83dbbd0b96022048028a309e3928771853e5031e968c6"},{"type":"toolCall","id":"call_function_zutsix0gr12n_1","name":"read","arguments":{"path":"/Users/dhruv2mars/dev/github/parameter-golf/train_kaggle.py"}},{"type":"toolCall","id":"call_function_zutsix0gr12n_2","name":"read","arguments":{"path":"/Users/dhruv2mars/dev/github/parameter-golf/run_train.sh"}},{"type":"toolCall","id":"call_function_zutsix0gr12n_3","name":"read","arguments":{"path":"/Users/dhruv2mars/dev/github/parameter-golf/run_train_ttt.sh"}}],"api":"anthropic-messages","provider":"minimax","model":"MiniMax-M2.7","usage":{"input":9185,"output":137,"cacheRead":17472,"cacheWrite":0,"totalTokens":26794,"cost":{"input":0.0027554999999999997,"output":0.00016439999999999998,"cacheRead":0.00104832,"cacheWrite":0,"total":0.00396822}},"stopReason":"toolUse","timestamp":1777140470316,"responseId":"063c35f602a988d905fee58f37a459ae"}}
