{"type":"message","id":"01ee80cb","parentId":"28128c2d","timestamp":"2026-04-25T18:07:58.577Z","message":{"role":"toolResult","toolCallId":"call_function_zutsix0gr12n_2","toolName":"read","content":[{"type":"text","text":"#!/bin/bash\n# Parameter Golf - Kaggle 2xT4 Training Runner\n# Optimized for stable, long-running sessions with checkpointing.\n\nset -euo pipefail\n\n# Fast syntax check\npython3 -m py_compile train_kaggle.py 2>/dev/null || { \n    echo \"SYNTAX ERROR in train_kaggle.py\"\n    exit 1\n}\n\nmkdir -p logs checkpoints\n\n# =============================================================================\n# ENVIRONMENT: All hyperparameters configurable via env vars\n# =============================================================================\n\n# Run identification\nexport RUN_ID=${RUN_ID:-\"t4-$(date +%Y%m%d-%H%M%S)\"}\n\n# Training (10 min for quick validation, extend for long runs)\nexport ITERATIONS=${ITERATIONS:-2500}\nexport MAX_WALLCLOCK_SECONDS=${MAX_WALLCLOCK_SECONDS:-600}\nexport WARMDOWN_FRAC=${WARMDOWN_FRAC:-0.72}\nexport MIN_LR_RATIO=${MIN_LR_RATIO:-0.1}\n\n# Batch (effective batch = BATCH_TOKENS * GRAD_ACCUM)\nexport TRAIN_BATCH_TOKENS=${TRAIN_BATCH_TOKENS:-8192}\nexport TRAIN_SEQ_LEN=${TRAIN_SEQ_LEN:-512}\nexport GRAD_ACCUM_STEPS=${GRAD_ACCUM_STEPS:-1}  # 1 for quick feedback, 4 for larger effective batch\n\n# Model architecture (proven SOTA config)\nexport VOCAB_SIZE=${VOCAB_SIZE:-8192}\nexport NUM_LAYERS=${NUM_LAYERS:-11}\nexport MODEL_DIM=${MODEL_DIM:-512}\nexport NUM_HEADS=${NUM_HEADS:-8}\nexport NUM_KV_HEADS=${NUM_KV_HEADS:-4}\nexport MLP_MULT=${MLP_MULT:-4}\n\n# Depth recurrence (layers 3-5 loop twice after 35% of training)\nexport NUM_LOOPS=${NUM_LOOPS:-2}\nexport LOOP_START=${LOOP_START:-3}\nexport LOOP_END=${LOOP_END:-5}\nexport ENABLE_LOOPING_AT=${ENABLE_LOOPING_AT:-0.35}\n\n# QK-Gain (5.25 is proven optimal)\nexport QK_GAIN_INIT=${QK_GAIN_INIT:-5.25}\n\n# RoPE\nexport ROPE_DIMS=${ROPE_DIMS:-16}\nexport ROPE_BASE=${ROPE_BASE:-10000.0}\n\n# Optimizer (AdamW, tuned for T4)\nexport MATRIX_LR=${MATRIX_LR:-0.001}\nexport WEIGHT_DECAY=${WEIGHT_DECAY:-0.095}\nexport BETA1=${BETA1:-0.9}\nexport BETA2=${BETA2:-0.95}\nexport GRAD_CLIP_NORM=${GRAD_CLIP_NORM:-1.0}\nexport EMA_DECAY=${EMA_DECAY:-0.9965}\n\n# Quantization (GPTQ SDClip)\nexport MATRIX_CLIP_SIGMAS=${MATRIX_CLIP_SIGMAS:-12.85}\nexport EMBED_CLIP_SIGMAS=${EMBED_CLIP_SIGMAS:-20.0}\n\n# TTT (Test-Time Training) - enables via TTT_ENABLED=1\nexport TTT_ENABLED=${TTT_ENABLED:-0}\nexport TTT_LR=${TTT_LR:-0.005}\nexport TTT_EPOCHS=${TTT_EPOCHS:-3}\nexport TTT_WARMUP_TOKENS=${TTT_WARMUP_TOKENS:-32768}\n\n# Checkpointing\nexport CHECKPOINT_DIR=${CHECKPOINT_DIR:-\"checkpoints\"}\n\n# =============================================================================\n# PRINT CONFIG\n# =============================================================================\n\necho \"==========================================\"\necho \"Parameter Golf - T4 Training\"\necho \"==========================================\"\necho \"RUN_ID: $RUN_ID\"\necho \"ITERATIONS: $ITERATIONS\"\necho \"MAX_TIME: ${MAX_WALLCLOCK_SECONDS}s\"\necho \"EFFECTIVE_BATCH: $((TRAIN_BATCH_TOKENS * GRAD_ACCUM_STEPS)) tokens\"\necho \"MODEL: ${NUM_LAYERS}L x ${MODEL_DIM}d x ${NUM_HEADS}H / ${NUM_KV_HEADS}KV\"\necho \"LOOP: layers ${LOOP_START}-${LOOP_END}, ${NUM_LOOPS}x\"\necho \"QK-GAIN: $QK_GAIN_INIT\"\necho \"TTT: $TTT_ENABLED (${TTT_EPOCHS} epochs)\"\necho \"==========================================\"\n\n# =============================================================================\n# RUN\n# =============================================================================\n\npython3 train_kaggle.py 2>&1 | tee \"logs/${RUN_ID}.log\"\n\n# =============================================================================\n# EXTRACT METRICS\n# =============================================================================\n\nif [ -f \"logs/${RUN_ID}.log\" ]; then\n    echo \"\"\n    echo \"==========================================\"\n    echo \"RESULTS\"\n    echo \"==========================================\"\n    \n    # Extract from log\n    VAL_BPB=$(grep -E \"final_val_bpb|best_val_bpb\" \"logs/${RUN_ID}.log\" | tail -1 | sed 's/.*=\\([0-9.]*\\).*/\\1/' || echo \"N/A\")\n    ARTIFACT=$(grep -E \"Compressed artifact:|artifact_bytes\" \"logs/${RUN_ID}.log\" | tail -1 | grep -oE '[0-9]+,' | tr -d ',' || echo \"N/A\")\n    STEPS=$(grep -E \"total_steps\" \"logs/${RUN_ID}.log\" | tail -1 | sed 's/.*=\\([0-9]*\\).*/\\1/' || echo \"N/A\")\n    TIME=$(grep -E \"total_time_s\" \"logs/${RUN_ID}.log\" | tail -1 | sed 's/.*=\\([0-9.]*\\).*/\\1/' || echo \"N/A\")\n    \n    echo \"val_bpb: ${VAL_BPB}\"\n    echo \"artifact_bytes: ${ARTIFACT}\"\n    echo \"steps: ${STEPS}\"\n    echo \"time_seconds: ${TIME}\"\n    \n    # METRIC lines for auto-parsing\n    grep \"^METRIC \" \"logs/${RUN_ID}.log\" | tail -10\nfi"}],"isError":false,"timestamp":1777140478576}}
{"type":"message","id":"4250b6f4","parentId":"01ee80cb","timestamp":"2026-04-25T18:07:58.577Z","message":{"role":"toolResult","toolCallId":"call_function_zutsix0gr12n_3","toolName":"read","content":[{"type":"text","text":"#!/bin/bash\n# Parameter Golf - Kaggle 2xT4 Training Runner\n# Optimized for stable, long-running sessions with checkpointing.\n\nset -euo pipefail\n\n# Fast syntax check\npython3 -m py_compile train_kaggle.py 2>/dev/null || { \n    echo \"SYNTAX ERROR in train_kaggle.py\"\n    exit 1\n}\n\nmkdir -p logs checkpoints\n\n# =============================================================================\n# ENVIRONMENT: All hyperparameters configurable via env vars\n# =============================================================================\n\n# Run identification\nexport RUN_ID=${RUN_ID:-\"t4-ttt-test\"}\n\n# Training (10 min for quick validation, extend for long runs)\nexport ITERATIONS=${ITERATIONS:-2500}\nexport MAX_WALLCLOCK_SECONDS=${MAX_WALLCLOCK_SECONDS:-600}\nexport WARMDOWN_FRAC=${WARMDOWN_FRAC:-0.72}\nexport MIN_LR_RATIO=${MIN_LR_RATIO:-0.1}\n\n# Batch (effective batch = BATCH_TOKENS * GRAD_ACCUM)\nexport TRAIN_BATCH_TOKENS=${TRAIN_BATCH_TOKENS:-8192}\nexport TRAIN_SEQ_LEN=${TRAIN_SEQ_LEN:-512}\nexport GRAD_ACCUM_STEPS=${GRAD_ACCUM_STEPS:-1}  # 1 for quick feedback, 4 for larger effective batch\n\n# Model architecture (proven SOTA config)\nexport VOCAB_SIZE=${VOCAB_SIZE:-8192}\nexport NUM_LAYERS=${NUM_LAYERS:-11}\nexport MODEL_DIM=${MODEL_DIM:-512}\nexport NUM_HEADS=${NUM_HEADS:-8}\nexport NUM_KV_HEADS=${NUM_KV_HEADS:-4}\nexport MLP_MULT=${MLP_MULT:-4}\n\n# Depth recurrence (layers 3-5 loop twice after 35% of training)\nexport NUM_LOOPS=${NUM_LOOPS:-2}\nexport LOOP_START=${LOOP_START:-3}\nexport LOOP_END=${LOOP_END:-5}\nexport ENABLE_LOOPING_AT=${ENABLE_LOOPING_AT:-0.35}\n\n# QK-Gain (5.25 is proven optimal)\nexport QK_GAIN_INIT=${QK_GAIN_INIT:-5.25}\n\n# RoPE\nexport ROPE_DIMS=${ROPE_DIMS:-16}\nexport ROPE_BASE=${ROPE_BASE:-10000.0}\n\n# Optimizer (AdamW, tuned for T4)\nexport MATRIX_LR=${MATRIX_LR:-0.001}\nexport WEIGHT_DECAY=${WEIGHT_DECAY:-0.095}\nexport BETA1=${BETA1:-0.9}\nexport BETA2=${BETA2:-0.95}\nexport GRAD_CLIP_NORM=${GRAD_CLIP_NORM:-1.0}\nexport EMA_DECAY=${EMA_DECAY:-0.9965}\n\n# Quantization (GPTQ SDClip)\nexport MATRIX_CLIP_SIGMAS=${MATRIX_CLIP_SIGMAS:-12.85}\nexport EMBED_CLIP_SIGMAS=${EMBED_CLIP_SIGMAS:-20.0}\n\n# TTT (Test-Time Training) - enables via TTT_ENABLED=1\nexport TTT_ENABLED=${TTT_ENABLED:-1}\nexport TTT_LR=${TTT_LR:-0.005}\nexport TTT_EPOCHS=${TTT_EPOCHS:-3}\nexport TTT_WARMUP_TOKENS=${TTT_WARMUP_TOKENS:-32768}\n\n# Checkpointing\nexport CHECKPOINT_DIR=${CHECKPOINT_DIR:-\"checkpoints\"}\n\n# =============================================================================\n# PRINT CONFIG\n# =============================================================================\n\necho \"==========================================\"\necho \"Parameter Golf - T4 Training\"\necho \"==========================================\"\necho \"RUN_ID: $RUN_ID\"\necho \"ITERATIONS: $ITERATIONS\"\necho \"MAX_TIME: ${MAX_WALLCLOCK_SECONDS}s\"\necho \"EFFECTIVE_BATCH: $((TRAIN_BATCH_TOKENS * GRAD_ACCUM_STEPS)) tokens\"\necho \"MODEL: ${NUM_LAYERS}L x ${MODEL_DIM}d x ${NUM_HEADS}H / ${NUM_KV_HEADS}KV\"\necho \"LOOP: layers ${LOOP_START}-${LOOP_END}, ${NUM_LOOPS}x\"\necho \"QK-GAIN: $QK_GAIN_INIT\"\necho \"TTT: $TTT_ENABLED (${TTT_EPOCHS} epochs)\"\necho \"==========================================\"\n\n# =============================================================================\n# RUN\n# =============================================================================\n\npython3 train_kaggle.py 2>&1 | tee \"logs/${RUN_ID}.log\"\n\n# =============================================================================\n# EXTRACT METRICS\n# =============================================================================\n\nif [ -f \"logs/${RUN_ID}.log\" ]; then\n    echo \"\"\n    echo \"==========================================\"\n    echo \"RESULTS\"\n    echo \"==========================================\"\n    \n    # Extract from log\n    VAL_BPB=$(grep -E \"final_val_bpb|best_val_bpb\" \"logs/${RUN_ID}.log\" | tail -1 | sed 's/.*=\\([0-9.]*\\).*/\\1/' || echo \"N/A\")\n    ARTIFACT=$(grep -E \"Compressed artifact:|artifact_bytes\" \"logs/${RUN_ID}.log\" | tail -1 | grep -oE '[0-9]+,' | tr -d ',' || echo \"N/A\")\n    STEPS=$(grep -E \"total_steps\" \"logs/${RUN_ID}.log\" | tail -1 | sed 's/.*=\\([0-9]*\\).*/\\1/' || echo \"N/A\")\n    TIME=$(grep -E \"total_time_s\" \"logs/${RUN_ID}.log\" | tail -1 | sed 's/.*=\\([0-9.]*\\).*/\\1/' || echo \"N/A\")\n    \n    echo \"val_bpb: ${VAL_BPB}\"\n    echo \"artifact_bytes: ${ARTIFACT}\"\n    echo \"steps: ${STEPS}\"\n    echo \"time_seconds: ${TIME}\"\n    \n    # METRIC lines for auto-parsing\n    grep \"^METRIC \" \"logs/${RUN_ID}.log\" | tail -10\nfi"}],"isError":false,"timestamp":1777140478577}}
{"type":"message","id":"d308aa37","parentId":"4250b6f4","timestamp":"2026-04-25T18:08:06.128Z","message":{"role":"assistant","content":[{"type":"thinking","thinking":"Now let me check the experiments folder and look at any existing results:\n","thinkingSignature":"f940b42bb66edf5331a1c436d7295b0f20443a4d05320c01004dcd236d266a15"},{"type":"toolCall","id":"call_function_b0hd2uhww972_1","name":"bash","arguments":{"command":"ls -la /Users/dhruv2mars/dev/github/parameter-golf/experiments/"}},{"type":"toolCall","id":"call_function_b0hd2uhww972_2","name":"bash","arguments":{"command":"cat /Users/dhruv2mars/dev/github/parameter-golf/records/track_10min_16mb/2026-04-24_exp6_baseline/README.md 2>/dev/null || echo \"no readme\""}}],"api":"anthropic-messages","provider":"minimax","model":"MiniMax-M2.7","usage":{"input":12244,"output":124,"cacheRead":26624,"cacheWrite":0,"totalTokens":38992,"cost":{"input":0.0036731999999999997,"output":0.00014879999999999998,"cacheRead":0.0015974399999999999,"cacheWrite":0,"total":0.005419439999999999}},"stopReason":"toolUse","timestamp":1777140478579,"responseId":"063c35fece5c6f3df48df0235e9a1c72"}}
{"type":"message","id":"ae3f9c0d","parentId":"d308aa37","timestamp":"2026-04-25T18:08:06.159Z","message":{"role":"toolResult","toolCallId":"call_function_b0hd2uhww972_1","toolName":"bash","content":[{"type":"text","text":"total 88\ndrwxr-xr-x@  5 dhruv2mars  staff    160 25 Apr 17:56 __pycache__\ndrwxr-xr-x@ 11 dhruv2mars  staff    352 25 Apr 17:50 .\ndrwxr-xr-x@ 30 dhruv2mars  staff    960 25 Apr 17:51 ..\ndrwxr-xr-x@ 24 dhruv2mars  staff    768 25 Apr 22:13 arch_results\n-rw-r--r--@  1 dhruv2mars  staff  13432 25 Apr 17:49 arch_verifier.py\ndrwxr-xr-x@ 12 dhruv2mars  staff    384 25 Apr 17:49 arch_work\ndrwxr-xr-x@ 17 dhruv2mars  staff    544 25 Apr 16:22 kaggle_results\n-rw-r--r--@  1 dhruv2mars  staff    582 25 Apr 16:07 kaggle_state.json\ndrwxr-xr-x@  8 dhruv2mars  staff    256 25 Apr 02:32 kaggle_work\n-rw-r--r--@  1 dhruv2mars  staff   9006 25 Apr 15:47 pg_autoresearch.py\n-rw-r--r--@  1 dhruv2mars  staff  10554 25 Apr 18:34 run_arch_experiments.py\n"}],"isError":false,"timestamp":1777140486159}}
{"type":"message","id":"73d81b7f","parentId":"ae3f9c0d","timestamp":"2026-04-25T18:08:06.159Z","message":{"role":"toolResult","toolCallId":"call_function_b0hd2uhww972_2","toolName":"bash","content":[{"type":"text","text":"no readme\n"}],"isError":false,"timestamp":1777140486159}}
{"type":"message","id":"69ae56c1","parentId":"73d81b7f","timestamp":"2026-04-25T18:08:10.950Z","message":{"role":"assistant","content":[{"type":"thinking","thinking":"Let me read the existing autoresearch script and kaggle results to understand the current state better.\n","thinkingSignature":"66f00d6f85fe6ffe21f202605e301739c8740fc3b56caa480485d9918309fb56"},{"type":"toolCall","id":"call_function_ye96a8wiw8ys_1","name":"read","arguments":{"path":"/Users/dhruv2mars/dev/github/parameter-golf/experiments/pg_autoresearch.py"}},{"type":"toolCall","id":"call_function_ye96a8wiw8ys_2","name":"read","arguments":{"path":"/Users/dhruv2mars/dev/github/parameter-golf/experiments/kaggle_state.json"}}],"api":"anthropic-messages","provider":"minimax","model":"MiniMax-M2.7","usage":{"input":477,"output":103,"cacheRead":38848,"cacheWrite":0,"totalTokens":39428,"cost":{"input":0.00014309999999999998,"output":0.0001236,"cacheRead":0.0023308799999999996,"cacheWrite":0,"total":0.0025975799999999995}},"stopReason":"toolUse","timestamp":1777140486161,"responseId":"063c3606c1204fb63b35355d1a7a1638"}}
