{"type":"message","id":"85a3295e","parentId":"8fb076ba","timestamp":"2026-04-27T11:33:04.055Z","message":{"role":"assistant","content":[{"type":"thinking","thinking":"I see the issue - it's using `train_kagglle.py` (double l) which is a typo from the Lightning wrapper. The actual file is `train_kaggle.py`. This is a Lightning wrapper issue. But the training itself worked fine - it reached step 150 with good BPB (2.89).\n\nLet me verify the setup is working by running it directly.","thinkingSignature":"21987058f4f033486af89ef6c8f622ed8b63eebb08f518e5eb6b76762e10f548"},{"type":"text","text":"Training is working. Exit 1 is from Lightning wrapper (typo `train_kagglle.py`). Let me verify directly:\n"},{"type":"toolCall","id":"call_function_27wcc4op23lr_1","name":"bash","arguments":{"command":"agent-browser type \"\" \"cd ~/parameter-golf && python3 train_kaggle.py 2>&1 | head -100\" 2>&1 && agent-browser press Enter 2>&1"}}],"api":"anthropic-messages","provider":"minimax","model":"MiniMax-M2.7","usage":{"input":56494,"output":169,"cacheRead":9348,"cacheWrite":0,"totalTokens":66011,"cost":{"input":0.0169482,"output":0.0002028,"cacheRead":0.0005608799999999999,"cacheWrite":0,"total":0.01771188}},"stopReason":"toolUse","timestamp":1777289575858,"responseId":"063e7c6a07a32e9511559e6ede18914b"}}
{"type":"message","id":"8e428818","parentId":"85a3295e","timestamp":"2026-04-27T11:33:04.495Z","message":{"role":"toolResult","toolCallId":"call_function_27wcc4op23lr_1","toolName":"bash","content":[{"type":"text","text":"✓ Done\n✓ Done\n"}],"isError":false,"timestamp":1777289584495}}
{"type":"message","id":"654f2917","parentId":"8e428818","timestamp":"2026-04-27T11:33:08.537Z","message":{"role":"assistant","content":[{"type":"thinking","thinking":"Let me wait and check the output.","thinkingSignature":"ab4cffa53661523d53ae074c8f18ca1446c6f4bf5f4030832541b0bbc9712658"},{"type":"toolCall","id":"call_function_8reanny8hp9o_1","name":"bash","arguments":{"command":"sleep 30 && agent-browser screenshot 2>&1"}}],"api":"anthropic-messages","provider":"minimax","model":"MiniMax-M2.7","usage":{"input":56684,"output":44,"cacheRead":9348,"cacheWrite":0,"totalTokens":66076,"cost":{"input":0.017005199999999998,"output":0.000052799999999999996,"cacheRead":0.0005608799999999999,"cacheWrite":0,"total":0.017618879999999996}},"stopReason":"toolUse","timestamp":1777289584500,"responseId":"063e7c7152362a53191f91034bd9fd9f"}}
{"type":"message","id":"06a0632c","parentId":"654f2917","timestamp":"2026-04-27T11:33:38.861Z","message":{"role":"toolResult","toolCallId":"call_function_8reanny8hp9o_1","toolName":"bash","content":[{"type":"text","text":"✓ Screenshot saved to /Users/dhruv2mars/.agent-browser/tmp/screenshots/screenshot-1777289618855.png\n"}],"isError":false,"timestamp":1777289618861}}
{"type":"message","id":"183b7e1c","parentId":"06a0632c","timestamp":"2026-04-27T11:33:46.619Z","message":{"role":"assistant","content":[{"type":"thinking","thinking":"Let me check.","thinkingSignature":"155764a1465f1aa31e7510f8cd8266c6638b35b4a37882161cbf92b1741bf4f4"},{"type":"toolCall","id":"call_function_yl64zkde9lto_1","name":"understand_image","arguments":{"prompt":"Is training running now? Show status.","image_url":"/Users/dhruv2mars/.agent-browser/tmp/screenshots/screenshot-1777289618855.png"}}],"api":"anthropic-messages","provider":"minimax","model":"MiniMax-M2.7","usage":{"input":56771,"output":69,"cacheRead":9348,"cacheWrite":0,"totalTokens":66188,"cost":{"input":0.0170313,"output":0.0000828,"cacheRead":0.0005608799999999999,"cacheWrite":0,"total":0.01767498}},"stopReason":"toolUse","timestamp":1777289618865,"responseId":"063e7c96c00db3082b6b5bdf72744d75"}}
{"type":"message","id":"4eeb7ff1","parentId":"183b7e1c","timestamp":"2026-04-27T11:33:57.053Z","message":{"role":"toolResult","toolCallId":"call_function_yl64zkde9lto_1","toolName":"understand_image","content":[{"type":"text","text":"Based on the terminal output in your screenshot, **training is not currently running**.\n\n### Status Summary:\n*   **Current State:** Stopped (Error)\n*   **Last Progress:** Training reached **step 150**.\n*   **Outcome:** The process exited prematurely with an error code (**`exit 1`**).\n*   **Evidence:** The command prompt (`autoresearch/phase1-20260426 ~/parameter-golf []`) has reappeared at the bottom of the terminal, indicating that the previously running command has finished execution.\n\n### What happened?\nThe line `[1] + 100120 exit 1 load_conda_and_run python3 ~/parameter-golf/train_kaggle.py` shows that your training script crashed. \n\nTo find out why it stopped, you should scroll up in the terminal to see if there are any Python traceback errors or messages just before the \"exit 1\" line. The red dot next to the `parameter-golf` folder in your file explorer also suggests that the editor has detected an error in the project files."}],"details":{"server":"MiniMax","tool":"understand_image","structuredContent":{"type":"text","text":"Based on the terminal output in your screenshot, **training is not currently running**.\n\n### Status Summary:\n*   **Current State:** Stopped (Error)\n*   **Last Progress:** Training reached **step 150**.\n*   **Outcome:** The process exited prematurely with an error code (**`exit 1`**).\n*   **Evidence:** The command prompt (`autoresearch/phase1-20260426 ~/parameter-golf []`) has reappeared at the bottom of the terminal, indicating that the previously running command has finished execution.\n\n### What happened?\nThe line `[1] + 100120 exit 1 load_conda_and_run python3 ~/parameter-golf/train_kaggle.py` shows that your training script crashed. \n\nTo find out why it stopped, you should scroll up in the terminal to see if there are any Python traceback errors or messages just before the \"exit 1\" line. The red dot next to the `parameter-golf` folder in your file explorer also suggests that the editor has detected an error in the project files.","annotations":null,"_meta":null},"isError":false},"isError":false,"timestamp":1777289637053}}
{"type":"message","id":"b4f4ecb8","parentId":"4eeb7ff1","timestamp":"2026-04-27T11:34:03.304Z","message":{"role":"assistant","content":[{"type":"thinking","thinking":"It's still showing the old output. Let me clear the terminal and run fresh.","thinkingSignature":"2a129c613417d3e884a85185d5bcfec4497503559d4e93e129a80bce731d0323"},{"type":"toolCall","id":"call_function_rwdigg8aby3m_1","name":"bash","arguments":{"command":"agent-browser type \"\" \"clear && python3 train_kaggle.py 2>&1\" 2>&1 && agent-browser press Enter 2>&1"}}],"api":"anthropic-messages","provider":"minimax","model":"MiniMax-M2.7","usage":{"input":57070,"output":72,"cacheRead":9348,"cacheWrite":0,"totalTokens":66490,"cost":{"input":0.017121,"output":0.0000864,"cacheRead":0.0005608799999999999,"cacheWrite":0,"total":0.01776828}},"stopReason":"toolUse","timestamp":1777289637057,"responseId":"063e7ca7885ae0d76b04b7f80a6ce9e6"}}
{"type":"message","id":"bef0c482","parentId":"b4f4ecb8","timestamp":"2026-04-27T11:34:03.765Z","message":{"role":"toolResult","toolCallId":"call_function_rwdigg8aby3m_1","toolName":"bash","content":[{"type":"text","text":"✓ Done\n✓ Done\n"}],"isError":false,"timestamp":1777289643765}}
{"type":"message","id":"916b3b33","parentId":"bef0c482","timestamp":"2026-04-27T11:34:08.338Z","message":{"role":"assistant","content":[{"type":"thinking","thinking":"Let me wait and check.","thinkingSignature":"c4fee00d46a721037777d6ec4307c893cbe9be85efb90e417a7490894a8745fe"},{"type":"toolCall","id":"call_function_pyt3l9tfojig_1","name":"bash","arguments":{"command":"sleep 20 && agent-browser screenshot 2>&1"}}],"api":"anthropic-messages","provider":"minimax","model":"MiniMax-M2.7","usage":{"input":57163,"output":42,"cacheRead":9348,"cacheWrite":0,"totalTokens":66553,"cost":{"input":0.017148899999999998,"output":0.0000504,"cacheRead":0.0005608799999999999,"cacheWrite":0,"total":0.017760179999999997}},"stopReason":"toolUse","timestamp":1777289643771,"responseId":"063e7cad11c99587a69d1802ea65f636"}}
{"type":"message","id":"8d0e1715","parentId":"916b3b33","timestamp":"2026-04-27T11:34:28.710Z","message":{"role":"toolResult","toolCallId":"call_function_pyt3l9tfojig_1","toolName":"bash","content":[{"type":"text","text":"✓ Screenshot saved to /Users/dhruv2mars/.agent-browser/tmp/screenshots/screenshot-1777289668702.png\n"}],"isError":false,"timestamp":1777289668710}}
{"type":"message","id":"08d80921","parentId":"8d0e1715","timestamp":"2026-04-27T11:34:34.741Z","message":{"role":"assistant","content":[{"type":"thinking","thinking":"Let me check.","thinkingSignature":"155764a1465f1aa31e7510f8cd8266c6638b35b4a37882161cbf92b1741bf4f4"},{"type":"toolCall","id":"call_function_9xsb99x796qk_1","name":"understand_image","arguments":{"prompt":"Is training now running correctly?","image_url":"/Users/dhruv2mars/.agent-browser/tmp/screenshots/screenshot-1777289668702.png"}}],"api":"anthropic-messages","provider":"minimax","model":"MiniMax-M2.7","usage":{"input":57248,"output":67,"cacheRead":9348,"cacheWrite":0,"totalTokens":66663,"cost":{"input":0.0171744,"output":0.0000804,"cacheRead":0.0005608799999999999,"cacheWrite":0,"total":0.01781568}},"stopReason":"toolUse","timestamp":1777289668715,"responseId":"063e7cc76287bc5e569d25133338241b"}}
{"type":"message","id":"b3f149cf","parentId":"08d80921","timestamp":"2026-04-27T11:34:45.032Z","message":{"role":"toolResult","toolCallId":"call_function_9xsb99x796qk_1","toolName":"understand_image","content":[{"type":"text","text":"Based on the terminal output in your screenshot, **training is currently not running, and it likely crashed or encountered an error.**\n\nHere's why:\n\n1.  **Exit Status:** At the bottom, you can see the message `[1] + 100120 exit 1`. An exit code of `1` in Linux/Unix systems almost always indicates that the program terminated due to an error.\n2.  **Return to Prompt:** You have a fresh command prompt (`autoresearch/phase1... []`), which means the previous command has finished executing and control has returned to the terminal.\n3.  **Potential Reason for Crash:** Before it stopped, the training seemed to be progressing well—the `val_loss` was decreasing from **7.1684** to **6.2248**. However, the command was piped to `head -50`, which would stop the process after 50 lines of output. This might have caused a \"Broken Pipe\" error if the script tried to print more output after that.\n\n**What to do next:**\n*   Check for any error messages that might have appeared above the part shown.\n*   Try running the command without the `| head -50` part (e.g., `python3 ~/parameter-golf/train_kaggle.py`) to see the full output and capture any error messages at the end.\n*   Check if you ran out of disk space or memory (VRAM/RAM), which are common causes for training to crash mid-way."}],"details":{"server":"MiniMax","tool":"understand_image","structuredContent":{"type":"text","text":"Based on the terminal output in your screenshot, **training is currently not running, and it likely crashed or encountered an error.**\n\nHere's why:\n\n1.  **Exit Status:** At the bottom, you can see the message `[1] + 100120 exit 1`. An exit code of `1` in Linux/Unix systems almost always indicates that the program terminated due to an error.\n2.  **Return to Prompt:** You have a fresh command prompt (`autoresearch/phase1... []`), which means the previous command has finished executing and control has returned to the terminal.\n3.  **Potential Reason for Crash:** Before it stopped, the training seemed to be progressing well—the `val_loss` was decreasing from **7.1684** to **6.2248**. However, the command was piped to `head -50`, which would stop the process after 50 lines of output. This might have caused a \"Broken Pipe\" error if the script tried to print more output after that.\n\n**What to do next:**\n*   Check for any error messages that might have appeared above the part shown.\n*   Try running the command without the `| head -50` part (e.g., `python3 ~/parameter-golf/train_kaggle.py`) to see the full output and capture any error messages at the end.\n*   Check if you ran out of disk space or memory (VRAM/RAM), which are common causes for training to crash mid-way.","annotations":null,"_meta":null},"isError":false},"isError":false,"timestamp":1777289685032}}
{"type":"message","id":"c0e8fe0b","parentId":"b3f149cf","timestamp":"2026-04-27T11:34:51.961Z","message":{"role":"assistant","content":[{"type":"thinking","thinking":"It's still showing the old output from the previous command. The issue is that there's a broken pipe from the `head -50` command. Let me kill this and run fresh without piping.","thinkingSignature":"e2ad3d92997ac5d59c7f4cb49ba6d501f9892f7942e3df11fd871409e053aae9"},{"type":"toolCall","id":"call_function_p7e3901uqoob_1","name":"bash","arguments":{"command":"agent-browser type \"\" \"^C\" 2>&1 && agent-browser press Enter 2>&1 && sleep 1"}}],"api":"anthropic-messages","provider":"minimax","model":"MiniMax-M2.7","usage":{"input":57631,"output":87,"cacheRead":9348,"cacheWrite":0,"totalTokens":67066,"cost":{"input":0.0172893,"output":0.00010439999999999999,"cacheRead":0.0005608799999999999,"cacheWrite":0,"total":0.01795458}},"stopReason":"toolUse","timestamp":1777289685041,"responseId":"063e7cd7caec08d1d28c33232bc3cc1e"}}
{"type":"message","id":"894fe8d6","parentId":"c0e8fe0b","timestamp":"2026-04-27T11:34:53.401Z","message":{"role":"toolResult","toolCallId":"call_function_p7e3901uqoob_1","toolName":"bash","content":[{"type":"text","text":"✓ Done\n✓ Done\n"}],"isError":false,"timestamp":1777289693401}}
{"type":"message","id":"77cfe3e6","parentId":"894fe8d6","timestamp":"2026-04-27T11:34:58.155Z","message":{"role":"assistant","content":[{"type":"thinking","thinking":"Let me clear and run fresh without any piping.","thinkingSignature":"5bad98ef612724c32f15019eb45de06d26d3b50d89779aa1c6979a2c1652e96f"},{"type":"toolCall","id":"call_function_4wp4p7oix8go_1","name":"bash","arguments":{"command":"agent-browser type \"\" \"python3 train_kaggle.py\" 2>&1 && agent-browser press Enter 2>&1"}}],"api":"anthropic-messages","provider":"minimax","model":"MiniMax-M2.7","usage":{"input":57739,"output":60,"cacheRead":9348,"cacheWrite":0,"totalTokens":67147,"cost":{"input":0.0173217,"output":0.000072,"cacheRead":0.0005608799999999999,"cacheWrite":0,"total":0.017954579999999998}},"stopReason":"toolUse","timestamp":1777289693409,"responseId":"063e7cddbce9443d4625e5177c211717"}}
{"type":"message","id":"c4c28b44","parentId":"77cfe3e6","timestamp":"2026-04-27T11:34:58.591Z","message":{"role":"toolResult","toolCallId":"call_function_4wp4p7oix8go_1","toolName":"bash","content":[{"type":"text","text":"✓ Done\n✓ Done\n"}],"isError":false,"timestamp":1777289698591}}
{"type":"message","id":"4ed2e6a1","parentId":"c4c28b44","timestamp":"2026-04-27T11:35:02.341Z","message":{"role":"assistant","content":[{"type":"thinking","thinking":"Let me wait and check.","thinkingSignature":"c4fee00d46a721037777d6ec4307c893cbe9be85efb90e417a7490894a8745fe"},{"type":"toolCall","id":"call_function_mjg55dh51na7_1","name":"bash","arguments":{"command":"sleep 30 && agent-browser screenshot 2>&1"}}],"api":"anthropic-messages","provider":"minimax","model":"MiniMax-M2.7","usage":{"input":57820,"output":42,"cacheRead":9348,"cacheWrite":0,"totalTokens":67210,"cost":{"input":0.017346,"output":0.0000504,"cacheRead":0.0005608799999999999,"cacheWrite":0,"total":0.01795728}},"stopReason":"toolUse","timestamp":1777289698597,"responseId":"063e7ce3a263c1b5ef311049d5de29af"}}
{"type":"message","id":"749aba2c","parentId":"4ed2e6a1","timestamp":"2026-04-27T11:35:32.674Z","message":{"role":"toolResult","toolCallId":"call_function_mjg55dh51na7_1","toolName":"bash","content":[{"type":"text","text":"✓ Screenshot saved to /Users/dhruv2mars/.agent-browser/tmp/screenshots/screenshot-1777289732665.png\n"}],"isError":false,"timestamp":1777289732674}}
{"type":"message","id":"8b7e9f29","parentId":"749aba2c","timestamp":"2026-04-27T11:35:38.143Z","message":{"role":"assistant","content":[{"type":"thinking","thinking":"Let me check.","thinkingSignature":"155764a1465f1aa31e7510f8cd8266c6638b35b4a37882161cbf92b1741bf4f4"},{"type":"toolCall","id":"call_function_h47jlw1zlf20_1","name":"understand_image","arguments":{"prompt":"Is training running now? Show status and any errors.","image_url":"/Users/dhruv2mars/.agent-browser/tmp/screenshots/screenshot-1777289732665.png"}}],"api":"anthropic-messages","provider":"minimax","model":"MiniMax-M2.7","usage":{"input":57905,"output":72,"cacheRead":9348,"cacheWrite":0,"totalTokens":67325,"cost":{"input":0.017371499999999998,"output":0.0000864,"cacheRead":0.0005608799999999999,"cacheWrite":0,"total":0.018018779999999998}},"stopReason":"toolUse","timestamp":1777289732679,"responseId":"063e7d07ce5ac8958d8b00a94e8564f2"}}
{"type":"message","id":"26f2c012","parentId":"8b7e9f29","timestamp":"2026-04-27T11:35:48.779Z","message":{"role":"toolResult","toolCallId":"call_function_h47jlw1zlf20_1","toolName":"understand_image","content":[{"type":"text","text":"Based on the screenshot, training is **not currently running**.\n\nHere is the status and the identified error:\n\n*   **Status:** The training process has stopped. The terminal shows a shell prompt (`⚡ autoresearch/...`), which means the last command has finished executing. Additionally, the T4 GPU monitor at the top shows no active utilization.\n*   **Error:** There is an error indicator in the terminal. The output shows:\n    `[1] + 100120 exit 1 load_conda_and_run python3 ~/parameter-golf/train_kaggle.py`\n    The **`exit 1`** indicates that the training script (`train_kaggle.py`) crashed or terminated with an error. \n\nThe last successful log output shows the training reached **step 150**, achieved a `val_loss` of 6.2248, and saved a \"Best checkpoint\" before it stopped. To find the specific cause of the crash, you would need to look further up in the terminal history or check any generated error logs, as the current view only shows the exit status."}],"details":{"server":"MiniMax","tool":"understand_image","structuredContent":{"type":"text","text":"Based on the screenshot, training is **not currently running**.\n\nHere is the status and the identified error:\n\n*   **Status:** The training process has stopped. The terminal shows a shell prompt (`⚡ autoresearch/...`), which means the last command has finished executing. Additionally, the T4 GPU monitor at the top shows no active utilization.\n*   **Error:** There is an error indicator in the terminal. The output shows:\n    `[1] + 100120 exit 1 load_conda_and_run python3 ~/parameter-golf/train_kaggle.py`\n    The **`exit 1`** indicates that the training script (`train_kaggle.py`) crashed or terminated with an error. \n\nThe last successful log output shows the training reached **step 150**, achieved a `val_loss` of 6.2248, and saved a \"Best checkpoint\" before it stopped. To find the specific cause of the crash, you would need to look further up in the terminal history or check any generated error logs, as the current view only shows the exit status.","annotations":null,"_meta":null},"isError":false},"isError":false,"timestamp":1777289748779}}
{"type":"message","id":"6bc9328a","parentId":"26f2c012","timestamp":"2026-04-27T11:35:59.605Z","message":{"role":"assistant","content":[{"type":"thinking","thinking":"It's still showing old output. Let me try to scroll up to see if there are any actual errors, or check what the real issue is. The `load_conda_and_run` wrapper seems to be causing issues.","thinkingSignature":"7f358390fbd772f321a39f9f41df26a7f27bfd0e81a31fea97581f1ed2028751"},{"type":"toolCall","id":"call_function_cy6qxgpuro4e_1","name":"bash","arguments":{"command":"agent-browser type \"\" \"source ~/.bashrc 2>/dev/null; which python; python --version\" 2>&1 && agent-browser press Enter 2>&1 && sleep 3 && agent-browser screenshot 2>&1"}}],"api":"anthropic-messages","provider":"minimax","model":"MiniMax-M2.7","usage":{"input":58208,"output":116,"cacheRead":9348,"cacheWrite":0,"totalTokens":67672,"cost":{"input":0.0174624,"output":0.0001392,"cacheRead":0.0005608799999999999,"cacheWrite":0,"total":0.018162479999999998}},"stopReason":"toolUse","timestamp":1777289748787,"responseId":"063e7d1bdbc44747b16957550dd8dca3"}}
{"type":"message","id":"169e342b","parentId":"6bc9328a","timestamp":"2026-04-27T11:36:03.442Z","message":{"role":"toolResult","toolCallId":"call_function_cy6qxgpuro4e_1","toolName":"bash","content":[{"type":"text","text":"✓ Done\n✓ Done\n✓ Screenshot saved to /Users/dhruv2mars/.agent-browser/tmp/screenshots/screenshot-1777289763432.png\n"}],"isError":false,"timestamp":1777289763442}}
{"type":"message","id":"25d707c9","parentId":"169e342b","timestamp":"2026-04-27T11:36:09.765Z","message":{"role":"assistant","content":[{"type":"thinking","thinking":"Let me check.","thinkingSignature":"155764a1465f1aa31e7510f8cd8266c6638b35b4a37882161cbf92b1741bf4f4"},{"type":"toolCall","id":"call_function_4h3i9jtqtg6c_1","name":"understand_image","arguments":{"prompt":"What is the python version and path?","image_url":"/Users/dhruv2mars/.agent-browser/tmp/screenshots/screenshot-1777289763432.png"}}],"api":"anthropic-messages","provider":"minimax","model":"MiniMax-M2.7","usage":{"input":58373,"output":69,"cacheRead":9348,"cacheWrite":0,"totalTokens":67790,"cost":{"input":0.0175119,"output":0.0000828,"cacheRead":0.0005608799999999999,"cacheWrite":0,"total":0.01815558}},"stopReason":"toolUse","timestamp":1777289763447,"responseId":"063e7d2557655fbf8144e276fb24ad87"}}
