{"type":"message","id":"eb0d54d0","parentId":"d802d321","timestamp":"2026-04-27T11:18:24.171Z","message":{"role":"toolResult","toolCallId":"call_function_j6a8vneymkss_1","toolName":"bash","content":[{"type":"text","text":"(no output)"}],"isError":false,"timestamp":1777288704171}}
{"type":"message","id":"8308939e","parentId":"eb0d54d0","timestamp":"2026-04-27T11:18:29.496Z","message":{"role":"assistant","content":[{"type":"thinking","thinking":"The port isn't open. Let me try running the command differently or check if Brave supports remote debugging.","thinkingSignature":"789f88cee03955004c5cf3ed366626dbccc81511b8da0e4aca69a6e13130f84c"},{"type":"toolCall","id":"call_function_9jt1wwt8mmw3_1","name":"bash","arguments":{"command":"ps aux | grep -i brave | grep -v grep | head -3"}}],"api":"anthropic-messages","provider":"minimax","model":"MiniMax-M2.7","usage":{"input":45547,"output":61,"cacheRead":9348,"cacheWrite":0,"totalTokens":54956,"cost":{"input":0.0136641,"output":0.00007319999999999999,"cacheRead":0.0005608799999999999,"cacheWrite":0,"total":0.01429818}},"stopReason":"toolUse","timestamp":1777288704175,"responseId":"063e79021fe8a07b78fd56e2332e1b34"}}
{"type":"message","id":"3df6312d","parentId":"8308939e","timestamp":"2026-04-27T11:18:29.590Z","message":{"role":"toolResult","toolCallId":"call_function_9jt1wwt8mmw3_1","toolName":"bash","content":[{"type":"text","text":"dhruv2mars       67257   1.6  0.6 486516832 105888   ??  S     4:59PM  53:24.13 /Applications/Brave Browser.app/Contents/Frameworks/Brave Browser Framework.framework/Versions/147.1.89.143/Helpers/Brave Browser Helper.app/Contents/MacOS/Brave Browser Helper --type=gpu-process --metrics-client-id=f1323857-24f6-4152-b78f-5b573a523236 --start-stack-profiler --gpu-preferences=SAAAAAAAAAAgAQAEAAAAAAAAAAAAAGAAAwAAAAAAAAAAAAAAAAAAAAIAAAAAAAAAAAAAAAAAAAAQAAAAAAAAABAAAAAAAAAACAAAAAAAAAAIAAAAAAAAAA== --shared-files --metrics-shmem-handle=1752395122,r,9393832315711841727,3799790649145597995,262144 --field-trial-handle=1718379636,r,18096080697482261582,11882613311223524539,262144 --variations-seed-version=main@fd393f9ffb5b987404ebe64f1c0d4fdffbe29e30 --pseudonymization-salt-handle=1935764596,r,3529630322230753069,16498665206353708603,4 --trace-process-track-uuid=3190708988185955192 --seatbelt-client=33\ndhruv2mars       67035   1.2  2.2 486950928 367200   ??  S     4:58PM  19:24.87 /Applications/Brave Browser.app/Contents/MacOS/Brave Browser\ndhruv2mars       95476   1.0  1.2 1890615600 197664   ??  S     4:37PM   0:00.33 /Applications/Brave Browser.app/Contents/Frameworks/Brave Browser Framework.framework/Versions/147.1.89.143/Helpers/Brave Browser Helper (Renderer).app/Contents/MacOS/Brave Browser Helper (Renderer) --type=renderer --metrics-client-id=f1323857-24f6-4152-b78f-5b573a523236 --enable-distillability-service REDACTED,fMS4mpO6buLQ/QMd+zJmxzty/VQ6B1EUZqoCU04zoRU= --lang=en-US --num-raster-threads=4 --enable-zero-copy --enable-gpu-memory-buffer-compositor-resources --enable-main-frame-before-activation --renderer-client-id=3153 --time-ticks-at-unix-epoch=-1777021065294480 --launch-time-ticks=266972497178 --shared-files --metrics-shmem-handle=1752395122,r,3331699205403569895,5129801742246768737,2097152 --field-trial-handle=1718379636,r,18096080697482261582,11882613311223524539,262144 --variations-seed-version=main@fd393f9ffb5b987404ebe64f1c0d4fdffbe29e30 --pseudonymization-salt-handle=1935764596,r,3529630322230753069,16498665206353708603,4 --trace-process-track-uuid=3190711940804821391 --seatbelt-client=186\n"}],"isError":false,"timestamp":1777288709590}}
{"type":"message","id":"65550006","parentId":"3df6312d","timestamp":"2026-04-27T11:18:33.621Z","message":{"role":"assistant","content":[{"type":"thinking","thinking":"Brave is running. The issue is the `--remote-debugging-port` flag didn't work with `open -a`. Let me try running Brave directly with the flag.","thinkingSignature":"33918314c3670bc167fba3511655192683c0fd3249ee1b9dfc20d6fbb493d048"},{"type":"toolCall","id":"call_function_a9w21w4ez9tx_1","name":"bash","arguments":{"command":"/Applications/Brave\\ Browser.app/Contents/MacOS/Brave\\ Browser --remote-debugging-port=9222 &"}}],"api":"anthropic-messages","provider":"minimax","model":"MiniMax-M2.7","usage":{"input":46388,"output":84,"cacheRead":9348,"cacheWrite":0,"totalTokens":55820,"cost":{"input":0.013916399999999999,"output":0.0001008,"cacheRead":0.0005608799999999999,"cacheWrite":0,"total":0.014578079999999998}},"stopReason":"toolUse","timestamp":1777288709594,"responseId":"063e790603143809e2553e55057eb58b"}}
{"type":"message","id":"5166dd98","parentId":"65550006","timestamp":"2026-04-27T11:18:33.733Z","message":{"role":"toolResult","toolCallId":"call_function_a9w21w4ez9tx_1","toolName":"bash","content":[{"type":"text","text":"(no output)"}],"isError":false,"timestamp":1777288713733}}
{"type":"message","id":"477a61d3","parentId":"5166dd98","timestamp":"2026-04-27T11:18:36.693Z","message":{"role":"assistant","content":[{"type":"thinking","thinking":"Let me wait and check if it's listening.","thinkingSignature":"62b1cef728abce2701961c3d2623446bc9e8a277a78d2c04dc5ced3039a79af3"},{"type":"toolCall","id":"call_function_b1dn63dys8jw_1","name":"bash","arguments":{"command":"sleep 3 && lsof -i :9222 2>/dev/null | head -3"}}],"api":"anthropic-messages","provider":"minimax","model":"MiniMax-M2.7","usage":{"input":46490,"output":54,"cacheRead":9348,"cacheWrite":0,"totalTokens":55892,"cost":{"input":0.013947,"output":0.0000648,"cacheRead":0.0005608799999999999,"cacheWrite":0,"total":0.01457268}},"stopReason":"toolUse","timestamp":1777288713736,"responseId":"063e790a71eb0145a99cb31a811f9fa1"}}
{"type":"message","id":"cd66bad7","parentId":"477a61d3","timestamp":"2026-04-27T11:18:39.779Z","message":{"role":"toolResult","toolCallId":"call_function_b1dn63dys8jw_1","toolName":"bash","content":[{"type":"text","text":"(no output)"}],"isError":false,"timestamp":1777288719779}}
{"type":"message","id":"92bec1e2","parentId":"cd66bad7","timestamp":"2026-04-27T11:18:45.039Z","message":{"role":"assistant","content":[{"type":"thinking","thinking":"Still not working. Let me try a different approach - use CDP directly to connect to an existing Brave window.","thinkingSignature":"15e0e394429631f33fe0b6b49809492188f9029250f465fea32d909367a4036a"},{"type":"toolCall","id":"call_function_c2hiiou0xdxu_1","name":"bash","arguments":{"command":"# Try to find the CDP unix socket\nls ~/Library/Application\\ Support/Brave*/*/SingletonSocket 2>/dev/null || ls ~/Library/Application\\ Support/Brave*/*/*/SingletonSocket 2>/dev/null"}}],"api":"anthropic-messages","provider":"minimax","model":"MiniMax-M2.7","usage":{"input":46562,"output":96,"cacheRead":9348,"cacheWrite":0,"totalTokens":56006,"cost":{"input":0.0139686,"output":0.0001152,"cacheRead":0.0005608799999999999,"cacheWrite":0,"total":0.014644679999999998}},"stopReason":"toolUse","timestamp":1777288719783,"responseId":"063e79105ffa1da0050a994946a57dcd"}}
{"type":"message","id":"1babd55f","parentId":"92bec1e2","timestamp":"2026-04-27T11:18:45.065Z","message":{"role":"toolResult","toolCallId":"call_function_c2hiiou0xdxu_1","toolName":"bash","content":[{"type":"text","text":"/Users/dhruv2mars/Library/Application Support/BraveSoftware/Brave-Browser/SingletonSocket\n"}],"isError":false,"timestamp":1777288725065}}
{"type":"message","id":"d55f2faf","parentId":"1babd55f","timestamp":"2026-04-27T11:18:50.196Z","message":{"role":"assistant","content":[{"type":"thinking","thinking":"Found the singleton socket. Let me try connecting via CDP through that socket or try a different approach.\n\nActually, let me just try the simplest thing - run Brave with the remote debugging port on a different port that might work.","thinkingSignature":"63737b886cf4a484ea0657213fa2e1b99ddfe1900377dc6215024de36869bade"},{"type":"toolCall","id":"call_function_8n66jqpfn674_1","name":"bash","arguments":{"command":"/Applications/Brave\\ Browser.app/Contents/MacOS/Brave\\ Browser --remote-debugging-port=9223 --user-data-dir=/tmp/brave-debug 2>&1 &"}}],"api":"anthropic-messages","provider":"minimax","model":"MiniMax-M2.7","usage":{"input":46695,"output":109,"cacheRead":9348,"cacheWrite":0,"totalTokens":56152,"cost":{"input":0.0140085,"output":0.00013079999999999998,"cacheRead":0.0005608799999999999,"cacheWrite":0,"total":0.01470018}},"stopReason":"toolUse","timestamp":1777288725071,"responseId":"063e79152510fd7eea44dcd2ebb8d6d6"}}
{"type":"message","id":"142fa621","parentId":"d55f2faf","timestamp":"2026-04-27T11:18:50.311Z","message":{"role":"toolResult","toolCallId":"call_function_8n66jqpfn674_1","toolName":"bash","content":[{"type":"text","text":"(no output)"}],"isError":false,"timestamp":1777288730311}}
{"type":"message","id":"dd21ba6f","parentId":"142fa621","timestamp":"2026-04-27T11:18:53.784Z","message":{"role":"assistant","content":[{"type":"thinking","thinking":"Let me check if it worked.","thinkingSignature":"daa588d067bd6bd7fe173b9ebbe1ef8d7fdd6edf3ccfed700d7618d26162a601"},{"type":"toolCall","id":"call_function_sfonnjl6cr8z_1","name":"bash","arguments":{"command":"sleep 3 && lsof -i :9223 2>/dev/null | head -3"}}],"api":"anthropic-messages","provider":"minimax","model":"MiniMax-M2.7","usage":{"input":46822,"output":52,"cacheRead":9348,"cacheWrite":0,"totalTokens":56222,"cost":{"input":0.0140466,"output":0.0000624,"cacheRead":0.0005608799999999999,"cacheWrite":0,"total":0.01466988}},"stopReason":"toolUse","timestamp":1777288730315,"responseId":"063e791a59e9197d7e678de2ce615353"}}
{"type":"message","id":"dfe1aed7","parentId":"dd21ba6f","timestamp":"2026-04-27T11:18:56.844Z","message":{"role":"toolResult","toolCallId":"call_function_sfonnjl6cr8z_1","toolName":"bash","content":[{"type":"text","text":"COMMAND    PID       USER   FD   TYPE             DEVICE SIZE/OFF NODE NAME\nBrave\\x20 4415 dhruv2mars   57u  IPv4 0x1f4269fc5883fb5a      0t0  TCP localhost:9223 (LISTEN)\n"}],"isError":false,"timestamp":1777288736844}}
{"type":"message","id":"0219e9af","parentId":"dfe1aed7","timestamp":"2026-04-27T11:19:00.017Z","message":{"role":"assistant","content":[{"type":"thinking","thinking":"It's listening on port 9223. Let me connect agent-browser to it.","thinkingSignature":"81a9f293f73ba82446759fb87adb7c933a2f4643b325f91bf49ac3c9f9e845c7"},{"type":"toolCall","id":"call_function_na4enbaasti4_1","name":"bash","arguments":{"command":"agent-browser close 2>&1 && sleep 1 && agent-browser connect localhost:9223 2>&1"}}],"api":"anthropic-messages","provider":"minimax","model":"MiniMax-M2.7","usage":{"input":46953,"output":64,"cacheRead":9348,"cacheWrite":0,"totalTokens":56365,"cost":{"input":0.0140859,"output":0.0000768,"cacheRead":0.0005608799999999999,"cacheWrite":0,"total":0.01472358}},"stopReason":"toolUse","timestamp":1777288736848,"responseId":"063e79218faaa02294fdf5ceaebf83be"}}
{"type":"message","id":"d909d8ec","parentId":"0219e9af","timestamp":"2026-04-27T11:19:01.212Z","message":{"role":"toolResult","toolCallId":"call_function_na4enbaasti4_1","toolName":"bash","content":[{"type":"text","text":"✓ Browser closed\nInvalid value: 'localhost:9223' is not a valid port number or URL\nUsage: agent-browser connect <port|url>\n\n\nCommand exited with code 1"}],"details":{},"isError":true,"timestamp":1777288741212}}
{"type":"message","id":"d835e928","parentId":"d909d8ec","timestamp":"2026-04-27T11:19:04.737Z","message":{"role":"assistant","content":[{"type":"thinking","thinking":"Let me try with the port number only.","thinkingSignature":"763afb3b604e96cf382f2d2a509056d86963a9e169361399b8abf17a93c7c27f"},{"type":"toolCall","id":"call_function_vjewomhayfe2_1","name":"bash","arguments":{"command":"agent-browser connect 9223 2>&1"}}],"api":"anthropic-messages","provider":"minimax","model":"MiniMax-M2.7","usage":{"input":47070,"output":44,"cacheRead":9348,"cacheWrite":0,"totalTokens":56462,"cost":{"input":0.014121,"output":0.000052799999999999996,"cacheRead":0.0005608799999999999,"cacheWrite":0,"total":0.01473468}},"stopReason":"toolUse","timestamp":1777288741216,"responseId":"063e7925bad2ad78e7162d692c068bb0"}}
{"type":"message","id":"c963adf4","parentId":"d835e928","timestamp":"2026-04-27T11:19:04.953Z","message":{"role":"toolResult","toolCallId":"call_function_vjewomhayfe2_1","toolName":"bash","content":[{"type":"text","text":"✓ Done\n"}],"isError":false,"timestamp":1777288744953}}
{"type":"message","id":"26fa2893","parentId":"c963adf4","timestamp":"2026-04-27T11:19:08.262Z","message":{"role":"assistant","content":[{"type":"thinking","thinking":"Connected. Now let me navigate to the Lightning AI studio.","thinkingSignature":"cb6ecb4c4d2e50081707bbc885d45a1985c652325720e2d5dbbd4d87e73965cf"},{"type":"toolCall","id":"call_function_kgres856k83j_1","name":"bash","arguments":{"command":"agent-browser open \"https://lightning.ai/dhruv2mars/default-project/studios/parameter-golf/code\" 2>&1"}}],"api":"anthropic-messages","provider":"minimax","model":"MiniMax-M2.7","usage":{"input":47132,"output":66,"cacheRead":9348,"cacheWrite":0,"totalTokens":56546,"cost":{"input":0.014139599999999999,"output":0.0000792,"cacheRead":0.0005608799999999999,"cacheWrite":0,"total":0.014779679999999998}},"stopReason":"toolUse","timestamp":1777288744960,"responseId":"063e79294688e6a7ddb943579466da63"}}
{"type":"message","id":"ea454eae","parentId":"26fa2893","timestamp":"2026-04-27T11:19:10.617Z","message":{"role":"toolResult","toolCallId":"call_function_kgres856k83j_1","toolName":"bash","content":[{"type":"text","text":"✓ Lightning AI\n  https://lightning.ai/dhruv2mars/default-project/studios/parameter-golf/code\n"}],"isError":false,"timestamp":1777288750617}}
{"type":"message","id":"0b062bce","parentId":"ea454eae","timestamp":"2026-04-27T11:19:14.111Z","message":{"role":"assistant","content":[{"type":"thinking","thinking":"Good. Let me take a screenshot to see if we're logged in.","thinkingSignature":"68355565fedbd19222364785b2f961823a9dbfe0b196fd9984256d21d9a5413c"},{"type":"toolCall","id":"call_function_hg5o99whquid_1","name":"bash","arguments":{"command":"agent-browser screenshot 2>&1"}}],"api":"anthropic-messages","provider":"minimax","model":"MiniMax-M2.7","usage":{"input":47239,"output":46,"cacheRead":9348,"cacheWrite":0,"totalTokens":56633,"cost":{"input":0.014171699999999999,"output":0.0000552,"cacheRead":0.0005608799999999999,"cacheWrite":0,"total":0.014787779999999999}},"stopReason":"toolUse","timestamp":1777288750622,"responseId":"063e792fa01eee122a18020204a02366"}}
{"type":"message","id":"0ede1670","parentId":"0b062bce","timestamp":"2026-04-27T11:19:14.377Z","message":{"role":"toolResult","toolCallId":"call_function_hg5o99whquid_1","toolName":"bash","content":[{"type":"text","text":"✓ Screenshot saved to /Users/dhruv2mars/.agent-browser/tmp/screenshots/screenshot-1777288754369.png\n"}],"isError":false,"timestamp":1777288754377}}
{"type":"message","id":"25fa6adb","parentId":"0ede1670","timestamp":"2026-04-27T11:19:18.358Z","message":{"role":"assistant","content":[{"type":"thinking","thinking":"Let me look at the screenshot.","thinkingSignature":"4e090fae90d1c90e966c2a895525a03d49938961c3937df68b9f375480ff40b6"},{"type":"toolCall","id":"call_function_zwqg9gnvdubi_1","name":"understand_image","arguments":{"prompt":"What is on screen? Is it logged in? Can I see a terminal?","image_url":"/Users/dhruv2mars/.agent-browser/tmp/screenshots/screenshot-1777288754369.png"}}],"api":"anthropic-messages","provider":"minimax","model":"MiniMax-M2.7","usage":{"input":47328,"output":80,"cacheRead":9348,"cacheWrite":0,"totalTokens":56756,"cost":{"input":0.0141984,"output":0.000096,"cacheRead":0.0005608799999999999,"cacheWrite":0,"total":0.01485528}},"stopReason":"toolUse","timestamp":1777288754381,"responseId":"063e793205a06a1f2ac20435a3c740c5"}}
{"type":"message","id":"e8944267","parentId":"25fa6adb","timestamp":"2026-04-27T11:19:26.382Z","message":{"role":"toolResult","toolCallId":"call_function_zwqg9gnvdubi_1","toolName":"understand_image","content":[{"type":"text","text":"On the screen is a **Google Sign-in prompt** for the website `lightning.ai`.\n\nTo answer your specific questions:\n\n*   **Is it logged in?** No. The screen is asking for an email or phone number to begin the login process.\n*   **Can I see a terminal?** No. There is no terminal or command-line interface visible on this screen; it is strictly a login page."}],"details":{"server":"MiniMax","tool":"understand_image","structuredContent":{"type":"text","text":"On the screen is a **Google Sign-in prompt** for the website `lightning.ai`.\n\nTo answer your specific questions:\n\n*   **Is it logged in?** No. The screen is asking for an email or phone number to begin the login process.\n*   **Can I see a terminal?** No. There is no terminal or command-line interface visible on this screen; it is strictly a login page.","annotations":null,"_meta":null},"isError":false},"isError":false,"timestamp":1777288766382}}
{"type":"message","id":"aaa38c47","parentId":"e8944267","timestamp":"2026-04-27T11:19:31.678Z","message":{"role":"assistant","content":[{"type":"thinking","thinking":"We're at the Google login page. The user needs to complete the login. Let me wait for them.","thinkingSignature":"afc98cb1bf57f32aeb70d9e7c051577b6239f9926fd367ff8b59022af2148730"},{"type":"text","text":"At Google login page. Your turn — login to Lightning AI."}],"api":"anthropic-messages","provider":"minimax","model":"MiniMax-M2.7","usage":{"input":47505,"output":38,"cacheRead":9348,"cacheWrite":0,"totalTokens":56891,"cost":{"input":0.014251499999999999,"output":0.0000456,"cacheRead":0.0005608799999999999,"cacheWrite":0,"total":0.014857979999999998}},"stopReason":"stop","timestamp":1777288766389,"responseId":"063e7940c27c1d9d6de600aa2b185f02"}}
{"type":"message","id":"a0f8cf5b","parentId":"aaa38c47","timestamp":"2026-04-27T11:19:49.866Z","message":{"role":"user","content":[{"type":"text","text":"done, see now"}],"timestamp":1777288789855}}
{"type":"message","id":"974f4b22","parentId":"a0f8cf5b","timestamp":"2026-04-27T11:19:56.569Z","message":{"role":"assistant","content":[{"type":"thinking","thinking":"Let me take a screenshot to see the current state.","thinkingSignature":"e7f7d124915fa0b32c4598ffc84d0067b382a60ebb63ded7dca4599649fb72b7"},{"type":"toolCall","id":"call_function_z9dr7i4vyvcu_1","name":"bash","arguments":{"command":"agent-browser screenshot 2>&1"}}],"api":"anthropic-messages","provider":"minimax","model":"MiniMax-M2.7","usage":{"input":13,"output":43,"cacheRead":9348,"cacheWrite":47026,"totalTokens":56430,"cost":{"input":0.0000039,"output":0.0000516,"cacheRead":0.0005608799999999999,"cacheWrite":0.01763475,"total":0.01825113}},"stopReason":"toolUse","timestamp":1777288789866,"responseId":"063e7958db96eec90a78702e44302dbb"}}
{"type":"message","id":"c1d08202","parentId":"974f4b22","timestamp":"2026-04-27T11:19:56.903Z","message":{"role":"toolResult","toolCallId":"call_function_z9dr7i4vyvcu_1","toolName":"bash","content":[{"type":"text","text":"✓ Screenshot saved to /Users/dhruv2mars/.agent-browser/tmp/screenshots/screenshot-1777288796894.png\n"}],"isError":false,"timestamp":1777288796903}}
{"type":"message","id":"5b9ba0aa","parentId":"c1d08202","timestamp":"2026-04-27T11:20:00.976Z","message":{"role":"assistant","content":[{"type":"thinking","thinking":"Let me see what screen we're at now.","thinkingSignature":"afb40020027901e323b9e378ee898a2d4ebe38dccc9d6bd19b46e93730bf3dac"},{"type":"toolCall","id":"call_function_igae8kpko0kk_1","name":"understand_image","arguments":{"prompt":"What is on screen now? Can I see a terminal or studio interface?","image_url":"/Users/dhruv2mars/.agent-browser/tmp/screenshots/screenshot-1777288796894.png"}}],"api":"anthropic-messages","provider":"minimax","model":"MiniMax-M2.7","usage":{"input":47125,"output":81,"cacheRead":9348,"cacheWrite":0,"totalTokens":56554,"cost":{"input":0.014137499999999999,"output":0.00009719999999999999,"cacheRead":0.0005608799999999999,"cacheWrite":0,"total":0.01479558}},"stopReason":"toolUse","timestamp":1777288796908,"responseId":"063e795de4ea99870717e23f2b177698"}}
