{"type":"message","id":"0b8d3865","parentId":"3762016a","timestamp":"2026-04-27T11:13:37.038Z","message":{"role":"toolResult","toolCallId":"call_function_4q1iooesvetx_1","toolName":"understand_image","content":[{"type":"text","text":"Based on the image provided, this is a **login page**.\n\nHere's why:\n\n*   **Explicit Text:** The center of the screen says, \"Login or create a free account to view this Studio.\"\n*   **Authentication Buttons:** There are prominent buttons to sign in using different methods: Email, Google, GitHub, and SSO.\n*   **Navigation:** The top right corner also features links for \"Log in\" and \"Create account.\"\n\nWhile the text mentions viewing a **Studio**, this is the gatekeeper page you see *before* you can access the actual Studio interface. It is definitely not a **terminal**, as it is a graphical web interface, not a text-based command line."}],"details":{"server":"MiniMax","tool":"understand_image","structuredContent":{"type":"text","text":"Based on the image provided, this is a **login page**.\n\nHere's why:\n\n*   **Explicit Text:** The center of the screen says, \"Login or create a free account to view this Studio.\"\n*   **Authentication Buttons:** There are prominent buttons to sign in using different methods: Email, Google, GitHub, and SSO.\n*   **Navigation:** The top right corner also features links for \"Log in\" and \"Create account.\"\n\nWhile the text mentions viewing a **Studio**, this is the gatekeeper page you see *before* you can access the actual Studio interface. It is definitely not a **terminal**, as it is a graphical web interface, not a text-based command line.","annotations":null,"_meta":null},"isError":false},"isError":false,"timestamp":1777288417038}}
{"type":"message","id":"b9c7a2cd","parentId":"0b8d3865","timestamp":"2026-04-27T11:13:44.350Z","message":{"role":"assistant","content":[{"type":"thinking","thinking":"I need to log in. The user needs to provide login credentials or a session cookie. Let me ask for them.","thinkingSignature":"b501dfbd280913fecdddc61b6513530053563e8e427b4f72779634f193c42648"},{"type":"text","text":"Need login. Options:\n1. **Give me credentials** — email/password or OAuth token\n2. **Login in your browser** and give me the session cookie\n3. **Login and run this command** to share session:\n   ```bash\n   agent-browser auth export\n   ```\n\nWhich?"}],"api":"anthropic-messages","provider":"minimax","model":"MiniMax-M2.7","usage":{"input":40980,"output":89,"cacheRead":9348,"cacheWrite":0,"totalTokens":50417,"cost":{"input":0.012294,"output":0.0001068,"cacheRead":0.0005608799999999999,"cacheWrite":0,"total":0.01296168}},"stopReason":"stop","timestamp":1777288417046,"responseId":"063e77e3b0a39c58fb90502bd99f608b"}}
{"type":"message","id":"799455fa","parentId":"b9c7a2cd","timestamp":"2026-04-27T11:14:17.764Z","message":{"role":"user","content":[{"type":"text","text":"open in my running brave bowser tab"}],"timestamp":1777288457754}}
{"type":"message","id":"3b5e9bce","parentId":"799455fa","timestamp":"2026-04-27T11:14:27.563Z","message":{"role":"assistant","content":[{"type":"thinking","thinking":"The user wants me to use their existing Brave browser session. Let me check if agent-browser can connect to an existing browser instance.","thinkingSignature":"4a64d9ac2cfbd78e0a8d55b07c92fa946bf35d848cf16da551b7df2626bc42f5"},{"type":"toolCall","id":"call_function_sh5o1mh2nokk_1","name":"bash","arguments":{"command":"agent-browser open --browser brave \"https://lightning.ai/dhruv2mars/default-project/studios/parameter-golf/code\" 2>&1"}}],"api":"anthropic-messages","provider":"minimax","model":"MiniMax-M2.7","usage":{"input":13,"output":83,"cacheRead":49165,"cacheWrite":1022,"totalTokens":50283,"cost":{"input":0.0000039,"output":0.0000996,"cacheRead":0.0029498999999999997,"cacheWrite":0.00038325,"total":0.0034366499999999994}},"stopReason":"toolUse","timestamp":1777288457765,"responseId":"063e780e33f56c098ce9a29cff78308b"}}
{"type":"message","id":"5501362d","parentId":"3b5e9bce","timestamp":"2026-04-27T11:14:27.834Z","message":{"role":"toolResult","toolCallId":"call_function_sh5o1mh2nokk_1","toolName":"bash","content":[{"type":"text","text":"✗ Navigation failed: net::ERR_NAME_NOT_RESOLVED\n\n\nCommand exited with code 1"}],"details":{},"isError":true,"timestamp":1777288467834}}
{"type":"message","id":"50ed9f04","parentId":"5501362d","timestamp":"2026-04-27T11:14:32.887Z","message":{"role":"assistant","content":[{"type":"thinking","thinking":"Let me try with CDP connection to the existing Brave browser.","thinkingSignature":"fb8f8abdd6f4acb9c7c717531f80ed98b81f0dc2b44e8e7bf5788cdb8e26032d"},{"type":"toolCall","id":"call_function_b21djel9uurv_1","name":"bash","arguments":{"command":"lsof -i \"chrome\\|brave\" 2>/dev/null | grep LISTEN | head -5 || echo \"checking remote debugging port...\" && lsof -i :9222 2>/dev/null | head -5"}}],"api":"anthropic-messages","provider":"minimax","model":"MiniMax-M2.7","usage":{"input":40971,"output":85,"cacheRead":9348,"cacheWrite":0,"totalTokens":50404,"cost":{"input":0.0122913,"output":0.000102,"cacheRead":0.0005608799999999999,"cacheWrite":0,"total":0.01295418}},"stopReason":"toolUse","timestamp":1777288467845,"responseId":"063e781467aa4b68423baf53da3ca9f0"}}
{"type":"message","id":"50d38c5c","parentId":"50ed9f04","timestamp":"2026-04-27T11:14:32.978Z","message":{"role":"toolResult","toolCallId":"call_function_b21djel9uurv_1","toolName":"bash","content":[{"type":"text","text":"(no output)"}],"isError":false,"timestamp":1777288472978}}
{"type":"message","id":"9668e8cd","parentId":"50d38c5c","timestamp":"2026-04-27T11:14:36.506Z","message":{"role":"assistant","content":[{"type":"thinking","thinking":"Let me check if brave has remote debugging enabled or if there's another way to connect.","thinkingSignature":"23b221e1a8defeed36d8698a9d1b9973a81d35a47ef053c72b29880f4d58b303"},{"type":"toolCall","id":"call_function_0oo6n3z5to4g_1","name":"bash","arguments":{"command":"ps aux | grep -i \"brave\\|chrome\" | grep -v grep | head -3"}}],"api":"anthropic-messages","provider":"minimax","model":"MiniMax-M2.7","usage":{"input":41074,"output":63,"cacheRead":9348,"cacheWrite":0,"totalTokens":50485,"cost":{"input":0.0123222,"output":0.0000756,"cacheRead":0.0005608799999999999,"cacheWrite":0,"total":0.01295868}},"stopReason":"toolUse","timestamp":1777288472981,"responseId":"063e781954c43ba31415c9b547f878b6"}}
{"type":"message","id":"6a6c695d","parentId":"9668e8cd","timestamp":"2026-04-27T11:14:36.620Z","message":{"role":"toolResult","toolCallId":"call_function_0oo6n3z5to4g_1","toolName":"bash","content":[{"type":"text","text":"dhruv2mars       69955  23.7  4.9 1894886528 822704   ??  R     3:44PM  15:43.71 /Applications/Brave Browser.app/Contents/Frameworks/Brave Browser Framework.framework/Versions/147.1.89.143/Helpers/Brave Browser Helper (Renderer).app/Contents/MacOS/Brave Browser Helper (Renderer) --type=renderer --metrics-client-id=f1323857-24f6-4152-b78f-5b573a523236 --enable-distillability-service REDACTED,fMS4mpO6buLQ/QMd+zJmxzty/VQ6B1EUZqoCU04zoRU= --start-stack-profiler --lang=en-US --num-raster-threads=4 --enable-zero-copy --enable-gpu-memory-buffer-compositor-resources --enable-main-frame-before-activation --renderer-client-id=3036 --time-ticks-at-unix-epoch=-1777021065294480 --launch-time-ticks=263830671416 --shared-files --metrics-shmem-handle=1752395122,r,17045804382658602912,8854531600820297136,2097152 --field-trial-handle=1718379636,r,18096080697482261582,11882613311223524539,262144 --variations-seed-version=main@fd393f9ffb5b987404ebe64f1c0d4fdffbe29e30 --pseudonymization-salt-handle=1935764596,r,3529630322230753069,16498665206353708603,4 --trace-process-track-uuid=3190711831170925058 --seatbelt-client=180\ndhruv2mars       67257  20.1  0.6 486477072 107536   ??  S     4:59PM  52:38.50 /Applications/Brave Browser.app/Contents/Frameworks/Brave Browser Framework.framework/Versions/147.1.89.143/Helpers/Brave Browser Helper.app/Contents/MacOS/Brave Browser Helper --type=gpu-process --metrics-client-id=f1323857-24f6-4152-b78f-5b573a523236 --start-stack-profiler --gpu-preferences=SAAAAAAAAAAgAQAEAAAAAAAAAAAAAGAAAwAAAAAAAAAAAAAAAAAAAAIAAAAAAAAAAAAAAAAAAAAQAAAAAAAAABAAAAAAAAAACAAAAAAAAAAIAAAAAAAAAA== --shared-files --metrics-shmem-handle=1752395122,r,9393832315711841727,3799790649145597995,262144 --field-trial-handle=1718379636,r,18096080697482261582,11882613311223524539,262144 --variations-seed-version=main@fd393f9ffb5b987404ebe64f1c0d4fdffbe29e30 --pseudonymization-salt-handle=1935764596,r,3529630322230753069,16498665206353708603,4 --trace-process-track-uuid=3190708988185955192 --seatbelt-client=33\ndhruv2mars       67035   1.1  2.2 486937424 362048   ??  S     4:58PM  19:22.02 /Applications/Brave Browser.app/Contents/MacOS/Brave Browser\n"}],"isError":false,"timestamp":1777288476620}}
{"type":"message","id":"ecd4300c","parentId":"6a6c695d","timestamp":"2026-04-27T11:14:41.906Z","message":{"role":"assistant","content":[{"type":"thinking","thinking":"Brave is running. Let me try to connect via CDP. I need to find the debugging port. Brave doesn't expose remote debugging by default. \n\nLet me try a different approach - using the CDP via Unix socket or finding the debug port.","thinkingSignature":"e825650d43f5df2c7492e6ad87bd30eb18a8b73f21235e5df9ec4196a43cab7f"},{"type":"toolCall","id":"call_function_ivn8da2t6tbb_1","name":"bash","arguments":{"command":"# Check for CDP port or unix socket\nls ~/Library/Application\\ Support/Brave* 2>/dev/null | head -5\nlsof -p 67035 -i 2>/dev/null | grep -i \"listen\\|stream\" | head -5"}}],"api":"anthropic-messages","provider":"minimax","model":"MiniMax-M2.7","usage":{"input":41922,"output":130,"cacheRead":9348,"cacheWrite":0,"totalTokens":51400,"cost":{"input":0.0125766,"output":0.000156,"cacheRead":0.0005608799999999999,"cacheWrite":0,"total":0.01329348}},"stopReason":"toolUse","timestamp":1777288476623,"responseId":"063e781cc39589a9e4225c6368524cb6"}}
{"type":"message","id":"48f4787f","parentId":"ecd4300c","timestamp":"2026-04-27T11:14:48.571Z","message":{"role":"toolResult","toolCallId":"call_function_ivn8da2t6tbb_1","toolName":"bash","content":[{"type":"text","text":"Brave-Browser\nControlCe   364 dhruv2mars   10u     IPv4 0xe7254e4b6c268eac       0t0                 TCP *:afs3-fileserver (LISTEN)\nControlCe   364 dhruv2mars   11u     IPv6  0x6870bfb6ec8ff69       0t0                 TCP *:afs3-fileserver (LISTEN)\nControlCe   364 dhruv2mars   12u     IPv4 0x94647d6bd79c32c7       0t0                 TCP *:commplex-main (LISTEN)\nControlCe   364 dhruv2mars   13u     IPv6 0x3f0cbf1e6c415890       0t0                 TCP *:commplex-main (LISTEN)\nrapportd    371 dhruv2mars    7u     IPv4  0xa14cd067539283b       0t0                 TCP *:49152 (LISTEN)\n"}],"isError":false,"timestamp":1777288488571}}
{"type":"message","id":"a7949704","parentId":"48f4787f","timestamp":"2026-04-27T11:14:59.886Z","message":{"role":"assistant","content":[{"type":"thinking","thinking":"No remote debugging port exposed. Let me try opening with a different approach - maybe via a profile with debugging enabled or use playwright CDP.\n\nActually, the simplest thing is to just ask the user to run a command in their Brave browser to enable remote debugging temporarily, OR just use the terminal directly.\n\nLet me try using the Brave Browser with remote debugging port if the user has it enabled, or ask them to enable it.\n\nActually wait - let me try `open -a \"Brave Browser\"` with some args to enable debugging.","thinkingSignature":"0a976189e93af99ab48f2543165ae9ab0f9a1c7af630262d6614befc76bd743f"},{"type":"text","text":"Brave not exposing debug port. Two options:\n\n1. **Enable remote debugging in Brave** (one-time):\n   ```bash\n   # Quit Brave first, then run:\n   open -a \"Brave Browser\" --args --remote-debugging-port=9222\n   ```\n   Then tell me to reconnect.\n\n2. **Run commands directly in Lightning terminal** and paste output.\n\nWhich?"}],"api":"anthropic-messages","provider":"minimax","model":"MiniMax-M2.7","usage":{"input":42296,"output":191,"cacheRead":9348,"cacheWrite":0,"totalTokens":51835,"cost":{"input":0.0126888,"output":0.0002292,"cacheRead":0.0005608799999999999,"cacheWrite":0,"total":0.01347888}},"stopReason":"stop","timestamp":1777288488579,"responseId":"063e782b7535c2440bab60b31d743d8c"}}
{"type":"message","id":"1dbc4054","parentId":"a7949704","timestamp":"2026-04-27T11:15:30.952Z","message":{"role":"user","content":[{"type":"text","text":"no, use agent browser skill, and open the lightning page directly on there. i will do the rest"}],"timestamp":1777288530940}}
{"type":"message","id":"9605495a","parentId":"1dbc4054","timestamp":"2026-04-27T11:15:37.675Z","message":{"role":"assistant","content":[{"type":"thinking","thinking":"The user wants me to use agent-browser to open the page directly. Let me try without the --browser flag, as agent-browser should handle it internally.","thinkingSignature":"6598431dfb751a1488e93cb9aada094dff95a56e03f1e0224a7f0ddb9ddf9dd8"},{"type":"toolCall","id":"call_function_mqiephma9pj5_1","name":"bash","arguments":{"command":"agent-browser open \"https://lightning.ai/dhruv2mars/default-project/studios/parameter-golf/code\" 2>&1"}}],"api":"anthropic-messages","provider":"minimax","model":"MiniMax-M2.7","usage":{"input":13,"output":85,"cacheRead":50409,"cacheWrite":1214,"totalTokens":51721,"cost":{"input":0.0000039,"output":0.000102,"cacheRead":0.0030245399999999996,"cacheWrite":0.00045525000000000003,"total":0.0035856899999999995}},"stopReason":"toolUse","timestamp":1777288530952,"responseId":"063e7855d7d89cfabc710c93249faa96"}}
{"type":"message","id":"5f4b8460","parentId":"9605495a","timestamp":"2026-04-27T11:15:38.418Z","message":{"role":"toolResult","toolCallId":"call_function_mqiephma9pj5_1","toolName":"bash","content":[{"type":"text","text":"✓ Lightning AI\n  https://lightning.ai/dhruv2mars/default-project/studios/parameter-golf/code\n"}],"isError":false,"timestamp":1777288538418}}
{"type":"message","id":"5cffaa8c","parentId":"5f4b8460","timestamp":"2026-04-27T11:15:41.367Z","message":{"role":"assistant","content":[{"type":"thinking","thinking":"Let me take a screenshot to see the current state.","thinkingSignature":"e7f7d124915fa0b32c4598ffc84d0067b382a60ebb63ded7dca4599649fb72b7"},{"type":"toolCall","id":"call_function_2p24z4mzgbxf_1","name":"bash","arguments":{"command":"agent-browser screenshot 2>&1"}}],"api":"anthropic-messages","provider":"minimax","model":"MiniMax-M2.7","usage":{"input":42414,"output":43,"cacheRead":9348,"cacheWrite":0,"totalTokens":51805,"cost":{"input":0.0127242,"output":0.0000516,"cacheRead":0.0005608799999999999,"cacheWrite":0,"total":0.01333668}},"stopReason":"toolUse","timestamp":1777288538422,"responseId":"063e785a30f88fa36ea90b0125ac60cf"}}
{"type":"message","id":"fd67f60b","parentId":"5cffaa8c","timestamp":"2026-04-27T11:15:41.636Z","message":{"role":"toolResult","toolCallId":"call_function_2p24z4mzgbxf_1","toolName":"bash","content":[{"type":"text","text":"✓ Screenshot saved to /Users/dhruv2mars/.agent-browser/tmp/screenshots/screenshot-1777288541626.png\n"}],"isError":false,"timestamp":1777288541636}}
{"type":"message","id":"f26acd2b","parentId":"fd67f60b","timestamp":"2026-04-27T11:15:45.637Z","message":{"role":"assistant","content":[{"type":"thinking","thinking":"Let me view the screenshot.","thinkingSignature":"32f9e6dea86b1452120f02da54122631bdc2204cf5589cde5bd60e16bf776f4f"},{"type":"toolCall","id":"call_function_hecy8iggbuaz_1","name":"understand_image","arguments":{"prompt":"What is on screen? Is it logged in? Can I see a terminal or studio interface?","image_url":"/Users/dhruv2mars/.agent-browser/tmp/screenshots/screenshot-1777288541626.png"}}],"api":"anthropic-messages","provider":"minimax","model":"MiniMax-M2.7","usage":{"input":42500,"output":82,"cacheRead":9348,"cacheWrite":0,"totalTokens":51930,"cost":{"input":0.01275,"output":0.00009839999999999999,"cacheRead":0.0005608799999999999,"cacheWrite":0,"total":0.013409279999999999}},"stopReason":"toolUse","timestamp":1777288541640,"responseId":"063e785d7968ce189acf23ce8a90299d"}}
{"type":"message","id":"e116f08f","parentId":"f26acd2b","timestamp":"2026-04-27T11:15:56.574Z","message":{"role":"toolResult","toolCallId":"call_function_hecy8iggbuaz_1","toolName":"understand_image","content":[{"type":"text","text":"Based on the image provided, here are the answers to your questions:\n\n*   **What is on screen?** This is the login and sign-up landing page for **Lightning AI** (the platform created by the developers of PyTorch Lightning). It provides options for users to authenticate using Email, Google, GitHub, or SSO.\n*   **Is it logged in?** **No.** The screen explicitly says \"Login or create a free account to view this Studio.\" Additionally, the \"Log in\" and \"Create account\" buttons are still visible in the top right corner.\n*   **Can I see a terminal or studio interface?** **No.** There is no terminal, code editor, or workspace visible. This page acts as a \"gate\"; you must log in first before the Studio environment and its tools (like a terminal) become accessible."}],"details":{"server":"MiniMax","tool":"understand_image","structuredContent":{"type":"text","text":"Based on the image provided, here are the answers to your questions:\n\n*   **What is on screen?** This is the login and sign-up landing page for **Lightning AI** (the platform created by the developers of PyTorch Lightning). It provides options for users to authenticate using Email, Google, GitHub, or SSO.\n*   **Is it logged in?** **No.** The screen explicitly says \"Login or create a free account to view this Studio.\" Additionally, the \"Log in\" and \"Create account\" buttons are still visible in the top right corner.\n*   **Can I see a terminal or studio interface?** **No.** There is no terminal, code editor, or workspace visible. This page acts as a \"gate\"; you must log in first before the Studio environment and its tools (like a terminal) become accessible.","annotations":null,"_meta":null},"isError":false},"isError":false,"timestamp":1777288556574}}
{"type":"message","id":"7a3e08cd","parentId":"e116f08f","timestamp":"2026-04-27T11:16:04.358Z","message":{"role":"assistant","content":[{"type":"thinking","thinking":"It's still showing the login page. The agent-browser opened the page but isn't logged in. I need the user to log in first. Let me ask them to log in using their browser and then I'll try again.\n\nActually, let me check if agent-browser has a way to handle auth or if we can use saved credentials. Let me check if there's a vault or session management.","thinkingSignature":"188ed810f9270293fb5fe641bf637518dd2b2c4dc40d8b851629f9a20e7a2b1f"},{"type":"text","text":"Still at login. Do your thing — login and navigate to the terminal. I'll wait."}],"api":"anthropic-messages","provider":"minimax","model":"MiniMax-M2.7","usage":{"input":42767,"output":98,"cacheRead":9348,"cacheWrite":0,"totalTokens":52213,"cost":{"input":0.012830099999999999,"output":0.0001176,"cacheRead":0.0005608799999999999,"cacheWrite":0,"total":0.01350858}},"stopReason":"stop","timestamp":1777288556582,"responseId":"063e786fb7b9f567a098143513351c7c"}}
{"type":"message","id":"bfa25559","parentId":"7a3e08cd","timestamp":"2026-04-27T11:16:40.442Z","message":{"role":"user","content":[{"type":"text","text":"there are no tabs in brave. have u ran it"}],"timestamp":1777288600435}}
{"type":"message","id":"96c6ee53","parentId":"bfa25559","timestamp":"2026-04-27T11:16:47.288Z","message":{"role":"assistant","content":[{"type":"thinking","thinking":"The user is saying there are no tabs in Brave. I ran the agent-browser open command, but it seems it might have opened in a fresh browser instance rather than connecting to their running Brave instance. Let me check what agent-browser open actually does - it probably creates a new browser instance.","thinkingSignature":"b7cb8d95c8b01cbd1d7f464016eb469635449faf41b8de9ac91071d37376a338"},{"type":"toolCall","id":"call_function_f0445hufuh2r_1","name":"bash","arguments":{"command":"agent-browser open \"https://lightning.ai/dhruv2mars/default-project/studios/parameter-golf/code\" --help 2>&1 | head -20"}}],"api":"anthropic-messages","provider":"minimax","model":"MiniMax-M2.7","usage":{"input":13,"output":118,"cacheRead":51827,"cacheWrite":254,"totalTokens":52212,"cost":{"input":0.0000039,"output":0.0001416,"cacheRead":0.0031096199999999996,"cacheWrite":0.00009525,"total":0.003350369999999999}},"stopReason":"toolUse","timestamp":1777288600442,"responseId":"063e789a540467bdbc98de5c8625a878"}}
{"type":"message","id":"57e02f92","parentId":"96c6ee53","timestamp":"2026-04-27T11:16:47.376Z","message":{"role":"toolResult","toolCallId":"call_function_f0445hufuh2r_1","toolName":"bash","content":[{"type":"text","text":"agent-browser open - Navigate to a URL\n\nUsage: agent-browser open <url>\n\nNavigates the browser to the specified URL. If no protocol is provided,\nhttps:// is automatically prepended.\n\nAliases: goto, navigate\n\nGlobal Options:\n  --json               Output as JSON\n  --session <name>     Use specific session\n  --headers <json>     Set HTTP headers (scoped to this origin)\n  --headed             Show browser window\n\nExamples:\n  agent-browser open example.com\n  agent-browser open https://github.com\n  agent-browser open localhost:3000\n  agent-browser open api.example.com --headers '{\"Authorization\": \"Bearer token\"}'\n"}],"isError":false,"timestamp":1777288607376}}
