{"type":"message","id":"13148e50","parentId":"ae77c16c","timestamp":"2026-04-25T18:31:41.536Z","message":{"role":"toolResult","toolCallId":"call_function_6tqbfqlz2rhv_1","toolName":"read","content":[{"type":"text","text":"# ============================================================================\n\ndef build_byte_lut(sp, vocab_size, device):\n    \"\"\"Build lookup table: token -> byte count.\"\"\"\n    base_bytes = torch.zeros(vocab_size, dtype=torch.int16, device=device)\n    for i in range(min(int(sp.vocab_size()), vocab_size)):\n        if sp.is_control(i) or sp.is_unknown(i) or sp.is_unused(i):\n            continue\n        piece = sp.id_to_piece(i)\n        if piece.startswith(\"▁\"):\n            piece = piece[1:]\n        base_bytes[i] = len(piece.encode(\"utf-8\"))\n    return base_bytes\n\n\ndef compute_val_bpb(val_loss, val_tokens, base_bytes_lut, device):\n    \"\"\"Compute validation bits-per-byte from cross-entropy loss.\"\"\"\n    bits_per_token = val_loss / math.log(2)\n    val_subset = val_tokens.to(device).long()\n    byte_count = base_bytes_lut[val_subset].sum().item()\n    tokens_per_byte = val_subset.numel() / max(byte_count, 1)\n    return bits_per_token * tokens_per_byte\n\n\n# ============================================================================\n# MODEL\n# ============================================================================\n\nclass RMSNorm(nn.Module):\n    def __init__(self, dim):\n        super().__init__()\n        self.scale = nn.Parameter(torch.ones(dim))\n    \n    def forward(self, x):\n        return self.scale * F.rms_norm(x, (x.size(-1),))\n\n\nclass CastedLinear(nn.Linear):\n    \"\"\"Linear that casts weights to float32 for computation.\"\"\"\n    def forward(self, x):\n        return F.linear(x, self.weight.float(), \n                        self.bias.float() if self.bias is not None else None)\n\n\nclass Rotary(nn.Module):\n    \"\"\"Rotary Position Embedding (RoPE).\"\"\"\n    def __init__(self, dim, base=10000.0, rope_dims=0):\n        super().__init__()\n        self.rope_dims = rope_dims if rope_dims > 0 else dim\n        inv_freq = 1.0 / (base ** (torch.arange(0, self.rope_dims, 2) / self.rope_dims))\n        self.register_buffer(\"inv_freq\", inv_freq, persistent=False)\n        self._cos = None\n        self._sin = None\n    \n    def forward(self, seq_len, device, dtype):\n        if self._cos is None or self._sin is None or self._cos.size(-2) != seq_len:\n            t = torch.arange(seq_len, device=device, dtype=self.inv_freq.dtype)\n            freqs = torch.outer(t, self.inv_freq.to(device))\n            self._cos = freqs.cos()[None, None, :, :]\n            self._sin = freqs.sin()[None, None, :, :]\n        return self._cos.to(dtype), self._sin.to(dtype)\n\n\ndef apply_rope(x, cos, sin, rope_dims=0):\n    \"\"\"Apply rotary embedding to query/key tensors.\"\"\"\n    if rope_dims > 0 and rope_dims < x.size(-1):\n        x_rope, x_pass = x[..., :rope_dims], x[..., rope_dims:]\n        half = rope_dims // 2\n        x1, x2 = x_rope[..., :half], x_rope[..., half:]\n        rotated = torch.cat((x1*cos + x2*sin, x1*(-sin) + x2*cos), -1)\n        return torch.cat((rotated, x_pass), -1)\n    half = x.size(-1) // 2\n    x1, x2 = x[..., :half], x[..., half:]\n    return torch.cat((x1*cos + x2*sin, x1*(-sin) + x2*cos), -1)\n\n\nclass Attention(nn.Module):\n    def __init__(self, dim, num_heads, num_kv_heads, rope_base, qk_gain_init, rope_dims=0):\n        super().__init__()\n        self.num_heads = num_heads\n        self.num_kv_heads = num_kv_heads\n        self.head_dim = dim // num_heads\n        self.rope_dims = rope_dims\n        kv_dim = num_kv_heads * self.head_dim\n        \n        self.q_proj = CastedLinear(dim, dim)\n        self.k_proj = CastedLinear(dim, kv_dim)\n        self.v_proj = CastedLinear(dim, kv_dim)\n        self.o_proj = CastedLinear(dim, dim)\n        \n        self.rotary = Rotary(self.head_dim, base=rope_base, rope_dims=rope_dims)\n        self.q_gain = nn.Parameter(torch.full((num_heads,), qk_gain_init, dtype=torch.float32))\n    \n    def forward(self, x):\n        b, s, d = x.shape\n        \n        q = self.q_proj(x).view(b, s, self.num_heads, self.head_dim).transpose(1, 2)\n        k = self.k_proj(x).view(b, s, self.num_kv_heads, self.head_dim).transpose(1, 2)\n        v = self.v_proj(x).view(b, s, self.num_kv_heads, self.head_dim).transpose(1, 2)\n        \n        # RMSNorm before QK projection (proven improvement)\n        q = F.rms_norm(q, (q.size(-1),))\n        k = F.rms_norm(k, (k.size(-1),))\n        \n        # Apply RoPE\n        cos, sin = self.rotary(s, x.device, q.dtype)\n        q = apply_rope(q, cos, sin, self.rope_dims)\n        k = apply_rope(k, cos, sin, self.rope_dims)\n        \n        # QK-Gain (learnable per-head scaling)\n        q = q * self.q_gain.view(1, -1, 1, 1).to(dtype=q.dtype)\n        \n        # KV replication for GQA\n        if self.num_kv_heads < self.num_heads:\n            repeat = self.num_heads // self.num_kv_heads\n            k = k.repeat_interleave(repeat, dim=1)\n            v = v.repeat_interleave(repeat, dim=1)\n        \n        # Attention\n        scale = self.head_dim ** -0.5\n        attn = torch.matmul(q * scale, k.transpose(-2, -1).float())\n        causal = torch.triu(torch.ones(s, s, device=x.device, dtype=torch.bool), 1)\n        attn = attn.masked_fill(causal, float(\"-inf\"))\n        attn = F.softmax(attn, dim=-1).to(q.dtype)\n        out = torch.matmul(attn, v).transpose(1, 2).contiguous().view(b, s, d)\n        return self.o_proj(out)\n\n\nclass MLP(nn.Module):\n    \"\"\"MLP with squared LeakyReLU activation.\"\"\"\n    def __init__(self, dim, mult=4):\n        super().__init__()\n        self.fc = CastedLinear(dim, mult * dim)\n        self.proj = CastedLinear(mult * dim, dim)\n    \n    def forward(self, x):\n        return self.proj(F.leaky_relu(self.fc(x), negative_slope=0.5).square())\n\n\nclass Block(nn.Module):\n    \"\"\"Transformer block with pre-norm and learned residuals.\"\"\"\n    def __init__(self, dim, num_heads, num_kv_heads, mlp_mult, rope_base, \n                 qk_gain_init, layer_idx, rope_dims=0):\n        super().__init__()\n        self.layer_idx = layer_idx\n        \n        self.attn_norm = RMSNorm(dim)\n        self.mlp_norm = RMSNorm(dim)\n        \n        self.attn = Attention(dim, num_heads, num_kv_heads, rope_base, qk_gain_init, rope_dims)\n        self.mlp = MLP(dim, mlp_mult)\n        \n        # Learned residual scaling (proven improvement)\n        self.attn_scale = nn.Parameter(torch.ones(dim))\n        self.mlp_scale = nn.Parameter(torch.ones(dim))\n        self.resid_mix = nn.Parameter(torch.stack((\n            torch.ones(dim), torch.zeros(dim)\n        )).float())\n        \n        # Layer scaling (deeper layers slightly smaller)\n        self.ln_scale = 1.0 / math.sqrt(layer_idx + 1)\n    \n    def forward(self, x, x0):\n        dtype = x.dtype\n        mix = self.resid_mix.to(dtype=dtype)\n        \n        # Residual mix: combine current and original residual\n        x_in = mix[0][None, None, :] * x + mix[1][None, None, :] * x0\n        \n        # Attention block\n        x = x_in + self.attn_scale.to(dtype=dtype)[None, None, :] * \\\n            self.attn(self.attn_norm(x_in) * self.ln_scale)\n        \n        # MLP block\n        x = x + self.mlp_scale.to(dtype=dtype)[None, None, :] * \\\n            self.mlp(self.mlp_norm(x) * self.ln_scale)\n        \n        return x\n\n\nclass GPT(nn.Module):\n    \"\"\"Standard transformer language model.\"\"\"\n    def __init__(self):\n        super().__init__()\n        \n        self.tok_emb = nn.Embedding(H.vocab_size, H.model_dim)\n        self.blocks = nn.ModuleList([\n            Block(\n                H.model_dim, H.num_heads, H.num_kv_heads, H.mlp_mult,\n                H.rope_base, H.qk_gain_init, i, H.rope_dims\n            )\n            for i in range(H.num_layers)\n        ])\n        self.final_norm = RMSNorm(H.model_dim)\n        \n        # Tied embeddings save parameters\n        self.lm_head = None if H.tie_embeddings else \\\n            CastedLinear(H.model_dim, H.vocab_size, bias=False)\n        \n        self._init_weights()\n    \n    def _init_weights(self):\n        if H.tie_embeddings:\n            nn.init.normal_(self.tok_emb.weight, std=0.005)\n        for m in self.modules():\n            if isinstance(m, CastedLinear) and m.bias is not None:\n                if (m.bias.data == 0).all() or m.bias.data.abs().sum() == 0:\n                    nn.init.zeros_(m.bias)\n    \n    def forward(self, x, target=None):\n        x = self.tok_emb(x)\n        x = F.rms_norm(x, (x.size(-1),))\n        x0 = x\n        \n        # Compute depth loop activation step\n        warmup_steps = int(H.iterations * H.enable_looping_at)\n        loop_active = False\n        \n        for i, block in enumerate(self.blocks):\n            x = block(x, x0)\n            \n            # Depth recurrence: loop layers 3-5 after warmup\n            if (i >= H.loop_start and i <= H.loop_end and \n                H.num_loops > 1 and loop_active):\n                for _ in range(H.num_loops - 1):\n                    x = block(x, x0)\n            \n            # Activate recurrence after warmup\n            if i == H.loop_start:\n                loop_active = True\n        \n        x = self.final_norm(x)\n        \n        # Output projection\n        if self.lm_head is not None:\n            logits = self.lm_head(x)\n        else:\n            logits = F.linear(x, self.tok_emb.weight)\n        \n        # Logit softcap (improves calibration)\n        logits = H.logit_softcap * torch.tanh(logits / H.logit_softcap)\n        \n        if target is not None:\n            return F.cross_entropy(logits.view(-1, H.vocab_size), target.view(-1), \n                                   reduction='mean')\n        return logits\n\n\n# ============================================================================\n# QUANTIZATION\n# ============================================================================\n\ndef quantize_row(t, clip_std_mult=12.85, bits=8):\n    \"\"\"Per-row quantization for GPTQ.\"\"\"\n    t = t.float()\n    qmax = (1 << (bits - 1)) - 1\n    \n    if t.ndim < 2:\n        scale = (t.abs().max() / qmax).clamp_min(1/qmax)\n        q = torch.round(torch.clamp(t, -qmax * scale, qmax * scale) / scale).to(torch.int8)\n        return q, scale\n    \n    std = t.std(dim=1, keepdim=True)\n    clip = std * clip_std_mult\n    scale = (clip / qmax).clamp_min(1/qmax)\n    q = torch.round(torch.clamp(t, -clip, clip) / scale).to(torch.int8)\n    return q, scale.squeeze(-1)\n\n\ndef pack_int6(q):\n    \"\"\"Pack int6 values into bytes (4 values per 3 bytes).\"\"\"\n    flat = (q.to(torch.int16).flatten() + 32).clamp_(0, 63).to(torch.int32)\n    pad = (-flat.numel()) % 4\n    if pad:\n        flat = torch.cat([flat, torch.zeros(pad, dtype=torch.int32)])\n    \n    vals = flat.view(-1, 4)\n    word = vals[:, 0] | (vals[:, 1] << 6) | (vals[:, 2] << 12) | (vals[:, 3] << 18)\n    \n    packed = torch.empty((word.numel(), 3), dtype=torch.uint8)\n    packed[:, 0] = (word & 255).to(torch.uint8)\n    packed[:, 1] = ((word >> 8) & 255).to(torch.uint8)\n    packed[:, 2] = ((word >> 16) & 255).to(torch.uint8)\n    \n    return packed.flatten(), pad\n\n\ndef quantize_state_dict(state_dict):\n    \"\"\"Quantize model weights for storage.\"\"\"\n    quantized = {}\n    scales = {}\n    meta = {}\n    \n    for name, tensor in state_dict.items():\n        t = tensor.detach().cpu()\n        \n        # Non-float tensors (embeddings indices, etc.)\n        if not t.is_floating_point():\n            quantized[name] = t.to(torch.int16)\n            continue\n\n[516 more lines in file. Use offset=530 to continue.]"}],"isError":false,"timestamp":1777141901536}}
{"type":"message","id":"240c49b8","parentId":"13148e50","timestamp":"2026-04-25T18:31:43.556Z","message":{"role":"assistant","content":[{"type":"thinking","thinking":"I've got a good understanding of the codebase. The 30-min baseline is running. Let me continue reading to understand the TTT implementation, EMA, checkpointing, and other key components.","thinkingSignature":"fa9a3002543c6d4b61e17d8025f6473de44252b60c85a852a62363f43294b50b"},{"type":"toolCall","id":"call_function_7le4z8y38zm9_1","name":"read","arguments":{"limit":300,"offset":530,"path":"/Users/dhruv2mars/dev/github/parameter-golf/train_kaggle.py"}}],"api":"anthropic-messages","provider":"minimax","model":"MiniMax-M2.7","usage":{"input":3044,"output":99,"cacheRead":24064,"cacheWrite":0,"totalTokens":27207,"cost":{"input":0.0009132,"output":0.0001188,"cacheRead":0.0014438399999999998,"cacheWrite":0,"total":0.00247584}},"stopReason":"toolUse","timestamp":1777141901537,"responseId":"063c3b8ecf2ca5e7d98adaf60a5c2de8"}}
