{"type":"message","id":"6a26b9b7","parentId":"43c2b703","timestamp":"2026-04-25T20:25:01.661Z","message":{"role":"toolResult","toolCallId":"call_function_w1oh9h0l605r_1","toolName":"read","content":[{"type":"text","text":"        # RMSNorm before QK projection (proven improvement)\n        q = F.rms_norm(q, (q.size(-1),))\n        k = F.rms_norm(k, (k.size(-1),))\n        \n        # Apply RoPE\n        cos, sin = self.rotary(s, x.device, q.dtype)\n        q = apply_rope(q, cos, sin, self.rope_dims)\n        k = apply_rope(k, cos, sin, self.rope_dims)\n        \n        # QK-Gain (learnable per-head scaling)\n        q = q * self.q_gain.view(1, -1, 1, 1).to(dtype=q.dtype)\n        \n        # KV replication for GQA\n        if self.num_kv_heads < self.num_heads:\n            repeat = self.num_heads // self.num_kv_heads\n            k = k.repeat_interleave(repeat, dim=1)\n            v = v.repeat_interleave(repeat, dim=1)\n        \n        # Attention\n        scale = self.head_dim ** -0.5\n        attn = torch.matmul(q * scale, k.transpose(-2, -1).float())\n        causal = torch.triu(torch.ones(s, s, device=x.device, dtype=torch.bool), 1)\n        attn = attn.masked_fill(causal, float(\"-inf\"))\n        attn = F.softmax(attn, dim=-1).to(q.dtype)\n        out = torch.matmul(attn, v).transpose(1, 2).contiguous().view(b, s, d)\n        return self.o_proj(out)\n\n\nclass MLP(nn.Module):\n    \"\"\"MLP with squared LeakyReLU activation.\"\"\"\n\n[686 more lines in file. Use offset=360 to continue.]"}],"isError":false,"timestamp":1777148701661}}
{"type":"message","id":"7f751332","parentId":"6a26b9b7","timestamp":"2026-04-25T20:25:07.257Z","message":{"role":"assistant","content":[{"type":"thinking","thinking":"Found it! Line 350:\n```python\nattn = torch.matmul(q * scale, k.transpose(-2, -1).float())\n```\n\nThe `.float()` is the culprit. With seq_len=512, this creates a 512x512 float32 matrix, and the model is large. But wait, the error says \"Tried to allocate 32.00 GiB\" - that's huge. Let me check what's happening.\n\nThe issue is that during TTT, the model is in eval mode but the weights are bf16, and the autocast is set to bf16. When we call `k.transpose(-2, -1).float()`, we're converting k to float32, which creates a full copy. Combined with the large model and T4's limited memory, this causes OOM.\n\n\nI need to replace `.float()` with `.to(dtype=q.dtype)` to keep the attention computation in bf16, and I'm also checking for other dtype conversions in the MLP's squared LeakyReLU activation. The problem stems from the large batch size and sequence length during validation—the attention matrix alone is massive at 8*64*512*512 * 4 bytes, which easily exhausts the 14.56 GiB T4 memory. Removing the `.float()` call will keep the computation in bf16 where it belongs during autocast.","thinkingSignature":"ba0008dae48e6b29f2d697644150fcf844199bbb2b0d4b15858d1d5c4dca9f74"},{"type":"toolCall","id":"call_function_qqcilpmsq376_1","name":"edit","arguments":{"edits":[{"newText":"        attn = torch.matmul(q * scale, k.transpose(-2, -1))","oldText":"        attn = torch.matmul(q * scale, k.transpose(-2, -1).float())"}],"path":"/Users/dhruv2mars/dev/github/parameter-golf/train_kaggle.py"}}],"api":"anthropic-messages","provider":"minimax","model":"MiniMax-M2.7","usage":{"input":453,"output":379,"cacheRead":53472,"cacheWrite":0,"totalTokens":54304,"cost":{"input":0.0001359,"output":0.0004548,"cacheRead":0.0032083199999999997,"cacheWrite":0,"total":0.0037990199999999997}},"stopReason":"toolUse","timestamp":1777148701666,"responseId":"063c561dde5b911aeb24c2a1c8500239"}}
{"type":"message","id":"536e3099","parentId":"7f751332","timestamp":"2026-04-25T20:25:07.278Z","message":{"role":"toolResult","toolCallId":"call_function_qqcilpmsq376_1","toolName":"edit","content":[{"type":"text","text":"Successfully replaced 1 block(s) in /Users/dhruv2mars/dev/github/parameter-golf/train_kaggle.py."}],"details":{"diff":"      ...\n  346             v = v.repeat_interleave(repeat, dim=1)\n  347         \n  348         # Attention\n  349         scale = self.head_dim ** -0.5\n- 350         attn = torch.matmul(q * scale, k.transpose(-2, -1).float())\n+ 350         attn = torch.matmul(q * scale, k.transpose(-2, -1))\n  351         causal = torch.triu(torch.ones(s, s, device=x.device, dtype=torch.bool), 1)\n  352         attn = attn.masked_fill(causal, float(\"-inf\"))\n  353         attn = F.softmax(attn, dim=-1).to(q.dtype)\n  354         out = torch.matmul(attn, v).transpose(1, 2).contiguous().view(b, s, d)\n      ...","firstChangedLine":350},"isError":false,"timestamp":1777148707278}}
{"type":"message","id":"79e835a0","parentId":"536e3099","timestamp":"2026-04-25T20:25:08.347Z","message":{"role":"assistant","content":[{"type":"thinking","thinking":"But the TTT function also has the same problem. Let me check the TTT function more carefully.","thinkingSignature":"1eb03208f59b87967a0a5b5dba477f4e6cd255e0231dabe12b038c1beea3ff7f"},{"type":"toolCall","id":"call_function_t5ynscmbk8or_1","name":"read","arguments":{"limit":100,"offset":565,"path":"/Users/dhruv2mars/dev/github/parameter-golf/train_kaggle.py"}}],"api":"anthropic-messages","provider":"minimax","model":"MiniMax-M2.7","usage":{"input":146,"output":82,"cacheRead":53920,"cacheWrite":0,"totalTokens":54148,"cost":{"input":0.0000438,"output":0.00009839999999999999,"cacheRead":0.0032351999999999997,"cacheWrite":0,"total":0.0033773999999999996}},"stopReason":"toolUse","timestamp":1777148707279,"responseId":"063c5623a94441803748e51db84de81d"}}
{"type":"message","id":"1947c27e","parentId":"79e835a0","timestamp":"2026-04-25T20:25:08.364Z","message":{"role":"toolResult","toolCallId":"call_function_t5ynscmbk8or_1","toolName":"read","content":[{"type":"text","text":"        \"optimizer\": optimizer.state_dict() if hasattr(optimizer, 'state_dict') else None,\n        \"ema_state\": ema_state,\n        \"best_val_bpb\": best_val_bpb,\n        \"train_stream_pos\": train_stream_pos,\n    }\n    \n    path = os.path.join(run_dir, f\"{_CHECKPOINT_PREFIX}{step}.pt\")\n    torch.save(checkpoint, path)\n    \n    # Clean old checkpoints (keep last 3)\n    ckpts = sorted(glob.glob(os.path.join(run_dir, f\"{_CHECKPOINT_PREFIX}*.pt\")))\n    for old in ckpts[:-3]:\n        os.remove(old)\n    \n    return path\n\n\ndef load_checkpoint(path, model, optimizer):\n    \"\"\"Load training checkpoint and return step + stream position.\"\"\"\n    ckpt = torch.load(path, map_location='cpu')\n    \n    if ckpt.get(\"model\") is not None:\n        model.load_state_dict(ckpt[\"model\"])\n    if ckpt.get(\"optimizer\") is not None and hasattr(optimizer, 'load_state_dict'):\n        optimizer.load_state_dict(ckpt[\"optimizer\"])\n    \n    return ckpt.get(\"step\", 0), ckpt.get(\"best_val_bpb\", float('inf')), \\\n           ckpt.get(\"train_stream_pos\", 0)\n\n\n# ============================================================================\n# TTT (TEST-TIME TRAINING)\n# ============================================================================\n\ndef run_ttt(model, val_tokens, base_bytes_lut, device, args, log_fn):\n    \"\"\"Run Test-Time Training for final BPB boost.\"\"\"\n    log_fn(\"[TTT] Starting Test-Time Training...\")\n    \n    model.eval()\n    ttt_opt = torch.optim.SGD(model.parameters(), lr=args.ttt_lr, momentum=0.9)\n    \n    tokens_used = 0\n    total_tokens = min(val_tokens.numel() - 1, args.ttt_warmup_tokens * args.ttt_epochs)\n    \n    for epoch in range(args.ttt_epochs):\n        indices = torch.randperm(val_tokens.numel() - 1)\n        \n        for start in range(0, len(indices), args.ttt_warmup_tokens):\n            chunk = indices[start:start + args.ttt_warmup_tokens]\n            \n            # Score first (legal requirement)\n            x = val_tokens[chunk].to(device).long()\n            y = val_tokens[chunk + 1].to(device).long()\n            \n            with torch.no_grad():\n                _ = model(x, y)\n            \n            # Then train\n            with torch.autocast(device_type=\"cuda\", dtype=torch.bfloat16):\n                loss = model(x, y)\n            \n            if not torch.isfinite(loss):\n                log_fn(f\"[TTT] Non-finite loss at epoch {epoch}, chunk {start}\")\n                continue\n            \n            ttt_opt.zero_grad()\n            loss.backward()\n            torch.nn.utils.clip_grad_norm_(model.parameters(), 1.0)\n            ttt_opt.step()\n            \n            tokens_used += x.numel()\n        \n        # Evaluate after each epoch\n        val_loss_sum = 0.0\n        val_token_count = 0\n        eval_limit = min(val_tokens.numel() - 1, args.val_max_tokens)\n        \n        with torch.no_grad():\n            for i in range(0, eval_limit, args.train_seq_len * 4):\n                x = val_tokens[i:i + args.train_seq_len * 4].to(device).long()\n                y = val_tokens[i + 1:i + 1 + args.train_seq_len * 4].to(device).long()\n                with torch.autocast(device_type=\"cuda\", dtype=torch.bfloat16):\n                    loss = model(x, y)\n                val_loss_sum += loss.item() * x.numel()\n                val_token_count += x.numel()\n        \n        ttt_val_bpb = compute_val_bpb(\n            val_loss_sum / val_token_count, val_tokens[:val_token_count],\n            base_bytes_lut, device\n        )\n        log_fn(f\"[TTT] Epoch {epoch + 1}/{args.ttt_epochs}: val_bpb={ttt_val_bpb:.4f}\")\n    \n    return model\n\n\n# ============================================================================\n# TRAINING\n# ============================================================================\n\ndef train():\n\n[381 more lines in file. Use offset=665 to continue.]"}],"isError":false,"timestamp":1777148708364}}
{"type":"message","id":"760c8e56","parentId":"1947c27e","timestamp":"2026-04-25T20:25:10.830Z","message":{"role":"assistant","content":[{"type":"thinking","thinking":"I see the TTT code. The issue is also in the validation loop during TTT evaluation:```python\nwith torch.autocast(device_type=\"cuda\", dtype=torch.bfloat16):\n    loss = model(x, y)\n```\n\nThis passes the model through autocast during evaluation. The model is already in bf16, and autocast will handle the casts, but the issue is that the model itself is already in bf16 and the weights are being cast. Let me also check if there's any other .float() calls in the TTT code.\n\nLooking at the TTT code:\n1. The \"score first\" part uses `with torch.no_grad()` but NOT autocast - that's fine, it will use bf16\n\n\n2. The training part uses `torch.autocast(device_type=\"cuda\", dtype=torch.bfloat16)` with the model, which should handle bf16 correctly if everything's set up properly\n\nThe main fixes I've made are CastedLinear to match input dtype and removing the .float() from attention scores, so let me try running TTT again to see if those resolve the issues.","thinkingSignature":"d8cb0007d887fd5cd56ea4b6ba098bf463a2d2c37ce0e550e6de61575ad3cce5"},{"type":"toolCall","id":"call_function_os4dln1ewo5z_1","name":"bash","arguments":{"command":"cd /Users/dhruv2mars/dev/github/parameter-golf && git add -A && git commit -m \"fix: attention scores use bf16 instead of float32 to avoid OOM\" 2>&1"}}],"api":"anthropic-messages","provider":"minimax","model":"MiniMax-M2.7","usage":{"input":971,"output":295,"cacheRead":54048,"cacheWrite":0,"totalTokens":55314,"cost":{"input":0.0002913,"output":0.000354,"cacheRead":0.0032428799999999996,"cacheWrite":0,"total":0.0038881799999999998}},"stopReason":"toolUse","timestamp":1777148708371,"responseId":"063c5624b1b3de45458ef10cbb64371a"}}
{"type":"message","id":"ff0d89d4","parentId":"760c8e56","timestamp":"2026-04-25T20:25:11.255Z","message":{"role":"toolResult","toolCallId":"call_function_os4dln1ewo5z_1","toolName":"bash","content":[{"type":"text","text":"[autoresearch/phase1-20260426 de16801] fix: attention scores use bf16 instead of float32 to avoid OOM\n 2 files changed, 2 insertions(+), 1 deletion(-)\n"}],"isError":false,"timestamp":1777148711255}}
{"type":"message","id":"65eb54e6","parentId":"ff0d89d4","timestamp":"2026-04-25T20:25:13.083Z","message":{"role":"assistant","content":[{"type":"thinking","thinking":"Now let me run TTT again. But wait - TTT with 40M tokens will take forever and OOM. Let me reduce the validation to something much smaller. Actually, let me try the TTT run with reduced scope first to see if it works at all, then we can scale up. Let me set TTT_WARMUP_TOKENS=8192 and VAL_MAX_TOKENS=32768 to be safer.","thinkingSignature":"3b219e3618d631ba666e493ffa337be0655c6120ba572eba01d1545197d0fd7e"},{"type":"toolCall","id":"call_function_bpqwwkc2z8d5_1","name":"bash","arguments":{"command":"cd /Users/dhruv2mars/dev/github/parameter-golf && python3 experiments/pg_autoresearch.py run --name \"ar_ttt_v2_$(date +%Y%m%d)\" --env \"ITERATIONS=7000\" --env \"MAX_WALLCLOCK_SECONDS=1800\" --env \"TTT_ENABLED=1\" --env \"TTT_EPOCHS=2\" --env \"TTT_LR=0.005\" --env \"TTT_WARMUP_TOKENS=8192\" --env \"VAL_MAX_TOKENS=65536\" --timeout 2400 2>&1"}}],"api":"anthropic-messages","provider":"minimax","model":"MiniMax-M2.7","usage":{"input":138,"output":243,"cacheRead":55008,"cacheWrite":0,"totalTokens":55389,"cost":{"input":0.0000414,"output":0.0002916,"cacheRead":0.0033004799999999997,"cacheWrite":0,"total":0.0036334799999999997}},"stopReason":"toolUse","timestamp":1777148711256,"responseId":"063c562757bcfcdf265c060dcf37563f"}}
{"type":"message","id":"2b8bb26e","parentId":"65eb54e6","timestamp":"2026-04-25T21:02:03.289Z","message":{"role":"toolResult","toolCallId":"call_function_bpqwwkc2z8d5_1","toolName":"bash","content":[{"type":"text","text":"{\"best_val_bpb\": 2.4351, \"compressed_bytes\": null, \"error\": \"Traceback (most recent call last):\\\\n\\\"}\\n,{\\\"stream_name\\\":\\\"stderr\\\",\\\"time\\\":1907.731849326,\\\"data\\\":\\\"[rank0]:   File \\\\\\\"/kaggle/src/script.py\\\\\\\", line 1055, in \\\\u003cmodule\\\\u003e\\\\n\\\"}\\n,{\\\"stream_name\\\":\\\"stderr\\\",\\\"time\\\":1907.731855622,\\\"data\\\":\\\"[rank0]:     train()\\\\n\\\"}\\n,{\\\"stream_name\\\":\\\"stderr\\\",\\\"time\\\":1907.731859322,\\\"data\\\":\\\"[rank0]:   File \\\\\\\"/kaggle/src/script.py\\\\\\\", line 1008, in train\\\\n\\\"}\\n,{\\\"stream_name\\\":\\\"stderr\\\",\\\"time\\\":1907.731863243,\\\"data\\\":\\\"[rank0]:     raw_model = run_ttt(raw_model, val_tokens, base_bytes_lu\", \"metric\": 2.4351, \"non_finite\": false, \"output\": \"/Users/dhruv2mars/dev/github/parameter-golf/experiments/kaggle_results/pg-auto-ar-ttt-v2-20260426-48713\", \"ref\": \"dhruv2mars/pg-auto-ar-ttt-v2-20260426-48713\", \"runtime_seconds\": null, \"status\": \"KernelWorkerStatus.ERROR\", \"steps\": 1200, \"ttt_val_bpb\": null, \"val_bpb\": 2.4351}\n"}],"isError":false,"timestamp":1777150923289}}
{"type":"message","id":"4950aa8e","parentId":"2b8bb26e","timestamp":"2026-04-25T21:02:08.739Z","message":{"role":"assistant","content":[{"type":"thinking","thinking":"Still crashing. Same error pattern. Let me check what the actual error is now.\n","thinkingSignature":"840dac6dd1994d7febe7471a471590c7b4d23445998b910ce5dc263de9db1539"},{"type":"toolCall","id":"call_function_51lxtvx7hp0p_1","name":"bash","arguments":{"command":"grep -o \"RuntimeError.*\\|OutOfMemoryError.*\\|Traceback.*\" /Users/dhruv2mars/dev/github/parameter-golf/experiments/kaggle_results/pg-auto-ar-ttt-v2-20260426-48713/*.log 2>/dev/null | tail -5 || tail -50 /Users/dhruv2mars/dev/github/parameter-golf/experiments/kaggle_results/pg-auto-ar-ttt-v2-20260426-48713/pg-auto-ar-ttt-v2-20260426-48713.log"}}],"api":"anthropic-messages","provider":"minimax","model":"MiniMax-M2.7","usage":{"input":55637,"output":158,"cacheRead":0,"cacheWrite":0,"totalTokens":55795,"cost":{"input":0.0166911,"output":0.0001896,"cacheRead":0,"cacheWrite":0,"total":0.016880700000000002}},"stopReason":"toolUse","timestamp":1777150923291,"responseId":"063c5ecd4c2508e2529d43f14b01514b"}}
{"type":"message","id":"5ac369c7","parentId":"4950aa8e","timestamp":"2026-04-25T21:02:08.764Z","message":{"role":"toolResult","toolCallId":"call_function_51lxtvx7hp0p_1","toolName":"bash","content":[{"type":"text","text":"Traceback (most recent call last):\\n\"}\nOutOfMemoryError: CUDA out of memory. Tried to allocate 2.00 GiB. GPU 0 has a total capacity of 14.56 GiB of which 197.81 MiB is free. Including non-PyTorch memory, this process has 14.37 GiB memory in use. Of the allocated memory 11.62 GiB is allocated by PyTorch, and 2.53 GiB is reserved by PyTorch but unallocated. If reserved but unallocated memory is large try setting PYTORCH_ALLOC_CONF=expandable_segments:True to avoid fragmentation.  See documentation for Memory Management  (https://pytorch.org/docs/stable/notes/cuda.html#environment-variables)\\n\"}\nTraceback (most recent call last):\\n\"}\n"}],"isError":false,"timestamp":1777150928764}}
{"type":"message","id":"92b4df99","parentId":"5ac369c7","timestamp":"2026-04-25T21:02:12.655Z","message":{"role":"assistant","content":[{"type":"thinking","thinking":"Still OOM. The eval loop also has issues. The problem is TTT is running in eval mode but the model is in bf16 and the eval loop may have memory issues.\n\nLet me think about this differently. The TTT epochs are using too much memory. Let me:1. Keep eval at the very end only (not after each epoch)\n2. Use smaller eval chunks\n3. Or... just skip TTT for now and focus on architecture\n\nActually, let me just disable TTT for now and come back to it after we have a good architecture. The TTT code needs more work to be stable.\n\nFor the autoresearch, let me focus on what I CAN improve: architecture and hyperparameters. TTT is a \"nice to have\" but fixing it would consume many iterations.\n","thinkingSignature":"02fb65e26b2cbaf665ed7f3f54c0e96f3ef6f3aee31dbbac77e340f5ce5d3b63"},{"type":"toolCall","id":"call_function_0grdkgmvpksx_1","name":"log_experiment","arguments":{"asi":{"error":"OOM still in TTT eval loop","fix_needed":"Reduce eval tokens per chunk, or skip TTT for now","ttt_broken":true},"commit":"de16801","description":"TTT still OOM: eval loop also has memory issues","metric":2.4351,"metrics":{"artifact_mb":12.3,"best_val_bpb":2.4351,"steps":1200},"status":"discard"}}],"api":"anthropic-messages","provider":"minimax","model":"MiniMax-M2.7","usage":{"input":347,"output":318,"cacheRead":55616,"cacheWrite":0,"totalTokens":56281,"cost":{"input":0.0001041,"output":0.0003816,"cacheRead":0.0033369599999999995,"cacheWrite":0,"total":0.0038226599999999994}},"stopReason":"toolUse","timestamp":1777150928766,"responseId":"063c5ed15154195d06a5fe564794f914"}}
{"type":"message","id":"a8834a1c","parentId":"92b4df99","timestamp":"2026-04-25T21:02:12.710Z","message":{"role":"toolResult","toolCallId":"call_function_0grdkgmvpksx_1","toolName":"log_experiment","content":[{"type":"text","text":"Logged #4: discard — TTT still OOM: eval loop also has memory issues\nBaseline val_bpb: 2.38bpb\nSecondary: artifact_mb: 12.30mb (+1.7%)  best_val_bpb: 2.44 (+2.4%)  steps: 1,200 (+3.9%)\n📋 ASI: error: OOM still in TTT eval loop | fix_needed: Reduce eval tokens per chunk, or skip TTT for now | ttt_broken: true\n(4 experiments)\n📝 Git: reverted changes (discard) — autoresearch files preserved"}],"details":{"experiment":{"commit":"de16801","metric":2.4351,"metrics":{"artifact_mb":12.3,"best_val_bpb":2.4351,"steps":1200},"status":"discard","description":"TTT still OOM: eval loop also has memory issues","timestamp":1777150932661,"segment":0,"confidence":null,"iterationTokens":null,"asi":{"error":"OOM still in TTT eval loop","fix_needed":"Reduce eval tokens per chunk, or skip TTT for now","ttt_broken":true}},"state":{"results":[{"commit":"a672845","metric":2.379,"metrics":{"best_val_bpb":2.379,"steps":1155,"artifact_mb":12.1},"status":"keep","description":"30-min baseline: 2.379 val_bpb, 1155 steps, still improving","timestamp":1777144208804,"segment":0,"confidence":null,"iterationTokens":null,"asi":{"baseline_30min":true,"steps_completed":1155,"max_iterations":7000,"pct_exhausted":16.5,"loss_still_declining":true,"artifact_mb":12.1,"gap_to_sub1":1.879}},{"commit":"a672845","metric":2.3857,"metrics":{"artifact_mb":12.3,"best_val_bpb":2.3857,"steps":1200},"status":"discard","description":"TTT crashed: dtype mismatch in CastedLinear (bf16/float32)","timestamp":1777146462942,"segment":0,"confidence":null,"iterationTokens":null,"asi":{"error":"mat1 mat2 dtype mismatch bf16 vs float","fix_needed":"CastedLinear cast weights to match autocast dtype","ttt_broken":true}},{"commit":"e8ecad4","metric":2.3821,"metrics":{"artifact_mb":12.3,"best_val_bpb":2.3821,"steps":1200},"status":"discard","description":"TTT still broken: OOM from attention .float() creating 32GB matrix","timestamp":1777148696907,"segment":0,"confidence":null,"iterationTokens":null,"asi":{"error":"OOM: attention .float() creates 32GB matrix","fix_needed":"Remove .float() or use bf16 for attention scores","ttt_broken":true}},{"commit":"de16801","metric":2.4351,"metrics":{"artifact_mb":12.3,"best_val_bpb":2.4351,"steps":1200},"status":"discard","description":"TTT still OOM: eval loop also has memory issues","timestamp":1777150932661,"segment":0,"confidence":null,"iterationTokens":null,"asi":{"error":"OOM still in TTT eval loop","fix_needed":"Reduce eval tokens per chunk, or skip TTT for now","ttt_broken":true}}],"bestMetric":2.379,"bestDirection":"lower","metricName":"val_bpb","metricUnit":"bpb","secondaryMetrics":[{"name":"best_val_bpb","unit":""},{"name":"steps","unit":""},{"name":"artifact_mb","unit":"mb"}],"name":"Parameter Golf - Find Best Config for Sub-1 BPB","currentSegment":0,"maxExperiments":null,"confidence":null},"wallClockSeconds":null},"isError":false,"timestamp":1777150932710}}
