{"type":"message","id":"77be2c2b","parentId":"1c93a283","timestamp":"2026-04-27T11:52:30.121Z","message":{"role":"toolResult","toolCallId":"call_function_8icek33ala92_1","toolName":"bash","content":[{"type":"text","text":"Cloning repo...\nCloning into 'parameter-golf'...\nremote: Enumerating objects: 1915, done.        \nremote: Counting objects:   0% (1/246)        \rremote: Counting objects:   1% (3/246)        \rremote: Counting objects:   2% (5/246)        \rremote: Counting objects:   3% (8/246)        \rremote: Counting objects:   4% (10/246)        \rremote: Counting objects:   5% (13/246)        \rremote: Counting objects:   6% (15/246)        \rremote: Counting objects:   7% (18/246)        \rremote: Counting objects:   8% (20/246)        \rremote: Counting objects:   9% (23/246)        \rremote: Counting objects:  10% (25/246)        \rremote: Counting objects:  11% (28/246)        \rremote: Counting objects:  12% (30/246)        \rremote: Counting objects:  13% (32/246)        \rremote: Counting objects:  14% (35/246)        \rremote: Counting objects:  15% (37/246)        \rremote: Counting objects:  16% (40/246)        \rremote: Counting objects:  17% (42/246)        \rremote: Counting objects:  18% (45/246)        \rremote: Counting objects:  19% (47/246)        \rremote: Counting objects:  20% (50/246)        \rremote: Counting objects:  21% (52/246)        \rremote: Counting objects:  22% (55/246)        \rremote: Counting objects:  23% (57/246)        \rremote: Counting objects:  24% (60/246)        \rremote: Counting objects:  25% (62/246)        \rremote: Counting objects:  26% (64/246)        \rremote: Counting objects:  27% (67/246)        \rremote: Counting objects:  28% (69/246)        \rremote: Counting objects:  29% (72/246)        \rremote: Counting objects:  30% (74/246)        \rremote: Counting objects:  31% (77/246)        \rremote: Counting objects:  32% (79/246)        \rremote: Counting objects:  33% (82/246)        \rremote: Counting objects:  34% (84/246)        \rremote: Counting objects:  35% (87/246)        \rremote: Counting objects:  36% (89/246)        \rremote: Counting objects:  37% (92/246)        \rremote: Counting objects:  38% (94/246)        \rremote: Counting objects:  39% (96/246)        \rremote: Counting objects:  40% (99/246)        \rremote: Counting objects:  41% (101/246)        \rremote: Counting objects:  42% (104/246)        \rremote: Counting objects:  43% (106/246)        \rremote: Counting objects:  44% (109/246)        \rremote: Counting objects:  45% (111/246)        \rremote: Counting objects:  46% (114/246)        \rremote: Counting objects:  47% (116/246)        \rremote: Counting objects:  48% (119/246)        \rremote: Counting objects:  49% (121/246)        \rremote: Counting objects:  50% (123/246)        \rremote: Counting objects:  51% (126/246)        \rremote: Counting objects:  52% (128/246)        \rremote: Counting objects:  53% (131/246)        \rremote: Counting objects:  54% (133/246)        \rremote: Counting objects:  55% (136/246)        \rremote: Counting objects:  56% (138/246)        \rremote: Counting objects:  57% (141/246)        \rremote: Counting objects:  58% (143/246)        \rremote: Counting objects:  59% (146/246)        \rremote: Counting objects:  60% (148/246)        \rremote: Counting objects:  61% (151/246)        \rremote: Counting objects:  62% (153/246)        \rremote: Counting objects:  63% (155/246)        \rremote: Counting objects:  64% (158/246)        \rremote: Counting objects:  65% (160/246)        \rremote: Counting objects:  66% (163/246)        \rremote: Counting objects:  67% (165/246)        \rremote: Counting objects:  68% (168/246)        \rremote: Counting objects:  69% (170/246)        \rremote: Counting objects:  70% (173/246)        \rremote: Counting objects:  71% (175/246)        \rremote: Counting objects:  72% (178/246)        \rremote: Counting objects:  73% (180/246)        \rremote: Counting objects:  74% (183/246)        \rremote: Counting objects:  75% (185/246)        \rremote: Counting objects:  76% (187/246)        \rremote: Counting objects:  77% (190/246)        \rremote: Counting objects:  78% (192/246)        \rremote: Counting objects:  79% (195/246)        \rremote: Counting objects:  80% (197/246)        \rremote: Counting objects:  81% (200/246)        \rremote: Counting objects:  82% (202/246)        \rremote: Counting objects:  83% (205/246)        \rremote: Counting objects:  84% (207/246)        \rremote: Counting objects:  85% (210/246)        \rremote: Counting objects:  86% (212/246)        \rremote: Counting objects:  87% (215/246)        \rremote: Counting objects:  88% (217/246)        \rremote: Counting objects:  89% (219/246)        \rremote: Counting objects:  90% (222/246)        \rremote: Counting objects:  91% (224/246)        \rremote: Counting objects:  92% (227/246)        \rremote: Counting objects:  93% (229/246)        \rremote: Counting objects:  94% (232/246)        \rremote: Counting objects:  95% (234/246)        \rremote: Counting objects:  96% (237/246)        \rremote: Counting objects:  97% (239/246)        \rremote: Counting objects:  98% (242/246)        \rremote: Counting objects:  99% (244/246)        \rremote: Counting objects: 100% (246/246)        \rremote: Counting objects: 100% (246/246), done.        \nremote: Compressing objects:   0% (1/122)        \rremote: Compressing objects:   1% (2/122)        \rremote: Compressing objects:   2% (3/122)        \rremote: Compressing objects:   3% (4/122)        \rremote: Compressing objects:   4% (5/122)        \rremote: Compressing objects:   5% (7/122)        \rremote: Compressing objects:   6% (8/122)        \rremote: Compressing objects:   7% (9/122)        \rremote: Compressing objects:   8% (10/122)        \rremote: Compressing objects:   9% (11/122)        \rremote: Compressing objects:  10% (13/122)        \rremote: Compressing objects:  11% (14/122)        \rremote: Compressing objects:  12% (15/122)        \rremote: Compressing objects:  13% (16/122)        \rremote: Compressing objects:  14% (18/122)        \rremote: Compressing objects:  15% (19/122)        \rremote: Compressing objects:  16% (20/122)        \rremote: Compressing objects:  17% (21/122)        \rremote: Compressing objects:  18% (22/122)        \rremote: Compressing objects:  19% (24/122)        \rremote: Compressing objects:  20% (25/122)        \rremote: Compressing objects:  21% (26/122)        \rremote: Compressing objects:  22% (27/122)        \rremote: Compressing objects:  23% (29/122)        \rremote: Compressing objects:  24% (30/122)        \rremote: Compressing objects:  25% (31/122)        \rremote: Compressing objects:  26% (32/122)        \rremote: Compressing objects:  27% (33/122)        \rremote: Compressing objects:  28% (35/122)        \rremote: Compressing objects:  29% (36/122)        \rremote: Compressing objects:  30% (37/122)        \rremote: Compressing objects:  31% (38/122)        \rremote: Compressing objects:  32% (40/122)        \rremote: Compressing objects:  33% (41/122)        \rremote: Compressing objects:  34% (42/122)        \rremote: Compressing objects:  35% (43/122)        \rremote: Compressing objects:  36% (44/122)        \rremote: Compressing objects:  37% (46/122)        \rremote: Compressing objects:  38% (47/122)        \rremote: Compressing objects:  39% (48/122)        \rremote: Compressing objects:  40% (49/122)        \rremote: Compressing objects:  41% (51/122)        \rremote: Compressing objects:  42% (52/122)        \rremote: Compressing objects:  43% (53/122)        \rremote: Compressing objects:  44% (54/122)        \rremote: Compressing objects:  45% (55/122)        \rremote: Compressing objects:  46% (57/122)        \rremote: Compressing objects:  47% (58/122)        \rremote: Compressing objects:  48% (59/122)        \rremote: Compressing objects:  49% (60/122)        \rremote: Compressing objects:  50% (61/122)        \rremote: Compressing objects:  51% (63/122)        \rremote: Compressing objects:  52% (64/122)        \rremote: Compressing objects:  53% (65/122)        \rremote: Compressing objects:  54% (66/122)        \rremote: Compressing objects:  55% (68/122)        \rremote: Compressing objects:  56% (69/122)        \rremote: Compressing objects:  57% (70/122)        \rremote: Compressing objects:  58% (71/122)        \rremote: Compressing objects:  59% (72/122)        \rremote: Compressing objects:  60% (74/122)        \rremote: Compressing objects:  61% (75/122)        \rremote: Compressing objects:  62% (76/122)        \rremote: Compressing objects:  63% (77/122)        \rremote: Compressing objects:  64% (79/122)        \rremote: Compressing objects:  65% (80/122)        \rremote: Compressing objects:  66% (81/122)        \rremote: Compressing objects:  67% (82/122)        \rremote: Compressing objects:  68% (83/122)        \rremote: Compressing objects:  69% (85/122)        \rremote: Compressing objects:  70% (86/122)        \rremote: Compressing objects:  71% (87/122)        \rremote: Compressing objects:  72% (88/122)        \rremote: Compressing objects:  73% (90/122)        \rremote: Compressing objects:  74% (91/122)        \rremote: Compressing objects:  75% (92/122)        \rremote: Compressing objects:  76% (93/122)        \rremote: Compressing objects:  77% (94/122)        \rremote: Compressing objects:  78% (96/122)        \rremote: Compressing objects:  79% (97/122)        \rremote: Compressing objects:  80% (98/122)        \rremote: Compressing objects:  81% (99/122)        \rremote: Compressing objects:  82% (101/122)        \rremote: Compressing objects:  83% (102/122)        \rremote: Compressing objects:  84% (103/122)        \rremote: Compressing objects:  85% (104/122)        \rremote: Compressing objects:  86% (105/122)        \rremote: Compressing objects:  87% (107/122)        \rremote: Compressing objects:  88% (108/122)        \rremote: Compressing objects:  89% (109/122)        \rremote: Compressing objects:  90% (110/122)        \rremote: Compressing objects:  91% (112/122)        \rremote: Compressing objects:  92% (113/122)        \rremote: Compressing objects:  93% (114/122)        \rremote: Compressing objects:  94% (115/122)        \rremote: Compressing objects:  95% (116/122)        \rremote: Compressing objects:  96% (118/122)        \rremote: Compressing objects:  97% (119/122)        \rremote: Compressing objects:  98% (120/122)        \rremote: Compressing objects:  99% (121/122)        \rremote: Compressing objects: 100% (122/122)        \rremote: Compressing objects: 100% (122/122), done.        \nReceiving objects:   0% (1/1915)\rReceiving objects:   1% (20/1915)\rReceiving objects:   2% (39/1915)\rReceiving objects:   3% (58/1915)\rReceiving objects:   4% (77/1915)\rReceiving objects:   5% (96/1915)\rReceiving objects:   6% (115/1915)\rReceiving objects:   7% (135/1915)\rReceiving objects:   8% (154/1915)\rReceiving objects:   9% (173/1915)\rReceiving objects:  10% (192/1915)\rReceiving objects:  11% (211/1915)\rReceiving objects:  12% (230/1915)\rReceiving objects:  13% (249/1915)\rReceiving objects:  14% (269/1915)\rReceiving objects:  15% (288/1915)\rReceiving objects:  16% (307/1915)\rReceiving objects:  17% (326/1915)\rReceiving objects:  18% (345/1915)\rReceiving objects:  19% (364/1915)\rReceiving objects:  20% (383/1915)\rReceiving objects:  21% (403/1915)\rReceiving objects:  22% (422/1915)\rReceiving objects:  23% (441/1915)\rReceiving objects:  24% (460/1915)\rReceiving objects:  25% (479/1915)\rReceiving objects:  26% (498/1915)\rReceiving objects:  27% (518/1915)\rReceiving objects:  28% (537/1915)\rReceiving objects:  29% (556/1915)\rReceiving objects:  30% (575/1915)\rReceiving objects:  31% (594/1915)\rReceiving objects:  32% (613/1915)\rReceiving objects:  33% (632/1915)\rReceiving objects:  34% (652/1915)\rReceiving objects:  35% (671/1915)\rReceiving objects:  36% (690/1915)\rReceiving objects:  37% (709/1915)\rReceiving objects:  38% (728/1915)\rReceiving objects:  39% (747/1915)\rReceiving objects:  40% (766/1915)\rReceiving objects:  41% (786/1915)\rReceiving objects:  42% (805/1915)\rReceiving objects:  43% (824/1915)\rReceiving objects:  44% (843/1915)\rReceiving objects:  45% (862/1915)\rReceiving objects:  46% (881/1915)\rReceiving objects:  47% (901/1915)\rReceiving objects:  48% (920/1915)\rReceiving objects:  49% (939/1915)\rReceiving objects:  50% (958/1915)\rReceiving objects:  51% (977/1915)\rReceiving objects:  52% (996/1915)\rReceiving objects:  53% (1015/1915)\rReceiving objects:  54% (1035/1915)\rReceiving objects:  55% (1054/1915)\rReceiving objects:  56% (1073/1915)\rReceiving objects:  57% (1092/1915)\rReceiving objects:  58% (1111/1915)\rReceiving objects:  59% (1130/1915)\rReceiving objects:  60% (1149/1915)\rReceiving objects:  61% (1169/1915)\rReceiving objects:  62% (1188/1915)\rReceiving objects:  63% (1207/1915)\rReceiving objects:  64% (1226/1915)\rReceiving objects:  65% (1245/1915)\rReceiving objects:  66% (1264/1915)\rReceiving objects:  67% (1284/1915)\rReceiving objects:  68% (1303/1915)\rReceiving objects:  69% (1322/1915)\rReceiving objects:  70% (1341/1915)\rReceiving objects:  71% (1360/1915)\rReceiving objects:  72% (1379/1915)\rReceiving objects:  73% (1398/1915)\rReceiving objects:  74% (1418/1915)\rReceiving objects:  75% (1437/1915)\rReceiving objects:  76% (1456/1915)\rReceiving objects:  77% (1475/1915)\rReceiving objects:  78% (1494/1915)\rReceiving objects:  79% (1513/1915)\rReceiving objects:  80% (1532/1915)\rReceiving objects:  81% (1552/1915)\rReceiving objects:  82% (1571/1915)\rReceiving objects:  83% (1590/1915)\rReceiving objects:  84% (1609/1915)\rReceiving objects:  85% (1628/1915)\rReceiving objects:  86% (1647/1915)\rReceiving objects:  87% (1667/1915)\rReceiving objects:  88% (1686/1915)\rReceiving objects:  89% (1705/1915)\rReceiving objects:  90% (1724/1915)\rReceiving objects:  91% (1743/1915)\rReceiving objects:  92% (1762/1915)\rReceiving objects:  93% (1781/1915)\rReceiving objects:  94% (1801/1915)\rReceiving objects:  95% (1820/1915)\rReceiving objects:  96% (1839/1915)\rremote: Total 1915 (delta 120), reused 231 (delta 107), pack-reused 1669 (from 1)        \nReceiving objects:  97% (1858/1915)\rReceiving objects:  98% (1877/1915)\rReceiving objects:  99% (1896/1915)\rReceiving objects: 100% (1915/1915)\rReceiving objects: 100% (1915/1915), 4.35 MiB | 27.16 MiB/s, done.\nResolving deltas:   0% (0/982)\rResolving deltas:   1% (10/982)\rResolving deltas:   2% (20/982)\rResolving deltas:   3% (30/982)\rResolving deltas:   4% (40/982)\rResolving deltas:   5% (50/982)\rResolving deltas:   6% (59/982)\rResolving deltas:   7% (69/982)\rResolving deltas:   8% (79/982)\rResolving deltas:   9% (89/982)\rResolving deltas:  10% (99/982)\rResolving deltas:  11% (109/982)\rResolving deltas:  12% (118/982)\rResolving deltas:  13% (128/982)\rResolving deltas:  14% (138/982)\rResolving deltas:  15% (148/982)\rResolving deltas:  16% (158/982)\rResolving deltas:  17% (167/982)\rResolving deltas:  18% (177/982)\rResolving deltas:  19% (187/982)\rResolving deltas:  20% (197/982)\rResolving deltas:  21% (207/982)\rResolving deltas:  22% (217/982)\rResolving deltas:  23% (226/982)\rResolving deltas:  24% (236/982)\rResolving deltas:  25% (246/982)\rResolving deltas:  26% (256/982)\rResolving deltas:  27% (266/982)\rResolving deltas:  28% (275/982)\rResolving deltas:  29% (285/982)\rResolving deltas:  30% (295/982)\rResolving deltas:  31% (305/982)\rResolving deltas:  32% (316/982)\rResolving deltas:  33% (325/982)\rResolving deltas:  34% (334/982)\rResolving deltas:  35% (344/982)\rResolving deltas:  36% (354/982)\rResolving deltas:  37% (364/982)\rResolving deltas:  38% (374/982)\rResolving deltas:  39% (383/982)\rResolving deltas:  40% (393/982)\rResolving deltas:  41% (403/982)\rResolving deltas:  42% (413/982)\rResolving deltas:  43% (423/982)\rResolving deltas:  44% (433/982)\rResolving deltas:  45% (442/982)\rResolving deltas:  46% (452/982)\rResolving deltas:  47% (463/982)\rResolving deltas:  48% (472/982)\rResolving deltas:  49% (482/982)\rResolving deltas:  50% (491/982)\rResolving deltas:  51% (501/982)\rResolving deltas:  52% (511/982)\rResolving deltas:  53% (521/982)\rResolving deltas:  54% (531/982)\rResolving deltas:  55% (541/982)\rResolving deltas:  56% (550/982)\rResolving deltas:  57% (560/982)\rResolving deltas:  58% (570/982)\rResolving deltas:  59% (580/982)\rResolving deltas:  60% (590/982)\rResolving deltas:  61% (600/982)\rResolving deltas:  62% (609/982)\rResolving deltas:  63% (619/982)\rResolving deltas:  64% (629/982)\rResolving deltas:  65% (639/982)\rResolving deltas:  66% (649/982)\rResolving deltas:  67% (658/982)\rResolving deltas:  68% (668/982)\rResolving deltas:  69% (678/982)\rResolving deltas:  70% (688/982)\rResolving deltas:  71% (698/982)\rResolving deltas:  72% (708/982)\rResolving deltas:  73% (717/982)\rResolving deltas:  74% (727/982)\rResolving deltas:  75% (737/982)\rResolving deltas:  76% (747/982)\rResolving deltas:  77% (757/982)\rResolving deltas:  78% (766/982)\rResolving deltas:  79% (776/982)\rResolving deltas:  80% (786/982)\rResolving deltas:  81% (796/982)\rResolving deltas:  82% (806/982)\rResolving deltas:  83% (816/982)\rResolving deltas:  84% (825/982)\rResolving deltas:  85% (835/982)\rResolving deltas:  86% (845/982)\rResolving deltas:  87% (855/982)\rResolving deltas:  88% (865/982)\rResolving deltas:  89% (874/982)\rResolving deltas:  90% (884/982)\rResolving deltas:  91% (894/982)\rResolving deltas:  92% (904/982)\rResolving deltas:  93% (914/982)\rResolving deltas:  94% (924/982)\rResolving deltas:  95% (933/982)\rResolving deltas:  96% (943/982)\rResolving deltas:  97% (953/982)\rResolving deltas:  98% (963/982)\rResolving deltas:  99% (973/982)\rResolving deltas: 100% (982/982)\rResolving deltas: 100% (982/982), done.\n"}],"isError":false,"timestamp":1777290750121}}
{"type":"message","id":"d92b8c48","parentId":"77be2c2b","timestamp":"2026-04-27T11:52:41.739Z","message":{"role":"assistant","content":[{"type":"thinking","thinking":"Repo cloned. Now let me run a quick 1-min training test.","thinkingSignature":"7c88e3af49ce76c2509c09e59c49d8db4d204e7db9e8face2edddf6ea4e411d3"},{"type":"text","text":"Repo cloned. Now running 1-min training test:\n"},{"type":"toolCall","id":"call_function_awm7kdbs4q3q_1","name":"bash","arguments":{"command":"source ~/.venv/pg/bin/activate && python -c \"\nfrom lightning_sdk import Studio, Teamspace\nimport os\n\nos.environ['LIGHTNING_USER_ID'] = 'd52587bc-ec3c-4c9c-a2fa-71246e3d4020'\nos.environ['LIGHTNING_API_KEY'] = '25da12f4-1ad8-4e3f-8ba4-2a60fcebaabe'\n\nts = Teamspace(name='default-project', user='dhruv2mars')\nstudio = Studio(name='parameter-golf', teamspace=ts)\n\n# Run 1-min training test\ncmd = 'cd /teamspace/studios/this_studio/parameter-golf && ITERATIONS=50 MAX_WALLCLOCK=60 python3 train_kaggle.py 2>&1'\nprint('Running 1-min training test...')\nresult = studio.run(cmd)\nprint('Output:')\nprint(result)\n\" 2>&1","timeout_seconds":"120"}}],"api":"anthropic-messages","provider":"minimax","model":"MiniMax-M2.7","usage":{"input":80614,"output":267,"cacheRead":9348,"cacheWrite":0,"totalTokens":90229,"cost":{"input":0.0241842,"output":0.0003204,"cacheRead":0.0005608799999999999,"cacheWrite":0,"total":0.025065479999999998}},"stopReason":"toolUse","timestamp":1777290750125,"responseId":"063e8101c34669948794fc0c3b596924"}}
{"type":"message","id":"68e878fa","parentId":"d92b8c48","timestamp":"2026-04-27T11:52:50.591Z","message":{"role":"toolResult","toolCallId":"call_function_awm7kdbs4q3q_1","toolName":"bash","content":[{"type":"text","text":"Traceback (most recent call last):\n  File \"<string>\", line 14, in <module>\n    result = studio.run(cmd)\n  File \"/Users/dhruv2mars/.venv/pg/lib/python3.14/site-packages/lightning_sdk/utils/logging.py\", line 37, in wrapper\n    return func(*args, **kwargs)\n  File \"/Users/dhruv2mars/.venv/pg/lib/python3.14/site-packages/lightning_sdk/studio.py\", line 578, in run\n    raise RuntimeError(output)\nRuntimeError: Traceback (most recent call last):\n  File \"/teamspace/studios/this_studio/parameter-golf/train_kaggle.py\", line 32, in <module>\n    import sentencepiece as spm\nModuleNotFoundError: No module named 'sentencepiece'\nRunning 1-min training test...\n\n\nCommand exited with code 1"}],"details":{},"isError":true,"timestamp":1777290770591}}
{"type":"message","id":"e1f28931","parentId":"68e878fa","timestamp":"2026-04-27T11:52:59.303Z","message":{"role":"assistant","content":[{"type":"thinking","thinking":"Need to install dependencies first.","thinkingSignature":"4add8bb8df0eb25c8a553a042fd74f11ed065eefb17499bb7d5375a90bb4a474"},{"type":"text","text":"Need to install deps:\n"},{"type":"toolCall","id":"call_function_q9g9q1o3kd3e_1","name":"bash","arguments":{"command":"source ~/.venv/pg/bin/activate && python -c \"\nfrom lightning_sdk import Studio, Teamspace\nimport os\n\nos.environ['LIGHTNING_USER_ID'] = 'd52587bc-ec3c-4c9c-a2fa-71246e3d4020'\nos.environ['LIGHTNING_API_KEY'] = '25da12f4-1ad8-4e3f-8ba4-2a60fcebaabe'\n\nts = Teamspace(name='default-project', user='dhruv2mars')\nstudio = Studio(name='parameter-golf', teamspace=ts)\n\n# Install dependencies\nprint('Installing deps...')\nresult = studio.run('pip install sentencepiece numpy torch --quiet 2>&1')\nprint(result[:500] if len(result) > 500 else result)\n\" 2>&1","timeout_seconds":"120"}}],"api":"anthropic-messages","provider":"minimax","model":"MiniMax-M2.7","usage":{"input":81085,"output":221,"cacheRead":9348,"cacheWrite":0,"totalTokens":90654,"cost":{"input":0.0243255,"output":0.0002652,"cacheRead":0.0005608799999999999,"cacheWrite":0,"total":0.02515158}},"stopReason":"toolUse","timestamp":1777290770595,"responseId":"063e811575fd8e0d6761fdd261ef6122"}}
