{"type":"message","id":"183622f0","parentId":"d02a6028","timestamp":"2026-04-25T20:24:54.524Z","message":{"role":"toolResult","toolCallId":"call_function_tg06i9gznjzc_1","toolName":"bash","content":[{"type":"text","text":",{\"stream_name\":\"stdout\",\"time\":1904.317511667,\"data\":\"[6/6] Running TTT...\\n\"}\n,{\"stream_name\":\"stdout\",\"time\":1904.359083827,\"data\":\"[TTT] Starting Test-Time Training...\\n\"}\n,{\"stream_name\":\"stderr\",\"time\":1907.356947698,\"data\":\"[rank0]: Traceback (most recent call last):\\n\"}\n,{\"stream_name\":\"stderr\",\"time\":1907.356984003,\"data\":\"[rank0]:   File \\\"/kaggle/src/script.py\\\", line 1054, in \\u003cmodule\\u003e\\n\"}\n,{\"stream_name\":\"stderr\",\"time\":1907.356990756,\"data\":\"[rank0]:     train()\\n\"}\n,{\"stream_name\":\"stderr\",\"time\":1907.356995758,\"data\":\"[rank0]:   File \\\"/kaggle/src/script.py\\\", line 1007, in train\\n\"}\n,{\"stream_name\":\"stderr\",\"time\":1907.35701736,\"data\":\"[rank0]:     raw_model = run_ttt(raw_model, val_tokens, base_bytes_lut, device, args, log)\\n\"}\n,{\"stream_name\":\"stderr\",\"time\":1907.35702047,\"data\":\"[rank0]:                 ^^^^^^^^^^^^^^^^^^^^^^^^^^^^^^^^^^^^^^^^^^^^^^^^^^^^^^^^^^^^^^^^^\\n\"}\n,{\"stream_name\":\"stderr\",\"time\":1907.357022976,\"data\":\"[rank0]:   File \\\"/kaggle/src/script.py\\\", line 629, in run_ttt\\n\"}\n,{\"stream_name\":\"stderr\",\"time\":1907.357025444,\"data\":\"[rank0]:     _ = model(x, y)\\n\"}\n,{\"stream_name\":\"stderr\",\"time\":1907.357027806,\"data\":\"[rank0]:         ^^^^^^^^^^^\\n\"}\n,{\"stream_name\":\"stderr\",\"time\":1907.357030162,\"data\":\"[rank0]:   File \\\"/usr/local/lib/python3.12/dist-packages/torch/nn/modules/module.py\\\", line 1776, in _wrapped_call_impl\\n\"}\n,{\"stream_name\":\"stderr\",\"time\":1907.357032842,\"data\":\"[rank0]:     return self._call_impl(*args, **kwargs)\\n\"}\n,{\"stream_name\":\"stderr\",\"time\":1907.357035249,\"data\":\"[rank0]:            ^^^^^^^^^^^^^^^^^^^^^^^^^^^^^^^^\\n\"}\n,{\"stream_name\":\"stderr\",\"time\":1907.35703763,\"data\":\"[rank0]:   File \\\"/usr/local/lib/python3.12/dist-packages/torch/nn/modules/module.py\\\", line 1787, in _call_impl\\n\"}\n,{\"stream_name\":\"stderr\",\"time\":1907.357040159,\"data\":\"[rank0]:     return forward_call(*args, **kwargs)\\n\"}\n,{\"stream_name\":\"stderr\",\"time\":1907.357043462,\"data\":\"[rank0]:            ^^^^^^^^^^^^^^^^^^^^^^^^^^^^^\\n\"}\n,{\"stream_name\":\"stderr\",\"time\":1907.357059922,\"data\":\"[rank0]:   File \\\"/kaggle/src/script.py\\\", line 458, in forward\\n\"}\n,{\"stream_name\":\"stderr\",\"time\":1907.357064418,\"data\":\"[rank0]:     x = block(x, x0)\\n\"}\n,{\"stream_name\":\"stderr\",\"time\":1907.357068613,\"data\":\"[rank0]:         ^^^^^^^^^^^^\\n\"}\n,{\"stream_name\":\"stderr\",\"time\":1907.357072946,\"data\":\"[rank0]:   File \\\"/usr/local/lib/python3.12/dist-packages/torch/nn/modules/module.py\\\", line 1776, in _wrapped_call_impl\\n\"}\n,{\"stream_name\":\"stderr\",\"time\":1907.35707748,\"data\":\"[rank0]:     return self._call_impl(*args, **kwargs)\\n\"}\n,{\"stream_name\":\"stderr\",\"time\":1907.357081146,\"data\":\"[rank0]:            ^^^^^^^^^^^^^^^^^^^^^^^^^^^^^^^^\\n\"}\n,{\"stream_name\":\"stderr\",\"time\":1907.357084572,\"data\":\"[rank0]:   File \\\"/usr/local/lib/python3.12/dist-packages/torch/nn/modules/module.py\\\", line 1787, in _call_impl\\n\"}\n,{\"stream_name\":\"stderr\",\"time\":1907.357088124,\"data\":\"[rank0]:     return forward_call(*args, **kwargs)\\n\"}\n,{\"stream_name\":\"stderr\",\"time\":1907.35709163,\"data\":\"[rank0]:            ^^^^^^^^^^^^^^^^^^^^^^^^^^^^^\\n\"}\n,{\"stream_name\":\"stderr\",\"time\":1907.357095246,\"data\":\"[rank0]:   File \\\"/kaggle/src/script.py\\\", line 410, in forward\\n\"}\n,{\"stream_name\":\"stderr\",\"time\":1907.357098924,\"data\":\"[rank0]:     self.attn(self.attn_norm(x_in) * self.ln_scale)\\n\"}\n,{\"stream_name\":\"stderr\",\"time\":1907.357102533,\"data\":\"[rank0]:   File \\\"/usr/local/lib/python3.12/dist-packages/torch/nn/modules/module.py\\\", line 1776, in _wrapped_call_impl\\n\"}\n,{\"stream_name\":\"stderr\",\"time\":1907.35710642,\"data\":\"[rank0]:     return self._call_impl(*args, **kwargs)\\n\"}\n,{\"stream_name\":\"stderr\",\"time\":1907.357118587,\"data\":\"[rank0]:            ^^^^^^^^^^^^^^^^^^^^^^^^^^^^^^^^\\n\"}\n,{\"stream_name\":\"stderr\",\"time\":1907.357127124,\"data\":\"[rank0]:   File \\\"/usr/local/lib/python3.12/dist-packages/torch/nn/modules/module.py\\\", line 1787, in _call_impl\\n\"}\n,{\"stream_name\":\"stderr\",\"time\":1907.357130348,\"data\":\"[rank0]:     return forward_call(*args, **kwargs)\\n\"}\n,{\"stream_name\":\"stderr\",\"time\":1907.357132747,\"data\":\"[rank0]:            ^^^^^^^^^^^^^^^^^^^^^^^^^^^^^\\n\"}\n,{\"stream_name\":\"stderr\",\"time\":1907.357136324,\"data\":\"[rank0]:   File \\\"/kaggle/src/script.py\\\", line 359, in forward\\n\"}\n,{\"stream_name\":\"stderr\",\"time\":1907.357139046,\"data\":\"[rank0]:     attn = torch.matmul(q * scale, k.transpose(-2, -1).float())\\n\"}\n,{\"stream_name\":\"stderr\",\"time\":1907.357160752,\"data\":\"[rank0]:            ^^^^^^^^^^^^^^^^^^^^^^^^^^^^^^^^^^^^^^^^^^^^^^^^^^^^\\n\"}\n,{\"stream_name\":\"stderr\",\"time\":1907.357166511,\"data\":\"[rank0]: torch.OutOfMemoryError: CUDA out of memory. Tried to allocate 32.00 GiB. GPU 0 has a total capacity of 14.56 GiB of which 13.33 GiB is free. Including non-PyTorch memory, this process has 1.23 GiB memory in use. Of the allocated memory 824.94 MiB is allocated by PyTorch, and 215.06 MiB is reserved by PyTorch but unallocated. If reserved but unallocated memory is large try setting PYTORCH_ALLOC_CONF=expandable_segments:True to avoid fragmentation.  See documentation for Memory Management  (https://pytorch.org/docs/stable/notes/cuda.html#environment-variables)\\n\"}\n,{\"stream_name\":\"stderr\",\"time\":1907.724677159,\"data\":\"[rank0]:[W425 20:19:46.301675159 ProcessGroupNCCL.cpp:1553] Warning: WARNING: destroy_process_group() was not called before program exit, which can leak resources. For more info, please see https://pytorch.org/docs/stable/distributed.html#shutdown (function operator())\\n\"}\n,{\"stream_name\":\"stderr\",\"time\":1909.809736299,\"data\":\"E0425 20:19:48.570000 7 torch/distributed/elastic/multiprocessing/api.py:984] failed (exitcode: 1) local_rank: 0 (pid: 27) of binary: /usr/bin/python3\\n\"}\n,{\"stream_name\":\"stderr\",\"time\":1909.835054504,\"data\":\"Traceback (most recent call last):\\n\"}\n,{\"stream_name\":\"stderr\",\"time\":1909.835078916,\"data\":\"  File \\\"\\u003cfrozen runpy\\u003e\\\", line 198, in _run_module_as_main\\n\"}\n,{\"stream_name\":\"stderr\",\"time\":1909.835084872,\"data\":\"  File \\\"\\u003cfrozen runpy\\u003e\\\", line 88, in _run_code\\n\"}\n,{\"stream_name\":\"stderr\",\"time\":1909.835094007,\"data\":\"  File \\\"/usr/local/lib/python3.12/dist-packages/torch/distributed/run.py\\\", line 995, in \\u003cmodule\\u003e\\n\"}\n,{\"stream_name\":\"stderr\",\"time\":1909.835586876,\"data\":\"    main()\\n\"}\n,{\"stream_name\":\"stderr\",\"time\":1909.835597275,\"data\":\"  File \\\"/usr/local/lib/python3.12/dist-packages/torch/distributed/elastic/multiprocessing/errors/__init__.py\\\", line 362, in wrapper\\n\"}\n,{\"stream_name\":\"stderr\",\"time\":1909.835896371,\"data\":\"    return f(*args, **kwargs)\\n\"}\n,{\"stream_name\":\"stderr\",\"time\":1909.835924187,\"data\":\"           ^^^^^^^^^^^^^^^^^^\\n\"}\n,{\"stream_name\":\"stderr\",\"time\":1909.835929888,\"data\":\"  File \\\"/usr/local/lib/python3.12/dist-packages/torch/distributed/run.py\\\", line 991, in main\\n\"}\n,{\"stream_name\":\"stderr\",\"time\":1909.836464479,\"data\":\"    run(args)\\n\"}\n,{\"stream_name\":\"stderr\",\"time\":1909.836474481,\"data\":\"  File \\\"/usr/local/lib/python3.12/dist-packages/torch/distributed/run.py\\\", line 982, in run\\n\"}\n,{\"stream_name\":\"stderr\",\"time\":1909.836957949,\"data\":\"    elastic_launch(\\n\"}\n,{\"stream_name\":\"stderr\",\"time\":1909.836973459,\"data\":\"  File \\\"/usr/local/lib/python3.12/dist-packages/torch/distributed/launcher/api.py\\\", line 170, in __call__\\n\"}\n,{\"stream_name\":\"stderr\",\"time\":1909.837044041,\"data\":\"    return launch_agent(self._config, self._entrypoint, list(args))\\n\"}\n,{\"stream_name\":\"stderr\",\"time\":1909.837195341,\"data\":\"           ^^^^^^^^^^^^^^^^^^^^^^^^^^^^^^^^^^^^^^^^^^^^^^^^^^^^^^^^\\n\"}\n,{\"stream_name\":\"stderr\",\"time\":1909.837204095,\"data\":\"  File \\\"/usr/local/lib/python3.12/dist-packages/torch/distributed/launcher/api.py\\\", line 317, in launch_agent\\n\"}\n,{\"stream_name\":\"stderr\",\"time\":1909.83737645,\"data\":\"    raise ChildFailedError(\\n\"}\n,{\"stream_name\":\"stderr\",\"time\":1909.837384421,\"data\":\"torch.distributed.elastic.multiprocessing.errors.ChildFailedError: \\n\"}\n,{\"stream_name\":\"stderr\",\"time\":1909.837388476,\"data\":\"============================================================\\n\"}\n,{\"stream_name\":\"stderr\",\"time\":1909.837392359,\"data\":\"/kaggle/src/script.py FAILED\\n\"}\n,{\"stream_name\":\"stderr\",\"time\":1909.837407681,\"data\":\"------------------------------------------------------------\\n\"}\n,{\"stream_name\":\"stderr\",\"time\":1909.837411534,\"data\":\"Failures:\\n\"}\n,{\"stream_name\":\"stderr\",\"time\":1909.837415029,\"data\":\"  \\u003cNO_OTHER_FAILURES\\u003e\\n\"}\n,{\"stream_name\":\"stderr\",\"time\":1909.837418862,\"data\":\"------------------------------------------------------------\\n\"}\n,{\"stream_name\":\"stderr\",\"time\":1909.837422395,\"data\":\"Root Cause (first observed failure):\\n\"}\n,{\"stream_name\":\"stderr\",\"time\":1909.837425809,\"data\":\"[0]:\\n\"}\n,{\"stream_name\":\"stderr\",\"time\":1909.837429856,\"data\":\"  time      : 2026-04-25_20:19:48\\n\"}\n,{\"stream_name\":\"stderr\",\"time\":1909.837433335,\"data\":\"  host      : 48ad975c046e\\n\"}\n,{\"stream_name\":\"stderr\",\"time\":1909.837436643,\"data\":\"  rank      : 0 (local_rank: 0)\\n\"}\n,{\"stream_name\":\"stderr\",\"time\":1909.837439873,\"data\":\"  exitcode  : 1 (pid: 27)\\n\"}\n,{\"stream_name\":\"stderr\",\"time\":1909.837443368,\"data\":\"  error_file: \\u003cN/A\\u003e\\n\"}\n,{\"stream_name\":\"stderr\",\"time\":1909.837446901,\"data\":\"  traceback : To enable traceback see: https://pytorch.org/docs/stable/elastic/errors.html\\n\"}\n,{\"stream_name\":\"stderr\",\"time\":1909.837450529,\"data\":\"============================================================\\n\"}\n,{\"stream_name\":\"stderr\",\"time\":1912.367978835,\"data\":\"/usr/local/lib/python3.12/dist-packages/mistune.py:435: SyntaxWarning: invalid escape sequence '\\\\|'\\n\"}\n,{\"stream_name\":\"stderr\",\"time\":1912.368005122,\"data\":\"  cells[i][c] = re.sub('\\\\\\\\\\\\\\\\\\\\|', '|', cell)\\n\"}\n,{\"stream_name\":\"stderr\",\"time\":1912.615057625,\"data\":\"/usr/local/lib/python3.12/dist-packages/nbconvert/filters/filter_links.py:36: SyntaxWarning: invalid escape sequence '\\\\_'\\n\"}\n,{\"stream_name\":\"stderr\",\"time\":1912.615086299,\"data\":\"  text = re.sub(r'_', '\\\\_', text) # Escape underscores in display text\\n\"}\n,{\"stream_name\":\"stderr\",\"time\":1913.237966788,\"data\":\"[NbConvertApp] Converting notebook __script__.ipynb to html\\n\"}\n,{\"stream_name\":\"stderr\",\"time\":1914.586541856,\"data\":\"[NbConvertApp] Writing 473630 bytes to __results__.html\\n\"}\n]"}],"isError":false,"timestamp":1777148694524}}
{"type":"message","id":"e91f4c64","parentId":"183622f0","timestamp":"2026-04-25T20:24:56.904Z","message":{"role":"assistant","content":[{"type":"thinking","thinking":"The dtype fix worked but now there's an OOM in TTT's attention score computation. The problem is in the attention forward: `torch.matmul(q * scale, k.transpose(-2, -1).float())` - the `.float()` creates a full-size float32 attention matrix which is 32GB for seq_len=512 and 8192 batch tokens. That's huge.\n\nI need to fix the attention to not create full-size float32 matrices. Let me look at the attention code and fix it.","thinkingSignature":"99bfc70ffbb9a26d0fc5e11813df4bf03978bb6f203c7ffa08265041e161aea2"},{"type":"toolCall","id":"call_function_tu1mamb255na_1","name":"log_experiment","arguments":{"asi":{"error":"OOM: attention .float() creates 32GB matrix","fix_needed":"Remove .float() or use bf16 for attention scores","ttt_broken":true},"commit":"e8ecad4","description":"TTT still broken: OOM from attention .float() creating 32GB matrix","metric":2.3821,"metrics":{"artifact_mb":12.3,"best_val_bpb":2.3821,"steps":1200},"status":"discard"}}],"api":"anthropic-messages","provider":"minimax","model":"MiniMax-M2.7","usage":{"input":3207,"output":270,"cacheRead":49696,"cacheWrite":0,"totalTokens":53173,"cost":{"input":0.0009620999999999999,"output":0.00032399999999999996,"cacheRead":0.0029817599999999995,"cacheWrite":0,"total":0.004267859999999999}},"stopReason":"toolUse","timestamp":1777148694527,"responseId":"063c56168dff064b89298eb322c0d5d0"}}
{"type":"message","id":"749d82b8","parentId":"e91f4c64","timestamp":"2026-04-25T20:24:56.953Z","message":{"role":"toolResult","toolCallId":"call_function_tu1mamb255na_1","toolName":"log_experiment","content":[{"type":"text","text":"Logged #3: discard — TTT still broken: OOM from attention .float() creating 32GB matrix\nBaseline val_bpb: 2.38bpb\nSecondary: artifact_mb: 12.30mb (+1.7%)  best_val_bpb: 2.38 (+0.1%)  steps: 1,200 (+3.9%)\n📋 ASI: error: OOM: attention .float() creates 32GB matrix | fix_needed: Remove .float() or use bf16 for attention scores | ttt_broken: true\n(3 experiments)\n📝 Git: reverted changes (discard) — autoresearch files preserved"}],"details":{"experiment":{"commit":"e8ecad4","metric":2.3821,"metrics":{"artifact_mb":12.3,"best_val_bpb":2.3821,"steps":1200},"status":"discard","description":"TTT still broken: OOM from attention .float() creating 32GB matrix","timestamp":1777148696907,"segment":0,"confidence":null,"iterationTokens":null,"asi":{"error":"OOM: attention .float() creates 32GB matrix","fix_needed":"Remove .float() or use bf16 for attention scores","ttt_broken":true}},"state":{"results":[{"commit":"a672845","metric":2.379,"metrics":{"best_val_bpb":2.379,"steps":1155,"artifact_mb":12.1},"status":"keep","description":"30-min baseline: 2.379 val_bpb, 1155 steps, still improving","timestamp":1777144208804,"segment":0,"confidence":null,"iterationTokens":null,"asi":{"baseline_30min":true,"steps_completed":1155,"max_iterations":7000,"pct_exhausted":16.5,"loss_still_declining":true,"artifact_mb":12.1,"gap_to_sub1":1.879}},{"commit":"a672845","metric":2.3857,"metrics":{"artifact_mb":12.3,"best_val_bpb":2.3857,"steps":1200},"status":"discard","description":"TTT crashed: dtype mismatch in CastedLinear (bf16/float32)","timestamp":1777146462942,"segment":0,"confidence":null,"iterationTokens":null,"asi":{"error":"mat1 mat2 dtype mismatch bf16 vs float","fix_needed":"CastedLinear cast weights to match autocast dtype","ttt_broken":true}},{"commit":"e8ecad4","metric":2.3821,"metrics":{"artifact_mb":12.3,"best_val_bpb":2.3821,"steps":1200},"status":"discard","description":"TTT still broken: OOM from attention .float() creating 32GB matrix","timestamp":1777148696907,"segment":0,"confidence":null,"iterationTokens":null,"asi":{"error":"OOM: attention .float() creates 32GB matrix","fix_needed":"Remove .float() or use bf16 for attention scores","ttt_broken":true}}],"bestMetric":2.379,"bestDirection":"lower","metricName":"val_bpb","metricUnit":"bpb","secondaryMetrics":[{"name":"best_val_bpb","unit":""},{"name":"steps","unit":""},{"name":"artifact_mb","unit":"mb"}],"name":"Parameter Golf - Find Best Config for Sub-1 BPB","currentSegment":0,"maxExperiments":null,"confidence":null},"wallClockSeconds":null},"isError":false,"timestamp":1777148696953}}
{"type":"message","id":"02dfbd50","parentId":"749d82b8","timestamp":"2026-04-25T20:25:00.692Z","message":{"role":"assistant","content":[{"type":"thinking","thinking":"The attention code uses `.float()` which allocates a full 32GB matrix on T4 (14.5GB). Let me fix this properly.\n\nIn the attention forward:\n```python\nattn = torch.matmul(q * scale, k.transpose(-2, -1).float())\n```\n\nThis creates a float32 matrix of (seq_len x seq_len). For seq_len=512 that's 512x512=262K elements, but wait that's only ~1MB. \n\nBut the error says \"Tried to allocate 32.00 GiB\". That's much bigger. Maybe it's creating something larger?\n\n\nActually, I see it now—the model is processing multiple batches with 8192 tokens per batch, which gets reshaped into 16 sequences of length 512. So when the attention matrix is computed across all sequences simultaneously, it's actually creating a 8192x8192 matrix instead of the smaller per-sequence one.\n\nLooking at the actual computation: `torch.matmul(q * scale, k.transpose(-2, -1).float())` with shapes (16, 8, 512, 64) and (16, 8, 512, 64) produces a (16, 8, 512, 512) output. That's only about 4 million float32 elements—roughly 16MB, not the 32GB error we're seeing. Something else must be causing the massive allocation.\n\nThe log explicitly states \"CUDA out of memory. Tried to allocate 32.00 GiB\", which doesn't match this calculation. I suspect the `.float()` conversion on the attention scores is forcing computation back to float32, and PyTorch's memory allocator might be reserving space for the full bf16 matrix plus additional head dimensions. The simplest solution would be to remove the `.float()` call entirely and use bf16 throughout, which should handle numerical stability fine for softmax. If that causes issues, I could switch to computing in bf16 instead.\n\nNow I'm realizing the original code used `.float()` on the attention scores itself, but the issue is that converting back to float32 after working in bf16 can cause the allocator to reserve extra space. I need to remove that `.float()` call to keep everything in bf16.\n","thinkingSignature":"6a7e714e780214c79190e1d7929fca5aef86bbebafd2ed530db246ef3843368a"},{"type":"toolCall","id":"call_function_tbe7g6nvecc6_1","name":"read","arguments":{"limit":20,"offset":355,"path":"/Users/dhruv2mars/dev/github/parameter-golf/train_kaggle.py"}}],"api":"anthropic-messages","provider":"minimax","model":"MiniMax-M2.7","usage":{"input":327,"output":515,"cacheRead":52896,"cacheWrite":0,"totalTokens":53738,"cost":{"input":0.0000981,"output":0.000618,"cacheRead":0.00317376,"cacheWrite":0,"total":0.0038898599999999998}},"stopReason":"toolUse","timestamp":1777148696955,"responseId":"063c56196bf29720de0172c13492e638"}}
{"type":"message","id":"9c0a07b9","parentId":"02dfbd50","timestamp":"2026-04-25T20:25:00.715Z","message":{"role":"toolResult","toolCallId":"call_function_tbe7g6nvecc6_1","toolName":"read","content":[{"type":"text","text":"        return self.o_proj(out)\n\n\nclass MLP(nn.Module):\n    \"\"\"MLP with squared LeakyReLU activation.\"\"\"\n    def __init__(self, dim, mult=4):\n        super().__init__()\n        self.fc = CastedLinear(dim, mult * dim)\n        self.proj = CastedLinear(mult * dim, dim)\n    \n    def forward(self, x):\n        return self.proj(F.leaky_relu(self.fc(x), negative_slope=0.5).square())\n\n\nclass Block(nn.Module):\n    \"\"\"Transformer block with pre-norm and learned residuals.\"\"\"\n    def __init__(self, dim, num_heads, num_kv_heads, mlp_mult, rope_base, \n                 qk_gain_init, layer_idx, rope_dims=0):\n        super().__init__()\n        self.layer_idx = layer_idx\n\n[671 more lines in file. Use offset=375 to continue.]"}],"isError":false,"timestamp":1777148700715}}
{"type":"message","id":"43c2b703","parentId":"9c0a07b9","timestamp":"2026-04-25T20:25:01.652Z","message":{"role":"assistant","content":[{"type":"thinking","thinking":"Let me find the attention forward method to see the .float() call:\n","thinkingSignature":"5b8b58a186f60ab7946b3e31ef5416e38d40a8f4d764dee5da38227d91b6b937"},{"type":"toolCall","id":"call_function_w1oh9h0l605r_1","name":"read","arguments":{"limit":30,"offset":330,"path":"/Users/dhruv2mars/dev/github/parameter-golf/train_kaggle.py"}}],"api":"anthropic-messages","provider":"minimax","model":"MiniMax-M2.7","usage":{"input":266,"output":76,"cacheRead":53216,"cacheWrite":0,"totalTokens":53558,"cost":{"input":0.0000798,"output":0.0000912,"cacheRead":0.00319296,"cacheWrite":0,"total":0.00336396}},"stopReason":"toolUse","timestamp":1777148700719,"responseId":"063c561c088730d31f70f5e554e70640"}}
