{"type":"message","id":"47105db7","parentId":"c851c324","timestamp":"2026-04-25T19:09:56.134Z","message":{"role":"toolResult","toolCallId":"call_function_r0jvsgkojcpi_1","toolName":"bash","content":[{"type":"text","text":"/Users/dhruv2mars/dev/github/parameter-golf/experiments/kaggle_results/pg-auto-30min-baseline-20260426-41891/pg-auto-30min-baseline-20260426-41891.log\n/Users/dhruv2mars/dev/github/parameter-golf/experiments/kaggle_results/pg-auto-30min-baseline-20260426-41891/logs/30min-baseline-20260426.rank0.txt\n/Users/dhruv2mars/dev/github/parameter-golf/experiments/kaggle_results/pg-auto-30min-baseline-20260426-41891/logs/30min-baseline-20260426.rank1.txt\n"}],"isError":false,"timestamp":1777144196134}}
{"type":"message","id":"10e41b72","parentId":"47105db7","timestamp":"2026-04-25T19:09:56.134Z","message":{"role":"toolResult","toolCallId":"call_function_r0jvsgkojcpi_2","toolName":"bash","content":[{"type":"text","text":"(no output)"}],"isError":false,"timestamp":1777144196134}}
{"type":"message","id":"a62769dd","parentId":"10e41b72","timestamp":"2026-04-25T19:09:57.788Z","message":{"role":"assistant","content":[{"type":"thinking","thinking":"Let me read the log file directly.","thinkingSignature":"ba1c9f966f4a7f180d6a0039332064ccd489aa25af229408c53bfa47d132d68f"},{"type":"toolCall","id":"call_function_olnmra54aj0e_1","name":"read","arguments":{"limit":100,"path":"/Users/dhruv2mars/dev/github/parameter-golf/experiments/kaggle_results/pg-auto-30min-baseline-20260426-41891/logs/30min-baseline-20260426.rank0.txt"}}],"api":"anthropic-messages","provider":"minimax","model":"MiniMax-M2.7","usage":{"input":341,"output":90,"cacheRead":40224,"cacheWrite":0,"totalTokens":40655,"cost":{"input":0.00010229999999999999,"output":0.000108,"cacheRead":0.0024134399999999998,"cacheWrite":0,"total":0.00262374}},"stopReason":"toolUse","timestamp":1777144196137,"responseId":"063c4484ac3601606d4c9848de2da4df"}}
{"type":"message","id":"b83da161","parentId":"a62769dd","timestamp":"2026-04-25T19:09:57.804Z","message":{"role":"toolResult","toolCallId":"call_function_olnmra54aj0e_1","toolName":"read","content":[{"type":"text","text":"============================================================\nParameter Golf - T4 Training\nRun ID: 30min-baseline-20260426\nDevice: Tesla T4 (rank 0/2)\nPyTorch: 2.10.0+cu128\n============================================================\n[1/6] Downloading data...\n[2/6] Loading tokenizer...\nVal tokens: 40,540,803\n[3/6] Building model...\nParams: 35,993,176 (68.7 MB bf16)\n[4/6] Training...\nstep:1/7000 train_loss:9.0175 time:0s\nstep:2/7000 train_loss:9.0043 time:2s\nstep:3/7000 train_loss:9.0065 time:3s\nstep:4/7000 train_loss:8.9989 time:4s\nstep:5/7000 train_loss:8.9666 time:5s\nstep:6/7000 train_loss:8.9356 time:6s\nstep:7/7000 train_loss:8.8951 time:8s\nstep:8/7000 train_loss:8.8568 time:9s\nstep:9/7000 train_loss:8.8023 time:10s\nstep:10/7000 train_loss:8.7522 time:11s\nstep=50 val_loss=7.1681 val_bpb=3.3254 best_bpb=3.3254 elapsed_s=60\n[CKPT] Best checkpoint saved\nstep:100/7000 train_loss:6.5813 time:138s\nstep=100 val_loss=6.5154 val_bpb=3.0226 best_bpb=3.0226 elapsed_s=139\n[CKPT] Best checkpoint saved\nstep=150 val_loss=6.2239 val_bpb=2.8874 best_bpb=2.8874 elapsed_s=217\n[CKPT] Best checkpoint saved\nstep:200/7000 train_loss:6.1759 time:294s\nstep=200 val_loss=6.0421 val_bpb=2.8031 best_bpb=2.8031 elapsed_s=296\n[CKPT] Best checkpoint saved\nstep=250 val_loss=5.9531 val_bpb=2.7618 best_bpb=2.7618 elapsed_s=374\n[CKPT] Best checkpoint saved\nstep:300/7000 train_loss:5.9836 time:451s\nstep=300 val_loss=5.8397 val_bpb=2.7092 best_bpb=2.7092 elapsed_s=452\n[CKPT] Best checkpoint saved\nstep=350 val_loss=5.7481 val_bpb=2.6666 best_bpb=2.6666 elapsed_s=530\n[CKPT] Best checkpoint saved\nstep:400/7000 train_loss:5.5204 time:607s\nstep=400 val_loss=5.6735 val_bpb=2.6320 best_bpb=2.6320 elapsed_s=609\n[CKPT] Best checkpoint saved\nstep=450 val_loss=5.5696 val_bpb=2.5839 best_bpb=2.5839 elapsed_s=687\n[CKPT] Best checkpoint saved\n[CKPT] Saved: checkpoints/30min-baseline-20260426/ckpt_step_493.pt\nstep:500/7000 train_loss:5.2423 time:764s\nstep=500 val_loss=5.5807 val_bpb=2.5890 best_bpb=2.5839 elapsed_s=766\nstep=550 val_loss=5.4834 val_bpb=2.5438 best_bpb=2.5438 elapsed_s=843\n[CKPT] Best checkpoint saved\nstep:600/7000 train_loss:5.5699 time:920s\nstep=600 val_loss=5.4438 val_bpb=2.5255 best_bpb=2.5255 elapsed_s=922\n[CKPT] Best checkpoint saved\nstep=650 val_loss=5.3949 val_bpb=2.5028 best_bpb=2.5028 elapsed_s=1000\n[CKPT] Best checkpoint saved\nstep:700/7000 train_loss:5.1525 time:1076s\nstep=700 val_loss=5.3456 val_bpb=2.4799 best_bpb=2.4799 elapsed_s=1078\n[CKPT] Best checkpoint saved\nstep=750 val_loss=5.3533 val_bpb=2.4835 best_bpb=2.4799 elapsed_s=1156\nstep:800/7000 train_loss:5.3480 time:1232s\nstep=800 val_loss=5.3018 val_bpb=2.4596 best_bpb=2.4596 elapsed_s=1234\n[CKPT] Best checkpoint saved\nstep=850 val_loss=5.2780 val_bpb=2.4486 best_bpb=2.4486 elapsed_s=1312\n[CKPT] Best checkpoint saved\nstep:900/7000 train_loss:5.0398 time:1389s\nstep=900 val_loss=5.2601 val_bpb=2.4403 best_bpb=2.4403 elapsed_s=1390\n[CKPT] Best checkpoint saved\nstep=950 val_loss=5.2396 val_bpb=2.4308 best_bpb=2.4308 elapsed_s=1468\n[CKPT] Best checkpoint saved\n[CKPT] Saved: checkpoints/30min-baseline-20260426/ckpt_step_973.pt\nstep:1000/7000 train_loss:5.0695 time:1546s\nstep=1000 val_loss=5.2007 val_bpb=2.4127 best_bpb=2.4127 elapsed_s=1548\n[CKPT] Best checkpoint saved\nstep=1050 val_loss=5.2399 val_bpb=2.4309 best_bpb=2.4127 elapsed_s=1626\nstep:1100/7000 train_loss:4.9216 time:1702s\nstep=1100 val_loss=5.1575 val_bpb=2.3927 best_bpb=2.3927 elapsed_s=1703\n[CKPT] Best checkpoint saved\nstep=1150 val_loss=5.1280 val_bpb=2.3790 best_bpb=2.3790 elapsed_s=1781\n[CKPT] Best checkpoint saved\nWallclock limit reached at step 1155\n[4/6] Training complete. Best val_bpb: 2.3790\n[5/6] Saving final model...\nCompressed artifact: 12,072,528 bytes\nCode size: 38,763 bytes\nTotal: 12,111,291 bytes (limit: 16,000,000)\n============================================================\nDONE\n============================================================\nfinal_val_bpb=2.3790 total_steps=1155 total_time_s=1878 artifact_bytes=12072528 code_bytes=38763 total_bytes=12111291\n"}],"isError":false,"timestamp":1777144197803}}
{"type":"message","id":"d71f5a9b","parentId":"b83da161","timestamp":"2026-04-25T19:10:08.796Z","message":{"role":"assistant","content":[{"type":"thinking","thinking":"Interesting! The 30-min baseline got:\n- **val_bpb: 2.379** at step 1155\n- **Trained for 31 minutes** (1878s) and completed 1155 steps\n- Only 1100 iterations of 7000 — so it didn't even get close to exhausting training\n- Still improving! From step 1100 (2.3927) to step 1150 (2.3790) to step 1155 (wallclock limit)\n- **Artifact size: 12,072,528 bytes** (fits well under 16MB)\n- **Code size: 38,763 bytes**\n\n\n- **Total: 12,111,291 bytes** (under 16MB limit)\n\nThe learning rate schedule looks solid — steady improvement throughout, dropping from 3.3254 down to 2.3790 across the full run. The loss is still decreasing, so extended training should yield even better results. With only 1155 steps completed in 31 minutes, there's clearly more potential to unlock here.\n\nLooking at the performance gap, I'm about 1.3 BPB away from sub-1, which makes me wonder if the loss computation itself might be the bottleneck. Let me trace through the math to see if there's something off with how val_bpb is being calculated.\n\nThe formula converts cross-entropy to bits-per-token, then multiplies by the compression ratio from the byte lookup table. Since val_bpb is consistently lower than val_loss, the model must be outputting tokens that compress well per byte. With the model still converging at step 1150, there's definitely room for improvement with longer training.\n\nFor the next iteration, I'm considering a few angles: lowering the learning rate might help convergence since it hasn't plateaued yet, though I'm also wondering if there's a systematic issue with how val_loss is being calculated or how the val_bpb metric is computed. I could try pushing iterations higher or reducing batch size to improve gradient quality, but first I want to double-check whether the loss calculation itself has a bug that's holding back performance. The math checks out—val_bpb of 2.379 corresponds to a compression ratio of 0.84 bits per byte, which aligns with what you'd expect from English text compressed with a BPE tokenizer. But stepping back, the real puzzle is that we hit 2.379 after 31 minutes of training, yet the SOTA leaderboard shows 1.08 for just 10 minutes on H100s—and with T4s being about 3x slower, that should only get us to around 2.7. Something's off with that calculation.\n\nActually, maybe the comparison isn't direct. The Kaggle evaluation might weight things differently than our internal validation, so that 1.08 could come from a totally different setup. I should dig into the actual leaderboard results and what they achieved to get a clearer picture.\n","thinkingSignature":"3f50c048372e60610f257969df9932b83a5c0c9de4a12313efa55de8c8a58c57"},{"type":"text","text":"\n\n**Phase 2: Analysis**\n\n30-min baseline result:\n- **val_bpb: 2.379** at step 1155 (still improving!)\n- 1155 steps in 31 min — only 16.5% of iterations exhausted\n- Artifact: 12.1MB (well under 16MB limit)\n- Loss curve: steady improvement, no plateau\n\n**Key insight:** Model is still learning. Extended training will help significantly. But 2.379 → sub-1 needs more than just time.\n\n**Gap analysis:**\n- Current: 2.379 BPB\n- Target: 0.5-0.6 BPB\n- Gap: ~1.8 BPB to close\n\n**What's needed:**\n1. More training time (model still converging)\n2. TTT boost (currently disabled)\n3. Possible architecture tweaks\n\nLet me log this baseline and start the loop.\n"},{"type":"toolCall","id":"call_function_wvqe8sj4ltuj_1","name":"log_experiment","arguments":{"asi":{"baseline_30min":true,"steps_completed":1155,"max_iterations":7000,"pct_exhausted":16.5,"loss_still_declining":true,"artifact_mb":12.1,"gap_to_sub1":1.879},"commit":"a672845","description":"30-min baseline: 2.379 val_bpb, 1155 steps, still improving","metric":2.379,"metrics":{"best_val_bpb":2.379,"steps":1155,"artifact_mb":12.1},"status":"keep"}}],"api":"anthropic-messages","provider":"minimax","model":"MiniMax-M2.7","usage":{"input":1669,"output":976,"cacheRead":40544,"cacheWrite":0,"totalTokens":43189,"cost":{"input":0.0005007,"output":0.0011711999999999998,"cacheRead":0.00243264,"cacheWrite":0,"total":0.004104539999999999}},"stopReason":"toolUse","timestamp":1777144197807,"responseId":"063c448554295ad7e7de23fbc24135c1"}}
{"type":"message","id":"9aea76f3","parentId":"d71f5a9b","timestamp":"2026-04-25T19:10:18.979Z","message":{"role":"toolResult","toolCallId":"call_function_wvqe8sj4ltuj_1","toolName":"log_experiment","content":[{"type":"text","text":"Logged #1: keep — 30-min baseline: 2.379 val_bpb, 1155 steps, still improving\nBaseline val_bpb: 2.38bpb\nSecondary: best_val_bpb: 2.38  steps: 1,155  artifact_mb: 12.10mb\n📋 ASI: baseline_30min: true | steps_completed: 1155 | max_iterations: 7000 | pct_exhausted: 16.5 | loss_still_declining: true | artifact_mb: 12.1 | gap_to_sub1: 1.879\n(1 experiments)\n📝 Git: committed — "}],"details":{"experiment":{"commit":"a672845","metric":2.379,"metrics":{"best_val_bpb":2.379,"steps":1155,"artifact_mb":12.1},"status":"keep","description":"30-min baseline: 2.379 val_bpb, 1155 steps, still improving","timestamp":1777144208804,"segment":0,"confidence":null,"iterationTokens":null,"asi":{"baseline_30min":true,"steps_completed":1155,"max_iterations":7000,"pct_exhausted":16.5,"loss_still_declining":true,"artifact_mb":12.1,"gap_to_sub1":1.879}},"state":{"results":[{"commit":"a672845","metric":2.379,"metrics":{"best_val_bpb":2.379,"steps":1155,"artifact_mb":12.1},"status":"keep","description":"30-min baseline: 2.379 val_bpb, 1155 steps, still improving","timestamp":1777144208804,"segment":0,"confidence":null,"iterationTokens":null,"asi":{"baseline_30min":true,"steps_completed":1155,"max_iterations":7000,"pct_exhausted":16.5,"loss_still_declining":true,"artifact_mb":12.1,"gap_to_sub1":1.879}}],"bestMetric":2.379,"bestDirection":"lower","metricName":"val_bpb","metricUnit":"bpb","secondaryMetrics":[{"name":"best_val_bpb","unit":""},{"name":"steps","unit":""},{"name":"artifact_mb","unit":"mb"}],"name":"Parameter Golf - Find Best Config for Sub-1 BPB","currentSegment":0,"maxExperiments":null,"confidence":null},"wallClockSeconds":null},"isError":false,"timestamp":1777144218979}}
{"type":"message","id":"bb7fc81c","parentId":"9aea76f3","timestamp":"2026-04-25T19:10:30.404Z","message":{"role":"assistant","content":[{"type":"thinking","thinking":"Phase 1 done. Now Phase 2: Analysis.\n\nKey findings from the 30-min baseline:\n1. **val_bpb = 2.379** at 30 min\n2. Still improving (last val at step 1150 was 2.379)\n3. Only 16.5% of iterations exhausted (1155/7000)\n4. Wallclock hit at step 1155 (not iteration cap)\n5. Artifact: 12.1 MB (under 16MB limit ✓)\n\n**Gap analysis:**\n- Current: 2.379 BPB\n\n\n- Target: < 1.0 BPB\n- Gap: 1.379 BPB\n\nScaling the improvement curve—2x training time on T4 hardware should yield roughly 1.4x the gains, pushing the model toward 1.9 BPB. Even with extended training to 6 hours and reaching 0.75x the iteration count, I'd only get to around 1.1-1.2 BPB, which means I need to explore other optimization paths.\n\nTesting different augmentation strategies shows TTT alone won't cut it—the 30-minute runs are far too constrained to converge. I need to push toward 6-hour training with a solid TTT implementation and likely incorporate PPM to hit the sub-1.0 target. For now, I'll move forward with architectural and hyperparameter tuning to build the strongest possible foundation before running extended training.","thinkingSignature":"f536d0973780f7ee4c478f6bce6336625ba78de8d4fa4268180090defd96b43b"},{"type":"text","text":"\n\n## Phase 1 Complete ✅\n\n**30-min baseline: 2.379 BPB**\n- 1155 steps, 1878 seconds (~31 min)\n- Still improving at wallclock limit\n- Artifact: 12.1 MB (under 16MB ✓)\n\n## Phase 2: Analysis\n\n**Gap to sub-1:** 1.379 BPB\n\n**Scaling estimate:**\n- 30 min → 2.379 BPB\n- 6 hr (12x more) → estimated ~1.7 BPB (still not sub-1!)\n- Sub-1 needs: architecture improvements + extended training + TTT + PPM\n\n**Key insight:** Loss still declining at step 1155 — model hasn't converged. Extended training alone won't close the gap. Need to optimize the config too.\n\n**Immediate next run:** Let me try enabling TTT to see if it works. TTT alone won't save us, but if it adds even 0.1 BPB improvement, combined with extended training it could help.\n"},{"type":"toolCall","id":"call_function_xl3xt671eynp_1","name":"bash","arguments":{"command":"cd /Users/dhruv2mars/dev/github/parameter-golf && python3 experiments/pg_autoresearch.py run --name \"ar_ttt_enabled_$(date +%Y%m%d)\" --env \"ITERATIONS=7000\" --env \"MAX_WALLCLOCK_SECONDS=1800\" --env \"TTT_ENABLED=1\" --env \"TTT_EPOCHS=3\" --env \"TTT_LR=0.005\" --env \"TTT_WARMUP_TOKENS=32768\" --timeout 2400 2>&1"}}],"api":"anthropic-messages","provider":"minimax","model":"MiniMax-M2.7","usage":{"input":350,"output":648,"cacheRead":42208,"cacheWrite":0,"totalTokens":43206,"cost":{"input":0.00010499999999999999,"output":0.0007775999999999999,"cacheRead":0.0025324799999999997,"cacheWrite":0,"total":0.0034150799999999996}},"stopReason":"toolUse","timestamp":1777144218982,"responseId":"063c449d272aa346f77fe9101b3c1ede"}}
{"type":"message","id":"245bca71","parentId":"bb7fc81c","timestamp":"2026-04-25T19:47:18.451Z","message":{"role":"toolResult","toolCallId":"call_function_xl3xt671eynp_1","toolName":"bash","content":[{"type":"text","text":"{\"best_val_bpb\": 2.3857, \"compressed_bytes\": null, \"error\": \"Traceback (most recent call last):\\\\n\\\"}\\n,{\\\"stream_name\\\":\\\"stderr\\\",\\\"time\\\":1901.523188595,\\\"data\\\":\\\"[rank0]:   File \\\\\\\"/kaggle/src/script.py\\\\\\\", line 1054, in \\\\u003cmodule\\\\u003e\\\\n\\\"}\\n,{\\\"stream_name\\\":\\\"stderr\\\",\\\"time\\\":1901.523194894,\\\"data\\\":\\\"[rank0]:     train()\\\\n\\\"}\\n,{\\\"stream_name\\\":\\\"stderr\\\",\\\"time\\\":1901.523198627,\\\"data\\\":\\\"[rank0]:   File \\\\\\\"/kaggle/src/script.py\\\\\\\", line 1007, in train\\\\n\\\"}\\n,{\\\"stream_name\\\":\\\"stderr\\\",\\\"time\\\":1901.523202506,\\\"data\\\":\\\"[rank0]:     raw_model = run_ttt(raw_model, val_tokens, base_bytes_lu\", \"metric\": 2.3857, \"non_finite\": false, \"output\": \"/Users/dhruv2mars/dev/github/parameter-golf/experiments/kaggle_results/pg-auto-ar-ttt-enabled-20260426-44230\", \"ref\": \"dhruv2mars/pg-auto-ar-ttt-enabled-20260426-44230\", \"runtime_seconds\": null, \"status\": \"KernelWorkerStatus.ERROR\", \"steps\": 1200, \"ttt_val_bpb\": null, \"val_bpb\": 2.3857}\n"}],"isError":false,"timestamp":1777146438451}}
{"type":"message","id":"d53093a8","parentId":"245bca71","timestamp":"2026-04-25T19:47:23.276Z","message":{"role":"assistant","content":[{"type":"thinking","thinking":"There's an error in TTT! The TTT function is crashing. Let me check the error logs to understand what went wrong.","thinkingSignature":"62127889f70d0410ce0031e6c06ae122eee939830a75ebfabaeb94e4bde3538d"},{"type":"toolCall","id":"call_function_qbx2cpzjuny1_1","name":"bash","arguments":{"command":"cat /Users/dhruv2mars/dev/github/parameter-golf/experiments/kaggle_results/pg-auto-ar-ttt-enabled-20260426-44230/logs/*.txt 2>/dev/null | grep -A5 \"Traceback\\|ERROR\\|Error\" | head -50"}}],"api":"anthropic-messages","provider":"minimax","model":"MiniMax-M2.7","usage":{"input":43034,"output":110,"cacheRead":0,"cacheWrite":0,"totalTokens":43144,"cost":{"input":0.0129102,"output":0.00013199999999999998,"cacheRead":0,"cacheWrite":0,"total":0.0130422}},"stopReason":"toolUse","timestamp":1777146438453,"responseId":"063c4d4827d98dcf0b31ad11321a4802"}}
{"type":"message","id":"096f2e06","parentId":"d53093a8","timestamp":"2026-04-25T19:47:23.301Z","message":{"role":"toolResult","toolCallId":"call_function_qbx2cpzjuny1_1","toolName":"bash","content":[{"type":"text","text":"(no output)"}],"isError":false,"timestamp":1777146443301}}
{"type":"message","id":"64f795f4","parentId":"096f2e06","timestamp":"2026-04-25T19:47:25.093Z","message":{"role":"assistant","content":[{"type":"thinking","thinking":"Let me try to find the error logs.","thinkingSignature":"60deab5198256c7eaa13e032fa727caa8ee4d702f2e0f992f3d2570573404a97"},{"type":"toolCall","id":"call_function_urtv2pyurdnu_1","name":"bash","arguments":{"command":"find /Users/dhruv2mars/dev/github/parameter-golf/experiments/kaggle_results/pg-auto-ar-ttt-enabled-20260426-44230 -type f 2>/dev/null"}}],"api":"anthropic-messages","provider":"minimax","model":"MiniMax-M2.7","usage":{"input":125,"output":75,"cacheRead":43008,"cacheWrite":0,"totalTokens":43208,"cost":{"input":0.0000375,"output":0.00008999999999999999,"cacheRead":0.0025804799999999996,"cacheWrite":0,"total":0.0027079799999999996}},"stopReason":"toolUse","timestamp":1777146443304,"responseId":"063c4d4bbcea8515cf259e97e2e235db"}}
{"type":"message","id":"022ecea3","parentId":"64f795f4","timestamp":"2026-04-25T19:47:25.112Z","message":{"role":"toolResult","toolCallId":"call_function_urtv2pyurdnu_1","toolName":"bash","content":[{"type":"text","text":"/Users/dhruv2mars/dev/github/parameter-golf/experiments/kaggle_results/pg-auto-ar-ttt-enabled-20260426-44230/checkpoints/ar-ttt-enabled-20260426/ckpt_step_900.pt\n/Users/dhruv2mars/dev/github/parameter-golf/experiments/kaggle_results/pg-auto-ar-ttt-enabled-20260426-44230/checkpoints/ar-ttt-enabled-20260426/ckpt_step_850.pt\n/Users/dhruv2mars/dev/github/parameter-golf/experiments/kaggle_results/pg-auto-ar-ttt-enabled-20260426-44230/checkpoints/ar-ttt-enabled-20260426/ckpt_step_950.pt\n/Users/dhruv2mars/dev/github/parameter-golf/experiments/kaggle_results/pg-auto-ar-ttt-enabled-20260426-44230/checkpoints/ar-ttt-enabled-20260426/best_model.pt\n/Users/dhruv2mars/dev/github/parameter-golf/experiments/kaggle_results/pg-auto-ar-ttt-enabled-20260426-44230/checkpoints/ar-ttt-enabled-20260426/best_model.int8.br\n/Users/dhruv2mars/dev/github/parameter-golf/experiments/kaggle_results/pg-auto-ar-ttt-enabled-20260426-44230/logs/ar-ttt-enabled-20260426.rank0.txt\n/Users/dhruv2mars/dev/github/parameter-golf/experiments/kaggle_results/pg-auto-ar-ttt-enabled-20260426-44230/logs/ar-ttt-enabled-20260426.rank1.txt\n/Users/dhruv2mars/dev/github/parameter-golf/experiments/kaggle_results/pg-auto-ar-ttt-enabled-20260426-44230/pg-auto-ar-ttt-enabled-20260426-44230.log\n"}],"isError":false,"timestamp":1777146445112}}
{"type":"message","id":"af486de0","parentId":"022ecea3","timestamp":"2026-04-25T19:47:27.297Z","message":{"role":"assistant","content":[{"type":"thinking","thinking":"Let me read the log to find the exact TTT error.","thinkingSignature":"0502547f2e293054cff66950f4347905c5cacbfb0989d9ee0aecf9fb4a508807"},{"type":"toolCall","id":"call_function_uua8b3rq4zc1_1","name":"bash","arguments":{"command":"cat /Users/dhruv2mars/dev/github/parameter-golf/experiments/kaggle_results/pg-auto-ar-ttt-enabled-20260426-44230/pg-auto-ar-ttt-enabled-20260426-44230.log 2>/dev/null | tail -100"}}],"api":"anthropic-messages","provider":"minimax","model":"MiniMax-M2.7","usage":{"input":501,"output":95,"cacheRead":43104,"cacheWrite":0,"totalTokens":43700,"cost":{"input":0.0001503,"output":0.00011399999999999999,"cacheRead":0.0025862399999999996,"cacheWrite":0,"total":0.0028505399999999995}},"stopReason":"toolUse","timestamp":1777146445113,"responseId":"063c4d4d63866f9c42fc0b6122bd11ab"}}
