{"type":"message","id":"90279d49","parentId":"c0e626b3","timestamp":"2026-04-27T11:21:08.359Z","message":{"role":"toolResult","toolCallId":"call_function_ktlosniuuvu2_1","toolName":"bash","content":[{"type":"text","text":"/bin/bash: -c: line 0: unexpected EOF while looking for matching ``'\n/bin/bash: -c: line 1: syntax error: unexpected end of file\n\n\nCommand exited with code 2"}],"details":{},"isError":true,"timestamp":1777288868359}}
{"type":"message","id":"3a128b2c","parentId":"90279d49","timestamp":"2026-04-27T11:21:12.246Z","message":{"role":"assistant","content":[{"type":"thinking","thinking":"Backtick is being interpreted by bash. Let me escape it.","thinkingSignature":"9454461c3ed112117caa20bf28456e13bbf86f6c9aea03c06adc04e365c0f3da"},{"type":"toolCall","id":"call_function_y3gqjncrdxqy_1","name":"bash","arguments":{"command":"agent-browser press 'Control+`' 2>&1"}}],"api":"anthropic-messages","provider":"minimax","model":"MiniMax-M2.7","usage":{"input":49110,"output":49,"cacheRead":9348,"cacheWrite":0,"totalTokens":58507,"cost":{"input":0.014733,"output":0.0000588,"cacheRead":0.0005608799999999999,"cacheWrite":0,"total":0.015352679999999999}},"stopReason":"toolUse","timestamp":1777288868365,"responseId":"063e79a4aa3199713889bb613d81ef1d"}}
{"type":"message","id":"c65c73ac","parentId":"3a128b2c","timestamp":"2026-04-27T11:21:12.505Z","message":{"role":"toolResult","toolCallId":"call_function_y3gqjncrdxqy_1","toolName":"bash","content":[{"type":"text","text":"✓ Done\n"}],"isError":false,"timestamp":1777288872505}}
{"type":"message","id":"c92b1fbb","parentId":"c65c73ac","timestamp":"2026-04-27T11:21:15.825Z","message":{"role":"assistant","content":[{"type":"thinking","thinking":"Good! Let me take a screenshot to see if the terminal opened.","thinkingSignature":"87b136c29376e63f487355285aa08b36941d5b634b9a8d56f1a17d478d9c4987"},{"type":"toolCall","id":"call_function_o81rmjh8e8a0_1","name":"bash","arguments":{"command":"agent-browser screenshot 2>&1"}}],"api":"anthropic-messages","provider":"minimax","model":"MiniMax-M2.7","usage":{"input":49177,"output":46,"cacheRead":9348,"cacheWrite":0,"totalTokens":58571,"cost":{"input":0.0147531,"output":0.0000552,"cacheRead":0.0005608799999999999,"cacheWrite":0,"total":0.01536918}},"stopReason":"toolUse","timestamp":1777288872543,"responseId":"063e79a8df7c2d1f64ffbce3ea62fa35"}}
{"type":"message","id":"acbefbce","parentId":"c92b1fbb","timestamp":"2026-04-27T11:21:16.137Z","message":{"role":"toolResult","toolCallId":"call_function_o81rmjh8e8a0_1","toolName":"bash","content":[{"type":"text","text":"✓ Screenshot saved to /Users/dhruv2mars/.agent-browser/tmp/screenshots/screenshot-1777288876128.png\n"}],"isError":false,"timestamp":1777288876137}}
{"type":"message","id":"f47b1db2","parentId":"acbefbce","timestamp":"2026-04-27T11:21:19.646Z","message":{"role":"assistant","content":[{"type":"thinking","thinking":"Let me see the result.","thinkingSignature":"2e3a26af10482055d587db1903a4da4615a9c9f91cc9da4f13a8fda07ee9d3fb"},{"type":"toolCall","id":"call_function_28hbxftq3cf0_1","name":"understand_image","arguments":{"prompt":"Is there a terminal open now? What is visible?","image_url":"/Users/dhruv2mars/.agent-browser/tmp/screenshots/screenshot-1777288876128.png"}}],"api":"anthropic-messages","provider":"minimax","model":"MiniMax-M2.7","usage":{"input":49266,"output":74,"cacheRead":9348,"cacheWrite":0,"totalTokens":58688,"cost":{"input":0.0147798,"output":0.00008879999999999999,"cacheRead":0.0005608799999999999,"cacheWrite":0,"total":0.015429479999999999}},"stopReason":"toolUse","timestamp":1777288876141,"responseId":"063e79aca9e4ae5fdfca1f330e7f10f2"}}
{"type":"message","id":"bd293fc3","parentId":"f47b1db2","timestamp":"2026-04-27T11:21:29.090Z","message":{"role":"toolResult","toolCallId":"call_function_28hbxftq3cf0_1","toolName":"understand_image","content":[{"type":"text","text":"Yes, there is a terminal open at the bottom of the screen.\n\nIn the terminal, you can see that a script named **run_lightning.sh** was executed. The visible output provides configuration details for \"Parameter Golf – Lightning AI Training,\" including:\n\n*   **RUN_ID:** lightning-20260427-105032\n*   **START_TIME:** Mon Apr 27 10:50:32 UTC 2026\n*   **ITERATIONS:** 25000\n*   **MAX_TIME:** 14000s\n*   **EFFECTIVE_BATCH:** 8192 tokens\n*   **MODEL:** 11L x 512d x 8H / 4KV\n*   **SEQ_LEN:** 512\n*   **VOCAB_SIZE:** 1024\n*   **ROPE_DIMS:** 32\n*   **EMA_DECAY:** 0.994\n\nAt the bottom of the terminal, there is a new command prompt: `autoresearch/phase1-20260426 ~/parameter-golf`, with a cursor waiting for the next command."}],"details":{"server":"MiniMax","tool":"understand_image","structuredContent":{"type":"text","text":"Yes, there is a terminal open at the bottom of the screen.\n\nIn the terminal, you can see that a script named **run_lightning.sh** was executed. The visible output provides configuration details for \"Parameter Golf – Lightning AI Training,\" including:\n\n*   **RUN_ID:** lightning-20260427-105032\n*   **START_TIME:** Mon Apr 27 10:50:32 UTC 2026\n*   **ITERATIONS:** 25000\n*   **MAX_TIME:** 14000s\n*   **EFFECTIVE_BATCH:** 8192 tokens\n*   **MODEL:** 11L x 512d x 8H / 4KV\n*   **SEQ_LEN:** 512\n*   **VOCAB_SIZE:** 1024\n*   **ROPE_DIMS:** 32\n*   **EMA_DECAY:** 0.994\n\nAt the bottom of the terminal, there is a new command prompt: `autoresearch/phase1-20260426 ~/parameter-golf`, with a cursor waiting for the next command.","annotations":null,"_meta":null},"isError":false},"isError":false,"timestamp":1777288889090}}
{"type":"message","id":"05563d67","parentId":"bd293fc3","timestamp":"2026-04-27T11:21:38.360Z","message":{"role":"assistant","content":[{"type":"thinking","thinking":"There's already a training run happening! The terminal shows run_lightning.sh is executing. I can see it's running with the best config we found. Let me type commands to check the status and interact with it.\n\nLet me verify the current state and check the training progress.","thinkingSignature":"1b956d3af3e50b071ca852b94137ba2bdcc994d0fe67e57b7162058a9233c2a5"},{"type":"text","text":"Terminal is open and **training is already running!** I can see `run_lightning.sh` executing with our best config.\n\nLet me check status:\n"},{"type":"toolCall","id":"call_function_82p9fwtm2boo_1","name":"bash","arguments":{"command":"agent-browser type \"\" \"tail -5 ~/parameter-golf/logs/*.log 2>/dev/null || echo 'no logs yet'\" 2>&1"}}],"api":"anthropic-messages","provider":"minimax","model":"MiniMax-M2.7","usage":{"input":49580,"output":141,"cacheRead":9348,"cacheWrite":0,"totalTokens":59069,"cost":{"input":0.014874,"output":0.0001692,"cacheRead":0.0005608799999999999,"cacheWrite":0,"total":0.01560408}},"stopReason":"toolUse","timestamp":1777288889093,"responseId":"063e79bcac603da503e33099ba2f1ccb"}}
{"type":"message","id":"d535995d","parentId":"05563d67","timestamp":"2026-04-27T11:21:38.593Z","message":{"role":"toolResult","toolCallId":"call_function_82p9fwtm2boo_1","toolName":"bash","content":[{"type":"text","text":"✓ Done\n"}],"isError":false,"timestamp":1777288898593}}
{"type":"message","id":"b1162efb","parentId":"d535995d","timestamp":"2026-04-27T11:21:42.671Z","message":{"role":"assistant","content":[{"type":"thinking","thinking":"Let me execute it with Enter.","thinkingSignature":"ad4c1336c2746312cf00d4644d106564da4677680c608543321c7b8f06d8b814"},{"type":"toolCall","id":"call_function_w41dlncdd0wp_1","name":"bash","arguments":{"command":"agent-browser press Enter 2>&1"}}],"api":"anthropic-messages","provider":"minimax","model":"MiniMax-M2.7","usage":{"input":49739,"output":40,"cacheRead":9348,"cacheWrite":0,"totalTokens":59127,"cost":{"input":0.0149217,"output":0.000048,"cacheRead":0.0005608799999999999,"cacheWrite":0,"total":0.015530579999999999}},"stopReason":"toolUse","timestamp":1777288898596,"responseId":"063e79c3b6148b381e45c4c7ae89de42"}}
{"type":"message","id":"81ae3005","parentId":"b1162efb","timestamp":"2026-04-27T11:21:42.878Z","message":{"role":"toolResult","toolCallId":"call_function_w41dlncdd0wp_1","toolName":"bash","content":[{"type":"text","text":"✓ Done\n"}],"isError":false,"timestamp":1777288902878}}
{"type":"message","id":"b5a52bfd","parentId":"81ae3005","timestamp":"2026-04-27T11:21:46.747Z","message":{"role":"assistant","content":[{"type":"thinking","thinking":"Let me wait and take a screenshot to see the result.","thinkingSignature":"28bc51713f59daf4fb60fac4452d2b48e8f114d8eeca68e1c888e57c71818d86"},{"type":"toolCall","id":"call_function_u4o5zvcfnwbj_1","name":"bash","arguments":{"command":"sleep 2 && agent-browser screenshot 2>&1"}}],"api":"anthropic-messages","provider":"minimax","model":"MiniMax-M2.7","usage":{"input":49797,"output":48,"cacheRead":9348,"cacheWrite":0,"totalTokens":59193,"cost":{"input":0.014939099999999999,"output":0.0000576,"cacheRead":0.0005608799999999999,"cacheWrite":0,"total":0.015557579999999998}},"stopReason":"toolUse","timestamp":1777288902881,"responseId":"063e79c77e45722441253df3b84b4c47"}}
{"type":"message","id":"fffef1be","parentId":"b5a52bfd","timestamp":"2026-04-27T11:21:49.092Z","message":{"role":"toolResult","toolCallId":"call_function_u4o5zvcfnwbj_1","toolName":"bash","content":[{"type":"text","text":"✓ Screenshot saved to /Users/dhruv2mars/.agent-browser/tmp/screenshots/screenshot-1777288909083.png\n"}],"isError":false,"timestamp":1777288909092}}
{"type":"message","id":"cc735f86","parentId":"fffef1be","timestamp":"2026-04-27T11:21:52.951Z","message":{"role":"assistant","content":[{"type":"thinking","thinking":"Let me see what's on screen.","thinkingSignature":"67a5ea24d6dc364056125b12a7ffe13fbe0e906d938a4cb4b9346e7e0ee3cff5"},{"type":"toolCall","id":"call_function_83b0ncqblmwi_1","name":"understand_image","arguments":{"prompt":"What does the terminal show? Any output?","image_url":"/Users/dhruv2mars/.agent-browser/tmp/screenshots/screenshot-1777288909083.png"}}],"api":"anthropic-messages","provider":"minimax","model":"MiniMax-M2.7","usage":{"input":49888,"output":73,"cacheRead":9348,"cacheWrite":0,"totalTokens":59309,"cost":{"input":0.0149664,"output":0.0000876,"cacheRead":0.0005608799999999999,"cacheWrite":0,"total":0.01561488}},"stopReason":"toolUse","timestamp":1777288909097,"responseId":"063e79cd00d05d4d016c590812200780"}}
{"type":"message","id":"2cb2ae8c","parentId":"cc735f86","timestamp":"2026-04-27T11:22:01.812Z","message":{"role":"toolResult","toolCallId":"call_function_83b0ncqblmwi_1","toolName":"understand_image","content":[{"type":"text","text":"The terminal shows that a training script called `run_lightning.sh` was executed for a project titled **\"Parameter Golf - Lightning AI Training.\"**\n\nThe output details various configuration parameters for a run (ID: `lightning-20260427-105032`), including:\n*   **Start Time:** Mon Apr 27 10:50:32 UTC 2026\n*   **Iterations:** 25,000\n*   **Model Architecture:** 11 layers, 512 dimension, 8 heads / 4KV\n*   **Hyperparameters:** Sequence length of 512, vocabulary size of 1024, and an EMA decay of 0.994.\n\nFollowing this, a `tail` command was run to check log files, which repeated some of the final configuration parameters. The terminal is currently idle at a command prompt within the `~/parameter-golf` directory."}],"details":{"server":"MiniMax","tool":"understand_image","structuredContent":{"type":"text","text":"The terminal shows that a training script called `run_lightning.sh` was executed for a project titled **\"Parameter Golf - Lightning AI Training.\"**\n\nThe output details various configuration parameters for a run (ID: `lightning-20260427-105032`), including:\n*   **Start Time:** Mon Apr 27 10:50:32 UTC 2026\n*   **Iterations:** 25,000\n*   **Model Architecture:** 11 layers, 512 dimension, 8 heads / 4KV\n*   **Hyperparameters:** Sequence length of 512, vocabulary size of 1024, and an EMA decay of 0.994.\n\nFollowing this, a `tail` command was run to check log files, which repeated some of the final configuration parameters. The terminal is currently idle at a command prompt within the `~/parameter-golf` directory.","annotations":null,"_meta":null},"isError":false},"isError":false,"timestamp":1777288921812}}
{"type":"message","id":"f2ea2df6","parentId":"2cb2ae8c","timestamp":"2026-04-27T11:22:08.567Z","message":{"role":"assistant","content":[{"type":"thinking","thinking":"Training is running. Let me check the current val_bpb and see what's happening.","thinkingSignature":"0ab2419ef073391803d1f6dccf9ca0e946a55f0f570139129d78fbf340ecd952"},{"type":"toolCall","id":"call_function_ywb0tvdvojya_1","name":"bash","arguments":{"command":"agent-browser type \"\" \"tail -20 ~/parameter-golf/logs/*.log 2>/dev/null | grep -i bpb || ps aux | grep python | head -3\" 2>&1"}}],"api":"anthropic-messages","provider":"minimax","model":"MiniMax-M2.7","usage":{"input":50155,"output":84,"cacheRead":9348,"cacheWrite":0,"totalTokens":59587,"cost":{"input":0.015046499999999999,"output":0.0001008,"cacheRead":0.0005608799999999999,"cacheWrite":0,"total":0.01570818}},"stopReason":"toolUse","timestamp":1777288921819,"responseId":"063e79dcd2e976f8ff726a3543afc429"}}
{"type":"message","id":"ba797b7c","parentId":"f2ea2df6","timestamp":"2026-04-27T11:22:08.832Z","message":{"role":"toolResult","toolCallId":"call_function_ywb0tvdvojya_1","toolName":"bash","content":[{"type":"text","text":"✓ Done\n"}],"isError":false,"timestamp":1777288928832}}
{"type":"message","id":"3fe7646a","parentId":"ba797b7c","timestamp":"2026-04-27T11:22:11.817Z","message":{"role":"assistant","content":[{"type":"thinking","thinking":"Let me press Enter and wait for the output.","thinkingSignature":"197f2493cf3b461dc8591f5bf7554402060e55aca10d8306044c6357ce6228d7"},{"type":"toolCall","id":"call_function_32ul5bjlmws3_1","name":"bash","arguments":{"command":"agent-browser press Enter 2>&1 && sleep 3 && agent-browser screenshot 2>&1"}}],"api":"anthropic-messages","provider":"minimax","model":"MiniMax-M2.7","usage":{"input":50257,"output":55,"cacheRead":9348,"cacheWrite":0,"totalTokens":59660,"cost":{"input":0.0150771,"output":0.00006599999999999999,"cacheRead":0.0005608799999999999,"cacheWrite":0,"total":0.01570398}},"stopReason":"toolUse","timestamp":1777288928836,"responseId":"063e79e1707af34f0fbb26883c3aa1b9"}}
{"type":"message","id":"bb372070","parentId":"3fe7646a","timestamp":"2026-04-27T11:22:15.392Z","message":{"role":"toolResult","toolCallId":"call_function_32ul5bjlmws3_1","toolName":"bash","content":[{"type":"text","text":"✓ Done\n✓ Screenshot saved to /Users/dhruv2mars/.agent-browser/tmp/screenshots/screenshot-1777288935381.png\n"}],"isError":false,"timestamp":1777288935391}}
{"type":"message","id":"bb3066de","parentId":"bb372070","timestamp":"2026-04-27T11:22:18.777Z","message":{"role":"assistant","content":[{"type":"thinking","thinking":"Let me see the output.","thinkingSignature":"428cf233543f06169b8f0feb8c93afd107b760ae86c43c810667cdc5f19ee5f7"},{"type":"toolCall","id":"call_function_kz2eb76y9kij_1","name":"understand_image","arguments":{"prompt":"What does the terminal show? Is training still running?","image_url":"/Users/dhruv2mars/.agent-browser/tmp/screenshots/screenshot-1777288935381.png"}}],"api":"anthropic-messages","provider":"minimax","model":"MiniMax-M2.7","usage":{"input":50358,"output":74,"cacheRead":9348,"cacheWrite":0,"totalTokens":59780,"cost":{"input":0.0151074,"output":0.00008879999999999999,"cacheRead":0.0005608799999999999,"cacheWrite":0,"total":0.01575708}},"stopReason":"toolUse","timestamp":1777288935396,"responseId":"063e79e79a84688d5c9ea108d99a8e49"}}
{"type":"message","id":"26270c29","parentId":"bb3066de","timestamp":"2026-04-27T11:22:29.585Z","message":{"role":"toolResult","toolCallId":"call_function_kz2eb76y9kij_1","toolName":"understand_image","content":[{"type":"text","text":"Based on the terminal output in the image:\n\n**What the terminal shows:**\n*   It shows the start of a training process called **\"Parameter Golf - Lightning AI Training\"** initiated by running a script named `run_lightning.sh`.\n*   It displays configuration parameters for the run, such as the `RUN_ID`, `ITERATIONS` (25,000), `MAX_TIME` (14,000s), and model specifications.\n*   Following the initial setup, a manual command was entered: `tail -5 ~/parameter-golf/logs/*.log...`. This command was used to check the last few lines of the log files, which output some basic configuration values (`VOCAB_SIZE`, `ROPE_DIMS`, etc.).\n\n**Is training still running?**\n*   **No, it does not appear to be running in the foreground of this terminal.** \n*   A command prompt (`autoresearch/phase1-20260426 ~/parameter-golf |`) is currently visible at the bottom. This indicates that the previous commands have finished executing and the terminal is waiting for new input. \n*   If training were actively running and logging to this window, you would see moving progress bars or updated loss/metric values instead of a fresh prompt. It is possible the training process was sent to the background or it finished/errored out very quickly."}],"details":{"server":"MiniMax","tool":"understand_image","structuredContent":{"type":"text","text":"Based on the terminal output in the image:\n\n**What the terminal shows:**\n*   It shows the start of a training process called **\"Parameter Golf - Lightning AI Training\"** initiated by running a script named `run_lightning.sh`.\n*   It displays configuration parameters for the run, such as the `RUN_ID`, `ITERATIONS` (25,000), `MAX_TIME` (14,000s), and model specifications.\n*   Following the initial setup, a manual command was entered: `tail -5 ~/parameter-golf/logs/*.log...`. This command was used to check the last few lines of the log files, which output some basic configuration values (`VOCAB_SIZE`, `ROPE_DIMS`, etc.).\n\n**Is training still running?**\n*   **No, it does not appear to be running in the foreground of this terminal.** \n*   A command prompt (`autoresearch/phase1-20260426 ~/parameter-golf |`) is currently visible at the bottom. This indicates that the previous commands have finished executing and the terminal is waiting for new input. \n*   If training were actively running and logging to this window, you would see moving progress bars or updated loss/metric values instead of a fresh prompt. It is possible the training process was sent to the background or it finished/errored out very quickly.","annotations":null,"_meta":null},"isError":false},"isError":false,"timestamp":1777288949585}}
{"type":"message","id":"f7d6949c","parentId":"26270c29","timestamp":"2026-04-27T11:22:36.509Z","message":{"role":"assistant","content":[{"type":"thinking","thinking":"Let me check if the training process is still running in the background.","thinkingSignature":"bfbe98183e6c28693634ab1df6f88861c27eee00042fa7297c7b458b52ff3362"},{"type":"toolCall","id":"call_function_t7agkaoxaiz9_1","name":"bash","arguments":{"command":"agent-browser type \"\" \"ps aux | grep -E 'python|torch' | grep -v grep | head -5\" 2>&1 && agent-browser press Enter 2>&1 && sleep 2 && agent-browser screenshot 2>&1"}}],"api":"anthropic-messages","provider":"minimax","model":"MiniMax-M2.7","usage":{"input":50723,"output":90,"cacheRead":9348,"cacheWrite":0,"totalTokens":60161,"cost":{"input":0.015216899999999998,"output":0.000108,"cacheRead":0.0005608799999999999,"cacheWrite":0,"total":0.01588578}},"stopReason":"toolUse","timestamp":1777288949592,"responseId":"063e79f83166a52dc80e54540d271da0"}}
{"type":"message","id":"111bfc23","parentId":"f7d6949c","timestamp":"2026-04-27T11:22:39.294Z","message":{"role":"toolResult","toolCallId":"call_function_t7agkaoxaiz9_1","toolName":"bash","content":[{"type":"text","text":"✓ Done\n✓ Done\n✓ Screenshot saved to /Users/dhruv2mars/.agent-browser/tmp/screenshots/screenshot-1777288959284.png\n"}],"isError":false,"timestamp":1777288959294}}
{"type":"message","id":"cd34cc5e","parentId":"111bfc23","timestamp":"2026-04-27T11:22:43.485Z","message":{"role":"assistant","content":[{"type":"thinking","thinking":"Let me see the result.","thinkingSignature":"2e3a26af10482055d587db1903a4da4615a9c9f91cc9da4f13a8fda07ee9d3fb"},{"type":"toolCall","id":"call_function_akzudkfnljd0_1","name":"understand_image","arguments":{"prompt":"What processes are running? Is training still active?","image_url":"/Users/dhruv2mars/.agent-browser/tmp/screenshots/screenshot-1777288959284.png"}}],"api":"anthropic-messages","provider":"minimax","model":"MiniMax-M2.7","usage":{"input":50862,"output":73,"cacheRead":9348,"cacheWrite":0,"totalTokens":60283,"cost":{"input":0.015258599999999999,"output":0.0000876,"cacheRead":0.0005608799999999999,"cacheWrite":0,"total":0.01590708}},"stopReason":"toolUse","timestamp":1777288959297,"responseId":"063e79ffa4e20b08b1df30ad5ddc8eb4"}}
