{"type":"message","id":"8fcf2c19","parentId":"e1f28931","timestamp":"2026-04-27T11:53:07.669Z","message":{"role":"toolResult","toolCallId":"call_function_q9g9q1o3kd3e_1","toolName":"bash","content":[{"type":"text","text":"Installing deps...\n\n"}],"isError":false,"timestamp":1777290787669}}
{"type":"message","id":"85df4db3","parentId":"8fcf2c19","timestamp":"2026-04-27T11:53:16.145Z","message":{"role":"assistant","content":[{"type":"thinking","thinking":"It seems to have installed. Let me now run the training test again.","thinkingSignature":"8fbbf331ef255342f8785e727e5d242405252549a0019e77527360605ceb7c89"},{"type":"toolCall","id":"call_function_mhabi43q6izq_1","name":"bash","arguments":{"command":"source ~/.venv/pg/bin/activate && python -c \"\nfrom lightning_sdk import Studio, Teamspace\nimport os\n\nos.environ['LIGHTNING_USER_ID'] = 'd52587bc-ec3c-4c9c-a2fa-71246e3d4020'\nos.environ['LIGHTNING_API_KEY'] = '25da12f4-1ad8-4e3f-8ba4-2a60fcebaabe'\n\nts = Teamspace(name='default-project', user='dhruv2mars')\nstudio = Studio(name='parameter-golf', teamspace=ts)\n\n# Run 1-min training test\ncmd = 'cd /teamspace/studios/this_studio/parameter-golf && ITERATIONS=50 MAX_WALLCLOCK=60 python3 train_kaggle.py 2>&1'\nprint('Running 1-min training test...')\nresult = studio.run(cmd)\nprint('Output:')\nprint(result)\n\" 2>&1","timeout_seconds":"120"}}],"api":"anthropic-messages","provider":"minimax","model":"MiniMax-M2.7","usage":{"input":81324,"output":256,"cacheRead":9348,"cacheWrite":0,"totalTokens":90928,"cost":{"input":0.024397199999999997,"output":0.0003072,"cacheRead":0.0005608799999999999,"cacheWrite":0,"total":0.025265279999999998}},"stopReason":"toolUse","timestamp":1777290787673,"responseId":"063e8126c4dc0f8e42c7387aa24efaad"}}
{"type":"message","id":"b6be3084","parentId":"85df4db3","timestamp":"2026-04-27T11:53:27.121Z","message":{"role":"toolResult","toolCallId":"call_function_mhabi43q6izq_1","toolName":"bash","content":[{"type":"text","text":"Traceback (most recent call last):\n  File \"<string>\", line 14, in <module>\n    result = studio.run(cmd)\n  File \"/Users/dhruv2mars/.venv/pg/lib/python3.14/site-packages/lightning_sdk/utils/logging.py\", line 37, in wrapper\n    return func(*args, **kwargs)\n  File \"/Users/dhruv2mars/.venv/pg/lib/python3.14/site-packages/lightning_sdk/studio.py\", line 578, in run\n    raise RuntimeError(output)\nRuntimeError: Traceback (most recent call last):\n  File \"/teamspace/studios/this_studio/parameter-golf/train_kaggle.py\", line 1045, in <module>\n    train()\n  File \"/teamspace/studios/this_studio/parameter-golf/train_kaggle.py\", line 673, in train\n    raise RuntimeError(\"CUDA required for training\")\nRuntimeError: CUDA required for training\nRunning 1-min training test...\n\n\nCommand exited with code 1"}],"details":{},"isError":true,"timestamp":1777290807121}}
{"type":"message","id":"d0b0820b","parentId":"b6be3084","timestamp":"2026-04-27T11:53:36.011Z","message":{"role":"assistant","content":[{"type":"thinking","thinking":"CUDA not available - need GPU. Let me check what the run script does to properly launch GPU training.","thinkingSignature":"7394183a3fe5bba8dc961625dfd9f2e04cc264cff204ffaf64f2259e303e4d04"},{"type":"text","text":"Need GPU. Let me use the run_lightning.sh script:\n"},{"type":"toolCall","id":"call_function_qpth7mugi9fu_1","name":"bash","arguments":{"command":"source ~/.venv/pg/bin/activate && python -c \"\nfrom lightning_sdk import Studio, Teamspace\nimport os\n\nos.environ['LIGHTNING_USER_ID'] = 'd52587bc-ec3c-4c9c-a2fa-71246e3d4020'\nos.environ['LIGHTNING_API_KEY'] = '25da12f4-1ad8-4e3f-8ba4-2a60fcebaabe'\n\nts = Teamspace(name='default-project', user='dhruv2mars')\nstudio = Studio(name='parameter-golf', teamspace=ts)\n\n# Check GPU availability\nresult = studio.run('nvidia-smi 2>&1 | head -20')\nprint('GPU Info:')\nprint(result)\n\" 2>&1","timeout_seconds":"30"}}],"api":"anthropic-messages","provider":"minimax","model":"MiniMax-M2.7","usage":{"input":81815,"output":234,"cacheRead":9348,"cacheWrite":0,"totalTokens":91397,"cost":{"input":0.0245445,"output":0.0002808,"cacheRead":0.0005608799999999999,"cacheWrite":0,"total":0.02538618}},"stopReason":"toolUse","timestamp":1777290807125,"responseId":"063e813a3cb17c8a800c39e933a48e80"}}
{"type":"message","id":"f65343ee","parentId":"d0b0820b","timestamp":"2026-04-27T11:53:42.388Z","message":{"role":"toolResult","toolCallId":"call_function_qpth7mugi9fu_1","toolName":"bash","content":[{"type":"text","text":"GPU Info:\nzsh: command not found: nvidia-smi\n"}],"isError":false,"timestamp":1777290822388}}
{"type":"message","id":"35ea7e69","parentId":"f65343ee","timestamp":"2026-04-27T11:53:50.039Z","message":{"role":"assistant","content":[{"type":"thinking","thinking":"GPU command not found. Let me check if CUDA is available in PyTorch.","thinkingSignature":"aeeb9d3c9d036fa73c96d70ab601c8d92ecdbbffbd972637ddd949d57a25a980"},{"type":"toolCall","id":"call_function_b81tesb42nye_1","name":"bash","arguments":{"command":"source ~/.venv/pg/bin/activate && python -c \"\nfrom lightning_sdk import Studio, Teamspace\nimport os\n\nos.environ['LIGHTNING_USER_ID'] = 'd52587bc-ec3c-4c9c-a2fa-71246e3d4020'\nos.environ['LIGHTNING_API_KEY'] = '25da12f4-1ad8-4e3f-8ba4-2a60fcebaabe'\n\nts = Teamspace(name='default-project', user='dhruv2mars')\nstudio = Studio(name='parameter-golf', teamspace=ts)\n\n# Check PyTorch CUDA\nresult = studio.run('python -c \\\"import torch; print(torch.cuda.is_available(), torch.cuda.device_count())\\\"')\nprint('CUDA:', result)\n\" 2>&1","timeout_seconds":"30"}}],"api":"anthropic-messages","provider":"minimax","model":"MiniMax-M2.7","usage":{"input":82079,"output":222,"cacheRead":9348,"cacheWrite":0,"totalTokens":91649,"cost":{"input":0.0246237,"output":0.00026639999999999997,"cacheRead":0.0005608799999999999,"cacheWrite":0,"total":0.025450979999999998}},"stopReason":"toolUse","timestamp":1777290822392,"responseId":"063e8149b9c65d1121359aeb57e3e070"}}
{"type":"message","id":"c4901893","parentId":"35ea7e69","timestamp":"2026-04-27T11:54:00.404Z","message":{"role":"toolResult","toolCallId":"call_function_b81tesb42nye_1","toolName":"bash","content":[{"type":"text","text":"CUDA: False 0\n"}],"isError":false,"timestamp":1777290840404}}
{"type":"message","id":"a8336bdf","parentId":"c4901893","timestamp":"2026-04-27T11:54:09.269Z","message":{"role":"assistant","content":[{"type":"thinking","thinking":"CUDA is not available in the current Python environment. We need to use a different Python or environment that has CUDA. Let me check what environments are available.","thinkingSignature":"31eb5fc9086ac4ecc7c8d2a2705eef72e9c19b872ae577ca94a307d9fade5d6e"},{"type":"toolCall","id":"call_function_tog62fr97ekt_1","name":"bash","arguments":{"command":"source ~/.venv/pg/bin/activate && python -c \"\nfrom lightning_sdk import Studio, Teamspace\nimport os\n\nos.environ['LIGHTNING_USER_ID'] = 'd52587bc-ec3c-4c9c-a2fa-71246e3d4020'\nos.environ['LIGHTNING_API_KEY'] = '25da12f4-1ad8-4e3f-8ba4-2a60fcebaabe'\n\nts = Teamspace(name='default-project', user='dhruv2mars')\nstudio = Studio(name='parameter-golf', teamspace=ts)\n\n# Check available Python envs with CUDA\nresult = studio.run('which python && conda env list 2>/dev/null || ls /opt/conda/envs/ 2>/dev/null')\nprint('Envs:', result)\n\" 2>&1","timeout_seconds":"30"}}],"api":"anthropic-messages","provider":"minimax","model":"MiniMax-M2.7","usage":{"input":82323,"output":246,"cacheRead":9348,"cacheWrite":0,"totalTokens":91917,"cost":{"input":0.024696899999999997,"output":0.00029519999999999997,"cacheRead":0.0005608799999999999,"cacheWrite":0,"total":0.025552979999999996}},"stopReason":"toolUse","timestamp":1777290840408,"responseId":"063e815baba9bb78f842d3bf28676576"}}
{"type":"message","id":"77e34cda","parentId":"a8336bdf","timestamp":"2026-04-27T11:54:18.117Z","message":{"role":"toolResult","toolCallId":"call_function_tog62fr97ekt_1","toolName":"bash","content":[{"type":"text","text":"Envs: /home/zeus/miniconda3/envs/cloudspace/bin/python\n# conda environments:\n#\ncloudspace            *  /home/zeus/miniconda3/envs/cloudspace\n\nWarning: Conda environment management is not allowed. A Studio has a default conda environment (max 1 environment). Start a new Studio to create a new environment.\n\nWarning: To view the installed packages, did you mean to use `pip list` or `conda list`?\n"}],"isError":false,"timestamp":1777290858117}}
{"type":"message","id":"a921542b","parentId":"77e34cda","timestamp":"2026-04-27T11:54:26.675Z","message":{"role":"assistant","content":[{"type":"thinking","thinking":"The studio has a conda environment called \"cloudspace\" with CUDA. Let me use that.","thinkingSignature":"e02e5eff2994db3027a4800f79558078cafa2ddb574c11c9a2ca442e8610aa80"},{"type":"toolCall","id":"call_function_3mgrcb630dcl_1","name":"bash","arguments":{"command":"source ~/.venv/pg/bin/activate && python -c \"\nfrom lightning_sdk import Studio, Teamspace\nimport os\n\nos.environ['LIGHTNING_USER_ID'] = 'd52587bc-ec3c-4c9c-a2fa-71246e3d4020'\nos.environ['LIGHTNING_API_KEY'] = '25da12f4-1ad8-4e3f-8ba4-2a60fcebaabe'\n\nts = Teamspace(name='default-project', user='dhruv2mars')\nstudio = Studio(name='parameter-golf', teamspace=ts)\n\n# Check CUDA in cloudspace env\nresult = studio.run('/opt/conda/envs/cloudspace/bin/python -c \\\"import torch; print(torch.cuda.is_available(), torch.cuda.device_count())\\\"')\nprint('CUDA:', result)\n\" 2>&1","timeout_seconds":"30"}}],"api":"anthropic-messages","provider":"minimax","model":"MiniMax-M2.7","usage":{"input":82683,"output":235,"cacheRead":9348,"cacheWrite":0,"totalTokens":92266,"cost":{"input":0.024804899999999998,"output":0.00028199999999999997,"cacheRead":0.0005608799999999999,"cacheWrite":0,"total":0.02564778}},"stopReason":"toolUse","timestamp":1777290858121,"responseId":"063e816c6bb151724212fd054e62094e"}}
{"type":"message","id":"5f42e136","parentId":"a921542b","timestamp":"2026-04-27T11:54:33.549Z","message":{"role":"toolResult","toolCallId":"call_function_3mgrcb630dcl_1","toolName":"bash","content":[{"type":"text","text":"Traceback (most recent call last):\n  File \"<string>\", line 12, in <module>\n    result = studio.run('/opt/conda/envs/cloudspace/bin/python -c \"import torch; print(torch.cuda.is_available(), torch.cuda.device_count())\"')\n  File \"/Users/dhruv2mars/.venv/pg/lib/python3.14/site-packages/lightning_sdk/utils/logging.py\", line 37, in wrapper\n    return func(*args, **kwargs)\n  File \"/Users/dhruv2mars/.venv/pg/lib/python3.14/site-packages/lightning_sdk/studio.py\", line 578, in run\n    raise RuntimeError(output)\nRuntimeError: (eval):1: no such file or directory: /opt/conda/envs/cloudspace/bin/python\n\n\nCommand aborted"}],"details":{},"isError":true,"timestamp":1777290873549}}
{"type":"message","id":"f6e09461","parentId":"5f42e136","timestamp":"2026-04-27T11:54:33.555Z","message":{"role":"assistant","content":[],"api":"anthropic-messages","provider":"minimax","model":"MiniMax-M2.7","usage":{"input":0,"output":0,"cacheRead":0,"cacheWrite":0,"totalTokens":0,"cost":{"input":0,"output":0,"cacheRead":0,"cacheWrite":0,"total":0}},"stopReason":"aborted","timestamp":1777290873553,"errorMessage":"Operation aborted"}}
{"type":"message","id":"3b50281e","parentId":"f6e09461","timestamp":"2026-04-27T12:10:03.001Z","message":{"role":"user","content":[{"type":"text","text":"continue. make sure our setup with cli is perfect and everything is working perfectly fine. also note that dont keep the GPU running continuesly if you dont need it, it cuts my usage quota"}],"timestamp":1777291802962}}
{"type":"message","id":"83fe24c3","parentId":"3b50281e","timestamp":"2026-04-27T12:10:35.721Z","message":{"role":"assistant","content":[{"type":"thinking","thinking":"Let me continue with the setup. The GPU is in a cloudspace environment but CUDA isn't available in the default Python. I need to find the right Python environment with CUDA support.\n","thinkingSignature":"33faf91e04f9df4dfd2a694c19e106c9e16656bdb6f9f81fc739329cd7bd12d8"},{"type":"toolCall","id":"call_function_5a3er440rvde_1","name":"bash","arguments":{"command":"source ~/.venv/pg/bin/activate && python -c \"\nfrom lightning_sdk import Studio, Teamspace\nimport os\n\nos.environ['LIGHTNING_USER_ID'] = 'd52587bc-ec3c-4c9c-a2fa-71246e3d4020'\nos.environ['LIGHTNING_API_KEY'] = '25da12f4-1ad8-4e3f-8ba4-2a60fcebaabe'\n\nts = Teamspace(name='default-project', user='dhruv2mars')\nstudio = Studio(name='parameter-golf', teamspace=ts)\n\n# Check Python with CUDA\nresult = studio.run('source ~/.bashrc 2>/dev/null; which python3; python3 -c \\\"import torch; print(torch.cuda.is_available())\\\"')\nprint('Result:', result)\n\" 2>&1","timeout_seconds":"30"}}],"api":"anthropic-messages","provider":"minimax","model":"MiniMax-M2.7","usage":{"input":91158,"output":250,"cacheRead":0,"cacheWrite":0,"totalTokens":91408,"cost":{"input":0.027347399999999997,"output":0.0003,"cacheRead":0,"cacheWrite":0,"total":0.0276474}},"stopReason":"toolUse","timestamp":1777291803003,"responseId":"063e852173d234bf18af7800d50a2bbd"}}
{"type":"message","id":"07ecdba8","parentId":"83fe24c3","timestamp":"2026-04-27T12:10:40.076Z","message":{"role":"toolResult","toolCallId":"call_function_5a3er440rvde_1","toolName":"bash","content":[{"type":"text","text":"Traceback (most recent call last):\n  File \"<string>\", line 12, in <module>\n    result = studio.run('source ~/.bashrc 2>/dev/null; which python3; python3 -c \"import torch; print(torch.cuda.is_available())\"')\n  File \"/Users/dhruv2mars/.venv/pg/lib/python3.14/site-packages/lightning_sdk/utils/logging.py\", line 37, in wrapper\n    return func(*args, **kwargs)\n  File \"/Users/dhruv2mars/.venv/pg/lib/python3.14/site-packages/lightning_sdk/studio.py\", line 576, in run\n    output, exit_code = self.run_with_exit_code(*commands)\n                        ~~~~~~~~~~~~~~~~~~~~~~~^^^^^^^^^^^\n  File \"/Users/dhruv2mars/.venv/pg/lib/python3.14/site-packages/lightning_sdk/utils/logging.py\", line 37, in wrapper\n    return func(*args, **kwargs)\n  File \"/Users/dhruv2mars/.venv/pg/lib/python3.14/site-packages/lightning_sdk/studio.py\", line 557, in run_with_exit_code\n    raise RuntimeError(\n    ...<2 lines>...\n    )\nRuntimeError: Cannot run a command in a Studio that is not running. Studio parameter-golf is Stopped.\n\n\nCommand exited with code 1"}],"details":{},"isError":true,"timestamp":1777291840076}}
{"type":"message","id":"a5e58978","parentId":"07ecdba8","timestamp":"2026-04-27T12:10:49.135Z","message":{"role":"assistant","content":[{"type":"thinking","thinking":"The studio stopped! Let me restart it.\n","thinkingSignature":"ccf6d7774354ea62b1118d92d0c2e872622c68e7e6664712f20823d2142590f4"},{"type":"toolCall","id":"call_function_izdwpno6k8bo_1","name":"bash","arguments":{"command":"source ~/.venv/pg/bin/activate && python -c \"\nfrom lightning_sdk import Studio, Teamspace\nimport os\n\nos.environ['LIGHTNING_USER_ID'] = 'd52587bc-ec3c-4c9c-a2fa-71246e3d4020'\nos.environ['LIGHTNING_API_KEY'] = '25da12f4-1ad8-4e3f-8ba4-2a60fcebaabe'\n\nts = Teamspace(name='default-project', user='dhruv2mars')\nstudio = Studio(name='parameter-golf', teamspace=ts)\nprint('Status:', studio.status)\n\n# Stop if running, then restart\nif studio.status != 'Stopped':\n    print('Stopping studio...')\n    studio.stop()\n    \nprint('Starting studio...')\nstudio.start()\nprint('Status:', studio.status)\n\" 2>&1","timeout_seconds":"60"}}],"api":"anthropic-messages","provider":"minimax","model":"MiniMax-M2.7","usage":{"input":534,"output":225,"cacheRead":91136,"cacheWrite":0,"totalTokens":91895,"cost":{"input":0.0001602,"output":0.00027,"cacheRead":0.00546816,"cacheWrite":0,"total":0.00589836}},"stopReason":"toolUse","timestamp":1777291840080,"responseId":"063e8542ef8687f3b84d9e91d87516b4"}}
{"type":"message","id":"f6eb3c6d","parentId":"a5e58978","timestamp":"2026-04-27T12:10:53.157Z","message":{"role":"toolResult","toolCallId":"call_function_izdwpno6k8bo_1","toolName":"bash","content":[{"type":"text","text":"Traceback (most recent call last):\n  File \"<string>\", line 15, in <module>\n    studio.stop()\n    ~~~~~~~~~~~^^\n  File \"/Users/dhruv2mars/.venv/pg/lib/python3.14/site-packages/lightning_sdk/utils/logging.py\", line 37, in wrapper\n    return func(*args, **kwargs)\n  File \"/Users/dhruv2mars/.venv/pg/lib/python3.14/site-packages/lightning_sdk/studio.py\", line 404, in stop\n    raise RuntimeError(f\"Cannot stop a studio that is not running. Studio {self.name} is {status}.\")\nRuntimeError: Cannot stop a studio that is not running. Studio parameter-golf is Stopped.\nStatus: Stopped\nStopping studio...\n\n\nCommand exited with code 1"}],"details":{},"isError":true,"timestamp":1777291853157}}
{"type":"message","id":"cc4becd8","parentId":"f6eb3c6d","timestamp":"2026-04-27T12:11:01.014Z","message":{"role":"assistant","content":[{"type":"thinking","thinking":"Studio is already stopped. Let me start it.\n","thinkingSignature":"5a915325b0746e720c886fa699dd76b5577f30f06b3c7919f1060423931f065b"},{"type":"toolCall","id":"call_function_dowo1wf3i0tp_1","name":"bash","arguments":{"command":"source ~/.venv/pg/bin/activate && python -c \"\nfrom lightning_sdk import Studio, Teamspace\nimport os\n\nos.environ['LIGHTNING_USER_ID'] = 'd52587bc-ec3c-4c9c-a2fa-71246e3d4020'\nos.environ['LIGHTNING_API_KEY'] = '25da12f4-1ad8-4e3f-8ba4-2a60fcebaabe'\n\nts = Teamspace(name='default-project', user='dhruv2mars')\nstudio = Studio(name='parameter-golf', teamspace=ts)\nprint('Starting studio...')\nstudio.start()\nprint('Status:', studio.status)\n\" 2>&1","timeout_seconds":"30"}}],"api":"anthropic-messages","provider":"minimax","model":"MiniMax-M2.7","usage":{"input":421,"output":192,"cacheRead":91648,"cacheWrite":0,"totalTokens":92261,"cost":{"input":0.0001263,"output":0.0002304,"cacheRead":0.005498879999999999,"cacheWrite":0,"total":0.005855579999999999}},"stopReason":"toolUse","timestamp":1777291853161,"responseId":"063e854f20b7538327669cefe5d952ab"}}
{"type":"message","id":"23b0a7e7","parentId":"cc4becd8","timestamp":"2026-04-27T12:11:52.091Z","message":{"role":"toolResult","toolCallId":"call_function_dowo1wf3i0tp_1","toolName":"bash","content":[{"type":"text","text":"Starting studio...\nStatus: Running\n"}],"isError":false,"timestamp":1777291912091}}
{"type":"message","id":"1e157af4","parentId":"23b0a7e7","timestamp":"2026-04-27T12:12:01.038Z","message":{"role":"assistant","content":[{"type":"thinking","thinking":"Good, studio is running. Let me check CUDA availability.\n","thinkingSignature":"18395c98b58ffdb298eefec4e3abb88ffb8f6fcc5deadbaae87e48317fdaed30"},{"type":"toolCall","id":"call_function_dxf6r999fxg7_1","name":"bash","arguments":{"command":"sleep 10 && source ~/.venv/pg/bin/activate && python -c \"\nfrom lightning_sdk import Studio, Teamspace\nimport os\n\nos.environ['LIGHTNING_USER_ID'] = 'd52587bc-ec3c-4c9c-a2fa-71246e3d4020'\nos.environ['LIGHTNING_API_KEY'] = '25da12f4-1ad8-4e3f-8ba4-2a60fcebaabe'\n\nts = Teamspace(name='default-project', user='dhruv2mars')\nstudio = Studio(name='parameter-golf', teamspace=ts)\n\n# Check CUDA\nresult = studio.run('python -c \\\"import torch; print(torch.cuda.is_available(), torch.cuda.device_count())\\\"')\nprint('CUDA:', result)\n\" 2>&1","timeout_seconds":"30"}}],"api":"anthropic-messages","provider":"minimax","model":"MiniMax-M2.7","usage":{"input":239,"output":219,"cacheRead":92032,"cacheWrite":0,"totalTokens":92490,"cost":{"input":0.0000717,"output":0.0002628,"cacheRead":0.00552192,"cacheWrite":0,"total":0.005856419999999999}},"stopReason":"toolUse","timestamp":1777291912095,"responseId":"063e858a9fd58ce9d2bdf0cd3df43d8d"}}
{"type":"message","id":"9e7012da","parentId":"1e157af4","timestamp":"2026-04-27T12:12:21.641Z","message":{"role":"toolResult","toolCallId":"call_function_dxf6r999fxg7_1","toolName":"bash","content":[{"type":"text","text":"CUDA: False 0\n"}],"isError":false,"timestamp":1777291941641}}
{"type":"message","id":"28b90bcf","parentId":"9e7012da","timestamp":"2026-04-27T12:12:41.062Z","message":{"role":"assistant","content":[{"type":"thinking","thinking":"CUDA is False. The cloudspace environment doesn't have CUDA. This is a Studio without GPU access - just a CPU cloud machine. For training with GPU, I need to use the Lightning AI's job system, not just running commands in the Studio.\n\nLet me check the `run_job` method - that's probably how you run GPU training on Lightning AI.\n","thinkingSignature":"dee090ecb7bf20f1885faca78e1d99ff2feddbe08fd66b4241c2fd77e92c21fb"},{"type":"toolCall","id":"call_function_cv1zui60tea9_1","name":"bash","arguments":{"command":"source ~/.venv/pg/bin/activate && python -c \"\nfrom lightning_sdk import Studio, Teamspace\nimport os\nimport inspect\n\nos.environ['LIGHTNING_USER_ID'] = 'd52587bc-ec3c-4c9c-a2fa-71246e3d4020'\nos.environ['LIGHTNING_API_KEY'] = '25da12f4-1ad8-4e3f-8ba4-2a60fcebaabe'\n\nts = Teamspace(name='default-project', user='dhruv2mars')\nstudio = Studio(name='parameter-golf', teamspace=ts)\n\n# Check machine info\nprint('Machine:', studio.machine)\nprint('Cloud account:', studio.cloud_account)\nprint('Cluster:', studio.cluster)\n\n# Check run_job signature\nprint('\\\\nrun_job signature:', inspect.signature(studio.run_job))\n\" 2>&1","timeout_seconds":"30"}}],"api":"anthropic-messages","provider":"minimax","model":"MiniMax-M2.7","usage":{"input":274,"output":292,"cacheRead":92224,"cacheWrite":0,"totalTokens":92790,"cost":{"input":0.00008219999999999999,"output":0.0003504,"cacheRead":0.00553344,"cacheWrite":0,"total":0.00596604}},"stopReason":"toolUse","timestamp":1777291941646,"responseId":"063e85ab67c24a88d5563f834dd0aff3"}}
