{"type":"message","id":"abf1b7c3","parentId":"240c49b8","timestamp":"2026-04-25T18:31:43.579Z","message":{"role":"toolResult","toolCallId":"call_function_7le4z8y38zm9_1","toolName":"read","content":[{"type":"text","text":"        \n        # Embedding layers: int8\n        if \"tok_emb\" in name or \"lm_head\" in name:\n            q, s = quantize_row(t, clip_std_mult=H.embed_clip_sigmas, bits=8)\n            quantized[name] = q\n            meta[name] = {\"bits\": 8, \"shape\": tuple(t.shape)}\n        \n        # Matrix weights: int6\n        elif t.ndim == 2:\n            q, s = quantize_row(t, clip_std_mult=H.matrix_clip_sigmas, bits=6)\n            packed, pad = pack_int6(q)\n            quantized[name] = packed\n            meta[name] = {\"bits\": 6, \"shape\": tuple(t.shape), \"pad\": pad}\n        \n        # Other: int8\n        else:\n            q, s = quantize_row(t, clip_std_mult=H.matrix_clip_sigmas, bits=8)\n            quantized[name] = q\n            meta[name] = {\"bits\": 8, \"shape\": tuple(t.shape)}\n        \n        scales[name] = s\n    \n    return {\"q\": quantized, \"s\": scales, \"meta\": meta}\n\n\n# ============================================================================\n# CHECKPOINTING\n# ============================================================================\n\ndef save_checkpoint(step, model, optimizer, ema_state, best_val_bpb, \n                    train_stream_pos, run_dir):\n    \"\"\"Save training checkpoint.\"\"\"\n    checkpoint = {\n        \"step\": step,\n        \"model\": model.state_dict() if hasattr(model, 'state_dict') else None,\n        \"optimizer\": optimizer.state_dict() if hasattr(optimizer, 'state_dict') else None,\n        \"ema_state\": ema_state,\n        \"best_val_bpb\": best_val_bpb,\n        \"train_stream_pos\": train_stream_pos,\n    }\n    \n    path = os.path.join(run_dir, f\"{_CHECKPOINT_PREFIX}{step}.pt\")\n    torch.save(checkpoint, path)\n    \n    # Clean old checkpoints (keep last 3)\n    ckpts = sorted(glob.glob(os.path.join(run_dir, f\"{_CHECKPOINT_PREFIX}*.pt\")))\n    for old in ckpts[:-3]:\n        os.remove(old)\n    \n    return path\n\n\ndef load_checkpoint(path, model, optimizer):\n    \"\"\"Load training checkpoint and return step + stream position.\"\"\"\n    ckpt = torch.load(path, map_location='cpu')\n    \n    if ckpt.get(\"model\") is not None:\n        model.load_state_dict(ckpt[\"model\"])\n    if ckpt.get(\"optimizer\") is not None and hasattr(optimizer, 'load_state_dict'):\n        optimizer.load_state_dict(ckpt[\"optimizer\"])\n    \n    return ckpt.get(\"step\", 0), ckpt.get(\"best_val_bpb\", float('inf')), \\\n           ckpt.get(\"train_stream_pos\", 0)\n\n\n# ============================================================================\n# TTT (TEST-TIME TRAINING)\n# ============================================================================\n\ndef run_ttt(model, val_tokens, base_bytes_lut, device, args, log_fn):\n    \"\"\"Run Test-Time Training for final BPB boost.\"\"\"\n    log_fn(\"[TTT] Starting Test-Time Training...\")\n    \n    model.eval()\n    ttt_opt = torch.optim.SGD(model.parameters(), lr=args.ttt_lr, momentum=0.9)\n    \n    tokens_used = 0\n    total_tokens = min(val_tokens.numel() - 1, args.ttt_warmup_tokens * args.ttt_epochs)\n    \n    for epoch in range(args.ttt_epochs):\n        indices = torch.randperm(val_tokens.numel() - 1)\n        \n        for start in range(0, len(indices), args.ttt_warmup_tokens):\n            chunk = indices[start:start + args.ttt_warmup_tokens]\n            \n            # Score first (legal requirement)\n            x = val_tokens[chunk].to(device).long()\n            y = val_tokens[chunk + 1].to(device).long()\n            \n            with torch.no_grad():\n                _ = model(x, y)\n            \n            # Then train\n            with torch.autocast(device_type=\"cuda\", dtype=torch.bfloat16):\n                loss = model(x, y)\n            \n            if not torch.isfinite(loss):\n                log_fn(f\"[TTT] Non-finite loss at epoch {epoch}, chunk {start}\")\n                continue\n            \n            ttt_opt.zero_grad()\n            loss.backward()\n            torch.nn.utils.clip_grad_norm_(model.parameters(), 1.0)\n            ttt_opt.step()\n            \n            tokens_used += x.numel()\n        \n        # Evaluate after each epoch\n        val_loss_sum = 0.0\n        val_token_count = 0\n        eval_limit = min(val_tokens.numel() - 1, args.val_max_tokens)\n        \n        with torch.no_grad():\n            for i in range(0, eval_limit, args.train_seq_len * 4):\n                x = val_tokens[i:i + args.train_seq_len * 4].to(device).long()\n                y = val_tokens[i + 1:i + 1 + args.train_seq_len * 4].to(device).long()\n                with torch.autocast(device_type=\"cuda\", dtype=torch.bfloat16):\n                    loss = model(x, y)\n                val_loss_sum += loss.item() * x.numel()\n                val_token_count += x.numel()\n        \n        ttt_val_bpb = compute_val_bpb(\n            val_loss_sum / val_token_count, val_tokens[:val_token_count],\n            base_bytes_lut, device\n        )\n        log_fn(f\"[TTT] Epoch {epoch + 1}/{args.ttt_epochs}: val_bpb={ttt_val_bpb:.4f}\")\n    \n    return model\n\n\n# ============================================================================\n# TRAINING\n# ============================================================================\n\ndef train():\n    \"\"\"Main training function.\"\"\"\n    args = H()\n    \n    # ==========================================================================\n    # SETUP\n    # ==========================================================================\n    \n    if not torch.cuda.is_available():\n        raise RuntimeError(\"CUDA required for training\")\n    \n    # Distributed setup\n    world_size = int(os.environ.get(\"WORLD_SIZE\", \"1\"))\n    local_rank = int(os.environ.get(\"LOCAL_RANK\", \"0\"))\n    rank = int(os.environ.get(\"RANK\", \"0\"))\n    device = torch.device(f\"cuda:{local_rank}\")\n    torch.cuda.set_device(device)\n    \n    if world_size > 1:\n        dist.init_process_group(backend=\"nccl\")\n    \n    is_main = rank == 0\n    \n    # Enable TF32 for faster compute\n    torch.backends.cuda.matmul.allow_tf32 = True\n    torch.backends.cudnn.allow_tf32 = True\n    \n    # Create run directory\n    run_dir = os.path.join(args.checkpoint_dir, args.run_id)\n    os.makedirs(run_dir, exist_ok=True)\n    os.makedirs(\"logs\", exist_ok=True)\n    \n    # Logging\n    logf = open(f\"logs/{args.run_id}.rank{rank}.txt\", \"w\")\n    \n    def log(msg):\n        if is_main:\n            print(msg)\n        print(msg, file=logf, flush=True)\n    \n    def log_metrics(metrics):\n        \"\"\"Log structured metrics.\"\"\"\n        line = \" \".join(f\"{k}={v}\" for k, v in metrics.items())\n        log(line)\n        # Also print for auto-parsing\n        if is_main:\n            for k, v in metrics.items():\n                print(f\"METRIC {k}={v}\", flush=True)\n    \n    log(\"=\" * 60)\n    log(f\"Parameter Golf - T4 Training\")\n    log(f\"Run ID: {args.run_id}\")\n    log(f\"Device: {torch.cuda.get_device_name()} (rank {rank}/{world_size})\")\n    log(f\"PyTorch: {torch.__version__}\")\n    log(\"=\" * 60)\n    \n    # ==========================================================================\n    # DATA\n    # ==========================================================================\n    \n    log(\"[1/6] Downloading data...\")\n    try:\n        data_path, tok_path = download_data(args.data_path, args.vocab_size)\n    except Exception as e:\n        log(f\"ERROR: Data download failed: {e}\")\n        raise\n    \n    # Tokenizer\n    log(\"[2/6] Loading tokenizer...\")\n    sp = spm.SentencePieceProcessor(model_file=tok_path)\n    actual_vocab = int(sp.vocab_size())\n    if actual_vocab != args.vocab_size:\n        log(f\"Warning: vocab mismatch {actual_vocab} vs {args.vocab_size}\")\n        args.vocab_size = actual_vocab\n    \n    # Validation tokens\n    val_tokens = load_shard(os.path.join(data_path, \"fineweb_val_000000.bin\"))\n    base_bytes_lut = build_byte_lut(sp, args.vocab_size, device)\n    log(f\"Val tokens: {val_tokens.numel():,}\")\n    \n    # Training data stream\n    train_stream = TokenStream(os.path.join(data_path, \"fineweb_train_*.bin\"))\n    \n    # ==========================================================================\n    # MODEL\n    # ==========================================================================\n    \n    log(\"[3/6] Building model...\")\n    model = GPT().to(device).to(torch.bfloat16)\n    for m in model.modules():\n        if isinstance(m, CastedLinear):\n            m.float()\n    \n    if world_size > 1:\n        model = DDP(model, device_ids=[local_rank], output_device=local_rank)\n    \n    raw_model = model.module if world_size > 1 else model\n    n_params = sum(p.numel() for p in raw_model.parameters())\n    log(f\"Params: {n_params:,} ({n_params * 2 / 1024 / 1024:.1f} MB bf16)\")\n    \n    # ==========================================================================\n    # OPTIMIZER\n    # ==========================================================================\n    \n    opt = torch.optim.AdamW(\n        raw_model.parameters(),\n        lr=args.matrix_lr,\n        betas=(args.beta1, args.beta2),\n        weight_decay=args.weight_decay,\n        fused=True,\n    )\n    \n    # EMA for model averaging\n    ema_state = {k: v.cpu().clone() for k, v in raw_model.state_dict().items()}\n    \n    # ==========================================================================\n    # TRAINING LOOP\n    # ==========================================================================\n    \n    log(\"[4/6] Training...\")\n    torch.cuda.synchronize()\n    t0 = time.perf_counter()\n    \n    step = 0\n    best_val_bpb = float('inf')\n    best_state = None\n    grad_accum = 0\n    last_val_step = -1\n    last_checkpoint_time = t0\n    train_stream_pos = 0\n    \n    # Resume from checkpoint if exists\n    latest_ckpt = None\n    if os.path.exists(run_dir):\n        ckpts = sorted(glob.glob(os.path.join(run_dir, f\"{_CHECKPOINT_PREFIX}*.pt\")))\n        if ckpts:\n            latest_ckpt = ckpts[-1]\n    \n    if latest_ckpt:\n        log(f\"Resuming from checkpoint: {latest_ckpt}\")\n        resume_step, resume_val_bpb, resume_pos = load_checkpoint(\n            latest_ckpt, raw_model, opt\n        )\n        step = resume_step\n        best_val_bpb = resume_val_bpb\n        train_stream_pos = resume_pos\n        train_stream.seek_tokens(train_stream_pos)\n        log(f\"Resumed from step {step}, val_bpb={best_val_bpb:.4f}\")\n    \n    # Batch function\n    def get_batch():\n        span = args.train_batch_tokens + 1\n        chunk = train_stream.take(span)\n        x = chunk[:-1].reshape(-1, args.train_seq_len).to(device).long()\n        y = chunk[1:].reshape(-1, args.train_seq_len).to(device).long()\n        return x, y\n    \n    # Learning rate schedule\n    def lr_schedule(step):\n        if step < args.warmup_steps:\n            return step / max(args.warmup_steps, 1)\n        warmdown_start = int(args.iterations * (1 - args.warmdown_frac))\n        if step >= warmdown_start:\n            frac = (args.iterations - step) / max(args.iterations - warmdown_start, 1)\n            return max(frac, args.min_lr_ratio)\n        return 1.0\n\n[216 more lines in file. Use offset=830 to continue.]"}],"isError":false,"timestamp":1777141903579}}
{"type":"message","id":"330e969a","parentId":"abf1b7c3","timestamp":"2026-04-25T18:31:45.195Z","message":{"role":"assistant","content":[{"type":"thinking","thinking":"Let me continue reading the rest of the training loop and the rest of the file.","thinkingSignature":"6a746f8235f3b47201ffdc2054e8866c1db47c0b3c240e058d571d2ab482c71e"},{"type":"toolCall","id":"call_function_ekeibtb1qh2d_1","name":"read","arguments":{"limit":220,"offset":830,"path":"/Users/dhruv2mars/dev/github/parameter-golf/train_kaggle.py"}}],"api":"anthropic-messages","provider":"minimax","model":"MiniMax-M2.7","usage":{"input":2635,"output":78,"cacheRead":27104,"cacheWrite":0,"totalTokens":29817,"cost":{"input":0.0007905,"output":0.0000936,"cacheRead":0.00162624,"cacheWrite":0,"total":0.00251034}},"stopReason":"toolUse","timestamp":1777141903580,"responseId":"063c3b8f6a61c71761591f74f8ae01c1"}}
{"type":"message","id":"add61737","parentId":"330e969a","timestamp":"2026-04-25T18:31:45.215Z","message":{"role":"toolResult","toolCallId":"call_function_ekeibtb1qh2d_1","toolName":"read","content":[{"type":"text","text":"    \n    while step < args.iterations:\n        elapsed = time.perf_counter() - t0\n        \n        # Checkpoint every N seconds\n        if is_main and (elapsed - last_checkpoint_time) >= _CHECKPOINT_EVERY_SECONDS:\n            if best_state is not None:\n                ckpt_path = save_checkpoint(\n                    step, raw_model, opt, ema_state, best_val_bpb, \n                    train_stream_pos, run_dir\n                )\n                log(f\"[CKPT] Saved: {ckpt_path}\")\n            last_checkpoint_time = time.perf_counter()\n        \n        # Validation\n        if step % args.val_loss_every == 0 and step > 0 and step != last_val_step:\n            last_val_step = step\n            if world_size > 1:\n                dist.barrier()\n            \n            torch.cuda.synchronize()\n            \n            if is_main:\n                model.eval()\n                val_loss_sum = 0.0\n                val_token_count = 0\n                val_limit = min(val_tokens.numel() - 1, args.val_max_tokens)\n                \n                with torch.no_grad():\n                    for i in range(0, val_limit, args.train_seq_len * 4):\n                        x = val_tokens[i:i + args.train_seq_len * 4].to(device).long()\n                        y = val_tokens[i + 1:i + 1 + args.train_seq_len * 4].to(device).long()\n                        with torch.autocast(device_type=\"cuda\", dtype=torch.bfloat16):\n                            loss = raw_model(x, y)\n                        val_loss_sum += loss.item() * x.numel()\n                        val_token_count += x.numel()\n                \n                val_loss = val_loss_sum / val_token_count\n                val_bpb = compute_val_bpb(val_loss, val_tokens[:val_token_count],\n                                          base_bytes_lut, device)\n                \n                # Update EMA\n                current_state = {k: v.cpu().clone() for k, v in raw_model.state_dict().items()}\n                for k in ema_state:\n                    ema_state[k] = args.ema_decay * ema_state[k] + (1 - args.ema_decay) * current_state[k]\n                \n                # Save best\n                if val_bpb < best_val_bpb:\n                    best_val_bpb = val_bpb\n                    best_state = {k: v.cpu().clone() for k, v in raw_model.state_dict().items()}\n                \n                log_metrics({\n                    \"step\": step,\n                    \"val_loss\": f\"{val_loss:.4f}\",\n                    \"val_bpb\": f\"{val_bpb:.4f}\",\n                    \"best_bpb\": f\"{best_val_bpb:.4f}\",\n                    \"elapsed_s\": f\"{elapsed:.0f}\"\n                })\n                \n                # Checkpoint on improvement\n                if val_bpb <= best_val_bpb:\n                    ckpt_path = save_checkpoint(\n                        step, raw_model, opt, ema_state, best_val_bpb,\n                        train_stream_pos, run_dir\n                    )\n                    log(f\"[CKPT] Best checkpoint saved\")\n            \n            model.train()\n            if world_size > 1:\n                dist.barrier()\n        \n        # Training step\n        try:\n            x, y = get_batch()\n            with torch.autocast(device_type=\"cuda\", dtype=torch.bfloat16):\n                loss = raw_model(x, y)\n            \n            # NaN/Inf detection\n            if not torch.isfinite(loss):\n                log(f\"ERROR: Non-finite loss at step {step}: {loss.item()}\")\n                # Save checkpoint before dying\n                if is_main and best_state is not None:\n                    save_checkpoint(step, raw_model, opt, ema_state, best_val_bpb,\n                                   train_stream_pos, run_dir)\n                break\n            \n            loss.backward()\n            grad_accum += 1\n            \n            # Optimizer step\n            if grad_accum >= args.grad_accum_steps:\n                scale = lr_schedule(step)\n                for g in opt.param_groups:\n                    g[\"lr\"] = args.matrix_lr * scale\n                \n                if args.grad_clip_norm > 0:\n                    torch.nn.utils.clip_grad_norm_(raw_model.parameters(), args.grad_clip_norm)\n                \n                opt.step()\n                opt.zero_grad(set_to_none=True)\n                \n                grad_accum = 0\n                step += 1\n                train_stream_pos += args.train_batch_tokens\n        \n        except Exception as e:\n            log(f\"ERROR at step {step}: {e}\")\n            if is_main:\n                save_checkpoint(step, raw_model, opt, ema_state, best_val_bpb,\n                              train_stream_pos, run_dir)\n            raise\n        \n        # Wallclock limit\n        if elapsed >= args.max_wallclock_seconds:\n            log(f\"Wallclock limit reached at step {step}\")\n            break\n        \n        # Progress logging\n        if step <= 10 or step % 100 == 0:\n            log(f\"step:{step}/{args.iterations} train_loss:{loss.item():.4f} time:{elapsed:.0f}s\")\n    \n    log(f\"[4/6] Training complete. Best val_bpb: {best_val_bpb:.4f}\")\n    \n    if world_size > 1:\n        dist.barrier()\n    \n    # ==========================================================================\n    # SAVE\n    # ==========================================================================\n    \n    if not is_main:\n        logf.close()\n        if world_size > 1:\n            dist.destroy_process_group()\n        return\n    \n    log(\"[5/6] Saving final model...\")\n    \n    if best_state is None:\n        best_state = {k: v.cpu().clone() for k, v in raw_model.state_dict().items()}\n    \n    torch.save(best_state, os.path.join(run_dir, \"best_model.pt\"))\n    \n    # Quantize and compress\n    quant = quantize_state_dict(best_state)\n    buf = io.BytesIO()\n    torch.save(quant, buf)\n    \n    import brotli\n    compressed = brotli.compress(buf.getvalue(), quality=11)\n    \n    code_size = len(open(__file__).read().encode())\n    total_size = len(compressed) + code_size\n    \n    log(f\"Compressed artifact: {len(compressed):,} bytes\")\n    log(f\"Code size: {code_size:,} bytes\")\n    log(f\"Total: {total_size:,} bytes (limit: 16,000,000)\")\n    \n    with open(os.path.join(run_dir, \"best_model.int8.br\"), \"wb\") as f:\n        f.write(compressed)\n    \n    # ==========================================================================\n    # TTT\n    # ==========================================================================\n    \n    if args.ttt_enabled:\n        log(\"[6/6] Running TTT...\")\n        raw_model.load_state_dict(best_state)\n        raw_model = run_ttt(raw_model, val_tokens, base_bytes_lut, device, args, log)\n        \n        # Save TTT model\n        ttt_state = {k: v.cpu() for k, v in raw_model.state_dict().items()}\n        torch.save(ttt_state, os.path.join(run_dir, \"best_model_ttt.pt\"))\n    \n    log(\"=\" * 60)\n    log(\"DONE\")\n    log(\"=\" * 60)\n    \n    log_metrics({\n        \"final_val_bpb\": f\"{best_val_bpb:.4f}\",\n        \"total_steps\": step,\n        \"total_time_s\": f\"{time.perf_counter() - t0:.0f}\",\n        \"artifact_bytes\": len(compressed),\n        \"code_bytes\": code_size,\n        \"total_bytes\": total_size\n    })\n    \n    logf.close()\n    if world_size > 1:\n        dist.destroy_process_group()\n\n\nif __name__ == \"__main__\":\n    # Signal handling for graceful shutdown\n    def handle_signal(signum, frame):\n        print(\"Received signal, saving checkpoint...\")\n        sys.exit(0)\n    \n    signal.signal(signal.SIGTERM, handle_signal)\n    signal.signal(signal.SIGINT, handle_signal)\n    \n    # Launch DDP if multiple GPUs\n    if (\n        os.environ.get(\"USE_DDP\", \"1\") == \"1\"\n        and \"LOCAL_RANK\" not in os.environ\n        and torch.cuda.is_available()\n        and torch.cuda.device_count() > 1\n    ):\n        cmd = [\n            sys.executable, \"-m\", \"torch.distributed.run\",\n            \"--standalone\", f\"--nproc_per_node={torch.cuda.device_count()}\",\n            __file__,\n        ]\n        os.execvp(cmd[0], cmd)\n    \n    train()"}],"isError":false,"timestamp":1777141905215}}
