{"type":"message","id":"481d002c","parentId":"57e02f92","timestamp":"2026-04-27T11:16:51.812Z","message":{"role":"assistant","content":[{"type":"thinking","thinking":"It creates a new browser instance. I need to use `--headed` to see the browser window. Let me open it headed.","thinkingSignature":"8b2b23a201b47a4b42cdc0679cd99fc12385a2f126256cd303dd5128a20cec7a"},{"type":"toolCall","id":"call_function_1f4l580h731h_1","name":"bash","arguments":{"command":"agent-browser open \"https://lightning.ai/dhruv2mars/default-project/studios/parameter-golf/code\" --headed 2>&1"}}],"api":"anthropic-messages","provider":"minimax","model":"MiniMax-M2.7","usage":{"input":43015,"output":82,"cacheRead":9348,"cacheWrite":0,"totalTokens":52445,"cost":{"input":0.0129045,"output":0.00009839999999999999,"cacheRead":0.0005608799999999999,"cacheWrite":0,"total":0.01356378}},"stopReason":"toolUse","timestamp":1777288607382,"responseId":"063e789feb7b8eded9e4e136b50a131d"}}
{"type":"message","id":"e9c0807c","parentId":"481d002c","timestamp":"2026-04-27T11:16:57.649Z","message":{"role":"toolResult","toolCallId":"call_function_1f4l580h731h_1","toolName":"bash","content":[{"type":"text","text":"⚠ --headed ignored: daemon already running. Use 'agent-browser close' first to restart with new options.\n✓ Lightning AI\n  https://lightning.ai/dhruv2mars/default-project/studios/parameter-golf/code\n"}],"isError":false,"timestamp":1777288617649}}
{"type":"message","id":"77fc01d7","parentId":"e9c0807c","timestamp":"2026-04-27T11:17:03.801Z","message":{"role":"assistant","content":[{"type":"thinking","thinking":"Let me close the current session and restart headed to see what's happening.","thinkingSignature":"55868205845a3245b53efba64beece7db8ccacd1a75852d2beee63d73bf4c02a"},{"type":"toolCall","id":"call_function_corq7c2nkx5g_1","name":"bash","arguments":{"command":"agent-browser close 2>&1 && sleep 1 && agent-browser open \"https://lightning.ai/dhruv2mars/default-project/studios/parameter-golf/code\" --headed 2>&1"}}],"api":"anthropic-messages","provider":"minimax","model":"MiniMax-M2.7","usage":{"input":43161,"output":82,"cacheRead":9348,"cacheWrite":0,"totalTokens":52591,"cost":{"input":0.0129483,"output":0.00009839999999999999,"cacheRead":0.0005608799999999999,"cacheWrite":0,"total":0.01360758}},"stopReason":"toolUse","timestamp":1777288617655,"responseId":"063e78acd075f423e2258359bd6b6889"}}
{"type":"message","id":"fa38a57a","parentId":"77fc01d7","timestamp":"2026-04-27T11:17:10.027Z","message":{"role":"toolResult","toolCallId":"call_function_corq7c2nkx5g_1","toolName":"bash","content":[{"type":"text","text":"✓ Browser closed\n✓ Sign in - Google Accounts\n  https://accounts.google.com/v3/signin/identifier?opparams=%253F&dsh=S-452247483%3A1777288629133717&REDACTED.apps.googleusercontent.com&o2v=1&redirect_uri=https%3A%2F%2Flightning.ai%2Fv1%2Fauth%2Foauth%2Fgoogle%2Fcomplete&response_type=code&scope=https%3A%2F%2Fwww.googleapis.com%2Fauth%2Fuserinfo.profile+https%3A%2F%2Fwww.googleapis.com%2Fauth%2Fuserinfo.email&service=lso&REDACTED%3D%3D&flowName=GeneralOAuthFlow&continue=https%3A%2F%2Faccounts.google.com%2Fsignin%2Foauth%2Fconsent%3Fauthuser%3Dunknown%26part%REDACTED%26flowName%3DGeneralOAuthFlow%26as%3DS-452247483%253A1777288629133717%26client_id%3D438065754791-br0s2p33a51gg4n5ilcvr86888j284hn.apps.googleusercontent.com%26requestPath%3D%252Fsignin%252Foauth%252Fconsent%23&app_domain=https%3A%2F%2Flightning.ai&REDACTED\n"}],"isError":false,"timestamp":1777288630027}}
{"type":"message","id":"264beb58","parentId":"fa38a57a","timestamp":"2026-04-27T11:17:17.341Z","message":{"role":"assistant","content":[{"type":"thinking","thinking":"It's at the Google login page. This means it opened in a fresh browser instance, not in the user's Brave browser with their session. They need to login. Let me take a screenshot to see.","thinkingSignature":"7999953db921c4851a4e46964effa938912ee1f1977029dcc480b0f706c805e3"},{"type":"toolCall","id":"call_function_pgjd49eyxart_1","name":"bash","arguments":{"command":"agent-browser screenshot 2>&1"}}],"api":"anthropic-messages","provider":"minimax","model":"MiniMax-M2.7","usage":{"input":44010,"output":72,"cacheRead":9348,"cacheWrite":0,"totalTokens":53430,"cost":{"input":0.013203,"output":0.0000864,"cacheRead":0.0005608799999999999,"cacheWrite":0,"total":0.01385028}},"stopReason":"toolUse","timestamp":1777288630036,"responseId":"063e78b992e8cd3e05fa156e8259949b"}}
{"type":"message","id":"1877e40a","parentId":"264beb58","timestamp":"2026-04-27T11:17:17.807Z","message":{"role":"toolResult","toolCallId":"call_function_pgjd49eyxart_1","toolName":"bash","content":[{"type":"text","text":"✓ Screenshot saved to /Users/dhruv2mars/.agent-browser/tmp/screenshots/screenshot-1777288637799.png\n"}],"isError":false,"timestamp":1777288637807}}
{"type":"message","id":"b06762af","parentId":"1877e40a","timestamp":"2026-04-27T11:17:20.458Z","message":{"role":"assistant","content":[{"type":"thinking","thinking":"It's at the Google login page. This is a fresh browser, not connected to their Brave. They need to login. Let me tell them to login.","thinkingSignature":"e760c7b6ee02385c32ee4cb8bcdfa3a2c0cbba58ec58609dedb17e6ef013ca26"},{"type":"text","text":"At Google"}],"api":"anthropic-messages","provider":"minimax","model":"MiniMax-M2.7","usage":{"input":44125,"output":0,"cacheRead":9348,"cacheWrite":0,"totalTokens":53473,"cost":{"input":0.0132375,"output":0,"cacheRead":0.0005608799999999999,"cacheWrite":0,"total":0.013798379999999999}},"stopReason":"aborted","timestamp":1777288637811,"responseId":"063e78be8ac9cdc74270c5451c201a8c","errorMessage":"Operation aborted"}}
{"type":"message","id":"f57c04ba","parentId":"b06762af","timestamp":"2026-04-27T11:17:26.923Z","message":{"role":"user","content":[{"type":"text","text":"dont open with chrome, open with brave"}],"timestamp":1777288646911}}
{"type":"message","id":"d17ee9c2","parentId":"f57c04ba","timestamp":"2026-04-27T11:17:34.237Z","message":{"role":"assistant","content":[{"type":"thinking","thinking":"The user wants me to use Brave browser instead of Chrome. Let me figure out how to configure agent-browser to use Brave.","thinkingSignature":"1a1fabcf9adc5c51b1bcb9d76ec0249ed440fdb117ff79cba295c75d1c2ea7ba"},{"type":"toolCall","id":"call_function_5lpvyvp9kh6v_1","name":"bash","arguments":{"command":"agent-browser --help 2>&1 | grep -i \"browser\\|brave\\|chrome\" | head -10"}}],"api":"anthropic-messages","provider":"minimax","model":"MiniMax-M2.7","usage":{"input":13,"output":74,"cacheRead":52205,"cacheWrite":1114,"totalTokens":53406,"cost":{"input":0.0000039,"output":0.00008879999999999999,"cacheRead":0.0031322999999999998,"cacheWrite":0.00041775,"total":0.0036427499999999997}},"stopReason":"toolUse","timestamp":1777288646923,"responseId":"063e78c9168bf9e08ce989a30ef117bf"}}
{"type":"message","id":"71e8db24","parentId":"d17ee9c2","timestamp":"2026-04-27T11:17:34.324Z","message":{"role":"toolResult","toolCallId":"call_function_5lpvyvp9kh6v_1","toolName":"bash","content":[{"type":"text","text":"agent-browser - fast browser automation CLI for AI agents\nUsage: agent-browser <command> [args] [options]\n  connect <port|url>         Connect to browser via CDP\n  close [--all]              Close browser (--all closes every session)\nGet Info:  agent-browser get <what> [selector]\nCheck State:  agent-browser is <what> <selector>\nFind Elements:  agent-browser find <locator> <value> <action> [text]\nMouse:  agent-browser mouse <action> [args]\nBrowser Settings:  agent-browser set <setting> [value]\nNetwork:  agent-browser network <action>\n"}],"isError":false,"timestamp":1777288654324}}
{"type":"message","id":"facbeee0","parentId":"71e8db24","timestamp":"2026-04-27T11:17:37.985Z","message":{"role":"assistant","content":[{"type":"thinking","thinking":"Let me check how to configure the browser executable path or use Brave.","thinkingSignature":"9168d8618dc203f14d5289598543bccf8c9fec5a78da3234ca97d6f5eb65a362"},{"type":"toolCall","id":"call_function_eo1whly21m0g_1","name":"bash","arguments":{"command":"agent-browser settings 2>&1 | head -20"}}],"api":"anthropic-messages","provider":"minimax","model":"MiniMax-M2.7","usage":{"input":44205,"output":50,"cacheRead":9348,"cacheWrite":0,"totalTokens":53603,"cost":{"input":0.013261499999999999,"output":0.000059999999999999995,"cacheRead":0.0005608799999999999,"cacheWrite":0,"total":0.013882379999999998}},"stopReason":"toolUse","timestamp":1777288654328,"responseId":"063e78ce2d28b14de1e37b7db869d74d"}}
{"type":"message","id":"060cdd16","parentId":"facbeee0","timestamp":"2026-04-27T11:17:38.059Z","message":{"role":"toolResult","toolCallId":"call_function_eo1whly21m0g_1","toolName":"bash","content":[{"type":"text","text":"Unknown command: settings\n"}],"isError":false,"timestamp":1777288658059}}
{"type":"message","id":"2dd49d05","parentId":"060cdd16","timestamp":"2026-04-27T11:17:40.985Z","message":{"role":"assistant","content":[{"type":"thinking","thinking":"Let me check the agent-browser config or environment variables.","thinkingSignature":"5fe58f0821abcb44b1c03c2f234fc62061d3527bbb38eecb6655a15cbc6980ae"},{"type":"toolCall","id":"call_function_yk3bpifyeqcd_1","name":"bash","arguments":{"command":"cat ~/.agent-browser/config.json 2>/dev/null || ls ~/.agent-browser/ 2>/dev/null"}}],"api":"anthropic-messages","provider":"minimax","model":"MiniMax-M2.7","usage":{"input":44275,"output":58,"cacheRead":9348,"cacheWrite":0,"totalTokens":53681,"cost":{"input":0.0132825,"output":0.0000696,"cacheRead":0.0005608799999999999,"cacheWrite":0,"total":0.013912979999999998}},"stopReason":"toolUse","timestamp":1777288658063,"responseId":"063e78d22aec9b5d5cb303835c32d6fa"}}
{"type":"message","id":"43d97bb9","parentId":"2dd49d05","timestamp":"2026-04-27T11:17:40.995Z","message":{"role":"toolResult","toolCallId":"call_function_yk3bpifyeqcd_1","toolName":"bash","content":[{"type":"text","text":"browsers\ndefault.engine\ndefault.pid\ndefault.sock\ndefault.stream\ndefault.version\nsessions\ntmp\n"}],"isError":false,"timestamp":1777288660995}}
{"type":"message","id":"c6866892","parentId":"43d97bb9","timestamp":"2026-04-27T11:17:44.476Z","message":{"role":"assistant","content":[{"type":"thinking","thinking":"Let me check how to configure Brave as the browser.","thinkingSignature":"a9c251a2a571b33badeac6f9ab7f7cf83fdea9b80651bafff7ae413fa467420a"},{"type":"toolCall","id":"call_function_j2znivot9b96_1","name":"bash","arguments":{"command":"cat ~/.agent-browser/browsers/ 2>/dev/null && ls ~/.agent-browser/browsers/ 2>/dev/null"}}],"api":"anthropic-messages","provider":"minimax","model":"MiniMax-M2.7","usage":{"input":44372,"output":63,"cacheRead":9348,"cacheWrite":0,"totalTokens":53783,"cost":{"input":0.0133116,"output":0.0000756,"cacheRead":0.0005608799999999999,"cacheWrite":0,"total":0.01394808}},"stopReason":"toolUse","timestamp":1777288660999,"responseId":"063e78d5907f6c1b0ceb90bdaa3fffe3"}}
{"type":"message","id":"55c57bb7","parentId":"c6866892","timestamp":"2026-04-27T11:17:44.486Z","message":{"role":"toolResult","toolCallId":"call_function_j2znivot9b96_1","toolName":"bash","content":[{"type":"text","text":"(no output)\n\nCommand exited with code 1"}],"details":{},"isError":true,"timestamp":1777288664486}}
{"type":"message","id":"f3fb4718","parentId":"55c57bb7","timestamp":"2026-04-27T11:17:48.318Z","message":{"role":"assistant","content":[{"type":"thinking","thinking":"Let me check if there's a way to set the browser executable. Let me look at the agent-browser source or docs.","thinkingSignature":"8fd87ea79c7d4bd6962d2efcb5228d745eb2ec42cf5a66dafef8b7e859d2fd51"},{"type":"toolCall","id":"call_function_ceion1to7k1x_1","name":"bash","arguments":{"command":"which brave && ls -la /Applications/Brave* 2>/dev/null | head -3"}}],"api":"anthropic-messages","provider":"minimax","model":"MiniMax-M2.7","usage":{"input":44460,"output":69,"cacheRead":9348,"cacheWrite":0,"totalTokens":53877,"cost":{"input":0.013338,"output":0.0000828,"cacheRead":0.0005608799999999999,"cacheWrite":0,"total":0.013981679999999998}},"stopReason":"toolUse","timestamp":1777288664489,"responseId":"063e78d8e64ad7b3095b9e0ff4edaa55"}}
{"type":"message","id":"8cc908c9","parentId":"f3fb4718","timestamp":"2026-04-27T11:17:48.328Z","message":{"role":"toolResult","toolCallId":"call_function_ceion1to7k1x_1","toolName":"bash","content":[{"type":"text","text":"(no output)\n\nCommand exited with code 1"}],"details":{},"isError":true,"timestamp":1777288668328}}
{"type":"message","id":"057ec3e7","parentId":"8cc908c9","timestamp":"2026-04-27T11:17:51.361Z","message":{"role":"assistant","content":[{"type":"thinking","thinking":"Let me check where brave browser is installed.","thinkingSignature":"869dbff600446c6eb39d971004f763b45cc21af2693c15d636e5710ce187da33"},{"type":"toolCall","id":"call_function_cvb3pg8h6pmj_1","name":"bash","arguments":{"command":"ls /Applications/ | grep -i brave"}}],"api":"anthropic-messages","provider":"minimax","model":"MiniMax-M2.7","usage":{"input":44554,"output":43,"cacheRead":9348,"cacheWrite":0,"totalTokens":53945,"cost":{"input":0.0133662,"output":0.0000516,"cacheRead":0.0005608799999999999,"cacheWrite":0,"total":0.01397868}},"stopReason":"toolUse","timestamp":1777288668334,"responseId":"063e78dc15d210e2becd723da0ab24a9"}}
{"type":"message","id":"e81ef34a","parentId":"057ec3e7","timestamp":"2026-04-27T11:17:51.373Z","message":{"role":"toolResult","toolCallId":"call_function_cvb3pg8h6pmj_1","toolName":"bash","content":[{"type":"text","text":"Brave Browser.app\n"}],"isError":false,"timestamp":1777288671373}}
{"type":"message","id":"e1195cd1","parentId":"e81ef34a","timestamp":"2026-04-27T11:17:55.537Z","message":{"role":"assistant","content":[{"type":"thinking","thinking":"Found it. Now let me figure out how to tell agent-browser to use Brave instead of Chrome. Let me check the documentation more carefully.","thinkingSignature":"941b828975d2df626516241672a47e007569a772b2162fa9e30ea109de008196"},{"type":"toolCall","id":"call_function_8o5ayrm01spb_1","name":"bash","arguments":{"command":"agent-browser set 2>&1 | head -15"}}],"api":"anthropic-messages","provider":"minimax","model":"MiniMax-M2.7","usage":{"input":44616,"output":64,"cacheRead":9348,"cacheWrite":0,"totalTokens":54028,"cost":{"input":0.013384799999999999,"output":0.0000768,"cacheRead":0.0005608799999999999,"cacheWrite":0,"total":0.014022479999999999}},"stopReason":"toolUse","timestamp":1777288671378,"responseId":"063e78df0fd6d189d4ec834b0168a6dc"}}
{"type":"message","id":"ac98d3db","parentId":"e1195cd1","timestamp":"2026-04-27T11:17:55.587Z","message":{"role":"toolResult","toolCallId":"call_function_8o5ayrm01spb_1","toolName":"bash","content":[{"type":"text","text":"Missing arguments for: set\nUsage: agent-browser set <viewport|device|geo|offline|headers|credentials|media> [args...]\n"}],"isError":false,"timestamp":1777288675586}}
{"type":"message","id":"7c173b5d","parentId":"ac98d3db","timestamp":"2026-04-27T11:18:01.343Z","message":{"role":"assistant","content":[{"type":"thinking","thinking":"Let me check if there's a way to specify the browser path.","thinkingSignature":"308e2ceb78e11b566fa7ba42d844a87b09b09d9b16351221d4c0008e1a89e0a0"},{"type":"toolCall","id":"call_function_m7o3e65ywlwd_1","name":"bash","arguments":{"command":"cat /Users/dhruv2mars/.agent-browser/browsers/$(cat /Users/dhruv2mars/.agent-browser/default.engine)/chrome/mac/$(cat /Users/dhruv2mars/.agent-browser/default.version)/info.json 2>/dev/null || find /Users/dhruv2mars/.agent-browser -name \"*.json\" -exec grep -l \"path\\|browser\" {} \\; 2>/dev/null | head -5"}}],"api":"anthropic-messages","provider":"minimax","model":"MiniMax-M2.7","usage":{"input":44726,"output":133,"cacheRead":9348,"cacheWrite":0,"totalTokens":54207,"cost":{"input":0.013417799999999999,"output":0.0001596,"cacheRead":0.0005608799999999999,"cacheWrite":0,"total":0.014138279999999998}},"stopReason":"toolUse","timestamp":1777288675592,"responseId":"063e78e482b3baf258d1248c51c91abd"}}
{"type":"message","id":"7c12a27e","parentId":"7c173b5d","timestamp":"2026-04-27T11:18:01.484Z","message":{"role":"toolResult","toolCallId":"call_function_m7o3e65ywlwd_1","toolName":"bash","content":[{"type":"text","text":"/Users/dhruv2mars/.agent-browser/browsers/chrome-148.0.7778.56/Google Chrome for Testing.app/Contents/Frameworks/Google Chrome for Testing Framework.framework/Versions/148.0.7778.56/Resources/third_party/search_engines_data/resources/definitions/prepopulated_engines.json\n/Users/dhruv2mars/.agent-browser/browsers/chrome-148.0.7778.56/Google Chrome for Testing.app/Contents/Frameworks/Google Chrome for Testing Framework.framework/Versions/148.0.7778.56/Libraries/vk_swiftshader_icd.json\n/Users/dhruv2mars/.agent-browser/browsers/chrome-148.0.7778.56/Google Chrome for Testing.app/Contents/Frameworks/Google Chrome for Testing Framework.framework/Versions/148.0.7778.56/Libraries/WidevineCdm/manifest.json\n/Users/dhruv2mars/.agent-browser/browsers/chrome-146.0.7680.153/Google Chrome for Testing.app/Contents/Frameworks/Google Chrome for Testing Framework.framework/Versions/146.0.7680.153/Libraries/vk_swiftshader_icd.json\n/Users/dhruv2mars/.agent-browser/browsers/chrome-146.0.7680.153/Google Chrome for Testing.app/Contents/Frameworks/Google Chrome for Testing Framework.framework/Versions/146.0.7680.153/Libraries/WidevineCdm/manifest.json\n"}],"isError":false,"timestamp":1777288681484}}
{"type":"message","id":"4af48155","parentId":"7c12a27e","timestamp":"2026-04-27T11:18:04.861Z","message":{"role":"assistant","content":[{"type":"thinking","thinking":"Let me check the agent-browser docs or source to see how to configure Brave.","thinkingSignature":"49096105a506a11b6955528a89dffbb1f6350be62ae2c57a990b6b1367443f44"},{"type":"toolCall","id":"call_function_47ne0z5lvx64_1","name":"bash","arguments":{"command":"find ~/.agent-browser -name \"*.md\" 2>/dev/null | head -5"}}],"api":"anthropic-messages","provider":"minimax","model":"MiniMax-M2.7","usage":{"input":45210,"output":60,"cacheRead":9348,"cacheWrite":0,"totalTokens":54618,"cost":{"input":0.013562999999999999,"output":0.000072,"cacheRead":0.0005608799999999999,"cacheWrite":0,"total":0.014195879999999998}},"stopReason":"toolUse","timestamp":1777288681487,"responseId":"063e78e99a6530db362003c5be31cfcc"}}
{"type":"message","id":"10ee11fe","parentId":"4af48155","timestamp":"2026-04-27T11:18:04.909Z","message":{"role":"toolResult","toolCallId":"call_function_47ne0z5lvx64_1","toolName":"bash","content":[{"type":"text","text":"(no output)"}],"isError":false,"timestamp":1777288684909}}
{"type":"message","id":"086c84aa","parentId":"10ee11fe","timestamp":"2026-04-27T11:18:09.150Z","message":{"role":"assistant","content":[{"type":"thinking","thinking":"Let me try a different approach - use Brave's remote debugging port. Brave supports `--remote-debugging-port=9222` like Chrome.","thinkingSignature":"608da2b9f606c7c0e26707ada97648875fdee017544c9c03e3f99f8694353b20"},{"type":"toolCall","id":"call_function_dmk1anlt9i9d_1","name":"bash","arguments":{"command":"agent-browser close 2>&1 && sleep 1 && open -a \"Brave Browser\" --args --remote-debugging-port=9222 2>&1 &"}}],"api":"anthropic-messages","provider":"minimax","model":"MiniMax-M2.7","usage":{"input":45288,"output":88,"cacheRead":9348,"cacheWrite":0,"totalTokens":54724,"cost":{"input":0.0135864,"output":0.00010559999999999999,"cacheRead":0.0005608799999999999,"cacheWrite":0,"total":0.01425288}},"stopReason":"toolUse","timestamp":1777288684912,"responseId":"063e78ed2a6947079d9f4178aac2e09f"}}
{"type":"message","id":"8df7fd5b","parentId":"086c84aa","timestamp":"2026-04-27T11:18:09.261Z","message":{"role":"toolResult","toolCallId":"call_function_dmk1anlt9i9d_1","toolName":"bash","content":[{"type":"text","text":"(no output)"}],"isError":false,"timestamp":1777288689261}}
{"type":"message","id":"e2980066","parentId":"8df7fd5b","timestamp":"2026-04-27T11:18:12.696Z","message":{"role":"assistant","content":[{"type":"thinking","thinking":"Let me wait a moment and then connect to Brave via CDP.","thinkingSignature":"2dfdb813b71329324c0b7c33a4226da5cc39332e2fa3d4d7866a6f423944ec5f"},{"type":"toolCall","id":"call_function_moe5gxf0ab40_1","name":"bash","arguments":{"command":"sleep 3 && lsof -i :9222 2>/dev/null | head -3"}}],"api":"anthropic-messages","provider":"minimax","model":"MiniMax-M2.7","usage":{"input":45394,"output":58,"cacheRead":9348,"cacheWrite":0,"totalTokens":54800,"cost":{"input":0.013618199999999999,"output":0.0000696,"cacheRead":0.0005608799999999999,"cacheWrite":0,"total":0.014248679999999998}},"stopReason":"toolUse","timestamp":1777288689265,"responseId":"063e78f279c2b61e045e46080eafa885"}}
{"type":"message","id":"920f867d","parentId":"e2980066","timestamp":"2026-04-27T11:18:15.778Z","message":{"role":"toolResult","toolCallId":"call_function_moe5gxf0ab40_1","toolName":"bash","content":[{"type":"text","text":"(no output)"}],"isError":false,"timestamp":1777288695778}}
{"type":"message","id":"d802d321","parentId":"920f867d","timestamp":"2026-04-27T11:18:19.086Z","message":{"role":"assistant","content":[{"type":"thinking","thinking":"Let me try a different approach - use the agent-browser connect command.","thinkingSignature":"55d8127313ff15e3dd8e882536d6135256556d11365bcff9f5ba71fbf49c6ffa"},{"type":"toolCall","id":"call_function_j6a8vneymkss_1","name":"bash","arguments":{"command":"sleep 5 && lsof -i :9222 2>/dev/null | head -3"}}],"api":"anthropic-messages","provider":"minimax","model":"MiniMax-M2.7","usage":{"input":45470,"output":59,"cacheRead":9348,"cacheWrite":0,"totalTokens":54877,"cost":{"input":0.013640999999999999,"output":0.0000708,"cacheRead":0.0005608799999999999,"cacheWrite":0,"total":0.014272679999999998}},"stopReason":"toolUse","timestamp":1777288695782,"responseId":"063e78f872d62056cd93170a2f402674"}}
