{"type":"message","id":"50bbf71b","parentId":"8a86bd12","timestamp":"2026-04-27T13:27:37.988Z","message":{"role":"assistant","content":[{"type":"thinking","thinking":"Now I need to update the GPT class to use the new parameters and implement SP8192 with gradient checkpointing. Let me replace the GPT class.","thinkingSignature":"851bd576c660d674ba7e1fa27cfe30222f8f5ba61924810e8d5ded82189fe168"},{"type":"toolCall","id":"call_function_tdd7ecbuwg5c_1","name":"edit","arguments":{"path":"/Users/dhruv2mars/dev/github/parameter-golf/train_kaggle.py","edits":[{"oldText":"class GPT(nn.Module):\n    \"\"\"Standard transformer language model.\"\"\"\n    def __init__(self):\n        super().__init__()\n        \n        self.tok_emb = nn.Embedding(H.vocab_size, H.model_dim)\n        self.blocks = nn.ModuleList([\n            Block(\n                H.model_dim, H.num_heads, H.num_kv_heads, H.mlp_mult,\n                H.rope_base, H.qk_gain_init, i, H.rope_dims\n            )\n            for i in range(H.num_layers)\n        ])\n        self.final_norm = RMSNorm(H.model_dim)\n        \n        # Tied embeddings save parameters\n        self.lm_head = None if H.tie_embeddings else \\\n            CastedLinear(H.model_dim, H.vocab_size, bias=False)\n        \n        self._init_weights()\n    \n    def _init_weights(self):\n        if H.tie_embeddings:\n            nn.init.normal_(self.tok_emb.weight, std=0.005)\n        for m in self.modules():\n            if isinstance(m, CastedLinear) and m.bias is not None:\n                if (m.bias.data == 0).all() or m.bias.data.abs().sum() == 0:\n                    nn.init.zeros_(m.bias)\n    \n    def forward(self, x, target=None):\n        x = self.tok_emb(x)\n        x = F.rms_norm(x, (x.size(-1),))\n        x0 = x\n        \n        # Compute depth loop activation step\n        warmup_steps = int(H.iterations * H.enable_looping_at)\n        loop_active = False\n        \n        for i, block in enumerate(self.blocks):\n            x = block(x, x0)\n            \n            # Depth recurrence: loop layers 3-5 after warmup\n            if (i >= H.loop_start and i <= H.loop_end and \n                H.num_loops > 1 and loop_active):\n                for _ in range(H.num_loops - 1):\n                    x = block(x, x0)\n            \n            # Activate recurrence after warmup\n            if i == H.loop_start:\n                loop_active = True\n        \n        x = self.final_norm(x)\n        \n        # Output projection\n        if self.lm_head is not None:\n            logits = self.lm_head(x)\n        else:\n            logits = F.linear(x, self.tok_emb.weight)\n        \n        # Logit softcap (improves calibration)\n        logits = H.logit_softcap * torch.tanh(logits / H.logit_softcap)\n        \n        if target is not None:\n            return F.cross_entropy(logits.view(-1, H.vocab_size), target.view(-1), \n                                   reduction='mean')\n        return logits","newText":"class GPT(nn.Module):\n    \"\"\"\n    Transformer language model with:\n    1. SP8192 - Sequence Parallelism via chunked processing\n    2. Parallel Residuals - attention and MLP in parallel\n    3. SmearGate - cross-layer gating\n    \"\"\"\n    def __init__(self):\n        super().__init__()\n        \n        self.tok_emb = nn.Embedding(H.vocab_size, H.model_dim)\n        self.blocks = nn.ModuleList([\n            Block(\n                H.model_dim, H.num_heads, H.num_kv_heads, H.mlp_mult,\n                H.rope_base, H.qk_gain_init, i, H.rope_dims,\n                use_parallel_residuals=H.parallel_residuals,\n                use_smear_gate=H.smear_gate,\n                smear_decay=H.smear_gate_decay\n            )\n            for i in range(H.num_layers)\n        ])\n        self.final_norm = RMSNorm(H.model_dim)\n        \n        # Tied embeddings save parameters\n        self.lm_head = None if H.tie_embeddings else \\\n            CastedLinear(H.model_dim, H.vocab_size, bias=False)\n        \n        # Register gradient checkpointing if enabled\n        if H.use_gradient_checkpointing:\n            self._use_cp = True\n        else:\n            self._use_cp = False\n        \n        self._init_weights()\n    \n    def _init_weights(self):\n        if H.tie_embeddings:\n            nn.init.normal_(self.tok_emb.weight, std=0.005)\n        for m in self.modules():\n            if isinstance(m, CastedLinear) and m.bias is not None:\n                if (m.bias.data == 0).all() or m.bias.data.abs().sum() == 0:\n                    nn.init.zeros_(m.bias)\n    \n    def _forward_chunk(self, x, x0, smear_state=None):\n        \"\"\"Forward pass through all blocks for a single chunk.\"\"\"\n        # Compute depth loop activation step\n        warmup_steps = int(H.iterations * H.enable_looping_at)\n        loop_active = False\n        \n        for i, block in enumerate(self.blocks):\n            # Gradient checkpointing for memory savings\n            if self._use_cp and self.training:\n                # Checkpoint each block\n                block_out = torch.utils.checkpoint(\n                    block, x, x0, smear_state,\n                    use_reentrant=False,  # Required for backward to work correctly\n                    preserve_rng_state=False\n                )\n            else:\n                block_out = block(x, x0, smear_state)\n            \n            # Update smear state from this layer\n            if H.smear_gate:\n                smear_state = block_out\n            \n            x = block_out\n            \n            # Depth recurrence: loop layers 3-5 after warmup\n            if (i >= H.loop_start and i <= H.loop_end and \n                H.num_loops > 1 and loop_active):\n                for _ in range(H.num_loops - 1):\n                    if self._use_cp and self.training:\n                        x = torch.utils.checkpoint(\n                            block, x, x0, smear_state,\n                            use_reentrant=False,\n                            preserve_rng_state=False\n                        )\n                    else:\n                        x = block(x, x0, smear_state)\n                    if H.smear_gate:\n                        smear_state = x\n            \n            # Activate recurrence after warmup\n            if i == H.loop_start:\n                loop_active = True\n        \n        return x, smear_state\n    \n    def forward(self, x, target=None):\n        b, seq_len, d = x.shape[0], x.shape[1], H.model_dim\n        \n        x = self.tok_emb(x)\n        x = F.rms_norm(x, (x.size(-1),))\n        x0 = x\n        \n        # ============================================================\n        # SP8192: Chunked sequence processing for long contexts\n        # ============================================================\n        if H.sp_enabled and seq_len > H.sp_chunk_size:\n            # Process sequence in chunks to save memory\n            # Use overlapping chunks and aggregate states\n            chunk_size = H.sp_chunk_size\n            smear_state = None\n            all_hiddens = []\n            \n            for start in range(0, seq_len, chunk_size):\n                end = min(start + chunk_size, seq_len)\n                chunk = x[:, start:end, :]\n                chunk0 = x0[:, start:end, :]\n                \n                # Forward through blocks\n                chunk_out, smear_state = self._forward_chunk(chunk, chunk0, smear_state)\n                all_hiddens.append(chunk_out)\n            \n            # Concatenate chunks\n            x = torch.cat(all_hiddens, dim=1)\n        else:\n            # Standard forward pass\n            x, _ = self._forward_chunk(x, x0, None)\n        \n        x = self.final_norm(x)\n        \n        # Output projection\n        if self.lm_head is not None:\n            logits = self.lm_head(x)\n        else:\n            logits = F.linear(x, self.tok_emb.weight)\n        \n        # Logit softcap (improves calibration)\n        logits = H.logit_softcap * torch.tanh(logits / H.logit_softcap)\n        \n        if target is not None:\n            return F.cross_entropy(logits.view(-1, H.vocab_size), target.view(-1), \n                                   reduction='mean')\n        return logits"}]}}],"api":"anthropic-messages","provider":"minimax","model":"MiniMax-M2.7","usage":{"input":46716,"output":1993,"cacheRead":9199,"cacheWrite":0,"totalTokens":57908,"cost":{"input":0.0140148,"output":0.0023916,"cacheRead":0.00055194,"cacheWrite":0,"total":0.01695834}},"stopReason":"toolUse","timestamp":1777296431068,"responseId":"063e972fd153f08a15aec1a7369302ad"}}
