{"type":"message","id":"429e5aaf","parentId":"8bffeb2c","timestamp":"2026-04-26T12:00:37.574Z","message":{"role":"toolResult","toolCallId":"call_function_1uiwraa4x79d_1","toolName":"log_experiment","content":[{"type":"text","text":"Logged #26: keep — ROPE 32 + EMA 0.994 + GRAD_CLIP 0.3: 2.309, HUGE WIN! 3% better than baseline\nBaseline val_bpb: 2.38bpb | this: 2.31bpb (-2.9%)\nSecondary: artifact_mb: 12.10mb (0.0%)  best_val_bpb: 2.31 (-2.9%)  steps: 1,100 (-4.8%)\n📋 ASI: arch: rope32 + ema994 + clip0.3 | conclusion: tighter gradient clipping helps convergence - MAJOR win! | result: NEW BEST - 3% better than baseline!\n📊 Confidence: 2.2× noise floor — improvement is likely real\n(26 experiments)\n📝 Git: committed — "}],"details":{"experiment":{"commit":"de16801","metric":2.3093,"metrics":{"artifact_mb":12.1,"best_val_bpb":2.3093,"steps":1100},"status":"keep","description":"ROPE 32 + EMA 0.994 + GRAD_CLIP 0.3: 2.309, HUGE WIN! 3% better than baseline","timestamp":1777204827391,"segment":0,"confidence":2.1512345679012386,"iterationTokens":null,"asi":{"arch":"rope32 + ema994 + clip0.3","conclusion":"tighter gradient clipping helps convergence - MAJOR win!","result":"NEW BEST - 3% better than baseline!"}},"state":{"results":[{"commit":"a672845","metric":2.379,"metrics":{"best_val_bpb":2.379,"steps":1155,"artifact_mb":12.1},"status":"keep","description":"30-min baseline: 2.379 val_bpb, 1155 steps, still improving","timestamp":1777144208804,"segment":0,"confidence":null,"iterationTokens":null,"asi":{"baseline_30min":true,"steps_completed":1155,"max_iterations":7000,"pct_exhausted":16.5,"loss_still_declining":true,"artifact_mb":12.1,"gap_to_sub1":1.879}},{"commit":"a672845","metric":2.3857,"metrics":{"artifact_mb":12.3,"best_val_bpb":2.3857,"steps":1200},"status":"discard","description":"TTT crashed: dtype mismatch in CastedLinear (bf16/float32)","timestamp":1777146462942,"segment":0,"confidence":null,"iterationTokens":null,"asi":{"error":"mat1 mat2 dtype mismatch bf16 vs float","fix_needed":"CastedLinear cast weights to match autocast dtype","ttt_broken":true}},{"commit":"e8ecad4","metric":2.3821,"metrics":{"artifact_mb":12.3,"best_val_bpb":2.3821,"steps":1200},"status":"discard","description":"TTT still broken: OOM from attention .float() creating 32GB matrix","timestamp":1777148696907,"segment":0,"confidence":null,"iterationTokens":null,"asi":{"error":"OOM: attention .float() creates 32GB matrix","fix_needed":"Remove .float() or use bf16 for attention scores","ttt_broken":true}},{"commit":"de16801","metric":2.4351,"metrics":{"artifact_mb":12.3,"best_val_bpb":2.4351,"steps":1200},"status":"discard","description":"TTT still OOM: eval loop also has memory issues","timestamp":1777150932661,"segment":0,"confidence":null,"iterationTokens":null,"asi":{"error":"OOM still in TTT eval loop","fix_needed":"Reduce eval tokens per chunk, or skip TTT for now","ttt_broken":true}},{"commit":"de16801","metric":2.4265,"metrics":{"artifact_mb":12.3,"best_val_bpb":2.4265,"steps":900},"status":"discard","description":"Wider arch (9L-640d) too slow, timed out at 900 steps","timestamp":1777155540944,"segment":0,"confidence":null,"iterationTokens":null,"asi":{"arch":"9L-640d-10H/5KV","conclusion":"wider model too slow, hit wallclock before converging","error":"SIGTERM/SIGABRT - wallclock timeout","result":"worse than baseline","steps":900}},{"commit":"de16801","metric":2.4179,"metrics":{"artifact_mb":12.1,"best_val_bpb":2.4179,"steps":1000},"status":"discard","description":"Deeper/narrower (13L-480d): 2.418 val_bpb, worse","timestamp":1777157778800,"segment":0,"confidence":null,"iterationTokens":null,"asi":{"arch":"13L-480d-8H/4KV","conclusion":"narrower model underfits","result":"worse than baseline"}},{"commit":"de16801","metric":2.4755,"metrics":{"artifact_mb":12.1,"best_val_bpb":2.4755,"steps":1600},"status":"discard","description":"Seq1024 + batch4096: 2.48 val_bpb, worse","timestamp":1777160126335,"segment":0,"confidence":null,"iterationTokens":null,"asi":{"arch":"11L-512d, seq_len=1024","conclusion":"longer context underfits - fewer steps per time","result":"worse than baseline"}},{"commit":"de16801","metric":2.4523,"metrics":{"artifact_mb":12.1,"best_val_bpb":2.4523,"steps":900},"status":"discard","description":"More depth loops (3x, layers 3-6): 2.452 val_bpb","timestamp":1777162354973,"segment":0,"confidence":null,"iterationTokens":null,"asi":{"arch":"11L-512d, 3 loops on layers 3-6","conclusion":"more depth recurrence = slower = fewer steps = worse","result":"worse than baseline"}},{"commit":"de16801","metric":2.3948,"metrics":{"artifact_mb":12.1,"best_val_bpb":2.3948,"steps":1200},"status":"discard","description":"Higher LR (0.002): 2.395, slightly worse","timestamp":1777164584746,"segment":0,"confidence":null,"iterationTokens":null,"asi":{"conclusion":"higher LR converges faster but worse final","hyperparam":"lr=0.002"}},{"commit":"de16801","metric":2.382,"metrics":{"artifact_mb":12.1,"best_val_bpb":2.382,"steps":1100},"status":"keep","description":"Lower LR (0.0005): 2.382, within noise of baseline","timestamp":1777166805914,"segment":0,"confidence":null,"iterationTokens":null,"asi":{"conclusion":"lower LR marginally worse but within noise - may generalize better","hyperparam":"lr=0.0005"}},{"commit":"de16801","metric":2.3871,"metrics":{"artifact_mb":12.1,"best_val_bpb":2.3871,"steps":1200},"status":"discard","description":"Shorter warmdown (0.6): 2.387, slightly worse","timestamp":1777169035789,"segment":0,"confidence":null,"iterationTokens":null,"asi":{"conclusion":"shorter warmdown slightly worse","hyperparam":"warmdown=0.6"}},{"commit":"de16801","metric":2.3903,"metrics":{"artifact_mb":12.1,"best_val_bpb":2.3903,"steps":1100},"status":"discard","description":"Lower WD (0.05): 2.390, slightly worse","timestamp":1777171253884,"segment":0,"confidence":null,"iterationTokens":null,"asi":{"conclusion":"lower weight decay slightly worse","hyperparam":"wd=0.05"}},{"commit":"de16801","metric":2.3767,"metrics":{"artifact_mb":12.1,"best_val_bpb":2.3767,"steps":1100},"status":"keep","description":"Higher WD (0.15): 2.377, BEST so far! Better than baseline","timestamp":1777173486921,"segment":0,"confidence":0.2035398230088492,"iterationTokens":null,"asi":{"conclusion":"higher WD improves BPB by ~0.002","hyperparam":"wd=0.15"}},{"commit":"de16801","metric":2.4075,"metrics":{"artifact_mb":12.1,"best_val_bpb":2.4075,"steps":1100},"status":"discard","description":"WD0.15 + warmdown0.8: 2.408, worse","timestamp":1777175717625,"segment":0,"confidence":0.16140350877192655,"iterationTokens":null,"asi":{"conclusion":"longer warmdown worse with higher WD","hyperparam":"wd=0.15, warmdown=0.8"}},{"commit":"de16801","metric":2.4864,"metrics":{"artifact_mb":12.1,"best_val_bpb":2.4864,"steps":1100},"status":"discard","description":"ROPE 8 dims: 2.486, much worse","timestamp":1777177952414,"segment":0,"confidence":0.14556962025316225,"iterationTokens":null,"asi":{"arch":"rope_dims=8","conclusion":"less RoPE = much worse","result":"much worse"}},{"commit":"de16801","metric":2.3565,"metrics":{"artifact_mb":12.1,"best_val_bpb":2.3565,"steps":1100},"status":"keep","description":"ROPE 24 dims: 2.357, NEW BEST! 2.4% better than baseline","timestamp":1777180169789,"segment":0,"confidence":1.4610389610389511,"iterationTokens":null,"asi":{"arch":"rope_dims=24","conclusion":"more RoPE is a REAL win - 2.4% better than baseline","result":"BEST so far - significant"}},{"commit":"de16801","metric":2.3531,"metrics":{"artifact_mb":12.1,"best_val_bpb":2.3531,"steps":1100},"status":"keep","description":"ROPE 24 + WD 0.15: 2.353, COMBINED BEST!","timestamp":1777182401297,"segment":0,"confidence":1.5058139534883455,"iterationTokens":null,"asi":{"arch":"rope_dims=24 + wd=0.15","conclusion":"COMBINING best findings: rope24 + wd15 = another small win","result":"NEW BEST - 1.1% better than rope24 alone"}},{"commit":"de16801","metric":2.331,"metrics":{"artifact_mb":12.1,"best_val_bpb":2.331,"steps":1100},"status":"keep","description":"ROPE 32 dims: 2.331, MASSIVE IMPROVEMENT! 2% better than baseline","timestamp":1777184633015,"segment":0,"confidence":2,"iterationTokens":null,"asi":{"arch":"rope_dims=32","conclusion":"HUGE WIN - rope32 is 2% better than baseline","result":"MASSIVE BEST - 2% improvement"}},{"commit":"de16801","metric":2.3341,"metrics":{"artifact_mb":12.1,"best_val_bpb":2.3341,"steps":1100},"status":"discard","description":"ROPE 32 + WD 0.15: 2.334, slightly worse than rope32 alone","timestamp":1777186873742,"segment":0,"confidence":1.5686274509803841,"iterationTokens":null,"asi":{"arch":"rope_dims=32 + wd=0.15","conclusion":"adding wd15 to rope32 doesn't help further"}},{"commit":"de16801","metric":2.3314,"metrics":{"artifact_mb":12.1,"best_val_bpb":2.3314,"steps":1100},"status":"discard","description":"ROPE 32 + WD 0.10: 2.331, same as rope32","timestamp":1777189126449,"segment":0,"confidence":1.5635179153094503,"iterationTokens":null,"asi":{"arch":"rope_dims=32 + wd=0.10","conclusion":"wd=0.10 no benefit over rope32 alone"}},{"commit":"de16801","metric":2.3493,"metrics":{"artifact_mb":12.1,"best_val_bpb":2.3493,"steps":1100},"status":"discard","description":"ROPE 48 dims: 2.349, worse than rope32","timestamp":1777191365822,"segment":0,"confidence":1.4906832298136656,"iterationTokens":null,"asi":{"arch":"rope_dims=48","conclusion":"rope48 worse than rope32 - sweet spot around rope32"}},{"commit":"de16801","metric":2.3564,"metrics":{"artifact_mb":12.1,"best_val_bpb":2.3564,"steps":1100},"status":"discard","description":"ROPE 28 dims: 2.356, confirms rope32 is the peak","timestamp":1777193581685,"segment":0,"confidence":1.6466552315609053,"iterationTokens":null,"asi":{"arch":"rope_dims=28","conclusion":"rope28 worse than rope32 - confirms peak around 32"}},{"commit":"de16801","metric":2.3319,"metrics":{"artifact_mb":12.1,"best_val_bpb":2.3319,"steps":1200},"status":"discard","description":"ROPE 32 + LR 0.0005: 2.332, same as rope32","timestamp":1777195798042,"segment":0,"confidence":1.6551724137931099,"iterationTokens":null,"asi":{"arch":"rope_dims=32 + lr=0.0005","conclusion":"lower LR no further benefit with rope32"}},{"commit":"de16801","metric":2.3469,"metrics":{"artifact_mb":12.1,"best_val_bpb":2.3469,"steps":1100},"status":"discard","description":"ROPE 32 + EMA 0.999: 2.347, worse than rope32","timestamp":1777200322812,"segment":0,"confidence":1.5559157212317658,"iterationTokens":null,"asi":{"arch":"rope_dims=32 + ema=0.999","conclusion":"higher EMA slows convergence, slightly worse"}},{"commit":"de16801","metric":2.3258,"metrics":{"artifact_mb":12.1,"best_val_bpb":2.3258,"steps":1200},"status":"keep","description":"ROPE 32 + EMA 0.994: 2.326, NEW BEST by combining rope32 + lower EMA!","timestamp":1777202534320,"segment":0,"confidence":1.6269113149846983,"iterationTokens":null,"asi":{"arch":"rope_dims=32 + ema=0.994","conclusion":"lower EMA decay (faster update) helps - NEW BEST!","result":"NEW BEST by combining rope32 + lower EMA"}},{"commit":"de16801","metric":2.3093,"metrics":{"artifact_mb":12.1,"best_val_bpb":2.3093,"steps":1100},"status":"keep","description":"ROPE 32 + EMA 0.994 + GRAD_CLIP 0.3: 2.309, HUGE WIN! 3% better than baseline","timestamp":1777204827391,"segment":0,"confidence":2.1512345679012386,"iterationTokens":null,"asi":{"arch":"rope32 + ema994 + clip0.3","conclusion":"tighter gradient clipping helps convergence - MAJOR win!","result":"NEW BEST - 3% better than baseline!"}}],"bestMetric":2.379,"bestDirection":"lower","metricName":"val_bpb","metricUnit":"bpb","secondaryMetrics":[{"name":"best_val_bpb","unit":""},{"name":"steps","unit":""},{"name":"artifact_mb","unit":"mb"}],"name":"Parameter Golf - Find Best Config for Sub-1 BPB","currentSegment":0,"maxExperiments":null,"confidence":2.1512345679012386},"wallClockSeconds":null},"isError":false,"timestamp":1777204837574}}
{"type":"message","id":"bc9cb9ff","parentId":"429e5aaf","timestamp":"2026-04-26T12:00:43.488Z","message":{"role":"assistant","content":[{"type":"thinking","thinking":"Great! We have another big win. Let me try combining more things with this winning config.","thinkingSignature":"c74cc4958fd50d94d47d5a25637af8bbcbe64135f50397226b302169290cb5ea"},{"type":"toolCall","id":"call_function_kxgjhomg80w5_1","name":"bash","arguments":{"command":"cd /Users/dhruv2mars/dev/github/parameter-golf && python3 experiments/pg_autoresearch.py run --name \"ar_rope32_ema994_clip03_more_$(date +%Y%m%d)\" --env \"ITERATIONS=7000\" --env \"MAX_WALLCLOCK_SECONDS=1800\" --env \"ROPE_DIMS=32\" --env \"EMA_DECAY=0.994\" --env \"GRAD_CLIP_NORM=0.3\" --env \"NUM_LAYERS=12\" --env \"MODEL_DIM=512\" --timeout 2400 2>&1"}}],"api":"anthropic-messages","provider":"minimax","model":"MiniMax-M2.7","usage":{"input":397,"output":175,"cacheRead":70752,"cacheWrite":0,"totalTokens":71324,"cost":{"input":0.0001191,"output":0.00020999999999999998,"cacheRead":0.00424512,"cacheWrite":0,"total":0.0045742199999999995}},"stopReason":"toolUse","timestamp":1777204837580,"responseId":"063d31682396ad9be7a348b3ad6db5c5"}}
{"type":"message","id":"9c9efe4c","parentId":"bc9cb9ff","timestamp":"2026-04-26T12:41:18.525Z","message":{"role":"toolResult","toolCallId":"call_function_kxgjhomg80w5_1","toolName":"bash","content":[{"type":"text","text":"{\"best_val_bpb\": null, \"compressed_bytes\": null, \"error\": null, \"metric\": 999.0, \"non_finite\": false, \"output\": \"/Users/dhruv2mars/dev/github/parameter-golf/experiments/kaggle_results/pg-auto-ar-rope32-ema994-clip03-more-20260426-4843\", \"ref\": \"dhruv2mars/pg-auto-ar-rope32-ema994-clip03-more-20260426-4843\", \"runtime_seconds\": null, \"status\": \"KernelWorkerStatus.RUNNING\", \"steps\": 0, \"ttt_val_bpb\": null, \"val_bpb\": 999.0}\n\n\nCommand exited with code 1"}],"details":{},"isError":true,"timestamp":1777207278525}}
{"type":"message","id":"6a03e943","parentId":"9c9efe4c","timestamp":"2026-04-26T12:41:24.931Z","message":{"role":"assistant","content":[{"type":"thinking","thinking":"Let me wait for it to complete.","thinkingSignature":"8c41d6dcfd223916268b7c85ea3e44d0e3b4129e2ee61ddf19236f249a6227d6"},{"type":"toolCall","id":"call_function_zg69ebkde3n8_1","name":"bash","arguments":{"command":"sleep 1800 && cd /Users/dhruv2mars/dev/github/parameter-golf && python3 experiments/pg_autoresearch.py status --ref \"dhruv2mars/pg-auto-ar-rope32-ema994-clip03-more-20260426-4843\" 2>&1"}}],"api":"anthropic-messages","provider":"minimax","model":"MiniMax-M2.7","usage":{"input":71407,"output":94,"cacheRead":64,"cacheWrite":0,"totalTokens":71565,"cost":{"input":0.0214221,"output":0.00011279999999999999,"cacheRead":0.00000384,"cacheWrite":0,"total":0.02153874}},"stopReason":"toolUse","timestamp":1777207278528,"responseId":"063d3af1ddc1c932c26598d22ad5c7fe"}}
{"type":"message","id":"8ddb9228","parentId":"6a03e943","timestamp":"2026-04-26T13:11:27.121Z","message":{"role":"toolResult","toolCallId":"call_function_zg69ebkde3n8_1","toolName":"bash","content":[{"type":"text","text":"KernelWorkerStatus.ERROR\n"}],"isError":false,"timestamp":1777209087121}}
{"type":"message","id":"aa1d46fd","parentId":"8ddb9228","timestamp":"2026-04-26T13:11:35.288Z","message":{"role":"assistant","content":[{"type":"thinking","thinking":"Timeout again. Too slow due to more layers. Let me try a different direction - exploring qk_gain which is known to be important.","thinkingSignature":"bc4ed50531982b674a72e6da5650b88b0a8f21f1b0f64497a75f5fb68786ebe2"},{"type":"toolCall","id":"call_function_ucz8weflivfq_1","name":"bash","arguments":{"command":"cd /Users/dhruv2mars/dev/github/parameter-golf && python3 experiments/pg_autoresearch.py collect --ref \"dhruv2mars/pg-auto-ar-rope32-ema994-clip03-more-20260426-4843\" --name \"rope32_ema994_clip03_more\" 2>&1"}}],"api":"anthropic-messages","provider":"minimax","model":"MiniMax-M2.7","usage":{"input":71575,"output":121,"cacheRead":0,"cacheWrite":0,"totalTokens":71696,"cost":{"input":0.0214725,"output":0.0001452,"cacheRead":0,"cacheWrite":0,"total":0.0216177}},"stopReason":"toolUse","timestamp":1777209087124,"responseId":"063d420238fb6936b742271a815c5895"}}
{"type":"message","id":"96597fc4","parentId":"aa1d46fd","timestamp":"2026-04-26T13:16:20.614Z","message":{"role":"toolResult","toolCallId":"call_function_ucz8weflivfq_1","toolName":"bash","content":[{"type":"text","text":"{\"best_val_bpb\": 2.3521, \"compressed_bytes\": null, \"error\": \"Traceback (most recent call last):\\\\n\\\"}\\n,{\\\"stream_name\\\":\\\"stderr\\\",\\\"time\\\":2492.019717965,\\\"data\\\":\\\"  File \\\\\\\"\\\\u003cfrozen runpy\\\\u003e\\\\\\\", line 198, in _run_module_as_main\\\\n\\\"}\\n,{\\\"stream_name\\\":\\\"stderr\\\",\\\"time\\\":2492.019724427,\\\"data\\\":\\\"  File \\\\\\\"\\\\u003cfrozen runpy\\\\u003e\\\\\\\", line 88, in _run_code\\\\n\\\"}\\n,{\\\"stream_name\\\":\\\"stderr\\\",\\\"time\\\":2492.01972853,\\\"data\\\":\\\"  File \\\\\\\"/usr/local/lib/python3.12/dist-packages/torch/distributed/run.py\\\\\\\", line 995, in \\\\u003cmodule\\\\u003e\\\\n\\\"}\\n,{\\\"stream_name\\\":\\\"stderr\\\",\\\"time\\\":2492.020172578,\", \"metric\": 2.3521, \"non_finite\": false, \"output\": \"/Users/dhruv2mars/dev/github/parameter-golf/experiments/kaggle_results/pg-auto-ar-rope32-ema994-clip03-more-20260426-4843\", \"ref\": \"dhruv2mars/pg-auto-ar-rope32-ema994-clip03-more-20260426-4843\", \"runtime_seconds\": null, \"status\": \"KernelWorkerStatus.ERROR\", \"steps\": 1000, \"ttt_val_bpb\": null, \"val_bpb\": 2.3521}\n"}],"isError":false,"timestamp":1777209380614}}
{"type":"message","id":"7e187792","parentId":"96597fc4","timestamp":"2026-04-26T13:16:42.825Z","message":{"role":"assistant","content":[{"type":"thinking","thinking":"12L-512d hit wallclock at 1000 steps - slower than expected. Worse than our best (2.309). Discard.","thinkingSignature":"86aee97ed9d51fe23b54405f4ced0e21c883be4d0fc7acb8dc6aa4d89b308ab4"},{"type":"toolCall","id":"call_function_qzohs7g4a4yw_1","name":"log_experiment","arguments":{"asi":{"arch":"12L-512d + rope32 + ema994 + clip0.3","conclusion":"12 layers too slow, hit wallclock early, worse than best"},"commit":"de16801","description":"12L + rope32/ema994/clip0.3: 2.352, too slow (1000 steps), worse","metric":2.3521,"metrics":{"artifact_mb":12.1,"best_val_bpb":2.3521,"steps":1000},"status":"discard"}}],"api":"anthropic-messages","provider":"minimax","model":"MiniMax-M2.7","usage":{"input":71954,"output":204,"cacheRead":64,"cacheWrite":0,"totalTokens":72222,"cost":{"input":0.0215862,"output":0.0002448,"cacheRead":0.00000384,"cacheWrite":0,"total":0.02183484}},"stopReason":"toolUse","timestamp":1777209380616,"responseId":"063d43285f8822a448fa62903d434fbf"}}
