{"type":"message","id":"606231bf","parentId":"4983b154","timestamp":"2026-04-27T13:26:41.158Z","message":{"role":"assistant","content":[{"type":"thinking","thinking":"Now I understand the current architecture. Let me implement the 3 changes:\n\n1. **SP8192 (Sequence Parallelism)**: Split sequence across GPUs for longer sequences\n2. **Parallel Residuals**: Compute attention and MLP in parallel branches\n3. **SmearGate**: A cross-layer gating mechanism\n\nLet me write the updated model code with these changes. I'll need to be careful about:\n- Memory usage with seq_len=8192\n- Gradient checkpointing for memory savings\n- Single T4 GPU (no tensor parallelism across GPUs)\n\nFor SP8192 on single T4:\n- We can use UTP (Universal Transformer) style processing or gradient checkpointing\n- The key is to support long sequences without OOM\n\nLet me create the updated implementation.","thinkingSignature":"fcedc8cf8461ebd806af9b55906c1ac6a2d47eb73f9b35923c887e5370bdfa03"},{"type":"toolCall","id":"call_function_ui0v5g6952zb_1","name":"edit","arguments":{"path":"/Users/dhruv2mars/dev/github/parameter-golf/train_kaggle.py","edits":[{"oldText":"# ============================================================================\n# HYPERPARAMETERS\n# ============================================================================\n\nclass H:\n    \"\"\"Hyperparameters - all configurable via environment variables.\"\"\"\n    \n    # Paths\n    data_path = os.environ.get(\"DATA_PATH\", \"/tmp/fineweb-pg\")\n    run_id = os.environ.get(\"RUN_ID\", str(uuid.uuid4())[:8])\n    seed = int(os.environ.get(\"SEED\", 1337))\n    checkpoint_dir = os.environ.get(\"CHECKPOINT_DIR\", _CHECKPOINT_DIR)\n    \n    # Training\n    iterations = int(os.environ.get(\"ITERATIONS\", _T4_ITERATIONS))\n    train_batch_tokens = int(os.environ.get(\"TRAIN_BATCH_TOKENS\", _T4_BATCH_TOKENS))\n    train_seq_len = int(os.environ.get(\"TRAIN_SEQ_LEN\", _T4_SEQ_LEN))\n    grad_accum_steps = int(os.environ.get(\"GRAD_ACCUM_STEPS\", _T4_GRAD_ACCUM))\n    max_wallclock_seconds = float(os.environ.get(\"MAX_WALLCLOCK_SECONDS\", _T4_MAX_WALLCLOCK))\n    warmup_steps = int(os.environ.get(\"WARMUP_STEPS\", 50))\n    warmdown_frac = float(os.environ.get(\"WARMDOWN_FRAC\", 0.72))\n    min_lr_ratio = float(os.environ.get(\"MIN_LR_RATIO\", 0.1))\n    \n    # Validation\n    val_loss_every = int(os.environ.get(\"VAL_LOSS_EVERY\", 50))\n    val_max_tokens = int(os.environ.get(\"VAL_MAX_TOKENS\", 131072))\n    \n    # Model architecture (proven SOTA config)\n    vocab_size = int(os.environ.get(\"VOCAB_SIZE\", 8192))\n    num_layers = int(os.environ.get(\"NUM_LAYERS\", 11))\n    model_dim = int(os.environ.get(\"MODEL_DIM\", 512))\n    num_heads = int(os.environ.get(\"NUM_HEADS\", 8))\n    num_kv_heads = int(os.environ.get(\"NUM_KV_HEADS\", 4))\n    mlp_mult = int(os.environ.get(\"MLP_MULT\", 4))\n    tie_embeddings = bool(int(os.environ.get(\"TIE_EMBEDDINGS\", \"1\")))\n    rope_base = float(os.environ.get(\"ROPE_BASE\", 10000.0))\n    rope_dims = int(os.environ.get(\"ROPE_DIMS\", 16))\n    logit_softcap = float(os.environ.get(\"LOGIT_SOFTCAP\", 30.0))\n    \n    # Depth recurrence (proven: layers 3-5 loop twice)\n    num_loops = int(os.environ.get(\"NUM_LOOPS\", 2))\n    loop_start = int(os.environ.get(\"LOOP_START\", 3))\n    loop_end = int(os.environ.get(\"LOOP_END\", 5))\n    enable_looping_at = float(os.environ.get(\"ENABLE_LOOPING_AT\", 0.35))\n    \n    # QK-Gain (proven: 5.25 is optimal)\n    qk_gain_init = float(os.environ.get(\"QK_GAIN_INIT\", 5.25))\n    \n    # Optimizer\n    matrix_lr = float(os.environ.get(\"MATRIX_LR\", _T4_MATRIX_LR))\n    weight_decay = float(os.environ.get(\"WEIGHT_DECAY\", 0.095))\n    beta1 = float(os.environ.get(\"BETA1\", 0.9))\n    beta2 = float(os.environ.get(\"BETA2\", 0.95))\n    adam_eps = float(os.environ.get(\"ADAM_EPS\", 1e-8))\n    grad_clip_norm = float(os.environ.get(\"GRAD_CLIP_NORM\", 1.0))\n    \n    # EMA (proven: 0.9965 is optimal)\n    ema_decay = float(os.environ.get(\"EMA_DECAY\", 0.9965))\n    \n    # Quantization\n    matrix_clip_sigmas = float(os.environ.get(\"MATRIX_CLIP_SIGMAS\", 12.85))\n    embed_clip_sigmas = float(os.environ.get(\"EMBED_CLIP_SIGMAS\", 20.0))\n    \n    # TTT (Test-Time Training) - enables via env var\n    ttt_enabled = bool(int(os.environ.get(\"TTT_ENABLED\", \"0\")))\n    ttt_lr = float(os.environ.get(\"TTT_LR\", 0.005))\n    ttt_epochs = int(os.environ.get(\"TTT_EPOCHS\", 3))\n    ttt_warmup_tokens = int(os.environ.get(\"TTT_WARMUP_TOKENS\", 32768))","newText":"# ============================================================================\n# HYPERPARAMETERS\n# ============================================================================\n\nclass H:\n    \"\"\"Hyperparameters - all configurable via environment variables.\"\"\"\n    \n    # Paths\n    data_path = os.environ.get(\"DATA_PATH\", \"/tmp/fineweb-pg\")\n    run_id = os.environ.get(\"RUN_ID\", str(uuid.uuid4())[:8])\n    seed = int(os.environ.get(\"SEED\", 1337))\n    checkpoint_dir = os.environ.get(\"CHECKPOINT_DIR\", _CHECKPOINT_DIR)\n    \n    # Training\n    iterations = int(os.environ.get(\"ITERATIONS\", _T4_ITERATIONS))\n    train_batch_tokens = int(os.environ.get(\"TRAIN_BATCH_TOKENS\", _T4_BATCH_TOKENS))\n    train_seq_len = int(os.environ.get(\"TRAIN_SEQ_LEN\", _T4_SEQ_LEN))\n    grad_accum_steps = int(os.environ.get(\"GRAD_ACCUM_STEPS\", _T4_GRAD_ACCUM))\n    max_wallclock_seconds = float(os.environ.get(\"MAX_WALLCLOCK_SECONDS\", _T4_MAX_WALLCLOCK))\n    warmup_steps = int(os.environ.get(\"WARMUP_STEPS\", 50))\n    warmdown_frac = float(os.environ.get(\"WARMDOWN_FRAC\", 0.72))\n    min_lr_ratio = float(os.environ.get(\"MIN_LR_RATIO\", 0.1))\n    \n    # Validation\n    val_loss_every = int(os.environ.get(\"VAL_LOSS_EVERY\", 50))\n    val_max_tokens = int(os.environ.get(\"VAL_MAX_TOKENS\", 131072))\n    \n    # Model architecture (proven SOTA config)\n    vocab_size = int(os.environ.get(\"VOCAB_SIZE\", 8192))\n    num_layers = int(os.environ.get(\"NUM_LAYERS\", 11))\n    model_dim = int(os.environ.get(\"MODEL_DIM\", 512))\n    num_heads = int(os.environ.get(\"NUM_HEADS\", 8))\n    num_kv_heads = int(os.environ.get(\"NUM_KV_HEADS\", 4))\n    mlp_mult = int(os.environ.get(\"MLP_MULT\", 4))\n    tie_embeddings = bool(int(os.environ.get(\"TIE_EMBEDDINGS\", \"1\")))\n    rope_base = float(os.environ.get(\"ROPE_BASE\", 10000.0))\n    rope_dims = int(os.environ.get(\"ROPE_DIMS\", 16))\n    logit_softcap = float(os.environ.get(\"LOGIT_SOFTCAP\", 30.0))\n    \n    # Depth recurrence (proven: layers 3-5 loop twice)\n    num_loops = int(os.environ.get(\"NUM_LOOPS\", 2))\n    loop_start = int(os.environ.get(\"LOOP_START\", 3))\n    loop_end = int(os.environ.get(\"LOOP_END\", 5))\n    enable_looping_at = float(os.environ.get(\"ENABLE_LOOPING_AT\", 0.35))\n    \n    # QK-Gain (proven: 5.25 is optimal)\n    qk_gain_init = float(os.environ.get(\"QK_GAIN_INIT\", 5.25))\n    \n    # Optimizer\n    matrix_lr = float(os.environ.get(\"MATRIX_LR\", _T4_MATRIX_LR))\n    weight_decay = float(os.environ.get(\"WEIGHT_DECAY\", 0.095))\n    beta1 = float(os.environ.get(\"BETA1\", 0.9))\n    beta2 = float(os.environ.get(\"BETA2\", 0.95))\n    adam_eps = float(os.environ.get(\"ADAM_EPS\", 1e-8))\n    grad_clip_norm = float(os.environ.get(\"GRAD_CLIP_NORM\", 1.0))\n    \n    # EMA (proven: 0.9965 is optimal)\n    ema_decay = float(os.environ.get(\"EMA_DECAY\", 0.9965))\n    \n    # Quantization\n    matrix_clip_sigmas = float(os.environ.get(\"MATRIX_CLIP_SIGMAS\", 12.85))\n    embed_clip_sigmas = float(os.environ.get(\"EMBED_CLIP_SIGMAS\", 20.0))\n    \n    # TTT (Test-Time Training) - enables via env var\n    ttt_enabled = bool(int(os.environ.get(\"TTT_ENABLED\", \"0\")))\n    ttt_lr = float(os.environ.get(\"TTT_LR\", 0.005))\n    ttt_epochs = int(os.environ.get(\"TTT_EPOCHS\", 3))\n    ttt_warmup_tokens = int(os.environ.get(\"TTT_WARMUP_TOKENS\", 32768))\n    \n    # ============================================================\n    # NEW FEATURES (SP8192 + Parallel Residuals + SmearGate)\n    # ============================================================\n    \n    # Sequence Parallelism (SP8192)\n    # Splits sequence across GPUs for longer context. On single GPU,\n    # we use chunked processing to save memory.\n    sp_enabled = bool(int(os.environ.get(\"SP_ENABLED\", \"1\")))\n    sp_chunk_size = int(os.environ.get(\"SP_CHUNK_SIZE\", 2048))  # Process in chunks\n    \n    # Parallel Residuals - compute attention and MLP in parallel\n    parallel_residuals = bool(int(os.environ.get(\"PARALLEL_RESIDUALS\", \"1\")))\n    \n    # SmearGate - cross-layer gating mechanism\n    # Smears information across layers via learned gating\n    smear_gate = bool(int(os.environ.get(\"SMEAR_GATE\", \"1\")))\n    smear_gate_decay = float(os.environ.get(\"SMEAR_GATE_DECAY\", 0.9))  # Decay factor\n    \n    # Gradient checkpointing for memory savings\n    use_gradient_checkpointing = bool(int(os.environ.get(\"USE_GRADIENT_CHECKPOINTING\", \"1\")))"}]}}],"api":"anthropic-messages","provider":"minimax","model":"MiniMax-M2.7","usage":{"input":40338,"output":2689,"cacheRead":9199,"cacheWrite":0,"totalTokens":52226,"cost":{"input":0.0121014,"output":0.0032267999999999997,"cacheRead":0.00055194,"cacheWrite":0,"total":0.01588014}},"stopReason":"toolUse","timestamp":1777296363273,"responseId":"063e96eb5e00b456503007974a272f30"}}
{"type":"message","id":"6a6e9980","parentId":"606231bf","timestamp":"2026-04-27T13:26:41.183Z","message":{"role":"toolResult","toolCallId":"call_function_ui0v5g6952zb_1","toolName":"edit","content":[{"type":"text","text":"Successfully replaced 1 block(s) in /Users/dhruv2mars/dev/github/parameter-golf/train_kaggle.py."}],"details":{"diff":"      ...\n  121     ttt_enabled = bool(int(os.environ.get(\"TTT_ENABLED\", \"0\")))\n  122     ttt_lr = float(os.environ.get(\"TTT_LR\", 0.005))\n  123     ttt_epochs = int(os.environ.get(\"TTT_EPOCHS\", 3))\n  124     ttt_warmup_tokens = int(os.environ.get(\"TTT_WARMUP_TOKENS\", 32768))\n+ 125     \n+ 126     # ============================================================\n+ 127     # NEW FEATURES (SP8192 + Parallel Residuals + SmearGate)\n+ 128     # ============================================================\n+ 129     \n+ 130     # Sequence Parallelism (SP8192)\n+ 131     # Splits sequence across GPUs for longer context. On single GPU,\n+ 132     # we use chunked processing to save memory.\n+ 133     sp_enabled = bool(int(os.environ.get(\"SP_ENABLED\", \"1\")))\n+ 134     sp_chunk_size = int(os.environ.get(\"SP_CHUNK_SIZE\", 2048))  # Process in chunks\n+ 135     \n+ 136     # Parallel Residuals - compute attention and MLP in parallel\n+ 137     parallel_residuals = bool(int(os.environ.get(\"PARALLEL_RESIDUALS\", \"1\")))\n+ 138     \n+ 139     # SmearGate - cross-layer gating mechanism\n+ 140     # Smears information across layers via learned gating\n+ 141     smear_gate = bool(int(os.environ.get(\"SMEAR_GATE\", \"1\")))\n+ 142     smear_gate_decay = float(os.environ.get(\"SMEAR_GATE_DECAY\", 0.9))  # Decay factor\n+ 143     \n+ 144     # Gradient checkpointing for memory savings\n+ 145     use_gradient_checkpointing = bool(int(os.environ.get(\"USE_GRADIENT_CHECKPOINTING\", \"1\")))\n  125 \n  126 \n  127 # ============================================================================\n  128 # DATA LOADING\n      ...","firstChangedLine":125},"isError":false,"timestamp":1777296401183}}
{"type":"message","id":"cb37bd49","parentId":"6a6e9980","timestamp":"2026-04-27T13:27:03.274Z","message":{"role":"assistant","content":[{"type":"thinking","thinking":"Now let me update the model components to implement the 3 changes. I need to:\n1. Update Block class for parallel residuals\n2. Add SmearGate mechanism\n3. Update the forward pass for SP8192 with gradient checkpointing\n\nLet me update the Block class and add the new components.","thinkingSignature":"3a76d87824fb71bae01b6299f932490b6a17baa90ff8fa96dc3c9d260c88ac26"},{"type":"toolCall","id":"call_function_x1n2tpmetvff_1","name":"edit","arguments":{"path":"/Users/dhruv2mars/dev/github/parameter-golf/train_kaggle.py","edits":[{"oldText":"class Block(nn.Module):\n    \"\"\"Transformer block with pre-norm and learned residuals.\"\"\"\n    def __init__(self, dim, num_heads, num_kv_heads, mlp_mult, rope_base, \n                 qk_gain_init, layer_idx, rope_dims=0):\n        super().__init__()\n        self.layer_idx = layer_idx\n        \n        self.attn_norm = RMSNorm(dim)\n        self.mlp_norm = RMSNorm(dim)\n        \n        self.attn = Attention(dim, num_heads, num_kv_heads, rope_base, qk_gain_init, rope_dims)\n        self.mlp = MLP(dim, mlp_mult)\n        \n        # Learned residual scaling (proven improvement)\n        self.attn_scale = nn.Parameter(torch.ones(dim))\n        self.mlp_scale = nn.Parameter(torch.ones(dim))\n        self.resid_mix = nn.Parameter(torch.stack((\n            torch.ones(dim), torch.zeros(dim)\n        )).float())\n        \n        # Layer scaling (deeper layers slightly smaller)\n        self.ln_scale = 1.0 / math.sqrt(layer_idx + 1)\n    \n    def forward(self, x, x0):\n        dtype = x.dtype\n        mix = self.resid_mix.to(dtype=dtype)\n        \n        # Residual mix: combine current and original residual\n        x_in = mix[0][None, None, :] * x + mix[1][None, None, :] * x0\n        \n        # Attention block\n        x = x_in + self.attn_scale.to(dtype=dtype)[None, None, :] * \\\n            self.attn(self.attn_norm(x_in) * self.ln_scale)\n        \n        # MLP block\n        x = x + self.mlp_scale.to(dtype=dtype)[None, None, :] * \\\n            self.mlp(self.mlp_norm(x) * self.ln_scale)\n        \n        return x","newText":"class Block(nn.Module):\n    \"\"\"\n    Transformer block with:\n    1. Parallel Residuals - attention and MLP computed in parallel\n    2. SmearGate - cross-layer gating for information flow\n    3. Pre-norm with learned residuals\n    \"\"\"\n    def __init__(self, dim, num_heads, num_kv_heads, mlp_mult, rope_base, \n                 qk_gain_init, layer_idx, rope_dims=0,\n                 use_parallel_residuals=True, use_smear_gate=True,\n                 smear_decay=0.9):\n        super().__init__()\n        self.layer_idx = layer_idx\n        self.use_parallel_residuals = use_parallel_residuals\n        self.use_smear_gate = use_smear_gate\n        \n        self.attn_norm = RMSNorm(dim)\n        self.mlp_norm = RMSNorm(dim)\n        \n        self.attn = Attention(dim, num_heads, num_kv_heads, rope_base, qk_gain_init, rope_dims)\n        self.mlp = MLP(dim, mlp_mult)\n        \n        # Learned residual scaling (proven improvement)\n        self.attn_scale = nn.Parameter(torch.ones(dim))\n        self.mlp_scale = nn.Parameter(torch.ones(dim))\n        self.resid_mix = nn.Parameter(torch.stack((\n            torch.ones(dim), torch.zeros(dim)\n        )).float())\n        \n        # ============================================================\n        # SmearGate - cross-layer information gating\n        # ============================================================\n        if use_smear_gate:\n            # Gate that smears information from previous layers\n            self.smear_gate = nn.Parameter(torch.ones(dim) * smear_decay)\n            self.smear_proj = CastedLinear(dim, dim)  # Project smear info\n        else:\n            self.smear_gate = None\n            self.smear_proj = None\n        \n        # Layer scaling (deeper layers slightly smaller)\n        self.ln_scale = 1.0 / math.sqrt(layer_idx + 1)\n    \n    def forward(self, x, x0, smear_state=None):\n        dtype = x.dtype\n        mix = self.resid_mix.to(dtype=dtype)\n        \n        # Residual mix: combine current and original residual\n        x_in = mix[0][None, None, :] * x + mix[1][None, None, :] * x0\n        \n        # ============================================================\n        # Apply SmearGate from previous layer's output\n        # ============================================================\n        if self.use_smear_gate and smear_state is not None:\n            gate = torch.sigmoid(self.smear_gate.to(dtype=dtype))\n            smear = self.smear_proj(smear_state)\n            x_in = x_in + gate[None, None, :] * smear\n        \n        # ============================================================\n        # Parallel Residuals: compute attn and MLP in parallel\n        # ============================================================\n        if self.use_parallel_residuals:\n            # Pre-norm both branches\n            attn_in = self.attn_norm(x_in) * self.ln_scale\n            mlp_in = self.mlp_norm(x_in) * self.ln_scale\n            \n            # Compute in parallel (manual implementation to ensure execution)\n            attn_out = self.attn(attn_in)\n            mlp_out = self.mlp(mlp_in)\n            \n            # Apply residual connections\n            x = x_in\n            x = x + self.attn_scale.to(dtype=dtype)[None, None, :] * attn_out\n            x = x + self.mlp_scale.to(dtype=dtype)[None, None, :] * mlp_out\n        else:\n            # Sequential (original)\n            x = x_in + self.attn_scale.to(dtype=dtype)[None, None, :] * \\\n                self.attn(self.attn_norm(x_in) * self.ln_scale)\n            x = x + self.mlp_scale.to(dtype=dtype)[None, None, :] * \\\n                self.mlp(self.mlp_norm(x) * self.ln_scale)\n        \n        return x"}]}}],"api":"anthropic-messages","provider":"minimax","model":"MiniMax-M2.7","usage":{"input":43068,"output":1477,"cacheRead":9199,"cacheWrite":0,"totalTokens":53744,"cost":{"input":0.012920399999999999,"output":0.0017724,"cacheRead":0.00055194,"cacheWrite":0,"total":0.01524474}},"stopReason":"toolUse","timestamp":1777296401185,"responseId":"063e97115c69629d052b0d90e2c57085"}}
