{"type":"message","id":"54ad260f","parentId":"124ffa76","timestamp":"2026-04-27T11:01:58.373Z","message":{"role":"assistant","content":[{"type":"thinking","thinking":"Stuck in rebase. Let me abort and do a clean reset.","thinkingSignature":"5e0c039b6b3974e70a998ec296137e0041cf936f7fe13ca7e7a9564539c0d897"},{"type":"toolCall","id":"call_function_uolkapbttbl7_1","name":"bash","arguments":{"command":"cd /Users/dhruv2mars/dev/github/parameter-golf && git rebase --abort 2>&1 && git fetch origin && git reset --hard origin/main 2>&1"}}],"api":"anthropic-messages","provider":"minimax","model":"MiniMax-M2.7","usage":{"input":34181,"output":79,"cacheRead":9348,"cacheWrite":0,"totalTokens":43608,"cost":{"input":0.0102543,"output":0.0000948,"cacheRead":0.0005608799999999999,"cacheWrite":0,"total":0.01090998}},"stopReason":"toolUse","timestamp":1777287714101,"responseId":"063e7522cca56317e94ebee9df29d252"}}
{"type":"message","id":"fba0f985","parentId":"54ad260f","timestamp":"2026-04-27T11:01:59.439Z","message":{"role":"toolResult","toolCallId":"call_function_uolkapbttbl7_1","toolName":"bash","content":[{"type":"text","text":"HEAD is now at 4f76b43 feat: add optimized train_kaggle.py pipeline\n"}],"isError":false,"timestamp":1777287719439}}
{"type":"message","id":"5e99e7c7","parentId":"fba0f985","timestamp":"2026-04-27T11:02:02.500Z","message":{"role":"assistant","content":[{"type":"thinking","thinking":"Good. Now on origin/main with the commit. Let me verify and push.","thinkingSignature":"8b68eae919d2270e6fee9e3171052facc87ad7faecf68bf3cf7c2ea90026bcee"},{"type":"toolCall","id":"call_function_qw47cel6szyh_1","name":"bash","arguments":{"command":"cd /Users/dhruv2mars/dev/github/parameter-golf && git log --oneline -3 && echo \"---\" && git status"}}],"api":"anthropic-messages","provider":"minimax","model":"MiniMax-M2.7","usage":{"input":34295,"output":71,"cacheRead":9348,"cacheWrite":0,"totalTokens":43714,"cost":{"input":0.010288499999999999,"output":0.0000852,"cacheRead":0.0005608799999999999,"cacheWrite":0,"total":0.01093458}},"stopReason":"toolUse","timestamp":1777287719447,"responseId":"063e752787569da3a8f6337538f4d906"}}
{"type":"message","id":"b3c18ccb","parentId":"5e99e7c7","timestamp":"2026-04-27T11:02:02.563Z","message":{"role":"toolResult","toolCallId":"call_function_qw47cel6szyh_1","toolName":"bash","content":[{"type":"text","text":"4f76b43 feat: add optimized train_kaggle.py pipeline\n7427de2 Update README leaderboard with recent record submissions + revert bad merges (#1806)\n8b148a0 Record: Scylla + Full GPTQ + XSA-all + FA3 — val_bpb 0.9485 (3-seed mean) (#1184)\n---\nOn branch main\nYour branch is ahead of 'upstream/main' by 1 commit.\n  (use \"git push\" to publish your local commits)\n\nUntracked files:\n  (use \"git add <file>...\" to include in what will be committed)\n\tkaggle_pull/\n\nnothing added to commit but untracked files present (use \"git add\" to track)\n"}],"isError":false,"timestamp":1777287722563}}
{"type":"message","id":"85c436f6","parentId":"b3c18ccb","timestamp":"2026-04-27T11:02:05.314Z","message":{"role":"assistant","content":[{"type":"thinking","thinking":"Good. On origin/main, clean. Your commit is 4f76b43. Let me push.","thinkingSignature":"957b9c26afafc9ea7d07125a147b3a23ef299b54c9125e711e336945fdcbbd0a"},{"type":"toolCall","id":"call_function_9907owrzqoza_1","name":"bash","arguments":{"command":"cd /Users/dhruv2mars/dev/github/parameter-golf && git push origin main 2>&1"}}],"api":"anthropic-messages","provider":"minimax","model":"MiniMax-M2.7","usage":{"input":34532,"output":70,"cacheRead":9348,"cacheWrite":0,"totalTokens":43950,"cost":{"input":0.0103596,"output":0.000084,"cacheRead":0.0005608799999999999,"cacheWrite":0,"total":0.01100448}},"stopReason":"toolUse","timestamp":1777287722568,"responseId":"063e752a7f072355dcf81c38a40801a5"}}
{"type":"message","id":"7f512757","parentId":"85c436f6","timestamp":"2026-04-27T11:02:06.263Z","message":{"role":"toolResult","toolCallId":"call_function_9907owrzqoza_1","toolName":"bash","content":[{"type":"text","text":"Everything up-to-date\n"}],"isError":false,"timestamp":1777287726263}}
{"type":"message","id":"2d09798b","parentId":"7f512757","timestamp":"2026-04-27T11:02:08.979Z","message":{"role":"assistant","content":[{"type":"thinking","thinking":"Already pushed. Good to go.","thinkingSignature":"69a64918cefffe556bf65c66e9a652c39ee7317b8a3f030b4e73e3b73882d7b6"},{"type":"text","text":"**Done. Clean and pushed.**\n\n```\nmain: 4f76b43 feat: add optimized train_kaggle.py pipeline\n```\n\nClean state. Ready for next phase."}],"api":"anthropic-messages","provider":"minimax","model":"MiniMax-M2.7","usage":{"input":34622,"output":46,"cacheRead":9348,"cacheWrite":0,"totalTokens":44016,"cost":{"input":0.0103866,"output":0.0000552,"cacheRead":0.0005608799999999999,"cacheWrite":0,"total":0.011002679999999999}},"stopReason":"stop","timestamp":1777287726267,"responseId":"063e752e84c08287cc93986f014bbb7e"}}
{"type":"message","id":"56ab8fac","parentId":"2d09798b","timestamp":"2026-04-27T11:05:43.535Z","message":{"role":"user","content":[{"type":"text","text":"ok, there is a major update. our kaggle quota has finished. so we have shifted to lightning.ai as they have gpu quota on free tier. checkout their docs to know more. i have a studio currently running. i want you to use that for the gpu training. setup that, see current repo and find relevant files. make sure everything works and runs smoothly. also setup such that you can perform terminal tasks and other stuff in studio by your own. if you need anything, want more context, ask me."}],"timestamp":1777287943524}}
{"type":"message","id":"1ffc62fc","parentId":"56ab8fac","timestamp":"2026-04-27T11:05:54.730Z","message":{"role":"assistant","content":[{"type":"thinking","thinking":"The user has switched from Kaggle to Lightning AI for GPU training. They have a studio running and want me to set it up. Let me:\n\n1. Check the Lightning AI setup files that were added in the autoresearch branch\n2. Understand the current repo structure\n3. Set up the environment for Lightning AI training\n4. Make sure everything works\n\nLet me start by checking what Lightning AI files exist in the repo.","thinkingSignature":"370800f61a91f25f0ae0c1b5c66cd270e487d49a2e10bc61c0d26360865d4532"},{"type":"toolCall","id":"call_function_765xf7190lz9_1","name":"bash","arguments":{"command":"cd /Users/dhruv2mars/dev/github/parameter-golf && find . -name \"*lightning*\" -o -name \"*lightning*\" 2>/dev/null | head -10"}},{"type":"toolCall","id":"call_function_765xf7190lz9_2","name":"bash","arguments":{"command":"cd /Users/dhruv2mars/dev/github/parameter-golf && git show HEAD:lightning_setup.sh 2>/dev/null | head -50"}},{"type":"toolCall","id":"call_function_765xf7190lz9_3","name":"bash","arguments":{"command":"cd /Users/dhruv2mars/dev/github/parameter-golf && git show HEAD:run_lightning.sh 2>/dev/null | head -50"}}],"api":"anthropic-messages","provider":"minimax","model":"MiniMax-M2.7","usage":{"input":13,"output":252,"cacheRead":9348,"cacheWrite":34385,"totalTokens":43998,"cost":{"input":0.0000039,"output":0.0003024,"cacheRead":0.0005608799999999999,"cacheWrite":0.012894375,"total":0.013761555}},"stopReason":"toolUse","timestamp":1777287943535,"responseId":"063e760ad1aab606e8b6f8d8569884be"}}
{"type":"message","id":"951893a5","parentId":"1ffc62fc","timestamp":"2026-04-27T11:05:54.851Z","message":{"role":"toolResult","toolCallId":"call_function_765xf7190lz9_1","toolName":"bash","content":[{"type":"text","text":"(no output)"}],"isError":false,"timestamp":1777287954851}}
{"type":"message","id":"65e207cc","parentId":"951893a5","timestamp":"2026-04-27T11:05:54.851Z","message":{"role":"toolResult","toolCallId":"call_function_765xf7190lz9_2","toolName":"bash","content":[{"type":"text","text":"(no output)"}],"isError":false,"timestamp":1777287954851}}
{"type":"message","id":"a1728f6c","parentId":"65e207cc","timestamp":"2026-04-27T11:05:54.853Z","message":{"role":"toolResult","toolCallId":"call_function_765xf7190lz9_3","toolName":"bash","content":[{"type":"text","text":"(no output)"}],"isError":false,"timestamp":1777287954851}}
{"type":"message","id":"8293ad84","parentId":"a1728f6c","timestamp":"2026-04-27T11:05:58.939Z","message":{"role":"assistant","content":[{"type":"thinking","thinking":"Those files weren't in the commit that got pushed. Let me check what's in the current repo and see if there's a way to connect to the Lightning AI studio.","thinkingSignature":"a5b6de40c42ef24d9489589320bf4fd33e8ec6b30631e566e06103e47786332d"},{"type":"toolCall","id":"call_function_go576vq5yhrb_1","name":"bash","arguments":{"command":"cd /Users/dhruv2mars/dev/github/parameter-golf && ls -la && git show autoresearch/phase1-20260426:lightning_setup.sh 2>/dev/null | head -80"}}],"api":"anthropic-messages","provider":"minimax","model":"MiniMax-M2.7","usage":{"input":34674,"output":101,"cacheRead":9348,"cacheWrite":0,"totalTokens":44123,"cost":{"input":0.0104022,"output":0.00012119999999999999,"cacheRead":0.0005608799999999999,"cacheWrite":0,"total":0.01108428}},"stopReason":"toolUse","timestamp":1777287954855,"responseId":"063e76133390e0b9bcd2ee76a1f5716f"}}
{"type":"message","id":"f06f6879","parentId":"8293ad84","timestamp":"2026-04-27T11:05:58.977Z","message":{"role":"toolResult","toolCallId":"call_function_go576vq5yhrb_1","toolName":"bash","content":[{"type":"text","text":"total 376\ndrwxr-xr-x@ 22 dhruv2mars  staff    704 27 Apr 16:33 .\ndrwxr-xr-x@ 20 dhruv2mars  staff    640 27 Apr 15:56 ..\ndrwxr-x---@  4 dhruv2mars  staff    128 27 Apr 16:33 .claude\ndrwxr-x---@  5 dhruv2mars  staff    160 27 Apr 16:33 .codex\ndrwxr-xr-x@  7 dhruv2mars  staff    224 27 Apr 16:35 .entire\ndrwxr-x---@  3 dhruv2mars  staff     96 27 Apr 16:33 .factory\ndrwxr-x---@  4 dhruv2mars  staff    128 27 Apr 16:33 .gemini\ndrwxr-xr-x@ 17 dhruv2mars  staff    544 27 Apr 16:35 .git\n-rw-r--r--@  1 dhruv2mars  staff    259 27 Apr 16:31 .gitignore\ndrwxr-xr-x@  3 dhruv2mars  staff     96 27 Apr 16:33 .opencode\ndrwxr-xr-x@  9 dhruv2mars  staff    288 24 Apr 00:39 data\ndrwxr-xr-x@  3 dhruv2mars  staff     96 27 Apr 16:31 experiments\ndrwxr-xr-x@  6 dhruv2mars  staff    192 24 Apr 20:51 kaggle_pull\n-rw-r--r--@  1 dhruv2mars  staff   1063 24 Apr 00:25 LICENSE\n-rw-r--r--@  1 dhruv2mars  staff  24483 27 Apr 16:31 README.md\ndrwxr-xr-x@  4 dhruv2mars  staff    128 24 Apr 00:25 records\n-rw-r--r--@  1 dhruv2mars  staff    109 24 Apr 00:25 requirements.txt\n-rwxr-xr-x@  1 dhruv2mars  staff   4486 27 Apr 16:31 run_train.sh\n-rw-r--r--@  1 dhruv2mars  staff   1341 24 Apr 00:25 THIRD_PARTY_NOTICES.md\n-rw-r--r--@  1 dhruv2mars  staff  50195 24 Apr 00:25 train_gpt_mlx.py\n-rw-r--r--@  1 dhruv2mars  staff  47686 24 Apr 00:25 train_gpt.py\n-rw-r--r--@  1 dhruv2mars  staff  38627 27 Apr 16:31 train_kaggle.py\n#!/bin/bash\n# =============================================================================\n# Lightning AI - One-Time Setup Script\n# =============================================================================\n# Run this ONCE when you create a new Studio to set up the environment.\n# =============================================================================\n\nset -euo pipefail\n\necho \"==========================================\"\necho \"Parameter Golf - Lightning AI Setup\"\necho \"==========================================\"\n\n# Configuration\nREPO_URL=\"https://github.com/Dhruv2mars/parameter-golf.git\"\nREPO_DIR=\"/teamspace/studios/this_studio/parameter-golf\"\nVOCAB_SIZE=${1:-1024}  # Default 1024 (works), pass 8192 as arg if needed\n\n# =============================================================================\n# 1. Install CLI if not present\n# =============================================================================\n\necho \"[1/5] Checking Lightning CLI...\"\nif ! command -v lightning &> /dev/null; then\n    echo \"Installing Lightning CLI...\"\n    pip install lightning -q\n    lightning login\nelse\n    echo \"CLI already installed\"\nfi\n\n# =============================================================================\n# 2. Clone repo\n# =============================================================================\n\necho \"[2/5] Setting up repository...\"\ncd /teamspace/studios/this_studio/parameter-golf\n\nif [ -d \"$REPO_DIR\" ]; then\n    echo \"Repo already exists, pulling latest...\"\n    cd \"$REPO_DIR\"\n    git pull origin main\nelse\n    echo \"Cloning repository...\"\n    git clone \"$REPO_URL\" \"$REPO_DIR\"\n    cd \"$REPO_DIR\"\nfi\n\n# =============================================================================\n# 3. Install dependencies\n# =============================================================================\n\necho \"[3/5] Installing dependencies...\"\npip install --upgrade pip -q\npip install numpy sentencepiece torch torchvision torchaudio huggingface-hub tqdm -q\n\n# Verify torch + CUDA\npython -c \"import torch; print(f'PyTorch: {torch.__version__}'); print(f'CUDA available: {torch.cuda.is_available()}')\"\n\n# =============================================================================\n# 4. Download FineWeb data\n# =============================================================================\n\necho \"[4/5] Downloading FineWeb dataset (vocab=$VOCAB_SIZE)...\"\ncd \"$REPO_DIR\"\n\n# Create directories\nmkdir -p data/datasets/fineweb10B_sp${VOCAB_SIZE}\nmkdir -p data/tokenizers\nmkdir -p checkpoints\nmkdir -p logs\n\n# Download using the existing script\npython3 data/cached_challenge_fineweb.py --variant sp${VOCAB_SIZE} --train-shards 2\n\necho \"Data download complete\"\n\n# =============================================================================\n# 5. Verify setup\n# =============================================================================\n"}],"isError":false,"timestamp":1777287958977}}
{"type":"message","id":"19441ffb","parentId":"f06f6879","timestamp":"2026-04-27T11:06:07.538Z","message":{"role":"assistant","content":[{"type":"thinking","thinking":"I see the Lightning AI setup script from the branch that wasn't pushed. Now I need to understand the current situation:\n\n1. The user has a Lightning AI studio running\n2. They want me to set up training there\n3. I need to connect to it and make sure things work\n\nLet me check the skill docs for Lightning AI and also see if there's a way to connect to the studio.","thinkingSignature":"06bc087677cd6df724544d6de4db70f0424e94fcf6a06f90e1091066edec0d50"},{"type":"toolCall","id":"call_function_xndtg7qsmr1p_1","name":"bash","arguments":{"command":"which lightning 2>/dev/null || echo \"no lightning cli\""}},{"type":"toolCall","id":"call_function_xndtg7qsmr1p_2","name":"bash","arguments":{"command":"lightning --version 2>/dev/null || echo \"lightning not installed locally\""}}],"api":"anthropic-messages","provider":"minimax","model":"MiniMax-M2.7","usage":{"input":35966,"output":154,"cacheRead":9348,"cacheWrite":0,"totalTokens":45468,"cost":{"input":0.010789799999999999,"output":0.0001848,"cacheRead":0.0005608799999999999,"cacheWrite":0,"total":0.011535479999999999}},"stopReason":"toolUse","timestamp":1777287958983,"responseId":"063e76176cbc1308e38acc871ab00715"}}
{"type":"message","id":"1ee2c851","parentId":"19441ffb","timestamp":"2026-04-27T11:06:07.567Z","message":{"role":"toolResult","toolCallId":"call_function_xndtg7qsmr1p_1","toolName":"bash","content":[{"type":"text","text":"no lightning cli\n"}],"isError":false,"timestamp":1777287967567}}
{"type":"message","id":"f844458b","parentId":"1ee2c851","timestamp":"2026-04-27T11:06:07.567Z","message":{"role":"toolResult","toolCallId":"call_function_xndtg7qsmr1p_2","toolName":"bash","content":[{"type":"text","text":"lightning not installed locally\n"}],"isError":false,"timestamp":1777287967567}}
{"type":"message","id":"8fe14d79","parentId":"f844458b","timestamp":"2026-04-27T11:06:13.215Z","message":{"role":"assistant","content":[{"type":"thinking","thinking":"Lightning CLI isn't installed locally. I need to understand how to connect to the user's Lightning AI studio. Let me ask the user for the connection details or studio ID.\n\nActually, let me check what the skill docs say about Lightning AI first.","thinkingSignature":"aa1de3b979751adf2ccecf3ad72de1aadefb2fd209112cb8a9d4e4f327c20120"},{"type":"toolCall","id":"call_function_u2v3z5gnc8vf_1","name":"read","arguments":{"path":"/Users/dhruv2mars/.pi/agent/skills/vercel-deploy/SKILL.md","limit":10}},{"type":"toolCall","id":"call_function_u2v3z5gnc8vf_2","name":"bash","arguments":{"command":"find /Users/dhruv2mars/.pi/agent -name \"*lightning*\" 2>/dev/null | head -5"}}],"api":"anthropic-messages","provider":"minimax","model":"MiniMax-M2.7","usage":{"input":36145,"output":149,"cacheRead":9348,"cacheWrite":0,"totalTokens":45642,"cost":{"input":0.010843499999999999,"output":0.00017879999999999998,"cacheRead":0.0005608799999999999,"cacheWrite":0,"total":0.011583179999999998}},"stopReason":"toolUse","timestamp":1777287967573,"responseId":"063e761fd8ae98f55a08cf87e3d36d86"}}
{"type":"message","id":"ef95b01c","parentId":"8fe14d79","timestamp":"2026-04-27T11:06:13.392Z","message":{"role":"toolResult","toolCallId":"call_function_u2v3z5gnc8vf_1","toolName":"read","content":[{"type":"text","text":"---\nname: vercel-deploy\ndescription: Deploy applications and websites to Vercel. Use when the user requests deployment actions like \"deploy my app\", \"deploy and give me the link\", \"push this live\", or \"create a preview deployment\".\n---\n\n# Vercel Deploy\n\nDeploy any project to Vercel instantly. **Always deploy as preview** (not production) unless the user explicitly asks for production.\n\n## Prerequisites\n\n[68 more lines in file. Use offset=11 to continue.]"}],"isError":false,"timestamp":1777287973392}}
{"type":"message","id":"7034082a","parentId":"ef95b01c","timestamp":"2026-04-27T11:06:13.392Z","message":{"role":"toolResult","toolCallId":"call_function_u2v3z5gnc8vf_2","toolName":"bash","content":[{"type":"text","text":"(no output)"}],"isError":false,"timestamp":1777287973392}}
{"type":"message","id":"b1760c04","parentId":"7034082a","timestamp":"2026-04-27T11:06:21.369Z","message":{"role":"assistant","content":[{"type":"thinking","thinking":"No Lightning AI skill found. I need to understand how to connect to the user's Lightning AI studio. Let me ask the user for:\n1. The studio URL or ID\n2. How to connect to it (SSH? Web terminal? API?)\n\nActually, looking at the Lightning AI setup script, it mentions `/teamspace/studios/this_studio/`. This suggests the studio might have a specific URL or connection method.\n\nLet me ask the user how to connect to their Lightning AI studio.","thinkingSignature":"64134308f592f23aa5563eea2c54091690caccf246dee65f43e39003dde07443"},{"type":"text","text":"Need connection details. How do I access your Lightning AI studio?\n\nOptions:\n1. **Studio URL** — e.g., `lightning.ai/studios/yourname/...`\n2. **SSH access** — IP/hostname + credentials\n3. **API token** — for `lightning` CLI remote commands\n4. **Workspace credentials** — username/password for web terminal\n\nWhat's available?"}],"api":"anthropic-messages","provider":"minimax","model":"MiniMax-M2.7","usage":{"input":36414,"output":189,"cacheRead":9348,"cacheWrite":0,"totalTokens":45951,"cost":{"input":0.0109242,"output":0.00022679999999999998,"cacheRead":0.0005608799999999999,"cacheWrite":0,"total":0.01171188}},"stopReason":"stop","timestamp":1777287973395,"responseId":"063e7626f16c9df938658d48074a103c"}}
{"type":"message","id":"ff03db6c","parentId":"b1760c04","timestamp":"2026-04-27T11:06:43.890Z","message":{"role":"user","content":[{"type":"text","text":"what do u need? for the setup"}],"timestamp":1777288003882}}
{"type":"message","id":"177654f0","parentId":"ff03db6c","timestamp":"2026-04-27T11:06:54.540Z","message":{"role":"assistant","content":[{"type":"thinking","thinking":"The user is asking what I need to set up Lightning AI training. Let me think about what I need:\n\n1. Access to the studio - SSH or web\n2. GPU availability info\n3. Current state of the repo on the studio\n4. Any existing setup already done\n\nLet me ask the user what they have available.","thinkingSignature":"5689d89b833e0284dc669b4b0bed1f0d5af80ef736990216d9db2db4e2dc081e"},{"type":"text","text":"To connect and run training:\n\n1. **Studio URL** — so I can access the terminal/shell\n2. **Or SSH credentials** — IP, username, password/key\n3. **Or API token** — for `lightning` CLI\n\nWhat's your studio URL or how do you access it?"}],"api":"anthropic-messages","provider":"minimax","model":"MiniMax-M2.7","usage":{"input":13,"output":135,"cacheRead":44008,"cacheWrite":1578,"totalTokens":45734,"cost":{"input":0.0000039,"output":0.00016199999999999998,"cacheRead":0.0026404799999999997,"cacheWrite":0.00059175,"total":0.00339813}},"stopReason":"stop","timestamp":1777288003890,"responseId":"063e76463c9f8e0122fa491696ef18d9"}}
{"type":"message","id":"39f0a682","parentId":"177654f0","timestamp":"2026-04-27T11:07:53.142Z","message":{"role":"user","content":[{"type":"text","text":"REDACTED \nREDACTED \nlightning login\n\nurl: https://lightning.ai/dhruv2mars/default-project/studios/parameter-golf/code\n\nanything more?"}],"timestamp":1777288073135}}
