{"type":"compaction","id":"e5376bb8","parentId":"62ad119c","timestamp":"2026-04-27T09:26:07.515Z","summary":"\n\n## Goal\n- Learn how to use the pi-autoresearch extension for autonomous experiment loops\n- Build the best language model that fits under **16MB** with sub-1 bpb (ideally **0.5–0.6 bpb**) for the **openai parameter-golf challenge** on the PB leaderboard\n- **Autoresearch scope**: Find best config (architecture + TTT + PPM + hyperparameters) via 30-min runs\n- **Winning config**: Run extended training (6-12 hr) to hit sub-1\n\n## Constraints & Preferences\n- Model must fit under **16MB**\n- Training via **Kaggle** with **2x T4 GPUs**\n- **No parallel runs** (Kaggle parallelization doesn't work well)\n- **Manual monitoring** required — user gets results/errors directly\n- **30hrs/week GPU quota**, **12hr max session**\n- Sequential runs only\n- Planned improvements: (1) extended training, (2) TTT, (3) PPM hybrid\n- Architecture already at \"decent levels\"\n\n## Progress\n### Done\n- [x] User learned how to use pi-autoresearch (read `SKILL.md` for `autoresearch-create`)\n- [x] **Grill-me interview completed** — validated the plan before setting up autoresearch\n- [x] **Identified core tension**: Extended training (6+ hr) = real gains but useless for autoresearch iteration loops; 30-min runs are the sweet spot\n- [x] **Confirmed strategy**: Autoresearch → 30-min runs → find best config → extended training for final push to sub-1\n- [x] **Planned 30-min baseline run**: 1800s wallclock, 7000 iterations\n\n### In Progress\n- [ ] **Phase 1: 30-min baseline run** — User will push to Kaggle to establish actual BPB at 30 min\n\n### Blocked\n- [none]\n\n## Key Decisions\n- **Grill-me first**: User wants to validate the plan before setting up autoresearch loop\n- **Autoresearch not yet initialized**: Awaiting grill-me outcome to define goal, metric, command, files in scope, and constraints\n- **[TTT untested]**: TTT is defined in `train_kaggle.py` but disabled (`TTT_ENABLED=0`) and never tested on T4 — must verify it works before optimizing\n- **[PPM not implemented]**: PPM hybrid exists only as a concept; needs implementation or integration before it can be in the search space\n- **[30-min baseline first]**: Establish actual BPB before designing search space — tells us how much TTT/PPM need to close the gap\n- **[Extended training excluded from autoresearch loop]**: 6-12 hr runs are too slow for iteration; they are the final step after finding winning config\n\n## Next Steps\n1. **User pushes 30-min run to Kaggle** — Config: `MAX_WALLCLOCK_SECONDS=1800`, `ITERATIONS=7000`\n2. **Phase 2: Analysis** — Check actual BPB vs expected, audit TTT/PPM status in code, determine gap to sub-1\n3. **Phase 3: Autoresearch Setup** — Write `autoresearch.md` (search space, metrics, constraints), write `autoresearch.sh` (runs 30-min experiment, outputs `METRIC val_bpb=X`)\n4. **Initialize autoresearch** — Run `init_experiment` with `direction=lower` (bpb), baseline run, `log_experiment`, start loop\n5. **Phase 4: Autoresearch Loop** — Tries architecture/hyperparameter/TTT/PPM changes via 30-min runs, keeps winners, discards losers\n6. **Phase 5: Winning Run** — Identify best config from autoresearch, run extended (6-12 hr) training to hit sub-1\n\n## Critical Context\n- **Extension path**: `/Users/dhruv2mars/.pi/agent/git/github.com/davebcn87/pi-autoresearch/skills/autoresearch-create/SKILL.md`\n- **Grill-me skill**: `/Users/dhruv2mars/.pi/agent/skills/grill-me/SKILL.md`\n- **T4 performance**: ~258ms/step estimated (6x slower than H100's ~43ms/step)\n- **Training throughput**: 8192 tokens/step, 6 hr ≈ 83,700 steps ≈ 686M tokens\n- **Best SOTA from records**: ~1.08-1.12 BPB (10-min runs on 8xH100); user target 0.5-0.6 BPB\n- **Current architecture** (already decent): 11L x 512d x 8H / 4KV tied embeddings, SP8192 tokenizer, depth recurrence (layers 3-5 loop 2x), QK-Gain 5.25, RoPE 16 dims, GPTQ int6/int8\n- **TTT status**: Defined but disabled, never tested on T4\n- **PPM status**: Not implemented yet\n- **Kaggle workflow**: One run = one val_bpb measurement, sequential, manual monitoring\n- **Key math**: 10-min on 8xH100 ≈ 30-min on 2xT4 (SOTA 1.08 BPB → user might need 30 min to reach similar)\n- **Metric**: `bpb` (lower is better)\n\n## Key Insights from Grill-Me\n- **Scaling curve unknown**: User has not run 30-min or extended runs yet; 10-min baseline (~2.65 BPB) is the only reference\n- **TTT/PPM are necessary**: User confirmed these are required to close gap from 30-min BPB → 0.5-0.6 BPB\n- **Architecture is proven**: Current stack matches SOTA approach; bottleneck is compute, not architecture design\n- **Iteration loop**: Code change → Push to Kaggle → Wait 10-20 min → Check val_bpb → Next idea\n\n---\n\n**Turn Context (split turn):**\n\n\n\n## Original Request\nUser asked to run full autoresearch loop through 5 phases, keeping going until best config found and extended run time. Set iterations to unlimited. Cheered \"HAIL MAINLAND CHINA!! GO FULL BONKERS!\"\n\n## Early Progress\n- Launched 30-min baseline (ITERATIONS=7000, MAX_WALLCLOCK=1800) → **2.379 BPB** (1155 steps, still improving)\n- Set up autoresearch.sh and autoresearch.md on branch `autoresearch/phase1-20260426`\n- Initialized experiment session with val_bpb as metric (lower is better)\n- Attempted to enable TTT — found 2 bugs: CastedLinear dtype mismatch and attention OOM from `.float()`. Both were reverted via `discard` — TTT is broken/OOM-prone on T4, skipped\n- Ran 31 autorun experiments systematically testing architecture and hyperparameter changes. Key pattern: any change that slows training causes underfitting (wallclock hits first). Wins found:\n  - **ROPE_DIMS=32**: massive win → 2.331 (2% better than baseline)\n  - **ROPE_32 + EMA=0.994**: further improvement → 2.326\n  - **ROPE_32 + EMA=0.994 + GRAD_CLIP=0.3**: best yet → **2.309** (3% better than baseline)\n\n## Context for Suffix\n- Currently at experiment #31 out of ongoing loop\n- Best config identified: **11L-512d, ROPE_32, EMA_0.994, GRAD_CLIP_0.3** → 2.309 BPB\n- TTT confirmed broken, skipped\n- Gap to sub-1 still ~1.3 BPB — will need extended training + PPM\n- Recent experiment (qk6.0) just logged as discard\n- Loop continuing with more hyperparameter exploration\n\n<read-files>\n/Users/dhruv2mars/.pi/agent/git/github.com/davebcn87/pi-autoresearch/skills/autoresearch-create/SKILL.md\n/Users/dhruv2mars/.pi/agent/skills/grill-me/SKILL.md\n/Users/dhruv2mars/dev/github/parameter-golf/PROGRESS.md\n/Users/dhruv2mars/dev/github/parameter-golf/README.md\n/Users/dhruv2mars/dev/github/parameter-golf/experiments/kaggle_results/pg-auto-30min-baseline-20260426-41891/logs/30min-baseline-20260426.rank0.txt\n/Users/dhruv2mars/dev/github/parameter-golf/experiments/kaggle_state.json\n/Users/dhruv2mars/dev/github/parameter-golf/experiments/pg_autoresearch.py\n/Users/dhruv2mars/dev/github/parameter-golf/records/track_10min_16mb/2026-03-19_Seq2048_FP16Emb_TunedLR/train_seed42.log\n/Users/dhruv2mars/dev/github/parameter-golf/run_train.sh\n/Users/dhruv2mars/dev/github/parameter-golf/run_train_ttt.sh\n</read-files>\n\n<modified-files>\n/Users/dhruv2mars/dev/github/parameter-golf/autoresearch.md\n/Users/dhruv2mars/dev/github/parameter-golf/autoresearch.sh\n/Users/dhruv2mars/dev/github/parameter-golf/train_kaggle.py\n</modified-files>","firstKeptEntryId":"17e2a619","tokensBefore":101224,"details":{"readFiles":["/Users/dhruv2mars/.pi/agent/git/github.com/davebcn87/pi-autoresearch/skills/autoresearch-create/SKILL.md","/Users/dhruv2mars/.pi/agent/skills/grill-me/SKILL.md","/Users/dhruv2mars/dev/github/parameter-golf/PROGRESS.md","/Users/dhruv2mars/dev/github/parameter-golf/README.md","/Users/dhruv2mars/dev/github/parameter-golf/experiments/kaggle_results/pg-auto-30min-baseline-20260426-41891/logs/30min-baseline-20260426.rank0.txt","/Users/dhruv2mars/dev/github/parameter-golf/experiments/kaggle_state.json","/Users/dhruv2mars/dev/github/parameter-golf/experiments/pg_autoresearch.py","/Users/dhruv2mars/dev/github/parameter-golf/records/track_10min_16mb/2026-03-19_Seq2048_FP16Emb_TunedLR/train_seed42.log","/Users/dhruv2mars/dev/github/parameter-golf/run_train.sh","/Users/dhruv2mars/dev/github/parameter-golf/run_train_ttt.sh"],"modifiedFiles":["/Users/dhruv2mars/dev/github/parameter-golf/autoresearch.md","/Users/dhruv2mars/dev/github/parameter-golf/autoresearch.sh","/Users/dhruv2mars/dev/github/parameter-golf/train_kaggle.py"]},"fromHook":false}
{"type":"message","id":"1a850685","parentId":"e5376bb8","timestamp":"2026-04-27T09:27:12.714Z","message":{"role":"user","content":[{"type":"text","text":"ok, whats the model status? done with 49 runs, where we are at now?"}],"timestamp":1777282032707}}
{"type":"message","id":"c604d26a","parentId":"1a850685","timestamp":"2026-04-27T09:27:28.403Z","message":{"role":"assistant","content":[{"type":"thinking","thinking":"Let me get the current status of the experiments and check the best results we've achieved.\n","thinkingSignature":"fda497058c13d5676a2d949ced21f8b8c26a8e448d14487309717d580a182975"},{"type":"toolCall","id":"call_function_y58nonbudkhb_1","name":"bash","arguments":{"command":"cd /Users/dhruv2mars/dev/github/parameter-golf && python3 experiments/pg_autoresearch.py status 2>&1 | tail -20"}}],"api":"anthropic-messages","provider":"minimax","model":"MiniMax-M2.7","usage":{"input":36563,"output":74,"cacheRead":0,"cacheWrite":0,"totalTokens":36637,"cost":{"input":0.0109689,"output":0.00008879999999999999,"cacheRead":0,"cacheWrite":0,"total":0.0110577}},"stopReason":"toolUse","timestamp":1777282032714,"responseId":"063e5ef3fee67fd69df3fedf888b32a9"}}
{"type":"message","id":"b7dcc91c","parentId":"c604d26a","timestamp":"2026-04-27T09:27:28.507Z","message":{"role":"toolResult","toolCallId":"call_function_y58nonbudkhb_1","toolName":"bash","content":[{"type":"text","text":"usage: pg_autoresearch.py status [-h] --ref REF\npg_autoresearch.py status: error: the following arguments are required: --ref\n"}],"isError":false,"timestamp":1777282048507}}
{"type":"message","id":"4cffdb2d","parentId":"b7dcc91c","timestamp":"2026-04-27T09:27:33.146Z","message":{"role":"assistant","content":[{"type":"thinking","thinking":"Let me check the current state by looking at the kaggle results.\n","thinkingSignature":"5be80e6787f73e11cb4106ac17347a9d195baf480af5dc00b33a10593f9217bf"},{"type":"toolCall","id":"call_function_tlty8upif0ll_1","name":"bash","arguments":{"command":"ls -t /Users/dhruv2mars/dev/github/parameter-golf/experiments/kaggle_results/ 2>/dev/null | head -10"}}],"api":"anthropic-messages","provider":"minimax","model":"MiniMax-M2.7","usage":{"input":122,"output":70,"cacheRead":36544,"cacheWrite":0,"totalTokens":36736,"cost":{"input":0.000036599999999999995,"output":0.000084,"cacheRead":0.0021926399999999996,"cacheWrite":0,"total":0.0023132399999999994}},"stopReason":"toolUse","timestamp":1777282048510,"responseId":"063e5f025360abbbb9dfcc07ca7d8023"}}
{"type":"message","id":"9db5ffdd","parentId":"4cffdb2d","timestamp":"2026-04-27T09:27:33.183Z","message":{"role":"toolResult","toolCallId":"call_function_tlty8upif0ll_1","toolName":"bash","content":[{"type":"text","text":"pg-auto-ar-4hr-extended-20260427-66952\npg-auto-ar-2hr-extended-20260427-59213\npg-auto-ar-best-confirm-20260427-56914\npg-auto-ar-best-beta095-20260427-54653\npg-auto-ar-best-2kv-20260427-52436\npg-auto-ar-best-ropebase20k-20260427-50198\npg-auto-ar-best-ropebase5k-20260427-47964\npg-auto-ar-best-batch16k-20260427-45737\npg-auto-ar-best-lr0006-20260427-41225\npg-auto-ar-best-lr0008-20260427-38982\n"}],"isError":false,"timestamp":1777282053182}}
{"type":"message","id":"0abb0c3f","parentId":"9db5ffdd","timestamp":"2026-04-27T09:27:37.614Z","message":{"role":"assistant","content":[{"type":"thinking","thinking":"Let me get the key results from the extended training runs and summarize the current status.\n","thinkingSignature":"0a346f22248927151ed473831a404645a324212d54150aa901d655c5c5896457"},{"type":"toolCall","id":"call_function_nijg7yrxockj_1","name":"bash","arguments":{"command":"cat /Users/dhruv2mars/dev/github/parameter-golf/experiments/kaggle_results/pg-auto-ar-4hr-extended-20260427-66952/logs/*.txt 2>/dev/null | grep \"val_bpb\" | tail -5"}}],"api":"anthropic-messages","provider":"minimax","model":"MiniMax-M2.7","usage":{"input":283,"output":97,"cacheRead":36608,"cacheWrite":0,"totalTokens":36988,"cost":{"input":0.00008489999999999999,"output":0.0001164,"cacheRead":0.00219648,"cacheWrite":0,"total":0.00239778}},"stopReason":"toolUse","timestamp":1777282053190,"responseId":"063e5f06065fe60dac11220821a7734c"}}
{"type":"message","id":"718e227b","parentId":"0abb0c3f","timestamp":"2026-04-27T09:27:37.640Z","message":{"role":"toolResult","toolCallId":"call_function_nijg7yrxockj_1","toolName":"bash","content":[{"type":"text","text":"step=9000 val_loss=4.0462 val_bpb=1.8771 best_bpb=1.8724 elapsed_s=14255\nstep=9050 val_loss=4.0568 val_bpb=1.8820 best_bpb=1.8724 elapsed_s=14334\n[4/6] Training complete. Best val_bpb: 1.8724\nfinal_val_bpb=1.8724 total_steps=9092 total_time_s=14472 artifact_bytes=15666163 code_bytes=38981 total_bytes=15705144\n[4/6] Training complete. Best val_bpb: inf\n"}],"isError":false,"timestamp":1777282057640}}
{"type":"message","id":"de5c13fa","parentId":"718e227b","timestamp":"2026-04-27T09:27:52.935Z","message":{"role":"assistant","content":[{"type":"thinking","thinking":"Let me give a concise summary.\n","thinkingSignature":"82147ba2e05e63947aaf5a7ba5f3de60a647c39db4fb8f81b67a8503c929857b"},{"type":"text","text":"\n\n## Current Status: 49 runs done\n\n### Extended Training Results (key milestones)\n| Duration | val_bpb | Steps | Notes |\n|----------|---------|-------|-------|\n| 30 min | **2.30** | 1,100 | best 30-min config |\n| 2 hr | **1.96** | 4,800 | still improving at end |\n| 4 hr | **1.87** | 9,092 | still improving |\n\n### Key Discoveries from 49 runs\n- **ROPE_DIMS 32** → biggest win (+2%)\n- **EMA_DECAY 0.994** → +0.2%\n- **GRAD_CLIP 0.3** → +0.6%\n- **QK_GAIN 4.0** → +0.1%\n- **WARMDOWN_FRAC 0.80** → small gain\n- **MATRIX_LR 0.0008** → helps\n- **TTT** → broken on T4 (OOM)\n- **12hr run** → timed out/aborted\n\n### Gap to Sub-1\n- Current: **1.87 BPB** (4hr)\n- Target: **<1.0 BPB**\n- Gap: ~0.87 BPB\n\n### Scaling Curve (still improving)\n```\n30min → 2.30 BPB\n2hr   → 1.96 BPB  \n4hr   → 1.87 BPB  ← still descending!\n```\n\n### What's Next\n1. **Run 6-8hr extended training** → likely ~1.7-1.8 BPB\n2. **Implement PPM** → could close most of the gap\n3. **Don't run 12hr** (Kaggle times out)\n\nWant me to continue with extended training, implement PPM, or explore other hyperparams?"}],"api":"anthropic-messages","provider":"minimax","model":"MiniMax-M2.7","usage":{"input":258,"output":399,"cacheRead":36864,"cacheWrite":0,"totalTokens":37521,"cost":{"input":0.0000774,"output":0.0004788,"cacheRead":0.0022118399999999996,"cacheWrite":0,"total":0.0027680399999999994}},"stopReason":"stop","timestamp":1777282057648,"responseId":"063e5f0a2513b46d51c608b4d5b09dce"}}
{"type":"message","id":"9239a247","parentId":"de5c13fa","timestamp":"2026-04-27T09:28:55.783Z","message":{"role":"user","content":[{"type":"text","text":"autoresearch stop"}],"timestamp":1777282135772}}
{"type":"message","id":"1cbbb85f","parentId":"9239a247","timestamp":"2026-04-27T09:29:04.933Z","message":{"role":"assistant","content":[{"type":"thinking","thinking":"User wants to stop the autoresearch loop. Let me acknowledge and summarize the final state.\n","thinkingSignature":"e0a7964d7ba43516b41fd2454acb7161d1beddba38265693e011332e1dde0986"},{"type":"text","text":"\n\n**Autoresearch loop stopped.**\n\n### Final Summary (49 experiments)\n| Metric | Value |\n|--------|-------|\n| Best 30-min | 2.30 BPB |\n| Best 4hr | 1.87 BPB |\n| Gap to sub-1 | 0.87 BPB |\n\n### Best Config Found\n```\nROPE_DIMS=32\nEMA_DECAY=0.994\nGRAD_CLIP_NORM=0.3\nQK_GAIN_INIT=4.0\nWARMDOWN_FRAC=0.80\nMATRIX_LR=0.0008\n```\n\n### To hit sub-1\n- Extended training (6hr+) → ~1.7 BPB\n- **PPM implementation** → key to closing remaining gap\n- TTT remains broken on T4\n\nBranch ready: `autoresearch/phase1-20260426` with all discoveries documented."}],"api":"anthropic-messages","provider":"minimax","model":"MiniMax-M2.7","usage":{"input":469,"output":211,"cacheRead":37056,"cacheWrite":0,"totalTokens":37736,"cost":{"input":0.0001407,"output":0.0002532,"cacheRead":0.0022233599999999997,"cacheWrite":0,"total":0.0026172599999999997}},"stopReason":"stop","timestamp":1777282135784,"responseId":"063e5f5a46e92af955b04ce957e0bc7d"}}
{"type":"message","id":"2f5a31a3","parentId":"1cbbb85f","timestamp":"2026-04-27T09:36:40.294Z","message":{"role":"user","content":[{"type":"text","text":"here is what we are gonna do before doing any other long run. \n\nStrategic Roadmap to <0.6 BPB\n\n\n  Phase 1: Fix TTT & Extended Training (Priority #1)\n\n\n  Your extended training run showed 0.34 BPB gain in 1.5 hours. Extrapolating:\n\n\n\n   30min: 2.30 BPB\n   2hr:    1.96 BPB  (-0.34)\n   4hr:    ~1.80 BPB (est)\n   8hr:    ~1.60 BPB (est)\n   12hr:   ~1.50 BPB (est)\n\n\n\n  But you need to fix TTT first - it could add 0.05-0.15 BPB.\n\n\n  Fix TTT for T4:\n\n\n   # Memory-efficient TTT implementation\n   def run_ttt_memory_efficient(model, val_tokens, ...):\n       # Option 1: Use only embeddings, not full model\n       # Option 2: LoRA-style updates\n       # Option 3: Smaller TTT batch size (1024 vs 8192)\n\n       model.eval()\n       optimizer = torch.optim.SGD(\n           [p for p in model.parameters() if p.ndim >= 2],  # skip small params\n           lr=0.002,\n           momentum=0.9\n       )\n\n       for epoch in range(args.ttt_epochs):\n           # Process 4K tokens at a time instead of 32K\n           for start in range(0, len(val_tokens)-1, 4096):\n               chunk = val_tokens[start:start+4096]\n               # Score first, then train on same chunk\n               ...\n\n\n\n  Phase 2: Architectural Additions (Priority #2)\n\n\n  Add proven techniques from leaderboard:\n\n\n  2.1 SmearGate (Easy Win)\n\n\n   # In Block.forward():\n   class Block(nn.Module):\n       def forward(self, x, x0):\n           # SmearGate: learns residual gating\n           smear = torch.sigmoid(self.smear_gate)  # learnable scalar\n           x = smear * x + (1 - smear) * x0\n           ...\n\n\n\n  2.2 BigramHash (Proven ~0.02 BPB improvement)\n\n\n   class BigramHash(nn.Module):\n       \"\"\"Hash-based n-gram lookup - captures local patterns cheaply\"\"\"\n       def __init__(self, vocab_size, capacity=4096):\n           super().__init__()\n           self.table = nn.Embedding(vocab_size, 64)  # hash bucket features\n           self.proj = nn.Linear(64, model_dim)\n\n       def forward(self, x):\n           # Simple: hash current + prev token\n           prev = torch.roll(x, 1, dims=0)\n           hash_idx = (x * 31 + prev) % self.capacity\n           return self.proj(self.table(hash_idx))\n\n\n\n  2.3 Parallel Residuals (Advanced) From SOTA submissions - both attention and MLP read from same pre-norm input.\n\n\n  Phase 3: The Real 0.6 Strategy\n\n\n  To reach 0.6 BPB, you need hybrid compression:\n\n\n  The insight: BPB measures compression ratio. A model that perfectly predicts token distribution gets ~1.0 BPB. Going below 1.0 requires:\n\n   1 Learning patterns that zlib can't compress\n   2 Exploiting document-level structure\n   3 Having enough capacity to model complex dependencies\n\n\n  Implement Document-Level Compression:\n\n\n\n   def compress_with_document_boundary(val_tokens, model, sp):\n       \"\"\"Split validation into documents and compress each separately\"\"\"\n       # Find document boundaries (tokenizer has boundary markers)\n       docs = split_by_boundary(val_tokens)\n\n       total_bits = 0\n       total_bytes = 0\n\n       for doc in docs:\n           # Model prediction\n           with torch.no_grad():\n               logits = model(doc[:-1])\n               probs = F.softmax(logits, dim=-1)\n\n           # Bits = -log2(p) for actual tokens\n           bits = -torch.log2(probs[range(len(doc)-1), doc[1:]].clamp(min=1e-10))\n           total_bits += bits.sum().item()\n\n           # Bytes from tokenizer\n           total_bytes += sum(len(sp.id_to_piece(t).encode('utf-8')) for t in doc)\n\n       return total_bits / total_bytes\n\nwe would first apply all of these, based on our understanding and past experience. i think if we apply all 3 phases, we can do wonders. \n\ni think we should do these 3 phases, and then do a 2 hour training run (after first verifying that TTT is working perfectly, by doing a short few min run). then compare that with our previous 2 hr run and see if these techniques helped. if yes, then we would know that we are on the right track. \n\nafter that, i still have few tricks up my sleeve which we can apply that will reduce the bpb even further. but thats for later. \n\nno need to do extreme long training runs for now. we have found that extended training helps. thats it. \n\ngive me a honest take on this and be ruthless. I don't want you glazing on me. use caveman ultra mode."}],"timestamp":1777282600282}}
