{"type":"message","id":"293746a3","parentId":"5b9ba0aa","timestamp":"2026-04-27T11:20:12.559Z","message":{"role":"toolResult","toolCallId":"call_function_igae8kpko0kk_1","toolName":"understand_image","content":[{"type":"text","text":"The screen shows the **Lightning AI Studio** interface, which is a web-based integrated development environment (IDE) tailored for machine learning and AI development.\n\nHere is a breakdown of what is visible:\n\n*   **Studio Interface:** Yes, the entire image is the Studio interface. You can see the project name at the top left (\"Dhruv Sharma / default-project / parameter-golf\") and the Lightning AI logo. The interface is built on a VS Code-like framework.\n*   **Central Editor Area:** This is currently empty, displaying a placeholder graphic and a list of common keyboard shortcuts (like `Cmd + P` to find a file).\n*   **Left Sidebar (Explorer):** This shows the file structure of the current environment, titled \"THIS_STUDIO\". It contains a hidden directory `.lightning_studio` and a project folder named `parameter-golf`.\n*   **Right Sidebar (AI Copilot):** This is a prominent feature of the Lightning AI platform. It contains an AI assistant panel with quick-action buttons for common tasks like \"Train model,\" \"Deploy model,\" \"Optimize training,\" and \"Get GPU.\" At the bottom of this panel is a chat interface for interacting with the AI agent.\n*   **Terminal:** **No, there is no terminal currently visible.** While this environment usually includes a terminal (typically at the bottom), it is not open in this specific view.\n*   **Status Bar:** At the very bottom, it shows the current Git branch/environment (`autoresearch/phase1-20260426*`) and notification/layout settings.\n*   **Top Header:** Displays system resources (T4 GPU utilization), SSH status, and buttons to \"Share\" or \"Deploy\" the project."}],"details":{"server":"MiniMax","tool":"understand_image","structuredContent":{"type":"text","text":"The screen shows the **Lightning AI Studio** interface, which is a web-based integrated development environment (IDE) tailored for machine learning and AI development.\n\nHere is a breakdown of what is visible:\n\n*   **Studio Interface:** Yes, the entire image is the Studio interface. You can see the project name at the top left (\"Dhruv Sharma / default-project / parameter-golf\") and the Lightning AI logo. The interface is built on a VS Code-like framework.\n*   **Central Editor Area:** This is currently empty, displaying a placeholder graphic and a list of common keyboard shortcuts (like `Cmd + P` to find a file).\n*   **Left Sidebar (Explorer):** This shows the file structure of the current environment, titled \"THIS_STUDIO\". It contains a hidden directory `.lightning_studio` and a project folder named `parameter-golf`.\n*   **Right Sidebar (AI Copilot):** This is a prominent feature of the Lightning AI platform. It contains an AI assistant panel with quick-action buttons for common tasks like \"Train model,\" \"Deploy model,\" \"Optimize training,\" and \"Get GPU.\" At the bottom of this panel is a chat interface for interacting with the AI agent.\n*   **Terminal:** **No, there is no terminal currently visible.** While this environment usually includes a terminal (typically at the bottom), it is not open in this specific view.\n*   **Status Bar:** At the very bottom, it shows the current Git branch/environment (`autoresearch/phase1-20260426*`) and notification/layout settings.\n*   **Top Header:** Displays system resources (T4 GPU utilization), SSH status, and buttons to \"Share\" or \"Deploy\" the project.","annotations":null,"_meta":null},"isError":false},"isError":false,"timestamp":1777288812559}}
{"type":"message","id":"f0b784d1","parentId":"293746a3","timestamp":"2026-04-27T11:20:20.125Z","message":{"role":"assistant","content":[{"type":"thinking","thinking":"We're in the Lightning AI studio. I can see the file explorer with \"parameter-golf\" project. I need to open a terminal. Let me try Ctrl+` or find a terminal button.","thinkingSignature":"5a60d8a59a333c97fdcf21979566d452f4d4ec024986d6d07fceceaa4c0da0c1"},{"type":"text","text":"Studio is open. Let me open terminal:\n"},{"type":"toolCall","id":"call_function_ss6xjapnfgzq_1","name":"bash","arguments":{"command":"agent-browser keyboard \"Control+`\" 2>&1"}}],"api":"anthropic-messages","provider":"minimax","model":"MiniMax-M2.7","usage":{"input":47573,"output":86,"cacheRead":9348,"cacheWrite":0,"totalTokens":57007,"cost":{"input":0.014271899999999999,"output":0.0001032,"cacheRead":0.0005608799999999999,"cacheWrite":0,"total":0.014935979999999998}},"stopReason":"toolUse","timestamp":1777288812562,"responseId":"063e796f5a8ce210aabcad7e883ac08b"}}
{"type":"message","id":"546cf4f2","parentId":"f0b784d1","timestamp":"2026-04-27T11:20:20.134Z","message":{"role":"toolResult","toolCallId":"call_function_ss6xjapnfgzq_1","toolName":"bash","content":[{"type":"text","text":"/bin/bash: -c: line 0: unexpected EOF while looking for matching ``'\n/bin/bash: -c: line 1: syntax error: unexpected end of file\n\n\nCommand exited with code 2"}],"details":{},"isError":true,"timestamp":1777288820134}}
{"type":"message","id":"3af70ade","parentId":"546cf4f2","timestamp":"2026-04-27T11:20:24.115Z","message":{"role":"assistant","content":[{"type":"thinking","thinking":"Need to escape the backtick properly.","thinkingSignature":"e544b59c2bfb99299527a8d29caabee8b3a62b4886daadae6fd0f6281b7e3943"},{"type":"toolCall","id":"call_function_okbwanxvi9wg_1","name":"bash","arguments":{"command":"agent-browser keyboard \"Control+\\`\" 2>&1"}}],"api":"anthropic-messages","provider":"minimax","model":"MiniMax-M2.7","usage":{"input":47718,"output":45,"cacheRead":9348,"cacheWrite":0,"totalTokens":57111,"cost":{"input":0.014315399999999999,"output":0.000054,"cacheRead":0.0005608799999999999,"cacheWrite":0,"total":0.014930279999999999}},"stopReason":"toolUse","timestamp":1777288820137,"responseId":"063e79757cb34642a9010e9b861bf408"}}
{"type":"message","id":"66f5a02c","parentId":"3af70ade","timestamp":"2026-04-27T11:20:24.170Z","message":{"role":"toolResult","toolCallId":"call_function_okbwanxvi9wg_1","toolName":"bash","content":[{"type":"text","text":"Unknown subcommand: Control+`\nValid options: type, inserttext\n\n\nCommand exited with code 1"}],"details":{},"isError":true,"timestamp":1777288824170}}
{"type":"message","id":"258bad34","parentId":"66f5a02c","timestamp":"2026-04-27T11:20:27.735Z","message":{"role":"assistant","content":[{"type":"thinking","thinking":"Let me try a different approach.","thinkingSignature":"6794737fd3431df69d8b3cc80999aa66fe1835dad8e8e158010621f86fc306c1"},{"type":"toolCall","id":"call_function_h9cpboz1r96l_1","name":"bash","arguments":{"command":"agent-browser keyboard type \"terminal\" 2>&1"}}],"api":"anthropic-messages","provider":"minimax","model":"MiniMax-M2.7","usage":{"input":47800,"output":43,"cacheRead":9348,"cacheWrite":0,"totalTokens":57191,"cost":{"input":0.014339999999999999,"output":0.0000516,"cacheRead":0.0005608799999999999,"cacheWrite":0,"total":0.014952479999999999}},"stopReason":"toolUse","timestamp":1777288824174,"responseId":"063e797888423c08a312307cfcdefb69"}}
{"type":"message","id":"f561a394","parentId":"258bad34","timestamp":"2026-04-27T11:20:27.940Z","message":{"role":"toolResult","toolCallId":"call_function_h9cpboz1r96l_1","toolName":"bash","content":[{"type":"text","text":"✓ Done\n"}],"isError":false,"timestamp":1777288827940}}
{"type":"message","id":"149b7192","parentId":"f561a394","timestamp":"2026-04-27T11:20:31.989Z","message":{"role":"assistant","content":[{"type":"thinking","thinking":"Let me look at the keyboard command options.","thinkingSignature":"6c1a146d7d52348b5204341f123fe9726d086252ad5be6fe2dd17fb4b2606d0a"},{"type":"toolCall","id":"call_function_ea4fk2uywkn8_1","name":"bash","arguments":{"command":"agent-browser keyboard 2>&1"}}],"api":"anthropic-messages","provider":"minimax","model":"MiniMax-M2.7","usage":{"input":47861,"output":41,"cacheRead":9348,"cacheWrite":0,"totalTokens":57250,"cost":{"input":0.0143583,"output":0.000049199999999999997,"cacheRead":0.0005608799999999999,"cacheWrite":0,"total":0.014968379999999998}},"stopReason":"toolUse","timestamp":1777288827943,"responseId":"063e797cc0a104dbec69897203d6b653"}}
{"type":"message","id":"f068e045","parentId":"149b7192","timestamp":"2026-04-27T11:20:32.058Z","message":{"role":"toolResult","toolCallId":"call_function_ea4fk2uywkn8_1","toolName":"bash","content":[{"type":"text","text":"Missing arguments for: keyboard\nUsage: agent-browser keyboard <type|inserttext> <text>\n\n\nCommand exited with code 1"}],"details":{},"isError":true,"timestamp":1777288832057}}
{"type":"message","id":"2032440b","parentId":"f068e045","timestamp":"2026-04-27T11:20:35.783Z","message":{"role":"assistant","content":[{"type":"thinking","thinking":"Let me try finding a terminal button or using a menu option.","thinkingSignature":"923b64dae184d489695a3be55b16e37938d6aa7ddc24015896e11e64d104fbe6"},{"type":"toolCall","id":"call_function_oq55bf8ecafe_1","name":"bash","arguments":{"command":"agent-browser find \"terminal\" button 2>&1 | head -10"}}],"api":"anthropic-messages","provider":"minimax","model":"MiniMax-M2.7","usage":{"input":47944,"output":53,"cacheRead":9348,"cacheWrite":0,"totalTokens":57345,"cost":{"input":0.014383199999999999,"output":0.0000636,"cacheRead":0.0005608799999999999,"cacheWrite":0,"total":0.015007679999999999}},"stopReason":"toolUse","timestamp":1777288832065,"responseId":"063e7980ea12ef36e0e36e9395b94f2c"}}
{"type":"message","id":"09b4d4aa","parentId":"2032440b","timestamp":"2026-04-27T11:20:35.833Z","message":{"role":"toolResult","toolCallId":"call_function_oq55bf8ecafe_1","toolName":"bash","content":[{"type":"text","text":"Unknown subcommand: terminal\nValid options: role, text, label, placeholder, alt, title, testid, first, last, nth\n"}],"isError":false,"timestamp":1777288835833}}
{"type":"message","id":"8d5869c0","parentId":"09b4d4aa","timestamp":"2026-04-27T11:20:39.412Z","message":{"role":"assistant","content":[{"type":"thinking","thinking":"Let me try using the find command differently.","thinkingSignature":"b2ed07f24c52f5c08c54b708f203efc69662e65b65cbf0291f666ea0a6ce3517"},{"type":"toolCall","id":"call_function_imsqxxjoi549_1","name":"bash","arguments":{"command":"agent-browser find text \"Terminal\" click 2>&1 | head -10"}}],"api":"anthropic-messages","provider":"minimax","model":"MiniMax-M2.7","usage":{"input":48042,"output":50,"cacheRead":9348,"cacheWrite":0,"totalTokens":57440,"cost":{"input":0.0144126,"output":0.000059999999999999995,"cacheRead":0.0005608799999999999,"cacheWrite":0,"total":0.015033479999999998}},"stopReason":"toolUse","timestamp":1777288835838,"responseId":"063e7984be1eabd5690dced819376570"}}
{"type":"message","id":"d6f756f7","parentId":"8d5869c0","timestamp":"2026-04-27T11:20:39.615Z","message":{"role":"toolResult","toolCallId":"call_function_imsqxxjoi549_1","toolName":"bash","content":[{"type":"text","text":"✗ Element not found. Verify the selector is correct and the element exists in the DOM.\n"}],"isError":false,"timestamp":1777288839615}}
{"type":"message","id":"51cf7201","parentId":"d6f756f7","timestamp":"2026-04-27T11:20:42.999Z","message":{"role":"assistant","content":[{"type":"thinking","thinking":"Let me try a different approach - maybe I can use the command palette with Cmd+Shift+P.","thinkingSignature":"20085ad83745ad1314b0f94cda94962ade5091b828beda42a185e86fb7afb8fa"},{"type":"toolCall","id":"call_function_ii7vrkr86jis_1","name":"bash","arguments":{"command":"agent-browser get all 2>&1 | head -50"}}],"api":"anthropic-messages","provider":"minimax","model":"MiniMax-M2.7","usage":{"input":48126,"output":57,"cacheRead":9348,"cacheWrite":0,"totalTokens":57531,"cost":{"input":0.014437799999999999,"output":0.0000684,"cacheRead":0.0005608799999999999,"cacheWrite":0,"total":0.015067079999999998}},"stopReason":"toolUse","timestamp":1777288839618,"responseId":"063e798891ba50a4ebc0406f326907c8"}}
{"type":"message","id":"bf4711c8","parentId":"51cf7201","timestamp":"2026-04-27T11:20:43.053Z","message":{"role":"toolResult","toolCallId":"call_function_ii7vrkr86jis_1","toolName":"bash","content":[{"type":"text","text":"Unknown subcommand: all\nValid options: text, html, value, attr, url, title, count, box, styles, cdp-url\n"}],"isError":false,"timestamp":1777288843053}}
{"type":"message","id":"9f19a8ce","parentId":"bf4711c8","timestamp":"2026-04-27T11:20:46.951Z","message":{"role":"assistant","content":[{"type":"thinking","thinking":"Let me try using the menu at the top or the sidebar to find terminal.","thinkingSignature":"935c17f49f85b9245d1c6f2404a4376bedf18db69d3a849cba9d192a5367ce9b"},{"type":"toolCall","id":"call_function_2xpgo38vlfsp_1","name":"bash","arguments":{"command":"agent-browser find text \"View\" click 2>&1 | head -5"}}],"api":"anthropic-messages","provider":"minimax","model":"MiniMax-M2.7","usage":{"input":48229,"output":57,"cacheRead":9348,"cacheWrite":0,"totalTokens":57634,"cost":{"input":0.0144687,"output":0.0000684,"cacheRead":0.0005608799999999999,"cacheWrite":0,"total":0.015097979999999999}},"stopReason":"toolUse","timestamp":1777288843057,"responseId":"063e798b7918735be20e6ff2d1dde4d1"}}
{"type":"message","id":"fbedc8c8","parentId":"9f19a8ce","timestamp":"2026-04-27T11:20:47.163Z","message":{"role":"toolResult","toolCallId":"call_function_2xpgo38vlfsp_1","toolName":"bash","content":[{"type":"text","text":"✗ Element not found. Verify the selector is correct and the element exists in the DOM.\n"}],"isError":false,"timestamp":1777288847163}}
{"type":"message","id":"27878402","parentId":"fbedc8c8","timestamp":"2026-04-27T11:20:50.051Z","message":{"role":"assistant","content":[{"type":"thinking","thinking":"Let me try opening a new terminal tab in the browser using keyboard shortcut.","thinkingSignature":"29567a934d4c8e19e9a2896c7fe2103eea43c9c86fed40192b487396b47f6965"},{"type":"toolCall","id":"call_function_er2fbgf263wu_1","name":"bash","arguments":{"command":"agent-browser find text \"New Terminal\" click 2>&1 | head -5"}}],"api":"anthropic-messages","provider":"minimax","model":"MiniMax-M2.7","usage":{"input":48320,"output":57,"cacheRead":9348,"cacheWrite":0,"totalTokens":57725,"cost":{"input":0.014496,"output":0.0000684,"cacheRead":0.0005608799999999999,"cacheWrite":0,"total":0.01512528}},"stopReason":"toolUse","timestamp":1777288847167,"responseId":"063e798f7cde465a26b32b84ce1e5eb4"}}
{"type":"message","id":"9fb1d64f","parentId":"27878402","timestamp":"2026-04-27T11:20:50.255Z","message":{"role":"toolResult","toolCallId":"call_function_er2fbgf263wu_1","toolName":"bash","content":[{"type":"text","text":"✗ Element not found. Verify the selector is correct and the element exists in the DOM.\n"}],"isError":false,"timestamp":1777288850255}}
{"type":"message","id":"fe0fb7d7","parentId":"9fb1d64f","timestamp":"2026-04-27T11:20:54.743Z","message":{"role":"assistant","content":[{"type":"thinking","thinking":"Let me try using the mouse to click at the right position to open the terminal. In Lightning AI Studio, the terminal is usually at the bottom. Let me try clicking on the area where the terminal button might be.","thinkingSignature":"0692f0c5abe9abde7db9a3716b0666532dc9ec0ec72e81a95d7a0d6c4765b038"},{"type":"toolCall","id":"call_function_464uivzj4bdi_1","name":"bash","arguments":{"command":"agent-browser mouse click 100 700 2>&1"}}],"api":"anthropic-messages","provider":"minimax","model":"MiniMax-M2.7","usage":{"input":48411,"output":81,"cacheRead":9348,"cacheWrite":0,"totalTokens":57840,"cost":{"input":0.0145233,"output":0.00009719999999999999,"cacheRead":0.0005608799999999999,"cacheWrite":0,"total":0.01518138}},"stopReason":"toolUse","timestamp":1777288850259,"responseId":"063e799286326dc3544b91336215a905"}}
{"type":"message","id":"b3271b33","parentId":"fe0fb7d7","timestamp":"2026-04-27T11:20:54.795Z","message":{"role":"toolResult","toolCallId":"call_function_464uivzj4bdi_1","toolName":"bash","content":[{"type":"text","text":"Unknown subcommand: click\nValid options: move, down, up, wheel\n\n\nCommand exited with code 1"}],"details":{},"isError":true,"timestamp":1777288854795}}
{"type":"message","id":"7ee5af16","parentId":"b3271b33","timestamp":"2026-04-27T11:20:57.761Z","message":{"role":"assistant","content":[{"type":"thinking","thinking":"Let me try with correct syntax.","thinkingSignature":"64b79f07291819bd94551a7254d0bcd75aecad5fe040a5b510186f1dcc61661b"},{"type":"toolCall","id":"call_function_g4u4vqe8m9vy_1","name":"bash","arguments":{"command":"agent-browser mouse move 100 700 2>&1"}}],"api":"anthropic-messages","provider":"minimax","model":"MiniMax-M2.7","usage":{"input":48531,"output":44,"cacheRead":9348,"cacheWrite":0,"totalTokens":57923,"cost":{"input":0.014559299999999999,"output":0.000052799999999999996,"cacheRead":0.0005608799999999999,"cacheWrite":0,"total":0.015172979999999999}},"stopReason":"toolUse","timestamp":1777288854799,"responseId":"063e79962189ea847e21db8a986f602d"}}
{"type":"message","id":"a2333341","parentId":"7ee5af16","timestamp":"2026-04-27T11:20:57.978Z","message":{"role":"toolResult","toolCallId":"call_function_g4u4vqe8m9vy_1","toolName":"bash","content":[{"type":"text","text":"✓ Done\n"}],"isError":false,"timestamp":1777288857978}}
{"type":"message","id":"627760a2","parentId":"a2333341","timestamp":"2026-04-27T11:21:01.281Z","message":{"role":"assistant","content":[{"type":"thinking","thinking":"Let me try to use Ctrl+` with the keyboard properly. Maybe I need to use a different format.","thinkingSignature":"74082c85100d91149da08908f1ae79525dd8236af92ab83de540d3f624599718"},{"type":"toolCall","id":"call_function_bo3h1sr22g6i_1","name":"bash","arguments":{"command":"agent-browser keys 2>&1 | head -10"}}],"api":"anthropic-messages","provider":"minimax","model":"MiniMax-M2.7","usage":{"input":48593,"output":58,"cacheRead":9348,"cacheWrite":0,"totalTokens":57999,"cost":{"input":0.0145779,"output":0.0000696,"cacheRead":0.0005608799999999999,"cacheWrite":0,"total":0.015208379999999999}},"stopReason":"toolUse","timestamp":1777288857981,"responseId":"063e799a2496cad6db40b00f5060b281"}}
{"type":"message","id":"1884713c","parentId":"627760a2","timestamp":"2026-04-27T11:21:01.329Z","message":{"role":"toolResult","toolCallId":"call_function_bo3h1sr22g6i_1","toolName":"bash","content":[{"type":"text","text":"Unknown command: keys\n"}],"isError":false,"timestamp":1777288861329}}
{"type":"message","id":"e9ab4538","parentId":"1884713c","timestamp":"2026-04-27T11:21:04.882Z","message":{"role":"assistant","content":[{"type":"thinking","thinking":"Let me try using CDP commands to execute the shortcut.","thinkingSignature":"a5c004fde409ccb7b5e843e7b95ece6c13c8a94f67b9306b5ce81e575d740760"},{"type":"toolCall","id":"call_function_qnsufi6dkfsd_1","name":"bash","arguments":{"command":"agent-browser --help 2>&1"}}],"api":"anthropic-messages","provider":"minimax","model":"MiniMax-M2.7","usage":{"input":48671,"output":44,"cacheRead":9348,"cacheWrite":0,"totalTokens":58063,"cost":{"input":0.0146013,"output":0.000052799999999999996,"cacheRead":0.0005608799999999999,"cacheWrite":0,"total":0.01521498}},"stopReason":"toolUse","timestamp":1777288861332,"responseId":"063e799d4010c75e9b07acff2b451c5e"}}
{"type":"message","id":"d07113f8","parentId":"e9ab4538","timestamp":"2026-04-27T11:21:04.942Z","message":{"role":"toolResult","toolCallId":"call_function_qnsufi6dkfsd_1","toolName":"bash","content":[{"type":"text","text":"agent-browser - fast browser automation CLI for AI agents\n\nUsage: agent-browser <command> [args] [options]\n\nCore Commands:\n  open <url>                 Navigate to URL\n  click <sel>                Click element (or @ref)\n  dblclick <sel>             Double-click element\n  type <sel> <text>          Type into element\n  fill <sel> <text>          Clear and fill\n  press <key>                Press key (Enter, Tab, Control+a)\n  keyboard type <text>       Type text with real keystrokes (no selector)\n  keyboard inserttext <text> Insert text without key events\n  hover <sel>                Hover element\n  focus <sel>                Focus element\n  check <sel>                Check checkbox\n  uncheck <sel>              Uncheck checkbox\n  select <sel> <val...>      Select dropdown option\n... omitted ...\n  agent-browser -p ios --device \"iPhone 15 Pro\" open url   # Specific device\n  agent-browser -p ios device list                         # List simulators\n  agent-browser -p ios swipe up                            # Swipe gesture\n  agent-browser -p ios tap @e1                             # Touch element\n\n[tokenjuice compacted bash output]"}],"details":{"tokenjuice":{"compacted":true,"rawChars":16110,"reducedChars":1106,"savedChars":15004,"reducer":"generic/help"}},"isError":false,"timestamp":1777288864942}}
{"type":"message","id":"c0e626b3","parentId":"d07113f8","timestamp":"2026-04-27T11:21:08.352Z","message":{"role":"assistant","content":[{"type":"thinking","thinking":"I can use `agent-browser press` for keyboard shortcuts. Let me try pressing Ctrl+` using that.","thinkingSignature":"f8a163f56fdca85564350a28345278a5b4d7445079420f0fa37ebca0f3f4311e"},{"type":"toolCall","id":"call_function_ktlosniuuvu2_1","name":"bash","arguments":{"command":"agent-browser press \"Control+`\" 2>&1"}}],"api":"anthropic-messages","provider":"minimax","model":"MiniMax-M2.7","usage":{"input":48992,"output":59,"cacheRead":9348,"cacheWrite":0,"totalTokens":58399,"cost":{"input":0.0146976,"output":0.0000708,"cacheRead":0.0005608799999999999,"cacheWrite":0,"total":0.015329279999999999}},"stopReason":"toolUse","timestamp":1777288864947,"responseId":"063e79a14a64117c1fb805eb73d56e59"}}
