{"type":"compaction","id":"506ee406","parentId":"21aeebaa","timestamp":"2026-04-27T13:18:08.588Z","summary":"## Goal\nBuild the best language model under 16MB to achieve lowest bits-per-byte (BPB) on FineWeb validation. Autoresearch via 30-min runs to find best config, then extended training for final push to sub-1 BPB.\n\n## Constraints & Preferences\n- Model must fit under **16MB**\n- **Kaggle quota exhausted** — switched to **Lightning AI** for GPU training\n- Sequential runs, manual monitoring required\n- 30hrs/week GPU quota on Lightning AI\n- Do not let GPU run continuously when idle (cuts quota)\n- **CLI is primary control method** via `lightning_sdk` Python package\n- Planned improvements: (1) extended training, (2) TTT (broken), (3) PPM (not implemented)\n\n## Progress\n### Done\n- [x] **49 experiments completed** on Kaggle — systematic architecture and hyperparameter exploration\n- [x] **Extended training scaling curve established**: 30min=2.30 → 2hr=1.96 → 4hr=1.87 BPB (model still improving)\n- [x] **Key discoveries from 49 runs**: ROPE_DIMS=32 (+2%), EMA_DECAY=0.994 (+0.2%), GRAD_CLIP=0.3 (+0.6%), QK_GAIN=4.0 (+0.1%), WARMDOWN_FRAC=0.80, MATRIX_LR=0.0008\n- [x] **TTT broken**: OOM on T4 even with conservative settings — skip\n- [x] **Repo cleaned and pushed to main**: `4f76b43 feat: add optimized train_kaggle.py pipeline`\n- [x] **Lightning CLI installed** locally: `pip install lightning-sdk -U` in venv at `~/.venv/pg`\n- [x] **Lightning SDK verified working**: Can connect, start/stop studios, run commands remotely\n- [x] **Studio identified**: `parameter-golf` in `default-project` teamspace, user `dhruv2mars`\n- [x] **Repo cloned on studio**: `parameter-golf` at `/teamspace/studios/this_studio/parameter-golf`\n\n### In Progress\n- [ ] **Resolve GPU cluster issue**: Studio is on AWS cluster (`lightning-public-prod`) without T4 GPUs — T4 only available on `gcp-lightning-public-prod`\n- [ ] **Verify full training pipeline** on Lightning AI once GPU issue resolved\n\n### Blocked\n- [x ~~Kaggle quota~~]: Switched to Lightning AI\n- [x ~~TTT broken on T4~~]: Skip, not worth the effort\n- [x ~~Repo not on main~~]: Pushed to origin/main\n- [x ~~CLI not installed~~]: Installed `lightning-sdk`\n- [x ~~Studio not accessible~~]: Can now start/stop/run commands via SDK\n\n## Key Decisions\n- **CLI over browser**: User preferred CLI control; `lightning-sdk` Python package is working\n- **CLI credentials**: `REDACTED`, `REDACTED`\n- **GPU cluster issue**: AWS cluster lacks T4, GCP cluster has T4 but studio can't switch clusters directly\n- **Stop GPU when idle**: Important for quota management\n- **Browser as backup**: `agent-browser` with Brave on port 9223 can access studio web terminal\n\n## Next Steps\n1. **Resolve GPU issue** — create new GPU-enabled studio on GCP cluster, or investigate `lightning-aggregate-provider-prod`\n2. **Verify training pipeline** — run 1-min test once GPU confirmed working\n3. **Push best config to studio** — copy `train_kaggle.py` with best hyperparameters (already in repo)\n4. **Run extended training** — use best config found: `ROPE_DIMS=32, EMA_DECAY=0.994, GRAD_CLIP=0.3, QK_GAIN=4.0, WARMDOWN=0.80, LR=0.0008`\n5. **Implement remaining tricks** (Phase 2-3 architectural additions from user's roadmap)\n\n## Critical Context\n- **Best config (30-min)**: 2.30 BPB — **3.1% better than baseline**\n- **Best 4-hr result**: 1.87 BPB — model still improving strongly\n- **Gap to sub-1**: ~0.87 BPB — needs extended training + architectural additions\n- **Studio URL**: `https://lightning.ai/dhruv2mars/default-project/studios/parameter-golf/code`\n- **Studio path**: `/teamspace/studios/this_studio/parameter-golf`\n- **Studio status**: Stopped (GPU issue needs resolution)\n- **Studio machine**: CPU only on AWS cluster\n- **Available clusters**: `lightning-public-prod` (AWS, no T4), `gcp-lightning-public-prod` (GCP, has T4), `lightning-aggregate-provider-prod`, `lightning-cloudflare-prod`\n- **TTT status**: Broken (OOM on T4) — skip\n- **PPM status**: Not implemented yet\n\n## Best Config Found\n```\nROPE_DIMS=32          # +2% - BIGGEST WIN\nEMA_DECAY=0.994       # +0.2%\nGRAD_CLIP_NORM=0.3    # +0.6%\nQK_GAIN_INIT=4.0      # +0.1%\nWARMDOWN_FRAC=0.80    # small gain\nMATRIX_LR=0.0008      # lower LR helps\n```\n\n---\n\n**Turn Context (split turn):**\n\n\n\n## Original Request\nUser deleted all old studios and created a new one called \"parameter-golf\" with the correct GPU. User asked the assistant to set it up and verify full control and functionality.\n\n## Early Progress\n- Created new studio with correct GPU configuration\n- Connected via Lightning SDK with user ID and API key\n- Confirmed studio status is **Running** on T4_SMALL GPU with lightning-public-prod cluster\n\n## Context for Suffix\nThe assistant attempted to verify CUDA availability by running a Python command through `studio.run()`, but encountered a **SyntaxError** due to quote escaping issues. The suffix (retained recent work) likely continues troubleshooting this CUDA verification step or attempting the command differently.\n\n<read-files>\n/Users/dhruv2mars/.pi/agent/git/github.com/davebcn87/pi-autoresearch/skills/autoresearch-create/SKILL.md\n/Users/dhruv2mars/.pi/agent/skills/agent-browser/SKILL.md\n/Users/dhruv2mars/.pi/agent/skills/grill-me/SKILL.md\n/Users/dhruv2mars/.pi/agent/skills/vercel-deploy/SKILL.md\n/Users/dhruv2mars/dev/github/parameter-golf/PROGRESS.md\n/Users/dhruv2mars/dev/github/parameter-golf/README.md\n/Users/dhruv2mars/dev/github/parameter-golf/experiments/kaggle_results/pg-auto-30min-baseline-20260426-41891/logs/30min-baseline-20260426.rank0.txt\n/Users/dhruv2mars/dev/github/parameter-golf/experiments/kaggle_state.json\n/Users/dhruv2mars/dev/github/parameter-golf/experiments/pg_autoresearch.py\n/Users/dhruv2mars/dev/github/parameter-golf/records/track_10min_16mb/2026-03-19_Seq2048_FP16Emb_TunedLR/train_seed42.log\n/Users/dhruv2mars/dev/github/parameter-golf/run_train.sh\n/Users/dhruv2mars/dev/github/parameter-golf/run_train_ttt.sh\n</read-files>\n\n<modified-files>\n/Users/dhruv2mars/dev/github/parameter-golf/autoresearch.md\n/Users/dhruv2mars/dev/github/parameter-golf/autoresearch.sh\n/Users/dhruv2mars/dev/github/parameter-golf/train_kaggle.py\n</modified-files>","firstKeptEntryId":"34fa2b9c","tokensBefore":125717,"details":{"readFiles":["/Users/dhruv2mars/.pi/agent/git/github.com/davebcn87/pi-autoresearch/skills/autoresearch-create/SKILL.md","/Users/dhruv2mars/.pi/agent/skills/agent-browser/SKILL.md","/Users/dhruv2mars/.pi/agent/skills/grill-me/SKILL.md","/Users/dhruv2mars/.pi/agent/skills/vercel-deploy/SKILL.md","/Users/dhruv2mars/dev/github/parameter-golf/PROGRESS.md","/Users/dhruv2mars/dev/github/parameter-golf/README.md","/Users/dhruv2mars/dev/github/parameter-golf/experiments/kaggle_results/pg-auto-30min-baseline-20260426-41891/logs/30min-baseline-20260426.rank0.txt","/Users/dhruv2mars/dev/github/parameter-golf/experiments/kaggle_state.json","/Users/dhruv2mars/dev/github/parameter-golf/experiments/pg_autoresearch.py","/Users/dhruv2mars/dev/github/parameter-golf/records/track_10min_16mb/2026-03-19_Seq2048_FP16Emb_TunedLR/train_seed42.log","/Users/dhruv2mars/dev/github/parameter-golf/run_train.sh","/Users/dhruv2mars/dev/github/parameter-golf/run_train_ttt.sh"],"modifiedFiles":["/Users/dhruv2mars/dev/github/parameter-golf/autoresearch.md","/Users/dhruv2mars/dev/github/parameter-golf/autoresearch.sh","/Users/dhruv2mars/dev/github/parameter-golf/train_kaggle.py"]},"fromHook":false}
{"type":"message","id":"5291eabe","parentId":"506ee406","timestamp":"2026-04-27T13:23:43.917Z","message":{"role":"user","content":[{"type":"text","text":"great. now we come to our actual work of working on the training and model. where were we at before all this kaggle-lightning drama and other stuff. ???"}],"timestamp":1777296223911}}
{"type":"message","id":"2e494ae3","parentId":"5291eabe","timestamp":"2026-04-27T13:23:50.433Z","message":{"role":"assistant","content":[{"type":"thinking","thinking":"Let me check the summary and PROGRESS.md to understand where we were before the cleanup work.","thinkingSignature":"e46d142a69bcb97434b901102fd2f707a9845704f00243cdce41d560c7be78f9"},{"type":"toolCall","id":"call_function_jc5j1ovkt39k_1","name":"read","arguments":{"path":"/Users/dhruv2mars/dev/github/parameter-golf/PROGRESS.md"}}],"api":"anthropic-messages","provider":"minimax","model":"MiniMax-M2.7","usage":{"input":13,"output":61,"cacheRead":0,"cacheWrite":36793,"totalTokens":36867,"cost":{"input":0.0000039,"output":0.00007319999999999999,"cacheRead":0,"cacheWrite":0.013797375,"total":0.013874475}},"stopReason":"toolUse","timestamp":1777296223918,"responseId":"063e96628a681a4b7d20ea6d3b73e6a7"}}
{"type":"message","id":"14a3f9a6","parentId":"2e494ae3","timestamp":"2026-04-27T13:23:50.439Z","message":{"role":"toolResult","toolCallId":"call_function_jc5j1ovkt39k_1","toolName":"read","content":[{"type":"text","text":"ENOENT: no such file or directory, access '/Users/dhruv2mars/dev/github/parameter-golf/PROGRESS.md'"}],"details":{},"isError":true,"timestamp":1777296230439}}
{"type":"message","id":"921cbf33","parentId":"14a3f9a6","timestamp":"2026-04-27T13:24:06.123Z","message":{"role":"assistant","content":[{"type":"thinking","thinking":"Let me check the summary context - it had the key info. Based on the summary:\n\n**Key Progress:**\n- 49 experiments completed on Kaggle\n- Best 30-min result: 2.30 BPB\n- Best 4-hr result: 1.87 BPB (model still improving strongly)\n- Gap to sub-1: ~0.87 BPB\n\n**Best Config Found:**\n- ROPE_DIMS=32 (+2%)\n- EMA_DECAY=0.994 (+0.2%)\n- GRAD_CLIP_NORM=0.3 (+0.6%)\n- QK_GAIN_INIT=4.0 (+0.1%)\n- WARMDOWN_FRAC=0.80\n- MATRIX_LR=0.0008\n\n**Next Steps from summary:**\n1. Run extended training (the 4-hr showed 1.87 BPB and still improving!)\n2. Implement TTT fix (but TTT was marked as broken - OOM on T4)\n3. Implement PPM (not implemented)\n\n**Scaling curve established:**\n- 30min = 2.30 BPB\n- 2hr = 1.96 BPB\n- 4hr = 1.87 BPB\n\nThe model was still strongly improving at 4hr, so extended training is the key next step.","thinkingSignature":"7eaa1f860c7145ce8d709ec6b4f2eb52be7eef3628265d1fc116dc634be67273"},{"type":"text","text":"Based on the context summary:\n\n## Where We Were\n\n**Training Results (Kaggle):**\n| Time | val_bpb |\n|------|---------|\n| 30min | 2.30 |\n| 2hr | 1.96 |\n| 4hr | **1.87** ← still improving! |\n\n**Best Config Found (30min):**\n```\nROPE_DIMS=32          # +2% (biggest win)\nEMA_DECAY=0.994       # +0.2%\nGRAD_CLIP=0.3         # +0.6%\nQK_GAIN=4.0           # +0.1%\nWARMDOWN=0.80\nLR=0.0008\n```\n\n**Gap to goal:** 1.87 → <1.0 BPB = need ~0.87 more\n\n## Next Steps (from your roadmap)\n1. **Extended training** — 4hr showed model still improving strongly\n2. **TTT (Test-Time Training)** — was broken (OOM on T4)\n3. **PPM ( Predictive / Preprocessing stuff)** — not implemented yet\n4. **Other architectural additions** from the leaderboard winners\n\n## Current Status\n- ✅ Lightning AI setup done (T4 GPU working)\n- ✅ Repo cleaned and synced\n- ⏸️ Need to run extended training now\n\nWant me to kick off a longer training run on Lightning AI (30min, 1hr, 2hr) to see if we can push toward sub-1 BPB?"}],"api":"anthropic-messages","provider":"minimax","model":"MiniMax-M2.7","usage":{"input":27711,"output":602,"cacheRead":9199,"cacheWrite":0,"totalTokens":37512,"cost":{"input":0.0083133,"output":0.0007224,"cacheRead":0.00055194,"cacheWrite":0,"total":0.00958764}},"stopReason":"stop","timestamp":1777296230442,"responseId":"063e96660d89cfbade0cd0f94380d2aa"}}
{"type":"message","id":"03b902eb","parentId":"921cbf33","timestamp":"2026-04-27T13:25:28.406Z","message":{"role":"user","content":[{"type":"text","text":"here is what you have to do now:\n\nDo this:\n1. implement all 3 changes: (SP8192 + parallel residuals + SmearGate)\n2. Run 30-min test with conservative settings:\n   TRAIN_SEQ_LEN=8192\n   TRAIN_BATCH_TOKENS=4096  # Reduce if OOM\n   GRAD_ACCUM_STEPS=2       # Maintain effective batch\n   ITERATIONS=2000         # 30-min budget\nif it doesnt OOM, great. but if it does: Use gradient checkpointing to trade compute for memory\n\ntell me once the 30 min training run is complete without any issues. be absolutely critical and no mistakes.\n\nalso, note that we are now on lightning.ai instead of kaggle. and here, we dont have 2x t4 gpus, instead a single one."}],"timestamp":1777296328399}}
{"type":"message","id":"e634d66a","parentId":"03b902eb","timestamp":"2026-04-27T13:25:35.826Z","message":{"role":"assistant","content":[{"type":"thinking","thinking":"The user wants me to:\n1. Implement 3 changes: SP8192 + parallel residuals + SmearGate\n2. Run a 30-min test with conservative settings on Lightning AI\n\nLet me first read the current train_kaggle.py to understand the architecture, then implement these changes.\n\nSP8192 = Sequence Parallelism with sequence length 8192\nParallel residuals = parallel attention and MLP branches\nSmearGate = some kind of gating mechanism\n\nLet me start by reading the current training code.","thinkingSignature":"b8301a16b08c5cf8d07f6d6f2c5f0bc7acb82953210f0c062f20ea1af74858d0"},{"type":"toolCall","id":"call_function_zm28ch3z085u_1","name":"read","arguments":{"path":"/Users/dhruv2mars/dev/github/parameter-golf/train_kaggle.py","limit":200}}],"api":"anthropic-messages","provider":"minimax","model":"MiniMax-M2.7","usage":{"input":13,"output":154,"cacheRead":36819,"cacheWrite":562,"totalTokens":37548,"cost":{"input":0.0000039,"output":0.0001848,"cacheRead":0.0022091399999999996,"cacheWrite":0.00021075,"total":0.0026085899999999996}},"stopReason":"toolUse","timestamp":1777296328407,"responseId":"063e96cb16e782686deed5c52c50ffea"}}
