{"type":"message","id":"ceb21c58","parentId":"fa1cc594","timestamp":"2026-04-27T11:38:42.939Z","message":{"role":"assistant","content":[{"type":"thinking","thinking":"Let me wait and check.","thinkingSignature":"c4fee00d46a721037777d6ec4307c893cbe9be85efb90e417a7490894a8745fe"},{"type":"toolCall","id":"call_function_l5oiwrkeks3k_1","name":"bash","arguments":{"command":"sleep 30 && agent-browser screenshot 2>&1"}}],"api":"anthropic-messages","provider":"minimax","model":"MiniMax-M2.7","usage":{"input":60556,"output":42,"cacheRead":9348,"cacheWrite":0,"totalTokens":69946,"cost":{"input":0.0181668,"output":0.0000504,"cacheRead":0.0005608799999999999,"cacheWrite":0,"total":0.01877808}},"stopReason":"toolUse","timestamp":1777289919077,"responseId":"063e7dbf5a5b6b68789742a8aebddaec"}}
{"type":"message","id":"e3522ff2","parentId":"ceb21c58","timestamp":"2026-04-27T11:39:13.306Z","message":{"role":"toolResult","toolCallId":"call_function_l5oiwrkeks3k_1","toolName":"bash","content":[{"type":"text","text":"✓ Screenshot saved to /Users/dhruv2mars/.agent-browser/tmp/screenshots/screenshot-1777289953296.png\n"}],"isError":false,"timestamp":1777289953306}}
{"type":"message","id":"9522c390","parentId":"e3522ff2","timestamp":"2026-04-27T11:39:19.539Z","message":{"role":"assistant","content":[{"type":"thinking","thinking":"Let me check.","thinkingSignature":"155764a1465f1aa31e7510f8cd8266c6638b35b4a37882161cbf92b1741bf4f4"},{"type":"toolCall","id":"call_function_2o29fagnb6eb_1","name":"understand_image","arguments":{"prompt":"Is training running? Show current status.","image_url":"/Users/dhruv2mars/.agent-browser/tmp/screenshots/screenshot-1777289953296.png"}}],"api":"anthropic-messages","provider":"minimax","model":"MiniMax-M2.7","usage":{"input":60641,"output":69,"cacheRead":9348,"cacheWrite":0,"totalTokens":70058,"cost":{"input":0.018192299999999998,"output":0.0000828,"cacheRead":0.0005608799999999999,"cacheWrite":0,"total":0.01883598}},"stopReason":"toolUse","timestamp":1777289953311,"responseId":"063e7de320af229eeb701c9f4da817b9"}}
{"type":"message","id":"95bef28b","parentId":"9522c390","timestamp":"2026-04-27T11:39:29.925Z","message":{"role":"toolResult","toolCallId":"call_function_2o29fagnb6eb_1","toolName":"understand_image","content":[{"type":"text","text":"Based on the terminal output in the image, training is **no longer running**.\n\nThe process appears to have stopped prematurely. Here is a summary of the current status:\n\n*   **Final Status:** The training process stopped with an error (indicated by `exit 1` in the terminal).\n*   **Progress:** It reached **step 150** out of a planned 2500.\n*   **Last Metrics:**\n    *   `val_loss`: 6.2248\n    *   `val_bpb`: 2.8878\n*   **Checkpointing:** The last best checkpoint was successfully saved just before the process exited.\n\nYou can see the terminal prompt at the bottom, which means the environment is ready for a new command. To continue or debug, you might want to check for any error messages that preceded the exit."}],"details":{"server":"MiniMax","tool":"understand_image","structuredContent":{"type":"text","text":"Based on the terminal output in the image, training is **no longer running**.\n\nThe process appears to have stopped prematurely. Here is a summary of the current status:\n\n*   **Final Status:** The training process stopped with an error (indicated by `exit 1` in the terminal).\n*   **Progress:** It reached **step 150** out of a planned 2500.\n*   **Last Metrics:**\n    *   `val_loss`: 6.2248\n    *   `val_bpb`: 2.8878\n*   **Checkpointing:** The last best checkpoint was successfully saved just before the process exited.\n\nYou can see the terminal prompt at the bottom, which means the environment is ready for a new command. To continue or debug, you might want to check for any error messages that preceded the exit.","annotations":null,"_meta":null},"isError":false},"isError":false,"timestamp":1777289969925}}
{"type":"message","id":"5c925962","parentId":"95bef28b","timestamp":"2026-04-27T11:39:36.189Z","message":{"role":"assistant","content":[{"type":"thinking","thinking":"It's still showing the old output. The `clear` command might not have worked properly. Let me try a different approach - close the current terminal tab and open a new one, or use Ctrl+L to clear.","thinkingSignature":"281e7921bc0e80b623d81fd62ea555c08bc379bc035a23ef7708cbc790db2348"},{"type":"toolCall","id":"call_function_gi9m8abpqxqy_1","name":"bash","arguments":{"command":"agent-browser press \"Control+l\" 2>&1 && sleep 1"}}],"api":"anthropic-messages","provider":"minimax","model":"MiniMax-M2.7","usage":{"input":60895,"output":83,"cacheRead":9348,"cacheWrite":0,"totalTokens":70326,"cost":{"input":0.0182685,"output":0.0000996,"cacheRead":0.0005608799999999999,"cacheWrite":0,"total":0.018928979999999998}},"stopReason":"toolUse","timestamp":1777289969934,"responseId":"063e7df4706ffd0150fa36429a7b9660"}}
{"type":"message","id":"831ddf74","parentId":"5c925962","timestamp":"2026-04-27T11:39:37.456Z","message":{"role":"toolResult","toolCallId":"call_function_gi9m8abpqxqy_1","toolName":"bash","content":[{"type":"text","text":"✓ Done\n"}],"isError":false,"timestamp":1777289977456}}
{"type":"message","id":"cc49841e","parentId":"831ddf74","timestamp":"2026-04-27T11:39:41.553Z","message":{"role":"assistant","content":[{"type":"thinking","thinking":"Let me type a command and see fresh output.","thinkingSignature":"489df8cb62ed6778045873f984c0ce8765a01fb36f124c6de99d118f649b783a"},{"type":"toolCall","id":"call_function_jyqj7bgj967l_1","name":"bash","arguments":{"command":"agent-browser type \"\" \"pwd && ls -la\" 2>&1 && agent-browser press Enter 2>&1 && sleep 2 && agent-browser screenshot 2>&1"}}],"api":"anthropic-messages","provider":"minimax","model":"MiniMax-M2.7","usage":{"input":60996,"output":71,"cacheRead":9348,"cacheWrite":0,"totalTokens":70415,"cost":{"input":0.0182988,"output":0.0000852,"cacheRead":0.0005608799999999999,"cacheWrite":0,"total":0.01894488}},"stopReason":"toolUse","timestamp":1777289977465,"responseId":"063e7df97f5c8519d40d096fadfaf207"}}
{"type":"message","id":"f6226f8f","parentId":"cc49841e","timestamp":"2026-04-27T11:39:44.351Z","message":{"role":"toolResult","toolCallId":"call_function_jyqj7bgj967l_1","toolName":"bash","content":[{"type":"text","text":"✓ Done\n✓ Done\n✓ Screenshot saved to /Users/dhruv2mars/.agent-browser/tmp/screenshots/screenshot-1777289984340.png\n"}],"isError":false,"timestamp":1777289984351}}
{"type":"message","id":"e38ce032","parentId":"f6226f8f","timestamp":"2026-04-27T11:39:48.463Z","message":{"role":"assistant","content":[{"type":"thinking","thinking":"Let me check.","thinkingSignature":"155764a1465f1aa31e7510f8cd8266c6638b35b4a37882161cbf92b1741bf4f4"},{"type":"toolCall","id":"call_function_4m454gizuzl1_1","name":"understand_image","arguments":{"prompt":"Show the fresh terminal output.","image_url":"/Users/dhruv2mars/.agent-browser/tmp/screenshots/screenshot-1777289984340.png"}}],"api":"anthropic-messages","provider":"minimax","model":"MiniMax-M2.7","usage":{"input":61116,"output":67,"cacheRead":9348,"cacheWrite":0,"totalTokens":70531,"cost":{"input":0.0183348,"output":0.0000804,"cacheRead":0.0005608799999999999,"cacheWrite":0,"total":0.01897608}},"stopReason":"toolUse","timestamp":1777289984356,"responseId":"063e7e006d3dde55a6afff722b620b78"}}
{"type":"message","id":"dc904e80","parentId":"e38ce032","timestamp":"2026-04-27T11:39:56.192Z","message":{"role":"toolResult","toolCallId":"call_function_4m454gizuzl1_1","toolName":"understand_image","content":[{"type":"text","text":"Based on the image provided, here is the output from the terminal:\n\n```\nMETRIC val_loss=7.1684\nMETRIC val_bpb=3.3256\nMETRIC best_bpb=3.3256\nMETRIC elapsed_s=57\n[CKPT] Best checkpoint saved\nstep:100/2500 train_loss:6.5520 time:125s\nstep=100 val_loss=6.4919 val_bpb=3.0117 best_bpb=3.0117 elapsed_s=126\nMETRIC step=100\nMETRIC val_loss=6.4919\nMETRIC val_bpb=3.0117\nMETRIC best_bpb=3.0117\nMETRIC elapsed_s=126\n[CKPT] Best checkpoint saved\nstep=150 val_loss=6.2248 val_bpb=2.8878 best_bpb=2.8878 elapsed_s=195\nMETRIC step=150\nMETRIC val_loss=6.2248\nMETRIC val_bpb=2.8878\nMETRIC best_bpb=2.8878\nMETRIC elapsed_s=195\n[CKPT] Best checkpoint saved\n\n[1]  + 100120 exit 1     load_conda_and_run python3 ~/parameter-golf/train_kaggle.py 2>&1 | \n       100121 done       head -50\n⚡️ autoresearch/phase1-20260426 ~/parameter-golf [] \n```"}],"details":{"server":"MiniMax","tool":"understand_image","structuredContent":{"type":"text","text":"Based on the image provided, here is the output from the terminal:\n\n```\nMETRIC val_loss=7.1684\nMETRIC val_bpb=3.3256\nMETRIC best_bpb=3.3256\nMETRIC elapsed_s=57\n[CKPT] Best checkpoint saved\nstep:100/2500 train_loss:6.5520 time:125s\nstep=100 val_loss=6.4919 val_bpb=3.0117 best_bpb=3.0117 elapsed_s=126\nMETRIC step=100\nMETRIC val_loss=6.4919\nMETRIC val_bpb=3.0117\nMETRIC best_bpb=3.0117\nMETRIC elapsed_s=126\n[CKPT] Best checkpoint saved\nstep=150 val_loss=6.2248 val_bpb=2.8878 best_bpb=2.8878 elapsed_s=195\nMETRIC step=150\nMETRIC val_loss=6.2248\nMETRIC val_bpb=2.8878\nMETRIC best_bpb=2.8878\nMETRIC elapsed_s=195\n[CKPT] Best checkpoint saved\n\n[1]  + 100120 exit 1     load_conda_and_run python3 ~/parameter-golf/train_kaggle.py 2>&1 | \n       100121 done       head -50\n⚡️ autoresearch/phase1-20260426 ~/parameter-golf [] \n```","annotations":null,"_meta":null},"isError":false},"isError":false,"timestamp":1777289996192}}
{"type":"message","id":"800b1874","parentId":"dc904e80","timestamp":"2026-04-27T11:40:04.526Z","message":{"role":"assistant","content":[{"type":"thinking","thinking":"The terminal buffer still shows old output. The `load_conda_and_run` wrapper is intercepting commands. Let me try to use the bash shell directly without the wrapper, or check what's happening.\n\nLooking at the output, the `pwd && ls -la` command output isn't showing. The terminal might be stuck. Let me try to kill any background jobs and start fresh.","thinkingSignature":"761605a37fdb9755dcab22318988b7e57f91b53cd49b3e9388ed244ae888c3ab"},{"type":"toolCall","id":"call_function_rr7f9m8ymmzh_1","name":"bash","arguments":{"command":"agent-browser type \"\" \"kill %% 2>/dev/null; jobs; pwd\" 2>&1 && agent-browser press Enter 2>&1 && sleep 3 && agent-browser screenshot 2>&1"}}],"api":"anthropic-messages","provider":"minimax","model":"MiniMax-M2.7","usage":{"input":61509,"output":144,"cacheRead":9348,"cacheWrite":0,"totalTokens":71001,"cost":{"input":0.0184527,"output":0.0001728,"cacheRead":0.0005608799999999999,"cacheWrite":0,"total":0.01918638}},"stopReason":"toolUse","timestamp":1777289996196,"responseId":"063e7e0ef0b0aa7e1999d1ddd0b3104e"}}
{"type":"message","id":"bc7b610e","parentId":"800b1874","timestamp":"2026-04-27T11:40:08.245Z","message":{"role":"toolResult","toolCallId":"call_function_rr7f9m8ymmzh_1","toolName":"bash","content":[{"type":"text","text":"✓ Done\n✓ Done\n✓ Screenshot saved to /Users/dhruv2mars/.agent-browser/tmp/screenshots/screenshot-1777290008236.png\n"}],"isError":false,"timestamp":1777290008245}}
{"type":"message","id":"8d989613","parentId":"bc7b610e","timestamp":"2026-04-27T11:40:12.199Z","message":{"role":"assistant","content":[{"type":"thinking","thinking":"Let me check.","thinkingSignature":"155764a1465f1aa31e7510f8cd8266c6638b35b4a37882161cbf92b1741bf4f4"},{"type":"toolCall","id":"call_function_jvtdcfhdm0mf_1","name":"understand_image","arguments":{"prompt":"Show fresh terminal output.","image_url":"/Users/dhruv2mars/.agent-browser/tmp/screenshots/screenshot-1777289999948.png"}}],"api":"anthropic-messages","provider":"minimax","model":"MiniMax-M2.7","usage":{"input":61702,"output":66,"cacheRead":9348,"cacheWrite":0,"totalTokens":71116,"cost":{"input":0.0185106,"output":0.0000792,"cacheRead":0.0005608799999999999,"cacheWrite":0,"total":0.01915068}},"stopReason":"toolUse","timestamp":1777290008249,"responseId":"063e7e1856b48506dd3058d1b28854e0"}}
{"type":"message","id":"a3cbe858","parentId":"8d989613","timestamp":"2026-04-27T11:40:12.206Z","message":{"role":"toolResult","toolCallId":"call_function_jvtdcfhdm0mf_1","toolName":"understand_image","content":[{"type":"text","text":"Failed to perform VLM analysis: Local image file does not exist: /Users/dhruv2mars/.agent-browser/tmp/screenshots/screenshot-1777289999948.png"}],"details":{"server":"MiniMax","tool":"understand_image","structuredContent":{"type":"text","text":"Failed to perform VLM analysis: Local image file does not exist: /Users/dhruv2mars/.agent-browser/tmp/screenshots/screenshot-1777289999948.png","annotations":null,"_meta":null},"isError":false},"isError":false,"timestamp":1777290012206}}
{"type":"message","id":"f1cbb4dc","parentId":"a3cbe858","timestamp":"2026-04-27T11:40:16.983Z","message":{"role":"assistant","content":[{"type":"thinking","thinking":"Let me check the right screenshot.","thinkingSignature":"155827fffe8150b21baedf97ec5779336570ff182a73a32eaf50e88e42b5e2ac"},{"type":"toolCall","id":"call_function_k2b8qzvelgzx_1","name":"understand_image","arguments":{"prompt":"Show the terminal output.","image_url":"/Users/dhruv2mars/.agent-browser/tmp/screenshots/screenshot-1777289999948.png"}}],"api":"anthropic-messages","provider":"minimax","model":"MiniMax-M2.7","usage":{"input":61820,"output":69,"cacheRead":9348,"cacheWrite":0,"totalTokens":71237,"cost":{"input":0.018546,"output":0.0000828,"cacheRead":0.0005608799999999999,"cacheWrite":0,"total":0.01918968}},"stopReason":"toolUse","timestamp":1777290012209,"responseId":"063e7e1d9f34b0e04687b3a988f7e05c"}}
{"type":"message","id":"c2ef9a06","parentId":"f1cbb4dc","timestamp":"2026-04-27T11:40:17.001Z","message":{"role":"toolResult","toolCallId":"call_function_k2b8qzvelgzx_1","toolName":"understand_image","content":[{"type":"text","text":"Failed to perform VLM analysis: Local image file does not exist: /Users/dhruv2mars/.agent-browser/tmp/screenshots/screenshot-1777289999948.png"}],"details":{"server":"MiniMax","tool":"understand_image","structuredContent":{"type":"text","text":"Failed to perform VLM analysis: Local image file does not exist: /Users/dhruv2mars/.agent-browser/tmp/screenshots/screenshot-1777289999948.png","annotations":null,"_meta":null},"isError":false},"isError":false,"timestamp":1777290017001}}
{"type":"message","id":"f9cc2e23","parentId":"c2ef9a06","timestamp":"2026-04-27T11:40:19.699Z","message":{"role":"assistant","content":[{"type":"thinking","thinking":"Let me use the correct path.","thinkingSignature":"e8649c034cc1907b2fdaa64a9283df83560c57a2368646ef79dc0450ec6b7d0f"},{"type":"toolCall","id":"call_function_xx02eo3wjsdz_1","name":"bash","arguments":{"command":"ls -la ~/.agent-browser/tmp/screenshots/ | tail -5"}}],"api":"anthropic-messages","provider":"minimax","model":"MiniMax-M2.7","usage":{"input":61941,"output":46,"cacheRead":9348,"cacheWrite":0,"totalTokens":71335,"cost":{"input":0.0185823,"output":0.0000552,"cacheRead":0.0005608799999999999,"cacheWrite":0,"total":0.019198379999999998}},"stopReason":"toolUse","timestamp":1777290017010,"responseId":"063e7e21f2da3fa699111f0b0163db11"}}
{"type":"message","id":"c3e3bab8","parentId":"f9cc2e23","timestamp":"2026-04-27T11:40:19.719Z","message":{"role":"toolResult","toolCallId":"call_function_xx02eo3wjsdz_1","toolName":"bash","content":[{"type":"text","text":"-rw-r--r--@  1 dhruv2mars  staff   108607 27 Apr 17:09 screenshot-1777289953296.png\n-rw-r--r--@  1 dhruv2mars  staff   108622 27 Apr 17:09 screenshot-1777289984340.png\n-rw-r--r--@  1 dhruv2mars  staff   108680 27 Apr 17:10 screenshot-1777290008236.png\n-rw-r--r--@  1 dhruv2mars  staff    40543 11 Apr 09:17 screenshot-2026-04-11T03-47-19-331Z-ct2k98.png\n-rw-r--r--@  1 dhruv2mars  staff    58111 11 Apr 09:18 screenshot-2026-04-11T03-48-21-671Z-39jwfs.png\n"}],"isError":false,"timestamp":1777290019719}}
{"type":"message","id":"a22b5e2d","parentId":"c3e3bab8","timestamp":"2026-04-27T11:40:23.229Z","message":{"role":"assistant","content":[{"type":"thinking","thinking":"Let me analyze the latest screenshot.","thinkingSignature":"96bb7c4218f175cec130fb7d9ffdb724c4db515dfbb1afc538e8adda971f59cc"},{"type":"toolCall","id":"call_function_uc5537crct8x_1","name":"understand_image","arguments":{"prompt":"Show the terminal output.","image_url":"/Users/dhruv2mars/.agent-browser/tmp/screenshots/screenshot-1777290008236.png"}}],"api":"anthropic-messages","provider":"minimax","model":"MiniMax-M2.7","usage":{"input":62210,"output":69,"cacheRead":9348,"cacheWrite":0,"totalTokens":71627,"cost":{"input":0.018663,"output":0.0000828,"cacheRead":0.0005608799999999999,"cacheWrite":0,"total":0.01930668}},"stopReason":"toolUse","timestamp":1777290019724,"responseId":"063e7e24421d2ace2c7a628404873688"}}
{"type":"message","id":"1145ab71","parentId":"a22b5e2d","timestamp":"2026-04-27T11:40:31.944Z","message":{"role":"toolResult","toolCallId":"call_function_uc5537crct8x_1","toolName":"understand_image","content":[{"type":"text","text":"The terminal output shown in the image is as follows:\n\n```text\nMETRIC val_loss=7.1684\nMETRIC val_bpb=3.3256\nMETRIC best_bpb=3.3256\nMETRIC elapsed_s=57\n[CKPT] Best checkpoint saved\nstep:100/2500 train_loss:6.5520 time:125s\nstep=100 val_loss=6.4919 val_bpb=3.0117 best_bpb=3.0117 elapsed_s=126\nMETRIC step=100\nMETRIC val_loss=6.4919\nMETRIC val_bpb=3.0117\nMETRIC best_bpb=3.0117\nMETRIC elapsed_s=126\n[CKPT] Best checkpoint saved\nstep=150 val_loss=6.2248 val_bpb=2.8878 best_bpb=2.8878 elapsed_s=195\nMETRIC step=150\nMETRIC val_loss=6.2248\nMETRIC val_bpb=2.8878\nMETRIC best_bpb=2.8878\nMETRIC elapsed_s=195\n[CKPT] Best checkpoint saved\n\n[1]  + 100120 exit 1    load_conda_and_run python3 ~/parameter-golf/train_kaggle.py 2>&1 | \n       100121 done      head -50\nautoresearch/phase1-20260426 ~/parameter-golf []\n```"}],"details":{"server":"MiniMax","tool":"understand_image","structuredContent":{"type":"text","text":"The terminal output shown in the image is as follows:\n\n```text\nMETRIC val_loss=7.1684\nMETRIC val_bpb=3.3256\nMETRIC best_bpb=3.3256\nMETRIC elapsed_s=57\n[CKPT] Best checkpoint saved\nstep:100/2500 train_loss:6.5520 time:125s\nstep=100 val_loss=6.4919 val_bpb=3.0117 best_bpb=3.0117 elapsed_s=126\nMETRIC step=100\nMETRIC val_loss=6.4919\nMETRIC val_bpb=3.0117\nMETRIC best_bpb=3.0117\nMETRIC elapsed_s=126\n[CKPT] Best checkpoint saved\nstep=150 val_loss=6.2248 val_bpb=2.8878 best_bpb=2.8878 elapsed_s=195\nMETRIC step=150\nMETRIC val_loss=6.2248\nMETRIC val_bpb=2.8878\nMETRIC best_bpb=2.8878\nMETRIC elapsed_s=195\n[CKPT] Best checkpoint saved\n\n[1]  + 100120 exit 1    load_conda_and_run python3 ~/parameter-golf/train_kaggle.py 2>&1 | \n       100121 done      head -50\nautoresearch/phase1-20260426 ~/parameter-golf []\n```","annotations":null,"_meta":null},"isError":false},"isError":false,"timestamp":1777290031944}}
{"type":"message","id":"bc7f59d0","parentId":"1145ab71","timestamp":"2026-04-27T11:40:40.423Z","message":{"role":"assistant","content":[{"type":"thinking","thinking":"The terminal still shows the same output. The `pwd` and `jobs` commands I typed aren't showing up. The `load_conda_and_run` wrapper seems to be intercepting all input somehow. \n\nLet me try a completely different approach - open a new terminal tab.","thinkingSignature":"c87f5689160e7e79eb901f090f4b099301feb9a000869363ccf9b1f8dc88f609"},{"type":"toolCall","id":"call_function_76lwrtmgqsaa_1","name":"bash","arguments":{"command":"agent-browser press \"Control+t\" 2>&1 && sleep 2 && agent-browser screenshot 2>&1"}}],"api":"anthropic-messages","provider":"minimax","model":"MiniMax-M2.7","usage":{"input":62600,"output":104,"cacheRead":9348,"cacheWrite":0,"totalTokens":72052,"cost":{"input":0.018779999999999998,"output":0.0001248,"cacheRead":0.0005608799999999999,"cacheWrite":0,"total":0.01946568}},"stopReason":"toolUse","timestamp":1777290031954,"responseId":"063e7e33fb3556a23abce74bc47110c3"}}
{"type":"message","id":"5b836b0d","parentId":"bc7f59d0","timestamp":"2026-04-27T11:40:43.012Z","message":{"role":"toolResult","toolCallId":"call_function_76lwrtmgqsaa_1","toolName":"bash","content":[{"type":"text","text":"✓ Done\n✓ Screenshot saved to /Users/dhruv2mars/.agent-browser/tmp/screenshots/screenshot-1777290042996.png\n"}],"isError":false,"timestamp":1777290043012}}
{"type":"message","id":"d65a95d8","parentId":"5b836b0d","timestamp":"2026-04-27T11:40:47.601Z","message":{"role":"assistant","content":[{"type":"thinking","thinking":"Let me check if a new tab opened.","thinkingSignature":"d9173e1d63596d735094ed9ac00f610531bfcaf602ccfa0762347ae89cc2a91c"},{"type":"toolCall","id":"call_function_u7o3iek1hdhb_1","name":"understand_image","arguments":{"prompt":"Is there a new terminal tab? What does the screen show?","image_url":"/Users/dhruv2mars/.agent-browser/tmp/screenshots/screenshot-1777290042996.png"}}],"api":"anthropic-messages","provider":"minimax","model":"MiniMax-M2.7","usage":{"input":62750,"output":79,"cacheRead":9348,"cacheWrite":0,"totalTokens":72177,"cost":{"input":0.018824999999999998,"output":0.0000948,"cacheRead":0.0005608799999999999,"cacheWrite":0,"total":0.019480679999999997}},"stopReason":"toolUse","timestamp":1777290043017,"responseId":"063e7e3be07024195330d1b6b41150db"}}
