{"type":"session","version":3,"id":"019dc5c7-496c-717e-a158-99cb06642402","timestamp":"2026-04-25T17:54:25.261Z","cwd":"/Users/dhruv2mars/dev/github/parameter-golf"}
{"type":"model_change","id":"9e944dee","parentId":null,"timestamp":"2026-04-25T17:54:25.415Z","provider":"minimax","modelId":"MiniMax-M2.7"}
{"type":"thinking_level_change","id":"2fdcfb4a","parentId":"9e944dee","timestamp":"2026-04-25T17:54:25.415Z","thinkingLevel":"high"}
{"type":"message","id":"31540029","parentId":"2fdcfb4a","timestamp":"2026-04-25T17:54:41.342Z","message":{"role":"user","content":[{"type":"text","text":"how do i use the pi-autoresearch extension?"}],"timestamp":1777139681279}}
{"type":"message","id":"9378a60e","parentId":"31540029","timestamp":"2026-04-25T17:54:48.228Z","message":{"role":"assistant","content":[{"type":"thinking","thinking":"The user is asking how to use the pi-autoresearch extension. Based on the available skills, I can see there are three autoresearch-related skills:\n\n1. `autoresearch-create` - Set up and run an autonomous experiment loop\n2. `autoresearch-finalize` - Finalize an autoresearch session into clean branches\n3. `autoresearch-hooks` - Author pre/post-iteration hooks\n\nI should read the main skill file for `autoresearch-create` since that's the primary one for setting up and running autoresearch.\n","thinkingSignature":"e442cb7eaf8a86e489449cb2a7c7a16ad3ecabf260675c525643f59a9ed72fd6"},{"type":"toolCall","id":"call_function_qsadi5f3dw89_1","name":"read","arguments":{"path":"/Users/dhruv2mars/.pi/agent/git/github.com/davebcn87/pi-autoresearch/skills/autoresearch-create/SKILL.md"}}],"api":"anthropic-messages","provider":"minimax","model":"MiniMax-M2.7","usage":{"input":9728,"output":171,"cacheRead":0,"cacheWrite":0,"totalTokens":9899,"cost":{"input":0.0029184,"output":0.0002052,"cacheRead":0,"cacheWrite":0,"total":0.0031236}},"stopReason":"toolUse","timestamp":1777139681343,"responseId":"063c32e3fe511109e5fe284ba9744d93"}}
{"type":"message","id":"f0c7db44","parentId":"9378a60e","timestamp":"2026-04-25T17:54:48.280Z","message":{"role":"toolResult","toolCallId":"call_function_qsadi5f3dw89_1","toolName":"read","content":[{"type":"text","text":"---\nname: autoresearch-create\ndescription: Set up and run an autonomous experiment loop for any optimization target. Gathers what to optimize, then starts the loop immediately. Use when asked to \"run autoresearch\", \"optimize X in a loop\", \"set up autoresearch for X\", or \"start experiments\".\n---\n\n# Autoresearch\n\nAutonomous experiment loop: try ideas, keep what works, discard what doesn't, never stop.\n\n## Tools\n\n- **`init_experiment`** — configure session (name, metric, unit, direction). Call again to re-initialize with a new baseline when the optimization target changes.\n- **`run_experiment`** — runs command, times it, captures output.\n- **`log_experiment`** — records result. `keep` auto-commits. `discard`/`crash`/`checks_failed` auto-reverts code changes (autoresearch files preserved). Always include secondary `metrics` dict. Dashboard: ctrl+shift+t.\n\n## Setup\n\n1. Ask (or infer): **Goal**, **Command**, **Metric** (+ direction), **Files in scope**, **Constraints**.\n2. `git checkout -b autoresearch/<goal>-<date>`\n3. Read the source files. Understand the workload deeply before writing anything.\n4. Write `autoresearch.md` and `autoresearch.sh` (see below). Commit both.\n5. `init_experiment` → run baseline → `log_experiment` → start looping immediately.\n\n### `autoresearch.md`\n\nThis is the heart of the session. A fresh agent with no context should be able to read this file and run the loop effectively. Invest time making it excellent.\n\n```markdown\n# Autoresearch: <goal>\n\n## Objective\n<Specific description of what we're optimizing and the workload.>\n\n## Metrics\n- **Primary**: <name> (<unit>, lower/higher is better) — the optimization target\n- **Secondary**: <name>, <name>, ... — independent tradeoff monitors\n\n## How to Run\n`./autoresearch.sh` — outputs `METRIC name=number` lines.\n\n## Files in Scope\n<Every file the agent may modify, with a brief note on what it does.>\n\n## Off Limits\n<What must NOT be touched.>\n\n## Constraints\n<Hard rules: tests must pass, no new deps, etc.>\n\n## What's Been Tried\n<Update this section as experiments accumulate. Note key wins, dead ends,\nand architectural insights so the agent doesn't repeat failed approaches.>\n```\n\nUpdate `autoresearch.md` periodically — especially the \"What's Been Tried\" section — so resuming agents have full context.\n\n### `autoresearch.sh`\n\nBash script (`set -euo pipefail`) that: pre-checks fast (syntax errors in <1s), runs the benchmark, and outputs structured lines to stdout. Keep the script fast — every second is multiplied by hundreds of runs.\n\n**For fast, noisy benchmarks** (< 5s), run the workload multiple times inside the script and report the median. This produces stable data points and makes the confidence score reliable from the start. Slow workloads (ML training, large builds) don't need this — single runs are fine.\n\n#### Structured output\n\n- `METRIC name=value` — primary metric (must match `init_experiment`'s `metric_name`) and any secondary metrics. Parsed automatically by `run_experiment`.\n\n#### Design the script to inform optimization\n\nThe script should output **whatever data helps you make better decisions in the next iteration.** Think about what you'll need to see after each run to know where to focus:\n\n- Phase timings when the workload has distinct stages\n- Error counts, failure categories, or test names when checks can fail in different ways\n- Memory usage, cache hit rates, or other runtime diagnostics when relevant\n- Anything domain-specific that would help localize regressions or identify bottlenecks\n\nThe script runs the same code every iteration — but you can **update it during the loop** if you discover you need more signal. Add instrumentation as you learn what matters.\n\n#### Agent-supplied ASI via `log_experiment`\n\nUse `log_experiment`'s `asi` parameter to annotate each run with **whatever would help the next iteration make a better decision.** Free-form key/value pairs — you decide what's worth recording. Don't repeat the description or raw output; capture what you'd lose after a context reset.\n\n**Annotate failures and crashes heavily.** Discarded and crashed runs are reverted — the code changes are gone. The only record that survives is the description and ASI in `autoresearch.jsonl`. If you don't capture what you tried and why it failed, future iterations will waste time re-discovering the same dead ends.\n\n### `autoresearch.config.json` (optional)\n\nJSON config file that lives in the pi session's working directory (`ctx.cwd`). Supported fields:\n\n- **`maxIterations`** (number) — maximum experiments before auto-stopping.\n- **`workingDir`** (string) — override the directory for all autoresearch operations: file I/O (`autoresearch.jsonl`, `autoresearch.md`, `autoresearch.sh`, `autoresearch.checks.sh`, `autoresearch.ideas.md`), command execution, and git operations. Supports absolute paths or relative paths (resolved against `ctx.cwd`). The config file itself always stays in `ctx.cwd`. Fails if the directory doesn't exist.\n\n```json\n{\n  \"workingDir\": \"/path/to/project\",\n  \"maxIterations\": 50\n}\n```\n\n### `autoresearch.checks.sh` (optional)\n\nBash script (`set -euo pipefail`) for backpressure/correctness checks: tests, types, lint, etc. **Only create this file when the user's constraints require correctness validation** (e.g., \"tests must pass\", \"types must check\").\n\nWhen this file exists:\n- Runs automatically after every **passing** benchmark in `run_experiment`.\n- If checks fail, `run_experiment` reports it clearly — log as `checks_failed`.\n- Its execution time does **NOT** affect the primary metric.\n- You cannot `keep` a result when checks have failed.\n- Has a separate timeout (default 300s, configurable via `checks_timeout_seconds`).\n\nWhen this file does **not** exist, everything behaves exactly as before — no changes to the loop.\n\n**Keep output minimal.** Only the last 80 lines of checks output are fed back to the agent on failure. Suppress verbose progress/success output and let only errors through. This keeps context lean and helps the agent pinpoint what broke.\n\n```bash\n#!/bin/bash\nset -euo pipefail\n# Example: run tests and typecheck — suppress success output, only show errors\npnpm test --run --reporter=dot 2>&1 | tail -50\npnpm typecheck 2>&1 | grep -i error || true\n```\n\n## Loop Rules\n\n**LOOP FOREVER.** Never ask \"should I continue?\" — the user expects autonomous work.\n\n- **Primary metric is king.** Improved → `keep`. Worse/equal → `discard`. Secondary metrics rarely affect this.\n- **Annotate every run with `asi`.** Record what you learned — not what you did. What would help the next iteration or a fresh agent resuming this session?\n- **Watch the confidence score.** After 3+ runs, `log_experiment` reports a confidence score (best improvement as a multiple of the session noise floor). ≥2.0× means the improvement is likely real. <1.0× means it's within noise — consider re-running to confirm before keeping. The score is advisory — it never auto-discards.\n- **Simpler is better.** Removing code for equal perf = keep. Ugly complexity for tiny gain = probably discard.\n- **Don't thrash.** Repeatedly reverting the same idea? Try something structurally different.\n- **Crashes:** fix if trivial, otherwise log and move on. Don't over-invest.\n- **Think longer when stuck.** Re-read source files, study the profiling data, reason about what the CPU is actually doing. The best ideas come from deep understanding, not from trying random variations.\n- **Resuming:** if `autoresearch.md` exists, read it + git log, continue looping.\n\n**NEVER STOP.** The user may be away for hours. Keep going until interrupted.\n\n## Ideas Backlog\n\nWhen you discover complex but promising optimizations that you won't pursue right now, **append them as bullets to `autoresearch.ideas.md`**. Don't let good ideas get lost.\n\nOn resume (context limit, crash), check `autoresearch.ideas.md` — prune stale/tried entries, experiment with the rest. When all paths are exhausted, delete the file and write a final summary.\n\n## User Messages During Experiments\n\nIf the user sends a message while an experiment is running, finish the current `run_experiment` + `log_experiment` cycle first, then incorporate their feedback in the next iteration. Don't abandon a running experiment.\n"}],"isError":false,"timestamp":1777139688280}}
{"type":"message","id":"252c84bc","parentId":"f0c7db44","timestamp":"2026-04-25T17:55:07.886Z","message":{"role":"assistant","content":[{"type":"thinking","thinking":"The user asked about how to use the pi-autoresearch extension. I've read the SKILL.md file which explains the full autoresearch workflow. Let me provide a concise summary.\n","thinkingSignature":"c5a38402cc283c6f10d70792ce6e01f56ff4c0c33dd0a8da93d97231594e9ea1"},{"type":"text","text":"\n\n## pi-autoresearch — Quick Guide\n\n**Autonomous experiment loop**: tries ideas, keeps winners, discards losers.\n\n### Setup (one-time per session)\n\n1. **Define your goal**: what to optimize, which metric, command to run, files in scope\n2. **Create branch**: `git checkout -b autoresearch/<goal>-<date>`\n3. **Read source files** deeply first\n4. **Write two files**:\n   - `autoresearch.md` — defines objective, metrics, files, constraints, what's been tried\n   - `autoresearch.sh` — benchmark script that outputs `METRIC name=value` lines\n5. **Commit both**, then initialize\n\n### Commands\n\n| Tool | Purpose |\n|------|---------|\n| `init_experiment` | Set session name, primary metric, unit, direction (lower/higher is better) |\n| `run_experiment` | Execute benchmark, capture timing + output |\n| `log_experiment` | Record result with status (`keep`/`discard`/`crash`/`checks_failed`) |\n\n### Workflow\n\n```\ninit_experiment\nrun_experiment → log_experiment (baseline)\n↓ loop\nrun_experiment → log_experiment\n```\n\n### Key Rules\n\n- **Loop forever** — never ask to continue, keep going until interrupted\n- **Primary metric rules**: improved → `keep`, worse/equal → `discard`\n- **Always use `asi` param** in `log_experiment` — annotates what you learned (crashes get auto-reverted, so this is the only record)\n- **Watch confidence score** (after 3+ runs): ≥2× = likely real, <1× = noise\n- **Simpler is better**: removal for equal perf = keep\n- **Don't thrash**: if you keep reverting same idea, try something structurally different\n\n### Optional Files\n\n- `autoresearch.config.json` — `maxIterations`, `workingDir`\n- `autoresearch.checks.sh` — correctness validation (tests, types, lint). Only create if needed.\n- `autoresearch.ideas.md` — backlog of promising ideas to try later\n\n### Example Start\n\n```bash\n# 1. Create branch\ngit checkout -b autoresearch/optimize-parse-speed-$(date +%Y%m%d)\n\n# 2. Write autoresearch.sh (outputs METRIC total_ms=42)\n./autoresearch.sh\n\n# 3. Initialize session\ninit_experiment(name=\"Faster parsing\", metric_name=\"total_ms\", metric_unit=\"ms\", direction=\"lower\")\n\n# 4. Run baseline\nrun_experiment(command=\"./autoresearch.sh\")\n# Then log_experiment with baseline metrics\n\n# 5. Start looping\n```"}],"api":"anthropic-messages","provider":"minimax","model":"MiniMax-M2.7","usage":{"input":1979,"output":602,"cacheRead":9664,"cacheWrite":0,"totalTokens":12245,"cost":{"input":0.0005937,"output":0.0007224,"cacheRead":0.00057984,"cacheWrite":0,"total":0.00189594}},"stopReason":"stop","timestamp":1777139688282,"responseId":"063c32e88d32e880562272fbc3c988e5"}}
{"type":"message","id":"46720a34","parentId":"252c84bc","timestamp":"2026-04-25T18:05:28.815Z","message":{"role":"user","content":[{"type":"text","text":"ok, great. so i want to use this extension and start an autoresearch loop. currently, we are working towards making our model score better on bpb leaderboard ranking, for parameter-golf challenge from openai. \n\nOUR ULTIMATE GOAL IS: building the best language model that fits under 16mb. and it bpb is sub 1, ideally in the range of 0.5-0.6. \n\nCurrently our architecture that we decided is okay-ish. with the hope that it will achieve our goal. considering we do these 3 things:\n1. extend the training time\n2. add TTT\n3. add PPM hybrid\n\nOUR SETUP: we use kaggle for training. where we utilize 2x t4 gpus. where we have no limits on compute and resources, 30hrs of gpu quota. and max session run is 12hrs. \n\n\nNOW, what i want with autoresearch is to make sure that our model achieve its ultimate goal (sub-1, ideally 0.5-0.6 bpb). \n\n\nwhats your thoughts about this?? the autoresearch setup?? use /grill-me skill."}],"timestamp":1777140328809}}
{"type":"message","id":"6cce9184","parentId":"46720a34","timestamp":"2026-04-25T18:05:34.169Z","message":{"role":"assistant","content":[{"type":"thinking","thinking":"The user wants to use the autoresearch extension to optimize their model for the parameter-golf challenge. They want to achieve sub-1 bpb (ideally 0.5-0.6) with a model under 16MB. They have 3 planned improvements: extended training, TTT, and PPM hybrid. They want to use the /grill-me skill to stress-test this plan.\n\nLet me load the grill-me skill first.\n","thinkingSignature":"53399da5f17943d801b11ca8a0c2ae681fd444a3a985cc77ac0e1b10728a14b9"},{"type":"toolCall","id":"call_function_8szb4juccma5_1","name":"read","arguments":{"path":"/Users/dhruv2mars/.pi/agent/skills/grill-me/SKILL.md"}}],"api":"anthropic-messages","provider":"minimax","model":"MiniMax-M2.7","usage":{"input":12458,"output":135,"cacheRead":0,"cacheWrite":0,"totalTokens":12593,"cost":{"input":0.0037373999999999997,"output":0.00016199999999999998,"cacheRead":0,"cacheWrite":0,"total":0.0038993999999999995}},"stopReason":"toolUse","timestamp":1777140328816,"responseId":"063c356af8bdc9c16dfcb290ce9548da"}}
{"type":"message","id":"f048805a","parentId":"6cce9184","timestamp":"2026-04-25T18:05:34.183Z","message":{"role":"toolResult","toolCallId":"call_function_8szb4juccma5_1","toolName":"read","content":[{"type":"text","text":"---\nname: grill-me\ndescription: Interview the user relentlessly about a plan or design until reaching shared understanding, resolving each branch of the decision tree. Use when user wants to stress-test a plan, get grilled on their design, or mentions \"grill me\".\n---\n\nInterview me relentlessly about every aspect of this plan until we reach a shared understanding. Walk down each branch of the design tree, resolving dependencies between decisions one-by-one. For each question, provide your recommended answer.\n\nAsk the questions one at a time.\n\nIf a question can be answered by exploring the codebase, explore the codebase instead.\n"}],"isError":false,"timestamp":1777140334183}}
{"type":"message","id":"6f0cfcfe","parentId":"f048805a","timestamp":"2026-04-25T18:05:37.032Z","message":{"role":"assistant","content":[{"type":"thinking","thinking":"The user wants to use the grill-me skill to stress-test their plan for using autoresearch to optimize their model for the parameter-golf challenge. Let me start interviewing them systematically about their plan.\n\nLet me start by understanding the goal and the current state.\n","thinkingSignature":"8a5d04ecc46d3d7dabc7279fa7f358734b070ce06516ac82d3fcbaa216440c8b"},{"type":"text","text":"\n\nLet's stress-test this plan. I'll interview you relentlessly until we have shared understanding.\n\n**First question: What is your current bpb score?**\n\nI need to know where you're starting from before we can design an effective optimization loop. What's the baseline you're trying to beat?"}],"api":"anthropic-messages","provider":"minimax","model":"MiniMax-M2.7","usage":{"input":219,"output":107,"cacheRead":12416,"cacheWrite":0,"totalTokens":12742,"cost":{"input":0.0000657,"output":0.0001284,"cacheRead":0.0007449599999999999,"cacheWrite":0,"total":0.0009390599999999999}},"stopReason":"stop","timestamp":1777140334186,"responseId":"063c356e1b77ef524b857390befd7fa4"}}
{"type":"message","id":"27fe0673","parentId":"6f0cfcfe","timestamp":"2026-04-25T18:07:32.853Z","message":{"role":"user","content":[{"type":"text","text":"you should checkout the whole repo, you will find much more info and context. \n\n- current ~2.65 bpb on 10 min training run."}],"timestamp":1777140452846}}
{"type":"message","id":"f976d015","parentId":"27fe0673","timestamp":"2026-04-25T18:07:42.887Z","message":{"role":"assistant","content":[{"type":"thinking","thinking":"Let me explore the repo to understand the project better. I should look at the codebase, docs, training configs, and any existing results.\n","thinkingSignature":"30b876a26acf5efe6b046d1f92b572d6630bcf7b180c099d3eb1640483e88300"},{"type":"toolCall","id":"call_function_k8ppo6s4784y_1","name":"bash","arguments":{"command":"find /Users/dhruv2mars/dev/github/parameter-golf -type f | head -80"}},{"type":"toolCall","id":"call_function_k8ppo6s4784y_2","name":"bash","arguments":{"command":"ls -la /Users/dhruv2mars/dev/github/parameter-golf/"}}],"api":"anthropic-messages","provider":"minimax","model":"MiniMax-M2.7","usage":{"input":122,"output":108,"cacheRead":12608,"cacheWrite":0,"totalTokens":12838,"cost":{"input":0.000036599999999999995,"output":0.0001296,"cacheRead":0.0007564799999999999,"cacheWrite":0,"total":0.0009226799999999999}},"stopReason":"toolUse","timestamp":1777140452853,"responseId":"063c35e61f50761c41ef245d25e426ab"}}
