{"type":"message","id":"fa996b06","parentId":"ff8ae0db","timestamp":"2026-04-27T09:23:59.424Z","message":{"role":"toolResult","toolCallId":"call_function_49gpmbl67ivv_1","toolName":"log_experiment","content":[{"type":"text","text":"Logged #49: keep — 4hr extended: 1.872 BPB! Still improving strongly!\nBaseline val_bpb: 2.38bpb | this: 1.87bpb (-21.3%)\nSecondary: artifact_mb: 12.10mb (0.0%)  best_val_bpb: 1.87 (-21.3%)  steps: 9,000 (+679.2%)\n📋 ASI: arch: rope32+ema994+clip0.3+qk4+warmdown0.80+lr0.0008 | conclusion: 4hr = 1.87 BPB! Still improving strongly! | extended_training: true | gap_to_sub1: 0.87 | scaling: 30min:2.30 → 2hr:1.96 → 4hr:1.87\n📊 Confidence: 19.3× noise floor — improvement is likely real\n(49 experiments)\n📝 Git: committed — "}],"details":{"experiment":{"commit":"f0a8b35","metric":1.8724,"metrics":{"artifact_mb":12.1,"best_val_bpb":1.8724,"steps":9000},"status":"keep","description":"4hr extended: 1.872 BPB! Still improving strongly!","timestamp":1777281829264,"segment":0,"confidence":19.262357414448672,"iterationTokens":null,"asi":{"arch":"rope32+ema994+clip0.3+qk4+warmdown0.80+lr0.0008","conclusion":"4hr = 1.87 BPB! Still improving strongly!","extended_training":true,"gap_to_sub1":0.87,"scaling":"30min:2.30 → 2hr:1.96 → 4hr:1.87"}},"state":{"results":[{"commit":"a672845","metric":2.379,"metrics":{"best_val_bpb":2.379,"steps":1155,"artifact_mb":12.1},"status":"keep","description":"30-min baseline: 2.379 val_bpb, 1155 steps, still improving","timestamp":1777144208804,"segment":0,"confidence":null,"iterationTokens":null,"asi":{"baseline_30min":true,"steps_completed":1155,"max_iterations":7000,"pct_exhausted":16.5,"loss_still_declining":true,"artifact_mb":12.1,"gap_to_sub1":1.879}},{"commit":"a672845","metric":2.3857,"metrics":{"artifact_mb":12.3,"best_val_bpb":2.3857,"steps":1200},"status":"discard","description":"TTT crashed: dtype mismatch in CastedLinear (bf16/float32)","timestamp":1777146462942,"segment":0,"confidence":null,"iterationTokens":null,"asi":{"error":"mat1 mat2 dtype mismatch bf16 vs float","fix_needed":"CastedLinear cast weights to match autocast dtype","ttt_broken":true}},{"commit":"e8ecad4","metric":2.3821,"metrics":{"artifact_mb":12.3,"best_val_bpb":2.3821,"steps":1200},"status":"discard","description":"TTT still broken: OOM from attention .float() creating 32GB matrix","timestamp":1777148696907,"segment":0,"confidence":null,"iterationTokens":null,"asi":{"error":"OOM: attention .float() creates 32GB matrix","fix_needed":"Remove .float() or use bf16 for attention scores","ttt_broken":true}},{"commit":"de16801","metric":2.4351,"metrics":{"artifact_mb":12.3,"best_val_bpb":2.4351,"steps":1200},"status":"discard","description":"TTT still OOM: eval loop also has memory issues","timestamp":1777150932661,"segment":0,"confidence":null,"iterationTokens":null,"asi":{"error":"OOM still in TTT eval loop","fix_needed":"Reduce eval tokens per chunk, or skip TTT for now","ttt_broken":true}},{"commit":"de16801","metric":2.4265,"metrics":{"artifact_mb":12.3,"best_val_bpb":2.4265,"steps":900},"status":"discard","description":"Wider arch (9L-640d) too slow, timed out at 900 steps","timestamp":1777155540944,"segment":0,"confidence":null,"iterationTokens":null,"asi":{"arch":"9L-640d-10H/5KV","conclusion":"wider model too slow, hit wallclock before converging","error":"SIGTERM/SIGABRT - wallclock timeout","result":"worse than baseline","steps":900}},{"commit":"de16801","metric":2.4179,"metrics":{"artifact_mb":12.1,"best_val_bpb":2.4179,"steps":1000},"status":"discard","description":"Deeper/narrower (13L-480d): 2.418 val_bpb, worse","timestamp":1777157778800,"segment":0,"confidence":null,"iterationTokens":null,"asi":{"arch":"13L-480d-8H/4KV","conclusion":"narrower model underfits","result":"worse than baseline"}},{"commit":"de16801","metric":2.4755,"metrics":{"artifact_mb":12.1,"best_val_bpb":2.4755,"steps":1600},"status":"discard","description":"Seq1024 + batch4096: 2.48 val_bpb, worse","timestamp":1777160126335,"segment":0,"confidence":null,"iterationTokens":null,"asi":{"arch":"11L-512d, seq_len=1024","conclusion":"longer context underfits - fewer steps per time","result":"worse than baseline"}},{"commit":"de16801","metric":2.4523,"metrics":{"artifact_mb":12.1,"best_val_bpb":2.4523,"steps":900},"status":"discard","description":"More depth loops (3x, layers 3-6): 2.452 val_bpb","timestamp":1777162354973,"segment":0,"confidence":null,"iterationTokens":null,"asi":{"arch":"11L-512d, 3 loops on layers 3-6","conclusion":"more depth recurrence = slower = fewer steps = worse","result":"worse than baseline"}},{"commit":"de16801","metric":2.3948,"metrics":{"artifact_mb":12.1,"best_val_bpb":2.3948,"steps":1200},"status":"discard","description":"Higher LR (0.002): 2.395, slightly worse","timestamp":1777164584746,"segment":0,"confidence":null,"iterationTokens":null,"asi":{"conclusion":"higher LR converges faster but worse final","hyperparam":"lr=0.002"}},{"commit":"de16801","metric":2.382,"metrics":{"artifact_mb":12.1,"best_val_bpb":2.382,"steps":1100},"status":"keep","description":"Lower LR (0.0005): 2.382, within noise of baseline","timestamp":1777166805914,"segment":0,"confidence":null,"iterationTokens":null,"asi":{"conclusion":"lower LR marginally worse but within noise - may generalize better","hyperparam":"lr=0.0005"}},{"commit":"de16801","metric":2.3871,"metrics":{"artifact_mb":12.1,"best_val_bpb":2.3871,"steps":1200},"status":"discard","description":"Shorter warmdown (0.6): 2.387, slightly worse","timestamp":1777169035789,"segment":0,"confidence":null,"iterationTokens":null,"asi":{"conclusion":"shorter warmdown slightly worse","hyperparam":"warmdown=0.6"}},{"commit":"de16801","metric":2.3903,"metrics":{"artifact_mb":12.1,"best_val_bpb":2.3903,"steps":1100},"status":"discard","description":"Lower WD (0.05): 2.390, slightly worse","timestamp":1777171253884,"segment":0,"confidence":null,"iterationTokens":null,"asi":{"conclusion":"lower weight decay slightly worse","hyperparam":"wd=0.05"}},{"commit":"de16801","metric":2.3767,"metrics":{"artifact_mb":12.1,"best_val_bpb":2.3767,"steps":1100},"status":"keep","description":"Higher WD (0.15): 2.377, BEST so far! Better than baseline","timestamp":1777173486921,"segment":0,"confidence":0.2035398230088492,"iterationTokens":null,"asi":{"conclusion":"higher WD improves BPB by ~0.002","hyperparam":"wd=0.15"}},{"commit":"de16801","metric":2.4075,"metrics":{"artifact_mb":12.1,"best_val_bpb":2.4075,"steps":1100},"status":"discard","description":"WD0.15 + warmdown0.8: 2.408, worse","timestamp":1777175717625,"segment":0,"confidence":0.16140350877192655,"iterationTokens":null,"asi":{"conclusion":"longer warmdown worse with higher WD","hyperparam":"wd=0.15, warmdown=0.8"}},{"commit":"de16801","metric":2.4864,"metrics":{"artifact_mb":12.1,"best_val_bpb":2.4864,"steps":1100},"status":"discard","description":"ROPE 8 dims: 2.486, much worse","timestamp":1777177952414,"segment":0,"confidence":0.14556962025316225,"iterationTokens":null,"asi":{"arch":"rope_dims=8","conclusion":"less RoPE = much worse","result":"much worse"}},{"commit":"de16801","metric":2.3565,"metrics":{"artifact_mb":12.1,"best_val_bpb":2.3565,"steps":1100},"status":"keep","description":"ROPE 24 dims: 2.357, NEW BEST! 2.4% better than baseline","timestamp":1777180169789,"segment":0,"confidence":1.4610389610389511,"iterationTokens":null,"asi":{"arch":"rope_dims=24","conclusion":"more RoPE is a REAL win - 2.4% better than baseline","result":"BEST so far - significant"}},{"commit":"de16801","metric":2.3531,"metrics":{"artifact_mb":12.1,"best_val_bpb":2.3531,"steps":1100},"status":"keep","description":"ROPE 24 + WD 0.15: 2.353, COMBINED BEST!","timestamp":1777182401297,"segment":0,"confidence":1.5058139534883455,"iterationTokens":null,"asi":{"arch":"rope_dims=24 + wd=0.15","conclusion":"COMBINING best findings: rope24 + wd15 = another small win","result":"NEW BEST - 1.1% better than rope24 alone"}},{"commit":"de16801","metric":2.331,"metrics":{"artifact_mb":12.1,"best_val_bpb":2.331,"steps":1100},"status":"keep","description":"ROPE 32 dims: 2.331, MASSIVE IMPROVEMENT! 2% better than baseline","timestamp":1777184633015,"segment":0,"confidence":2,"iterationTokens":null,"asi":{"arch":"rope_dims=32","conclusion":"HUGE WIN - rope32 is 2% better than baseline","result":"MASSIVE BEST - 2% improvement"}},{"commit":"de16801","metric":2.3341,"metrics":{"artifact_mb":12.1,"best_val_bpb":2.3341,"steps":1100},"status":"discard","description":"ROPE 32 + WD 0.15: 2.334, slightly worse than rope32 alone","timestamp":1777186873742,"segment":0,"confidence":1.5686274509803841,"iterationTokens":null,"asi":{"arch":"rope_dims=32 + wd=0.15","conclusion":"adding wd15 to rope32 doesn't help further"}},{"commit":"de16801","metric":2.3314,"metrics":{"artifact_mb":12.1,"best_val_bpb":2.3314,"steps":1100},"status":"discard","description":"ROPE 32 + WD 0.10: 2.331, same as rope32","timestamp":1777189126449,"segment":0,"confidence":1.5635179153094503,"iterationTokens":null,"asi":{"arch":"rope_dims=32 + wd=0.10","conclusion":"wd=0.10 no benefit over rope32 alone"}},{"commit":"de16801","metric":2.3493,"metrics":{"artifact_mb":12.1,"best_val_bpb":2.3493,"steps":1100},"status":"discard","description":"ROPE 48 dims: 2.349, worse than rope32","timestamp":1777191365822,"segment":0,"confidence":1.4906832298136656,"iterationTokens":null,"asi":{"arch":"rope_dims=48","conclusion":"rope48 worse than rope32 - sweet spot around rope32"}},{"commit":"de16801","metric":2.3564,"metrics":{"artifact_mb":12.1,"best_val_bpb":2.3564,"steps":1100},"status":"discard","description":"ROPE 28 dims: 2.356, confirms rope32 is the peak","timestamp":1777193581685,"segment":0,"confidence":1.6466552315609053,"iterationTokens":null,"asi":{"arch":"rope_dims=28","conclusion":"rope28 worse than rope32 - confirms peak around 32"}},{"commit":"de16801","metric":2.3319,"metrics":{"artifact_mb":12.1,"best_val_bpb":2.3319,"steps":1200},"status":"discard","description":"ROPE 32 + LR 0.0005: 2.332, same as rope32","timestamp":1777195798042,"segment":0,"confidence":1.6551724137931099,"iterationTokens":null,"asi":{"arch":"rope_dims=32 + lr=0.0005","conclusion":"lower LR no further benefit with rope32"}},{"commit":"de16801","metric":2.3469,"metrics":{"artifact_mb":12.1,"best_val_bpb":2.3469,"steps":1100},"status":"discard","description":"ROPE 32 + EMA 0.999: 2.347, worse than rope32","timestamp":1777200322812,"segment":0,"confidence":1.5559157212317658,"iterationTokens":null,"asi":{"arch":"rope_dims=32 + ema=0.999","conclusion":"higher EMA slows convergence, slightly worse"}},{"commit":"de16801","metric":2.3258,"metrics":{"artifact_mb":12.1,"best_val_bpb":2.3258,"steps":1200},"status":"keep","description":"ROPE 32 + EMA 0.994: 2.326, NEW BEST by combining rope32 + lower EMA!","timestamp":1777202534320,"segment":0,"confidence":1.6269113149846983,"iterationTokens":null,"asi":{"arch":"rope_dims=32 + ema=0.994","conclusion":"lower EMA decay (faster update) helps - NEW BEST!","result":"NEW BEST by combining rope32 + lower EMA"}},{"commit":"de16801","metric":2.3093,"metrics":{"artifact_mb":12.1,"best_val_bpb":2.3093,"steps":1100},"status":"keep","description":"ROPE 32 + EMA 0.994 + GRAD_CLIP 0.3: 2.309, HUGE WIN! 3% better than baseline","timestamp":1777204827391,"segment":0,"confidence":2.1512345679012386,"iterationTokens":null,"asi":{"arch":"rope32 + ema994 + clip0.3","conclusion":"tighter gradient clipping helps convergence - MAJOR win!","result":"NEW BEST - 3% better than baseline!"}},{"commit":"de16801","metric":2.3521,"metrics":{"artifact_mb":12.1,"best_val_bpb":2.3521,"steps":1000},"status":"discard","description":"12L + rope32/ema994/clip0.3: 2.352, too slow (1000 steps), worse","timestamp":1777209402828,"segment":0,"confidence":2.346801346801345,"iterationTokens":null,"asi":{"arch":"12L-512d + rope32 + ema994 + clip0.3","conclusion":"12 layers too slow, hit wallclock early, worse than best"}},{"commit":"de16801","metric":2.3179,"metrics":{"artifact_mb":12.1,"best_val_bpb":2.3179,"steps":1100},"status":"discard","description":"Wider/shallower (10L-576d-9H): 2.318, slightly worse than best","timestamp":1777211810396,"segment":0,"confidence":2.300330033003304,"iterationTokens":null,"asi":{"arch":"10L-576d-9H/3KV + rope32 + ema994 + clip0.3","conclusion":"wider shallower slightly worse than 11L-512d best"}},{"commit":"de16801","metric":2.3123,"metrics":{"artifact_mb":12.1,"best_val_bpb":2.3123,"steps":1100},"status":"discard","description":"Best config + clip 0.2: 2.312, slightly worse than clip0.3","timestamp":1777214053140,"segment":0,"confidence":2.262987012987004,"iterationTokens":null,"asi":{"arch":"rope32 + ema994 + clip0.2","conclusion":"clip0.2 slightly worse than clip0.3"}},{"commit":"de16801","metric":2.3133,"metrics":{"artifact_mb":12.1,"best_val_bpb":2.3133,"steps":1100},"status":"discard","description":"Best config + clip 0.4: 2.313, slightly worse than clip0.3","timestamp":1777216277397,"segment":0,"confidence":2.07440476190476,"iterationTokens":null,"asi":{"arch":"rope32 + ema994 + clip0.4","conclusion":"clip0.4 slightly worse than clip0.3, confirms sweet spot"}},{"commit":"de16801","metric":2.3193,"metrics":{"artifact_mb":12.1,"best_val_bpb":2.3193,"steps":1100},"status":"discard","description":"Best config + QK gain 6.0: 2.319, slightly worse","timestamp":1777218495202,"segment":0,"confidence":2.2777777777777675,"iterationTokens":null,"asi":{"arch":"rope32 + ema994 + clip0.3 + qk6.0","conclusion":"higher QK gain slightly worse"}},{"commit":"de16801","metric":2.3104,"metrics":{"artifact_mb":12.1,"best_val_bpb":2.3104,"steps":1100},"status":"keep","description":"Best config + QK gain 4.5: 2.310, NEW BEST!","timestamp":1777220801672,"segment":0,"confidence":2.27406199021207,"iterationTokens":null,"asi":{"arch":"rope32 + ema994 + clip0.3 + qk4.5","conclusion":"QK gain 4.5 is the sweet spot! New best!","result":"NEW BEST - 2.3104"}},{"commit":"8f3abc1","metric":2.3077,"metrics":{"artifact_mb":12.1,"best_val_bpb":2.3077,"steps":1100},"status":"keep","description":"Best config + QK gain 4.0: 2.308, NEW BEST!","timestamp":1777225293458,"segment":0,"confidence":2.322475570032541,"iterationTokens":null,"asi":{"arch":"rope32 + ema994 + clip0.3 + qk4.0","conclusion":"QK gain 4.0 is the sweet spot! New best!","result":"NEW BEST - 2.3077"}},{"commit":"8f3abc1","metric":2.3099,"metrics":{"artifact_mb":12.1,"best_val_bpb":2.3099,"steps":1100},"status":"discard","description":"QK gain 3.5: 2.310, slightly worse than 4.0","timestamp":1777227678164,"segment":0,"confidence":2.103244837758107,"iterationTokens":null,"asi":{"arch":"rope32 + ema994 + clip0.3 + qk3.5","conclusion":"QK 3.5 slightly worse than 4.0, confirms peak around 4.0"}},{"commit":"8f3abc1","metric":2.3159,"metrics":{"artifact_mb":12.1,"best_val_bpb":2.3159,"steps":1300},"status":"discard","description":"Best config + TTT v3: STILL OOM, TTT broken on T4","timestamp":1777230037914,"segment":0,"confidence":2.0970588235293937,"iterationTokens":null,"asi":{"arch":"rope32+ema994+clip0.3+qk4+TTT","conclusion":"TTT still OOM even with conservative settings - T4 memory too constrained","error":"OOM in TTT SGD step","ttt_broken":true}},{"commit":"8f3abc1","metric":2.3067,"metrics":{"artifact_mb":12.1,"best_val_bpb":2.3067,"steps":1100},"status":"keep","description":"Best config + warmdown 0.75: 2.307, NEW BEST!","timestamp":1777232261512,"segment":0,"confidence":2.0895953757225265,"iterationTokens":null,"asi":{"arch":"rope32+ema994+clip0.3+qk4+warmdown0.75","conclusion":"warmdown 0.75 slightly better! New best!","result":"NEW BEST - 2.3067"}},{"commit":"8f3abc1","metric":2.3016,"metrics":{"artifact_mb":12.1,"best_val_bpb":2.3016,"steps":1100},"status":"keep","description":"Best config + warmdown 0.78: 2.302, NEW BEST!","timestamp":1777234494044,"segment":0,"confidence":2.2114285714285598,"iterationTokens":null,"asi":{"arch":"rope32+ema994+clip0.3+qk4+warmdown0.78","conclusion":"warmdown 0.78 even better! 3.3% better than baseline!","result":"NEW BEST - 2.3016"}},{"commit":"8f3abc1","metric":2.3014,"metrics":{"artifact_mb":12.1,"best_val_bpb":2.3014,"steps":1100},"status":"keep","description":"Best config + warmdown 0.80: 2.301, TINY NEW BEST!","timestamp":1777236733651,"segment":0,"confidence":2.1736694677870942,"iterationTokens":null,"asi":{"arch":"rope32+ema994+clip0.3+qk4+warmdown0.80","conclusion":"warmdown 0.80 marginally better! 3.3% better than baseline!","result":"TINY NEW BEST - 2.3014"}},{"commit":"8f3abc1","metric":2.308,"metrics":{"artifact_mb":12.1,"best_val_bpb":2.308,"steps":1100},"status":"discard","description":"warmdown 0.82: 2.308, slightly worse than 0.80","timestamp":1777238978674,"segment":0,"confidence":2.1318681318681296,"iterationTokens":null,"asi":{"arch":"rope32+ema994+clip0.3+qk4+warmdown0.82","conclusion":"warmdown 0.82 worse than 0.80, peak around 0.78-0.80"}},{"commit":"8f3abc1","metric":2.2996,"metrics":{"artifact_mb":12.1,"best_val_bpb":2.2996,"steps":1100},"status":"keep","description":"Best config + LR 0.0008: 2.300, NEW BEST!","timestamp":1777241208547,"segment":0,"confidence":2.163487738419625,"iterationTokens":null,"asi":{"arch":"rope32+ema994+clip0.3+qk4+warmdown0.80+lr0.0008","conclusion":"lower LR 0.0008 helps! 3.4% better than baseline!","result":"NEW BEST - 2.2996"}},{"commit":"8f3abc1","metric":999,"metrics":{"artifact_mb":0,"best_val_bpb":0,"steps":1200},"status":"crash","description":"LR 0.0006: timed out at 1200 steps, no result","timestamp":1777245733101,"segment":0,"confidence":2.1459459459459542,"iterationTokens":null,"asi":{"arch":"rope32+ema994+clip0.3+qk4+warmdown0.80+lr0.0006","conclusion":"too slow - timed out before getting results","error":"wallclock timeout","result":"no result"}},{"commit":"8f3abc1","metric":2.3236,"metrics":{"artifact_mb":12.1,"best_val_bpb":2.3236,"steps":600},"status":"discard","description":"Batch 16k: 2.324, WORSE - fewer steps (600)","timestamp":1777247961448,"segment":0,"confidence":2.163487738419625,"iterationTokens":null,"asi":{"arch":"rope32+ema994+clip0.3+qk4+warmdown0.80+lr0.0008+batch16k","conclusion":"larger batch = fewer steps (600 vs 1100) = worse","hyperparam":"batch 16k"}},{"commit":"8f3abc1","metric":2.3007,"metrics":{"artifact_mb":12.1,"best_val_bpb":2.3007,"steps":1100},"status":"discard","description":"Rope base 5000: 2.301, slightly worse than 10000","timestamp":1777250192227,"segment":0,"confidence":2.1753424657534164,"iterationTokens":null,"asi":{"arch":"rope32+ropebase5k","conclusion":"rope base 5000 slightly worse than 10000"}},{"commit":"8f3abc1","metric":2.3245,"metrics":{"artifact_mb":12.1,"best_val_bpb":2.3245,"steps":1100},"status":"discard","description":"Rope base 20000: 2.325, much worse","timestamp":1777252428975,"segment":0,"confidence":2.431852986217457,"iterationTokens":null,"asi":{"arch":"rope32+ropebase20k","conclusion":"rope base 20000 much worse"}},{"commit":"8f3abc1","metric":2.3011,"metrics":{"artifact_mb":12.1,"best_val_bpb":2.3011,"steps":1100},"status":"discard","description":"2 KV heads: 2.301, slightly worse than 4","timestamp":1777254645736,"segment":0,"confidence":3.0075757575757907,"iterationTokens":null,"asi":{"arch":"rope32 + 2KV heads","conclusion":"2 KV heads slightly worse than 4"}},{"commit":"8f3abc1","metric":2.2897,"metrics":{"artifact_mb":12.1,"best_val_bpb":2.2897,"steps":1200},"status":"keep","description":"Best config + beta095: 2.290, possible new best!","timestamp":1777256894659,"segment":0,"confidence":3.4612403100775193,"iterationTokens":null,"asi":{"arch":"rope32+ema994+clip0.3+qk4+warmdown0.80+lr0.0008+beta095","conclusion":"2.29 - could be noise or real improvement with 1200 steps","result":"possible new best - 2.2897"}},{"commit":"8f3abc1","metric":2.3051,"metrics":{"artifact_mb":12.1,"best_val_bpb":2.3051,"steps":1100},"status":"keep","description":"Confirmation run: 2.305, confirms ~2.30-2.31 range","timestamp":1777259137775,"segment":0,"confidence":3.5436507936508153,"iterationTokens":null,"asi":{"arch":"rope32+ema994+clip0.3+qk4+warmdown0.80+lr0.0008","conclusion":"confirms ~2.30-2.31 is the true range, 2.29 was lucky noise"}},{"commit":"f0a8b35","metric":1.9628,"metrics":{"artifact_mb":12.1,"best_val_bpb":1.9628,"steps":4800},"status":"keep","description":"2hr extended: 1.963 BPB! Extended training is a BIG win!","timestamp":1777266930922,"segment":0,"confidence":16.16310679611668,"iterationTokens":null,"asi":{"arch":"rope32+ema994+clip0.3+qk4+warmdown0.80+lr0.0008","conclusion":"2hr = 1.96 BPB! Extended training works massively!","extended_training":true,"gap_to_sub1":0.963,"scaling":"30min:2.30 → 2hr:1.96, still improving"}},{"commit":"f0a8b35","metric":1.8724,"metrics":{"artifact_mb":12.1,"best_val_bpb":1.8724,"steps":9000},"status":"keep","description":"4hr extended: 1.872 BPB! Still improving strongly!","timestamp":1777281829264,"segment":0,"confidence":19.262357414448672,"iterationTokens":null,"asi":{"arch":"rope32+ema994+clip0.3+qk4+warmdown0.80+lr0.0008","conclusion":"4hr = 1.87 BPB! Still improving strongly!","extended_training":true,"gap_to_sub1":0.87,"scaling":"30min:2.30 → 2hr:1.96 → 4hr:1.87"}}],"bestMetric":2.379,"bestDirection":"lower","metricName":"val_bpb","metricUnit":"bpb","secondaryMetrics":[{"name":"best_val_bpb","unit":""},{"name":"steps","unit":""},{"name":"artifact_mb","unit":"mb"}],"name":"Parameter Golf - Find Best Config for Sub-1 BPB","currentSegment":0,"maxExperiments":null,"confidence":19.262357414448672},"wallClockSeconds":null},"isError":false,"timestamp":1777281839424}}
