{"type":"message","id":"731eeda9","parentId":"ac0f5bee","timestamp":"2026-04-27T11:43:10.868Z","message":{"role":"assistant","content":[],"api":"anthropic-messages","provider":"minimax","model":"MiniMax-M2.7","usage":{"input":0,"output":0,"cacheRead":0,"cacheWrite":0,"totalTokens":0,"cost":{"input":0,"output":0,"cacheRead":0,"cacheWrite":0,"total":0}},"stopReason":"aborted","timestamp":1777290190468,"errorMessage":"Operation aborted"}}
{"type":"message","id":"c2e77ebb","parentId":"731eeda9","timestamp":"2026-04-27T11:45:05.496Z","message":{"role":"user","content":[{"type":"text","text":"you have to remove whatever cli u installed. run this to install: pip install lightning-sdk -U"}],"timestamp":1777290305491}}
{"type":"message","id":"b77a01b4","parentId":"c2e77ebb","timestamp":"2026-04-27T11:45:12.458Z","message":{"role":"assistant","content":[{"type":"thinking","thinking":"The user wants me to install lightning-sdk instead. Let me do that and then use it to control the Lightning AI studio.","thinkingSignature":"57e01e5a11d296c105b2c5fa6eead83217394b53203eed8ec53bf5179583940b"},{"type":"toolCall","id":"call_function_f07wuao5io65_1","name":"bash","arguments":{"command":"source ~/.venv/pg/bin/activate && pip install lightning-sdk -U 2>&1 | tail -5"}}],"api":"anthropic-messages","provider":"minimax","model":"MiniMax-M2.7","usage":{"input":13,"output":73,"cacheRead":9348,"cacheWrite":63690,"totalTokens":73124,"cost":{"input":0.0000039,"output":0.0000876,"cacheRead":0.0005608799999999999,"cacheWrite":0.023883750000000002,"total":0.024536130000000003}},"stopReason":"toolUse","timestamp":1777290305496,"responseId":"063e7f4404eb8a0ceaa922447684dfa9"}}
{"type":"message","id":"9fc3a954","parentId":"b77a01b4","timestamp":"2026-04-27T11:45:15.657Z","message":{"role":"toolResult","toolCallId":"call_function_f07wuao5io65_1","toolName":"bash","content":[{"type":"text","text":"\nSuccessfully installed backoff-2.2.1 docker-7.1.0 lightning-sdk-2026.4.23 simple-term-menu-1.6.6 urllib3-2.5.0\n\n[notice] A new release of pip is available: 26.0.1 -> 26.1\n[notice] To update, run: pip install --upgrade pip\n"}],"isError":false,"timestamp":1777290315657}}
{"type":"message","id":"0eac3319","parentId":"9fc3a954","timestamp":"2026-04-27T11:45:20.040Z","message":{"role":"assistant","content":[{"type":"thinking","thinking":"Now let me try to use the lightning SDK to connect to the studio.","thinkingSignature":"64a6575856a36735d00997388811553a54c2fd3d220ddf0dbdfd0a95e3c12c34"},{"type":"toolCall","id":"call_function_cru8ak93vw17_1","name":"bash","arguments":{"command":"source ~/.venv/pg/bin/activate && LIGHTNING_USER_ID=\"d52587bc-ec3c-4c9c-a2fa-71246e3d4020\" LIGHTNING_API_KEY=\"REDACTED\" python -c \"from lightning_sdk import Lightning; print('ok')\" 2>&1"}}],"api":"anthropic-messages","provider":"minimax","model":"MiniMax-M2.7","usage":{"input":63872,"output":129,"cacheRead":9348,"cacheWrite":0,"totalTokens":73349,"cost":{"input":0.0191616,"output":0.0001548,"cacheRead":0.0005608799999999999,"cacheWrite":0,"total":0.01987728}},"stopReason":"toolUse","timestamp":1777290315662,"responseId":"063e7f4c8deed07841c28e27dd0d30e9"}}
{"type":"message","id":"31ddecfa","parentId":"0eac3319","timestamp":"2026-04-27T11:45:21.491Z","message":{"role":"toolResult","toolCallId":"call_function_cru8ak93vw17_1","toolName":"bash","content":[{"type":"text","text":"Traceback (most recent call last):\n  File \"<string>\", line 1, in <module>\n    from lightning_sdk import Lightning; print('ok')\n    ^^^^^^^^^^^^^^^^^^^^^^^^^^^^^^^^^^^\nImportError: cannot import name 'Lightning' from 'lightning_sdk' (/Users/dhruv2mars/.venv/pg/lib/python3.14/site-packages/lightning_sdk/__init__.py)\n\n\nCommand exited with code 1"}],"details":{},"isError":true,"timestamp":1777290321491}}
{"type":"message","id":"49ea44dc","parentId":"31ddecfa","timestamp":"2026-04-27T11:45:26.189Z","message":{"role":"assistant","content":[{"type":"thinking","thinking":"Let me check what's available in lightning_sdk.","thinkingSignature":"591b285645edd78c9135c3ac99f20c4518b611abc6305475afd65c2c0cecf417"},{"type":"toolCall","id":"call_function_w9e7z33e5rh9_1","name":"bash","arguments":{"command":"source ~/.venv/pg/bin/activate && python -c \"import lightning_sdk; print(dir(lightning_sdk))\" 2>&1"}}],"api":"anthropic-messages","provider":"minimax","model":"MiniMax-M2.7","usage":{"input":64102,"output":63,"cacheRead":9348,"cacheWrite":0,"totalTokens":73513,"cost":{"input":0.0192306,"output":0.0000756,"cacheRead":0.0005608799999999999,"cacheWrite":0,"total":0.01986708}},"stopReason":"toolUse","timestamp":1777290321495,"responseId":"063e7f52f6bfd2d7af044aeee84c9047"}}
{"type":"message","id":"797ef301","parentId":"49ea44dc","timestamp":"2026-04-27T11:45:26.940Z","message":{"role":"toolResult","toolCallId":"call_function_w9e7z33e5rh9_1","toolName":"bash","content":[{"type":"text","text":"['AIHub', 'Agent', 'CloudProvider', 'ConnectionType', 'Deployment', 'FolderLocation', 'Job', 'JobsPlugin', 'K8sCluster', 'MMT', 'Machine', 'MultiMachineTrainingPlugin', 'Organization', 'Plugin', 'SlurmJobsPlugin', 'Status', 'Studio', 'Teamspace', 'User', 'VM', 'VersionChecker', '__GLOBAL_LIGHTNING_UNIQUE_IDS_STORE__', '__all__', '__builtins__', '__cached__', '__doc__', '__file__', '__loader__', '__name__', '__package__', '__path__', '__spec__', '__version__', '_version_checker', 'agents', 'ai_hub', 'api', 'base_studio', 'constants', 'deployment', 'exceptions', 'helpers', 'job', 'k8s_cluster', 'lightning_cloud', 'machine', 'mmt', 'models', 'organization', 'owner', 'plugin', 'services', 'set_tqdm_envvars_noninteractive', 'status', 'studio', 'teamspace', 'user', 'utils']\n"}],"isError":false,"timestamp":1777290326940}}
{"type":"message","id":"79b4c357","parentId":"797ef301","timestamp":"2026-04-27T11:45:33.091Z","message":{"role":"assistant","content":[{"type":"thinking","thinking":"There's `Studio` class. Let me use that.","thinkingSignature":"36e598b884f99bde360c2a88758e246f94635d1059e5c7b3b64682370d9a22da"},{"type":"toolCall","id":"call_function_ayz4a4jb6fee_1","name":"bash","arguments":{"command":"source ~/.venv/pg/bin/activate && LIGHTNING_USER_ID=\"d52587bc-ec3c-4c9c-a2fa-71246e3d4020\" LIGHTNING_API_KEY=\"REDACTED\" python -c \"\nfrom lightning_sdk import Studio, StudioAuth\nimport os\n\n# Set credentials\nos.environ['LIGHTNING_USER_ID'] = 'd52587bc-ec3c-4c9c-a2fa-71246e3d4020'\nos.environ['LIGHTNING_API_KEY'] = 'REDACTED'\n\n# List studios\nstudio = Studio()\nprint('Connected to Lightning!')\nprint(studio.list())\n\" 2>&1"}}],"api":"anthropic-messages","provider":"minimax","model":"MiniMax-M2.7","usage":{"input":64413,"output":222,"cacheRead":9348,"cacheWrite":0,"totalTokens":73983,"cost":{"input":0.019323899999999998,"output":0.00026639999999999997,"cacheRead":0.0005608799999999999,"cacheWrite":0,"total":0.020151179999999998}},"stopReason":"toolUse","timestamp":1777290326944,"responseId":"063e7f57547e898e8fe1b8637787c37c"}}
{"type":"message","id":"37027a5c","parentId":"79b4c357","timestamp":"2026-04-27T11:45:33.882Z","message":{"role":"toolResult","toolCallId":"call_function_ayz4a4jb6fee_1","toolName":"bash","content":[{"type":"text","text":"Traceback (most recent call last):\n  File \"<string>\", line 2, in <module>\n    from lightning_sdk import Studio, StudioAuth\nImportError: cannot import name 'StudioAuth' from 'lightning_sdk' (/Users/dhruv2mars/.venv/pg/lib/python3.14/site-packages/lightning_sdk/__init__.py)\n\n\nCommand exited with code 1"}],"details":{},"isError":true,"timestamp":1777290333882}}
{"type":"message","id":"77c8fe56","parentId":"37027a5c","timestamp":"2026-04-27T11:45:40.233Z","message":{"role":"assistant","content":[{"type":"thinking","thinking":"Let me try without StudioAuth.","thinkingSignature":"79006864ac9c1443a0da99cedfcfd6ab080429649283eeb8320a67dedd460a60"},{"type":"toolCall","id":"call_function_onk5kcruqtxm_1","name":"bash","arguments":{"command":"source ~/.venv/pg/bin/activate && LIGHTNING_USER_ID=\"d52587bc-ec3c-4c9c-a2fa-71246e3d4020\" LIGHTNING_API_KEY=\"REDACTED\" python -c \"\nfrom lightning_sdk import Studio\nimport os\n\nos.environ['LIGHTNING_USER_ID'] = 'd52587bc-ec3c-4c9c-a2fa-71246e3d4020'\nos.environ['LIGHTNING_API_KEY'] = 'REDACTED'\n\nstudio = Studio()\nprint('Connected to Lightning!')\nprint(dir(studio))\n\" 2>&1"}}],"api":"anthropic-messages","provider":"minimax","model":"MiniMax-M2.7","usage":{"input":64731,"output":207,"cacheRead":9348,"cacheWrite":0,"totalTokens":74286,"cost":{"input":0.0194193,"output":0.00024839999999999997,"cacheRead":0.0005608799999999999,"cacheWrite":0,"total":0.02022858}},"stopReason":"toolUse","timestamp":1777290333886,"responseId":"063e7f5e4f450d70f82de90b202d98b7"}}
{"type":"message","id":"aedf896e","parentId":"77c8fe56","timestamp":"2026-04-27T11:45:41.415Z","message":{"role":"toolResult","toolCallId":"call_function_onk5kcruqtxm_1","toolName":"bash","content":[{"type":"text","text":"Traceback (most recent call last):\n  File \"<string>\", line 8, in <module>\n    studio = Studio()\n  File \"/Users/dhruv2mars/.venv/pg/lib/python3.14/site-packages/lightning_sdk/utils/logging.py\", line 37, in wrapper\n    return func(*args, **kwargs)\n  File \"/Users/dhruv2mars/.venv/pg/lib/python3.14/site-packages/lightning_sdk/studio.py\", line 99, in __init__\n    raise ValueError(\"Couldn't resolve teamspace from the provided name, org, or user\")\nValueError: Couldn't resolve teamspace from the provided name, org, or user\n\n\nCommand exited with code 1"}],"details":{},"isError":true,"timestamp":1777290341415}}
{"type":"message","id":"60f3f0e9","parentId":"aedf896e","timestamp":"2026-04-27T11:45:48.044Z","message":{"role":"assistant","content":[{"type":"thinking","thinking":"I need to provide the teamspace name. Let me look at the user's URL: https://lightning.ai/dhruv2mars/default-project/studios/parameter-golf/code\n\nThe user is \"dhruv2mars\" and the project is \"default-project\". Let me try that.","thinkingSignature":"88069d6acab93c7178c50117ee3a3fd58369235cde8c141c7e2d2a13a43934d7"},{"type":"toolCall","id":"call_function_njcyxap3r7ve_1","name":"bash","arguments":{"command":"source ~/.venv/pg/bin/activate && LIGHTNING_USER_ID=\"d52587bc-ec3c-4c9c-a2fa-71246e3d4020\" LIGHTNING_API_KEY=\"REDACTED\" python -c \"\nfrom lightning_sdk import Studio\nimport os\n\nos.environ['LIGHTNING_USER_ID'] = 'd52587bc-ec3c-4c9c-a2fa-71246e3d4020'\nos.environ['LIGHTNING_API_KEY'] = 'REDACTED'\n\nstudio = Studio(user='dhruv2mars', project='default-project')\nprint('Connected!')\nprint('Methods:', [m for m in dir(studio) if not m.startswith('_')])\n\" 2>&1"}}],"api":"anthropic-messages","provider":"minimax","model":"MiniMax-M2.7","usage":{"input":65104,"output":284,"cacheRead":9348,"cacheWrite":0,"totalTokens":74736,"cost":{"input":0.0195312,"output":0.0003408,"cacheRead":0.0005608799999999999,"cacheWrite":0,"total":0.020432879999999997}},"stopReason":"toolUse","timestamp":1777290341420,"responseId":"063e7f654c334892a13916b51687a772"}}
{"type":"message","id":"736454aa","parentId":"60f3f0e9","timestamp":"2026-04-27T11:45:48.825Z","message":{"role":"toolResult","toolCallId":"call_function_njcyxap3r7ve_1","toolName":"bash","content":[{"type":"text","text":"Traceback (most recent call last):\n  File \"<string>\", line 8, in <module>\n    studio = Studio(user='dhruv2mars', project='default-project')\n  File \"/Users/dhruv2mars/.venv/pg/lib/python3.14/site-packages/lightning_sdk/utils/logging.py\", line 21, in wrapper\n    bound_args = sig.bind(*args, **kwargs)\n  File \"/opt/homebrew/Cellar/python@3.14/3.14.4/Frameworks/Python.framework/Versions/3.14/lib/python3.14/inspect.py\", line 3236, in bind\n    return self._bind(args, kwargs)\n           ~~~~~~~~~~^^^^^^^^^^^^^^\n  File \"/opt/homebrew/Cellar/python@3.14/3.14.4/Frameworks/Python.framework/Versions/3.14/lib/python3.14/inspect.py\", line 3225, in _bind\n    raise TypeError(\n        'got an unexpected keyword argument {arg!r}'.format(\n            arg=next(iter(kwargs))))\nTypeError: got an unexpected keyword argument 'project'\n\n\nCommand exited with code 1"}],"details":{},"isError":true,"timestamp":1777290348825}}
{"type":"message","id":"3c2bf5fa","parentId":"736454aa","timestamp":"2026-04-27T11:45:52.390Z","message":{"role":"assistant","content":[{"type":"thinking","thinking":"Let me check the Studio class signature.","thinkingSignature":"11448a7dc49df130d9ceb48162b351ae0856c9d555c11b1bec0d9b42e1887eef"},{"type":"toolCall","id":"call_function_93i7kf79zb33_1","name":"bash","arguments":{"command":"source ~/.venv/pg/bin/activate && python -c \"\nfrom lightning_sdk import Studio\nimport inspect\nprint(inspect.signature(Studio.__init__))\nprint('---')\nprint(inspect.getsourcefile(Studio))\n\" 2>&1"}}],"api":"anthropic-messages","provider":"minimax","model":"MiniMax-M2.7","usage":{"input":65648,"output":84,"cacheRead":9348,"cacheWrite":0,"totalTokens":75080,"cost":{"input":0.0196944,"output":0.0001008,"cacheRead":0.0005608799999999999,"cacheWrite":0,"total":0.020356080000000002}},"stopReason":"toolUse","timestamp":1777290348828,"responseId":"063e7f6d832ab1734f2df0460c797b4a"}}
{"type":"message","id":"b989168d","parentId":"3c2bf5fa","timestamp":"2026-04-27T11:45:53.160Z","message":{"role":"toolResult","toolCallId":"call_function_93i7kf79zb33_1","toolName":"bash","content":[{"type":"text","text":"(self, name: str | None = None, teamspace: str | lightning_sdk.teamspace.Teamspace | None = None, org: str | lightning_sdk.organization.Organization | None = None, user: str | lightning_sdk.user.User | None = None, cloud_account: str | None = None, cloud_provider: lightning_sdk.machine.CloudProvider | str | None = None, create_ok: bool = True, cluster: str | None = None, source: str | None = None, disable_secrets: bool = False, provider: lightning_sdk.machine.CloudProvider | str | None = None, studio_type: str | None = None) -> None\n---\n/Users/dhruv2mars/.venv/pg/lib/python3.14/site-packages/lightning_sdk/studio.py\n"}],"isError":false,"timestamp":1777290353160}}
{"type":"message","id":"9f9e9d31","parentId":"b989168d","timestamp":"2026-04-27T11:45:58.587Z","message":{"role":"assistant","content":[{"type":"thinking","thinking":"I need to use `teamspace` parameter. Let me look at the docs or try different combinations.","thinkingSignature":"933a1d8733f753cde582baad96f696372cf2e2d08604137a3379a4ae3931246c"},{"type":"toolCall","id":"call_function_wjh5ksygeh5q_1","name":"bash","arguments":{"command":"source ~/.venv/pg/bin/activate && python -c \"\nfrom lightning_sdk import Studio\nimport os\n\nos.environ['LIGHTNING_USER_ID'] = 'd52587bc-ec3c-4c9c-a2fa-71246e3d4020'\nos.environ['LIGHTNING_API_KEY'] = '25da12f4-1ad8-4e3f-8ba4-2a60fcebaabe'\n\nstudio = Studio(name='parameter-golf', user='dhruv2mars')\nprint('Connected!')\n\" 2>&1"}}],"api":"anthropic-messages","provider":"minimax","model":"MiniMax-M2.7","usage":{"input":65912,"output":165,"cacheRead":9348,"cacheWrite":0,"totalTokens":75425,"cost":{"input":0.0197736,"output":0.000198,"cacheRead":0.0005608799999999999,"cacheWrite":0,"total":0.02053248}},"stopReason":"toolUse","timestamp":1777290353164,"responseId":"063e7f71c61e5182f3cdc7396e67b78d"}}
{"type":"message","id":"6c428640","parentId":"9f9e9d31","timestamp":"2026-04-27T11:45:59.791Z","message":{"role":"toolResult","toolCallId":"call_function_wjh5ksygeh5q_1","toolName":"bash","content":[{"type":"text","text":"Traceback (most recent call last):\n  File \"<string>\", line 8, in <module>\n    studio = Studio(name='parameter-golf', user='dhruv2mars')\n  File \"/Users/dhruv2mars/.venv/pg/lib/python3.14/site-packages/lightning_sdk/utils/logging.py\", line 37, in wrapper\n    return func(*args, **kwargs)\n  File \"/Users/dhruv2mars/.venv/pg/lib/python3.14/site-packages/lightning_sdk/studio.py\", line 99, in __init__\n    raise ValueError(\"Couldn't resolve teamspace from the provided name, org, or user\")\nValueError: Couldn't resolve teamspace from the provided name, org, or user\n\n\nCommand exited with code 1"}],"details":{},"isError":true,"timestamp":1777290359791}}
{"type":"message","id":"5114ff69","parentId":"6c428640","timestamp":"2026-04-27T11:46:05.603Z","message":{"role":"assistant","content":[{"type":"thinking","thinking":"Let me check if there's a way to list studios first.","thinkingSignature":"4d2830fb830818af2ac2bf2ea2329ccb98dc2f8b2019026bdc1a6ac5be643720"},{"type":"toolCall","id":"call_function_jjbiee3ybcir_1","name":"bash","arguments":{"command":"source ~/.venv/pg/bin/activate && python -c \"\nfrom lightning_sdk import Teamspace\nimport os\n\nos.environ['LIGHTNING_USER_ID'] = 'd52587bc-ec3c-4c9c-a2fa-71246e3d4020'\nos.environ['LIGHTNING_API_KEY'] = '25da12f4-1ad8-4e3f-8ba4-2a60fcebaabe'\n\nts = Teamspace()\nprint('Teamspaces:', dir(ts))\n\" 2>&1"}}],"api":"anthropic-messages","provider":"minimax","model":"MiniMax-M2.7","usage":{"input":66255,"output":149,"cacheRead":9348,"cacheWrite":0,"totalTokens":75752,"cost":{"input":0.0198765,"output":0.00017879999999999998,"cacheRead":0.0005608799999999999,"cacheWrite":0,"total":0.020616179999999998}},"stopReason":"toolUse","timestamp":1777290359795,"responseId":"063e7f7784e73d43876cb1477e370f2f"}}
{"type":"message","id":"4bbd43c5","parentId":"5114ff69","timestamp":"2026-04-27T11:46:06.820Z","message":{"role":"toolResult","toolCallId":"call_function_jjbiee3ybcir_1","toolName":"bash","content":[{"type":"text","text":"Traceback (most recent call last):\n  File \"<string>\", line 8, in <module>\n    ts = Teamspace()\n  File \"/Users/dhruv2mars/.venv/pg/lib/python3.14/site-packages/lightning_sdk/utils/logging.py\", line 37, in wrapper\n    return func(*args, **kwargs)\n  File \"/Users/dhruv2mars/.venv/pg/lib/python3.14/site-packages/lightning_sdk/teamspace.py\", line 91, in __init__\n    raise ValueError(\"Teamspace name wasn't provided and could not be inferred from environment\")\nValueError: Teamspace name wasn't provided and could not be inferred from environment\n\n\nCommand exited with code 1"}],"details":{},"isError":true,"timestamp":1777290366820}}
{"type":"message","id":"1ac88562","parentId":"4bbd43c5","timestamp":"2026-04-27T11:46:11.491Z","message":{"role":"assistant","content":[{"type":"thinking","thinking":"Let me try with the teamspace name \"default-project\".","thinkingSignature":"33155ecee17561643e7045c3149f7d845032add19862f8b5c6a6f2424c9ea278"},{"type":"toolCall","id":"call_function_q5wzkjay8oo5_1","name":"bash","arguments":{"command":"source ~/.venv/pg/bin/activate && python -c \"\nfrom lightning_sdk import Teamspace\nimport os\n\nos.environ['LIGHTNING_USER_ID'] = 'd52587bc-ec3c-4c9c-a2fa-71246e3d4020'\nos.environ['LIGHTNING_API_KEY'] = '25da12f4-1ad8-4e3f-8ba4-2a60fcebaabe'\n\nts = Teamspace(name='default-project')\nprint('Teamspace:', ts)\nprint(dir(ts))\n\" 2>&1"}}],"api":"anthropic-messages","provider":"minimax","model":"MiniMax-M2.7","usage":{"input":66569,"output":156,"cacheRead":9348,"cacheWrite":0,"totalTokens":76073,"cost":{"input":0.019970699999999997,"output":0.0001872,"cacheRead":0.0005608799999999999,"cacheWrite":0,"total":0.020718779999999996}},"stopReason":"toolUse","timestamp":1777290366825,"responseId":"063e7f7f29fd542c97f7a238bb89d345"}}
{"type":"message","id":"83beeaea","parentId":"1ac88562","timestamp":"2026-04-27T11:46:12.646Z","message":{"role":"toolResult","toolCallId":"call_function_q5wzkjay8oo5_1","toolName":"bash","content":[{"type":"text","text":"Traceback (most recent call last):\n  File \"<string>\", line 8, in <module>\n    ts = Teamspace(name='default-project')\n  File \"/Users/dhruv2mars/.venv/pg/lib/python3.14/site-packages/lightning_sdk/utils/logging.py\", line 37, in wrapper\n    return func(*args, **kwargs)\n  File \"/Users/dhruv2mars/.venv/pg/lib/python3.14/site-packages/lightning_sdk/teamspace.py\", line 120, in __init__\n    raise RuntimeError(\n        \"Neither user or org are specified, but one of them has to be the owner of the Teamspace\"\n    )\nRuntimeError: Neither user or org are specified, but one of them has to be the owner of the Teamspace\n\n\nCommand exited with code 1"}],"details":{},"isError":true,"timestamp":1777290372646}}
{"type":"message","id":"9018056c","parentId":"83beeaea","timestamp":"2026-04-27T11:46:16.403Z","message":{"role":"assistant","content":[{"type":"thinking","thinking":"Let me add user parameter.","thinkingSignature":"fcd5ca5dd99b0f4a9b5a28d6e5afa746313a3c3094dd68a2341cc2b3e4999e83"},{"type":"toolCall","id":"call_function_977nm9bllguc_1","name":"bash","arguments":{"command":"source ~/.venv/pg/bin/activate && python -c \"\nfrom lightning_sdk import Teamspace\nimport os\n\nos.environ['LIGHTNING_USER_ID'] = 'd52587bc-ec3c-4c9c-a2fa-71246e3d4020'\nos.environ['LIGHTNING_API_KEY'] = '25da12f4-1ad8-4e3f-8ba4-2a60fcebaabe'\n\nts = Teamspace(name='default-project', user='dhruv2mars')\nprint('Connected!')\nprint('Methods:', [m for m in dir(ts) if not m.startswith('_')])\n\" 2>&1"}}],"api":"anthropic-messages","provider":"minimax","model":"MiniMax-M2.7","usage":{"input":66914,"output":170,"cacheRead":9348,"cacheWrite":0,"totalTokens":76432,"cost":{"input":0.0200742,"output":0.000204,"cacheRead":0.0005608799999999999,"cacheWrite":0,"total":0.02083908}},"stopReason":"toolUse","timestamp":1777290372650,"responseId":"063e7f847c24b690ff1d9969e7bb1037"}}
{"type":"message","id":"f7b89056","parentId":"9018056c","timestamp":"2026-04-27T11:46:18.381Z","message":{"role":"toolResult","toolCallId":"call_function_977nm9bllguc_1","toolName":"bash","content":[{"type":"text","text":"Connected!\nMethods: ['cloud_account_objs', 'cloud_accounts', 'clusters', 'create_agent', 'default_cloud_account', 'delete_model', 'download_file', 'download_folder', 'download_model', 'id', 'jobs', 'list_machines', 'list_model_versions', 'list_models', 'multi_machine_jobs', 'name', 'new_connection', 'new_folder', 'owner', 'secrets', 'set_secret', 'start_studios_on_interruptible', 'studios', 'upload_file', 'upload_folder', 'upload_model', 'vms']\n"}],"isError":false,"timestamp":1777290378381}}
