{"type":"message","id":"13274ffd","parentId":"cb37bd49","timestamp":"2026-04-27T13:27:03.285Z","message":{"role":"toolResult","toolCallId":"call_function_x1n2tpmetvff_1","toolName":"edit","content":[{"type":"text","text":"Successfully replaced 1 block(s) in /Users/dhruv2mars/dev/github/parameter-golf/train_kaggle.py."}],"details":{"diff":"      ...\n  387         return self.proj(F.leaky_relu(self.fc(x), negative_slope=0.5).square())\n  388 \n  389 \n  390 class Block(nn.Module):\n- 391     \"\"\"Transformer block with pre-norm and learned residuals.\"\"\"\n+ 391     \"\"\"\n+ 392     Transformer block with:\n+ 393     1. Parallel Residuals - attention and MLP computed in parallel\n+ 394     2. SmearGate - cross-layer gating for information flow\n+ 395     3. Pre-norm with learned residuals\n+ 396     \"\"\"\n  392     def __init__(self, dim, num_heads, num_kv_heads, mlp_mult, rope_base, \n- 393                  qk_gain_init, layer_idx, rope_dims=0):\n+ 398                  qk_gain_init, layer_idx, rope_dims=0,\n+ 399                  use_parallel_residuals=True, use_smear_gate=True,\n+ 400                  smear_decay=0.9):\n  394         super().__init__()\n  395         self.layer_idx = layer_idx\n+ 403         self.use_parallel_residuals = use_parallel_residuals\n+ 404         self.use_smear_gate = use_smear_gate\n  396         \n  397         self.attn_norm = RMSNorm(dim)\n  398         self.mlp_norm = RMSNorm(dim)\n  399         \n      ...\n  406         self.resid_mix = nn.Parameter(torch.stack((\n  407             torch.ones(dim), torch.zeros(dim)\n  408         )).float())\n  409         \n+ 419         # ============================================================\n+ 420         # SmearGate - cross-layer information gating\n+ 421         # ============================================================\n+ 422         if use_smear_gate:\n+ 423             # Gate that smears information from previous layers\n+ 424             self.smear_gate = nn.Parameter(torch.ones(dim) * smear_decay)\n+ 425             self.smear_proj = CastedLinear(dim, dim)  # Project smear info\n+ 426         else:\n+ 427             self.smear_gate = None\n+ 428             self.smear_proj = None\n+ 429         \n  410         # Layer scaling (deeper layers slightly smaller)\n  411         self.ln_scale = 1.0 / math.sqrt(layer_idx + 1)\n  412     \n- 413     def forward(self, x, x0):\n+ 433     def forward(self, x, x0, smear_state=None):\n  414         dtype = x.dtype\n  415         mix = self.resid_mix.to(dtype=dtype)\n  416         \n  417         # Residual mix: combine current and original residual\n  418         x_in = mix[0][None, None, :] * x + mix[1][None, None, :] * x0\n  419         \n- 420         # Attention block\n- 421         x = x_in + self.attn_scale.to(dtype=dtype)[None, None, :] * \\\n- 422             self.attn(self.attn_norm(x_in) * self.ln_scale)\n+ 440         # ============================================================\n+ 441         # Apply SmearGate from previous layer's output\n+ 442         # ============================================================\n+ 443         if self.use_smear_gate and smear_state is not None:\n+ 444             gate = torch.sigmoid(self.smear_gate.to(dtype=dtype))\n+ 445             smear = self.smear_proj(smear_state)\n+ 446             x_in = x_in + gate[None, None, :] * smear\n  423         \n- 424         # MLP block\n- 425         x = x + self.mlp_scale.to(dtype=dtype)[None, None, :] * \\\n- 426             self.mlp(self.mlp_norm(x) * self.ln_scale)\n+ 448         # ============================================================\n+ 449         # Parallel Residuals: compute attn and MLP in parallel\n+ 450         # ============================================================\n+ 451         if self.use_parallel_residuals:\n+ 452             # Pre-norm both branches\n+ 453             attn_in = self.attn_norm(x_in) * self.ln_scale\n+ 454             mlp_in = self.mlp_norm(x_in) * self.ln_scale\n+ 455             \n+ 456             # Compute in parallel (manual implementation to ensure execution)\n+ 457             attn_out = self.attn(attn_in)\n+ 458             mlp_out = self.mlp(mlp_in)\n+ 459             \n+ 460             # Apply residual connections\n+ 461             x = x_in\n+ 462             x = x + self.attn_scale.to(dtype=dtype)[None, None, :] * attn_out\n+ 463             x = x + self.mlp_scale.to(dtype=dtype)[None, None, :] * mlp_out\n+ 464         else:\n+ 465             # Sequential (original)\n+ 466             x = x_in + self.attn_scale.to(dtype=dtype)[None, None, :] * \\\n+ 467                 self.attn(self.attn_norm(x_in) * self.ln_scale)\n+ 468             x = x + self.mlp_scale.to(dtype=dtype)[None, None, :] * \\\n+ 469                 self.mlp(self.mlp_norm(x) * self.ln_scale)\n  427         \n  428         return x\n  429 \n  430 \n      ...","firstChangedLine":391},"isError":false,"timestamp":1777296423285}}
{"type":"message","id":"3a2fac86","parentId":"13274ffd","timestamp":"2026-04-27T13:27:06.754Z","message":{"role":"assistant","content":[{"type":"thinking","thinking":"Now I need to update the GPT class to:\n1. Pass the new parameters to Block\n2. Handle SmearGate state across layers\n3. Support gradient checkpointing for SP8192","thinkingSignature":"becfb74667d29d085a4993bed3bdba28e3a81c16e2752b6028b8208c345f85af"},{"type":"toolCall","id":"call_function_zuta3zc36ldn_1","name":"read","arguments":{"path":"/Users/dhruv2mars/dev/github/parameter-golf/train_kaggle.py","offset":380,"limit":100}}],"api":"anthropic-messages","provider":"minimax","model":"MiniMax-M2.7","usage":{"input":44586,"output":102,"cacheRead":9199,"cacheWrite":0,"totalTokens":53887,"cost":{"input":0.0133758,"output":0.0001224,"cacheRead":0.00055194,"cacheWrite":0,"total":0.014050140000000001}},"stopReason":"toolUse","timestamp":1777296423287,"responseId":"063e97274534dcfd5e6da2a66053cf12"}}
{"type":"message","id":"be6150e5","parentId":"3a2fac86","timestamp":"2026-04-27T13:27:06.765Z","message":{"role":"toolResult","toolCallId":"call_function_zuta3zc36ldn_1","toolName":"read","content":[{"type":"text","text":"    \"\"\"MLP with squared LeakyReLU activation.\"\"\"\n    def __init__(self, dim, mult=4):\n        super().__init__()\n        self.fc = CastedLinear(dim, mult * dim)\n        self.proj = CastedLinear(mult * dim, dim)\n    \n    def forward(self, x):\n        return self.proj(F.leaky_relu(self.fc(x), negative_slope=0.5).square())\n\n\nclass Block(nn.Module):\n    \"\"\"\n    Transformer block with:\n    1. Parallel Residuals - attention and MLP computed in parallel\n    2. SmearGate - cross-layer gating for information flow\n    3. Pre-norm with learned residuals\n    \"\"\"\n    def __init__(self, dim, num_heads, num_kv_heads, mlp_mult, rope_base, \n                 qk_gain_init, layer_idx, rope_dims=0,\n                 use_parallel_residuals=True, use_smear_gate=True,\n                 smear_decay=0.9):\n        super().__init__()\n        self.layer_idx = layer_idx\n        self.use_parallel_residuals = use_parallel_residuals\n        self.use_smear_gate = use_smear_gate\n        \n        self.attn_norm = RMSNorm(dim)\n        self.mlp_norm = RMSNorm(dim)\n        \n        self.attn = Attention(dim, num_heads, num_kv_heads, rope_base, qk_gain_init, rope_dims)\n        self.mlp = MLP(dim, mlp_mult)\n        \n        # Learned residual scaling (proven improvement)\n        self.attn_scale = nn.Parameter(torch.ones(dim))\n        self.mlp_scale = nn.Parameter(torch.ones(dim))\n        self.resid_mix = nn.Parameter(torch.stack((\n            torch.ones(dim), torch.zeros(dim)\n        )).float())\n        \n        # ============================================================\n        # SmearGate - cross-layer information gating\n        # ============================================================\n        if use_smear_gate:\n            # Gate that smears information from previous layers\n            self.smear_gate = nn.Parameter(torch.ones(dim) * smear_decay)\n            self.smear_proj = CastedLinear(dim, dim)  # Project smear info\n        else:\n            self.smear_gate = None\n            self.smear_proj = None\n        \n        # Layer scaling (deeper layers slightly smaller)\n        self.ln_scale = 1.0 / math.sqrt(layer_idx + 1)\n    \n    def forward(self, x, x0, smear_state=None):\n        dtype = x.dtype\n        mix = self.resid_mix.to(dtype=dtype)\n        \n        # Residual mix: combine current and original residual\n        x_in = mix[0][None, None, :] * x + mix[1][None, None, :] * x0\n        \n        # ============================================================\n        # Apply SmearGate from previous layer's output\n        # ============================================================\n        if self.use_smear_gate and smear_state is not None:\n            gate = torch.sigmoid(self.smear_gate.to(dtype=dtype))\n            smear = self.smear_proj(smear_state)\n            x_in = x_in + gate[None, None, :] * smear\n        \n        # ============================================================\n        # Parallel Residuals: compute attn and MLP in parallel\n        # ============================================================\n        if self.use_parallel_residuals:\n            # Pre-norm both branches\n            attn_in = self.attn_norm(x_in) * self.ln_scale\n            mlp_in = self.mlp_norm(x_in) * self.ln_scale\n            \n            # Compute in parallel (manual implementation to ensure execution)\n            attn_out = self.attn(attn_in)\n            mlp_out = self.mlp(mlp_in)\n            \n            # Apply residual connections\n            x = x_in\n            x = x + self.attn_scale.to(dtype=dtype)[None, None, :] * attn_out\n            x = x + self.mlp_scale.to(dtype=dtype)[None, None, :] * mlp_out\n        else:\n            # Sequential (original)\n            x = x_in + self.attn_scale.to(dtype=dtype)[None, None, :] * \\\n                self.attn(self.attn_norm(x_in) * self.ln_scale)\n            x = x + self.mlp_scale.to(dtype=dtype)[None, None, :] * \\\n                self.mlp(self.mlp_norm(x) * self.ln_scale)\n        \n        return x\n\n\nclass GPT(nn.Module):\n    \"\"\"Standard transformer language model.\"\"\"\n    def __init__(self):\n        super().__init__()\n        \n        self.tok_emb = nn.Embedding(H.vocab_size, H.model_dim)\n\n[630 more lines in file. Use offset=480 to continue.]"}],"isError":false,"timestamp":1777296426765}}
{"type":"message","id":"2a279d98","parentId":"be6150e5","timestamp":"2026-04-27T13:27:11.056Z","message":{"role":"assistant","content":[{"type":"thinking","thinking":"Let me read the full GPT class and update it.","thinkingSignature":"ff81976ce114bf0a955bc7d7001152388882a41e74b9236d9a26d21eec07bb51"},{"type":"toolCall","id":"call_function_xsmm0az9n7o6_1","name":"read","arguments":{"path":"/Users/dhruv2mars/dev/github/parameter-golf/train_kaggle.py","offset":480,"limit":100}}],"api":"anthropic-messages","provider":"minimax","model":"MiniMax-M2.7","usage":{"input":45677,"output":73,"cacheRead":9199,"cacheWrite":0,"totalTokens":54949,"cost":{"input":0.0137031,"output":0.0000876,"cacheRead":0.00055194,"cacheWrite":0,"total":0.01434264}},"stopReason":"toolUse","timestamp":1777296426766,"responseId":"063e972bf55a130ceaba8c91804f3e86"}}
{"type":"message","id":"8a86bd12","parentId":"2a279d98","timestamp":"2026-04-27T13:27:11.067Z","message":{"role":"toolResult","toolCallId":"call_function_xsmm0az9n7o6_1","toolName":"read","content":[{"type":"text","text":"        self.blocks = nn.ModuleList([\n            Block(\n                H.model_dim, H.num_heads, H.num_kv_heads, H.mlp_mult,\n                H.rope_base, H.qk_gain_init, i, H.rope_dims\n            )\n            for i in range(H.num_layers)\n        ])\n        self.final_norm = RMSNorm(H.model_dim)\n        \n        # Tied embeddings save parameters\n        self.lm_head = None if H.tie_embeddings else \\\n            CastedLinear(H.model_dim, H.vocab_size, bias=False)\n        \n        self._init_weights()\n    \n    def _init_weights(self):\n        if H.tie_embeddings:\n            nn.init.normal_(self.tok_emb.weight, std=0.005)\n        for m in self.modules():\n            if isinstance(m, CastedLinear) and m.bias is not None:\n                if (m.bias.data == 0).all() or m.bias.data.abs().sum() == 0:\n                    nn.init.zeros_(m.bias)\n    \n    def forward(self, x, target=None):\n        x = self.tok_emb(x)\n        x = F.rms_norm(x, (x.size(-1),))\n        x0 = x\n        \n        # Compute depth loop activation step\n        warmup_steps = int(H.iterations * H.enable_looping_at)\n        loop_active = False\n        \n        for i, block in enumerate(self.blocks):\n            x = block(x, x0)\n            \n            # Depth recurrence: loop layers 3-5 after warmup\n            if (i >= H.loop_start and i <= H.loop_end and \n                H.num_loops > 1 and loop_active):\n                for _ in range(H.num_loops - 1):\n                    x = block(x, x0)\n            \n            # Activate recurrence after warmup\n            if i == H.loop_start:\n                loop_active = True\n        \n        x = self.final_norm(x)\n        \n        # Output projection\n        if self.lm_head is not None:\n            logits = self.lm_head(x)\n        else:\n            logits = F.linear(x, self.tok_emb.weight)\n        \n        # Logit softcap (improves calibration)\n        logits = H.logit_softcap * torch.tanh(logits / H.logit_softcap)\n        \n        if target is not None:\n            return F.cross_entropy(logits.view(-1, H.vocab_size), target.view(-1), \n                                   reduction='mean')\n        return logits\n\n\n# ============================================================================\n# QUANTIZATION\n# ============================================================================\n\ndef quantize_row(t, clip_std_mult=12.85, bits=8):\n    \"\"\"Per-row quantization for GPTQ.\"\"\"\n    t = t.float()\n    qmax = (1 << (bits - 1)) - 1\n    \n    if t.ndim < 2:\n        scale = (t.abs().max() / qmax).clamp_min(1/qmax)\n        q = torch.round(torch.clamp(t, -qmax * scale, qmax * scale) / scale).to(torch.int8)\n        return q, scale\n    \n    std = t.std(dim=1, keepdim=True)\n    clip = std * clip_std_mult\n    scale = (clip / qmax).clamp_min(1/qmax)\n    q = torch.round(torch.clamp(t, -clip, clip) / scale).to(torch.int8)\n    return q, scale.squeeze(-1)\n\n\ndef pack_int6(q):\n    \"\"\"Pack int6 values into bytes (4 values per 3 bytes).\"\"\"\n    flat = (q.to(torch.int16).flatten() + 32).clamp_(0, 63).to(torch.int32)\n    pad = (-flat.numel()) % 4\n    if pad:\n        flat = torch.cat([flat, torch.zeros(pad, dtype=torch.int32)])\n    \n    vals = flat.view(-1, 4)\n    word = vals[:, 0] | (vals[:, 1] << 6) | (vals[:, 2] << 12) | (vals[:, 3] << 18)\n    \n    packed = torch.empty((word.numel(), 3), dtype=torch.uint8)\n    packed[:, 0] = (word & 255).to(torch.uint8)\n    packed[:, 1] = ((word >> 8) & 255).to(torch.uint8)\n    packed[:, 2] = ((word >> 16) & 255).to(torch.uint8)\n    \n    return packed.flatten(), pad\n\n\n[530 more lines in file. Use offset=580 to continue.]"}],"isError":false,"timestamp":1777296431066}}
